id,created,updated,locale,product,title,is_solved,solution,solved_by,is_spam,last_answer,answers,topic,tags,creator,content,involved,is_archived,is_locked,is_taken,metadata,num_answers,num_votes_past_week,num_votes,taken_until,taken_by,updated_by
1492321,2025-02-10 11:29:45 -0800,2025-02-10 11:29:45 -0800,es,thunderbird,"thunderbird carpeta spam ""desaparecida"" en una cuenta de la aplicacion de escritorio para windows",false,,,false,,"",junk-mail-and-spam,thunderbird;junk-mail-and-spam;,rforcadell,"<p>Buenas no entiendo muy bien por que o desde cuando, pero en la aplicacion de escritorio me ha desaparecido la carpeta de ""spam"", no soy consciente de haberla borrado y en principio la configuracion para esa cuenta en general es la misma que para otras cuentas que tengo en la misma aplicacion y visualizo igual. no se si la puedo regenerar de alguna manera o debo borrar la cuenta y volverla a crear. gracias </p>",rforcadell;,true,false,false,";useragent:Mozilla/5.0 (Windows NT 10.0; Win64; x64) AppleWebKit/537.36 (KHTML, like Gecko) Chrome/133.0.0.0 Safari/537.36",0,0,0,,,
1492325,2025-02-10 11:50:56 -0800,2025-02-10 17:11:04 -0800,en-US,thunderbird,Unthreading messages hides them,false,,,false,1711222,1711222;,customization,thunderbird;customization;,darwyn.sumner,"<p>After unthreading messages following the instructions (in the Sort by menu), several incoming messages are now invisible in their folder. Only revealed now via an inbox search. how can I get them to come out of hiding? </p>",darwyn.sumner;DavidGG;,true,false,false,;useragent:Mozilla/5.0 (Windows NT 10.0; Win64; x64; rv:135.0) Gecko/20100101 Firefox/135.0,1,0,0,,,
1492328,2025-02-10 12:02:27 -0800,2025-02-11 13:26:50 -0800,en-US,thunderbird,Message sync on office PC and Notebook,false,,,false,1711392,1711392;,customization,thunderbird;customization;,michaelknoerzer,"<p>I keep copies of all messages on my imap server and office PC. I also have a notebook PC and installed Thunderbird to keep copies all messages. I need to free space on the notebook. Can I change the ""Synchronize all messages locally regardless of age"" setting to ""Synchronize the most recent"" on the notebook without causing the imap server to delete my older messages? </p>",michaelknoerzer;davidsk;,true,false,false,;useragent:Mozilla/5.0 (Windows NT 10.0; Win64; x64; rv:135.0) Gecko/20100101 Firefox/135.0,1,0,0,,,
1492333,2025-02-10 12:11:43 -0800,2025-02-10 17:04:33 -0800,en-US,thunderbird,Thunderbird,false,,,false,1711220,1711198;1711220;,profiles,app-crash;thunderbird;profiles;,DonCaldwell,<p>I am trying to move my profiles to another drive since I am out of room on my C: drive.  I followed directions in a reply to a similar question and when I create the new profile using the thunderbird.exe -p command I get a totally blank window for thunderbird.  There are not even menus displayed.  If I click in the window it says thunderbird not responding.  I tried the process several times and get the same results every time.  Any ideas? </p>,DonCaldwell;davidsk;DavidGG;,true,false,false,";useragent:Mozilla/5.0 (Windows NT 10.0; Win64; x64) AppleWebKit/537.36 (KHTML, like Gecko) Chrome/131.0.0.0 Safari/537.36 AVG/131.0.0.0",2,0,1,,,
1492337,2025-02-10 12:34:41 -0800,2025-02-10 13:17:04 -0800,en-US,thunderbird,new Thunderbird user question,false,,,false,1711193,1711193;,tags,customization;send-and-receive-email;thunderbird;tags;,robertconley,"<p>I am a very long time user of Outlook Client (Classic) mail app from MSFT. </p><p>It has been my practice to annotate incoming mail by editing the subject.  For example when I receive an email about a financial transaction such as a online payment or a charge, I edit the subject adding the amout, what was the charge/purchase for and sanitized last four of account number plus any other useful info.  I move these emails to a separate folder, either ""eBills"" or ""Receipts"".  That way I can quickly find receipts, bills, and other transactions without having to open each individual mail message. </p><p>Apparently Thunderbird does not support this functionality.  Is that correct? </p><p>Thanks, </p><p>Robert </p>",robertconley;davidsk;,true,false,false,";useragent:Mozilla/5.0 (Windows NT 10.0; Win64; x64) AppleWebKit/537.36 (KHTML, like Gecko) Chrome/132.0.0.0 Safari/537.36 Edg/132.0.0.0",1,0,0,,,
1492345,2025-02-10 13:14:02 -0800,2025-02-12 11:09:38 -0800,en-US,thunderbird,Can't delete or move Thunderbird inbox messages,true,1711619,wernerkro,false,1711619,1711285;1711619;,email-and-messaging,email-and-messaging;thunderbird;,wernerkro,"<p>Zack Harkness ITS Service Desk Hi Zack, Recently, I have a few mails in my Thunderbird Inbox that I can neither move nor delete. Do you have a solution for this problem? Regards, Werner --  Werner J. Kronenberg </p><p>[edited po box and phone# from public support forum] South Africa </p><p>mailto: [edited] @mwebbiz.co.za </p>",wernerkro;DavidGG;,true,false,false,";useragent:Mozilla/5.0 (Windows NT 10.0; Win64; x64) AppleWebKit/537.36 (KHTML, like Gecko) Chrome/131.0.0.0 Safari/537.36 CCleaner/131.0.0.0;solver_id:6480914",2,0,1,,,James
1492347,2025-02-10 13:23:58 -0800,2025-02-11 05:01:36 -0800,en-US,thunderbird,Thunderbird limits on addresses in To: line for Google Workspace accounts,false,,,false,1711291,1711195;1711291;,send-and-receive-email,thunderbird;send-and-receive-email;,doctorjah,"<p>I can send a single email to the several hundred email addresses in one of my Google Workspace labels with no problem using the online Gmail web interface.  But when I try to send an identical email to the identical label members through the Google Workspace account in Thunderbird 128, it says there are too many recipients in the To: line.  Is this limitation being imposed by Thunderbird itself or is it imposed by Google on messages sent from Thunderbird?  Google Workspace chat AI bot says it's likely Thunderbird, but is it? </p>",doctorjah;davidsk;,true,false,false,;useragent:Mozilla/5.0 (Macintosh; Intel Mac OS X 10.15; rv:135.0) Gecko/20100101 Firefox/135.0,2,0,1,,,
1492350,2025-02-10 13:34:32 -0800,2025-02-11 02:11:57 -0800,en-US,thunderbird,Gmail disconnecting from Thunderbird,false,,,false,1711263,1711263;,connectivity,thunderbird;connectivity;,sqrat,"<p>I don't know if this has been asked before but here goes All of a sudden my Thunderbird seems to lose sync with my gmail It stops sending sent emails to the sent file and when I delete messages they do not show in the trash folder. If I delete the account and re-add it the problem goes away for a bit. Sometimes it works for a few days and other times, more than not, like today, only a few hours. It is set to use  OAuth2 and I also get a certificate warning in regards to gmail which I have to accept every time I re-install. Anyone else have this issue??? </p>",sqrat;DavidGG;,true,false,false,";useragent:Mozilla/5.0 (Windows NT 10.0; Win64; x64) AppleWebKit/537.36 (KHTML, like Gecko) Chrome/109.0.0.0 Safari/537.36",1,0,0,,,
1492352,2025-02-10 13:52:47 -0800,2025-02-11 04:32:55 -0800,en-US,thunderbird,Emails disappeared,false,,,false,1711287,1711287;,junk-mail-and-spam,send-and-receive-email;thunderbird;junk-mail-and-spam;,jamesmcguire623,<p>I had some TB emails in my inbox that I wanted to keep. After about 2-3 weeks they all disappeared. Where did they go? </p>,jamesmcguire623;DavidGG;,true,false,false,";useragent:Mozilla/5.0 (Windows NT 10.0; Win64; x64) AppleWebKit/537.36 (KHTML, like Gecko) Chrome/132.0.0.0 Safari/537.36 Edg/132.0.0.0",1,0,0,,,
1492353,2025-02-10 13:54:55 -0800,2025-04-03 21:10:43 -0700,en-US,thunderbird,Thunderbird email account Login to account failed,false,,,false,1723190,1711202;1723190;,send-and-receive-email,connectivity;thunderbird;send-and-receive-email;,seemommyrun,"<p>I suddenly cannot receive new messages, for the last 5 days  I didn't change anything (in fact was out of town) but now I get an Error that says ""Login to account ________ failed.  Login to server mail.nctvocom with username ________ failed."" </p>",seemommyrun;markwarner22;wsmwk;,true,false,false,";useragent:Mozilla/5.0 (Windows NT 10.0; Win64; x64) AppleWebKit/537.36 (KHTML, like Gecko) Chrome/131.0.0.0 Safari/537.36",2,0,9,,,
1492354,2025-02-10 13:56:47 -0800,2025-02-10 13:56:47 -0800,es,thunderbird,"Estoy tratando de instalar un nuevo correo personal mucho mejor en Thunderbird, pero me resulta casi imposible o es que primero se debe Donar dinero?",false,,,false,,"",email-and-messaging,thunderbird;email-and-messaging;,luissolerespino,"<p>¿Existe algún modo en particular, algunos pasos que seguir, para instalar y registrar un correo en Thunderbird? </p>",luissolerespino;,true,false,false,;useragent:Mozilla/5.0 (Windows NT 10.0; Win64; x64; rv:135.0) Gecko/20100101 Firefox/135.0,0,0,0,,,
1492356,2025-02-10 13:59:30 -0800,2025-02-10 13:59:30 -0800,es,thunderbird,Exportación de Plantillas,false,,,false,,"",import-and-export-settings,thunderbird;import-and-export-settings;,alexvp.7343,"<p>Es posible exportar las plantillas de Thunderbird para ""descargar"" en otras máquinas? </p>",alexvp.7343;,true,false,false,;useragent:Mozilla/5.0 (X11; Ubuntu; Linux x86_64; rv:134.0) Gecko/20100101 Firefox/134.0,0,0,0,,,
1492357,2025-02-10 14:05:02 -0800,2025-02-10 14:05:02 -0800,en-US,thunderbird,Search,false,,,false,,"",search,thunderbird;search;,cheyenne6304,"<p>For several weeks I have been unable to search within certain emails i.e. Amazon, Jacque Lawson cards, Woot, etc. When I click within these emails to search for a specific item all I get is an""e"" or an ""i"".  I need (for example) to buy a specific item in Amazon but the email won't let me search for it.  Extremely frustrating!!! I need to get this solved ASAP.  Thank you. Linda Sullivan </p>",cheyenne6304;,true,false,false,";useragent:Mozilla/5.0 (Windows NT 10.0; Win64; x64) AppleWebKit/537.36 (KHTML, like Gecko) Chrome/132.0.0.0 Safari/537.36",0,0,0,,,
1492358,2025-02-10 14:07:29 -0800,2025-02-10 14:07:29 -0800,en-US,thunderbird,Unable to Select All the addressee in a new email window,false,,,false,,"",contacts,thunderbird;contacts;,gwcardona68,"<p>I'm using the latest version of Thunderbird on my MacBook Pro laptop computer.  When I compose a new email, I can no longer Select All the email addresses from Contacts.   </p><p>I was able to Select all the email addresses from the selected address book and then either click To or Bcc.  The selected addresses would then go in the To or Bcc fields.  It does not do this. </p><p>Any suggestions?  Thank you.   </p><p>Gordon </p>",gwcardona68;,true,false,false,;useragent:Mozilla/5.0 (Macintosh; Intel Mac OS X 10.15; rv:128.0) Gecko/20100101 Firefox/128.0,0,0,0,,,
1492363,2025-02-10 14:57:13 -0800,2025-02-10 17:55:11 -0800,en-US,thunderbird,Thunderbird Profile Missing Error,false,,,false,1711226,1711215;1711226;,profiles,thunderbird;profiles;,blake20,<p>I'm trying to start Thunderbird and get the missing profiles error message. I'm unable to open profile manager using terminal. It says that location does not exist and there is no other way I can find to open the profile manager. I'm on Mac OS 15.3 </p>,blake20;Mapenzi;DavidGG;,true,false,false,";useragent:Mozilla/5.0 (Macintosh; Intel Mac OS X 10_15_7) AppleWebKit/537.36 (KHTML, like Gecko) Chrome/132.0.0.0 Safari/537.36",2,0,1,,,
1492364,2025-02-10 14:58:22 -0800,2025-02-10 18:27:39 -0800,en-US,thunderbird,images with links not working,false,,,false,1711234,1711234;,send-and-receive-email,email-and-messaging;thunderbird;send-and-receive-email;,rjhodge1,"<p>About 2 weeks ago, all links attached to images in my emails stopped working. Clicking the images only opens the images in my photo app. If I use a different email client, they work correctly. Quite a few of the 3D content sites I get emails from only have images. You click the image and go to the product page. This is no longer working in your program. What has happened to my links and what can be done to fix this? </p>",rjhodge1;sfhowes;,true,false,false,";useragent:Mozilla/5.0 (Windows NT 10.0; Win64; x64) AppleWebKit/537.36 (KHTML, like Gecko) Chrome/132.0.0.0 Safari/537.36",1,0,0,,,
1492366,2025-02-10 15:06:00 -0800,2025-02-10 18:24:28 -0800,en-US,thunderbird,Existing email account set up,false,,,false,1711233,1711233;,send-and-receive-email,thunderbird;send-and-receive-email;,SueVZ,"<p>I have Xfinity as email provider. After a factory restore, I reinstalled Thunderbird without email address. Used your installation instructions for automatic set-up but process is stalled on checking password.  Screen from Xfinity came up for user account and password, then goes to screen saying access denied. There is no error .in my entries. I can go to Xfinity and log into my email. The box it checked for allowing third party access. </p>",SueVZ;DavidGG;,true,false,false,";useragent:Mozilla/5.0 (Windows NT 10.0; Win64; x64) AppleWebKit/537.36 (KHTML, like Gecko) Chrome/133.0.0.0 Safari/537.36 Edg/133.0.0.0",1,0,0,,,
