id,created,updated,locale,product,title,is_solved,solution,solved_by,is_spam,last_answer,answers,topic,tags,creator,content,involved,is_archived,is_locked,is_taken,metadata,num_answers,num_votes_past_week,num_votes,taken_until,taken_by,updated_by
1530693,2025-08-21 07:45:18 -0700,2025-08-21 07:45:18 -0700,en-US,thunderbird,Digitally signing  Issue,false,,,false,,"",security,thunderbird;security;,apereira1970,"<p>Been using thunderbird for at least 20 years, and learn to live with the bugs and wait for the next release waiting and expecting the issues of the previous release were solved in the next one. </p><p>I've been using S/MIME certificates for many years without problem. I've recently installed a new certificate wich is correctly installed in my personal repository expiring in 2027. Since version 141 this certificates shows as selected, but is not used.  Updated to release 142 ... but the problem persists.  </p><p>I'm attaching a screen capture were shows the error message and the Developers Console showing the exitcode when trying to send a mail with digitally signed. </p><p>Please also note (i don´t know if this is related or not) that when y check the certificate in the account the hexadecimal ID of the certificate is not shown.  If I clear the certificate and select it again it is shown in this screen.    Attached to this you can find a capture of what mentioned before. </p><p>Please let me know if more information is needed. </p><p>Thanks / Regards  </p><p><br> Ariel Pereira </p>",apereira1970;,false,false,false,";useragent:Mozilla/5.0 (X11; Linux x86_64; rv:142.0) Gecko/20100101 Firefox/142.0;kb_visits_prior:[""/es/kb/firma-digital-y-cifrado-de-mensajes""]",0,0,0,,,
1530698,2025-08-21 08:06:26 -0700,2025-08-21 08:06:26 -0700,pt-BR,thunderbird,criar uma nova conta de email,false,,,false,,"",account-management,thunderbird;account-management;,lasp1,<p>Ao digitar dados da nova conta de e-mail o sistema fica rodando automaticamente mas nao instala a conta </p>,lasp1;,false,false,false,";useragent:Mozilla/5.0 (Windows NT 10.0; Win64; x64) AppleWebKit/537.36 (KHTML, like Gecko) Chrome/139.0.0.0 Safari/537.36 Edg/139.0.0.0",0,0,0,,,
1530701,2025-08-21 08:24:36 -0700,2025-09-05 05:18:21 -0700,en-US,thunderbird,What happened to Thunderbird error log? (linux),false,,,false,1762115,1758490;1759373;1759383;1759523;1759529;1759633;1759635;1759646;1759978;1759994;1759997;1760444;1760453;1760644;1760762;1760776;1760778;1760802;1760803;1760809;1760878;1760879;1760962;1761044;1761070;1761089;1761169;1761199;1761288;1761913;1762093;1762115;,send-and-receive-email,thunderbird;send-and-receive-email;,arf668,"<p>I used to troubleshoot when Thunderbird would fail to download new messages by looking at the last successfully downloaded email.  But I can't find the error log.   I'm pretty sure older versions allowed you to see the error log under Tools.  But it isn't there and developer section is not helpful.  I have tons of message filters going into folders so it is impossible to identify the last successful email download.    </p><p>How am I to fix this issue if there is no longer a way to see failed email downloads via the error log? </p><p>I wasn't happy with the UI changes burying the menus into the hamburger on the side, but figured I could live with it.  Not sure the benefit, maybe it looks cleaner?   But removing functionality at the same time is really NOT helpful. </p><p>Anyone have any ideas how to find the error log or find the email causing Thunderbird to stop seeing downloadable emails? </p>",arf668;davidsk;wsmwk;MattAuSupport;mozilla98;Googlethunderbird.;,false,false,false,;useragent:Mozilla/5.0 (X11; Linux x86_64; rv:142.0) Gecko/20100101 Firefox/142.0,32,0,0,,,"{""username""=>""wsmwk"", ""display_name""=>""Wayne Mery"", ""avatar""=>""https://firefoxusercontent.com/3f0645137479a481e67f7fb3ff1d945b""}"
1530703,2025-08-21 08:33:42 -0700,2025-08-21 09:39:23 -0700,en-US,thunderbird,Unable to access Email account,false,,,false,1758496,1758496;,reset-passwords,thunderbird;reset-passwords;,annie.mcdowall27,"<p>Hi! I can't log into my Thunderbird account. It won't accept the password, and before it locked me out altogether, no emails were showing in  my inbox. </p><p>Can you please advise? Many thanks, Annie </p>",annie.mcdowall27;davidsk;,false,false,false,;useragent:Mozilla/5.0 (Windows NT 10.0; Win64; x64; rv:142.0) Gecko/20100101 Firefox/142.0,1,0,3,,,
1530704,2025-08-21 08:36:25 -0700,2025-08-25 00:48:24 -0700,en-US,thunderbird,"""Server powerrangerserver.gogogo.com has disconnected. The server may have gone down or there may be a network problem.""",false,,,false,1759469,1759469;,connectivity,thunderbird;connectivity;,tehvashree,"<p>Hi, I’m a student working on an assignment to set up an email server from Rocky Linux (server) to Ubuntu (client). I have configured Postfix, Dovecot, IMAP, POP3, SSL, SMTP, and DNS on Rocky. </p><p>However, when using Thunderbird on Ubuntu, I get: </p><p>""Server <a href=""http://powerrangerserver.gogogo.com"" rel=""nofollow"">powerrangerserver.gogogo.com</a> has disconnected. The server may have gone down or there may be a network problem."" </p><p>All services are running, and the firewall is not blocking connections, but I cannot figure out why Thunderbird cannot connect. </p><p>I have tried all the solution from google to chatgpt. pls do help </p>",tehvashree;MattAuSupport;,false,false,false,";useragent:Mozilla/5.0 (Windows NT 10.0; Win64; x64) AppleWebKit/537.36 (KHTML, like Gecko) Chrome/139.0.0.0 Safari/537.36",1,0,1,,,"{""username""=>""wsmwk"", ""display_name""=>""Wayne Mery"", ""avatar""=>""https://firefoxusercontent.com/3f0645137479a481e67f7fb3ff1d945b""}"
1530706,2025-08-21 08:50:26 -0700,2025-08-21 08:54:51 -0700,en-US,thunderbird,Thunderbird says email server says password incorrect.  Checked with provider.  They say nothing wrong.,false,,,false,1758482,1758482;,passwords-and-sign-in,thunderbird;passwords-and-sign-in;,morganle,"<p>I tried to get into my emails via Thunderbird but am told password is incorrect.  Checked with email provider (Empire Access)  They say password and settings are OK.  Have been able to access their web mail using password.  Also, since yesterday have lost Firefox and all my bookmarks.  Something is very wrong. </p>",morganle;davidsk;,false,false,false,";useragent:Mozilla/5.0 (Windows NT 10.0; Win64; x64) AppleWebKit/537.36 (KHTML, like Gecko) Chrome/139.0.0.0 Safari/537.36",1,0,0,,,
1530712,2025-08-21 09:14:13 -0700,2025-09-01 14:24:56 -0700,en-US,thunderbird,Thunderbird version 142,true,1758540,"{""username""=>""sfhowes"", ""display_name""=>""sfhowes"", ""avatar""=>""https://firefoxusercontent.com/c92a42cdab68b73a39b7e6b5bde36e39""}",false,1761271,1758494;1758495;1758540;1761271;,update,thunderbird;update;,kathy.albro,<p>Thunderbird version 142 seems to have affected OWL.  One of my email accounts that is on a microsoft server has completely disappeared.  Please help.  Am I able to go backwards to a prior version. </p>,kathy.albro;davidsk;sfhowes;dnix71;,false,false,false,;solver_id:6644207;useragent:Mozilla/5.0 (Windows NT 10.0; Win64; x64; rv:142.0) Gecko/20100101 Firefox/142.0,4,0,0,,,
1530716,2025-08-21 09:18:14 -0700,2025-08-25 06:10:11 -0700,en-US,thunderbird,Can not create subfolders in the Inbox of an IMAP Account,false,,,false,1759536,1758493;1758499;1758535;1758708;1759157;1759232;1759414;1759536;,email-and-messaging,thunderbird;email-and-messaging;,colin21,"<p>In an IMAP account I can create subfolders in all folders except the inbox. Subfolders created in the inbox become folders at the same level as the inbox. TB 140.2.0esr Screenshot of server settings, advanced attached. </p><p>Thanks </p>",colin21;davidsk;MattAuSupport;,false,false,false,";useragent:Mozilla/5.0 (Windows NT 10.0; Win64; x64; rv:142.0) Gecko/20100101 Firefox/142.0;kb_visits_prior:[""/en-US/kb/message-threading-thunderbird""]",8,0,0,,,
1530723,2025-08-21 10:00:04 -0700,2025-08-24 09:22:21 -0700,en-US,thunderbird,i can't receive emails. it works in troubleshoot mode,false,,,false,1759329,1758502;1759329;,extensions,thunderbird;extensions;,mevenson60,<p>i can't receive emails. it works in troubleshoot mode just fine. </p>,mevenson60;davidsk;wsmwk;,false,false,false,;useragent:Mozilla/5.0 (Windows NT 10.0; Win64; x64; rv:141.0) Gecko/20100101 Firefox/141.0,2,0,0,,,
1530724,2025-08-21 10:00:28 -0700,2025-08-23 07:09:34 -0700,en-US,thunderbird,forgot passward,false,,,false,1758999,1758999;,passwords-and-sign-in,thunderbird;passwords-and-sign-in;,jerry.garcia,<p>How to recover passward </p>,jerry.garcia;davidsk;,false,false,false,";useragent:Mozilla/5.0 (Windows NT 10.0; Win64; x64) AppleWebKit/537.36 (KHTML, like Gecko) Chrome/139.0.0.0 Safari/537.36 Viewer/99.9.8610.85;kb_visits_prior:[""/en-US/kb/protect-your-thunderbird-passwords-primary-password"", ""/en-US/kb/primary-password-replacing-master-password-thunderbird""]",1,0,0,,,
1530725,2025-08-21 10:01:33 -0700,2025-08-24 01:11:43 -0700,en-US,thunderbird,reset password,false,,,false,1759202,1759202;,passwords-and-sign-in,thunderbird;passwords-and-sign-in;,mike310,<p>I would like to reset my password how can I do that&nbsp;? </p>,mike310;MattAuSupport;,false,false,false,";useragent:Mozilla/5.0 (Windows NT 10.0; Win64; x64) AppleWebKit/537.36 (KHTML, like Gecko) Chrome/139.0.0.0 Safari/537.36",1,0,1,,,
1530728,2025-08-21 10:23:47 -0700,2025-08-21 10:26:06 -0700,en-US,thunderbird,"The ""Send"" button has disappeared when I write e-mails.  I cannot send.",false,,,false,1758501,1758501;,send-and-receive-email,thunderbird;send-and-receive-email;,redwardowen,"<p>The ""Send"" button has disappeared from my e-mails.  Therefore, I cannot send out my e-mails. I need help. </p>",redwardowen;davidsk;,false,false,false,";useragent:Mozilla/5.0 (Windows NT 10.0; Win64; x64) AppleWebKit/537.36 (KHTML, like Gecko) Chrome/109.0.0.0 Safari/537.36",1,0,4,,,
1530733,2025-08-21 10:51:23 -0700,2025-08-21 10:51:23 -0700,en-US,thunderbird,Calendar is missing data,false,,,false,,"",events,thunderbird;events;,karenmorgan4289,"<p>I recently migrated Thunderbird from my old Windows 10 computer to my new Windows 11 computer.  I seem to have resolved all my issues with Thunderbird except for the following: In the Calendar, I have all my events from 2014 forward until the end of May 2024.  After that time period I only have 2 events, when I know for a fact that I had many more.  I would like to recover this data for historical purposes because it contains many medical appointments.  Does anyone have any ideas about how this can be accomplished? </p>",karenmorgan4289;,false,false,false,";useragent:Mozilla/5.0 (Windows NT 10.0; Win64; x64; rv:141.0) Gecko/20100101 Firefox/141.0;kb_visits_prior:[""/en-US/kb/moving-thunderbird-data-to-a-new-computer""]",0,0,0,,,
1530735,2025-08-21 11:09:36 -0700,2025-08-23 10:19:30 -0700,en-US,thunderbird,Thunderbird with Dark theme: message pane has white background,false,,,false,1759055,1758832;1758934;1759042;1759055;,customization,thunderbird;customization;,julien.larena,"<p>Hello. I am using Thunderbird version 128.14.0esr on POP OS 24.04. I use a default dark theme. It seems to me that there is a problem with the way the dark theme is applied, which breaks consistency. For a while now, my message panes appear with black text over a white background, as opposed to white text over a black background, as it used to be. Only when I ""Turn dark mode off"" with the dark mode ""drop"" in the message menu does it revert back to normal. This is quite annoying as it has to be done every time I want to read an email. Is there a solution to this minor but annoying problem? Thanks. </p>",julien.larena;Toad-Hall;,false,false,false,;useragent:Mozilla/5.0 (X11; Linux x86_64; rv:141.0) Gecko/20100101 Firefox/141.0,4,0,0,,,
1530739,2025-08-21 11:14:09 -0700,2025-11-15 07:47:37 -0800,en-US,thunderbird,my cursor keeps changing,false,,,false,1779461,1758814;1779461;,crashing-and-slow-performance,thunderbird;crashing-and-slow-performance;,mbjmills,<p>my cursor will be fine (finger point) then I go back to email and it is a fist and won't open emails </p>,mbjmills;Toad-Hall;jlhart68;,false,false,false,;useragent:Mozilla/5.0 (Windows NT 10.0; Win64; x64; rv:142.0) Gecko/20100101 Firefox/142.0,2,0,0,,,
1530744,2025-08-21 11:26:15 -0700,2025-08-28 10:09:00 -0700,en-US,thunderbird,renew my thunderbird email,false,,,false,1760294,1758516;1758519;1758531;1758779;1758784;1758845;1759309;1759380;1759602;1759670;1760246;1760249;1760277;1760288;1760290;1760294;,passwords-and-sign-in,thunderbird;passwords-and-sign-in;needsinfo;,vmausser,"<p>I never had a password for the past 18 years, so now it suddenly asks for one. What gives? </p>",vmausser;davidsk;Toad-Hall;,false,false,false,";useragent:Mozilla/5.0 (Windows NT 10.0; Win64; x64) AppleWebKit/537.36 (KHTML, like Gecko) Chrome/139.0.0.0 Safari/537.36",16,0,4,,,
1530748,2025-08-21 11:56:03 -0700,2025-08-22 09:30:29 -0700,en-US,thunderbird,Trash file not compacted in Thnuderbird,true,1758813,"{""username""=>""denis.gehle"", ""display_name""=>""Denis Gehle"", ""avatar""=>""https://profile.accounts.firefox.com/v1/avatar/D""}",false,1758824,1758530;1758653;1758719;1758748;1758749;1758813;1758824;,junk-mail-and-spam,thunderbird;junk-mail-and-spam;,denis.gehle,"<p>Hello, Despite I compacted my folder, the trash file is steel big 27Gb even with empty trash. Version 140.2.0esr 64 on Windows10. I have the same issue on all boxes. How could I delete the trash file. Could I delete it and recreate an empty file&nbsp;? Thank you Denis </p>",denis.gehle;davidsk;mozilla98;,false,false,false,;solver_id:6108960;useragent:Mozilla/5.0 (Windows NT 10.0; Win64; x64; rv:142.0) Gecko/20100101 Firefox/142.0,7,0,0,,,
1530753,2025-08-21 12:25:28 -0700,2025-08-21 13:19:35 -0700,en-US,thunderbird,Email,false,,,false,1758532,1758532;,send-and-receive-email,thunderbird;send-and-receive-email;,entrekin,<p>this cimputer was just worked on and upgrades operating systems now cannot get email? </p>,entrekin;davidsk;,false,false,false,;useragent:Mozilla/5.0 (Macintosh; Intel Mac OS X 10.15; rv:128.0) Gecko/20100101 Firefox/128.0,1,0,0,,,
1530754,2025-08-21 12:36:12 -0700,2025-08-21 13:58:27 -0700,en-US,thunderbird,Date Column data incomplete suddenly,true,1758541,"{""username""=>""kmacker"", ""display_name""=>""Kelly"", ""avatar""=>""https://firefoxusercontent.com/cd39d2400f5aed179b93984e991dd84e""}",false,1758541,1758523;1758524;1758538;1758541;,customization,thunderbird;customization;,kmacker,<p>Just realized all my date column today on incoming emails are only showing time of receipt and no date. I don't think it was anything I did setting wise... I have not been into that info at all recently...  </p><p>Any ideas on what might have caused it? I am on 142.0 64bit  Yikes this is not good for organizing things. </p><p>Thanks in advance for any help. Kelly </p>,kmacker;sfhowes;,false,false,false,";solver_id:4156121;useragent:Mozilla/5.0 (Windows NT 10.0; Win64; x64) AppleWebKit/537.36 (KHTML, like Gecko) Chrome/139.0.0.0 Safari/537.36 Edg/139.0.0.0",4,0,0,,,
1530761,2025-08-21 13:28:15 -0700,2025-08-26 07:05:46 -0700,en-US,thunderbird,"*cannot move or delete messages from Inbox.* Safe and Troubleshoot Mode do not help. And ""Inbox on constans@sfu.ca' could not be compacted because writing to folder failed. Verify that you have enough disk space, and that you have write privileges""",false,,,false,1759774,1758757;1758822;1758826;1758828;1758881;1758892;1758897;1758899;1758902;1758920;1758960;1759084;1759117;1759118;1759178;1759215;1759406;1759408;1759435;1759669;1759676;1759723;1759774;,crashing-and-slow-performance,thunderbird;crashing-and-slow-performance;,mamaconnie,"<p>Hi.  I have over 20,000 messages in my Inbox.  I've been sometimes having trouble moving messages into folders, so I thought it would be a good idea to reduce the number of messages in my Inbox.  But I can't delete or move messages in the Inbox.  When I select messages and enter command to move them to a folder, or ask to delete them, nothing happens. I am a Thunderbird supporter, and I love this program.  Thanks for your work!  Any advice appreciated.  Connie </p>",mamaconnie;mozilla98;christ1;MattAuSupport;wsmwk;,false,false,false,;useragent:Mozilla/5.0 (Windows NT 10.0; Win64; x64; rv:141.0) Gecko/20100101 Firefox/141.0,23,0,0,,,"{""username""=>""wsmwk"", ""display_name""=>""Wayne Mery"", ""avatar""=>""https://firefoxusercontent.com/3f0645137479a481e67f7fb3ff1d945b""}"
1530763,2025-08-21 13:48:42 -0700,2025-08-23 14:19:16 -0700,en-US,thunderbird,"""Message Options"" to view all headers.",false,,,false,1759112,1758610;1759053;1759064;1759106;1759112;,junk-mail-and-spam,thunderbird;junk-mail-and-spam;,cwcjr,"<p>The old Outlook app has a function of ""Message Options"" that allows you to view all the message headers, without opening the message, to determine if the Email is spam or contains malicious 'packages'.  Spammers fake the basic FROM information, but within the headers you can see where the message actually originated from and which servers it passed through.  It is a safety feature to prevent automatic 'confirmation of receipt' and other cyberstalking responses upon opening of the Email by deleting it before opening. How can I do the same thing using Thunderbird. </p><p>Example: Return-Path: &lt;01010198ce4******-cca7-4763-bd7c-736abf31a416-000000@mail.firefox.com&gt; <strong>(***this can be falsified***)</strong> Delivered-To: '''<em><strong>(***redacted***)'''</strong></em> Received: (qmail 404816 invoked from network); 21 Aug 2025 20:14:47 -0000 Received: from <a href=""http://a59-50.smtp-out.us-west-2.amazonses.com"" rel=""nofollow"">a59-50.smtp-out.us-west-2.amazonses.com</a> (HELO <a href=""http://a59-50.smtp-out.us-west-2.amazonses.com"" rel=""nofollow"">a59-50.smtp-out.us-west-2.amazonses.com</a>) (54.240.59.50) (***This can be falsified***) 	by (***redacted***) with  (TLS_AES_128_GCM_SHA256 encrypted) ESMTPS 	(7b9ce110-7e*********341ca7f98); Thu, 21 Aug 2025 16:14:47 -0400 DKIM-Signature: v=1; a=rsa-sha256; q=dns/txt; c=relaxed/simple; 	s=6ujb3doj4mwbng********3; d=<a href=""http://firefox.com"" rel=""nofollow"">firefox.com</a>; t=1755***286; 	h=From:Sender:To:Subject:Message-ID:Date:MIME-Version:Content-Type; 	bh=T5q+t93Z3ALFYCbyT*********+OJW/vRrGhTg=; 	b=bTLofV7VLWXo/EmaTMwly2r35torEW7HAKOXuASjJwxiq73VLbKz2vMHZOGXEluu 	RMG5I1DUwpy4dn**********Tg1gS7ZSS+GuyCwMAASjyweSMvKZhlANnNfbW 	C9PUvylBVj272EhtTk9s4MBFIIjOPZmrwe+zmo2Q= DKIM-Signature: v=1; a=rsa-sha256; q=dns/txt; c=relaxed/simple; 	s=gdwg2y3ko******ilkup5wp5hhxx; d=<a href=""http://amazonses.com"" rel=""nofollow"">amazonses.com</a>; t=1755807286; 	h=From:Sender:To:Subject:Message-ID:Date:MIME-Version:Content-Type:Feedback-ID; 	bh=T5q+t93Z3ALFYC**********5YdKr+OJW/vRrGhTg=; 	b=Y0JnPpx1TwX2E51oYf+drgGkglkHNxdZH+/xQcqk5Mku7Wi2YglHZSSyf9kMRJOJ 	3nDB5a/DwVo/YLY0l**********ZjFs893PwdsktXopqXEOLSyNGLMRCdh 	iUcOti/cHJHUSdN5lmrcyAv9zcnMevO9FX5/KpxQ= Content-Language: en-US X-Template-Name: verifyShortCode X-Template-Version: 5 X-Verify-Short-Code: 830807 X-Device-ID: 9e821fb2191******2ad21a34147f59 X-Flow-ID: e437667dd6a6****************f5cc6e044af637002 X-Flow-Begin-Time: 1755807026335 X-Uid: fd5df64e898*********714d932108c From: Mozilla &lt;accounts@firefox.com&gt;  (***This cannot be falsified***) Sender: Mozilla &lt;accounts@firefox.com&gt; (***This cannot be falsified***) To: (***redacted***) Subject: Confirm your account Message-ID: &lt;01010198ce4**********763-bd7c-736abf31a416-000000@us<a href=""http://-west-2.amazonses.com"" rel=""nofollow"">-west-2.amazonses.com</a>&gt; Date: Thu, 21 Aug 2025 20:14:45 +0000 MIME-Version: 1.0 Content-Type: multipart/alternative; </p><pre>boundary=""--_NmP-9e6cf*****86020-Part_1"" </pre> <p>Feedback-ID: fxa-verify::<a href=""http://1.us"" rel=""nofollow"">1.us</a>-west-2.9obwqSuHxA*********AmnSHOVLO3+B/64gdyXQ=:AmazonSES X-SES-Outgoing: 2025.08.21-54.240.59.50 X-MagicMail-OS: Linux 2.2.x-3.x X-MagicMail-UUID: 7b9ce110*********a73341ca7f98 X-MagicMail-SourceIP: 54.240.59.50 X-MagicMail-RegexMatch: 0 X-MagicMail-EnvelopeFrom: &lt;01010198ce4502a********-cca7-4763-bd7c-736abf31a416-000000@mail.firefox.com&gt; (***this cannot be falsified***) X-MagicMail-Original-Destination: (***redacted***) X-MagicMail-Quarantine: Yes X-Antivirus: Norton (VPS 250****10, 8/21/2025), Inbound message X-Antivirus-Status: Clean </p>",cwcjr;mozilla98;,false,false,false,";useragent:Mozilla/5.0 (Windows NT 10.0; Win64; x64) AppleWebKit/537.36 (KHTML, like Gecko) Chrome/139.0.0.0 Safari/537.36 Edg/139.0.0.0",5,0,0,,,
1530765,2025-08-21 13:59:54 -0700,2025-08-26 04:49:12 -0700,en-US,thunderbird,why doesnt toolkit.legacyUserProfileCustomizations.stylesheets work any more,true,1758546,"{""username""=>""davidsk"", ""display_name""=>""david"", ""avatar""=>""https://firefoxusercontent.com/5eed5ecf74d9e1ec85435ea262bc016e""}",false,1759755,1758546;1758560;1758720;1758857;1758859;1758988;1759000;1759028;1759048;1759073;1759320;1759344;1759348;1759360;1759755;,customization,thunderbird;customization;,bill.ruggirello,"<p>I want to change all the tab bars to hide thread column but i cant do it because toolkit.legacyUserProfileCustomizations.stylesheets doesnt look for css file any more. That's a pita, i have a lot of folders I there another way of changing this and other things globally? </p>",bill.ruggirello;davidsk;,false,false,false,;solver_id:2216362;useragent:Mozilla/5.0 (Windows NT 10.0; Win64; x64; rv:142.0) Gecko/20100101 Firefox/142.0,15,0,0,,,
1530779,2025-08-21 14:58:24 -0700,2025-08-24 18:51:34 -0700,en-US,thunderbird,why is outlook taking over Thunderbird?,false,,,false,1759423,1758755;1759037;1759148;1759325;1759423;,extensions,thunderbird;extensions;,lessha,"<p>As of this afternoon, I'm suddenly getting a Microsoft 365/Outlook tab popping up in Thunderbird. Why? How do I stop it? </p>",lessha;mozilla98;MattAuSupport;,false,false,false,;useragent:Mozilla/5.0 (Windows NT 10.0; Win64; x64; rv:142.0) Gecko/20100101 Firefox/142.0,5,0,0,,,
1530780,2025-08-21 15:18:57 -0700,2025-08-21 20:06:19 -0700,en-US,thunderbird,Thunderbird wont download,true,1758630,"{""username""=>""MattAuSupport"", ""display_name""=>""Matt"", ""avatar""=>""https://firefoxusercontent.com/79e0e1373e33440d6ce85c47aefeda62""}",false,1758630,1758630;,install,thunderbird;install;,Jerry71,"<p><strong>bold text</strong> I donated to for Thunderbird and clicked ""Download"" but nothing happened. I've done this several times with no download coming. </p>",Jerry71;MattAuSupport;,false,false,false,;solver_id:3393976;useragent:Mozilla/5.0 (Windows NT 10.0; Win64; x64; rv:142.0) Gecko/20100101 Firefox/142.0,1,0,0,,,
1530783,2025-08-21 15:41:56 -0700,2025-08-25 05:36:39 -0700,en-US,thunderbird,Logged in/on but to syn it tells me the saved passworrd is WRONG,false,,,false,1759524,1758722;1758762;1758772;1759104;1759107;1759315;1759343;1759388;1759524;,reset-passwords,thunderbird;reset-passwords;,dulca,"<p>I was able to log in/on to Mozilla Support but when I tried to sync - update it would NOT accept the password, even though I was able to log in - on. </p><p>Am at an impasse.  I can, if I could get to them, answer the security questions! </p>",dulca;davidsk;,false,false,false,;useragent:Mozilla/5.0 (Windows NT 10.0; Win64; x64; rv:141.0) Gecko/20100101 Firefox/141.0,9,0,0,,,
1530786,2025-08-21 15:55:38 -0700,2025-08-21 15:55:38 -0700,en-US,thunderbird,Certain calendar events now appear as accepted invitations - cannot edit or dismiss.,false,,,false,,"",events,thunderbird;events;,rednoise,"<p>I hope I can explain this well: Recently, many recurring events from Google Contacts, namely birthdays and anniversaries, now appear in Google Calendar as invitations from ""Unknown Organizer &lt;unknownorganizer@calendar.google.com&gt;"" that I have accepted (but I have not.) These events keep triggering pop-up notifications. Those notifications do not respond to the Dismiss or Snooze buttons - they do nothing. I can dismiss the dialog box with the upper-right [X], but the pop up gain every time the calendar re-syncs. I try to edit the properties of the event, but the changes do not take. When I look at Google Calendar directly with my browser, these events do not show up, only the proper ones that are listed in my Birthdays calendar. </p><p>Why did this happen, and how can I fix this. The un-dismissable notifications make Thunderbird Calendar unusable. I find many similar (but not necessarily identical) complaints going back years, but no actual solutions. </p><p>Thunderbird 140.2.0esr Windows 10 22H2 Cardbook address book add-on 100.4 </p>",rednoise;,false,false,false,;useragent:Mozilla/5.0 (Windows NT 10.0; Win64; x64; rv:142.0) Gecko/20100101 Firefox/142.0,0,0,5,,,
1530787,2025-08-21 16:05:22 -0700,2025-08-26 15:52:46 -0700,en-US,thunderbird,Why do my emails disappear after they are received by Gmail?,true,1759154,"{""username""=>""MichelT"", ""display_name""=>""Michel T"", ""avatar""=>""https://profile.accounts.firefox.com/v1/avatar/o""}",false,1759897,1758797;1758799;1758915;1759013;1759018;1759066;1759154;1759155;1759179;1759251;1759288;1759897;,send-and-receive-email,thunderbird;send-and-receive-email;,brandon.t,"<p>My email from a third party domain is routed to both my gmail inbox and to my thunderbird client.  The emails typically get received by thunderbird first, and I read them quickly because of the notification that comes up.  However, these emails on thunderbird disappear as soon as they show up in my gmail inbox.  Does anyone know how to prevent this?  I haven't found any other similar issues on the support forums or other sources. </p>",brandon.t;Toad-Hall;mozilla98;MichelT;,false,false,false,;solver_id:6968802;useragent:Mozilla/5.0 (Windows NT 10.0; Win64; x64; rv:141.0) Gecko/20100101 Firefox/141.0,12,0,0,,,
