id,question_id,created,updated,content,creator,is_spam,num_helpful,num_unhelpful
1777115,1544992,2025-11-05 05:08:55 -0800,2025-11-05 05:08:55 -0800,"<p>This is usually not a problem. In fact, I have routinely suggested deleting account info there when a user has a new password. To verify that, I just deleted account info for one of my accounts and then sent a test message and was prompted to reenter password. Try sending a message to yourself. </p>",davidsk,false,0,0
1777183,1544992,2025-11-05 08:54:32 -0800,2025-11-05 08:54:32 -0800,"<p>David, Thank you for answering. This didn't work for me. I tried sending an email to myself from Thunderbird. Then a “Sending Message” window popped up, and eventually another pop up that said “login to server smtp.mail.....failed” and it gave me the options to retry, enter new password, or cancel. When I click enter new password the window disappears, nothing appears prompting me for an new password.  Then I start repeatedly getting the same pop up I get when I start Thunderbird (telling me “too many requests”) indicating my credentials failed. Hitting “cancel” just stopped the attempt to send the email, and hitting “retry” just put me back to the “Sending message” infinite loop and then another “login to server smtp.mail.....failed” box. Any other suggestions would be appreciated. Thanks again for answering. David </p>",beach_boy_dave,false,0,0
1777215,1544992,2025-11-05 13:06:53 -0800,2025-11-05 13:06:53 -0800,"<p>I would check to make sure you didn't actually set up the account twice. And recheck settings&gt;privacy&amp;security and, if new entries are there,  I would delete again. Other than that, all I could suggest would be to remove and create new. </p>",davidsk,false,0,0
1777231,1544992,2025-11-05 17:03:59 -0800,2025-11-05 17:03:59 -0800,"<p>When you say remove and create new, what are you saying I should remove and create new, and where would I find it. I rechecked as you suggested.  I don't have any new entries.  I don't have any entries at all.  When I go to setting&gt;privacy&amp;security and click saved passwords, there are no (as in zero) saved logins.  And Thunderbird won't let me create a new login using my online email address because it gives me an error message that my incoming server already exists.  My login isn't there under saved logins, but when I try to re-create my login with my email address Thunderbird won't create it because it thinks it already exists -- but I can't see it, I can't see or change the password, and it won't connect to my email provider's server because my provider made me change the password online and I can't update it on Thunderbird.  I can't delete any entries because there are no entries.  Its there somewhere, but it isn't anywhere I can find it or see it or change the password. I appreciate your suggestions. Thanks for sticking with me. David </p>",beach_boy_dave,false,0,0
1777308,1544992,2025-11-06 04:48:09 -0800,2025-11-06 04:48:09 -0800,"<p>First, I am puzzled that when you attempt to retrieve messages that you are not offered the option to enter password. That's the normal process when the entries in settings&gt;privacy&amp;security are removed. At this point, my approach would be this:  - If IMAP account, simply delete the account and start over. nothing will be lost  - if POP account, my approach would be a bit different -   delete the POP account, but DO NOT tick the box to remove data.  -   create the account again and thunderbird will resume control of the account data  FOR SAFETY, I recommend backing up the profile first. Not needed, but I like to be safe. </p>",davidsk,false,0,0
1777082,1544996,2025-11-05 01:04:53 -0800,2025-11-05 01:04:53 -0800,"<p>Just disabling the filters should have been enough, so try deleting them. </p>",siffemoz,false,0,0
1777080,1545001,2025-11-05 01:03:01 -0800,2025-11-05 01:03:01 -0800,"<p>See <a href=""https://support.mozilla.org/en-US/kb/protect-your-thunderbird-passwords-primary-password#w_resetting-your-primary-password-if-you-have-forgotten-it"" rel=""nofollow"">https://support.mozilla.org/en-US/kb/protect-your-thunderbird-passwords-primary-password#w_resetting-your-primary-password-if-you-have-forgotten-it</a>. </p>",siffemoz,false,0,0
1777068,1545005,2025-11-04 22:36:20 -0800,2025-11-04 22:36:20 -0800,"<p>Hi, </p><p>Can you share more details about the issue you're experiencing? </p>",norhorn,false,0,0
1777057,1545009,2025-11-04 21:18:19 -0800,2025-11-04 21:18:19 -0800,"<p>All six accounts are configures identically via IMAP. </p><p>I've changed the account settings so as not to fetch emails  for all six accounts immediately upon activating T-Bird. </p><p>I've changed the times to fetch emails again to random times, 10 to 31 minutes. </p><p>Sorry for BOLD dashes above. </p>",TedT_USA,false,0,0
1777176,1545009,2025-11-05 08:18:38 -0800,2025-11-05 08:18:38 -0800,<p>Yahoo has been having trouble over the last week or more. </p>,wsmwk,false,0,0
1777059,1545011,2025-11-04 21:47:29 -0800,2025-11-04 21:47:29 -0800,"<p>On W11, the arrows only appear when the cursor hovers on the spot where they normally appear, so this might also be the case on Linux. </p>",sfhowes,false,0,0
1777060,1545011,2025-11-04 22:07:05 -0800,2025-11-04 22:07:05 -0800,"<p>Hello </p><p>Of course, this is not the expected answer, nevertheless, for information purposes. <a href=""https://connect.mozilla.org/t5/ideas/scroll-bar-width-in-thunderbird/idc-p/50540/highlight/true#M29344"" rel=""nofollow"">https://connect.mozilla.org/t5/ideas/scroll-bar-width-in-thunderbird/idc-p/50540/highlight/true#M29344</a> </p><p>A Test, below. </p>",Agentvirtuel,false,0,0
1777061,1545011,2025-11-04 22:11:15 -0800,2025-11-04 22:11:15 -0800,"<p>Update: after doing the fix I saw on Reddit mentioned above, my inbox got really weird. Emails were appearing and disappearing. It showed 6 of 1400 emails! I couldn't seem to get to any others. I tried returning to the default setting of ""0"", but that didn't seem to work. </p><p>I had to copy my old profile over the current profile. Luckily I had just backed it up a few hours ago, so I didn't lose many emails I hope!  </p><p>There must be a better solution that doesn't mess everything up. </p>",DD46,false,0,0
1777062,1545011,2025-11-04 22:13:02 -0800,2025-11-04 22:13:02 -0800,"<p>Hi sfhowes, </p><p>Yes, the scrollbars don't show up unless I hover over them, but the arrows never show up. They're just completely missing! And now that I'm back to the default scroll bars, they are like 1/4 of the width that they were on Windows 10. Really difficult to work with. </p><p>Thanks, DD </p>",DD46,false,0,0
1777063,1545011,2025-11-04 22:13:51 -0800,2025-11-04 22:13:51 -0800,"<p>See <a href=""https://support.mozilla.org/en-US/questions/1536610"" rel=""nofollow"">https://support.mozilla.org/en-US/questions/1536610</a> </p><p><a href=""https://support.mozilla.org/en-US/questions/1503077"" rel=""nofollow"">https://support.mozilla.org/en-US/questions/1503077</a> </p>",sfhowes,false,0,0
1777064,1545011,2025-11-04 22:16:04 -0800,2025-11-04 22:16:04 -0800,"<em><p>DD46 <a href=""#answer-1777062"" rel=""nofollow"">said</a></p></em> <blockquote>Hi sfhowes,  Yes, the scrollbars don't show up unless I hover over them, but the arrows never show up. They're just completely missing! And now that I'm back to the default scroll bars, they are like 1/4 of the width that they were on Windows 10. Really difficult to work with.  Thanks, DD </blockquote> <p>Besides the config. editor settings in TB, you might have to adjust something in Linux settings, as with W11 Settings. </p>",sfhowes,false,0,0
1777065,1545011,2025-11-04 22:17:03 -0800,2025-11-04 22:17:03 -0800,"<p>Hi Agent Virtuel, </p><p>I don't think I want to mess with the Config Editor again. I'm not a super-techie person and I don't want to lose more emails. I hope there's a safer way to do this. And in your attached image, the arrows are also missing. I'd love to have the arrows and the wide scroll bar, as in my screenshot. It's very awkward to use the current style. </p><p>Thanks, DD </p>",DD46,false,0,0
1777217,1545011,2025-11-05 13:34:19 -0800,2025-11-05 13:34:19 -0800,<p>Does anyone have any other suggestions other than using the Config Editor?  </p><p>Or else maybe a step-by-step way to use it so that I don't mess up my emails like before? </p><p>Thanks! </p>,DD46,false,0,0
1777260,1545011,2025-11-05 23:25:56 -0800,2025-11-05 23:25:56 -0800,"<p>Hello </p><p>Go to config editor <a href=""https://support.mozilla.org/en-US/kb/config-editor"" rel=""nofollow"">https://support.mozilla.org/en-US/kb/config-editor</a> Next. Search a preference <strong>widget.non-native-theme.scrollbar.size.override</strong> Double-click on the preference, enter a new value, <strong>40</strong>, for example. </p><p>About, scroll bar color, with the help of, userContent.css file, illustration custom colors. <a href=""https://connect.mozilla.org/t5/ideas/scroll-bar-color/idc-p/57539/highlight/true#M33660"" rel=""nofollow"">https://connect.mozilla.org/t5/ideas/scroll-bar-color/idc-p/57539/highlight/true#M33660</a> </p>",Agentvirtuel,false,0,0
1777274,1545020,2025-11-06 01:08:19 -0800,2025-11-06 01:08:19 -0800,"<p><em>Questa domanda non ha ricevuto risposte, probabilmente nessuno degli utenti di <a href=""http://support.mozilla.org"" rel=""nofollow"">support.mozilla.org</a> può darti una mano. Se vuoi, puoi chiedere una seconda opinione riportando la domanda anche su <a href=""https://forum.mozillaitalia.org/"" rel=""nofollow"">https://forum.mozillaitalia.org/</a> </em> </p>",@next,false,0,0
1777078,1545027,2025-11-05 00:59:21 -0800,2025-11-05 00:59:21 -0800,"<p>La connessione a internet è di TIM/Telecom Italia? </p><p>Più in generale, Per poter inquadrare il problema prova a fornire queste informazioni: </p> <ol><li> Versione di Thunderbird </li><li> Versione del sistema operativo </li><li> Provider delle caselle email (Gmail, Libero, Hotmail, etc.) </li><li> Tipologia di account (POP3, IMAP) </li><li> Estensioni installate </li><li> Messaggi di errore che vengono visualizzati durante l'utilizzo di Thunderbird </li><li> Software di sicurezza eventualmente presenti (Antivirus e simili) </li><li> Screenshot del problema (se utile a chiarire il contesto) </li></ol>",@next,false,0,0
1777091,1545028,2025-11-05 02:26:36 -0800,2025-11-05 02:26:36 -0800,"<p>Hai attivato l'autenticazione a 2 fattori? (password sicura) </p><p>Più in generale, Per poter inquadrare il problema prova a fornire queste informazioni: </p> <ol><li> Versione di Thunderbird </li><li> Versione del sistema operativo </li><li> Provider delle caselle email (Gmail, Libero, Hotmail, etc.) </li><li> Tipologia di account (POP3, IMAP) </li><li> Estensioni installate </li><li> Messaggi di errore che vengono visualizzati durante l'utilizzo di Thunderbird </li><li> Software di sicurezza eventualmente presenti (Antivirus e simili) </li><li> Screenshot del problema (se utile a chiarire il contesto) </li></ol>",@next,false,0,0
1777186,1545046,2025-11-05 09:16:42 -0800,2025-11-05 09:16:42 -0800,"<p>Hello </p><p>Is it this subject <a href=""https://bugzilla.mozilla.org/show_bug.cgi?id=1993842"" rel=""nofollow"">https://bugzilla.mozilla.org/show_bug.cgi?id=1993842</a> </p><p><a href=""https://support.mozilla.org/en-US/questions/1543769"" rel=""nofollow"">https://support.mozilla.org/en-US/questions/1543769</a> </p>",Agentvirtuel,false,0,0
1777126,1545060,2025-11-05 06:09:15 -0800,2025-11-05 06:09:15 -0800,"<p>I spent several years managing a large university help desk. My suggestion is to first contact them, as I am confident you are not the first to do this. They should have everything you need to achieve your goal. You may still get assistance here, but they should already have it written up. Good luck. </p>",davidsk,false,0,0
1777134,1545067,2025-11-05 06:34:21 -0800,2025-11-05 06:35:42 -0800,<p>Tasto menu &gt; Impostazioni &gt; Composizione </p><p>assicurati che la voce <em>Controlla ortografia prima di inviare</em> non sia attiva </p><p>(Può darsi che su una vecchia versione come la 115 la posizione si diversa) </p>,@next,false,0,0
1777137,1545069,2025-11-05 06:35:21 -0800,2025-11-05 06:35:21 -0800,"<p>Che significa che non riesci ad aggiornare? Cosa fai? Cosa succede? </p><p>Più in generale, Per poter inquadrare il problema prova a fornire queste informazioni: </p> <ol><li> Versione di Thunderbird </li><li> Versione del sistema operativo </li><li> Provider delle caselle email (Gmail, Libero, Hotmail, etc.) </li><li> Tipologia di account (POP3, IMAP) </li><li> Estensioni installate </li><li> Messaggi di errore che vengono visualizzati durante l'utilizzo di Thunderbird </li><li> Software di sicurezza eventualmente presenti (Antivirus e simili) </li><li> Screenshot del problema (se utile a chiarire il contesto) </li></ol>",@next,false,0,0
1777199,1545070,2025-11-05 10:28:23 -0800,2025-11-05 10:28:23 -0800,<p>Does it look correct in safe/troubleshoot mode (hold Shift when launching TB)? </p>,sfhowes,false,0,0
1777201,1545070,2025-11-05 10:48:14 -0800,2025-11-05 10:48:14 -0800,"<p>When I started TB in troubleshooting mode, I did NOT check ""Disable all add-ons"" or ""Reset toolbars and controls"". Yes it looked correct in this mode - what does that mean? Thanks </p>",major4579,false,0,0
1777202,1545070,2025-11-05 10:51:29 -0800,2025-11-05 10:51:29 -0800,"<p>Possibly a broken layout.  Launch again in safe mode, check 'reset toolbars...', and 'make changes and restart'. </p><p><a href=""https://kb.mozillazine.org/Safe_Mode#Safe_Mode_options"" rel=""nofollow"">https://kb.mozillazine.org/Safe_Mode#Safe_Mode_options</a> </p>",sfhowes,false,0,0
1777188,1545077,2025-11-05 09:18:54 -0800,2025-11-05 09:19:35 -0800,<p>Do you mean another email <strong>account</strong>? Go to File &gt; New &gt; Email Account.... </p>,Mapenzi,false,0,0
1777232,1545083,2025-11-05 19:55:25 -0800,2025-11-05 19:55:25 -0800,"<p>Hola,  Esto sucede siempre en la misma carpeta? entonces debe ser un problema con el contenido de la carpeta, puede intentar compactarla y/o repararla (propiedades de la carpeta en el Thunderbird) Saludos </p>",pcp04,false,0,0
1777264,1545083,2025-11-05 23:56:29 -0800,2025-11-05 23:56:29 -0800,"<p>Gracias por tu respuesta, si, pasa con otras, me han desaparecido y si estan el la carpeta Local folders de windows.  La compactacion ya la realize, lo he echo de nuevo. La que me importa no perder, si la dejo dentro de otra carpeta parece que no se pierde. Voy a provar creando una nueva carpeta y mover los mensajes de dentro. Saludos </p>",suportmpi,false,0,0
1777187,1545088,2025-11-05 09:16:48 -0800,2025-11-05 09:16:48 -0800,"<p>Stai dicendo che se apri una cartella ti si aprono tutte le mail che contiene? Mi pare improbabile... </p><p>Puoi spiegare esattamente cosa fai? </p><p>Comunque più in generale, Per poter inquadrare il problema prova a fornire queste informazioni: </p> <ol><li> Versione di Thunderbird </li><li> Versione del sistema operativo </li><li> Provider delle caselle email (Gmail, Libero, Hotmail, etc.) </li><li> Tipologia di account (POP3, IMAP) </li><li> Estensioni installate </li><li> Messaggi di errore che vengono visualizzati durante l'utilizzo di Thunderbird </li><li> Software di sicurezza eventualmente presenti (Antivirus e simili) </li><li> Screenshot del problema (se utile a chiarire il contesto) </li></ol>",@next,false,0,0
1777205,1545088,2025-11-05 11:38:33 -0800,2025-11-05 11:38:33 -0800,"<p>Cerco di essere più preciso: quando apro mozilla, si vedono tutte le cartelle con i nomi di queste. se vado sulla mia posta in entrata, vedo tutte le mail , in evidenza quelle ultime in grassetto. Se apro una mail, si vede, però nella barra superiore (come da foto allegato ci sono tutte le mail iconizzate della cartella). quando chiudo l'ultima mail aperta, devo scorrere tutte le icone a sinistra per tornare al menu principale. </p>",aldo46a,false,0,0
1777272,1545088,2025-11-06 01:00:34 -0800,2025-11-06 01:00:34 -0800,"<p>No, se tieni aperte tutte quelle schede, ogni nuova mail viene aperta in coda. </p>",@next,false,0,0
1777278,1545088,2025-11-06 01:39:50 -0800,2025-11-06 01:39:50 -0800,"<p>Io non voglio tenere aperte tutte quelle schede, quando sono nella cartella di posta in arrivo o qualsiasi altra, se apro una mail, perchè mi apre anche tutte le altre?, come si fa ad aprire solo una mail? prima non lo aveva mai fatto, o forse ho dato un comando involontario che mi da questo problema. Se si, come torno indietro? Grazie </p>",aldo46a,false,0,0
1777280,1545088,2025-11-06 02:11:48 -0800,2025-11-06 02:11:48 -0800,"<p>E come faccio a saperlo? Quindi se chiudi tutte le mail aperte e poi ne apri una si riaprono tutte? </p><p>Inoltre, rispondi alle domande che ho elencato sopra per capire la situazione. </p>",@next,false,0,0
1777285,1545088,2025-11-06 03:14:56 -0800,2025-11-06 03:14:56 -0800,"<p>Allego tre foto per semplificare il problema . quando apro mozilla, viene visualizzata la pagina con le varie cartelle e in alto la barra con tutte le mail, prima non c'erano, poi quando seleziono la cartella, si vedono le mail all'interno , e le mail vengono scaricate tutte sulla barra in alto, quando apro una mail, si vedono sempre tutte le mail caricate, per uscire da questa cartella , devo scorrere la freccia sotto la barra di"" File"" sino a quando tutte le mail sono terminate(nel senso che torno alla casella di apertura). E cosi per ogni cartella Spero di aver chiarito il mio problema. </p><p>Ps: pensavo fosse una versione in particolare ma è su qualsiasi. Grazie </p>",aldo46a,false,0,0
1777297,1545088,2025-11-06 04:16:41 -0800,2025-11-06 04:16:41 -0800,<p>Ti ho già chiesto due volte di rispondere alle domande che ti ho elencato nelle prima risposta... Non lo farò di nuovo. </p>,@next,false,0,0
1777311,1545088,2025-11-06 05:09:09 -0800,2025-11-06 05:09:09 -0800,<p>1 versione --144 in un pc e 138  in un altro 2 win11 25h2 3 non so come leggerlo 4  IMAP 5 niente estensioni 6 non vengono visualizzati messaggi di errore 7 iobit   malware fighter 8 già inviate foto </p>,aldo46a,false,0,0
1777185,1545089,2025-11-05 09:14:41 -0800,2025-11-05 09:14:41 -0800,"<p>Forse è stato attivato il nuovo Centro account Lo puoi disattivare da </p><p>Menu &gt; Impostazioni &gt; Generale Sezione Centro account Togli la spunta da Crea account nel nuovo Centro account </p><p>A questo punto puoi usare la vecchia procedura automatica -&gt; <a href=""https://support.mozilla.org/it/kb/configurazione-automatica-account"" rel=""nofollow"">https://support.mozilla.org/it/kb/configurazione-automatica-account</a> </p><p>o la procedura manuale -&gt; <a href=""https://support.mozilla.org/it/kb/configurazione-manuale-account"" rel=""nofollow"">https://support.mozilla.org/it/kb/configurazione-manuale-account</a> </p>",@next,false,0,0
1777316,1545090,2025-11-06 05:25:38 -0800,2025-11-06 05:25:38 -0800,"<p>The RETR error generally means there is a problem with the email provider's mail server, or there is a message 'stuck' in the account. I suggest logging on to website of account and see if there may be a message there you can delete and then resume with Thunderbird. </p>",davidsk,false,0,0
1777200,1545104,2025-11-05 10:31:37 -0800,2025-11-05 10:31:37 -0800,"<p>you might try this: rightclick on folder, select properties and then select repair. That refreshes the index. </p>",davidsk,false,0,0
1777226,1545121,2025-11-05 14:37:02 -0800,2025-11-05 14:37:02 -0800,<p>I have managed to do it through the help and account settings.  I needed to force the profile changes.  Don't ask me how&nbsp;!  What a journey. </p>,mcleviesteve,false,0,0
1777225,1545141,2025-11-05 14:35:52 -0800,2025-11-05 14:35:52 -0800,"<p>See <a href=""https://addons.thunderbird.net/en-us/thunderbird/addon/msghdr-toolbar-customize/"" rel=""nofollow"">https://addons.thunderbird.net/en-us/thunderbird/addon/msghdr-toolbar-customize/</a> </p>",sfhowes,false,0,0
