id,created,updated,locale,product,title,is_solved,solution,solved_by,is_spam,last_answer,answers,topic,tags,creator,content,involved,is_archived,is_locked,is_taken,metadata,num_answers,num_votes_past_week,num_votes,taken_until,taken_by,updated_by
1502127,2025-03-27 09:58:06 -0700,2025-03-27 09:58:06 -0700,en-US,thunderbird,"Not receving some emails in IN box, but sender says they are marked as read",false,,,false,,"",send-and-receive-email,thunderbird;send-and-receive-email;,joesgrille,"<p>I have not been receiving all incoming messages. they are not in my spam. It shows up that I have read them to others. My assistant is now checking my email and he sees the messages, but I don't seem to have them anywhere. I am getting some messages so it is not universal. It has happened with several urls. What is possibly wrong and how do I fix?  </p><p>thanks for the help! </p>",joesgrille;,true,false,false,;useragent:Mozilla/5.0 (Macintosh; Intel Mac OS X 10.15; rv:136.0) Gecko/20100101 Firefox/136.0,0,0,0,,,
1502128,2025-03-27 10:11:21 -0700,2025-03-27 10:11:21 -0700,en-US,thunderbird,Unable to dismiss or snooze Calendar reminders,false,,,false,,"",calendar,thunderbird;calendar;,firefox2478,"<p>When the Reminder window pops open with a reminder from my Calendar, I can neither snooze or dismiss the reminder. The only way to remove the reminder window is to click the x to actually close the window. This behaviour appears to have started at a recent update. </p><p>I am presently running Thunderbird 128.8.0esr in Linux Mint 21.1 </p>",firefox2478;,true,false,false,;useragent:Mozilla/5.0 (X11; Linux x86_64; rv:136.0) Gecko/20100101 Firefox/136.0,0,0,0,,,
1502129,2025-03-27 10:12:45 -0700,2025-03-27 16:39:59 -0700,en-US,thunderbird,cannot send mails,false,,,false,1721635,1721635;,send-and-receive-email,thunderbird;send-and-receive-email;,john1164,"<p>we cannot send email today we get this message, what can we do? Outgoing server (SMTP) error. The server responded:  <a href=""http://smtp27.relay.iad3a.emailsrvr.com"" rel=""nofollow"">smtp27.relay.iad3a.emailsrvr.com</a> ESMTP not accepting connections. </p>",john1164;jeff-g;,true,false,false,";useragent:Mozilla/5.0 (Windows NT 10.0; Win64; x64) AppleWebKit/537.36 (KHTML, like Gecko) Chrome/134.0.0.0 Safari/537.36 Edg/134.0.0.0;kb_visits_prior:[""/en-US/kb/cannot-send-messages""]",1,0,1,,,
1502130,2025-03-27 10:12:56 -0700,2025-03-27 10:39:08 -0700,en-US,thunderbird,CardDAV   Thunderbird,false,,,false,1721556,1721556;,contacts,thunderbird;contacts;,symbiotic1976,<p>How to setup CardDAV for Thunderbird </p>,symbiotic1976;markwarner22;,true,false,false,;useragent:Mozilla/5.0 (X11; Ubuntu; Linux x86_64; rv:129.0) Gecko/20100101 Firefox/129.0,1,0,0,,,
1502133,2025-03-27 10:24:01 -0700,2025-03-28 00:26:57 -0700,it,thunderbird,Thunderbird portable,false,,,false,1721672,1721672;,crashing-and-slow-performance,needsinfo;thunderbird;crashing-and-slow-performance;,plgalanti,"<p>Ho su chiavetta USB un tool Portableapps, cui vi è anche Thunderbird portable edition 136.0.1.  Avrei necessità di riutilizzarlo ma è estremamente lento. E' ancora attuale ed utilizzabile o devo passare alla mobile? </p>",plgalanti;@next;,true,false,false,";useragent:Mozilla/5.0 (Windows NT 10.0; Win64; x64; rv:136.0) Gecko/20100101 Firefox/136.0;kb_visits_prior:[""/it/kb/profili-thunderbird""]",1,0,1,,,
1502143,2025-03-27 10:58:58 -0700,2025-03-27 12:47:16 -0700,en-US,thunderbird,terminal (ubuntu),false,,,true,1721596,1721596;,privacy-and-security,thunderbird;privacy-and-security_1;,sushin.maks,<p>How to fix a terminal if it doesn't work at all? </p>,sushin.maks;christ1;,true,false,false,";useragent:Mozilla/5.0 (X11; Linux x86_64) AppleWebKit/537.36 (KHTML, like Gecko) Chrome/134.0.0.0 Safari/537.36",1,0,0,,,
1502146,2025-03-27 11:18:49 -0700,2025-04-06 05:02:53 -0700,en-US,thunderbird,Help I don’t know what this is,false,,,true,1723689,1721592;1723680;1723689;,email-and-messaging,thunderbird;email-and-messaging;needsinfo;,arnett.mindy8,"<p>ug_type"":""226"",""timestamp"":""2025-03-24 23:34:17.00 -0500"",""os_version"":""iPhone OS 18.3.2 (22D82)"",""roots_installed"":0,""incident_id"":""3C3D05E0-D45F-4609-8040-94B207D1C81B""} {""postTime"":1742877257442.1279,""events"":[{""eventTime"":1742568864958.5339,""product"":""iPhone OS"",""build"":""22D82"",""eventLinkID"":""E0189137-4549-4EB3-84D9-EE769EB02CCA"",""eventType"":""CloudServicesiCloudIdentity"",""eventClass"":1,""errorDomain"":""CloudServicesErrorDomain"",""topic"":""xp_coreos_securebackup"",""modelid"":""iPhone16,2"",""errorCode"":212},{""eventTime"":1742568865997.7178,""product"":""iPhone OS"",""build"":""22D82"",""eventLinkID"":""E0189137-4549-4EB3-84D9-EE769EB02CCA"",""eventType"":""SOSStatus"",""eventClass"":1,""errorDomain"":""com.apple.security.sos.error"",""topic"":""xp_coreos_securebackup"",""modelid"":""iPhone16,2"",""errorCode"":1050},{""eventTime"":1742624573227.2981,""product"":""iPhone OS"",""build"":""22D82"",""eventLinkID"":""E0189137-4549-4EB3-84D9-EE769EB02CCA"",""eventType"":""CloudServicesiCloudIdentity"",""eventClass"":1,""errorDomain"":""CloudServicesErrorDomain"",""topic"":""xp_coreos_securebackup"",""modelid"":""iPhone16,2"",""errorCode"":212},{""eventTime"":1742644348856.354,""product"":""iPhone OS"",""build"":""22D82"",""eventLinkID"":""E0189137-4549-4EB3-84D9-EE769EB02CCA"",""eventType"":""SOSStatus"",""eventClass"":1,""errorDomain"":""com.apple.security.sos.error"",""topic"":""xp_coreos_securebackup"",""modelid"":""iPhone16,2"",""errorCode"":1050},{""eventTime"":1742711722186.741,""product"":""iPhone OS"",""build"":""22D82"",""eventLinkID"":""E0189137-4549-4EB3-84D9-EE769EB02CCA"",""eventType"":""CloudServicesiCloudIdentity"",""eventClass"":1,""errorDomain"":""CloudServicesErrorDomain"",""topic"":""xp_coreos_securebackup"",""modelid"":""iPhone16,2"",""errorCode"":212},{""eventTime"":1742711722543.71,""product"":""iPhone OS"",""build"":""22D82"",""eventLinkID"":""E0189137-4549-4EB3-84D9-EE769EB02CCA"",""eventType"":""SOSStatus"",""eventClass"":1,""errorDomain"":""com.apple.security.sos.error"",""topic"":""xp_coreos_securebackup"",""modelid"":""iPhone16,2"",""errorCode"":1050},{""eventTime"":1742769412280.8599,""product"":""iPhone OS"",""build"":""22D82"",""eventLinkID"":""E0189137-4549-4EB3-84D9-EE769EB02CCA"",""eventType"":""SOSStatus"",""eventClass"":1,""errorDomain"":""com.apple.security.sos.error"",""topic"":""xp_coreos_securebackup"",""modelid"":""iPhone16,2"",""errorCode"":1050},{""eventTime"":1742797393929.1379,""product"":""iPhone OS"",""build"":""22D82"",""eventLinkID"":""E0189137-4549-4EB3-84D9-EE769EB02CCA"",""eventType"":""CloudServicesiCloudIdentity"",""eventClass"":1,""errorDomain"":""CloudServicesErrorDomain"",""topic"":""xp_coreos_securebackup"",""modelid"":""iPhone16,2"",""errorCode"":212},{""eventTime"":1742877251836.364,""product"":""iPhone OS"",""build"":""22D82"",""eventLinkID"":""E0189137-4549-4EB3-84D9-EE769EB02CCA"",""eventType"":""SOSStatus"",""eventClass"":1,""errorDomain"":""com.apple.security.sos.error"",""topic"":""xp_coreos_securebackup"",""modelid"":""iPhone16,2"",""errorCode"":1050}]} </p>",arnett.mindy8;christ1;Googlethunderbird.;,true,false,false,";useragent:Mozilla/5.0 (iPhone; CPU iPhone OS 18_3_2 like Mac OS X) AppleWebKit/605.1.15 (KHTML, like Gecko) Version/18.3.2 Mobile/15E148 Safari/604.1",3,0,0,,,
1502149,2025-03-27 11:34:26 -0700,2025-03-27 11:34:26 -0700,pt-BR,thunderbird,jogos,false,,,true,,"",accessibility,thunderbird;accessibility;,rosangelademoura1985,<p>bn gfhnmgbm hbmk </p>,rosangelademoura1985;,true,false,false,;useragent:Mozilla/5.0 (X11; Linux x86_64; rv:89.0) Gecko/20100101 Firefox/89.0,0,0,0,,,
1502155,2025-03-27 11:59:22 -0700,2025-03-27 16:28:44 -0700,en-US,thunderbird,Google pop up screen when using Thunderbird email,false,,,true,1721630,1721630;,accessibility,thunderbird;accessibility;,gnye307,<p>I cannot stop the Google screen that pops up after I access a Thunderbird email. No way out of this pop up - only can use the esc key but then it comes back again.  Help </p><p>Gary Nye </p><p>xxx@gmail.com or text xxx 408 9995 </p>,gnye307;wsmwk;,true,true,false,";useragent:Mozilla/5.0 (Linux; Android 10; K) AppleWebKit/537.36 (KHTML, like Gecko) Chrome/134.0.0.0 Mobile Safari/537.36",1,0,0,,,wsmwk
1502157,2025-03-27 12:03:41 -0700,2025-04-01 08:24:44 -0700,en-US,thunderbird,"Email received ""Important Notice About Your Thunderbird Newsletter Subscription""",false,,,false,1722577,1721590;1721595;1721634;1721638;1721664;1722062;1722577;,account-management,thunderbird;account-management;,mozilla157,"<p>today I received an email from the thunderbird Newsletter team advising me of a data breach relating to MailChimp. It came on a unique disposable address only used for Thunderbird matters. Everything about it checks out as genuine and the various clickable links are the same as those I received on my original subscription email,  but when I tried to use the ""change my preferences"" link (which again links to the genuine site,  I got to a site which said it would send a verification email to my email address h t t p s:/ /<a href=""http://thunderbird.us12.list-manage.com/profile/send-email"" rel=""nofollow"">thunderbird.us12.list-manage.com/profile/send-email</a>  (obfuscated for forum) . No such email arrives. There are NO ways I can see of contacting anyone on the newsletter team. I am trying to change the address used to send the newsletter to me, but am unable to do so as the verification email never arrives. Two questions - is this ""important notice about your thunderbird newsletter subscription"" genuine, and secondly - how do I update my preferences if I never get the verification email and can't otherwise contact the newsletter team? Thanks for any assistance, I can't see any other way of contacting the team. </p>",mozilla157;christ1;jeff-g;James;wsmwk;,true,false,false,;useragent:Mozilla/5.0 (X11; Linux x86_64; rv:136.0) Gecko/20100101 Firefox/136.0,7,0,0,,,
1502158,2025-03-27 12:06:41 -0700,2025-03-28 07:18:09 -0700,en-US,thunderbird,Exporting Outlook to TB and Moving to new machine,false,,,false,1721730,1721700;1721730;,import-and-export-email,thunderbird;import-and-export-email;,mozilla516,"<p>Hi, we have a Windows 11 machine running 'New Outlook'. We have a new machine, also with Windows 11, but we want to move to Thunderbird on the new machine. Grateful for some advice on the best approach.  </p><p>Should we migrate from New Outlook to Thunderbird on the old machine, then take a TB export (if that's possible) and move that to the new machine? </p><p>Thanks very much for any help to get this right first time! </p>",mozilla516;davidsk;,true,false,false,";useragent:Mozilla/5.0 (Windows NT 10.0; Win64; x64) AppleWebKit/537.36 (KHTML, like Gecko) Chrome/134.0.0.0 Safari/537.36;kb_visits_prior:[""/en-US/kb/switching-thunderbird""]",2,0,0,,,
1502159,2025-03-27 12:06:43 -0700,2025-05-30 07:57:23 -0700,en-US,thunderbird,making a mailing list,false,,,false,1737860,1721589;1721591;1721594;1734116;1737860;,contacts,thunderbird;contacts;,sbecker5,<p>What are the steps to make a mailing list? </p>,sbecker5;christ1;jimcandela;minde1;,true,false,false,;useragent:Mozilla/5.0 (Windows NT 10.0; Win64; x64; rv:136.0) Gecko/20100101 Firefox/136.0,5,0,2,,,
1502171,2025-03-27 13:23:04 -0700,2025-03-28 11:06:23 -0700,en-US,thunderbird,Authentication by receiver's server.,false,,,false,1721797,1721698;1721797;,send-and-receive-email,thunderbird;send-and-receive-email;,enneth74,"<p>My e-mail, enneth74@swissmail.org, has bounced because it is not authenticated.  How do I authenticated my email address? </p>",enneth74;davidsk;sfhowes;,true,false,false,";useragent:Mozilla/5.0 (Windows NT 10.0; Win64; x64) AppleWebKit/537.36 (KHTML, like Gecko) Chrome/134.0.0.0 Safari/537.36",2,0,0,,,
1502173,2025-03-27 13:24:42 -0700,2025-03-27 16:29:40 -0700,en-US,thunderbird,Thunderbird google popup,false,,,true,1721631,1721631;,performance-and-connectivity,thunderbird;performance-and-connectivity;,gnye307,"<p>With the latest update 136.01 whenever I click on any Thunderbird mail I get a popup screen that says ""Thunderbird Email wants to access you Google account"". The screen implies there is an ""Allow"" link that I should click on but none exists! Then the only way out of this screen is use the esc key. That takes me back to my Thunderbird mail but anything I try to initialises this pop up up screen again.  So my email account is totally unusable. I have used Thunderbird over ten years and have not had any problem.  I hope it can be fixed.  Thank You.  Gary Nye. text me at xxx 408 9995 </p>",gnye307;wsmwk;,true,true,false,";useragent:Mozilla/5.0 (Windows NT 10.0; Win64; x64) AppleWebKit/537.36 (KHTML, like Gecko) Chrome/134.0.0.0 Safari/537.36 Edg/134.0.0.0;kb_visits_prior:[""/en-US/kb/mozilla-crash-reporter-tb""]",1,0,0,,,wsmwk
1502174,2025-03-27 13:26:19 -0700,2025-03-27 16:29:56 -0700,en-US,thunderbird,There is a space between sentences. How to rid message of this?,true,1721632,timbernie,false,1721632,1721607;1721626;1721627;1721632;,customization,thunderbird;customization;,timbernie,<p>There is a space between sentences. How to rid message of this? </p>,timbernie;wsmwk;,true,false,false,";useragent:Mozilla/5.0 (Windows NT 10.0; Win64; x64) AppleWebKit/537.36 (KHTML, like Gecko) Chrome/134.0.0.0 Safari/537.36;solver_id:4880263",4,0,1,,,
1502177,2025-03-27 13:34:38 -0700,2025-03-27 13:34:38 -0700,pt-BR,thunderbird,contas outlook e hotmail,false,,,false,,"",connectivity,thunderbird;connectivity;,ernand3s,"<p>boa tarde, eu entrei no thunderbird beta com minhas contas hotmail, <a href=""http://outlook.com"" rel=""nofollow"">outlook.com</a> e <a href=""http://outlook.com.br"" rel=""nofollow"">outlook.com.br</a> de inicio funcionou e recebi os emails, em seguida adicionei as outras contas que são do gmail, agora eta funcionando apenas para contas gmail, eu tinha deixado de usar o thunderbird beta por esse motivo, primeiro que nem entrava nas contas citadas, agora depois de muito tempo entrei novamente e fiquei todo feliz que as contas entraram e minutos depois cerca de uns 40 minutos as contas citadas não funcionam, queria saber os motivos, ja entre em contato com a microsoft e dizem estar tudo correto com as contas e que o defeito fosse com a mozilla, então por favor me ajudem a solucionar, queria muito ficar usando somente o thunderbird e esquecer a existencia do gmail e do outlook, segui as configuraçoes padrão ou seja escolhi um nome, digitei o email, a senha, abriu uma nova janela da microsoft e do gmail, para confirmar a senha, fiz as confirmaçoes, sincronizou com sucesso, porem depois dos 40 minutos ficou somente as contas do gmail. </p>",ernand3s;,true,false,false,;useragent:Mozilla/5.0 (Windows NT 10.0; Win64; x64; rv:128.0) Gecko/20100101 Firefox/128.0,0,0,0,,,
1502181,2025-03-27 13:49:02 -0700,2025-03-27 13:49:02 -0700,en-US,thunderbird,Thunderbird indexing stuck - gmail,false,,,false,,"",crashing-and-slow-performance,thunderbird;crashing-and-slow-performance;,afoltz26,"<p>Hello all: </p><p>For the last few months, I've been having some issues with frequent lockups while accounts update.  I'm now having issues with indexing, and being able to search and find messages.  According to the activity screen, indexing freezes around 97% on the Inbox of my main gmail account (~17,800 messages total in that inbox, indexing stops around 17,300 and hangs).    </p><p>Version:  128.8.1esr OS:  Windows 10 Accounts:  4 all IMAP (2 gmail) Largest inbox:  about 17k messages </p><p>Troubleshooting done: 1. Repaired folders 2. Rebuilt global Index 3. Removed All mail from sync 4. Excluded antivirus (Windows Defender) </p><p>Is there any way to find the email is causing the lockup?  Any other suggestions? </p>",afoltz26;,true,false,false,";useragent:Mozilla/5.0 (Windows NT 10.0; Win64; x64; rv:136.0) Gecko/20100101 Firefox/136.0;kb_visits_prior:[""/en-US/kb/rebuilding-global-database"", ""/en-US/kb/imap-synchronization""]",0,0,0,,,
1502187,2025-03-27 14:00:19 -0700,2025-03-28 08:47:42 -0700,en-US,thunderbird,Filters not moving existing messages to newly created folder/deleting actually deleting.,false,,,false,1721778,1721778;,email-and-messaging,thunderbird;email-and-messaging;,fyzxman1,<p>Number 1: I have filters that work on new messages that come in but I still have email in my inbox that the filter is not moving to the designated folder as defined in the filter. Is this due to some setting? I use Thunderbird for multiple gmail accounts.  Need help because I have a huge inbox and it needs managed into multiple folders and I can't seem to get it to work. It worked one time in the past but I am not sure why it doesn't now. &nbsp;??? </p><p>Number 2: Does the retention policy for a folder actually send a delete instruction to the server? I want to know how I can do that so I am actually deleting messages at the server as well.    What all info do you need? </p>,fyzxman1;mozilla98;,true,false,false,;useragent:Mozilla/5.0 (Windows NT 10.0; Win64; x64; rv:136.0) Gecko/20100101 Firefox/136.0,1,0,0,,,
1502204,2025-03-27 16:42:56 -0700,2025-03-27 23:21:20 -0700,en-US,thunderbird,Flatpak version of the official monthly releases?,false,,,false,1721665,1721665;,install,thunderbird;install;,pvdvegte,"<p>Hello Firstly, thank you very much for this great product. Secondly, I prefer to use Thunderbird as a Flatpak on my openSUSE install and have been hearing a lot about version 136. Can you please create a Flatpak version for ""The official monthly release. This release is intended for users who want all available new features and bug fixes on a monthly basis."", so that we can get updated to versions such as 136 sooner rather than later? Cheers Pieter </p>",pvdvegte;wsmwk;,true,false,false,";useragent:Mozilla/5.0 (X11; Linux x86_64; rv:136.0) Gecko/20100101 Firefox/136.0;kb_visits_prior:[""/en-US/kb/updating-thunderbird""]",1,0,0,,,
1502208,2025-03-27 16:56:33 -0700,2025-03-28 16:47:29 -0700,en-US,thunderbird,Can't get email,true,1721751,mozilla98,false,1721853,1721751;1721852;1721853;,send-and-receive-email,thunderbird;send-and-receive-email;,PCintheWoods,"<p>I haven't used my Win 11 laptop in a while.  I started it up and let Thunderbird run.  It had several months of emails to download, but has now stopped at early March.  I asked it to continue and get a message ""Unable to write email to mailbox.  .....""  I know there is plenty of space on the harddisk.  I cleared out a lot of the junk emails from earlier months and emptied the trash.  Rebooted.  Updated to latest version 128.8.1esr.  Still same error message. </p>",PCintheWoods;mozilla98;,true,false,false,;useragent:Mozilla/5.0 (Windows NT 10.0; Win64; x64; rv:136.0) Gecko/20100101 Firefox/136.0;solver_id:1291417,3,0,0,,,
