id,question_id,created,updated,content,creator,is_spam,num_helpful,num_unhelpful
1781116,1548119,2025-11-22 08:07:23 -0800,2025-11-22 08:07:23 -0800,"<p>Hi Ed, No, I'm still getting that message. Any more ideas? </p>",Tombarkas,false,0,0
1781272,1548119,2025-11-22 19:52:24 -0800,2025-11-22 19:52:24 -0800,"<em><p>Tombarkas <a href=""#question-1548119"" rel=""nofollow"">said</a></p></em> <blockquote>I quite often get this message, though it tends not to be a problem later ""Unable to write the email to the mailbox. Make sure the file system allows you write privileges, and you have enough disk space to copy the mailbox""  One of the solutions seems to be Compact a File. How do I do this? </blockquote> <p>The usual diagnosis on this forum is anti-virus software. Are you using some? Can you create an exception for Thunderbird in it? </p>",mozilla98,false,0,0
1781326,1548119,2025-11-22 22:58:53 -0800,2025-11-22 22:58:53 -0800,"<p>HI Rick. The main purpose of my antivirus is to scan emails, so turning it off doesn't seem a good idea. Also, the message comes and goes for the same email download - if I leave it, then try again, the emails download with no problem. However, the length of time to wait between attempts at downloads can be quite variable </p>",Tombarkas,false,0,0
1781339,1548119,2025-11-23 00:00:00 -0800,2025-11-23 00:00:00 -0800,"<em><p>Tombarkas <a href=""#answer-1781116"" rel=""nofollow"">said</a></p></em> <blockquote>Hi Ed, No, I'm still getting that message. Any more ideas? </blockquote> <p>Can also happen if you're getting multiple copies of the same message. If you think that's happening, go to your email via the web interface and delete that message. </p>",siffemoz,false,0,0
1779477,1548121,2025-11-15 08:52:58 -0800,2025-11-15 08:52:58 -0800,"<blockquote> I keep getting an alert saying I need to update my email account. </blockquote> <p>Please post a screenshot. <a href=""https://support.mozilla.org/kb/how-do-i-create-screenshot-my-problem"" rel=""nofollow"">https://support.mozilla.org/kb/how-do-i-create-screenshot-my-problem</a> </p>",christ1,false,0,0
1780055,1548121,2025-11-18 06:59:46 -0800,2025-11-18 06:59:46 -0800,<p>Here's the screen shot of the notice that keeps popping up (for months). </p>,BruceRatcliffe,false,0,0
1780075,1548121,2025-11-18 07:45:27 -0800,2025-11-18 07:46:52 -0800,"<p>The screen shot you uploaded shows icon of Mail (of Microsoft), not Thunderbird. </p>",Yu5tiqX9og,false,0,0
1780473,1548121,2025-11-19 20:39:24 -0800,2025-11-19 20:39:24 -0800,<p>No response yet. </p>,BruceRatcliffe,false,0,0
1780474,1548121,2025-11-19 20:43:23 -0800,2025-11-19 20:43:23 -0800,"<p>Dear YU5.  True, but sbcglobal is the part after the ""@"" symbol in my Thunderbird email addresses.  My full Thunderbird would be like this: my name@sbcglobal.net </p>",BruceRatcliffe,false,0,0
1779494,1548142,2025-11-15 10:45:29 -0800,2025-11-15 10:45:29 -0800,"<p>The relevant preference is <em>mail.delete_matches_sort_order</em>, which defaults to false.  The PCs might have different default sort orders, i.e. descending vs. ascending. </p>",sfhowes,false,0,0
1779515,1548142,2025-11-15 12:29:33 -0800,2025-11-15 12:29:33 -0800,"<p>Thank you.  Right you are.  On the PC that was working as I wanted, both mail.delete and mail.delete_matches_sort_order were set to false but on the other one mail.delete was false and the other one was true.  Now it is working fine. </p><p>What does mail.delete control? </p>",eberger5,false,0,0
1779519,1548142,2025-11-15 13:41:12 -0800,2025-11-15 13:41:12 -0800,"<p>I don't see any pref. that is just mail.delete.  mail.delete_matches_sort_order controls where the selection moves, as in your original post. </p><p>From <a href=""https://kb.mozillazine.org/Mail_and_news_settings"" rel=""nofollow"">https://kb.mozillazine.org/Mail_and_news_settings</a> </p><p>""True: If you set View -&gt; Sort by -&gt; Descending when you delete a message it will move the selection up to the next most recent message (rather than to the next oldest message). False(default): Does nothing."" </p>",sfhowes,false,1,0
1779522,1548182,2025-11-15 13:52:09 -0800,2025-11-15 13:52:09 -0800,<p>Check the View/Message Body As setting (press Alt if the Menu Bar with View is hidden).  It must be Original HTML to display remote images or display the banner. </p>,sfhowes,false,0,0
1779524,1548182,2025-11-15 14:00:40 -0800,2025-11-15 14:00:40 -0800,<p>Yay!!  I completely forgot about pressing Alt to get the Menu Bar visible. Thank you thank you! </p>,je3an,false,0,0
1779521,1548186,2025-11-15 13:49:26 -0800,2025-11-15 13:49:26 -0800,"<p>See <a href=""https://connect.mozilla.org/t5/ideas/thunderbird-trash-delete-button-beside-star-in-cards-view/idi-p/51713"" rel=""nofollow"">https://connect.mozilla.org/t5/ideas/thunderbird-trash-delete-button-beside-star-in-cards-view/idi-p/51713</a> </p><p>In Table View, the Delete column can be displayed that has a bin icon next to each message.  In Cards View, right-click a card and click the bin icon at the top right corner. </p>",sfhowes,false,0,0
1779543,1548186,2025-11-15 19:40:18 -0800,2025-11-15 19:40:18 -0800,"<p>Thanks for the link; I had searched before and didn't find that. </p><p>This link illustrates the frustration many people have experienced due to the lack of a 'delete unopened' icon in the card view. </p><p>Why is this being ignored? It seems like a relatively simple fix. </p><p>As a newbie, I am extremely impressed with the ease of adding accounts. However, not having a feature in card view that allows for a one-click delete without opening is very disappointing. </p>",jimtippins,false,0,0
1779550,1548186,2025-11-15 20:36:47 -0800,2025-11-15 20:36:47 -0800,"<p>If you close the Message Pane (F8), messages can be deleted without opening them by selecting in the messages list then the Delete key. </p>",sfhowes,false,0,0
1779650,1548186,2025-11-16 10:18:55 -0800,2025-11-16 10:18:55 -0800,"<p>sfhowes is an acceptable solution. Outlook allows you to keep the message preview pane open and delete an unrelated message without opening it, but this will have to do. </p>",jimtippins,false,0,0
1779520,1548189,2025-11-15 13:44:33 -0800,2025-11-15 13:44:33 -0800,"<p>If this is a new account, is IMAP enabled in webmail settings? </p><p><a href=""https://support.mozilla.org/en-US/questions/1533790"" rel=""nofollow"">https://support.mozilla.org/en-US/questions/1533790</a> </p>",sfhowes,false,0,0
1779582,1548192,2025-11-16 02:29:20 -0800,2025-11-16 02:30:45 -0800,"<p>Spustite <a href=""http://seznam.cz"" rel=""nofollow"">seznam.cz</a> a cez web rozhranie sa prihláste k svojmu účtu. Preverte aké názvy jednotlivých zložiek sú vo vašom  účte uvedené - anglické, alebo české? </p>",Ansamb,false,0,0
1779583,1548192,2025-11-16 02:39:11 -0800,2025-11-16 02:39:11 -0800,"<p>Můžete ručně nastavit správné „speciální složky“ </p><p>Thunderbird: Nastavení účtu → Nastavení serveru → Kopie a složky </p><p>Zkontrolujte, zda: Odeslaná pošta → „Sent“ nebo český ekvivalent Koš → „Trash“ Nevyžádaná pošta → „Junk“ nebo „Spam“ Vyberte správné složky. </p><p>Proč zůstala jen „Doporučená pošta“? Tato složka není systémová; je to klasická uživatelská složka, proto se nepřejmenovala. Systémové složky (Inbox, Sent, Junk, Drafts…) přebírá Thunderbird z IMAP serveru. </p>",Ansamb,false,0,0
1779584,1548192,2025-11-16 02:40:24 -0800,2025-11-16 02:40:24 -0800,<p>složky jsou české </p>,unizona,false,0,0
1779585,1548192,2025-11-16 02:42:33 -0800,2025-11-16 02:42:33 -0800,"<p>Můžete ručně nastavit správné „speciální složky“ </p><p>Thunderbird: Nastavení účtu → Nastavení serveru → Kopie a složky </p><p>Zkontrolujte, zda: Odeslaná pošta → „Sent“ nebo český ekvivalent Koš → „Trash“ Nevyžádaná pošta → „Junk“ nebo „Spam“ Vyberte správné složky. </p><p>Proč zůstala jen „Doporučená pošta“? Tato složka není systémová; je to klasická uživatelská složka, proto se nepřejmenovala. Systémové složky (Inbox, Sent, Junk, Drafts…) přebírá Thunderbird z IMAP serveru. </p>",Ansamb,false,0,0
1779586,1548192,2025-11-16 02:45:07 -0800,2025-11-16 02:45:07 -0800,<p>tohle ukazuje v Kopie a složky viz foto </p>,unizona,false,0,0
1779587,1548192,2025-11-16 02:48:19 -0800,2025-11-16 02:48:19 -0800,<p>co s tím mám dělat teď? </p>,unizona,false,0,0
1779600,1548192,2025-11-16 05:34:56 -0800,2025-11-16 05:34:56 -0800,<p>Toto: </p>,Ansamb,false,0,0
1779669,1548192,2025-11-16 11:30:59 -0800,2025-11-16 11:30:59 -0800,"<p>Ahoj, nastavil jsem to, ale po restartu  to samé- anglicky, tak nevím, kde je chyba. </p>",unizona,false,0,0
1779673,1548192,2025-11-16 11:54:03 -0800,2025-11-16 11:54:03 -0800,"<p>...a opětovně jsem vypnul a spustil aplikaci a zase je to takhle nastavené! No, nevím čím to je, nikdy to nedělalo, používám hodně let aplikaci. </p>",unizona,false,0,0
1779765,1548192,2025-11-17 01:06:16 -0800,2025-11-17 01:06:16 -0800,"<p>Preveril som to a musím konštatovať, že Thunderbird 145.0 (64‑bitová verzia) sa takto chová a zatiaľ nie je možnosť to zmeniť. Neviem o takejto možnosti. V mojom prípade to zmenilo iba jeden priečinok a zobrazuje sa anglickým názvom. </p>",Ansamb,false,1,0
1779766,1548192,2025-11-17 01:08:23 -0800,2025-11-17 01:08:23 -0800,"<p>Toto je „Diskusné fórum“ používateľov Firefoxu a Thunderbirdu. Táto stránka nemá nič spoločné s vývojom produktov Mozilly, a nie je v silách tejto komunity to zmeniť. Ak to chcete riešiť, tak svoje pripomienky im môžete napísať tuna: <a href=""https://bugzilla.mozilla.org"" rel=""nofollow"">https://bugzilla.mozilla.org</a> </p>",Ansamb,false,0,0
1779768,1548192,2025-11-17 01:21:08 -0800,2025-11-17 01:21:08 -0800,"<p>Děkuji za info a pomoc, tak snad to bude v další aktualizaci opraveno. S pozdravem, Franto </p>",unizona,false,1,0
1779551,1548201,2025-11-15 23:07:37 -0800,2025-11-15 23:07:37 -0800,<p>Informazioni insufficienti a compredere il problema. Spiegati meglio. </p>,@next,false,0,0
1779576,1548207,2025-11-16 01:41:59 -0800,2025-11-16 01:41:59 -0800,"<p>What mail provider? What settings do you have for the outgoing server (SMTP) that you are using to send mail (not the incoming server details,  the SMTP server for the identity). </p><p>It woulds like you have not completed the oauth authentication for your providers outgoing (incoming and outgoing are two different authentications) server and are complaining that it does not work,  but I am trying to read between the lines with very little actual information about what the problem is. </p><p>have you lost anything,  if you use IMAP to get mail,  if the account is not connecting you will loose everything except an inbox and a trash folder until the connection is restored.  It is not a real data loss,  it is a red flag you have a connection issue.  Perhaps Thunderbird should not delete what it can no longer validete with the server,  but it does.  Once the connection issue is fixed the folder will reappear in most cases. </p><p>You downgraded?  Really.  Was it to the ESR version which updates about once a year or to the release 140 default which will just start you on the update merry-go-round again? Did you loose you profile and contacts when you downgraded?  it would be expected behavior. </p><p>While I have some personal opinions about the release versions, I can not really fault the ESR version I stayed with (140.5.0esr 64 bit).  It suits my needs,  has most addons working with it and only updates for critical, mostly security,  bugs each month. </p>",MattAuSupport,false,0,0
1779647,1548207,2025-11-16 10:15:33 -0800,2025-11-16 12:22:24 -0800,"<p>Thanks for the replay Matt. </p><p>My system is: Win11 Pro 24H2 - OS Build 24007.71 </p><p>The the last several weeks I have been beating my head against a wall trying to figure out what happened when TB upgraded to 141.   </p><p>141 - 8/13/2025: I had messages that would not delete.  </p><p>142 to 143 upgrade 10/7/2025:  Half my folders disappeared; I still could not delete any messages or folders; I could not create a folder.  Then I realized that there are TWO versions of TB: ESR and RELEASE. </p><p>Current:  Now, I'm on version 145.0, half my folders disappeared again.  HOWEVER, I have figured out why I wasn't able to send anything. The outgoing <a href=""http://SMTP.Comcast.net"" rel=""nofollow"">SMTP.Comcast.net</a> authentication method was set to <em><strong>OAuth2 instead of Password</strong></em>. When I changed it back to ""password"" I was able to send emails. </p><p>Weird Part:   My 'missing folders' are listed in the root directory user/app data/roaming/xxxxxx/thunderbird/profile esr /mail / <a href=""http://mail.comcast.net"" rel=""nofollow"">mail.comcast.net</a> / inbox / xxxx  </p><pre>                 <strong> BUT they will not show when TB is open</strong>. </pre>",lajoes,false,0,0
1779652,1548207,2025-11-16 10:23:40 -0800,2025-11-16 12:22:13 -0800,"<p>Thanks for the replay Matt. </p><p>My system is: Win11 Pro 24H2 - OS Build 24007.71 </p><p><br> The the last several weeks I have been beating my head against a wall trying to figure out what happened when TB upgraded to 141.   </p><p>141 - 8/13/2025: I had messages that would not delete.  </p><p>142 to 143 upgrade 10/7/2025:  Half my folders disappeared; I still could not delete any messages or folders; I could not create a folder.  Then I realized that there are TWO versions of TB: ESR and RELEASE. </p><p>Current:  Now, I'm on version 145.0, half my folders disappeared again.  HOWEVER, I have figured out why I wasn't able to send anything. The outgoing <a href=""http://SMTP.Comcast.net"" rel=""nofollow"">SMTP.Comcast.net</a> authentication method was set to <em><strong>OAuth2 instead of Password</strong></em>. When I changed it back to ""password"" I was able to send emails. </p><p>Weird Part:   My 'missing folders' are listed in the root directory user/app data/roaming/xxxxxx/thunderbird/profile esr /mail / <a href=""http://mail.comcast.net"" rel=""nofollow"">mail.comcast.net</a> / inbox / xxxx  </p><pre>                 <strong> BUT they will not show when TB is open</strong>. </pre>",lajoes,false,0,0
1779653,1548207,2025-11-16 10:31:29 -0800,2025-11-16 10:31:29 -0800,"<p><strong>Why am I doing this and not TB when it upgrades</strong>? </p><p>Just found this link about OAuth2 vs password for outgoing email servers: </p><p><a href=""https://www.xfinity.com/support/articles/update-your-xfinity-email-settings"" rel=""nofollow"">https://www.xfinity.com/support/articles/update-your-xfinity-email-settings</a> </p>",lajoes,false,0,0
1779656,1548207,2025-11-16 10:37:19 -0800,2025-11-16 10:37:19 -0800,<p>I install TB as POP3 </p>,lajoes,false,0,0
1779689,1548207,2025-11-16 13:50:52 -0800,2025-11-16 16:26:27 -0800,"<p>OK, Matt, here's where I'm at now: </p><p>I removed TB and did a clean install of 1<strong>40.3.1 esr</strong> </p><p>And here are the issues I had with this install:  </p><p>(1) In order to send emails, <strong>OAuth2 is NOT an option for <a href=""http://Comcast.net"" rel=""nofollow"">Comcast.net</a></strong>. They are still using ""normal password"".  So, why does TB default to the former? (see attached file). </p><p>(2) As soon as I created my new installation, I immediately closed TB to prevent TB from downloading several days worth of emails. Then I copied the files from my saved profile's ""mail/<a href=""http://mail.comcast.net"" rel=""nofollow"">mail.comcast.net</a>"" folder and pasted them into my newly created profile.  Then I reopened TB and it downloaded everything.  And it appears to be working.  <em>I can delete messages, all my folders are there.  And most importantly, I can now SENT messages. </em> <em> </em> Then I checked for updates. I always keep this setting at, ""always check for updates, but let me decide to install"". I was informed that 140.5.0 esr was available. I allowed it, it appears to be working, e.g., I can still delete messages, I can send messages. </p><p>++++++++++++++++++++++++++++++++++++++++++++++ </p><p>Here's what I've learned from this fiasco: </p><p>1. There are multiple flavors of TB: ESR, Release and Beta. </p><p>2. TB automatically defaults the <strong>authentication method</strong> to OAuth2 instead of 'normal password' for <a href=""http://comcast.net"" rel=""nofollow"">comcast.net</a>. ******  This is a big issue for TB ****** </p><p>3. I still don't know why I could NOT DELETE messages. ****This is what started me down this rabbit hole**** </p><p>I am going to stick with the esr version because I can not go through this every month. </p>",lajoes,false,0,0
1779690,1548207,2025-11-16 13:59:29 -0800,2025-11-16 13:59:29 -0800,<p>One more thing Matt:  I just received your email stating that you replied to my posting. </p>,lajoes,false,0,0
1779746,1548207,2025-11-16 21:22:23 -0800,2025-11-16 21:22:23 -0800,"<p>TB lied.  I am back to square one.  I can not delete a message, folder, et al. </p><p>I finally thought everything was going to be great when I install Thunderbird 140.5.0esr. </p><p>At first it appeared to flawlessly.  Then I shut it down for a couple of hours.  When I reopened it, the ORIGINAL issue was back:  I count NOT DELETE anything. </p><p>I currently using TB v140.5.0 on a Win11 Pro machine, with 24H2 installed, OS Build 240071.71., with 64GB RAM. </p><p>This situation first appeared in TB v141.  It would leave a ""ghost message"" once one was deleted.  I'd deleted a message and it would get grayed out. It never went away. </p><p>Then v142 and 143 I could not only NOT DELETE messages, I could not sent anything.  Something about a default setting of OAuth2  (authentication method for comcast) . </p><p>And then there was v144, same thing.  I could receive email, I could not sent anything, and I could not delete anything,.   </p><p>These trail installations were both esr and release versions. </p><p>I finally settled on the esr because I thought I got it up and running correctly and I would not have to go through this every month with the regular monthly release version. </p><p>Boy was I wrong. </p><p>Anyone got any idea(s) as to why I can not delete a message? </p>",lajoes,false,0,0
