id,created,updated,title,content,tags,product,topic,locale,answers,creator
1507370,2025-04-21 17:19:01 -0700,2025-04-21 17:19:01 -0700,Configuring the name displayed in the To header when reading a message,"<p>Hello all, </p><p>Here is my environment. </p><p>Thunderbird 128.9.2esr (64-bit) running on Windows 10 Home, version 22H2 (with current patches). </p><p>I have both a Gmail account, and a Yahoo mail account. I've connected Thunderbird to both accounts. Recently, I made a configuration change somewhere in Thunderbird, and it asked me for my ""full name."" I put it in, not thinking it would change how incoming emails are displayed because under General-&gt;Settings-&gt;Message List, I have the ""Full name and email address"" option checked. </p><p>However, for both Gmail and Yahoo, I only see that ""full name"" that I put into my settings when I read an email message. It does not show the actual name (if any) that is in the email header, nor does it show the email address. Basically, the To header in the incoming message is ignored. </p><p>I've checked the account settings for both Gmail and Yahoo. Default Identity-&gt;Your Name, hasn't changed for either account. Both names are different from the ""full name"" that I put in recently. I'd like for Thunderbird to show the actual To header for both accounts. </p><p>Does anyone know hot to fix this? </p><p>Thanks in advance. </p><p>Robert Orosz </p>",thunderbird;email-and-messaging;,thunderbird,email-and-messaging,en-US,"",rdo80241
1507376,2025-04-21 18:03:52 -0700,2025-04-21 18:03:52 -0700,My thunderbird email disappeared,"<p>It had too much in it, but I was erasing a lot and it didn't help. Then it was suddenly gone. I've had it for many years. I reset the password, but the solutions were very confusing and I need help. They are still showing up on my phone. Thanks Carol </p>",thunderbird;email-and-messaging;,thunderbird,email-and-messaging,en-US,"",CarolAdams1
1507391,2025-04-21 21:43:39 -0700,2025-04-21 23:16:36 -0700,Spar map,"<p>Hallo, Sinds enkele weken verdwijnen gewone berichten van mensen die me al jaren mailen, in de spam map. Erg lastig, want er liep al een en ander mis .. </p><p>Kan ik de spam map gewoon verwijderen?  Wat gebeurt er in dat geval met mails die anders in de spam map zouden verdwijnen? Bovendien geeft die map niet aan of er berichten in zitten. </p><p>Bedankt! </p><p>Thunderbird in Windows 11 </p>",thunderbird;email-and-messaging;,thunderbird,email-and-messaging,nl,1727363;,wulp
1507407,2025-04-22 00:26:06 -0700,2025-04-22 00:26:06 -0700,Beheren van ongewenste berichten,"<p>Goede morgen, Ik ben Jos Janssens, mijn mailadres is 'jos.janssens@pandora.be' </p><p>Bij het aanvinken van 'ongewenst' worden de mails automatisch verplaatst naar de map 'ongewenst'. Daar worden ze na 31 dagen verwijderd. Dit omdat ik heel veel spam krijg en de map onoverzichtelijk vol geraakt. </p><p>Mijn vraag luidt: Bestaat er ergens een lijst van (alle) afzenders die ooit door mij als 'ongewenst' werden aangevinkt? Dit om te kunnen opzoeken of er bepaalde afzenders door mij ten onrechte werden aangevinkt en deze fout te kunnen herstellen? </p><p>Bij voorbaat dank voor uw antwoord. Jos Janssens </p>",thunderbird;privacy-and-security_1;,thunderbird,privacy-and-security,nl,"",jos.janssens4
1507413,2025-04-22 01:23:13 -0700,2025-04-22 01:23:13 -0700,Deleted Thunderbird Folders.,<p>While using Czkawka I deleted my email profile and hence most of the folders disappeared. How can they be recovered.  Linux Mint ver 21.3 Ted </p>,thunderbird;email-and-messaging;,thunderbird,email-and-messaging,en-US,"",nerkfr
1507415,2025-04-22 02:10:53 -0700,2025-04-22 02:10:53 -0700,How to change from double line spacing to single spacing,<p>When I receive an email with double line spacing I can't find a way to alter this to single line spacing. I'd like to be able to change from one to the other at will. M </p>,thunderbird;settings;,thunderbird,settings,en-US,"",midascourt
1507416,2025-04-22 02:20:29 -0700,2025-04-22 02:20:29 -0700,fvfdv,<p>fdvrdgsrdgtgtdbbdbd </p>,thunderbird;accessibility;,thunderbird,accessibility,en-US,"",siddhu.phadke
