id,created,updated,locale,product,title,is_solved,solution,solved_by,is_spam,last_answer,answers,topic,tags,creator,content,involved,is_archived,is_locked,is_taken,metadata,num_answers,num_votes_past_week,num_votes,taken_until,taken_by,updated_by
1537788,2025-09-24 17:47:06 -0700,2025-09-24 19:03:58 -0700,en-US,thunderbird,Thunderbird screen presentation,false,,,false,1767174,1767162;1767172;1767174;,customization,thunderbird;customization;,k3pto,"<p>Windows 10 Pro went to a black screen while I was editing a file.  Thunderbird was running in the background.  I had to do a hard re-boot.  When I restarted Thunderbird, the Inbox presentation was different.  See the attached file.  How do I get the correct presentation back? </p><p>I tried bringing back a backup version of my profile (the whole folder tree).  The presentation was OK this time but emails were lost.  So, I brought back the corrupted(?) profile in order to get my recent emails. </p>",k3pto;mozilla98;,false,false,false,";useragent:Mozilla/5.0 (Windows NT 10.0; Win64; x64) AppleWebKit/537.36 (KHTML, like Gecko) Chrome/140.0.0.0 Safari/537.36;kb_visits_prior:[""/en-US/kb/how-change-thunderbird-layout""]",3,0,0,,,
1537792,2025-09-24 18:28:20 -0700,2025-09-26 10:10:01 -0700,en-US,thunderbird,Merging profiles?  (Help setting up profile from documents folder.),true,1767724,"{""username""=>""lanny2"", ""display_name""=>"""", ""avatar""=>""https://profile.accounts.firefox.com/v1/avatar/l""}",false,1767728,1767396;1767480;1767627;1767697;1767701;1767703;1767724;1767728;,profiles,thunderbird;profiles;,lanny2,"<p>HELP!!   </p><p>I am trying to move my Thunderbird profile (containing a huge number of mail files dating back to 1995!!) from a Windows 10 computer to a new Windows 11 computer.  My active profile has been kept in my Documents file (for easier automatic cloud backup).  I have spent days trying everything I can to make this work.  The best I can do is two profiles, one that can check mail, but contains no historic mail or files -- the other that has all my emails but won't connect with my server.  ""The following is a special account.""  ""There are no identities associated with it.""  I was wondering if I could merge these two profiles?  Or? </p><p>Any assistance will be greatly appreciated!!!!!!!! </p>",lanny2;davidsk;,false,false,false,";solver_id:7041349;useragent:Mozilla/5.0 (Windows NT 10.0; Win64; x64) AppleWebKit/537.36 (KHTML, like Gecko) Chrome/140.0.0.0 Safari/537.36;kb_visits_prior:[""/en-US/kb/profiles-where-thunderbird-stores-user-data""]",8,0,0,,,
1537800,2025-09-24 20:59:42 -0700,2025-09-25 04:17:01 -0700,en-US,thunderbird,preview plane on new email account,true,1767270,"{""username""=>""davidsk"", ""display_name""=>""david"", ""avatar""=>""https://firefoxusercontent.com/5eed5ecf74d9e1ec85435ea262bc016e""}",false,1767270,1767270;,email-and-messaging,thunderbird;email-and-messaging;,browncarolyn828,"<p>My old <a href=""http://q.com"" rel=""nofollow"">q.com</a> email account is going away.  The new <a href=""http://myctl.net"" rel=""nofollow"">myctl.net</a> inbox does not have a preview pane.  How do I get it back? </p>",browncarolyn828;davidsk;,false,false,false,;solver_id:6983242;useragent:Mozilla/5.0 (Windows NT 10.0; Win64; x64; rv:143.0) Gecko/20100101 Firefox/143.0,1,0,0,,,
1537807,2025-09-24 21:50:30 -0700,2025-09-25 10:10:17 -0700,en-US,thunderbird,i have just donated,true,1767382,"{""username""=>""Toad-Hall"", ""display_name""=>""Toad-Hall"", ""avatar""=>""https://firefoxusercontent.com/872eb8d7f6dcbcec1eb5a2e14bbde9fa""}",false,1767382,1767382;,undefined,thunderbird;undefined;,t.j.bunchuai,<p>I have just donated but still getting a DONATE reminder? </p>,t.j.bunchuai;Toad-Hall;,false,false,false,";solver_id:7051567;useragent:Mozilla/5.0 (Windows NT 10.0; Win64; x64) AppleWebKit/537.36 (KHTML, like Gecko) Chrome/140.0.0.0 Safari/537.36",1,0,0,,,
1537812,2025-09-24 22:24:58 -0700,2025-10-06 18:15:35 -0700,en-US,thunderbird,unable to send emails,true,1769994,"{""username""=>""Toad-Hall"", ""display_name""=>""Toad-Hall"", ""avatar""=>""https://firefoxusercontent.com/872eb8d7f6dcbcec1eb5a2e14bbde9fa""}",false,1770166,1767384;1769994;1770166;,send-and-receive-email,thunderbird;send-and-receive-email;,davewood4,<p>how do i fix the problem </p>,davewood4;Toad-Hall;,false,false,false,";solver_id:7051619;useragent:Mozilla/5.0 (Windows NT 10.0; Win64; x64) AppleWebKit/537.36 (KHTML, like Gecko) Chrome/140.0.0.0 Safari/537.36 Edg/140.0.0.0",3,0,0,,,
1537813,2025-09-24 22:33:12 -0700,2025-09-24 23:05:07 -0700,nl,thunderbird,Backup van bepaalde mails,false,,,false,1767205,1767205;,import-and-export-email,thunderbird;import-and-export-email;,glda19,<p>Hoe kan ik backup maken van een bepaalde map in de mailbox </p>,glda19;Mozilla-assistent;,false,false,false,";useragent:Mozilla/5.0 (Linux; Android 10; K) AppleWebKit/537.36 (KHTML, like Gecko) Chrome/140.0.0.0 Mobile Safari/537.36",1,0,0,,,
1537815,2025-09-24 22:59:02 -0700,2025-10-11 00:35:00 -0700,en-US,thunderbird,I have lost all of my email records and archived files after agreeing to compacting. Can I recover same please,false,,,false,1771242,1767381;1771242;,email-and-messaging,thunderbird;email-and-messaging;,president11,<p>I agreed to compact files on Tuesday evening and from Wednesday morning I have no emails or archive files. Can I restore same please </p>,president11;Toad-Hall;wsmwk;,false,false,false,";useragent:Mozilla/5.0 (Windows NT 10.0; Win64; x64) AppleWebKit/537.36 (KHTML, like Gecko) Chrome/140.0.0.0 Safari/537.36 Edg/140.0.0.0",2,0,1,,,
1537817,2025-09-24 23:32:36 -0700,2025-09-27 20:11:57 -0700,en-US,thunderbird,Thunderbird EDI messaging PKCS#7 argument error: malformed S/MIME encoded PKCS#7 object,false,,,false,1767982,1767982;,encryption,thunderbird;encryption;,user61594,<p>We are testing EDI messaging with a government department however it seems that Thunderbird keeps stripping the attachment before the email reaches the exchange and produces this error. </p><p>We sent 3 messages: </p><p>1. 2 had this error: PKCS#7 argument error: malformed S/MIME encoded PKCS#7 object  2. 1 had this error: no attachment on their end </p><p>PKI Certificate is installed in Thunderbird. </p>,user61594;MattAuSupport;,false,false,false,";useragent:Mozilla/5.0 (Windows NT 10.0; Win64; x64) AppleWebKit/537.36 (KHTML, like Gecko) Chrome/140.0.0.0 Safari/537.36",1,0,0,,,
1537818,2025-09-25 00:04:11 -0700,2025-09-25 09:46:32 -0700,en-US,thunderbird,Thunderbird from Mircosoft Store different to Thunderbird downloaded from Mozilla,true,1767269,"{""username""=>""davidsk"", ""display_name""=>""david"", ""avatar""=>""https://firefoxusercontent.com/5eed5ecf74d9e1ec85435ea262bc016e""}",false,1767373,1767269;1767360;1767373;,install,thunderbird;install;,Ulrich-Dieter.Schmidt,"<p>Yesterday I set up my Laptop with a new Windows 11 system from scratch. Then I installed Thunderbird from the Microsoft store and tried to paste the copied repository to the Profile Folder in %APPDATA%/Thunderbird/Profiles (as described <a href=""http://example.com"" rel=""nofollow"">here</a>). And was astonished - there was none. All the folders as described in the Thunderbird settings (e.g. Local Folder, Profile Folder etc) are still descibed within Thunderbird to be there - but werent. When I clicked on ""Open Folder"" in the ""Troubleshooting Information"" - Page - I got an error, that it is not there). </p><p>I had to delete Thunderbird and learned by that, it iis installed as an App - it cannot be removed as programs are removed. </p><p>So I am left with the question: How to migrate the repository of Thunderbird is installed as App from the Microsoft Store? Where are the data persisted? </p>",Ulrich-Dieter.Schmidt;davidsk;,false,false,false,;solver_id:7051758;useragent:Mozilla/5.0 (Windows NT 10.0; Win64; x64; rv:143.0) Gecko/20100101 Firefox/143.0,3,0,0,,,
1537821,2025-09-25 00:19:54 -0700,2025-10-01 12:38:17 -0700,en-US,thunderbird,Loss of access to Thunderbird Local Folders list and contents (bug1990571),false,,,false,1768937,1767364;1768937;,email-and-messaging,thunderbird;email-and-messaging;needsinfo;,BarickmanKen,"<p>Currently using Thunderbird v143.0.1 on a Windows 10 Pro desktop computer.  Since about 17 July 2025, I have not been able to access all of my Local Folders and/or content messages.  There are 39 primary local folders displayed with an additional 27 not displayed.  However, by navigating through the User AppData folder structure as follows: C:\Users\Ken\AppData\Roaming\Thunderbird\Profiles\k1fx5scw.default\Mail\Local Folders, I am able to see the missing folders and messages, just not able to access them from within Thunderbird. </p><p>Is my problem a Thunderbird setting value or have I run into a physical limitation of the application? </p>",BarickmanKen;Toad-Hall;wsmwk;,false,false,false,;useragent:Mozilla/5.0 (Windows NT 10.0; Win64; x64; rv:143.0) Gecko/20100101 Firefox/143.0,2,0,0,,,"{""username""=>""wsmwk"", ""display_name""=>""Wayne Mery"", ""avatar""=>""https://firefoxusercontent.com/3f0645137479a481e67f7fb3ff1d945b""}"
1537831,2025-09-25 01:08:02 -0700,2025-09-25 18:55:14 -0700,en-US,thunderbird,Thunderbird only downloads about 100 of my 1000s of emails,false,,,false,1767501,1767312;1767485;1767501;,send-and-receive-email,thunderbird;send-and-receive-email;,mrstaemin7,"<p>I've installed Thunderbird on a new laptop after the old one died. I need to download all the emails on the server, but Thunderbird only snags about 100 of them. Under Account Settings &gt; Synchronization &amp; Storage &gt; Disk Space, ""Synchronize all messages locally regardless of age"" is selected. </p>",mrstaemin7;wsmwk;MattAuSupport;,false,false,false,";useragent:Mozilla/5.0 (Windows NT 10.0; Win64; x64; rv:143.0) Gecko/20100101 Firefox/143.0;kb_visits_prior:[""/en-US/kb/faq-changing-imap-pop""]",3,0,0,,,
1537834,2025-09-25 01:35:14 -0700,2025-09-26 09:21:54 -0700,en-US,thunderbird,Thunderbird add-ons backup,true,1767368,"{""username""=>""davidsk"", ""display_name""=>""david"", ""avatar""=>""https://firefoxusercontent.com/5eed5ecf74d9e1ec85435ea262bc016e""}",false,1767713,1767234;1767319;1767345;1767354;1767368;1767427;1767712;1767713;,extensions,thunderbird;extensions;,software-ff,"<p>Do add-on settings get backed up when backing up a profile? I always have to manually install my add-ons when reinstalling a profile. I have one add-on that is a pain to set back up (Identity  Chooser), and I have assumed the settings for it are lost. </p>",software-ff;Mapenzi;davidsk;,false,false,false,;solver_id:4986397;useragent:Mozilla/5.0 (Windows NT 10.0; Win64; x64; rv:143.0) Gecko/20100101 Firefox/143.0,8,0,0,,,
1537835,2025-09-25 01:37:52 -0700,2025-09-25 04:30:35 -0700,it,thunderbird,email,false,,,false,1767273,1767273;,send-and-receive-email,firefox-14301;firefox-1430;windows-11;thunderbird;send-and-receive-email;needsinfo;,castmond,<p>firefox scarica le email solo fino a giuugno 2025 </p>,castmond;@next;,false,false,false,;useragent:Mozilla/5.0 (Windows NT 10.0; Win64; x64; rv:143.0) Gecko/20100101 Firefox/143.0;ff_version:143.0.1;os:Windows 11,1,0,0,,,
1537838,2025-09-25 02:16:04 -0700,2025-09-25 04:32:14 -0700,it,thunderbird,mail impossible to send,true,1767274,"{""username""=>""@next"", ""display_name""=>""next"", ""avatar""=>""https://firefoxusercontent.com/087aa6840d6b13774b464f2b88a7d23b""}",false,1767274,1767274;,send-and-receive-email,thunderbird;send-and-receive-email;,daniele26,"<p>For the past few minutes, I haven't been able to send emails from any of my four accounts. This message always pops up. See picture attached </p><p>It's only a problem with Thunderbird because if I send emails from the Gmail website, they go through fine. </p><p>Thanks a lot </p>",daniele26;@next;,false,false,false,;solver_id:7052080;useragent:Mozilla/5.0 (Windows NT 10.0; Win64; x64; rv:143.0) Gecko/20100101 Thunderbird/143.0.1,1,0,0,,,
1537847,2025-09-25 03:20:22 -0700,2025-09-25 19:35:59 -0700,es,thunderbird,"Trheads, automatic expansion",true,1767515,"{""username""=>""pcp04"", ""display_name""=>""GerardoPcp04"", ""avatar""=>""https://firefoxusercontent.com/9a858e240d93a30ef1c57f20344ce89b""}",false,1767515,1767515;,customization,thunderbird;customization;,justofersan,"<p>Hello Thunderbird Team, It would be great to have an option to completely disable automatic conversation expansion when returning to the inbox or switching folders. Currently, this behavior is inconvenient, as there's no way in the settings to keep conversations collapsed or as they were. Please include this in future updates! Thanks for listening to the community </p>",justofersan;pcp04;,false,false,false,";solver_id:7052221;useragent:Mozilla/5.0 (Linux; Android 10; K) AppleWebKit/537.36 (KHTML, like Gecko) Chrome/140.0.0.0 Mobile Safari/537.36",1,0,0,,,
1537851,2025-09-25 04:32:45 -0700,2025-09-25 04:32:45 -0700,en-US,thunderbird,Can't import accounts from Outlook desktop (MS365),false,,,false,,"",import-and-export-settings,thunderbird;import-and-export-settings;,rsbrux,"<p>The import tool offers to import accounts and settings from Outlook, but runniing it fails to import any of the 8 accounts I have configured. 7 of the accounts are IMAP/SMTP, one is a Google Workspace (GWS) account synchronized via GWSMO. Import Accounts and Settings finishes instantly with no error messages but imports nothing. Import Address Books takes longer but appears to import all contacts regardless of source in Outlook into one local address book. There is no differentiation between the GWS address book and the various local address books configured in Outlook. The Import Calendar option is disabled. Import Mail Messages hung but seemed to import at least all local message folders as well as the GWS mail messages. Thunderbird is 143.0.1 (32-bit) running under Windows Pro x64 22H2. </p>",rsbrux;,false,false,false,;useragent:Mozilla/5.0 (Windows NT 10.0; Win64; x64; rv:143.0) Gecko/20100101 Firefox/143.0,0,0,0,,,
1537860,2025-09-25 05:19:20 -0700,2025-10-29 08:07:06 -0700,it,thunderbird,suggerimento automatico inserimento parola,false,,,false,1775629,1767293;1775629;,customization,thunderbird;customization;,a.rotella,"<p>Buongiorno pur avendo disabilitato i controlli ortografici, o meglio, pur non avendoli mai attivati,  quando digito una declinazione del verbo ""arrivare"", Thunderbird mi suggerisce l'inserimento della frase  ""Sto Arrivando!."". Schiacciando quindi spazio o invio per completare normalmente il mio messaggio, Thunderbird recepisce il comando per accettare il suggerimento, anche se non voglio. Vedi screenshot. come posso risolvere? </p>",a.rotella;@next;jakabjulia;,false,false,false,";useragent:Mozilla/5.0 (Macintosh; Intel Mac OS X 10_15_7) AppleWebKit/537.36 (KHTML, like Gecko) Chrome/140.0.0.0 Safari/537.36",2,0,1,,,
1537862,2025-09-25 05:26:34 -0700,2025-09-25 08:53:45 -0700,en-US,thunderbird,switch between upper and lower case with Shift+F3,false,,,false,1767351,1767346;1767351;,customization,thunderbird;customization;,bn1,"<p>Is it possible to switch between upper and lower case with Shift+F3, as you can in Outlook and Word? </p>",bn1;Toad-Hall;,false,false,false,";useragent:Mozilla/5.0 (Windows NT 10.0; Win64; x64) AppleWebKit/537.36 (KHTML, like Gecko) Chrome/140.0.0.0 Safari/537.36",2,0,0,,,
1537863,2025-09-25 05:30:42 -0700,2025-09-25 07:25:20 -0700,en-US,thunderbird,translate text in email into Danish without having to copy and paste into Web Translate,false,,,false,1767325,1767316;1767325;,languages,thunderbird;languages;,bn1,<p>Can you translate text in email into Danish without having to copy and paste into Web Translate? </p>,bn1;Agentvirtuel;,false,false,false,";useragent:Mozilla/5.0 (Windows NT 10.0; Win64; x64) AppleWebKit/537.36 (KHTML, like Gecko) Chrome/140.0.0.0 Safari/537.36",2,0,1,,,
1537864,2025-09-25 05:33:20 -0700,2025-09-25 08:00:30 -0700,en-US,thunderbird,The activity bar at the bottom of the window is missing.,true,1767339,"{""username""=>""christ1"", ""display_name""=>""christ1"", ""avatar""=>""https://profile.accounts.firefox.com/v1/avatar/c""}",false,1767339,1767297;1767333;1767339;,customization,thunderbird;customization;,dshoemann,<p>The activity bar was there and disappeared.  I can't retrieve it. </p>,dshoemann;mozilla98;christ1;,false,false,false,";solver_id:6189825;useragent:Mozilla/5.0 (Macintosh; Intel Mac OS X 10_15_7) AppleWebKit/537.36 (KHTML, like Gecko) Chrome/135.0.0.0 Safari/537.36 OPR/120.0.0.0",3,0,0,,,
1537866,2025-09-25 06:19:04 -0700,2025-09-29 09:17:28 -0700,en-US,thunderbird,thunderbird account corrupted Ghost Files - how to repair,false,,,false,1768389,1767365;1767411;1767895;1768389;,profiles,thunderbird;profiles;,paola11,"<p>Hi, I’m using an IMAP account in Thunderbird and connecting to a Microsoft Exchange server. </p><p>I've done several tests and it seems like my account might be corrupted. When I try to move or delete a folder in Thunderbird, it doesn’t work — the folder name appears in italics. Also when I rename a folder, it creates another on in italics </p><p>I also tried moving a folder directly on the Exchange server. But when I reopened Thunderbird, the folder didn’t appear in its new location. Instead, it stayed in the same place, showed up in italics, and the emails inside were missing. Fortunately, the emails weren’t deleted — they’re still in the folder, but only visible from the Exchange server. </p><p>Here are the anomalies I’ve noticed: </p><p>- There are two profile folders in the data directory - I have two trash folders: one labeled ""Deleted Items"" and another local folder called ""Corbeille"" - I see multiple ghost folders with no emails inside but only in thunderbird app in the laptop, I've got no problem in android app. </p><p>And here are the screenshots </p>",paola11;Toad-Hall;,false,false,false,";useragent:Mozilla/5.0 (Windows NT 10.0; Win64; x64) AppleWebKit/537.36 (KHTML, like Gecko) Chrome/140.0.0.0 Safari/537.36;kb_visits_prior:[""/fr/kb/gestionnaire-profils-creer-supprimer-thunderbird""]",4,0,1,,,
1537872,2025-09-25 06:33:01 -0700,2025-09-30 16:07:11 -0700,en-US,thunderbird,thunderbird　143.0.1にバージョンアップしたら、エラーメッセージが出て起動しなくなりました。,true,1768694,"{""username""=>""wsmwk"", ""display_name""=>""Wayne Mery"", ""avatar""=>""https://firefoxusercontent.com/3f0645137479a481e67f7fb3ff1d945b""}",false,1768694,1767389;1767647;1768694;,app-crash,thunderbird;app-crash;,yoshihironose54,<p>エラーメッセージ「Thunderbirdは起動していますが応答しません。新しいウィンドウを開くには、既存のThunderbirdプロセスを終了させなければなりません。」　が出て起動できなりました。ネットを参考に・システムの再起動やトラブルシューティングモード起動など試してみましたが、同じ結果でした。 これまでThunderbirdを利用させてもらって、大変助かっており皆様には感謝いたしております。今回は初めてのトラブルでほとほと困っております。 どなたか対処方法や参考になるサイトなどがありましたら、お教え願いますでしょうか。よろしくお願いいたします。 </p>,yoshihironose54;sfhowes;wsmwk;,false,false,false,";solver_id:7052558;useragent:Mozilla/5.0 (Windows NT 10.0; Win64; x64) AppleWebKit/537.36 (KHTML, like Gecko) Chrome/140.0.0.0 Safari/537.36 Edg/140.0.0.0",3,0,0,,,
1537875,2025-09-25 07:09:28 -0700,2025-09-28 02:22:54 -0700,en-US,thunderbird,Thunderbird - cannot save email attachments locally,false,,,false,1768033,1767978;1768006;1768033;,attachments,thunderbird;attachments;,mephared,"<p>Dear Community, </p><p>I just encountered the following issue with Thunderbird after installting the tool on my new laptop: When I click ""save"" in an email with an attachment, the ""Save attachment"" window pops up and I can browse to a local folder. But when I click ""Save"" and then check the corresponding folder, nothing has been saved. </p><p>I've searched the Thunderbird Settings menu up and down for a setting/option that will fix this issue, but I couldn't find one. </p><p>I've been using Thunderbird for many years, and I've never come across this issue before. I'm at my wits' end, so I'm hoping for your support! </p>",mephared;MattAuSupport;Mad_Maks;,false,false,false,";useragent:Mozilla/5.0 (Windows NT 10.0; Win64; x64) AppleWebKit/537.36 (KHTML, like Gecko) Chrome/140.0.0.0 Safari/537.36 Edg/140.0.0.0",3,0,8,,,
1537879,2025-09-25 07:47:14 -0700,2025-09-25 09:43:14 -0700,it,thunderbird,"quando cerco di aggiungere un account mail, dopo aver inserito il nome e la mail inizia un caricamento infinito che blocca il programma e non porta da nessuna parte",false,,,false,1767369,1767369;,app-crash,thunderbird;app-crash;,filippo9,"<p>quando cerco di aggiungere un account mail, dopo aver inserito il nome e la mail inizia un caricamento infinito che blocca il programma e non porta da nessuna parte </p>",filippo9;@next;,false,false,false,";useragent:Mozilla/5.0 (Windows NT 10.0; Win64; x64) AppleWebKit/537.36 (KHTML, like Gecko) Chrome/140.0.0.0 Safari/537.36",1,0,0,,,
1537895,2025-09-25 08:41:52 -0700,2025-10-01 10:32:33 -0700,en-US,thunderbird,Failure to set up my outlook.com email address in version 143.0.1 (default release),true,1767385,"{""username""=>""sfhowes"", ""display_name""=>""sfhowes"", ""avatar""=>""https://firefoxusercontent.com/c92a42cdab68b73a39b7e6b5bde36e39""}",false,1768904,1767385;1768695;1768700;1768704;1768707;1768708;1768762;1768904;,send-and-receive-email,thunderbird;send-and-receive-email;,brian290,"<p>My friend was unable to configure his <a href=""http://outlook.com"" rel=""nofollow"">outlook.com</a> email address in Thunderbird (143.0.1) while I had no problem doing so in mine (140.3.0esr). We both had installed other email addresses already configured with no problem. I upgraded my second laptop from the esr version to his recommended release version, and hey presto, I suffered the same fate. This is definitely a bug within Thunderbird 143.0.1 which is the current release version. </p><p>I had not previously added the outlook email to Tbird as it is not my main email address. </p><p>More info: The error message encountered was: </p><p>Authentication failed: Please check the username and password </p><p>When you click on the ""More information"" link, it says: </p><p>""Exchange auth error"" </p><p>Please note that we checked the username and password and verified them as correct. I addition, I was successful using that username/password on the 140 esr version and it worked perfectly. </p>",brian290;sfhowes;wsmwk;,false,false,false,;solver_id:5300113;useragent:Mozilla/5.0 (Windows NT 10.0; Win64; x64; rv:143.0) Gecko/20100101 Firefox/143.0,8,0,4,,,
1537896,2025-09-25 08:42:05 -0700,2025-10-01 03:58:27 -0700,en-US,thunderbird,some accounts missing,false,,,false,1768793,1767366;1768629;1768641;1768793;,account-management,thunderbird;account-management;,tekaham,<p>I'm running Thundrbird 143.0.1 on windows 11 pro PC Today find that only one of my 3 accounts is listed Also only the inbox is showing </p><p>suggestions please </p>,tekaham;davidsk;,false,false,false,";useragent:Mozilla/5.0 (Windows NT 10.0; Win64; x64) AppleWebKit/537.36 (KHTML, like Gecko) Chrome/140.0.0.0 Safari/537.36",4,0,0,,,
1537899,2025-09-25 08:49:53 -0700,2025-09-25 11:39:44 -0700,nl,thunderbird,"balk met verzenden, bijlage etc verdwenen. Hoe krijg ik die weer terug?",false,,,false,1767412,1767412;,customization,thunderbird;customization;,roodenbu,"<p>Balk met verzenden, bijlage etc is verdwenen. Hoe op te lossen? </p>",roodenbu;Mad_Maks;,false,false,false,";useragent:Mozilla/5.0 (Windows NT 10.0; Win64; x64) AppleWebKit/537.36 (KHTML, like Gecko) Chrome/140.0.0.0 Safari/537.36",1,0,1,,,
1537900,2025-09-25 08:52:48 -0700,2025-09-25 10:31:37 -0700,en-US,thunderbird,Impossible d'envoyer un mail mais pas de souci pour recevoir,false,,,false,1767393,1767393;,junk-mail-and-spam,thunderbird;junk-mail-and-spam;,bjmlameyse,"<p>Message d'erreur suivant Client host rejected by spamhaus for spamming issues; please refer to Listed by XBL,see <a href=""https://check.spamhaus.org/query/ip/78.113.132;87"" rel=""nofollow"">https://check.spamhaus.org/query/ip/78.113.132;87</a> for further information </p>",bjmlameyse;davidsk;,false,false,false,";useragent:Mozilla/5.0 (Windows NT 10.0; Win64; x64) AppleWebKit/537.36 (KHTML, like Gecko) Chrome/140.0.0.0 Safari/537.36",1,0,0,,,
1537903,2025-09-25 09:08:08 -0700,2025-09-28 07:37:05 -0700,en-US,thunderbird,Why is TB duplicating local folders that cannot be deleted?,true,1768073,"{""username""=>""wsmwk"", ""display_name""=>""Wayne Mery"", ""avatar""=>""https://firefoxusercontent.com/3f0645137479a481e67f7fb3ff1d945b""}",false,1768090,1767415;1767426;1767977;1768058;1768072;1768073;1768090;,account-management,thunderbird;account-management;,ke4avb,<p>Why is TB duplicating local folders and then why I can't delete those duplicates. The only valid one is the highlighted one in the attach image. </p><p>And the message filter are not working properly? </p><p>Win10Pro </p>,ke4avb;davidsk;MattAuSupport;wsmwk;,false,false,false,;solver_id:668715;useragent:Mozilla/5.0 (Windows NT 10.0; Win64; x64; rv:143.0) Gecko/20100101 Firefox/143.0,7,0,2,,,"{""username""=>""wsmwk"", ""display_name""=>""Wayne Mery"", ""avatar""=>""https://firefoxusercontent.com/3f0645137479a481e67f7fb3ff1d945b""}"
