id,question_id,created,updated,content,creator,is_spam,num_helpful,num_unhelpful
1734737,1512762,2025-05-20 04:36:36 -0700,2025-05-20 04:36:36 -0700,"<p>""Delete"" is a powerful verb. You can check your account online and see if Gmail retained any of it in trash. Thunderbird does not do backups. </p>",davidsk,false,0,0
1734730,1512773,2025-05-20 03:07:27 -0700,2025-05-20 03:07:27 -0700,<p>What version are you using? Did the problem start exactly when you updated to that version? Do you have Thunderbird files or Thunderbird profile on a network drive? </p>,wsmwk,false,0,0
1734743,1512783,2025-05-20 05:02:26 -0700,2025-05-20 05:02:26 -0700,"<p>It may help to post screenshot of your incoming server settings pane to get possible feedback. deleting the profile is not necessary as that contains your addressbook and other settings. However, to locate your profile, click help&gt;troubleshootinginformation, scroll down to 'profile folder' and click 'open folder'.  I share that for your information, not as a suggestion to delete it. </p>",davidsk,false,0,0
1734752,1512783,2025-05-20 05:23:36 -0700,2025-05-20 05:23:36 -0700,"<p>Thanks David. Screenshot attached of settings. </p><p>For profile, the open folder prompt doesn't work. It gives an error. Also attached. </p><p>Dan </p>",dan307,false,0,0
1734738,1512787,2025-05-20 04:42:56 -0700,2025-05-20 04:42:56 -0700,"<p>Try this:: - change to table view if not already there. This is the view that shows columns, such as subject, from, date - click the icon on right of the top line in message list pane to add 'tags' column in the display - tag the desired message - click view&gt;sort by and set to tags  - now, click the tags column entry on bar at top of message list pane and the tagged item will appear at top.  </p><p>My suggestion was to use tags, but you can view the menu at view&gt;sort by and you may prefer another option, such as star or priority. </p>",davidsk,false,0,0
1734706,1512792,2025-05-20 01:24:03 -0700,2025-05-20 01:24:03 -0700,"<p>By the way, both the stable and beta releases have the same problem. That is unrelated. </p>",1070101572,false,0,0
1734736,1512793,2025-05-20 04:33:32 -0700,2025-05-20 04:33:32 -0700,"<p>First, reinstalling thunderbird accomplishes nothing, as thunderbird is not the issue. Try this: - click account settings&gt;synchronizaion&amp;storage for each account and set sync to just recent 30 days.  - next, exit thunderbird - in profile, in the imap\&lt;accountname&gt; folder for each account, DELETE the message folders and their msf entries.  - restart thunderbird, which will repopulate the folders with the new sync setting  - then, periodically compact the folders. That is what is causing space on PC to be bigger than space on server.  </p><p>The phone is a separate entity and has the same issues, but is not a cause of the space usage. </p>",davidsk,false,0,0
1734753,1512817,2025-05-20 05:29:03 -0700,2025-05-20 05:29:03 -0700,"<p>Voor de Nederlandstaligen: Ik heb op mijn laptop een nieuwe agenda aangemaakt in Thunderbird (netwerk) en deze gekoppeld aan de CalDAV-url van mijn NAS. Nu worden alleen de afspraken die ik in Thunderbird maak direct gesynchroniseerd met de NAS, maar Thunderbird download de items die al op de NAS staan ​​niet. Mijn andere pc met Outlook en mijn telefoon synchroniseren beide perfect in twee richtingen met de NAS. Welke instelling kan ik in Thunderbird wijzigen om de items die op de NAS staan ​​te downloaden? </p>",josvdh,false,0,0
1734742,1512820,2025-05-20 04:56:26 -0700,2025-05-20 04:56:26 -0700,"<p>Please send suggestions to <a href=""http://connect.mozilla.org"" rel=""nofollow"">connect.mozilla.org</a> and sign to the IDEAS section. Thank you for your interest . </p>",davidsk,false,1,0
1734746,1512820,2025-05-20 05:04:14 -0700,2025-05-20 05:04:14 -0700,<p>done! tks marvin </p>,v.martiello,false,0,0
