id,question_id,created,updated,content,creator,is_spam,num_helpful,num_unhelpful
1771485,1540778,2025-10-12 00:26:12 -0700,2025-10-12 00:26:12 -0700,"<p>It's misworded, but the Global Junk Preferences button goes to the right place: TB menu &gt; Privacy &amp; Security &gt; Junk. </p>",siffemoz,false,0,0
1771501,1540793,2025-10-12 03:34:07 -0700,2025-10-12 03:34:07 -0700,"<blockquote> I use Bitdefender, but it still happens with that off. </blockquote> <p>How did you turn it off? The only reliable method is to start <a href=""https://support&#46;microsoft&#46;com/help/12376/windows-10-start-your-pc-in-safe-mode"" rel=""nofollow"">Windows 10 in safe mode</a> with networking enabled. Still in Windows safe mode, start <a href=""https://support&#46;mozilla&#46;org/kb/safe-mode"" rel=""nofollow"">Thunderbird in troubleshooting mode</a>. Have you tried this? </p>",christ1,false,0,0
1771555,1540816,2025-10-12 08:31:51 -0700,2025-10-12 08:31:51 -0700,"<p>U heeft deze vraag ook in <a href=""https://support.mozilla.org/nl/questions/1540675"" rel=""nofollow"">https://support.mozilla.org/nl/questions/1540675</a> gesteld en daar is een antwoord gegegeven . ik sluit deze vraag </p>",Mad_Maks,false,0,0
1771552,1540818,2025-10-12 07:53:12 -0700,2025-10-12 07:53:12 -0700,"<p>You appear to have set up the account as IMAP. With IMAP, the account syncs to the server. What you see on the PC is a copy of what is on the server. When you delete from the PC, the account syncs to the server and deletes it there as well. This is not a thunderbird bug or unique process; it's how IMAP works. To do what you want, first COPY (not move) the message to local folders. Then, delete it. </p>",davidsk,false,0,0
1771558,1540818,2025-10-12 08:44:42 -0700,2025-10-12 08:44:42 -0700,"<p>So, canI change the account to POP?  If so, how?  And would that solve my problem? </p>",Philthy,false,0,0
1771556,1540823,2025-10-12 08:35:07 -0700,2025-10-12 08:35:07 -0700,"<p>krijgt u een foutmelding, wordt er iets gemeld in het filterlogboek als u de filter uitvoert? </p>",Mad_Maks,false,0,0
