id,created,updated,locale,product,title,is_solved,solution,solved_by,is_spam,last_answer,answers,topic,tags,creator,content,involved,is_archived,is_locked,is_taken,metadata,num_answers,num_votes_past_week,num_votes,taken_until,taken_by,updated_by
1534839,2025-09-10 06:52:33 -0700,2025-09-10 07:04:35 -0700,en-US,thunderbird,Thunderbird stuck in loop,true,1763289,"{""username""=>""wsmwk"", ""display_name""=>""Wayne Mery"", ""avatar""=>""https://firefoxusercontent.com/3f0645137479a481e67f7fb3ff1d945b""}",false,1763289,1763289;,customization,thunderbird;customization;,team39,"<p>Thunderbird won’t auto-configure Fastmail for my domain (stuck in autodiscovery loop / overwrites SMTP) </p> <ul><li><ul><li>Summary:** After moving our domain from Google Workspace to Fastmail, Thunderbird still tries old/incorrect settings when adding accounts. One mailbox adds, others fail. I need true **auto-config** for all users (no manual server entry). </li></ul> </li></ul> <p>--- </p><pre>Environment </pre> <ul><li> **Client:** Thunderbird for macOS (current stable, 2025 UI) </li><li> **OS:** macOS (Apple Silicon) </li><li> **Mail provider (now):** Fastmail </li><li> **Domain:** custom domain (previously hosted on Google Workspace, now on Fastmail) </li></ul> <p>--- </p> <ol><li><ol><li> What changed </li></ol> </li></ol> <ul><li> Domain email hosting migrated from Google Workspace → Fastmail. </li><li> DNS updated: MX/SPF/DKIM/DMARC all pointing to Fastmail. </li><li> Added autoconfig/autodiscover CNAMEs to Fastmail. </li></ul> <ul><li><ul><li>Current DNS of note** </li></ul> </li></ul> <p>``` MX: </p><pre> 10 <a href=""http://in1-smtp.messagingengine.com"" rel=""nofollow"">in1-smtp.messagingengine.com</a>  20 <a href=""http://in2-smtp.messagingengine.com"" rel=""nofollow"">in2-smtp.messagingengine.com</a> </pre> <p>CNAME: </p><pre> autoconfig.&lt;domain&gt;   → <a href=""http://autoconfig.fastmail.com"" rel=""nofollow"">autoconfig.fastmail.com</a>  autodiscover.&lt;domain&gt; → <a href=""http://autoconfig.fastmail.com"" rel=""nofollow"">autoconfig.fastmail.com</a> </pre> <p>SPF (TXT): </p><pre> v=spf1 include:<a href=""http://spf.messagingengine.com"" rel=""nofollow"">spf.messagingengine.com</a>&nbsp;?all </pre> <p>DKIM: </p><pre> fm1/fm2/fm3 selectors pointing to *.dkim.fmhosted.com </pre> <p>DMARC: </p><pre> v=DMARC1; p=reject; adkim=r; aspf=r; rua=... </pre> <p>``` </p><p>Testing autoconfig directly in browser (e.g. `<a href=""https://autoconfig.fastmail.com/mail/config-v1.1.xml?emailaddress=user@domain"" rel=""nofollow"">https://autoconfig.fastmail.com/mail/config-v1.1.xml?emailaddress=user@domain</a>`) returns Fastmail’s correct IMAP/SMTP XML. </p><p>--- </p> <ol><li><ol><li> The problem (repeatable) </li></ol> </li></ol> <p>1. In **Account Hub**, enter any address at the domain. 2. The dialog sits on **“Looking up configuration”** (spinning). Sometimes it shows **Configure manually**. 3. If reaching Outgoing settings and pressing **Test**, Thunderbird **overwrites** the SMTP I typed (`<a href=""http://smtp.fastmail.com"" rel=""nofollow"">smtp.fastmail.com</a>`) with **`smtp.&lt;domain&gt;`** (wrong) and then fails at the end. 4. For some accounts, Thunderbird shows: </p><pre>  ```   Authentication error.   Component returned failure code: 0x80550014 [nsIMsgIncomingServer.verifyLogon]   ``` </pre> <p>5. One mailbox **does** add successfully. Additional mailboxes (real Fastmail mailboxes with their own App Passwords) **do not**, even though IMAP/SMTP login works in other clients. </p> <ul><li><ul><li>Why manual config doesn’t solve it:** I need a repeatable **auto-config** experience for multiple staff machines and future hires. Manually entering server details isn’t viable, and Thunderbird’s “Test” step keeps overriding anyway. </li></ul> </li></ul> <p>--- </p> <ol><li><ol><li> What I’ve already tried </li></ol> </li></ol> <ul><li> Verified DNS (see above) and confirmed propagation. </li><li> Confirmed each user is a **real Fastmail mailbox** (not alias), IMAP enabled, App Password generated. </li><li> In Thunderbird: </li></ul> <pre> * Cleared Saved Passwords.  * Removed/re-added accounts.  * Used Advanced Config to hard-set `<a href=""http://imap.fastmail.com:993"" rel=""nofollow"">imap.fastmail.com:993</a> SSL/TLS` and `<a href=""http://smtp.fastmail.com:465"" rel=""nofollow"">smtp.fastmail.com:465</a> SSL/TLS`. Thunderbird still overwrites SMTP on test. </pre> <ul><li> Nuked local state: </li></ul> <pre> * Deleted `~/Library/Thunderbird/` (profiles, installs.ini, profiles.ini).  * Cleared Keychain items for imap/smtp/domain.  * Flushed macOS DNS cache. </pre> <ul><li> After reset, one mailbox adds via auto-config, but others still fail or get SMTP swapped. </li></ul> <p>--- </p> <ol><li><ol><li> What I’m asking the community for </li></ol> </li></ol> <p>1. **How to force Thunderbird to always use the domain autoconfig (CNAME to Fastmail) and never overwrite with its own probe?** </p><pre>  * Is there an about\:config pref to disable the probe/replace behavior during SMTP test?   * Can Thunderbird be told to prioritize domain autoconfig and skip ISPDB/MX guessing entirely? </pre> <p>2. **How to fully clear Thunderbird’s cached provider/domain configs.** </p><pre>  * Beyond deleting `~/Library/Thunderbird` and Keychain, are there other places Thunderbird stores provider data? </pre> <p>3. **Logging/diagnostics.** </p><pre>  * Which logging prefs/console settings show: </pre> <pre>    * What URLs Thunderbird queries (autoconfig, ISPDB, MX/SRV)     * Why SMTP is being swapped back to `smtp.&lt;domain&gt;`   * I can share logs if told exactly what to enable. </pre> <p>4. **Best-practice for Fastmail domains in Thunderbird.** </p><pre>  * Given DNS already points autoconfig/autodiscover to Fastmail, is it better to host our own `mail/config-v1.1.xml` at `autoconfig.&lt;domain&gt;` instead of CNAME, to stop fallback loops? </pre> <p>--- </p> <ol><li><ol><li> Goal / Constraints </li></ol> </li></ol> <ul><li> Need a **zero-touch, auto-config** experience for all domain users (each with their own Fastmail mailbox + App Password). </li><li> No manual server typing. </li><li> No SMTP being silently replaced during “Test.” </li><li> Looking for a definitive way to make Thunderbird trust/use domain autoconfig every time. </li></ul> <p>Thanks for any guidance, prefs to flip, or diagnostic steps to pinpoint why Thunderbird keeps reverting SMTP and why only the first mailbox adds cleanly. </p>",team39;wsmwk;,false,false,false,";solver_id:7015606;useragent:Mozilla/5.0 (Macintosh; Intel Mac OS X 10_15_7) AppleWebKit/537.36 (KHTML, like Gecko) Chrome/140.0.0.0 Safari/537.36",1,0,0,,,"{""username""=>""team39"", ""display_name""=>""Team Aralyx"", ""avatar""=>""https://profile.accounts.firefox.com/v1/avatar/T""}"
1534845,2025-09-10 07:54:57 -0700,2025-09-10 07:54:57 -0700,pt-BR,thunderbird,Versões antigas puxando a versão Release,false,,,false,,"",account-management,thunderbird;account-management;,maite.b,"<p>Bom dia! Gostaria de informar que a versão Release está apresentando problemas ao adicionar mais uma conta de e-mail. Além disso, as versões mais antigas (Daily e Beta), ao adicionar um segundo e-mail, abre a tela pop-up como o da versão Release, e apresentando erro. Ao preencher os campos ""nome"" e ""e-mail"" fica travado na tela de carregamento. </p>",maite.b;,false,false,false,";useragent:Mozilla/5.0 (Windows NT 10.0; Win64; x64) AppleWebKit/537.36 (KHTML, like Gecko) Chrome/135.0.0.0 Safari/537.36 OPR/120.0.0.0",0,0,0,,,
1534853,2025-09-10 08:50:40 -0700,2025-09-11 06:59:11 -0700,en-US,thunderbird,Thunderbird can't connect to Yahoo email server,true,1763550,"{""username""=>""mk869"", ""display_name""=>"""", ""avatar""=>""https://profile.accounts.firefox.com/v1/avatar/m""}",false,1763550,1763382;1763461;1763467;1763550;,connectivity,thunderbird;connectivity;,mk869,"<p>After years of working flawlessly today I turn on my computer, start Thunderbird and see the following Alert pop up- </p><p>""An error occurred during a connection to <a href=""http://pop.bizmail.yahoo.com:995"" rel=""nofollow"">pop.bizmail.yahoo.com:995</a> </p><p>Peer reports incompatible or unsupported protocol version </p><p>(Error code: ssl_error_protocol_version_alert)"" </p><p>I click on OK and the same message pops up another 3 times (Thunderbird is managing 4 email addresses for my business, hosted on Yahoo email). </p><p>I called my website host and they tell me it is nothing on their side. No changes were made overnight. </p><p>Where should I begin? </p>",mk869;MichelT;,false,false,false,;solver_id:3729926;useragent:Mozilla/5.0 (Windows NT 10.0; Win64; x64; rv:142.0) Gecko/20100101 Firefox/142.0,4,0,0,,,
1534859,2025-09-10 09:12:09 -0700,2025-09-10 09:12:09 -0700,en-US,thunderbird,Email,false,,,false,,"",accessibility,thunderbird;accessibility;,njl1982,"<p>I would like to know how to make the text darker in my thunderbird email, I had to buy a new computer for windows 11 and the text is very light.  Thanks for any help. </p>",njl1982;,false,false,false,";useragent:Mozilla/5.0 (Macintosh; Intel Mac OS X 10_15_7) AppleWebKit/605.1.15 (KHTML, like Gecko) Version/18.3 Safari/605.1.15 Ddg/18.6",0,0,0,,,
1534861,2025-09-10 09:25:12 -0700,2025-09-10 09:34:24 -0700,en-US,thunderbird,gmail account doesn't connect,false,,,false,,"",send-and-receive-email,thunderbird;send-and-receive-email;,carolarohner,"<p>Hi all, I've had 2 gmail accounts set up on my windows PC and I also have them now on my Thunderbird android, actually 2 mobiles and on my laptop. Both worked fine. I haven't used my PC since May, and now I saw that since then Thunderbird won't download my mails. (But only on that one gmail account - not on the other one)   Now, I've changed my password with google, adapted it and on the mobile it works perfect - but not on my PC. So - I've deleted the one, set it up again, (it's the same as the other gmail settings) but it doesn't work. (screenshot) I also deleted google access to thunderbird (thought maybe there is an old password in or so) and in the mobile it set up a new access without problems (Thunderbird Freeyour Inbox) ... ... but still nothing is happening on the PC set up. anything else I can try?  Thanks for any advise or help, Caro </p>",carolarohner;,false,false,false,;useragent:Mozilla/5.0 (Windows NT 10.0; Win64; x64; rv:142.0) Gecko/20100101 Firefox/142.0,0,0,0,,,"{""username""=>""carolarohner"", ""display_name""=>""Caro"", ""avatar""=>""https://profile.accounts.firefox.com/v1/avatar/C""}"
1534871,2025-09-10 09:45:40 -0700,2025-09-10 10:34:00 -0700,en-US,thunderbird,Thunderbird,false,,,false,1763370,1763370;,languages,thunderbird;languages;,Michael.Schellberg37,<p>Kann ich e-mails mit englischem Text in meine deutsche Sprache im Programm übersetzen? Was muss ich tun? </p>,Michael.Schellberg37;sfhowes;,false,false,false,";useragent:Mozilla/5.0 (Windows NT 10.0; Win64; x64) AppleWebKit/537.36 (KHTML, like Gecko) Chrome/139.0.0.0 Safari/537.36",1,0,0,,,
1534874,2025-09-10 09:50:24 -0700,2025-09-10 09:50:24 -0700,en-US,thunderbird,connecting to server,false,,,false,,"",send-and-receive-email,thunderbird;send-and-receive-email;,dbarkley71,<p>message appears saying server doesnt reconize my account so new email is coming in all of a sudden </p>,dbarkley71;,false,false,false,";useragent:Mozilla/5.0 (Windows NT 10.0; Win64; x64) AppleWebKit/537.36 (KHTML, like Gecko) Chrome/140.0.0.0 Safari/537.36;kb_visits_prior:[""/en-US/kb/faq-changing-imap-pop"", ""/en-US/kb/signatures""]",0,0,0,,,
1534876,2025-09-10 10:01:51 -0700,2025-09-14 02:37:32 -0700,en-US,thunderbird,Error on CALDAV calendar,false,,,false,1764217,1763380;1764217;,events,thunderbird;events;,theking2,"<p>An error occurred when writing to the calendar Verjaardagen! Please see below for more information. </p><p><br> If you're seeing this message after snoozing or dismissing a reminder and this is for a calendar you do not want to add or edit events for, you can mark this calendar as read-only to avoid such experience in future. To do so, get to the calendar properties by right-clicking on this calendar in the list in the calendar or task view. </p><p><br> The calendar is marked as read-only because it contains birthday's and reminders cannot be dismissed. </p><p>What is the proper way handle a anniversary calender and reminders? </p>",theking2;MichelT;,false,false,false,";useragent:Mozilla/5.0 (X11; Linux x86_64) AppleWebKit/537.36 (KHTML, like Gecko) Chrome/138.0.0.0 Safari/537.36",2,0,0,,,
1534879,2025-09-10 10:14:01 -0700,2025-09-10 10:59:52 -0700,it,thunderbird,problemi di invio delle e mail,false,,,false,1763378,1763378;,send-and-receive-email,thunderbird;send-and-receive-email;needsinfo;,info12966,"<p>Buonasera, è da un paio di giorni che non riesco più ad inviare le mail, mi da un errore nel certificato , ma comunque seguendo tutta la procedura per il risolvere il problema , non è cambiato nulla. chiedo la vostra assistenza. Cordiali Saluti Monaco Marco </p>",info12966;@next;,false,false,false,";useragent:Mozilla/5.0 (Windows NT 10.0; Win64; x64) AppleWebKit/537.36 (KHTML, like Gecko) Chrome/139.0.0.0 Safari/537.36",1,0,0,,,
1534880,2025-09-10 10:20:32 -0700,2025-09-16 08:34:19 -0700,en-US,thunderbird,"Oops I just marked all my messages as ""Read""...",true,1763790,"{""username""=>""Toad-Hall"", ""display_name""=>""Toad-Hall"", ""avatar""=>""https://firefoxusercontent.com/872eb8d7f6dcbcec1eb5a2e14bbde9fa""}",false,1764818,1763368;1763429;1763466;1763505;1763630;1763790;1764818;,send-and-receive-email,thunderbird;send-and-receive-email;,mikemtnbikes,"<p>I accidently marked all of the emails in my mailbox as 'read'.  FOrtunately I closed Tb before the change was applied to my server.  HOw can I restart Tb so it uses the server, not internal notes, for the read/unread state of my mailbox? </p>",mikemtnbikes;MichelT;Toad-Hall;,false,false,false,;useragent:Mozilla/5.0 (X11; Linux x86_64; rv:142.0) Gecko/20100101 Firefox/142.0;solver_id:1330982,7,0,1,,,
1534887,2025-09-10 10:37:26 -0700,2025-09-10 10:37:26 -0700,en-US,thunderbird,"Enregistrement tronqué du Dossier ""messages envoyés""",false,,,false,,"",send-and-receive-email,thunderbird;send-and-receive-email;,Jchmelchio,"<p>Bonsoir, J'utilise Thunderbird pour regrouper plusieurs compte de messagerie.  Sur mon compte principal <a href=""http://yahoo.fr"" rel=""nofollow"">yahoo.fr</a> le dossier ""messages envoyés"" est amputé de beaucoup de mails envoyés alors qu'ils sont bien présents dans la messagerie <a href=""http://yahoo.fr"" rel=""nofollow"">yahoo.fr</a>. J'ai supprimé les comptes puis réinstallé mais ça ne change rien. Savez-vous comment je pourrais récupérer ces messages&nbsp;? Merci d'avance. Jch </p>",Jchmelchio;,false,false,false,";useragent:Mozilla/5.0 (Linux; Android 10; K) AppleWebKit/537.36 (KHTML, like Gecko) Chrome/140.0.0.0 Mobile Safari/537.36",0,0,0,,,
1534891,2025-09-10 11:32:43 -0700,2025-09-10 11:40:01 -0700,en-US,thunderbird,connection to mail server,false,,,false,,"",encryption,thunderbird;encryption;,shlomokr47,<p>I get a massage: the certificate to ... does not come from a trusted source. On other 2 computer I can connect to the same mail server. Desktop PC win 10 I have installed Bluemail to get and send mail and it works properly! </p>,shlomokr47;,false,false,false,;useragent:Mozilla/5.0 (Windows NT 10.0; Win64; x64; rv:142.0) Gecko/20100101 Firefox/142.0,0,0,0,,,"{""username""=>""shlomokr47"", ""display_name""=>""Shlomo Kramer"", ""avatar""=>""https://profile.accounts.firefox.com/v1/avatar/S""}"
1534899,2025-09-10 12:09:53 -0700,2025-09-11 07:57:35 -0700,nl,thunderbird,problemen met nieuw accout toe te voegen,false,,,false,1763568,1763568;,account-management,thunderbird;account-management;needsinfo;,sergejansen360,"<p>Beste vrijwilligers, </p><p>kunnen jullie even nakijken wat er zou mislopen. </p><p>wanneer wij een nieuw account willen toevoegen blijft het cirkeltje als maar draaien. op onze andere laptop werkt het wel. maar dit staat er zeker al 5 maanden op. </p><p>nu willen wij dit na testfase op al onze pc""s en laptops plaatsen maar het lukt dus niet meer. </p><p>wat kunnen we nu doen </p>",sergejansen360;Mozilla-assistent;,false,false,false,";useragent:Mozilla/5.0 (Windows NT 10.0; Win64; x64) AppleWebKit/537.36 (KHTML, like Gecko) Chrome/137.0.0.0 Safari/537.36 OPR/121.0.0.0",1,0,2,,,
1534901,2025-09-10 12:34:59 -0700,2025-09-13 06:14:31 -0700,en-US,thunderbird,Thunderbird not opening MacOS Catalina 10.15.7,false,,,false,1764035,1764035;,app-crash,thunderbird;app-crash;,olavhansen59,"<p>Hi </p><p>Since recently, I have not been able to open Thunderbird on my mac. Its an old macbook pro mid 2012, and therefore I cannot update any more than Catalina 10.15.7. But in the system requirements for Thunderbird it says that MacOS 10.15 is enough. Is this no longer the case? Or what else could be wrong? I have tried reinstalling without any success. </p><p>Cheers </p>",olavhansen59;wsmwk;,false,false,false,;useragent:Mozilla/5.0 (Macintosh; Intel Mac OS X 10.15; rv:142.0) Gecko/20100101 Firefox/142.0,1,0,1,,,
1534903,2025-09-10 12:40:36 -0700,2025-09-11 05:38:01 -0700,en-US,thunderbird,Can't reply or sent out messages - Getting Error Message,false,,,false,1763530,1763418;1763530;,send-and-receive-email,thunderbird;send-and-receive-email;,mickeyrdenny,"<p>My mail server is wavecable and I haven't changed anything! A few days ago I started getting  ""Error [R8] Authentication Failed, must login"", when sending out messages? What has changed and how do I fix? </p><p>Thanks, Mickey Denny </p>",mickeyrdenny;rednoise;Toad-Hall;,false,false,false,;useragent:Mozilla/5.0 (Windows NT 10.0; Win64; x64; rv:142.0) Gecko/20100101 Firefox/142.0,2,0,0,,,
1534915,2025-09-10 14:11:49 -0700,2025-09-10 14:11:49 -0700,en-US,thunderbird,Some emails unable to forward email with attachments and keep the attachments attached,false,,,false,,"",attachments,thunderbird;attachments;,nkemp,"<p>I cannot forward a specific email with attachments and keep the attachments attached.  I have an email with a couple attachments  One file is a PDF and is not that big.  When I forward the email (Inline selected), it does not attach the attachments.  </p><p>I've tested this with 3 other unrelated emails and in those cases, the attachments get attached as expected. One was an email with a .PDF attached.  </p><p>For further testing,  I went to my Hotmail account, and from there I can forward the subject email and the attachments stay attached. </p><p>That implies there is something about that specific email and how Thunderbird is handling it. </p><p>FWIW, this occurs on two PC's, one W10, the other W11. Both running latestes OS and Thunderbird. </p><p>To be clear, I'm not looking to send the email as an attachment (which is a majority of Google responses relative to this problem) </p>",nkemp;,false,false,false,";useragent:Mozilla/5.0 (Windows NT 10.0; Win64; x64) AppleWebKit/537.36 (KHTML, like Gecko) Chrome/140.0.0.0 Safari/537.36",0,0,0,,,
1534921,2025-09-10 14:45:45 -0700,2025-09-18 09:44:38 -0700,en-US,thunderbird,Emails suddenly stopped downloading to Thunderbird 140.2.1esr,false,,,false,1765410,1763458;1763982;1764011;1764228;1764229;1764359;1764454;1765410;,send-and-receive-email,thunderbird;send-and-receive-email;,matthewharley80,"<p>Thunderbird (140.2.1esr) suddenly stopped downloading emails on 8th Sept 2025, although new emails are still accessible on my email server's webmail, suggesting the problem is with Thunderbird not accessing the server. Sending messages in Thunderbird is unaffected. Have tried every solution I can find online, but problem still persists. When I click 'Get messages' , at the bottom it says 'Host contacted, sending login information', then 'Checking inbox for new messages', then 'No messages to download'. </p>",matthewharley80;mk869;MattAuSupport;oliviercollo;charlie14;,false,false,false,";useragent:Mozilla/5.0 (Windows NT 10.0; Win64; x64) AppleWebKit/537.36 (KHTML, like Gecko) Chrome/140.0.0.0 Safari/537.36;kb_visits_prior:[""/en-US/kb/cannot-receive-messages"", ""/en-US/kb/thunderbird-78-faq""]",8,1,17,,,
1534924,2025-09-10 15:00:33 -0700,2025-09-10 15:00:33 -0700,pt-BR,thunderbird,Itens Enviados,false,,,false,,"",send-and-receive-email,thunderbird;send-and-receive-email;,LCarlos,"<p>Quando envio um email, ao invez de ir para itens enviados ele nao cnseggue salvar e cria uma nova pasta com outro nome  para salvamento. </p>",LCarlos;,false,false,false,";useragent:Mozilla/5.0 (Windows NT 10.0; Win64; x64) AppleWebKit/537.36 (KHTML, like Gecko) Chrome/140.0.0.0 Safari/537.36;kb_visits_prior:[""/pt-BR/kb/nao-e-possivel-enviar-mensagens""]",0,0,0,,,
1534928,2025-09-10 15:29:09 -0700,2025-09-12 21:18:24 -0700,en-US,thunderbird,Copying email address of sender,false,,,false,1763941,1763469;1763476;1763545;1763641;1763645;1763763;1763941;,send-and-receive-email,thunderbird;send-and-receive-email;,Haigster,"<p>When you are viewing an email, you used to be able to just left-click on the sender's address in the top left corner and a drop-down menu would allow you to copy the sender's email address (to use in creating a filter, for instance).  That no longer works. Left-clicking or right-clicking does nothing. I have resorted to clicking to forward the message then copying the email address from the body of the forwarded email, then deleting the email.  Is this an bug in Thunderbird, or did they remove this convenient menu? </p>",Haigster;MichelT;sfhowes;Toad-Hall;haigster1;,false,false,false,;useragent:Mozilla/5.0 (Windows NT 10.0; Win64; x64; rv:142.0) Gecko/20100101 Firefox/142.0,7,0,0,,,
1534933,2025-09-10 16:13:52 -0700,2025-10-01 11:26:06 -0700,en-US,thunderbird,Server for sending Emails is not working,false,,,false,1768924,1763981;1765706;1765766;1768679;1768924;,send-and-receive-email,thunderbird;send-and-receive-email;,bvmzh8f6dj,"<p>I got a new account on my german provider 1&amp;1 and used the right servers the company recommends on its Website (same servers as the previous account). For some reason it is not possible for me to send any Emails but to receive them. On my Iphone I neither receive nor send messages because the server isn‘t working as well. I tried several different accountnames…. I hope you can help me. Thank you! </p><p>(PS: first image from Iphone, second image Thunderbird on Macbook) </p>",bvmzh8f6dj;MattAuSupport;robin11;,false,false,false,";useragent:Mozilla/5.0 (iPhone; CPU iPhone OS 17_4_1 like Mac OS X) AppleWebKit/605.1.15 (KHTML, like Gecko) Version/17.4.1 Mobile/15E148 Safari/604.1",5,0,1,,,
1534936,2025-09-10 16:32:45 -0700,2025-09-10 16:34:29 -0700,en-US,thunderbird,Importing Outlook into Thunderbird,false,,,false,1763464,1763464;,import-and-export-email,thunderbird;import-and-export-email;,mozilla.firefox.squad266,"<p>I just installed Thunderbird and used its import tool to import two Pop3 Outlook accounts.  It seems to to have worked well.  The two accounts are in an Outlook Import folder, which is in the Local Folders.  Here are a few questions: </p><p>1) Is there a way to activate those imported accounts with their password, server settings etc.? </p><p>2) I then created new Thunderbird accounts using the imported accounts' passwords etc.  That worked well.  It's residing above the Local Folders.  Is there a way to move it into the Local Folders? </p><p>3)  Leaving the new account where it is (above the Local Folder) I was hoping to move every imported sub-folder over using the Outlook's Move tool.  It transfers the folder over, but its sub-sub-folders etc. do not transfer over.  I hate to have to go into every sub-sub-sub-folder etc. and move every group of emails in it. </p>",mozilla.firefox.squad266;,false,false,false,;useragent:Mozilla/5.0 (Windows NT 10.0; Win64; x64; rv:142.0) Gecko/20100101 Firefox/142.0,1,0,0,,,
1534942,2025-09-10 16:50:12 -0700,2025-09-11 05:27:34 -0700,en-US,thunderbird,how can i find my password?,false,,,false,1763523,1763478;1763523;,passwords-and-sign-in,thunderbird;passwords-and-sign-in;,rrparry,<p>We can't send emails . WE need a password. </p>,rrparry;rednoise;Toad-Hall;,false,false,false,;useragent:Mozilla/5.0 (Windows NT 10.0; Win64; x64; rv:142.0) Gecko/20100101 Firefox/142.0,2,0,0,,,
