id,created,updated,title,content,tags,product,topic,locale,answers,creator
1531756,2025-08-26 10:45:32 -0700,2025-08-26 11:49:30 -0700,Thunderbird creates spam folder when I already have a junk folder (bug1985372),"<p>I use Thunderbird desktop to access IMAP email from my hosting provider.  My hosting provider includes a junk email folder named ""Junk"" with the path ""...hosting.com/INBOX/Junk.  I cannot delete this folder. </p><p>Whenever I run Thunderbird, it creates a second folder named ""Junk"" with the path ""...hosting.com/INBOX/spam.  If I right-click on this folder and delete it, it is re-created the next time I start Thunderbird.  I have gone into ""Junk Settings"" unchecked the ""Move new junk message to..."" checkbox thinking that this is causing Thunderbird to mistakenly create an extra junk/spam folder but it continues to create that extra junk folder. </p><p>How do I stop this from happening?  I should only require one junk/spam folder. </p>",thunderbird;junk-mail-and-spam;,thunderbird,junk-mail-and-spam,en-US,1759839;,wes118
1531762,2025-08-26 11:16:58 -0700,2025-08-26 11:16:58 -0700,Cannot get emails or replies from anyone using a gmail account to my sympatico account,"<p>If I send any emails to a gmail account, the recipient gets the emails and replies, but I do not get any replies to my Thunderbird v142.0 account. </p>",thunderbird;send-and-receive-email;,thunderbird,send-and-receive-email,en-US,"",mrodness
1531763,2025-08-26 11:18:49 -0700,2025-08-26 11:18:49 -0700,thunderbird mac outlook beállítási probléma,"<p>Sziasztok! Segítséget szeretnék kérni, mert nem sikerül beállítanom az outlookos emailt a thunderbirdbe, többszöri próbálkozás ellenére sem. Bejelentkezés megvan, fiókként szerepel, de csak bejövő emailek mappa és azokat se tölti be. sima outlookos címem van, 2 faktoros hitelesítéssel. thunderbe elvileg minden a megfelelő módon van beállítva, de tényleg már minden kombinációt próbáltam. imapos egyébként. hibaüzenet nincs.  köszi a segítséget </p>",thunderbird;send-and-receive-email;,thunderbird,send-and-receive-email,hu,"",wmoni
1531774,2025-08-26 12:04:44 -0700,2025-08-26 12:04:44 -0700,Unable to send email to invitees in the Calendar.,"<p>I am trying to add an invitee to an email done from the calendar.  When I attempt to add an invitee, everything appears in the user interface to be OK.  When I send the email, nothing is received by the invitee.  I have even sent email to myself as an invitee and that fails as well.  I found the attached error in a troubleshooting log. </p><p>I have scoured the internet looking for a solution but couldn't find one.  Hopefully you can tell me how to proceed so that I can get this feature to work.  I haven't even had Thunderbird for a year and now this.  I have donated $100 to you so hopefully you won't see me as a freeloader who wants to complain. </p><p>Thanks </p>",thunderbird;events;,thunderbird,events,en-US,"",steve669
1531782,2025-08-26 13:09:38 -0700,2025-08-26 13:09:38 -0700,Je ne peux plus enregistrer mes messages envoyés,"<p>Lorsque j'envoie un message, il ne s'enregistre plus dans le dossier ""envoyés"" </p>",thunderbird;send-and-receive-email;,thunderbird,send-and-receive-email,en-US,"",a.geneix
1531787,2025-08-26 13:26:30 -0700,2025-08-26 13:26:30 -0700,settings are not working,"<p>Trying to reinstall TB, settings do not work? </p>",thunderbird;install;,thunderbird,install,en-US,"",vrister
1531791,2025-08-26 14:01:10 -0700,2025-08-26 14:01:10 -0700,Can't send message.,"<p>Thunderbird Version 142.0 (64-bit) August 19, 2025 </p><p>If I get a popup stating: </p><pre> ""Check Spelling""    ""Misspelled word: ...""  (Yes, there is a ""misspelled"" word) </pre> <p>Clicking either ""Ignore"" then ""Send"", or ""Send"" results in: </p><p>Sending of the message failed. An error occurred while sending mail. The mail server responded: MAIL FROM:&lt;MarkJL0@OptOnline.net&gt; does not match authenticated user name. Please verify that your email address is correct in your account settings and try again. </p>",thunderbird;send-and-receive-email;,thunderbird,send-and-receive-email,en-US,"",markjl0
1531793,2025-08-26 14:02:51 -0700,2025-08-26 14:02:51 -0700,email blocked,"<p>My Thunderbird email has been blocked with the error message ""login to server <a href=""http://imap.earthlink.net"" rel=""nofollow"">imap.earthlink.net</a> with user [my email address] failed"" </p><p>Never had this issue before a week or so ago.  Please help. </p><p>Richard </p>",thunderbird;send-and-receive-email;,thunderbird,send-and-receive-email,en-US,"",rrands
1531799,2025-08-26 14:43:44 -0700,2025-08-27 04:37:47 -0700,"""Folder . . . could not be compacted because writing to the folder failed"" error message","<p>All of a sudden, this error message started popping up every time I open my in box. Please help: What is the problem, and what can I do about it? I am not expert enough to figure out what I must do just from reading the error message. Image below. Thanks. </p>",thunderbird;email-and-messaging;,thunderbird,email-and-messaging,en-US,1759968;,kirkaby
1531802,2025-08-26 15:09:33 -0700,2025-08-26 16:15:03 -0700,"After upgrading to ""Eclipse"", TB stopped showing a notification badge on taskbar icon","<p>There was a forced upgrade to ""Eclipse"" a couple of months ago, and TB stopped showing a notification for new/unread emails on the taskbar icon. This was on Win10. </p><p>I hoped that a clean install of Win11 would maybe fix the issue, but nothing changed. </p><p>The weird thing is that TB is not listed under System&gt;Notifications in Win11 settings (see image). I guess the issue lies within TB, not Win11. </p><p>Is this a new bug, or have i missed some setting? I'm on v142 currently. </p>",thunderbird;customization;,thunderbird,customization,en-US,1759893;1759899;1759901;,MarcDwonn
1531805,2025-08-26 15:33:01 -0700,2025-08-26 15:55:19 -0700,How do i get the sender name and email in my emails in my inbox?,<p>How do I get the sender name and email in my emails in my inbox?  Right now I only get the subject and my email.  I need both to delete or avoid phishing. </p>,thunderbird;customization;,thunderbird,customization,en-US,1759898;,ca6
1531807,2025-08-26 15:35:34 -0700,2025-08-28 09:53:49 -0700,email addresses,"<p>I recieve email with a LOT of other addresses in the ""to"" list. how can i copy these addresses into a new contact list without typing each one separately.[which would take a LOT of time] </p>",thunderbird;contacts;,thunderbird,contacts,en-US,1759902;1760109;1760122;1760278;1760282;,curtwh
1531809,2025-08-26 15:41:09 -0700,2025-08-26 15:41:09 -0700,Thunderbird 142.0 not connecting to server?,"<p>Please somebody help!  I have Windows 11, IMAP and Thunderbird 142.0, and It. Just. Isn't. Working.  Is the trouble with this newest T-Bird version?  It doesn't download emails from the server, and when it does, they don't open for ages.  I read every Blog I can find and changed every setting suggested. </p>",thunderbird;performance-and-connectivity;,thunderbird,performance-and-connectivity,en-US,"",JackieHarrell
1531811,2025-08-26 15:48:26 -0700,2025-08-26 15:48:26 -0700,Access Issue,"<p>I have two accounts.  One I've been using, ongoing, the other I'm trying to resurrect from a moribund state.  I'm having password problems.  I doubt I can change a password without a password.  I don't know how to resolve my issue.  TU </p>",thunderbird;reset-passwords;,thunderbird,reset-passwords,en-US,"",dennisdittman
1531813,2025-08-26 15:53:32 -0700,2025-08-26 15:53:32 -0700,Cannot delete a single email that appears empty,"<p>I have a single email that appears to be empty, but I cannot delete it.  When I open the message in a new tab you can see that it blank.  I will attach a screen capture.  I've tried everything short of reload Thunderbird to delete this particular email. </p>",thunderbird;email-and-messaging;,thunderbird,email-and-messaging,en-US,"",rbmcdill1
1531815,2025-08-26 15:54:10 -0700,2025-08-26 15:54:10 -0700,having a difficult time installing,<p>what do I do next </p>,thunderbird;installation-and-updates;,thunderbird,installation-and-updates,en-US,"",traxworks
1531820,2025-08-26 16:21:50 -0700,2025-08-26 16:21:50 -0700,emails,"<p>emails disappear as soon as they are in this recipients inbox, bruce@wc2wines.com </p>",thunderbird;send-and-receive-email;,thunderbird,send-and-receive-email,en-US,"",andrea19
1531821,2025-08-26 16:37:09 -0700,2025-08-26 20:37:59 -0700,Screen readers like JAWS.,"<p>Please make this better!  But, I love it! </p>",thunderbird;accessibility;,thunderbird,accessibility,en-US,1759920;,keisha.ramkissoon
