id,created,updated,locale,product,title,is_solved,solution,solved_by,is_spam,last_answer,answers,topic,tags,creator,content,involved,is_archived,is_locked,is_taken,metadata,num_answers,num_votes_past_week,num_votes,taken_until,taken_by,updated_by
1492123,2025-02-09 16:10:55 -0800,2025-02-10 14:53:44 -0800,en-US,thunderbird,How do you create chrome/userChrome.css,false,,,false,1711212,1711212;,customization,thunderbird;customization;,012wtf,"<p>Im trying to change color of font for unread email for the latest version. To do this its says you have to edit the chrome/userChrome.css file in Style Editor. </p><p>With earlier versions from what Ive read they had settings inbuilt to chnage font color within ""Display"" tab, for some reason it has been removed in later versions </p><p>Im following these instructions <a href=""https://devnodes.in/blog/misc/thunderbird-mail-theme-customize/"" rel=""nofollow"">https://devnodes.in/blog/misc/thunderbird-mail-theme-customize/</a> </p><p>There's a part where it says ""Next create file chrome/userChrome.css"" in Thunderbird’s Profiles directory , but it doesnt say how to create it. </p><p>I tried creating a folder called chrome in the profiles directory, then creating a file named userCrome.css using notepad but the style editor doesnt list this/see file. </p>",012wtf;Mapenzi;,true,false,false,";useragent:Mozilla/5.0 (Windows NT 10.0; Win64; x64) AppleWebKit/537.36 (KHTML, like Gecko) Chrome/132.0.0.0 Safari/537.36",1,0,0,,,
1492150,2025-02-09 21:17:57 -0800,2025-02-10 13:31:29 -0800,en-US,thunderbird,on thunderbird I have an account called orateague44@outlook.com that does not work properly so I need to delete it.  How do I delete orateague44@outlook.com?,false,,,false,1711196,1711196;,account-management,thunderbird;account-management;,orateague441,<p>on thunderbird I have an account called orateague44@outlook.com that does not work properly so I need to delete it.  How do I delete orateague44@outlook.com? </p>,orateague441;remi.daniel;,true,false,false,";useragent:Mozilla/5.0 (Windows NT 10.0; Win64; x64) AppleWebKit/537.36 (KHTML, like Gecko) Chrome/132.0.0.0 Safari/537.36",1,0,0,,,
1492154,2025-02-09 21:29:19 -0800,2025-02-10 05:42:23 -0800,en-US,thunderbird,email,false,,,false,1711117,1711117;,send-and-receive-email,thunderbird;send-and-receive-email;,julieg23,<p>I can send email but cant receive them. How do I fix it.? i'm using Thunderbird </p>,julieg23;davidsk;,true,false,false,;useragent:Mozilla/5.0 (Windows NT 10.0; Win64; x64; rv:135.0) Gecko/20100101 Firefox/135.0,1,0,0,,,
1492160,2025-02-09 22:18:11 -0800,2025-02-10 05:30:33 -0800,en-US,thunderbird,My Thunderbird email account has crashed.,false,,,false,1711109,1711109;,app-crash,thunderbird;app-crash;,garmson,"<p>My crashed ID is ""bp-24b627a1-1416-4c09-a4ab     I am a novice with this as I have not received any emails for 4 days. My email account is garmson@aussiebb.com.au  thank you. Please fix and I await your reply. </p>",garmson;davidsk;,true,false,false,";useragent:Mozilla/5.0 (Windows NT 10.0; Win64; x64) AppleWebKit/537.36 (KHTML, like Gecko) Chrome/132.0.0.0 Safari/537.36 Edg/132.0.0.0",1,0,0,,,
1492163,2025-02-09 22:25:24 -0800,2025-02-14 18:28:00 -0800,en-US,thunderbird,Is messenger.notifications.getPermissionLevel() supported in Thunderbird 128esr?,false,,,false,1712252,1712252;,extensions,thunderbird;extensions;,JDLH,"<p>I am learning how to develop add-ons for Thunderbird. In working through the [**""Hello World"" Extension Tutorial**](<a href=""https://developer.thunderbird.net/add-ons/hello-world-add-on"" rel=""nofollow"">https://developer.thunderbird.net/add-ons/hello-world-add-on</a>), I decided to try calling the function `messenger.notifications.getPermissionLevel()` function described in the [MailExtensions notifications API documentation](<a href=""https://webextension-api.thunderbird.net/en/128-esr-mv2/notifications.html"" rel=""nofollow"">https://webextension-api.thunderbird.net/en/128-esr-mv2/notifications.html</a>).  </p><p>When I use code like: ``` let allowed = await messenger.notifications.getPermissionLevel(); ``` I see the following error message on the Developer Tools console: ``` Uncaught (in promise) TypeError: messenger.notifications.getPermissionLevel is not a function ``` </p><p>Meanwhile, over at GitHub, I see [thunderbird/webext-schemas/schema-files/notifications.json#L228-L247](<a href=""https://github.com/thunderbird/webext-schemas/blob/d0c42f0f1e82244095f002387a2a4d253ab679fb/schema-files/notifications.json#L228-L247"" rel=""nofollow"">https://github.com/thunderbird/webext-schemas/blob/d0c42f0f1e82244095f002387a2a4d253ab679fb/schema-files/notifications.json#L228-L247</a>), which includes the field, `""unsupported"": true`. It also lacks a field `mdn_url`, and there is no entry for it in the [Mozilla browser extensions docs](<a href=""https://developer.mozilla.org/en-US/docs/Mozilla/Add-ons/WebExtensions/API/notifications"" rel=""nofollow"">https://developer.mozilla.org/en-US/docs/Mozilla/Add-ons/WebExtensions/API/notifications</a>).  </p><p>So, is messenger.notifications.getPermissionLevel() supported in Thunderbird 128esr? And, where is that answer documented? </p>",JDLH;MattAuSupport;,true,false,false,;useragent:Mozilla/5.0 (Macintosh; Intel Mac OS X 10.15; rv:134.0) Gecko/20100101 Firefox/134.0,1,0,0,,,
1492171,2025-02-09 22:49:25 -0800,2025-02-10 01:17:37 -0800,en-US,thunderbird,sort accounts in thunderbird 128?,true,1711084,tbundy00,false,1711084,1711084;,extensions,thunderbird;extensions;,tbundy00,<p>Is there a way to sort folders or accounts in thunderbird 128?  The old manually sort folders addon doesn't work with this version. </p>,tbundy00;,true,false,false,;useragent:Mozilla/5.0 (Windows NT 10.0; Win64; x64; rv:135.0) Gecko/20100101 Firefox/135.0;solver_id:6335580,1,0,1,,,
1492177,2025-02-09 23:17:56 -0800,2025-02-10 05:30:02 -0800,en-US,thunderbird,My Thunderbird email account has crashed.,false,,,false,1711108,1711108;,app-crash,thunderbird;app-crash;,garmson,<p>Please reinstate my Thunderbird account. </p>,garmson;davidsk;,true,false,false,";useragent:Mozilla/5.0 (Windows NT 10.0; Win64; x64) AppleWebKit/537.36 (KHTML, like Gecko) Chrome/132.0.0.0 Safari/537.36 Edg/132.0.0.0",1,0,0,,,
1492179,2025-02-09 23:24:15 -0800,2025-02-10 10:45:03 -0800,en-US,thunderbird,redirect mail,false,,,false,1711157,1711077;1711157;,send-and-receive-email,thunderbird;send-and-receive-email;,robert.hidropump,"<p>Hi, We have around five unique emails, and I want each message they send to be redirected to a separate email (let's call it A1). The problem is that when I set up the filter to automatically redirect messages to A1, it keeps sending the same message over and over again. </p>",robert.hidropump;davidsk;,true,false,false,";useragent:Mozilla/5.0 (Windows NT 10.0; Win64; x64) AppleWebKit/537.36 (KHTML, like Gecko) Chrome/133.0.0.0 Safari/537.36",2,0,2,,,
1492182,2025-02-09 23:39:20 -0800,2025-08-06 06:17:29 -0700,en-US,thunderbird,Thuderbird uses 100% CPU (linux),false,,,false,1754406,1711189;1754343;1754405;1754406;,app-crash,thunderbird;app-crash;,antymat,"<p>Thunderbird gets to 100% CPU usage, stays there for hours, and the only solution is to kill it. Any idea, what could be the reason? </p>",antymat;DavidGG;wsmwk;,true,true,false,;useragent:Mozilla/5.0 (X11; Linux x86_64; rv:130.0) Gecko/20100101 Firefox/130.0,4,0,1,,,wsmwk
1492193,2025-02-10 00:24:59 -0800,2025-02-10 00:37:41 -0800,it,thunderbird,Impossibile caricare il profilo Thunderbird. Il profilo risulta mancante o non accessibile,false,,,false,1711082,1711082;,app-crash,needsinfo;thunderbird;app-crash;,eva.beniteznieto,"<p>Salve non so per quale motivo non si riesci a utilizzare il vostro applicativo, è possibile un aito? Grazie </p>",eva.beniteznieto;@next;,true,false,false,;useragent:Mozilla/5.0 (Windows NT 10.0; Win64; x64; rv:128.0) Gecko/20100101 Firefox/128.0,1,0,1,,,
1492197,2025-02-10 00:41:07 -0800,2025-02-10 09:55:22 -0800,en-US,thunderbird,problem with email account after changing password,false,,,false,1711153,1711115;1711153;,passwords-and-sign-in,needsinfo;thunderbird;passwords-and-sign-in;,bart.metale,"<p>Hello, I use IMAP/SMTP email, yesterday I changed my email password via the website. After this change, Thunderbird does not want to log me in, I keep getting the message that the address, password or configuration is incorrect. Please help me solve this problem </p><p>Tram Bartlomiej </p>",bart.metale;mozilla98;DavidGG;,true,false,false,;useragent:Mozilla/5.0 (Macintosh; Intel Mac OS X 10.15; rv:132.0) Gecko/20100101 Firefox/132.0,2,0,4,,,
1492200,2025-02-10 01:06:20 -0800,2025-02-10 05:13:31 -0800,nl,thunderbird,wachtwoord,false,,,false,1711103,1711103;,reset-passwords,thunderbird;reset-passwords;,erikaelbers,<p>Mijn oud wachtwoord wordt niet herkend. Hoe kan ik een nieuw wachtwoord aanmaken? </p>,erikaelbers;Mozilla-assistent;,true,false,false,";useragent:Mozilla/5.0 (Windows NT 10.0; Win64; x64) AppleWebKit/537.36 (KHTML, like Gecko) Chrome/132.0.0.0 Safari/537.36 Edg/132.0.0.0",1,0,0,,,
1492201,2025-02-10 01:23:49 -0800,2025-02-10 11:28:51 -0800,en-US,thunderbird,Not responding,false,,,false,1711164,1711164;,app-crash,thunderbird;app-crash;,4mfdr9rpsb,<p>My MacBook version of Thunderbird just has a spinning beach ball continuously.  The CPU is 105% and is using 1.6GB of memory - I cannot shut any of the windows inside of the application.  I have restarted my Mac twice and it is still the same.  Any clues please? </p>,4mfdr9rpsb;Mapenzi;,true,false,false,";useragent:Mozilla/5.0 (Macintosh; Intel Mac OS X 10_15_7) AppleWebKit/537.36 (KHTML, like Gecko) Chrome/132.0.0.0 Safari/537.36",1,0,0,,,
1492202,2025-02-10 01:57:40 -0800,2025-06-16 19:56:35 -0700,en-US,thunderbird,some emails not readable and repair folder does not help,false,,,false,1711219,1711219;1742322;,import-and-export-email,thunderbird;import-and-export-email;,lmoreschini1,"<p>I have a (small) subfolder in my inbox and while the list of emails is still there, only the first three are readable, the rest appears empty if I click on one of them. I tried the repair folder option but if I do that, which recreates the msf file, the result is that now the list is completely empty, the folder appears to contain nothing at all.  I have both files (msf and the main one containing the actual emails) saved somewhere else so I can play with them, and I can see that the main file, if I open it with textedit, DOES contain the emails, but I just can't read them in thunderbird. Please note that I do not have access to the imap server of this account anymore. it is now closed, so I cannot re-download the emails. thank you </p>",lmoreschini1;DavidGG;Andrew_Jacobs;,true,false,false,";useragent:Mozilla/5.0 (Macintosh; Intel Mac OS X 10_15_7) AppleWebKit/605.1.15 (KHTML, like Gecko) Version/18.2 Safari/605.1.15",1,0,0,,,
1492206,2025-02-10 02:27:36 -0800,2025-02-14 18:23:55 -0800,en-US,thunderbird,E-mail stopped working,false,,,false,1712251,1712251;,send-and-receive-email,thunderbird;send-and-receive-email;,tomstryd,"<p>Good day - My e-mail stopped working. (I do not receive any mails, nor can I send any) Can you please assist, My e-mail address is tomstryd@absamail.co.za </p><p>Kind regards </p><p>Tom </p>",tomstryd;MattAuSupport;,true,false,false,";useragent:Mozilla/5.0 (Windows NT 10.0; Win64; x64) AppleWebKit/537.36 (KHTML, like Gecko) Chrome/132.0.0.0 Safari/537.36",1,0,3,,,
1492207,2025-02-10 02:30:08 -0800,2025-02-10 02:32:38 -0800,en-US,thunderbird,mail is written in chinese when UTF-8 and UTF-16 is both used in the email,false,,,false,,"",send-and-receive-email,send-and-receive-email;thunderbird;,mozilla696,"<p>Hello, I'm using Thunderbird (128.7.0esr (64-bit) on Linux (Ubuntu 22.04) for many years now and this is first real problem I encountered. Veeam is a backup solution which is writing emails where the first headers are written in UTF-8 and the body in UTF-16. The attachment is written in UTF-8. The body is a summary written in UTF-16 When I open the mail the body is shown in Chinese characters. The attachment is normal and readable. Outlook has no problems reading this email and though it is possible to change Veeam to write everything in UTF-8 the system admin who is using outlook refuses to change it. Is this a known problem or do I have set some settings wrong&nbsp;? </p>",mozilla696;,true,false,false,;useragent:Mozilla/5.0 (X11; Ubuntu; Linux x86_64; rv:135.0) Gecko/20100101 Firefox/135.0,0,0,0,,,mozilla696
1492208,2025-02-10 02:33:46 -0800,2025-02-10 05:31:38 -0800,it,thunderbird,cambio da tim a vodafone,false,,,false,1711110,1711090;1711110;,send-and-receive-email,thunderbird;send-and-receive-email;,iz4ndm,<p>non riesco piu a entrare nella posta </p>,iz4ndm;@next;,true,false,false,;useragent:Mozilla/5.0 (Windows NT 10.0; Win64; x64; rv:135.0) Gecko/20100101 Firefox/135.0,2,0,0,,,
1492212,2025-02-10 02:44:49 -0800,2025-02-10 05:40:35 -0800,en-US,thunderbird,Servernavn,false,,,false,1711116,1711116;,send-and-receive-email,thunderbird;send-and-receive-email;,faarupparken1,"<p>Hvad er forskellen på IMAP og POP3, og hvad bruges hvor?? </p>",faarupparken1;davidsk;,true,false,false,";useragent:Mozilla/5.0 (Windows NT 10.0; Win64; x64) AppleWebKit/537.36 (KHTML, like Gecko) Chrome/132.0.0.0 Safari/537.36 Edg/132.0.0.0",1,0,0,,,
1492229,2025-02-10 05:02:05 -0800,2025-02-10 12:41:48 -0800,en-US,thunderbird,thunderbird ne répond pas,false,,,false,1711187,1711187;,app-crash,thunderbird;app-crash;,celine.voix,"<p>Bonjour, J'ai en permanence thunderbird qui me met "" ne répond pas"" je suis obligé de fermer et ré-ouvrir. JE ne comprends pas d’où vient le problème. Je l'ai réinstallé entièrement. </p>",celine.voix;DavidGG;,true,false,false,;useragent:Mozilla/5.0 (Windows NT 10.0; Win64; x64; rv:128.0) Gecko/20100101 Firefox/128.0,1,0,0,,,
1492230,2025-02-10 05:10:18 -0800,2025-02-10 05:10:18 -0800,es,thunderbird,Importing to-do lists (tasks) from Todoist or Google Calendar,false,,,false,,"",events,thunderbird;events;,sicabi,"<p>Hi,  </p><p>I'd like to see the tasks from Google Calendar in my Thunderbird Calendar, but I havent found a way to see these tasks I upload with the Todoist app, even though other calendar apps from Ubuntu or Samsung Calendar in Android do this automatically (they place it as a all day event in the calendar, no necessarily as a task). </p><p>Any suggestions?  </p><p>Best, </p><p>Sicabí </p>",sicabi;,true,false,false,;useragent:Mozilla/5.0 (X11; Ubuntu; Linux x86_64; rv:135.0) Gecko/20100101 Firefox/135.0,0,0,0,,,
1492232,2025-02-10 05:28:32 -0800,2025-02-10 05:32:48 -0800,it,thunderbird,Problems viewing some emails / Problemi con la visualizzazione di alcune mail,false,,,false,1711111,1711111;,email-and-messaging,email-and-messaging;thunderbird;,boviolauraqw,"<p>Hello, I am having a problem with emails that I can't figure out. I basically don't see some emails on the thunderbid main screen but if I search for the email address in the search bar the email appears. This problem only occurs with some specific emails. </p><p>Can you tell me a possible solution to the problem? </p><p><br> Buongiorno, sto riscontrando un problema con le mail di cui non ne vengo a capo. Praticamente non visualizzo alcune mail nella schermata principale di thunderbid ma se cerco l'indirizzo mail nella barra di ricerca la mail risulta.  Questo problema si presenta solo con alcune mail specifiche. </p><p>Sapete indicarmi una possibile risoluzione del problema? </p>",boviolauraqw;@next;,true,false,false,";useragent:Mozilla/5.0 (Windows NT 10.0; Win64; x64) AppleWebKit/537.36 (KHTML, like Gecko) Chrome/132.0.0.0 Safari/537.36",1,0,0,,,
1492233,2025-02-10 05:29:02 -0800,2025-02-11 20:21:12 -0800,en-US,thunderbird,Inconsistent Edit Mode in Contacts,false,,,false,1711465,1711163;1711228;1711465;,contacts,thunderbird;contacts;,R.HYMAN,"<p>I am using Thunderbird version 128.7.Oesr on an iMac running Sequoia 15.3. When trying to update a contact's information I'm finding some contacts allow for Edit Mode and other contacts do not even display the Edit button as an option. I've tried Troubleshooting mode, but have the same issue. Any advice would be much appreciated.  Thanks, Ron </p>",R.HYMAN;Mapenzi;MattAuSupport;,true,false,false,;useragent:Mozilla/5.0 (Macintosh; Intel Mac OS X 10.15; rv:135.0) Gecko/20100101 Firefox/135.0,3,0,0,,,
1492236,2025-02-10 05:38:07 -0800,2025-02-10 06:07:09 -0800,en-US,thunderbird,Copying between folders in mail account does not work,true,1711127,newsletters2,false,1711127,1711127;,email-and-messaging,thunderbird;email-and-messaging;,newsletters2,"<p>I have imap-email accounts with too many folders I have created. I wanted to reduce the folders' amount and move mails between folders. crtl-a selects all mail in a folder, then with the right click menu of the mouse copy or move etc. It just does not do that. Only a small amount of mails is transferred. Same with grab and move to the folder. I then tried to move the mails to a local folder, delete them and move them from the local folder to the destination. Same problem. They would not move to the local folder. Is there any configuration limiting the intended moves? </p>",newsletters2;,true,false,false,;useragent:Mozilla/5.0 (Windows NT 10.0; Win64; x64; rv:135.0) Gecko/20100101 Firefox/135.0;solver_id:5565601,1,0,1,,,
1492243,2025-02-10 05:58:06 -0800,2025-02-10 05:58:49 -0800,en-US,thunderbird,Will CRED refund money?,true,1711122,marandi01ug,true,1711123,1711122;1711123;,accounts,thunderbird;accounts;,marandi01ug,<p>CRED Customer Care: 6OOO649OO4 in-app chat support &amp; email. get support on-demand. via the app. CRED doesn't have a customer phone line but we do have experts on stand-by to help resolve any problems you might be facing. </p>,marandi01ug;,true,false,false,";useragent:Mozilla/5.0 (Linux; Android 10; K) AppleWebKit/537.36 (KHTML, like Gecko) Chrome/120.0.0.0 Mobile Safari/537.36;solver_id:6479797",2,0,1,,,
1492244,2025-02-10 06:00:21 -0800,2025-02-14 18:22:11 -0800,en-US,thunderbird,All Update FQDN (Thunderbird Portable),false,,,false,1712250,1712250;,update,thunderbird;update;,alientm.allegro,<p>Where can I find all the fully qualified domain names (FQDNs) and IP addresses needed for automatic update of Thunderbird Portable version? </p>,alientm.allegro;MattAuSupport;,true,false,false,";useragent:Mozilla/5.0 (Windows NT 10.0; Win64; x64) AppleWebKit/537.36 (KHTML, like Gecko) Chrome/131.0.0.0 Safari/537.36",1,0,0,,,
1492247,2025-02-10 06:15:51 -0800,2025-02-10 16:13:07 -0800,en-US,thunderbird,Deleted emails become undeleted,false,,,false,1711218,1711218;,junk-mail-and-spam,thunderbird;junk-mail-and-spam;,32fbat,<p>I am finding that emails that have been deleted reappear a few days later. I have numerous subfolders under 'Inbox' and this mysterious reappearance happends within individual subfolders. thanx </p>,32fbat;DavidGG;,true,false,false,";useragent:Mozilla/5.0 (Windows NT 10.0; Win64; x64) AppleWebKit/537.36 (KHTML, like Gecko) Chrome/132.0.0.0 Safari/537.36 Edg/132.0.0.0",1,0,0,,,
1492248,2025-02-10 06:18:13 -0800,2025-02-10 12:32:47 -0800,en-US,thunderbird,How to bulk delete,false,,,false,1711186,1711186;,email-and-messaging,thunderbird;email-and-messaging;,ricepost,<p>How can I bulk delete emails&nbsp;? </p>,ricepost;DavidGG;,true,false,false,";useragent:Mozilla/5.0 (iPhone; CPU iPhone OS 18_2_1 like Mac OS X) AppleWebKit/605.1.15 (KHTML, like Gecko) Version/18.2 Mobile/15E148 Safari/604.1",1,0,0,,,
1492249,2025-02-10 06:20:56 -0800,2025-02-24 04:17:53 -0800,it,thunderbird,Thunderbird si disconnette  di continuo,false,,,false,1714178,1711140;1712097;1712098;1712272;1712292;1712307;1713138;1713385;1714178;,connectivity,thunderbird;connectivity;,digiovanni,"<p>Buongiorno, Thunderbird si disconnette di continuo, leggere o preparare messaggi di posta è diventato un incubo, devo riavviare il software spessissimo e ricominciando sempre da capo. Cortesemente mi date una soluzione per ritornare alla stabilità. Gli aggiornamenti li ho sempre eseguiti correttamente. Grazie </p>",digiovanni;@next;,true,false,false,";useragent:Mozilla/5.0 (Windows NT 10.0; Win64; x64) AppleWebKit/537.36 (KHTML, like Gecko) Chrome/132.0.0.0 Safari/537.36 Edg/132.0.0.0",9,0,0,,,
1492263,2025-02-10 07:23:16 -0800,2025-02-11 07:00:33 -0800,en-US,thunderbird,Not all email account folders showing,true,1711310,ii1631106,false,1711310,1711154;1711310;,account-management,thunderbird;account-management;,ii1631106,"<p>Hi All, no matter what I try, seems for my POP3 accounts I am unable to see all my folders. I am unable to find a way to a way to configure the account as IMAP. Seems there is manual override to set up account as IMAP? </p><p>In Outlook, this all works well these accounts are setup as IMAP. </p>",ii1631106;davidsk;,true,false,false,";useragent:Mozilla/5.0 (Windows NT 10.0; Win64; x64) AppleWebKit/537.36 (KHTML, like Gecko) Chrome/132.0.0.0 Safari/537.36;solver_id:6479975",2,0,0,,,
1492272,2025-02-10 07:55:15 -0800,2025-02-10 07:55:15 -0800,en-US,thunderbird,thunderbird 135.0 how to add EWS account ?,false,,,false,,"",account-management,thunderbird;account-management;,emoxam,"<p>Hello all! I am using kubuntu 24.04 thunderbird 135.0 And i heard i can now add EWS account to TB I am using on premises exchange server TB founds my account but offen only OWL addon exchange But i can press ""manual"" and there i see Protocol is Exchange. I press ""configure manually"" or ""advanced config"" but both ignores me... How to add EWS mailbox&nbsp;? </p>",emoxam;,true,false,false,;useragent:Mozilla/5.0 (X11; Linux x86_64; rv:135.0) Gecko/20100101 Firefox/135.0,0,0,0,,,
1492287,2025-02-10 08:42:54 -0800,2025-02-11 07:14:25 -0800,it,thunderbird,Account di posta gmail,false,,,false,1711318,1711142;1711305;1711318;,email-and-messaging,needsinfo;thunderbird;email-and-messaging;,abierre661,"<p>Non si configura l'account di posta gmail pur inserendo indirizzo e passward corretti. L'indirizzo è&nbsp;: abierre66@gmail.com Sul sito di gmail funziona e leggo la posta, su Thunderbird mi da errore e non si configura. L'altro indirizzo di posta <a href=""http://tiscali.it"" rel=""nofollow"">tiscali.it</a> si è configurato e funziona perfettamente. Se riuscite ad aiutarmi Vi ringrazio. Buona serata </p>",abierre661;@next;,true,false,false,;useragent:Mozilla/5.0 (Windows NT 10.0; Win64; x64; rv:135.0) Gecko/20100101 Firefox/135.0,3,0,0,,,
1492293,2025-02-10 08:59:31 -0800,2025-02-10 08:59:31 -0800,en-US,thunderbird,ENVOI DE MESSAGE,false,,,false,,"",junk-mail-and-spam,thunderbird;junk-mail-and-spam;,bernard48.dupont,<p>JE NE PEUX PLUS ENVOYER DE COURRIEL - LE MESSAGE LORS DE L'ENVOI ME DIT QU'IL Y A TROP DE SPAM J'AI MEME ESSAYE AVEC UN MESSAGE VIDE COMMENT DOIS-JE FAIRE </p>,bernard48.dupont;,true,false,false,;useragent:Mozilla/5.0 (Windows NT 10.0; Win64; x64; rv:135.0) Gecko/20100101 Firefox/135.0,0,0,0,,,
1492295,2025-02-10 09:08:11 -0800,2025-02-11 08:17:56 -0800,en-US,thunderbird,Es geht um Meine Anmeldung bei Thunderbird,false,,,false,1711339,1711339;,reset-passwords,thunderbird;reset-passwords;,harald.kleinelsen,"<p>Mein Name ist Harald Kleinelsen.  Ich benutze ein duales PC-System mit WIN 11 und neuerdings auch UBuntu 2204. Wegen meines vorgerückten Alters von 84 Jahren (2.3.1941) habe ich meinen PC zur Umrüstung einem IT-Spezialisten übergeben und kenne nun mein Benutzerkonto von Thunderbird nicht mehr. mit dem ich bis heute- eben noch gearbeitet habe! Entweder war es bei <a href=""http://web.de"" rel=""nofollow"">web.de</a> oder von einem Google-Konto ""076@gmail.de."" Ihren guten Webbrowser nutze ich ständig, mal mit, mal ohne Konto-Anmeldung seit den 90er Jahren, der PC-Popularität. Würden Sie mir bitte helfen? Mit freundlichem Gruss, Harald Kleinelsen </p>",harald.kleinelsen;davidsk;,true,false,false,";useragent:Mozilla/5.0 (X11; Linux x86_64) AppleWebKit/537.36 (KHTML, like Gecko) Chrome/132.0.0.0 Safari/537.36",1,0,0,,,
1492299,2025-02-10 09:36:45 -0800,2025-02-10 09:36:45 -0800,en-US,thunderbird,my rmaikl onmly sdhows one at a time...how can I fix,false,,,false,,"",customization,thunderbird;customization;,fog01,<p>I installed a new 1T PCIe hd and new win 11 now my email only shows one at a time and cant see the next unless I delete this one </p>,fog01;,true,false,false,;useragent:Mozilla/5.0 (Windows NT 10.0; Win64; x64; rv:135.0) Gecko/20100101 Firefox/135.0,0,0,0,,,
1492305,2025-02-10 10:11:44 -0800,2025-02-14 18:29:45 -0800,en-US,thunderbird,need help to export for mobile,false,,,true,1712253,1712253;,import-and-export-email,thunderbird;import-and-export-email;,robertvd,<p>I need help to export for mobile from desktop pc </p>,robertvd;MattAuSupport;,true,false,false,;useragent:Mozilla/5.0 (Windows NT 10.0; Win64; x64; rv:134.0) Gecko/20100101 Firefox/134.0,1,0,0,,,
1492314,2025-02-10 10:48:42 -0800,2025-02-28 05:04:44 -0800,en-US,thunderbird,Number of MIME parts exceeds maximum permitted,false,,,false,1714985,1712249;1713895;1714985;,attachments,thunderbird;attachments;,moojanmomen,"<p>I am trying to send a message with lots of MIME attachments from Thunderbird and I get this error message: ""Number of MIME parts exceeds maximum permitted"". Unhelpfully it does not say what the maximum is and I cannot find this information in Support.  Anyone know what the maximum number of MIME attachments to an email is? Thanks in advance </p>",moojanmomen;MattAuSupport;,true,false,false,";useragent:Mozilla/5.0 (Windows NT 10.0; Win64; x64) AppleWebKit/537.36 (KHTML, like Gecko) Chrome/131.0.0.0 Safari/537.36 OPR/116.0.0.0",3,0,0,,,
