id,created,updated,title,content,tags,product,topic,locale,answers,creator
1520487,2025-07-02 17:02:15 -0700,2025-07-03 03:16:48 -0700,where  is ThunderBird profile found for new release 128.11,<p>whw where  is ThunderBird profile found? </p>,thunderbird;profiles;,thunderbird,profiles,en-US,"",jnm9k77n6s
1520490,2025-07-02 17:24:54 -0700,2025-07-02 17:24:54 -0700,Event background colours,<p>Hi everyone. </p><p>Hoping someone may be able to help.  I see that other users are able to fully highlight the events in calendar.  I seem to be only able to highlight 2/3's (see image) </p><p>Thanks in advance </p>,thunderbird;events;,thunderbird,events,en-US,"",hendrik
1520494,2025-07-02 18:13:25 -0700,2025-07-02 18:13:25 -0700,Sent Mail to Inbox not working,"<p>Hi all </p><p>I have my sent mail going into my Inbox be default, so that I can see entire threads in context. It's set that way in Copies &amp; Folders in each of my email accounts. However, I frequently find sent emails in the Sent Mail folder. </p><p>Can anyone offer an idea of why, and how to fix it? </p><p>Thanks Edwin </p>",thunderbird;email-and-messaging;,thunderbird,email-and-messaging,en-US,"",humphries.edwin
1520499,2025-07-02 19:01:51 -0700,2025-07-02 19:01:51 -0700,emails and gmail,<p>Am unable to receive messages from Gmail over the past 2-3 days. Email from other sources are fine. Our Email provider here in Oz is 'The Messaging Co'. They don't respond to our queries. thanks in advance. Confused </p>,thunderbird;email-and-messaging;,thunderbird,email-and-messaging,en-US,"",confusedalso
1520507,2025-07-02 19:32:36 -0700,2025-07-02 19:32:36 -0700,can I recover or deleted product,<p>Yesterday sometime I accidentally deleted my calendar program and it's a killer I need it bad and if I can't get it I need a simple easy to use replacement it's not asking me a hundred questions just because I want to keep somebody's phone number but what I really want to do is try and find the program a little more before I give up where do deleted products go? </p>,firefox-1400;android;thunderbird;calendar;,thunderbird,calendar,en-US,"",azdon360
1520518,2025-07-02 20:47:35 -0700,2025-07-03 01:59:39 -0700,password issue,<p>one of our email addresses was hacked so we changed the password on that one email account but now we have a pop up window every time we open thunderbird asking to enter the password for two of our addresses. The system won't accept the original password nor the new one. It keeps saying it failed so I can't get into my account passwords screen to see what is going on. We are getting our emails. just that darn window keeps popping up every time. we can send emails too. </p>,thunderbird;passwords-and-sign-in;,thunderbird,passwords-and-sign-in,en-US,1746393;,RobinClaire
1520519,2025-07-02 20:49:20 -0700,2025-07-02 20:49:20 -0700,Downloading emails,"<p>Since yesterday Thunderbird cannot download messages. </p><p>It says ""Downloading 1 of 4 messages"" and attempts for a while, then stops. No messages are downloaded. </p>",thunderbird;email-and-messaging;,thunderbird,email-and-messaging,en-US,"",gilbo90
1520527,2025-07-02 21:42:53 -0700,2025-07-02 22:50:25 -0700,non riesco a connettermi a info@villaggioidra.it,"<p>Buongiorno, non riesco a connettermi a info@villaggioidra.it cosa debbo fare&nbsp;? </p>",thunderbird;email-and-messaging;,thunderbird,email-and-messaging,it,1746376;,info6060
1520528,2025-07-02 22:08:43 -0700,2025-07-02 22:08:43 -0700,Primary password lost Mozilla reset failed,"<p>I recently lost Internet and waiting for new provider 12/6. I get msg "" pls enter your Primary Password on Thunderbird. The one I've had for years fails and new choice through the Mozilla help reset area fails too.....is reset dependent on broadband/Internet? I have inet on phone but CANNOT transfer usage to desktop!!!&nbsp;? help? </p>",thunderbird;passwords-and-sign-in;,thunderbird,passwords-and-sign-in,en-US,"",jaybeewebb
1520535,2025-07-02 22:34:46 -0700,2025-07-02 22:34:46 -0700,Transferring Thunderbird to new laptop,"<p>When I downloaded the Thunderbird app to my new laptop and opened it, it already had a fortnight's worth of recent messages in the Inbox, plus many of my Sent messages. However, the remainder of the Inbox, dating back to 2010, was not there, neither were my address books. Why didn't a clean copy of the app download so I can import my Profiles? In addition, my old laptop uses POP incoming, but the new laptop seems to be configured to IMAP. Is this a problem, and if so, which should I choose for the new laptop? </p>",thunderbird;settings;,thunderbird,settings,en-US,"",cmfindlay
1520540,2025-07-02 23:22:12 -0700,2025-07-02 23:31:07 -0700,THUNDERBIRD NON RISPONDE,<p>IL PROGRAMMA CONTINUA AD INTERROMPERSI DICENDO CHE NON RISPONDE </p>,thunderbird;app-crash;needsinfo;,thunderbird,app-crash,it,1746379;,ilmondodelserramento90
1520545,2025-07-03 00:07:36 -0700,2025-07-03 00:07:36 -0700,Cannot load profile,"<p>Hi, Win 10 Pro new installation. Dell Optiplex MBR type Bios. </p><p>I had saved a recent profile to an external drive in its own name (i.e. not the profiles folder) </p><p>After the new Win 10 installation, I downloaded a new copy of Thunderbird. </p><p>I then copied the saved profile into the new Profiles folder, selected it in Choose user profile and started Thunderbird.   </p><p>Thunderbird opened but not with the saved (8+ Gb) profile, just one new email account and asking for passwords to other email accounts I used before, and no folders. </p><p>I went back into the profiles folder and renamed all other profiles ""OLDxxx999, but still the same one new email account when I opened Thunderbird. </p><p>I desperately need the saved email folders - I don't mind loading all the email accounts again, just need my court case history folders. </p><p>How can I force Thunderbird to use the saved profile, or can I identify and individually load in the saved local folders?  </p><p>Thank you for any guidance towards a solution. </p>",thunderbird;accounts;,thunderbird,accounts,en-US,"",jfdi
1520561,2025-07-03 01:41:39 -0700,2025-07-03 02:13:40 -0700,"indicazione scheda ""corrispondenti"": diverso dal mittente effettivo","<p>Nell'account pec configurato Thunderbird , nella posta in arrivo, da qualche tempo, la scheda ""corrispondenti"" indica sempre lo stesso nome ma che è diverso e non corrisponde al vero mittente del messaggio. come posso risolvere </p>",thunderbird;contacts;,thunderbird,contacts,it,1746396;,federicausai
1520578,2025-07-03 03:39:52 -0700,2025-07-03 03:39:52 -0700,Le email di richiesta nel mio sito vengono da poco individuate come spam,"<p>le email di richiesta informazioni del mio sito vengono segnalate sempre come spam da qualche mese senza aver cambiato nulla.  Questo il messaggio: che devo fare? Gentile cliente,   I nostri sistemi automatici hanno identificato l'e-mail allegata come SPAM.  </p><p>Per tutelare la sicurezza del tuo account, abbiamo provveduto ad imbustare ed allegare il messaggio originale eliminando eventuali allegati presenti che, qualora aperti, potrebbero risultare rischiosi.  </p><p>Ti consigliamo inoltre di non cliccare sui link presenti nel messaggio a meno che tu non lo ritenga attendibile.  </p><p>Nel caso in cui l'email segnalata non sia SPAM e tu desideri ricevere la comunicazione sulla tua casella, puoi inserire il mittente all'interno della White List e richiedere al mittente un nuovo invio.  </p><p>Per impostare regole relative alla White List dovrai:  -          Accedere alla Webmail  -          Selezionare le voci ""Opzioni"" - ""Antispam"" nel menu a sinistra  -          All'interno della sezione ""White list"" inserire il mittente da considerare attendibile. </p>",thunderbird;privacy-and-security_1;,thunderbird,privacy-and-security,it,"",sales209
