id,created,updated,locale,product,title,is_solved,solution,solved_by,is_spam,last_answer,answers,topic,tags,creator,content,involved,is_archived,is_locked,is_taken,metadata,num_answers,num_votes_past_week,num_votes,taken_until,taken_by,updated_by
1501999,2025-03-26 20:20:02 -0700,2025-03-28 10:00:14 -0700,en-US,thunderbird,Thunderbird channels,true,1721524,jeff-g,false,1721789,1721477;1721524;1721545;1721574;1721789;,update,thunderbird;update;,jeff-g,"<p>I have been trying to stay on releases and was told to upgrade to 115.10.1.  So I did that and was told to go to 115.18.0 and it was not noted as esr.  So I did and was immediately told to go to 128.8.1 esr.  I was not on the esr channel and do not want/need to be on esr.  about:config has been changed to esr channel from release w/o my ok - the least I'd expect is a warning.  Release 115.x.x has betas and releases more than I had seen previously - aboutr 25-26.  It looks like nothing but betas from 116 to 128 and a lot of what look like releases from x.0 to x.10.2 which is new to me.  What is the rational behind all these versions and why there is not a simple center of how to use this info?  I remember when way back, tbird had issues but they were manageable. </p>",jeff-g;wsmwk;Yu5tiqX9og;James;,true,false,false,;useragent:Mozilla/5.0 (X11; Linux x86_64; rv:136.0) Gecko/20100101 Firefox/136.0;solver_id:1626539,5,0,0,,,
1502000,2025-03-26 20:41:01 -0700,2025-03-26 21:55:26 -0700,en-US,thunderbird,Does the Win 10 version of Thunderbird run under a Windows 11 softwar on a desktop?,false,,,false,1721413,1721412;1721413;,install,thunderbird;install;,mccoydennis45,<p>Is Win 10 version of Thunderbird compatible with Win 11?? </p>,mccoydennis45;firefox1670;James;,true,false,false,;useragent:Mozilla/5.0 (Windows NT 10.0; Win64; x64; rv:136.0) Gecko/20100101 Firefox/136.0,2,0,0,,,
1502003,2025-03-26 20:48:19 -0700,2025-03-26 20:48:19 -0700,en-US,thunderbird,Login to server imap.ipage.com with username failed,false,,,false,,"",send-and-receive-email,thunderbird;send-and-receive-email;,kongdm69,"<p>Login to server <a href=""http://imap.ipage.com"" rel=""nofollow"">imap.ipage.com</a> with username failed </p>",kongdm69;,true,false,false,";useragent:Mozilla/5.0 (Windows NT 10.0; Win64; x64) AppleWebKit/537.36 (KHTML, like Gecko) Chrome/134.0.0.0 Safari/537.36 Edg/134.0.0.0",0,0,0,,,
1502010,2025-03-26 22:06:27 -0700,2025-03-28 06:51:29 -0700,en-US,thunderbird,Constantly being logged out of account.,false,,,false,1721720,1721483;1721637;1721720;,passwords-and-sign-in,thunderbird;passwords-and-sign-in;,highonmusic,"<p>Hi, I am working on behalf of my dad to figure out what's going on with his Thunderbird client and trying to understand if it's a client issue, or an issue with his email address. </p><p>The e-mail address used belongs to The Messaging Company (as they have bought out iiNet/AAPT). There are issues where my dad is logged out constantly and has to retype his password, and sometimes is unable to send or receive mail. I have updated server in-going and out-going according to The Messaging Company's suggestion. I've attached screenshots. </p><p>Let me know what else I can do to troubleshoot if this is Thunderbird client or issues with the email service. </p>",highonmusic;mozilla98;,true,false,false,;useragent:Mozilla/5.0 (Windows NT 10.0; Win64; x64; rv:136.0) Gecko/20100101 Firefox/136.0,3,0,1,,,highonmusic
1502021,2025-03-26 23:37:38 -0700,2025-03-26 23:37:38 -0700,en-US,thunderbird,e-mail werden nicht geladen,false,,,true,,"",send-and-receive-email,thunderbird;send-and-receive-email;,vbischoff,"<p>e-mails werden nicht geladen </p><p>vbischoff@kabelmail.de vbischoff@t<a href=""http://-online.de"" rel=""nofollow"">-online.de</a> vobischoff@gmail.com </p>",vbischoff;,true,false,false,";useragent:Mozilla/5.0 (Windows NT 10.0; Win64; x64) AppleWebKit/537.36 (KHTML, like Gecko) Chrome/134.0.0.0 Safari/537.36",0,0,0,,,
1502036,2025-03-27 00:53:12 -0700,2025-03-27 06:13:41 -0700,nl,thunderbird,Ik ontvang al twee dagen geen mail en kan nog wel verzenden.,false,,,true,1721436,1721436;,email-and-messaging,thunderbird;email-and-messaging;,JosvanBeurdne,<p>Door mij even te bellen en te helpen (ik ben beetje digibeet) </p>,JosvanBeurdne;Mozilla-assistent;,true,false,false,";useragent:Mozilla/5.0 (Windows NT 10.0; Win64; x64) AppleWebKit/537.36 (KHTML, like Gecko) Chrome/134.0.0.0 Safari/537.36;kb_visits_prior:[""/nl/kb/kan-geen-berichten-ontvangen""]",1,0,0,,,Fjoerfoks
1502039,2025-03-27 01:19:09 -0700,2025-03-27 01:19:09 -0700,en-US,thunderbird,gmail not able to configure,false,,,false,,"",connectivity,thunderbird;connectivity;,sreedhar.kvsree,"<p>dear sir my gmail was working till now. it stopped working from past 5 days. i removed account , cache and try to configure. it is not able to connect also. able to access mail from <a href=""http://gmail.com"" rel=""nofollow"">gmail.com</a> </p><p>can you help me. neither pop or imps <a href=""http://working.it"" rel=""nofollow"">working.it</a> poping up one screen attached with this url <a href=""https://accounts.google.com/o/oauth2/auth?response_type=code&amp;client_id=406964657835-aq8lmia8j95dhl1a2bvharmfk3t1hgqj.apps.googleusercontent.com&amp;redirect_uri=http%3A%2F%2Flocalhost&amp;scope=https%3A%2F%2Fmail.google.com%2F+https%3A%2F%2Fwww.googleapis.com%2Fauth%2Fcarddav+https%3A%2F%2Fwww.googleapis.com%2Fauth%2Fcalendar&amp;login_hint=Sreedhar.kvsree%40gmail.com"" rel=""nofollow"">https://accounts.google.com/o/oauth2/auth?response_type=code&amp;client_id=406964657835-aq8lmia8j95dhl1a2bvharmfk3t1hgqj.apps.googleusercontent.com&amp;redirect_uri=http%3A%2F%2Flocalhost&amp;scope=https%3A%2F%2Fmail.google.com%2F+https%3A%2F%2Fwww.googleapis.com%2Fauth%2Fcarddav+https%3A%2F%2Fwww.googleapis.com%2Fauth%2Fcalendar&amp;login_hint=Sreedhar.kvsree%40gmail.com</a> </p><p>not connecting what ever i do. telling invalid userid /password </p>",sreedhar.kvsree;,true,false,false,";useragent:Mozilla/5.0 (Windows NT 10.0; Win64; x64) AppleWebKit/537.36 (KHTML, like Gecko) Chrome/134.0.0.0 Safari/537.36",0,0,0,,,
1502043,2025-03-27 02:13:43 -0700,2025-03-27 02:13:43 -0700,en-US,thunderbird,Envoie d'un couriel à la messagerie WANADOO,false,,,false,,"",send-and-receive-email,thunderbird;send-and-receive-email;,negrierfrancois,"<p>Bonjour, j'ai envoyé , hier Mercredi 26 Mars 2025 , un courriel à un client Wanadoo , je ne trouve pas , l'envoie du message dans Thunderbird&nbsp;!!! , comment faire pour retrouver ce méssage&nbsp;? , vous remerciant , dans l'attente , cordialement , François NEGRIER . </p>",negrierfrancois;,true,false,false,";useragent:Mozilla/5.0 (Windows NT 10.0; Win64; x64) AppleWebKit/537.36 (KHTML, like Gecko) Chrome/134.0.0.0 Safari/537.36;kb_visits_prior:[""/fr/kb/accessibilite-avec-thunderbird""]",0,0,0,,,
1502044,2025-03-27 02:25:04 -0700,2025-03-28 07:07:15 -0700,it,thunderbird,Eliminare definitivamente un account,true,1721442,@next,false,1721728,1721442;1721728;,account-management,thunderbird;account-management;,vegavox1,<p>Devo cancellare un account collegato ad una email Hotmail che non è più attiva. Come posso fare? Grazie! </p>,vegavox1;@next;,true,false,false,;useragent:Mozilla/5.0 (Windows NT 10.0; Win64; x64; rv:136.0) Gecko/20100101 Firefox/136.0;solver_id:3362914,2,0,2,,,
1502051,2025-03-27 03:04:17 -0700,2025-03-27 04:40:29 -0700,en-US,thunderbird,Multiple Folders,false,,,false,1721462,1721455;1721460;1721462;,customization,thunderbird;customization;,jimparker1,"<p>I have 3 email addresses at Zen for me (jimparker@corppcsoft.com), my wife(Estherparker@corppcsoft.com) and son (Zacparker@corppcsoft.com). Previously in Thunderbird (Windows 11) I had the usual folders for inbox, sent, trash, spam under each of these headings. This has recently changed with no input from me to multiple repeats of the contents of folder but with different quantities (many missing) under the following headings: All folders; Local Folders x2; Unified Folders; Favourite Folders; Unread Folders; Recent Folders How do I return this to its original display without losing any saved messages please? </p>",jimparker1;davidsk;,true,false,false,";useragent:Mozilla/5.0 (Windows NT 10.0; Win64; x64) AppleWebKit/537.36 (KHTML, like Gecko) Chrome/134.0.0.0 Safari/537.36",3,0,0,,,
1502054,2025-03-27 03:36:59 -0700,2025-03-27 03:36:59 -0700,en-US,thunderbird,Auto-Redirect If No Reply,false,,,false,,"",extensions,thunderbird;extensions;,isaaca,"<p>Before switching to Thunderbird, I used a VBA script in Outlook to redirect/resend emails if the recipient hadn't replied by a set time and date. The VBA script and instructions can be found <a href=""https://www.extendoffice.com/documents/outlook/6922-outlook-resend-email-if-no-response.html"" rel=""nofollow"">here</a>. Is there a Thunderbird add-on that can achieve similar results? </p>",isaaca;,true,false,false,;useragent:Mozilla/5.0 (Windows NT 10.0; Win64; x64; rv:136.0) Gecko/20100101 Firefox/136.0,0,0,0,,,
1502056,2025-03-27 03:44:39 -0700,2025-03-27 05:43:08 -0700,en-US,thunderbird,mails,false,,,false,1721473,1721473;,send-and-receive-email,thunderbird;send-and-receive-email;,estevepi,"<p>bonjour, je n'arrive plus à envoyer des mails. cela fonctionne très bien avant la mise à jour. voila le message/ erreur d'envoi du message l'envoi du message a échoué une erreur est survenue lors de l'envoi de l'e-mail.le serveur du courrier a répondu/ &lt;unknown(2a01:ec1a:6780:69e9:5c3:9bf4):49204&gt;:client host rejected:Access denied. Vuillez vérifier l'adresserions du destinataire estevepi@free.fr et essayer à nouveau. Mais les mails envoyés sont bloqués; très cordialement Estève </p>",estevepi;davidsk;,true,false,false,";useragent:Mozilla/5.0 (Macintosh; Intel Mac OS X 10_15_7) AppleWebKit/605.1.15 (KHTML, like Gecko) Version/18.3.1 Safari/605.1.15",1,0,0,,,
1502063,2025-03-27 04:36:14 -0700,2025-03-29 00:59:03 -0700,en-US,thunderbird,Large message corrupted in Thunderbird after sending,false,,,false,1721886,1721884;1721886;,send-and-receive-email,thunderbird;send-and-receive-email;,marck1,"<p>I sent a message with 2 large attachments, which came to about 700kb. I have my email account configured to move replies to the original message folder after sending. The sent message appears blank in the folder. View source reveals little but starts with the following: <em>X-Mozilla-Status: 0001 </em> X-Mozilla-Status2: 00000000 IesvbLYCv+2WRXVrCMCm89IOemygPZpNbz2NBY [and so on for 433 lines of 73 bytes]<em>,  &lt; 32kb. </em> </p><p>When I use my online webmail interface, the message that Thunderbird can no longer read is intact, legible and contains both the large attachments. The same is true when viewed in another email client. I have restored the message by exporting it from the webmail and importing it back to Thunderbird (to keep my records intact), which Thunderbird handles okay.  </p><p>The outgoing mail server log shows that the message received from Thunderbird and sent to the final recipient was the correct 700kb+ size. </p><p>I'm rather curious as to what went on there.   </p><p>Attachments to post:  1. View of the corrupt message in the Trash folder 2. Intact message after importing as an export from webmail. </p>",marck1;wsmwk;,true,false,false,";useragent:Mozilla/5.0 (Windows NT 10.0; Win64; x64) AppleWebKit/537.36 (KHTML, like Gecko) Chrome/134.0.0.0 Safari/537.36 Edg/134.0.0.0",2,0,0,,,
1502072,2025-03-27 05:47:31 -0700,2025-03-27 06:24:23 -0700,hu,thunderbird,Beérkező üzenetek helye,true,1721480,meskobalazs,false,1721480,1721480;,send-and-receive-email,thunderbird;send-and-receive-email;,drkiss,"<p>Előre is köszönöm a választ, a kérdés: </p><p>Hol és hogyan lehet beállítani, hogy egy adott postafiókba érkező üzenetek ne az adott postafiók Beérkező üzenetek mappájába, hanem a Helyi mappákba érkezzen? </p><p>Üdv, Kiss Csaba </p>",drkiss;meskobalazs;,true,false,false,;useragent:Mozilla/5.0 (Windows NT 10.0; Win64; x64; rv:136.0) Gecko/20100101 Firefox/136.0;solver_id:6591151,1,0,0,,,
1502078,2025-03-27 06:04:59 -0700,2025-03-27 06:04:59 -0700,en-US,thunderbird,"""Dismiss all"" button in Calendar Reminders window",false,,,false,,"",events,thunderbird;events;,sbweaver71,"<p>Is it possible to disable the ""Dismiss All"" button in the lower-right side of the Calendar Reminders window?  I must have inadvertently clicked on that and my list of current (un-dismissed) reminders has completely disappeared.  I am more of a line-by-line dismisser of reminders.  If I accidentally dismiss one line, at least I can quickly write down what it was while it's fresh in my mind.  Not so easy when my list of 10 or 15 reminders is gone in one single click. </p><p>Or, if the button can't be disabled, can the developers add an ""Are you sure?"" prompt to the ""Dismiss All"" sequence?   </p><p>(I realize all those reminders can still be found by looking around in the main Calendar window, but that takes a lot of time to find the ones that should not yet be dismissed.) </p><p>Thanks!! </p>",sbweaver71;,true,false,false,";useragent:Mozilla/5.0 (Windows NT 10.0; Win64; x64) AppleWebKit/537.36 (KHTML, like Gecko) Chrome/134.0.0.0 Safari/537.36",0,0,0,,,
1502080,2025-03-27 06:17:48 -0700,2025-03-27 07:36:06 -0700,en-US,thunderbird,How do I report a scam e-mail?,false,,,false,1721502,1721502;,junk-mail-and-spam,thunderbird;junk-mail-and-spam;,snorkelsj,<p>How do I report a scam e-mail? </p>,snorkelsj;davidsk;,true,false,false,;useragent:Mozilla/5.0 (Windows NT 6.1; rv:115.0) Gecko/20100101 Thunderbird/115.10.1,1,0,0,,,
1502085,2025-03-27 06:32:37 -0700,2025-03-27 10:28:23 -0700,en-US,thunderbird,Envoi des messages impossibles,false,,,true,1721553,1721491;1721553;,email-and-messaging,thunderbird;email-and-messaging;,francinecornilleir,"<p>Bonjour, Depuis 15 jours, je reçois bien mes messages sur la boite ""na.patrimoine@orange.fr"" mais impossible d'en envoyer ... je reçois un message d'erreur que je vous joins ... j'ai essayé de modifié l'adresse du serveur sans succès... Merci de votre aide Bien cordialement, Anne NIGAUT 06 81 40 80 74 </p>",francinecornilleir;sfhowes;,true,false,false,";useragent:Mozilla/5.0 (Windows NT 10.0; Win64; x64) AppleWebKit/537.36 (KHTML, like Gecko) Chrome/134.0.0.0 Safari/537.36 Edg/134.0.0.0",2,0,1,,,
1502090,2025-03-27 07:09:25 -0700,2025-03-31 05:38:35 -0700,cs,thunderbird,Chybné zobrazování některých HTML zpráv v Thunderbirdu,true,1721512,Ansamb,false,1722253,1721512;1721694;1721695;1721702;1722253;,email-and-messaging,thunderbird;email-and-messaging;,kimba3b,"<p>Dobrý den&nbsp;! Thunderbird mi u některých došlých zpráv zobrazuje text HTML zprávy rozsekaný po jednom nebo dvou slovech pod sebou v jednom úzkém sloupci. Na serveru poskytovatele mailu se ale zpráva zobrazuje správně. Přepnutí zobrazení mailu do prostého textu sice přečíst pomůže, ale není to komfortní. Většina mailů se zobrazuje normálně, jen některé se zobrazují chybně. V čem je problém a jak tuto chybu zobrazení napravit? Mám aktuální verzi TV (128.8.1esr) a Windows 10. Děkuji&nbsp;! </p>",kimba3b;Ansamb;poljos-moz;,true,false,false,";useragent:Mozilla/5.0 (Windows NT 10.0; Win64; x64) AppleWebKit/537.36 (KHTML, like Gecko) Chrome/132.0.0.0 Safari/537.36 OPR/117.0.0.0;solver_id:6594244",5,0,0,,,
1502098,2025-03-27 07:49:51 -0700,2025-03-27 10:27:24 -0700,en-US,thunderbird,Thunderbird - ver. 128.8.1 - MAC / OSX 14.4.1,false,,,false,1721551,1721550;1721551;,send-and-receive-email,thunderbird;send-and-receive-email;,tony304,<p>Been a LONG TIME user of Thunderbird (over 15 years) updated recently and now my Thunderbird e-mail server will not download e-mails off my Network Solutions acct. My I-Phone has no problem and the setting as the same (I doubled checked the settings) POP acct. same server settings . . same password . . etc.  </p><p>Please get back to me as to how to fix this . . I'm in IT and I simply can't figure out why it just stopped work (ALL THE ACCTS on the mail server stopped downloading) it is not the internet connection  . . I'm writing you through the same laptop / computer / using a browser.  </p><p>Thank you&nbsp;!  </p><p>Tony Caio </p>,tony304;Toad-Hall;jeff-g;,true,false,false,";useragent:Mozilla/5.0 (Macintosh; Intel Mac OS X 10_15_7) AppleWebKit/537.36 (KHTML, like Gecko) Chrome/134.0.0.0 Safari/537.36",2,0,0,,,
1502101,2025-03-27 07:52:19 -0700,2025-03-27 08:15:08 -0700,en-US,thunderbird,Add-ons,false,,,false,1721511,1721511;,extensions,thunderbird;extensions;,annette27,<p>I want to add the RainbowNote and want to know if it is safe and secure.  Are all add-ons listed as Thunderbird verified to be from any malware? </p>,annette27;davidsk;,true,false,false,;useragent:Mozilla/5.0 (Windows NT 10.0; Win64; x64; rv:136.0) Gecko/20100101 Firefox/136.0,1,0,0,,,
1502102,2025-03-27 08:01:32 -0700,2025-03-28 14:58:41 -0700,en-US,thunderbird,Thunderbird Google pop up screen,false,,,true,1721772,1721546;1721552;1721714;1721721;1721767;1721772;,accessibility,thunderbird;accessibility;,gnye307,"<p>With the latest update 136.01 whenever I click on any Thunderbird mail I get a popup screen that says ""Thunderbird Email wants to access you Google account"". </p><p>The screen implies there is an ""Alow"" link that I should click on but none exists! Then the only way out of this screen is use the esc key. That takes me back to my Thunderbird mail but anything I try to initialise thi popo up screen again.  So my email account is totally unusable. I have used Thunderbird over ten years and have not had any problem.  I hope it can be fixed.  Thank You.  Gary Nye. text me at [edited from community support forum] </p>",gnye307;jeff-g;Toad-Hall;,true,false,false,;useragent:Mozilla/5.0 (Windows NT 10.0; Win64; x64; rv:136.0) Gecko/20100101 Thunderbird/136.0.1,6,0,1,,,James
1502103,2025-03-27 08:01:54 -0700,2025-03-27 08:01:54 -0700,en-US,thunderbird,Autofile addon installation - cannot change support email for autofile addon,false,,,false,,"",extensions,thunderbird;extensions;,hcom4242,"<p>Hello, </p><p>I am the developer of the autofile addon. I am trying to change the support email address for this addon. In the edit/manage page (<a href=""https://addons.thunderbird.net/fr/developers/addon/autofile-fast-e-mail-to-folder/edit"" rel=""nofollow"">https://addons.thunderbird.net/fr/developers/addon/autofile-fast-e-mail-to-folder/edit</a>) I did successfully change the old support email address(autofile@oasisllc.com) to the new one (autofile@europhages.com) in the required fields.  However the update does not happens in the module page and  the email address remains the old one(autofile@oasisllc.com) when you try to send an email to support  from the module page. </p><p>Actually the email remains stuck to the UUID in the module's manifest (autofile@oasisllc.com). It is like the support email remains stuck to the email in the module's manifest. </p><p>Btw, I am in France and I use the French version of the interface. Maybe this interface version needs be updated. </p><p>Thanks. </p><p>Henri </p>",hcom4242;,true,false,false,";useragent:Mozilla/5.0 (Windows NT 10.0; Win64; x64) AppleWebKit/537.36 (KHTML, like Gecko) Chrome/134.0.0.0 Safari/537.36",0,0,0,,,
1502105,2025-03-27 08:07:39 -0700,2025-07-14 07:55:58 -0700,en-US,thunderbird,unable to login in with the icloud.com,false,,,false,1748981,1721541;1721568;1721617;1721749;1721762;1721766;1721779;1721995;1748981;,account-management,thunderbird;account-management;,yulijuan0711,<p>please let me know how I can login in Thunderbird email with my username （xuweikang2015@icloud.com）and password. </p>,yulijuan0711;jeff-g;Toad-Hall;mozilla98;RadeRad;,true,false,false,";useragent:Mozilla/5.0 (iPhone; CPU iPhone OS 18_3_2 like Mac OS X) AppleWebKit/605.1.15 (KHTML, like Gecko) Version/18.3.1 Mobile/15E148 Safari/604.1;kb_visits_prior:[""/zh-CN/kb/%E8%AE%BE%E7%BD%AE%E4%B8%BB%E5%AF%86%E7%A0%81"", ""/zh-CN/kb/%E5%88%9D%E7%BA%A7%E5%AF%86%E7%A0%81%E6%AD%A3%E5%9C%A8%E6%9B%BF%E6%8D%A2Thunderbird%E4%B8%AD%E7%9A%84%E4%B8%BB%E5%AF%86%E7%A0%81""]",9,0,6,,,
1502114,2025-03-27 08:46:27 -0700,2025-04-23 01:07:42 -0700,en-US,thunderbird,How to view only one message in preview pane,true,1727469,Mapenzi,false,1727639,1721620;1727348;1727411;1727464;1727465;1727469;1727471;1727532;1727639;,customization,thunderbird;customization;,ugcheleuce,"<p>Hello everyone </p><p>I recently upgraded from TB 69 to the latest TB (after a crucial add-on finally got updated), and I'm generally happy with it, except for one little irk:  </p><p>In Classic layout, the preview pane now contain multiple messages.  As far as I can tell, it contains all messages of the selected thread, in date order (not in message list order).  I would prefer the preview pane to contain just ONE message, namely the currently selected message.  It is annoying to have to click repeatedly inside the preview pane to access the individual messages in the preview pane.  It is also visually confusing (to me). </p><p>What's worse, the messages in the preview pane do not follow the normal threading: they appear to be shown in order of date, not in the order of the messages in the message list. </p><p>In the screenshot, you can see the thread has 11 messages, and in the message list there are three subthreads.  The preview pane also shows the 11 messages, but not in the same order as in the message list. Plus, in order for me to read any messages, I need to click inside the preview pane to fold each message in or out. </p><p>I prefer a situation where I can click a single message in the message list, and a single message is shown in the preview pane.  Is this possible with the latest TB? </p><p>Thanks. </p>",ugcheleuce;mozilla98;sm007jr;Mapenzi;,true,false,false,";solver_id:2187082;useragent:Mozilla/5.0 (Windows NT 10.0; Win64; x64) AppleWebKit/537.36 (KHTML, like Gecko) Chrome/134.0.0.0 Safari/537.36",9,0,1,,,
1502116,2025-03-27 08:57:49 -0700,2025-04-20 06:36:19 -0700,en-US,thunderbird,uninstall hidden Thunderbird components for a clean reinstall,false,,,false,1726998,1721529;1721547;1726998;,install,thunderbird;install;,anniesmart,"<p>I have tried 3 times to do a 100% clean out of my old Thunderbird program for a clean re-install. But it never works, so when I install TB afresh the same glitch pops back up, making the program unusable, and the process has to be repeated. Any clues anyone? I like Thunderbird! I use win 10 upgraded to win 11 and comcast provides my email service. Thanks. </p>",anniesmart;jeff-g;sfhowes;wsmwk;,true,false,false,";useragent:Mozilla/5.0 (Windows NT 10.0; Win64; x64; rv:135.0) Gecko/20100101 Firefox/135.0;kb_visits_prior:[""/en-US/kb/installing-thunderbird-windows""]",3,0,2,,,
1502119,2025-03-27 09:31:28 -0700,2025-03-27 09:39:50 -0700,en-US,thunderbird,block a email,false,,,false,1721532,1721532;,send-and-receive-email,thunderbird;send-and-receive-email;,david283,<p>how do I block an incoming email </p>,david283;jeff-g;,true,false,false,";useragent:Mozilla/5.0 (Windows NT 10.0; Win64; x64) AppleWebKit/537.36 (KHTML, like Gecko) Chrome/134.0.0.0 Safari/537.36 Edg/134.0.0.0",1,0,0,,,
1502122,2025-03-27 09:41:57 -0700,2025-03-30 01:15:35 -0700,en-US,thunderbird,not receiving as many emails as before why,false,,,false,1722049,1722049;,send-and-receive-email,thunderbird;send-and-receive-email;,pmay7,<p>not receiving as many emails as before why </p>,pmay7;wsmwk;,true,false,false,";useragent:Mozilla/5.0 (Windows NT 10.0; Win64; x64) AppleWebKit/537.36 (KHTML, like Gecko) Chrome/134.0.0.0 Safari/537.36 Edg/134.0.0.0",1,0,0,,,
1502123,2025-03-27 09:43:36 -0700,2025-03-30 01:14:30 -0700,en-US,thunderbird,not receiving as many emails as before why,false,,,false,1722048,1722048;,send-and-receive-email,thunderbird;send-and-receive-email;,pmay7,<p>not receiving as many emails as before why </p>,pmay7;wsmwk;,true,true,false,";useragent:Mozilla/5.0 (Windows NT 10.0; Win64; x64) AppleWebKit/537.36 (KHTML, like Gecko) Chrome/134.0.0.0 Safari/537.36 Edg/134.0.0.0",1,0,0,,,
1502124,2025-03-27 09:47:10 -0700,2025-03-30 02:43:49 -0700,en-US,thunderbird,IMAP Email not deleting from server until Thunderbird is closed.,false,,,false,1722065,1722065;,send-and-receive-email,thunderbird;send-and-receive-email;,tony263,"<p>After the latest update I noticed a syncing issue.  I have thunderbird on my imac and I also check my email with my iphone using iphones mail program.  I am using IMAP.  What happened after the update is when I delete a message in thunderbird it doesnt delete from the mail server, so it still shows in my iphone.  If I close out of thunderbird it then removes it from the server.   Everything else is syncing correctly, like showing a message read or not etc.  Just the deleting doesn't happen till thunderbird is closed.  Am I missing a new setting that has to be changed now?  I have used Thunderbird for my email since the start and this is the first time I have had an issue.  Thank you </p>",tony263;Yu5tiqX9og;,true,false,false,;useragent:Mozilla/5.0 (Macintosh; Intel Mac OS X 10.15; rv:136.0) Gecko/20100101 Firefox/136.0,1,0,1,,,
1502125,2025-03-27 09:52:49 -0700,2025-03-28 04:26:28 -0700,en-US,thunderbird,I am unable to delete my comcast.net email account,false,,,false,1721701,1721701;,account-management,thunderbird;account-management;,grigsfam,<p>How do I remove my grigsfam@comcast.net email account from Thunderbird. I only want my grigsfam@gmail.com email account </p><p>I have tried following the online steps shown by Mozilla </p>,grigsfam;davidsk;,true,false,false,;useragent:Mozilla/5.0 (Windows NT 10.0; Win64; x64; rv:136.0) Gecko/20100101 Firefox/136.0,1,0,0,,,
