id,created,updated,locale,product,title,is_solved,solution,solved_by,is_spam,last_answer,answers,topic,tags,creator,content,involved,is_archived,is_locked,is_taken,metadata,num_answers,num_votes_past_week,num_votes,taken_until,taken_by,updated_by
1537907,2025-09-25 09:12:14 -0700,2025-09-25 10:41:24 -0700,en-US,thunderbird,opłata Thunderbird,false,,,false,1767400,1767400;,accessibility,thunderbird;accessibility;,joanna.kaczmarczyk,"<p>Mam zablokowane konto i pojawia się konieczność zapłacenia darowizny. Niestety darowizna wymaga zapłaty kartą kredytową której nie mam. Chcę zapłacić przelewem lub BLIK jak to zrobić, by odblokować konto </p>",joanna.kaczmarczyk;davidsk;,false,false,false,";useragent:Mozilla/5.0 (Windows NT 10.0; Win64; x64) AppleWebKit/537.36 (KHTML, like Gecko) Chrome/140.0.0.0 Safari/537.36",1,0,0,,,
1537910,2025-09-25 09:26:17 -0700,2025-09-25 13:13:23 -0700,en-US,thunderbird,Thunderbird and Gmail,false,,,false,1767438,1767390;1767438;,customization,thunderbird;customization;,wd5don,"<p>Hi, </p><p>Trying to wade through the Gmail craziness with Thunderbird.  What I want to do is remove all local storage of incoming messages on my Gmail account, as well as the LOCAL COPIES ONLY of all messages that are already on my machine.  I don't mind if TB has to go to the Gmail servers to retrieve an old email, I just don't want anything but the headers taking up space on my hard drive.  How do I do this safely, to insure that I don't lose all my emails? </p><p>Thanks much! </p><p>Don </p>",wd5don;davidsk;,false,false,false,";useragent:Mozilla/5.0 (Windows NT 10.0; Win64; x64) AppleWebKit/537.36 (KHTML, like Gecko) Chrome/109.0.0.0 Safari/537.36;kb_visits_prior:[""/en-US/kb/thunderbird-and-gmail""]",2,0,0,,,
1537919,2025-09-25 09:58:00 -0700,2025-09-25 11:28:55 -0700,en-US,thunderbird,Sync google contacts - Does it work?,true,1767397,"{""username""=>""sfhowes"", ""display_name""=>""sfhowes"", ""avatar""=>""https://firefoxusercontent.com/c92a42cdab68b73a39b7e6b5bde36e39""}",false,1767403,1767388;1767397;1767399;1767401;1767403;,contacts,thunderbird;contacts;,jon68,"<p>I thought up a sync for google contacts , but it seems to be broken. I tried to redo it and got an error(see image). Can it work? How? </p>",jon68;davidsk;sfhowes;,false,false,false,;solver_id:7053086;useragent:Mozilla/5.0 (Windows NT 10.0; Win64; x64; rv:143.0) Gecko/20100101 Firefox/143.0,5,0,0,,,
1537926,2025-09-25 12:06:35 -0700,2025-09-25 12:06:35 -0700,en-US,thunderbird,reminding time (one day) for dates.,false,,,false,,"",events,thunderbird;events;,mail2461,<p>Since a last update the calendar in thunderbird ignore the reminding time (one day) for dates. </p>,mail2461;,false,false,false,";useragent:Mozilla/5.0 (Windows NT 10.0; Win64; x64) AppleWebKit/537.36 (KHTML, like Gecko) Chrome/140.0.0.0 Safari/537.36",0,0,0,,,
1537929,2025-09-25 12:08:55 -0700,2025-09-26 04:53:34 -0700,en-US,thunderbird,How to fix RBL restriction error,false,,,false,1767630,1767630;,send-and-receive-email,thunderbird;send-and-receive-email;,joemorgan,<p>How can I fix an RBL restriction error and send emails again? </p>,joemorgan;davidsk;,false,false,false,;useragent:Mozilla/5.0 (Windows NT 10.0; Win64; x64; rv:136.0) Gecko/20100101 Firefox/136.0,1,0,0,,,
1537930,2025-09-25 12:15:42 -0700,2025-09-25 12:15:42 -0700,en-US,thunderbird,Thunderbird 143 Calendar not loading events,false,,,false,,"",events,thunderbird;events;,ArtLikesThunderbird,"<p>Thunderbird Calendar is not automatically loading events when TB starts. I must delete &amp; import one of my calendar's for it to load all past &amp; future events on all my calendars? I use the .ics format. </p><p>FYI, I recently upgraded from an old version of Thunderbird to the current version. Thanks for any help. </p>",ArtLikesThunderbird;,false,false,false,;useragent:Mozilla/5.0 (Windows NT 10.0; Win64; x64; rv:143.0) Gecko/20100101 Firefox/143.0,0,0,0,,,
1537932,2025-09-25 12:17:50 -0700,2025-09-25 13:05:35 -0700,en-US,thunderbird,thunderbird,false,,,false,1767432,1767432;,send-and-receive-email,thunderbird;send-and-receive-email;,stevech49,"<p>I just moved my emails to a new windows 11 computer, but my <a href=""http://verizon.net"" rel=""nofollow"">verizon.net</a> account will not connect. The error message says server <a href=""http://pop.verizon.net"" rel=""nofollow"">pop.verizon.net</a> with username schjd failed. please. can you give me some guidance I would appreciate it. Thank you. </p>",stevech49;davidsk;,false,false,false,";useragent:Mozilla/5.0 (Windows NT 10.0; Win64; x64) AppleWebKit/537.36 (KHTML, like Gecko) Chrome/140.0.0.0 Safari/537.36 Edg/140.0.0.0",1,0,0,,,
1537937,2025-09-25 12:40:00 -0700,2025-09-25 13:08:05 -0700,en-US,thunderbird,My Thunderbird receives EM but will not send them but my Outlook works.,false,,,false,1767434,1767434;,send-and-receive-email,thunderbird;send-and-receive-email;,desi3755,<p>thunder bird will not send email but Outlook does </p>,desi3755;davidsk;,false,false,false,;useragent:Mozilla/5.0 (Windows NT 10.0; Win64; x64; rv:143.0) Gecko/20100101 Firefox/143.0,1,0,2,,,
1537951,2025-09-25 13:56:34 -0700,2025-09-26 04:22:26 -0700,en-US,thunderbird,Password,false,,,false,1767622,1767622;,passwords-and-sign-in,thunderbird;passwords-and-sign-in;,jdaivs1,<p>I can not sign in to my thunderbird account with my gmail password. But I can go to gmail and sign in with the password </p>,jdaivs1;davidsk;,false,false,false,;useragent:Mozilla/5.0 (Windows NT 10.0; Win64; x64; rv:143.0) Gecko/20100101 Firefox/143.0,1,0,0,,,
1537954,2025-09-25 14:34:10 -0700,2025-09-27 18:18:59 -0700,en-US,thunderbird,can not receive emails,false,,,false,1767976,1767976;,installation-and-updates,firefox-1150;windows-7;thunderbird;installation-and-updates;,marengoon,"<p>can not receive emails, something about CL VIEW windows installer error 90, cannot install necessary files </p>",marengoon;MattAuSupport;,false,false,false,";useragent:Mozilla/5.0 (Windows NT 6.1; rv:109.0) Gecko/20100101 Firefox/115.0;ff_version:115.0;os:Windows 7;kb_visits_prior:[""/en-US/kb/captive-portal""]",1,0,0,,,
1537955,2025-09-25 14:36:32 -0700,2025-11-11 03:26:55 -0800,en-US,thunderbird,"Repeated ""Mozilla Thunderbird Email wants to access your Google Account""",true,1767544,"{""username""=>""cjshaker"", ""display_name""=>""OldCoder"", ""avatar""=>""https://profile.accounts.firefox.com/v1/avatar/c""}",false,1778272,1767459;1767460;1767461;1767463;1767469;1767470;1767472;1767474;1767475;1767482;1767490;1767493;1767500;1767528;1767534;1767544;1768459;1768465;1777959;1778272;,email-and-messaging,thunderbird;email-and-messaging;,cjshaker,"<p>I changed my gmail account password, and Mozilla Thunderbird is losing its mind. I did the Oauth, logged in, but Thunderbird keeps popping up ""Mozilla Thunderbird Email wants to access your Google Account"" over and over again, even though I keep clicking on ""Allow""! </p>",cjshaker;wsmwk;MattAuSupport;thunderbird.ud1fl;,false,true,false,";solver_id:7053465;useragent:Mozilla/5.0 (Windows NT 10.0; Win64; x64) AppleWebKit/537.36 (KHTML, like Gecko) Chrome/140.0.0.0 Safari/537.36",20,0,2,,,
1537965,2025-09-25 16:29:58 -0700,2025-09-25 19:13:58 -0700,en-US,thunderbird,Failed to send message . . .,false,,,false,1767507,1767502;1767507;,send-and-receive-email,thunderbird;send-and-receive-email;,dalewebb1,<p>Started getting these (have had several with slightly different wording).  What to they mean and what do I need to do&gt; Failed to send some messages IllegalStateException: No outbox_state entry for message with id 2 </p>,dalewebb1;MattAuSupport;,false,false,false,;useragent:Mozilla/5.0 (Windows NT 10.0; Win64; x64; rv:143.0) Gecko/20100101 Firefox/143.0,2,0,0,,,
1537966,2025-09-25 16:41:37 -0700,2025-09-27 17:35:09 -0700,en-US,thunderbird,Thunderbird 143.0.1 Can't download,false,,,false,1767967,1767964;1767967;,send-and-receive-email,thunderbird;send-and-receive-email;,satnick,"<p>I have an issue with Thunderbird version 143.0.1 on Windows 11.  Everything worked Tuesday (9/23) evening and then nothing worked on Wednesday (9/24) morning.   </p><p>The problem is that Thunderbird can’t retrieve email on either of my 2 different email accounts from different servers.  The error message says “There is not enough space to download new messages.”  This is simply not true – I have 1 TB of free space.  I can send outgoing messages, but they can’t be saved to the Sent folder.  </p><p>Here are the steps I’ve taken: Tried compacting – Error message says “..could not be compacted because writing to folder failed.”  Deleted a bunch of old Trash messages – Made no difference Cleared the Thunderbird cache – Made no difference Created a new profile – Could download messages, but when I close Thunderbird and reopen it, the can’t download problem reappears. </p><p>What happened on Thunderbird’s side of things between Tuesday evening and Wednesday morning? Anybody else have this issue? </p>",satnick;wsmwk;,false,false,false,";useragent:Mozilla/5.0 (Windows NT 10.0; Win64; x64) AppleWebKit/537.36 (KHTML, like Gecko) Chrome/140.0.0.0 Safari/537.36",2,0,4,,,
