id,created,updated,title,content,tags,product,topic,locale,answers,creator
1516750,2025-06-12 17:01:31 -0700,2025-06-12 17:01:31 -0700,I can't search messages properly.,"<p>It does not appear in the message search. Perhaps the emails of a particular account are not included in the search, but is there a way to address this? I have already rebuilt the “global search database”. </p>",thunderbird;search;,thunderbird,search,en-US,"",next_l
1516756,2025-06-12 17:55:22 -0700,2025-06-12 17:55:22 -0700,all emails going to trash,<p>why  just today  is all my incoming emails coming to trasha nd not my in box in Thunderbird worked  fine in the morning but  i am not getting any mail in my in box it is all going to  trash </p>,thunderbird;send-and-receive-email;,thunderbird,send-and-receive-email,en-US,"",mdm54
1516765,2025-06-12 20:05:37 -0700,2025-06-12 20:19:27 -0700,thunderbird Oauth2 not working with M365-21vnet,<p>thunderbird Oauth2 not working with M365-21vnet </p>,thunderbird;connectivity;,thunderbird,connectivity,en-US,1741467;,zhiming.liu
1516770,2025-06-12 21:54:02 -0700,2025-06-12 21:54:02 -0700,Alifsan,<p>Alif san </p>,thunderbird;email-and-messaging;,thunderbird,email-and-messaging,en-US,"",mdsifat46625
1516796,2025-06-13 00:30:00 -0700,2025-06-13 00:30:00 -0700,"Thunderbird Shift+F5 ""Get All New Messages"" Command Issues","<p>Issue 1: When using Shift+F5 to Get All New Messages: This command used to go through my accounts within several seconds; but now this can take several minutes. What changed to cause this? </p><p>Issue 2: I have one account that is having server problems... causing must click popups in TB.   How do I exclude this account when using Shift+F5? I've tried Unchecking the boxes for ""Check for new messages at startup"" and ""Check for new messages every xx minutes"". And one help result suggests ""Disable immediate notifications: Uncheck""; but I do not see such a setting. </p>",thunderbird;email-and-messaging;,thunderbird,email-and-messaging,en-US,"",ggg3
1516808,2025-06-13 01:25:16 -0700,2025-06-13 01:25:16 -0700,"Can we change the default color of ""Thunderbird has blocked remote content in this message""",<p>I have CPTSD to yellow color. It is possible that I will feel headaches or stomachaches after I see that color too often. I just wonder is that possible to let us change the color. It is fine we cannot and I just allow remote content instead. </p>,thunderbird;settings;,thunderbird,settings,en-US,"",keaddeak
1516810,2025-06-13 01:29:39 -0700,2025-06-13 01:29:39 -0700,Data lost,"<p>I have lost all my Thunderbird data due to the fact that I have a new PC with Win 11 (previously Win 10). I have not safed the mails and adresses on a separate storage device. This question was already answered by David and he asked if the old PC is still at hand. It is, but the harddisc was formatted and is now used in the new PC. </p><p>Is there any chance to rescue the lost data? If not it is not a real drama, but a mess!&nbsp;:-) </p><p>Ralf </p>",thunderbird;email-and-messaging;,thunderbird,email-and-messaging,en-US,"",rasograph58
