id,question_id,created,updated,content,creator,is_spam,num_helpful,num_unhelpful
1703556,1485950,2025-01-14 10:34:03 -0800,2025-01-14 10:34:03 -0800,"<em><p>pmarr <a href=""#question-1485950"" rel=""nofollow"">said</a></p></em> <blockquote> What program do I use to open this file? </blockquote> <p>You can open the Sent file in a text editor which is not very comfortable. If you want to read and see all messages with their contents Thunderbird is the best choice! </p>",Mapenzi,false,0,1
1703561,1485950,2025-01-14 10:51:59 -0800,2025-01-14 10:51:59 -0800,"<p>That Sent file is an mbox file.  Help/Troubleshooting Info, Profile Folder, Open Folder, close TB, copy Sent into Mail/Local Folders, renaming it if necessary, restart TB, find the folder under Local Folders in the Folder Pane. </p>",sfhowes,false,1,0
1703581,1485950,2025-01-14 12:08:02 -0800,2025-01-14 12:08:02 -0800,"<p>As suggested, the text editor solution basically yields garbage. The second works albeit somewhat unusually ( it renamed my renamed file). </p>",pmarr,false,0,0
1703569,1485959,2025-01-14 11:06:44 -0800,2025-01-14 11:06:44 -0800,"<p>This is caused by Bitdefender.   </p><p>Download and install Thunderbird from <a href=""https://thunderbird.net/download"" rel=""nofollow"">https://thunderbird.net/download</a> </p>",wsmwk,false,0,0
1704848,1485962,2025-01-19 05:12:30 -0800,2025-01-19 05:12:30 -0800,<p>You need to check your mail provider. </p>,wsmwk,false,0,0
1703686,1485966,2025-01-14 23:54:38 -0800,2025-01-14 23:54:38 -0800,"<p>V ""Správcovi hesiel"", máte k tomuto účtu zaznamenaných viac prihlasovacích údajov. Spustite ""Správcu hesiel"", a u toho problémového účtu odstráňte (najlepšie) všetky prihlasovacie údaje. Reštartujte Thunderbird a zadajte správne prihlasovacie údaje k tomuto problémovému účtu: - Thunderbird - Nástroje - Nastavenia - Súkromie a bezpečnosť - Heslá - Uložené heslá - Zobraziť heslá </p>",Ansamb,false,0,0
1703697,1485966,2025-01-15 01:04:42 -0800,2025-01-15 01:04:42 -0800,"<em><p>Marcela Vargová <a href=""#question-1485966"" rel=""nofollow"">said</a></p></em> <blockquote>dnes po vašem výpadku fungování příjmu a odesílání zpráv</blockquote> <p>O jakém výpadku je řeč? Pokud nezabere rada od Ansam, zkus <strong>změnit SMTP</strong> adresu pro odesílání zpráv. Taky je možné, že šlo jen o dočasnou chybu u zvoleného SMTP. </p>",poljos-moz,false,0,0
1703616,1485973,2025-01-14 17:00:10 -0800,2025-01-14 17:00:10 -0800,"<p>Hola,  Puedes hacer un backup de la carpeta de perfil del Thunderbird (por respaldo) y luego compactar las carpetas, si el problema persiste podrías intentar reparar las carpetas pero ojo, por eso el backup previo, si los archivos están corruptos se elimina su contenido. Saludos </p>",pcp04,false,0,0
1704141,1485973,2025-01-16 12:04:55 -0800,2025-01-16 12:04:55 -0800,"<p>Hola, Tengo el backup, pero no se como hacer lo de la reparación. Si que he hecho el compactado, pero no me sale la opción de reparar, ¿cómo se haría? con el botón derecho sobre la carpeta no lo veo.. </p><p>Gracias! </p>",albertoshsh,false,0,0
1705255,1485973,2025-01-20 18:06:37 -0800,2025-01-20 18:06:37 -0800,"<p>Hola,  Sobre la carpeta en cuestión le das propiedades (clic derecho del mouse sobre la carpeta), aparece un nueva ventana con el botón reparar, así con el resto de las carpeta que tiene el problema. Saludos </p>",pcp04,false,0,0
1706772,1485973,2025-01-26 09:49:51 -0800,2025-01-26 09:50:23 -0800,<p>mi problema es que se duplican los mensajes enviados </p>,mfgt1949,false,0,0
1703745,1485977,2025-01-15 03:19:08 -0800,2025-01-15 03:19:08 -0800,"<p>Please see <a href=""https://wiki.mozilla.org/Thunderbird:Testing:Memory_Usage_Problems"" rel=""nofollow"">https://wiki.mozilla.org/Thunderbird:Testing:Memory_Usage_Problems</a> </p>",wsmwk,false,0,0
1703732,1485984,2025-01-15 02:41:52 -0800,2025-01-15 02:41:52 -0800,"<p>1.  Thunderbird creates numbered version when access is not available,  so anything that causes contention.  Most often antivirus file scanners.  But it can, at times, be Thunderbird itself as it is not a robust in its threading as it should be.  They can be deleted,  the software never looks at them. 2. I generally recommend deleting it.  I can not answer why it appends.  Personally I think it is a bug and should be filed as such <a href=""https://bugzilla.mozilla.org"" rel=""nofollow"">https://bugzilla.mozilla.org</a> </p><p>If you do file a bug, please link to it here as I would like to follow it. 3.  I actually think there is a bug already for that as it is a known cause of issues on dual boot systems, but I can not find it at the moment. </p>",MattAuSupport,false,0,0
1703820,1485984,2025-01-15 07:19:09 -0800,2025-01-15 07:19:09 -0800,"<p>1. I will delete all folderCache-x.json files. Thanks for the explanation. </p><p>2. Later today, I will file a bug about the rebuild behavior of folderCache.json, and refer it to this discussion. I appreciate that suggestion. </p><p>3. I will look for that bug about folder paths being fully qualified rather than relative to the profile (and yes, you are correct in your guess that dual-boot issues prompted this inquiry). </p><p>Thanks for wrapping this up so quickly and succinctly. </p>",kaufmann,false,0,0
1704760,1485984,2025-01-18 17:14:20 -0800,2025-01-18 17:14:20 -0800,"<p>&gt; 2. Later today, I will file a bug about the rebuild behavior of folderCache.json, and refer it to this discussion. I appreciate that suggestion. </p><p>Do we have a bug#&nbsp;? </p>",wsmwk,false,0,0
1707069,1485984,2025-01-27 13:31:46 -0800,2025-01-27 13:31:46 -0800,"<p><a href=""https://bugzilla.mozilla.org/show_bug.cgi?id=1944138"" rel=""nofollow"">Bug# 1944138</a>.   </p><p>So sorry for the delay -- especially after Matt so promptly replied to my question. In order to try to make the bug as helpful as possible, I began late that day familiarizing myself with relevant prior reports, and found myself needing to do some digging on ""more code"" and panacea.dat, Then Life, and three weather-induced emergencies, made it a LONG day. </p>",kaufmann,false,0,0
1703720,1485990,2025-01-15 02:27:23 -0800,2025-01-15 02:27:23 -0800,"<blockquote>Does identifying an email as 'Junk mail' automatically block future emails from this source? </blockquote> <p>Most emphatically not. See <a href=""https://support.mozilla.org/en-US/kb/thunderbird-and-junk-spam-messages"" rel=""nofollow"">https://support.mozilla.org/en-US/kb/thunderbird-and-junk-spam-messages</a> </p><p>As the email you are unsubscribing from was sent to the email that are asking for,  I see no issue.   </p><p>Certainly good unsubscribe links embed the email address in the link you click,  but at some point the sender has to know what email address to stop sending mail to.  Others like <a href=""http://groups.io"" rel=""nofollow"">groups.io</a> will remove you from a mailing list with a single click.  But I think if you want to stop getting mail. Entering the email it was sent to,  while somewhat onerous, is simpler than trying to suppress future email via a mail client.   </p><p>While there used to be some sort of urban story about confirming your email address exists if you enter it in  unsubscribe  links fundamentally the real spammer simply do not care if the email addresses exist.  Some even send mail to random addresses in the hope they hit one that does exist.  Their clicks per email send are almost nothing but when you send  500 million email almost nothing is still quite a substantial number.  Those senders rarely offer an unsubscribe link, even where is is a legal requirement.  One thing that is generally overlooked is when an SMTP server tries to deliver an email to the email address.  The receiving server will refuse mail for many reasons,  one of those reasons is the email address does not exist on that server.  So if the marketer was interested in knowing which of the addresses they sent email to, they would simply log the send failures. </p><p>Legislation, in the EU and Australia, that I know of requires marketing mails to have an unsubscribe links.  Google has come on board requiring the links in what they consider bulk emails.  The result is that the vast majority of unsubscribe links now function as advertised and are not some sort of honey trap for harvesting email addresses.  But not of the legislation requires it to be a single click and done.  Hence the ask some questions in the hope folks will abandon the idea.  It obviously working with you up to now. </p>",MattAuSupport,false,0,3
1703707,1485996,2025-01-15 02:12:56 -0800,2025-01-15 02:12:56 -0800,<p>assicurarti che Thunderbird e l'utente che lo esegue abbiano pieni diritti di scrittura sulla cartella del server di rete. ed assicurati che non ci siano software di sicurezza che intervengano sui file di Thunderbird </p>,@next,false,0,0
1703857,1485996,2025-01-15 09:50:17 -0800,2025-01-15 09:50:17 -0800,<p>Grazie per la risposta. Non credo sia questo il problema. Thunderbird funziona correttamente se é un solo pc che archivia la posta. Il problema nasce se un secondo (o più client) puntano alla medesima cartella locale. </p><p>Si può risolvere? </p>,domenico.pullia,false,0,0
1703880,1485996,2025-01-15 11:39:52 -0800,2025-01-15 11:39:52 -0800,"<p>Se accedeno contemporaneamente è inevitabilmente che si sovrascrivano reciprocamente i file. Se accedono uno alla volta dovrebbe funzionare, ma è comunque una configurazione troppo atipica per le mie conoscenze. </p>",@next,false,0,0
1703894,1485996,2025-01-15 13:15:49 -0800,2025-01-15 13:15:49 -0800,"<p>Trattandosi del solo archivio, necessario per la consultazione della posta pregressa, la necessità é che sia in linea su più di un pc. Comprendo che, essendo più di uno, il file indice possa venire compromesso all'accesso simultaneo. Eppure, con le vecchie versioni funzionava. Risolvo andando a copiare il file dell'anno di interesse in locale lasciando un solo pc che punta sul server. </p>",domenico.pullia,false,0,0
1703741,1485999,2025-01-15 03:13:41 -0800,2025-01-15 03:13:41 -0800,"<p>michael, can you post a screen shot? </p>",wsmwk,false,0,0
1703852,1486007,2025-01-15 09:17:19 -0800,2025-01-15 09:17:19 -0800,"<p>re&nbsp;:Did a reinstall of win11, which wiped out my old files </p><p>If you are using Windows OS then it's likely Windows created a 'windows.old' folder. </p><p>That windows.old folder should contain your original Thunderbird profile and all data. </p><p>See info at this link: <a href=""https://support.mozilla.org/en-US/questions/1187095"" rel=""nofollow"">https://support.mozilla.org/en-US/questions/1187095</a> </p>",Toad-Hall,false,0,0
1703722,1486008,2025-01-15 02:28:21 -0800,2025-01-15 02:28:21 -0800,"<p>See <a href=""https://support.mozilla.org/en-US/kb/cannot-receive-messages"" rel=""nofollow"">https://support.mozilla.org/en-US/kb/cannot-receive-messages</a> </p>",MattAuSupport,false,0,0
1703706,1486022,2025-01-15 02:04:02 -0800,2025-01-15 02:04:02 -0800,"<p>Click the view button.  Who is the issuer on the certificate. (not that there should be one on Port 25,  but Optus are still in the 1990s security wise)..  My guess is it is your antivirus program and you need to click the confirm button. But you should not do that unless you trust the issuer. </p>",MattAuSupport,false,1,1
1703905,1486022,2025-01-15 15:24:21 -0800,2025-01-15 15:24:21 -0800,<p>Thank you Matt for answering my query - tried what you suggested and the issuer was Avast AV so clicked the confirm button. Tried this morning to send email but now comes up with another message (see screenshot) so still cannot send emails. Looking forward to a solution! </p>,nears53,false,0,0
1704049,1486022,2025-01-16 07:06:22 -0800,2025-01-16 07:06:22 -0800,"<p>you may find your antivirus,  or it's software firewall, is blocking port 25 entirely.  It has supposedly been used exclusively for server to server transmission of email for about 20 years but Optus have not moved with the times.  So it is entirely possible that antivirus types look as a server port being accessed from the local machine and go aha malware.  Block block block. </p><p>Please post the outgoing server (SMTP) settings you are using.  The connection security for Optus outgoing has to be STARTTLS and I have a feeling it will be SSL/TLS </p>",MattAuSupport,false,0,1
1704165,1486022,2025-01-16 14:40:58 -0800,2025-01-16 14:40:58 -0800,"<p>Thanks for your reply, attached please find info requested.  This problem started out of the blue this week having had no problems sending emails before. It's affecting both my laptop and  my husbands desktop, both with W11 but only my laptop has Avast and the desktop has Windows. Haven't changed anything at all so not sure what's happened. Cheers Linda. </p>",nears53,false,0,0
1722229,1486022,2025-03-31 02:18:42 -0700,2025-03-31 10:08:24 -0700,"<p>tried disable AV ... not fixed   tried disable VPN ( altho no previous prob) .. not fixed . opened Tbird  --&gt;tools--&gt;settings--&gt;account settings --&gt; outgoing server SMTP  now ,Optus had advised a while back that in SMTP the server name as <a href=""http://mail.optusnet.com.au"" rel=""nofollow"">mail.optusnet.com.au</a>  port25 mine was showing as <a href=""http://smtp.optusnet.com.au"" rel=""nofollow"">smtp.optusnet.com.au</a> so editted name by change smtp to mail.. and all fixed ... can now send .. test 1. forwarded email with large  attach to someone ..went ok .. test2. sent email to myself ... went ok ... ad received  instantly . so regard above as a solution ... dont know why it was smtp , must have been changed ... maybe part of a scam to get a certificate&nbsp;? </p>",Baudie1,false,0,0
1703685,1486024,2025-01-14 23:42:37 -0800,2025-01-14 23:42:37 -0800,"<p>""Archiving"" doesn't free up space, unless you are moving messages from your gmail account to a Local Folder in Thunderbird.  Archiving just moves the message from the current folder to the archive folder.   </p><p>Yes, certainly, you can delete email from gmail. It then goes to the Trash folder, where gmail ages it out (deletes it) after 30 days. </p><p>To get more gmail storage see <a href=""https://support.google.com/mail/answer/9312312"" rel=""nofollow"">https://support.google.com/mail/answer/9312312</a> and <a href=""https://support.google.com/googleone/answer/2375123"" rel=""nofollow"">https://support.google.com/googleone/answer/2375123</a> </p>",wsmwk,false,0,1
