id,created,updated,locale,product,title,is_solved,solution,solved_by,is_spam,last_answer,answers,topic,tags,creator,content,involved,is_archived,is_locked,is_taken,metadata,num_answers,num_votes_past_week,num_votes,taken_until,taken_by,updated_by
1544905,2025-11-04 07:22:41 -0800,2025-11-04 11:40:15 -0800,en-US,thunderbird,Thunderbird 140 esr calendar today highlight,true,1776999,"{""username""=>""sfhowes"", ""display_name""=>""sfhowes"", ""avatar""=>""https://firefoxusercontent.com/c92a42cdab68b73a39b7e6b5bde36e39""}",false,1776999,1776999;,customization,thunderbird;customization;,ffsync5,"<p>Is there a way to make the “Today” tile stand out more clearly in the calendar month view? The currently selected day is displayed with a light gray background and stands out, but the actual day is only modestly marked by the day number. With many entries in the calendar, it is therefore difficult to recognize. I would therefore like to see a user-selectable background for the current day. </p>",ffsync5;sfhowes;,false,false,false,;useragent:Mozilla/5.0 (Windows NT 10.0; Win64; x64; rv:140.0) Gecko/20100101 Firefox/140.0;solver_id:1899186,1,0,0,,,
1544907,2025-11-04 07:26:07 -0800,2025-11-04 07:26:07 -0800,en-US,thunderbird,Unable to send an e-mail to one specifik adress,false,,,false,,"",send-and-receive-email,thunderbird;send-and-receive-email;,carsten.and,"<p>Hello support It is not possible for me - carsten.and@mail.dk - to send mails to ""ole_quistgaard@hotmail.com"" . Mail from me is not recieved and I got no massege from any webmaster of unknown or fail delivery. Mails from the same adress are recieved by me with no problems. Could it caused the underscore digit in the mail&nbsp;? best regard Carsten Andersen. </p>",carsten.and;,false,false,false,";useragent:Mozilla/5.0 (Windows NT 10.0; Win64; x64) AppleWebKit/537.36 (KHTML, like Gecko) Chrome/141.0.0.0 Safari/537.36",0,0,0,,,
1544910,2025-11-04 07:32:28 -0800,2025-11-04 07:32:28 -0800,en-US,thunderbird,Sent Messages Not Saved After Sending Emails in Thunderbird,false,,,false,,"",send-and-receive-email,thunderbird;send-and-receive-email;,rlajfjdke121e,"<p>Dear Thunderbird Support Team, </p><p>When sending emails through Thunderbird, the emails are successfully sent, but they do not appear in the “Sent Messages” folder. The following error message is displayed: </p><p>“The message was sent successfully, but could not be copied to your Sent folder due to network or file access errors. You may retry or save the message locally to Sent Messages - shin955@hanbat.ac.kr </p><pre>(IMAP).” </pre> <p>We are currently using IMAP and SMTP. On other devices and locations, the sent emails appear correctly in the “Sent Messages” folder without any errors. However, at a certain point, this issue started occurring on the system that had been working fine before — the emails send successfully, but they are no longer saved to the Sent folder. </p><p>Here are the troubleshooting steps we have already tried: </p><p>Checked and reconfigured the “Save sent messages” folder settings. </p><p>Deleted the MSF files from the App Data folder and restarted Thunderbird. </p><p>Disabled firewall and antivirus programs, then retried sending emails. </p><p>We have tried nearly all the solutions suggested online, but the issue persists. I would like to request remote assistance to resolve this problem if possible. </p><p>Sorry for the trouble, and I would appreciate your prompt response. </p>",rlajfjdke121e;,false,false,false,";useragent:Mozilla/5.0 (Windows NT 10.0; Win64; x64) AppleWebKit/537.36 (KHTML, like Gecko) Chrome/141.0.0.0 Safari/537.36;kb_visits_prior:[""/ko/kb/ignore-threads"", ""/ko/kb/archived-messages""]",0,0,0,,,
1544911,2025-11-04 07:34:44 -0800,2025-11-04 13:28:52 -0800,en-US,thunderbird,How to set back to mbox for new account in thunderbird,true,1776996,"{""username""=>""davidsk"", ""display_name""=>""david"", ""avatar""=>""https://firefoxusercontent.com/5eed5ecf74d9e1ec85435ea262bc016e""}",false,1777021,1776988;1776991;1776996;1777021;,customization,thunderbird;customization;,adam81,"<p>Hi,  lot of years ago I have changed TB to use maildir ibstead of mbox for new accounts, Now I met some filtering issue I can't fix and it is proabely caused by maildir. </p><p>So I'd like to set TB to use mbox  with new accounts instead of maildir. </p><p>Some additional info: TB 144.0.1 (64 bit), win 10 pro, I have 4 mbox accounts and one maildir account. </p><p>There is no need to export / import / keep data existing on maildir account. I can remove it with no pain.  I just want to setup TB to create new accounts as mbox again. </p><p>Any help will be appreciated. </p><p>TIA </p>",adam81;davidsk;,false,false,false,";useragent:Mozilla/5.0 (Windows NT 10.0; Win64; x64; rv:144.0) Gecko/20100101 Firefox/144.0;kb_visits_prior:[""/pl/kb/format-maildir-w-thunderbirdzie""];solver_id:7145933",4,0,0,,,
1544915,2025-11-04 07:54:48 -0800,2025-11-07 15:47:42 -0800,en-US,thunderbird,Need help setting Thunderbird home screen up,true,1777661,"{""username""=>""n5jjr"", ""display_name""=>"""", ""avatar""=>""https://profile.accounts.firefox.com/v1/avatar/m""}",false,1777664,1776982;1777153;1777190;1777191;1777197;1777204;1777346;1777557;1777574;1777586;1777591;1777661;1777664;,customization,thunderbird;customization;,n5jjr,"<p>I have 1 computer that shows bars at the top and left side that I like.  The one at the top shows Get messages, Delete, Reply, Reply All, and a few more items.  The one on the left side shows icons that are for Mail, Address Book, Calendar, Tasks, and Chat. I have another computer that doesn't have those bars.  I have attached a screen shot from that computer.   Both are running T'bird 140.4.0esr (64-bit) and both are Win 11 machines. I've tried everything I can see to get the 2 bars to appear on the 2nd computer.  I hope someone can tell me how to get them to show up. Thanks, Mike </p>",n5jjr;davidsk;Toad-Hall;,false,false,false,;useragent:Mozilla/5.0 (Windows NT 10.0; Win64; x64; rv:144.0) Gecko/20100101 Firefox/144.0;solver_id:229312,13,0,0,,,
1544917,2025-11-04 08:02:08 -0800,2025-11-04 08:02:08 -0800,en-US,thunderbird,Sending email,false,,,false,,"",send-and-receive-email,thunderbird;send-and-receive-email;,sandra16,<p>Everthing was fine but last night it stopped sending emails saying verification failed for my email address.  I installed this on my phone yesterday and imported info from desktop version </p>,sandra16;,false,false,false,";useragent:Mozilla/5.0 (Linux; Android 10; K) AppleWebKit/537.36 (KHTML, like Gecko) Chrome/142.0.0.0 Mobile Safari/537.36;kb_visits_prior:[""/en-US/kb/thunderbird-android-import""]",0,0,0,,,
1544918,2025-11-04 08:02:18 -0800,2025-11-04 09:34:38 -0800,en-US,thunderbird,"Pictures into mails, I want not wait for seeing its. Thanks for your help.",true,1776987,"{""username""=>""davidsk"", ""display_name""=>""david"", ""avatar""=>""https://firefoxusercontent.com/5eed5ecf74d9e1ec85435ea262bc016e""}",false,1776987,1776987;,customization,thunderbird;customization;,pierremaginot,"<p>Hello When I reçoivent a mail, I want see immediatly thé pictures included, wihout clicking for that  thanks. </p>",pierremaginot;davidsk;,false,false,false,";useragent:Mozilla/5.0 (Linux; Android 10; K) AppleWebKit/537.36 (KHTML, like Gecko) Chrome/141.0.0.0 Mobile Safari/537.36;kb_visits_prior:[""/fr/kb/importer-thunderbird-android""];solver_id:7146022",1,0,0,,,
1544919,2025-11-04 08:02:32 -0800,2025-11-04 12:35:25 -0800,en-US,thunderbird,Sending email,false,,,false,,"",email-and-messaging,thunderbird;email-and-messaging;,sandra16,"<p><i>duplicate of <a href=""/questions/1544917"" rel=""nofollow"">/questions/1544917</a> thread</i> </p><p>Everthing was fine but last night it stopped sending emails saying verification failed for my email address.  I installed this on my phone yesterday and imported info from desktop version </p>",sandra16;,false,true,false,";useragent:Mozilla/5.0 (Linux; Android 10; K) AppleWebKit/537.36 (KHTML, like Gecko) Chrome/142.0.0.0 Mobile Safari/537.36;kb_visits_prior:[""/en-US/kb/thunderbird-android-import""]",0,0,0,,,"{""username""=>""James"", ""display_name""=>""James"", ""avatar""=>""https://firefoxusercontent.com/b5072f416de6e7e53744bc4acfce0225""}"
1544928,2025-11-04 09:13:58 -0800,2025-11-05 08:20:22 -0800,en-US,thunderbird,I cannot sign in for months to send email. password expired.,false,,,false,1777177,1777177;,reset-passwords,firefox-1430;windows-10;thunderbird;reset-passwords;,Frankevans022,<p>I cannot get signed in. to send email. password expired-they say </p>,Frankevans022;wsmwk;,false,false,false,;useragent:Mozilla/5.0 (Windows NT 10.0; Win64; x64; rv:143.0) Gecko/20100101 Firefox/143.0,1,0,0,,,"{""username""=>""wsmwk"", ""display_name""=>""Wayne Mery"", ""avatar""=>""https://firefoxusercontent.com/3f0645137479a481e67f7fb3ff1d945b""}"
1544931,2025-11-04 09:33:17 -0800,2025-11-04 09:33:17 -0800,en-US,thunderbird,cannot receive messages automaticallly and the documents in my Archives map are all gone,false,,,false,,"",send-and-receive-email,thunderbird;send-and-receive-email;,carina.jonsheim,"<p>I have two questions. </p><p>1. Right now I cannot receive messages automatically, which always has functioned. Now I have to shut down my e-mail and then reopen it, after I´ve done that I receive new messages. But I really will receive them automatically. </p><p>2. In the map Archives have all my saved documents been missing. I have six different maps in the Archives map and all saved information are now gone. </p><p>What has occoured? I hope yo can help me. </p><p>Kind regards, Carina Jonsheim </p>",carina.jonsheim;,false,false,false,";useragent:Mozilla/5.0 (Windows NT 10.0; Win64; x64; rv:144.0) Gecko/20100101 Firefox/144.0;kb_visits_prior:[""/en-US/kb/cannot-receive-messages""]",0,0,0,,,
1544946,2025-11-04 11:25:39 -0800,2025-11-04 11:31:50 -0800,en-US,thunderbird,The point of the exercise of the 'Make filter from message' right click was to avoid opening the creepy messages.,false,,,false,1776998,1776998;,junk-mail-and-spam,thunderbird;junk-mail-and-spam;,gla3,"<p>For me at least, the point of the exercise of the 'Make filter from message' right click was to avoid opening the creepy messages.  I respect that you had some reason to remove that, but now filtering through hundreds of scary messages takes many times longer, and I was barely keeping up before.  My email is practically unusable to me now.  I'll try to adapt, but there are only 36 hours in day at my place.  I'm a little afraid of updates now.  Other than that, I love and appreciate your excellent efforts.  Thank you. ---end--- </p>",gla3;sfhowes;,false,false,false,;useragent:Mozilla/5.0 (Windows NT 10.0; Win64; x64; rv:144.0) Gecko/20100101 Firefox/144.0,1,0,0,,,
1544947,2025-11-04 11:27:57 -0800,2025-11-19 15:53:09 -0800,en-US,thunderbird,Tbird/yahoo authentication problem   EDGE Too many requests (bug1997062),true,1777022,"{""username""=>""davidsk"", ""display_name""=>""david"", ""avatar""=>""https://firefoxusercontent.com/5eed5ecf74d9e1ec85435ea262bc016e""}",false,1780447,1777022;1777444;1777524;1780447;,send-and-receive-email,thunderbird;send-and-receive-email;,bababarb,"<p>Email problem. Old Lenovo Desktop, Window 8.0 (I know, I know, but it's my wife's and all she uses it for is email and utube recipes, and she's used to it). I use it for some banking, mainly because the printer is on it. Tbird 115.18.0 (32 bit) -says it's up to date AVG antivirus free </p><p>Email through yahoo. It worked fine until, going by the last date it linked email, 10/30/25 at 06:45AM MST  When I tried to download new messages Sunday 11/2, it failed.  </p><p>It pops up a new window  ""Enter credentials for bababarb@yahoo.com on <a href=""http://imap.mail.yahoo.com"" rel=""nofollow"">imap.mail.yahoo.com</a>"" In the address window is ""<a href=""https://login.yahoo.com/?src=thunderbird&amp;client_id=(about"" rel=""nofollow"">https://login.yahoo.com/?src=thunderbird&amp;client_id=(about</a> a zillion characters) Then, in the message window is ""Edge: Too many requests"" </p><p>So, I did the troubleshooting as in Help article. I logged in on the webmail, signed in with the password, and was able to see the messages, many from after the 30th (she gets a ton of sorta spam). </p><p>Looking under Account setting&gt; server settings, I find that the security is set to SSL/TLS and Authentication is set to OAuth2. Incidentally, these were set automatically when I set this to a <a href=""http://yahoo.com"" rel=""nofollow"">yahoo.com</a> address. </p><p>So, I try setting the Authentication to Password and request mail. I get a popup asking for the password. I enter it (the same password I used on webmail) and it replies ""Login to server <a href=""http://imap.mail.yahoo.com"" rel=""nofollow"">imap.mail.yahoo.com</a> with username bababarb@yahoo.com failed."" </p><p>Following suggestions on the help article, I got to Settings, and check ""saved passwords"". Then, again following the suggestions, I remove the yahoo password entry. According to the article, the next login attempt should ask for a password. It does not. I just get the ""too many requests"" popup. What the hell, I go back and remove the SMTP password, too. Same result. </p><p>Anybody else having this issue? Any suggestions? </p>",bababarb;davidsk;wsmwk;,false,false,false,";useragent:Mozilla/5.0 (Windows NT 6.2; Win64; x64; rv:109.0) Gecko/20100101 Firefox/115.0;kb_visits_prior:[""/en-US/kb/cannot-receive-messages"", ""/en-US/kb/cannot-delete-messages""];solver_id:7146468",4,0,2,,,"{""username""=>""wsmwk"", ""display_name""=>""Wayne Mery"", ""avatar""=>""https://firefoxusercontent.com/3f0645137479a481e67f7fb3ff1d945b""}"
1544952,2025-11-04 11:43:20 -0800,2025-11-04 12:02:16 -0800,en-US,thunderbird,error message: This site attempts to identify itself with invalid information,false,,,false,1777007,1777007;,encryption,thunderbird;encryption;,wkrause23,<p>how can I correct </p>,wkrause23;christ1;,false,false,false,;useragent:Mozilla/5.0 (X11; Ubuntu; Linux x86_64; rv:144.0) Gecko/20100101 Firefox/144.0,1,0,0,,,
1544957,2025-11-04 12:26:34 -0800,2025-11-04 12:26:34 -0800,en-US,thunderbird,Can't locate email from consultdee@aol.com about a month ago with important attachments,false,,,false,,"",attachments,thunderbird;attachments;,robroyclark,<p>I can't locate an email from consultdee@aol.com about a month ago with important attachments </p>,robroyclark;,false,false,false,";useragent:Mozilla/5.0 (Linux; Android 10; K) AppleWebKit/537.36 (KHTML, like Gecko) Chrome/142.0.0.0 Mobile Safari/537.36;kb_visits_prior:[""/en-US/kb/difference-between-imap-and-pop3""]",0,0,0,,,
1544968,2025-11-04 13:00:13 -0800,2025-11-22 20:16:24 -0800,en-US,thunderbird,Unable to add AOL email to new Thunderbird install.    EDGE Too many requests (bug1997062),true,1781286,"{""username""=>""wsmwk"", ""display_name""=>""Wayne Mery"", ""avatar""=>""https://firefoxusercontent.com/3f0645137479a481e67f7fb3ff1d945b""}",false,1781286,1777020;1777023;1781286;,passwords-and-sign-in,thunderbird;passwords-and-sign-in;,ronbean53,"<p>Something changed.  I’ve tried to set up my old AOL email account multiple times using different default browsers, and the setup typically fails.  Using Edge, I get “Edge: Too Many Requests” .   Using Firefox, I get “Waiting for authorization in login popup…” and then the old rotating arrow.   After about a minute delay, the Account Hub reports “Authentication error.”  The Thunderbird Account Hub reports the outgoing server settings test good.  I’ve changed my AOL email password, and have an AOL application password ready to use, but never get asked.  I’ve turned off two-step verification in AOL, but same Thunderbird behavior.  I’ve got multiple computers, and this issue is the same on all.  I’ve had no problem adding a Gmail and <a href=""http://SBCGlobal.net"" rel=""nofollow"">SBCGlobal.net</a> account.  Thunderbird is 144.0.1 (64-bit) release.  Windows 11 Home, version 25H2.  I really don't want to give up Thunderbird, but I need this account badly. </p>",ronbean53;davidsk;wsmwk;,false,false,false,";useragent:Mozilla/5.0 (Windows NT 10.0; Win64; x64) AppleWebKit/537.36 (KHTML, like Gecko) Chrome/142.0.0.0 Safari/537.36;solver_id:7146589",3,0,3,,,"{""username""=>""wsmwk"", ""display_name""=>""Wayne Mery"", ""avatar""=>""https://firefoxusercontent.com/3f0645137479a481e67f7fb3ff1d945b""}"
1544974,2025-11-04 13:55:14 -0800,2025-11-04 13:55:14 -0800,en-US,thunderbird,emails,false,,,false,,"",send-and-receive-email,thunderbird;send-and-receive-email;,michaelyoung00758,<p>Unable to receive email's. Won't accept passwords or email address. Maybe l've done something to upset it. </p>,michaelyoung00758;,false,false,false,";useragent:Mozilla/5.0 (Windows NT 10.0; Win64; x64) AppleWebKit/537.36 (KHTML, like Gecko) Chrome/141.0.0.0 Safari/537.36",0,0,0,,,
1544978,2025-11-04 14:58:35 -0800,2025-11-05 09:11:04 -0800,en-US,thunderbird,TB freezes when replying,false,,,false,1777184,1777083;1777139;1777184;,app-crash,thunderbird;app-crash;,tim.skene1,"<p>TB frequently freezes when writing a reply. There are no reports in crash reports.  It shows this image, and says reporting to Microsoft when I click close. Version 140.4.0esr (64-bit) </p><p>How can I fix the problem? </p>",tim.skene1;siffemoz;wsmwk;,false,false,false,;useragent:Mozilla/5.0 (Windows NT 10.0; Win64; x64; rv:144.0) Gecko/20100101 Firefox/144.0,3,0,0,,,
1544981,2025-11-04 15:32:09 -0800,2025-11-04 15:32:09 -0800,en-US,thunderbird,Hidden bigpond messages in Thunderbird,false,,,false,,"",junk-mail-and-spam,thunderbird;junk-mail-and-spam;,brirobse,<p>I continually have messages I can’t see. Please help </p>,brirobse;,false,false,false,";useragent:Mozilla/5.0 (iPhone; CPU iPhone OS 18_6 like Mac OS X) AppleWebKit/605.1.15 (KHTML, like Gecko) GSA/137.2.345735309 Mobile/15E148 Safari/604.1",0,0,0,,,
