id,created,updated,locale,product,title,is_solved,solution,solved_by,is_spam,last_answer,answers,topic,tags,creator,content,involved,is_archived,is_locked,is_taken,metadata,num_answers,num_votes_past_week,num_votes,taken_until,taken_by,updated_by
1544780,2025-11-03 16:37:46 -0800,2025-11-05 13:56:05 -0800,en-US,thunderbird,imap yahoo error message - edge: too many requests  (bug1997062),false,,,false,1776888,1776888;,send-and-receive-email,thunderbird;send-and-receive-email;,Colin.Warren,"<p>I have THREE yahoo accounts, one of them is giving me an issue, and I don't know why. A message window pops up: ""Enter credentials for XYZ@yahoo.com on imap mail yahoo com"" But the window says: ""Edge: too many requests"" But the other two connect and fetch mail without issues. </p>",Colin.Warren;siffemoz;,false,false,false,;useragent:Mozilla/5.0 (Windows NT 10.0; rv:144.0) Gecko/20100101 Firefox/144.0,1,0,1,,,"{""username""=>""wsmwk"", ""display_name""=>""Wayne Mery"", ""avatar""=>""https://firefoxusercontent.com/3f0645137479a481e67f7fb3ff1d945b""}"
1544781,2025-11-03 16:42:39 -0800,2025-11-03 22:31:56 -0800,en-US,thunderbird,Thunderbird inbox,false,,,false,1776865,1776865;,search,thunderbird;search;,robertpjchattaway,<p>How do i search the inbox between 24/6/2025 and 14/07/2025 </p>,robertpjchattaway;sfhowes;,false,false,false,;useragent:Mozilla/5.0 (X11; Ubuntu; Linux x86_64; rv:144.0) Gecko/20100101 Firefox/144.0,1,0,0,,,
1544783,2025-11-03 16:47:29 -0800,2025-11-03 16:47:29 -0800,en-US,thunderbird,Test #bug bounty,false,,,true,,"",accounts,thunderbird;accounts;,opsiamop1,<p>Test #bug bounty </p>,opsiamop1;,false,false,false,";useragent:Mozilla/5.0 (Windows NT 10.0; Win64; x64) AppleWebKit/537.36 (KHTML, like Gecko) Chrome/141.0.0.0 Safari/537.36",0,0,0,,,
1544784,2025-11-03 16:50:16 -0800,2025-11-03 16:50:16 -0800,en-US,thunderbird,Thiasd a ssjdwek ksjdf sdkjf,false,,,true,,"",search-tag-and-share,thunderbird;search-tag-and-share;,opsiamop,<p>nsd fskdjf sdfkjsdf sdfjsdf sdfkjsdf sdfkjsd fskdjfsd fskdfj sdfksjdf </p>,opsiamop;,false,false,false,;useragent:Mozilla/5.0 (Windows NT 10.0; Win64; x64; rv:144.0) Gecko/20100101 Firefox/144.0,0,0,0,,,
1544786,2025-11-03 17:02:38 -0800,2025-11-03 17:02:38 -0800,en-US,thunderbird,Thunderbird Will Load Account Folders But No Emails,false,,,false,,"",email-and-messaging,thunderbird;email-and-messaging;,reg51,"<p>Good day, </p><p>Friday Oct 31 I noticed Thunderbird downloading several copies (8 to 10) of the same email over and over into a couple account folders.  Not the same email into separate folder accounts, rather 8 to 10 duplicates from whomever into the account it was sent to. </p><p>After restarting Thunderbird error box stated - ""Thunderbird is already running, but not responding.  The old Thunderbird process must be closed to open a new window."" </p><p>After reviewing in Task Manager, no instance was running nor in the background. </p><p>I made a copies of these files onto a separate drive: </p><p>1)  AppData\Roaming\Thunderbird\Profiles </p><pre>     and profiles.ini </pre> <p>2)  AppData\Local\Thunderbird\Profiles </p> <h1 id=""w_"">=</h1> <p>I uninstalled Thunderbird (v 140.4.0) and did a new install, this was v 140.4.0esr </p><p>Thunderbird did open with the new install. </p><p>However it will only display the Email Account Folders and Not any of the previous emails. </p><p>It was looking into the appropriate folder, but not loading the data. </p><p>On one account I changed the location to read the profile containing the emails with no change via: Account Settings/Server/Local Settings. </p><p>I can tell by the size of the folder in the default profile, it does contain the email data, I just need it to load it. </p><p>I don't think uninstalling Thunderbird 140.4.0esr and re-installing v 140.4.0 would make any difference?? </p><p>Very Interesting - any thoughts to remedy? </p><p>Thanks - Drew </p>",reg51;,false,false,false,";useragent:Mozilla/5.0 (Windows NT 10.0; Win64; x64) AppleWebKit/537.36 (KHTML, like Gecko) Chrome/142.0.0.0 Safari/537.36",0,0,0,,,
1544788,2025-11-03 17:22:34 -0800,2025-11-04 02:19:15 -0800,en-US,thunderbird,Thunderbird email,false,,,false,1776924,1776921;1776924;,send-and-receive-email,thunderbird;send-and-receive-email;needsinfo;,kobark,<p>Someone tried to help but I don't seem to be able to reply to that person . It seems that my new computer put Thunderbird on an STMP server and my phone and my old computer are on a POP server . i would like to have them all on the same server so that when read or delete they show read or are deleted on all my computers . </p><pre>    Thanks&nbsp;! Ken </pre>,kobark;Toad-Hall;,false,false,false,;useragent:Mozilla/5.0 (Windows NT 10.0; Win64; x64; rv:144.0) Gecko/20100101 Firefox/144.0,2,0,0,,,
1544793,2025-11-03 18:33:26 -0800,2025-11-03 23:02:51 -0800,en-US,thunderbird,Thunderbird header pane color change,true,1776864,"{""username""=>""sfhowes"", ""display_name""=>""sfhowes"", ""avatar""=>""https://firefoxusercontent.com/c92a42cdab68b73a39b7e6b5bde36e39""}",false,1776869,1776864;1776869;,customization,thunderbird;customization;,fhutt,<p>I am running Windows 11 with Thunderbird V144 and the Windows Classic theme. I find the background colors of the Message List Pane and the Message Pane almost the same as background of the Header pane. I would like to change the background color of the Header Pane so that it stands out more. I looked on the internet and found some solutions to most other Header Pane features but not the background color. Most of those solutions were additions to the userChrome.css file that appear not to work on V144. </p><p>I would appreciate some help with this. </p>,fhutt;sfhowes;,false,false,false,";useragent:Mozilla/5.0 (Windows NT 11.0; Win64; x64; rv:142.0) Gecko/20100101 Firefox/142;kb_visits_prior:[""/en-US/kb/appearance-panel-layout-message-list-card-view-tab""];solver_id:7144501",2,0,0,,,
1544798,2025-11-03 20:13:33 -0800,2025-11-06 11:03:26 -0800,en-US,thunderbird,Conflict between Norton and Thunderbird,false,,,false,1777373,1777373;,connectivity,thunderbird;connectivity;needsinfo;,4junkmail,"<p>When I try to get new emails, a Norton message pops up claiming Thunderbird does not ""recognize Norton's secure connection"". How can I or you fix this? </p>",4junkmail;rooclown101;,false,false,false,;useragent:Mozilla/5.0 (Windows NT 6.1; Win64; x64; rv:109.0) Gecko/20100101 Firefox/115.0,1,0,0,,,
1544802,2025-11-03 21:13:47 -0800,2025-11-07 09:50:33 -0800,en-US,thunderbird,Can't download Yahoo mail - EDGE: Too many requests (bug1997062),false,,,false,1777603,1776887;1777603;,send-and-receive-email,thunderbird;send-and-receive-email;,roongboon,"<p>Since last week, I can't get the mail or send mail through yahoo mail using IMAP in Thunderbird. There is no problem in the past just recently. </p>",roongboon;siffemoz;jjlcape2;,false,false,false,";useragent:Mozilla/5.0 (Windows NT 10.0; Win64; x64) AppleWebKit/537.36 (KHTML, like Gecko) Chrome/141.0.0.0 Safari/537.36",2,0,0,,,"{""username""=>""wsmwk"", ""display_name""=>""Wayne Mery"", ""avatar""=>""https://firefoxusercontent.com/3f0645137479a481e67f7fb3ff1d945b""}"
1544825,2025-11-03 23:55:44 -0800,2025-11-04 00:36:54 -0800,nl,thunderbird,"Extensie ""Open in Browser""op werkbalk plaatsen lukt niet.",false,,,false,1776899,1776899;,extensions,thunderbird;extensions;,j.a.m.berk,"<p>Beste Hulp! </p><p>De extensie ""Open in Browser""heb ik gedownload en is zichtbaar in Extensies. Het lukt me maar niet om deze op een werkbalk van Thunderbird te plaatsen. De moersleutel is niet actief. Het lukt mij wel om andere extensies op een werkbalk te plaatsen, bijv. ""Web Translate"". </p><p>Verwijzing: <a href=""https://github.com/adamreichold/open-in-browser"" rel=""nofollow"">https://github.com/adamreichold/open-in-browser</a>,  <a href=""https://github.com/adamreichold/open-in-browser"" rel=""nofollow"">https://github.com/adamreichold/open-in-browser</a> </p><p>Kunt u me helpen? </p><p>Hartelijke groet, Jan Berk </p>",j.a.m.berk;markh2;,false,false,false,;useragent:Mozilla/5.0 (Windows NT 10.0; Win64; x64; rv:144.0) Gecko/20100101 Firefox/144.0,1,0,0,,,
1544827,2025-11-04 00:01:58 -0800,2025-11-04 00:49:22 -0800,cs,thunderbird,Řádkování v tělě mailu,true,1776904,"{""username""=>""poljos-moz"", ""display_name""=>""poljos"", ""avatar""=>""https://firefoxusercontent.com/111ca132bf44b0bf77555536a14131c1""}",false,1776908,1776904;1776908;,customization,thunderbird;customization;,Karel_01,"<p>(Thunderbird  verze 140.4.0 esr). </p><p>Dobrý den,  lze někde nastavit řádkování textu?  Pokud je souvislý odstavec je řádování ""normální"". Pokud odstavec ukončím, následující odstavec je od předešlého odsazený o jeden řádek. Nevyhovuje mi to. Umím přidat prázdný řádek, když to potřebuji, ale neumím ""automatické odřádkování"" zrušit. Např. při závěrečném podpisu typu&nbsp;: </p><p>S pozdravem za ..... pan XXXX </p><p>to pak vypadá takto: </p><p>S pozdravem </p><p>za ..... </p><p>pan XXXX </p><p>Proč? </p>",Karel_01;poljos-moz;,false,false,false,;useragent:Mozilla/5.0 (Windows NT 10.0; Win64; x64; rv:144.0) Gecko/20100101 Firefox/144.0;solver_id:869668,2,0,0,,,
1544830,2025-11-04 00:30:08 -0800,2025-11-04 03:42:07 -0800,en-US,thunderbird,Thunderbird Email,false,,,false,1776934,1776934;,customization,firefox-14402;firefox-1440;windows-11;thunderbird;customization;,salven,"<p>Just loaded this program and it is great, easy to use and set up. After saying that, I cannot work out how to put the display into columns with the inbox on the left, email next to that and then the email body on the right. I hope that this is clear enough. Any help would be appreciated Thanks Steve </p>",salven;davidsk;,false,false,false,;useragent:Mozilla/5.0 (Windows NT 10.0; Win64; x64; rv:144.0) Gecko/20100101 Firefox/144.0;ff_version:144.0.2;os:Windows 11,1,0,0,,,
1544839,2025-11-04 01:40:07 -0800,2025-11-04 11:57:07 -0800,en-US,thunderbird,Use of the outbox,false,,,false,1777005,1777005;,send-and-receive-email,thunderbird;send-and-receive-email;,pmwilford,"<p>Using Thunderbird email. When 'sending' the message sends rather than just going to the outbox until I wish to send/receive emails as I did in outlook. How do i configure my email accounts to use the outbox rather than sending immediately.?  Thanks, Patrick. </p>",pmwilford;sfhowes;,false,false,false,";useragent:Mozilla/5.0 (Windows NT 10.0; Win64; x64) AppleWebKit/537.36 (KHTML, like Gecko) Chrome/140.0.0.0 Safari/537.36 Edg/140.0.0.0;kb_visits_prior:[""/en-US/kb/how-create-and-use-mailing-lists-thunderbird"", ""/en-US/kb/sending-and-receiving-messages-thunderbird""]",1,0,0,,,
1544840,2025-11-04 02:00:52 -0800,2025-11-04 02:26:02 -0800,it,thunderbird,tracciamento mail,false,,,false,1776927,1776927;,extensions,thunderbird;extensions;,3rdiredaellimauro,<p>Esiste una estensione per tracciare le mail inviate?... (una notifica quando il destinatario legge la mail??? ) Grazie </p>,3rdiredaellimauro;@next;,false,false,false,";useragent:Mozilla/5.0 (Windows NT 10.0; Win64; x64) AppleWebKit/537.36 (KHTML, like Gecko) Chrome/142.0.0.0 Safari/537.36",1,0,0,,,
1544842,2025-11-04 02:07:20 -0800,2025-11-06 11:58:37 -0800,en-US,thunderbird,メッセージを送信できませんでした。 送信 (SMTP) サーバー  の認証に失敗しました。パスワードを確認し、[アカウント設定] の [送信 (SMTP) サーバー] で [認証方式] が正しいことを確認してください。,false,,,false,1777400,1777400;,send-and-receive-email,thunderbird;send-and-receive-email;,masaya-isida,<p>メッセージを送信できませんでした。 送信 (SMTP) サーバー  の認証に失敗しました。パスワードを確認し、[アカウント設定] の [送信 (SMTP) サーバー] で [認証方式] が正しいことを確認してください。どうすればいいですか </p>,masaya-isida;wsmwk;,false,false,false,";useragent:Mozilla/5.0 (Windows NT 10.0; Win64; x64) AppleWebKit/537.36 (KHTML, like Gecko) Chrome/142.0.0.0 Safari/537.36 Edg/142.0.0.0;kb_visits_prior:[""/ja/kb/cannot-receive-messages"", ""/ja/kb/cannot-send-messages""]",1,0,0,,,
1544843,2025-11-04 02:25:49 -0800,2025-11-04 02:25:49 -0800,en-US,thunderbird,[Ctrl]+[H] Replace Display Bug?,false,,,false,,"",email-and-messaging,thunderbird;email-and-messaging;,yamato4,"<p>When creating a new email in Thunderbird, the batch replace operation using [Ctrl]+[H] used to show the replacements in the editing window.  Now, they don't appear unless I close the [Find and Replace] dialog. Even when I want to check the replacements, they don't show until I close the dialog. This seems like a bug. Is there anything I can do? </p>",yamato4;,false,false,false,;useragent:Mozilla/5.0 (Windows NT 10.0; Win64; x64; rv:144.0) Gecko/20100101 Firefox/144.0,0,0,0,,,
1544848,2025-11-04 02:38:23 -0800,2025-11-04 02:38:23 -0800,en-US,thunderbird,Accès à la messagerie,false,,,false,,"",send-and-receive-email,thunderbird;send-and-receive-email;,j-p.ploussard,"<p>Bonjour Connexion impossible à mon compte, l'échec étant imputé à une typographie erronée de l'adresse de messagerie (.fr.) alors que celle-ci est normale, de type(.fr). Comment corriger&nbsp;? Merci de votre aide </p>",j-p.ploussard;,false,false,false,;useragent:Mozilla/5.0 (Windows NT 10.0; Win64; x64; rv:144.0) Gecko/20100101 Firefox/144.0,0,0,0,,,
1544849,2025-11-04 02:42:55 -0800,2025-11-04 02:42:55 -0800,en-US,thunderbird,How do I paste a list of web addresses into an email without formatting ?,false,,,false,,"",customization,thunderbird;customization;,jc.auvray,"<p>Hello, Viewed with Thunderbird: 140.4.0esr (64-bit) and earlier versions Viewed in email drafting In the list, each web address begins with ""https"" or ""www."" If I copy/paste a list of website addresses, only the first one is pasted, with automatic creation of an image and a link to that website. The other lines in the list are ignored. The same problem occurs when pasting ""without formatting"" or when changing the ""sending format"" of the email to ""text only"". Which solution is possible without pasting the list line by line&nbsp;? Sorry for my English Thanks </p>",jc.auvray;,false,false,false,";useragent:Mozilla/5.0 (Windows NT 10.0; Win64; x64; rv:144.0) Gecko/20100101 Firefox/144.0;kb_visits_prior:[""/fr/kb/comment-creer-et-utiliser-des-listes-de-diffusion"", ""/fr/kb/les-liens-hypertextes-dans-les-messages-ne-fonctio""]",0,0,0,,,
1544853,2025-11-04 03:02:08 -0800,2025-11-04 03:02:08 -0800,en-US,thunderbird,Sixxy video,false,,,true,,"",passwords-and-sign-in,thunderbird;passwords-and-sign-in;,kamranbutt8666,<p>Sixxy video </p>,kamranbutt8666;,false,false,false,";useragent:Mozilla/5.0 (Linux; Android 10; K) AppleWebKit/537.36 (KHTML, like Gecko) Chrome/142.0.0.0 Mobile Safari/537.36",0,0,0,,,
1544855,2025-11-04 03:11:48 -0800,2025-11-06 10:56:36 -0800,en-US,thunderbird,Saved .eml files on network folder appear blank when reopened,false,,,false,1777370,1777370;,import-and-export-email,thunderbird;import-and-export-email;,made4web,"<p>Hello, I’m experiencing an issue when saving email messages as .eml files from Thunderbird. </p><p>When I save a message to a network storage folder (for example, a shared drive or NAS), the file seems to save correctly, but when I try to reopen it later, the content is completely blank — the message body is missing. </p><p>If I save the same email to my desktop or a local folder, the file opens perfectly and displays all content as expected. </p><p>Environment details: </p><p>Thunderbird version: 140.3.1esr </p><p>Operating system: Windows 11 </p><p>Network storage type: NAS </p><p>Has anyone else experienced this issue? Could this be related to file permissions, encoding, or how Thunderbird handles .eml files on network paths? </p><p>Thank you for your help! </p>",made4web;wsmwk;,false,false,false,";useragent:Mozilla/5.0 (Windows NT 10.0; Win64; x64) AppleWebKit/537.36 (KHTML, like Gecko) Chrome/141.0.0.0 Safari/537.36",1,0,0,,,
1544859,2025-11-04 03:38:42 -0800,2025-11-04 03:38:42 -0800,it,thunderbird,Come faccio per installarlo su iPhone,false,,,true,,"",accessibility,thunderbird;accessibility;,cvkzkdkwnd,<p>Come faccio a installarlo su iPhone </p>,cvkzkdkwnd;,false,false,false,";useragent:Mozilla/5.0 (iPhone; CPU iPhone OS 18_7_1 like Mac OS X) AppleWebKit/605.1.15 (KHTML, like Gecko) FxiOS/144.3  Mobile/15E148 Safari/604.1",0,0,0,,,
1544866,2025-11-04 04:02:00 -0800,2025-11-04 05:59:27 -0800,en-US,thunderbird,Wie kann ich die Schriftgröße der Anzeige aller Emails nach dem Einloggen vergrößern? ...nicht die Schriftgröße in den Emails!,true,1776957,"{""username""=>""Mapenzi"", ""display_name""=>""Mapenzi"", ""avatar""=>""https://profile.accounts.firefox.com/v1/avatar/d""}",false,1776957,1776957;,customization,thunderbird;customization;,g.deist,<p>Wie kann ich die Schriftgröße der Anzeige aller Emails nach dem Einloggen vergrößern? ...nicht die Schriftgröße in den Emails! </p>,g.deist;Mapenzi;,false,false,false,;useragent:Mozilla/5.0 (Windows NT 10.0; Win64; x64; rv:144.0) Gecko/20100101 Firefox/144.0;solver_id:7138932,1,0,0,,,
1544872,2025-11-04 04:40:37 -0800,2025-11-04 05:15:12 -0800,en-US,thunderbird,adding new account,false,,,false,1776948,1776948;,account-management,thunderbird;account-management;,radpawlowski,"<p>hi, if I go to settings and email account settings and if try to add new account a windows with ""name"" and ""email adress"" open and after filling it up I get blue circle spinning and nothng </p>",radpawlowski;davidsk;,false,false,false,";useragent:Mozilla/5.0 (Windows NT 10.0; Win64; x64) AppleWebKit/537.36 (KHTML, like Gecko) Chrome/142.0.0.0 Safari/537.36;kb_visits_prior:[""/pl/kb/thunderbird-uzywanie-wielu-profili""]",1,0,0,,,
1544874,2025-11-04 04:52:32 -0800,2025-11-04 08:44:13 -0800,en-US,thunderbird,Emails not received in Webmail but not in Thunderbird,false,,,false,1776978,1776967;1776978;,send-and-receive-email,thunderbird;send-and-receive-email;,melsnews,"<p>Hello, </p><p>I have used thunderbird for years.  I have several email accounts on thunderbird.  I own a small company with a private domain.  The last [work] email both my employee and i received in Thunderbird was on 10/27/2025.  The emails just stopped arriving in our inboxes.  We can both access email through webmail.  Personally i am still able to access all my other emails (<a href=""http://gmail.com"" rel=""nofollow"">gmail.com</a>, <a href=""http://comcast.net"" rel=""nofollow"">comcast.net</a>). </p><p>I checked with Hostgator and my thunderbird email settings are correct. </p><p>I did not have a SSL certificate so i have just onboarded that feature (not sure if that has any relevance to our current predicament). </p><p>Thoughts on how to troubleshoot this problem?  Is it possible Thunderbird has made a recent software change? </p><p>Any ideas appreciated. </p><p>Thanks, Melissa </p>",melsnews;davidsk;,false,false,false,";useragent:Mozilla/5.0 (Windows NT 10.0; Win64; x64) AppleWebKit/537.36 (KHTML, like Gecko) Chrome/142.0.0.0 Safari/537.36",2,0,2,,,
1544875,2025-11-04 04:53:01 -0800,2025-11-05 11:45:59 -0800,en-US,thunderbird,Emails received in Webmail but not in Thunderbird,false,,,false,1777208,1776950;1777119;1777208;,send-and-receive-email,thunderbird;send-and-receive-email;,melsnews,"<p>Hello, </p><p>I have used thunderbird for years.  I have several email accounts on thunderbird.  I own a small company with a private domain.  The last [work] email both my employee and i received in Thunderbird was on 10/27/2025.  The emails just stopped arriving in our inboxes.  We can both access email through webmail.  Personally i am still able to access all my other emails (<a href=""http://gmail.com"" rel=""nofollow"">gmail.com</a>, <a href=""http://comcast.net"" rel=""nofollow"">comcast.net</a>). </p><p>I checked with Hostgator and my thunderbird email settings are correct. </p><p>I did not have a SSL certificate so i have just onboarded that feature (not sure if that has any relevance to our current predicament). </p><p>Thoughts on how to troubleshoot this problem?  Is it possible Thunderbird has made a recent software change? </p><p>Any ideas appreciated. </p><p>Thanks, Melissa </p>",melsnews;davidsk;,false,false,false,";useragent:Mozilla/5.0 (Windows NT 10.0; Win64; x64) AppleWebKit/537.36 (KHTML, like Gecko) Chrome/142.0.0.0 Safari/537.36",3,0,0,,,
1544879,2025-11-04 05:05:42 -0800,2025-11-04 17:09:42 -0800,en-US,thunderbird,How to do an event search in Agenda ?,true,1777002,"{""username""=>""sfhowes"", ""display_name""=>""sfhowes"", ""avatar""=>""https://firefoxusercontent.com/c92a42cdab68b73a39b7e6b5bde36e39""}",false,1777039,1777002;1777039;,search,thunderbird;search;,roland.oeyen,<p>How can I perform an search in Thunderbird Agenda&nbsp;? </p>,roland.oeyen;sfhowes;,false,false,false,";useragent:Mozilla/5.0 (Windows NT 10.0; Win64; x64) AppleWebKit/537.36 (KHTML, like Gecko) Chrome/142.0.0.0 Safari/537.36;solver_id:7145605",2,0,0,,,
1544885,2025-11-04 06:10:09 -0800,2025-11-04 06:10:09 -0800,en-US,thunderbird,Inbox.conf(1) folder ... creation,false,,,false,,"",email-and-messaging,thunderbird;email-and-messaging;,thomgarner,<p>For some reason after the last update I have been getting multiple inbox.conf folders getting created (see image). I have not found a way to remove these folders. Is this a bug or a setting issue? </p>,thomgarner;,false,false,false,";useragent:Mozilla/5.0 (Windows NT 10.0; Win64; x64) AppleWebKit/537.36 (KHTML, like Gecko) Chrome/142.0.0.0 Safari/537.36 Edg/142.0.0.0",0,0,0,,,
1544886,2025-11-04 06:23:51 -0800,2025-11-04 06:23:51 -0800,en-US,thunderbird,Hacked,false,,,false,,"",security,thunderbird;security;,mister.polo,"<p>The application Thunderbird was added to my microsoft account without my consent, and immediately a bunch of e-mail rules were set up to pass on e-mails and delete them. This led to me loosing acces to a bunch of stuff, among which are vinted, discord and humble bundle. Discord has been recovered now though. However, microsoft support was very elusive on how this happened, how specifically thunderbird recieved permission to acces my microsoft account. Could you please explain how hackers were able to abuse your application to make life hard on people? </p>",mister.polo;,false,false,false,;useragent:Mozilla/5.0 (Windows NT 10.0; Win64; x64; rv:144.0) Gecko/20100101 Firefox/144.0,0,0,0,,,
1544895,2025-11-04 06:51:34 -0800,2025-11-04 07:08:01 -0800,nl,thunderbird,thunderbird,false,,,false,1776964,1776964;,languages,thunderbird;languages;,vicsam,"<p>Beste, plots staan verschillende mapnamen  in het engels. hoe kan ik die terug in het nederlands zetten? </p>",vicsam;Mozilla-assistent;,false,false,false,;useragent:Mozilla/5.0 (Windows NT 10.0; Win64; x64; rv:144.0) Gecko/20100101 Firefox/144.0,1,0,0,,,
1544899,2025-11-04 07:01:42 -0800,2025-11-04 09:38:32 -0800,en-US,thunderbird,Mozilla Emails,true,1776989,"{""username""=>""davidsk"", ""display_name""=>""david"", ""avatar""=>""https://firefoxusercontent.com/5eed5ecf74d9e1ec85435ea262bc016e""}",false,1776989,1776989;,send-and-receive-email,thunderbird;send-and-receive-email;,jssantafe,<p>Can't send email but can receive them.  Get error that authentication is required. ELNK003_308 Correct email address. </p>,jssantafe;davidsk;,false,false,false,";useragent:Mozilla/5.0 (Windows NT 10.0; Win64; x64) AppleWebKit/537.36 (KHTML, like Gecko) Chrome/142.0.0.0 Safari/537.36 Edg/142.0.0.0;solver_id:7145860",1,0,0,,,
1544900,2025-11-04 07:03:51 -0800,2025-11-04 11:46:54 -0800,en-US,thunderbird,Finnish Spell Checker missing for philosophical / technical reasons?,false,,,false,1777000,1777000;,languages,thunderbird;languages;,kai.kronstrom,"<p>I was looking for a Finnish spell checker, but apparently there is none. The issue appears to be that a dictionary is far from enough for checking Finnish as the endings embedded into words do the trick prepositions do in many languages (i.e. house - talo, to the house - taloon, from the house - talosta, from my house - talostani). There is a spell checker engine available (Voikko), but the WebExtension API fundamentally doesn't provide the needed support. Likely LLM helpers will have the same issue. </p><p>Questions: Is my understanding correct? Is there any plans that this could be fixed&nbsp;?  Any tricks that could be applied&nbsp;? i.e. old enough version as it used to work for long time a ago? </p><p>If my understanding is correct, then it doesn't make sense to have Finnish language SW-version and downloading page. At least without proper warning that this important feature is not available. </p>",kai.kronstrom;sfhowes;,false,false,false,;useragent:Mozilla/5.0 (Windows NT 10.0; Win64; x64; rv:144.0) Gecko/20100101 Firefox/144.0,1,0,0,,,
1544904,2025-11-04 07:06:35 -0800,2025-11-04 07:17:02 -0800,nl,thunderbird,verzonder berichten niet in map semt items,true,1776968,"{""username""=>""Mozilla-assistent"", ""display_name""=>""Mozilla-assistent"", ""avatar""=>""https://firefoxusercontent.com/bcc8ecd2bffa6acd887585aec6134e40""}",false,1776968,1776968;,send-and-receive-email,thunderbird;send-and-receive-email;needsinfo;,minekus,<p>Al langere tijd verschijnen sommige emails niet in de map sent items. Ook niet na opnieuw openen van thunderbird. Soms wil ik deze weer inzien. Hoer kan ik dit oplossen? </p><p>Ik gebruik Thunderbird 144.0.1 64 bits. Windows 11 home 24H2 </p><p>Al vast veel dank! </p><p>Jan Minekus </p>,minekus;Mozilla-assistent;,false,false,false,;useragent:Mozilla/5.0 (Windows NT 10.0; Win64; x64; rv:144.0) Gecko/20100101 Firefox/144.0;solver_id:491063,1,0,0,,,
