id,question_id,created,updated,content,creator,is_spam,num_helpful,num_unhelpful
1712490,1493640,2025-02-16 05:39:31 -0800,2025-02-16 05:40:36 -0800,"<p>The 'Light' or 'Dark' mode on a computer is very specific and it's a 'Theme' which is why it is located under 'Addons and Themes'.  It has nothing to do with 'Language' and 'Appearance' is about font and colour and size  - it has nothing to do with Themes. </p><p>Please note it is possible to download a Theme, so that means it's an addon hence why they are in same location. It's not going to change because a generic Theme is not the same as choosing how you prefer to alter the appearance of the contents when using the selected theme. </p><p><strong>re&nbsp;:but can't find a solution to switch to a readable light version. </strong> </p><p>I suggest you offer more information on your real issue and see if a good solution can be found that suits you. </p><p>Please tell me what OS you are using because the 'System Theme' on Thunderbird will be dependent upon what settings you have on computer. For example: Windows OS has a settings for customised app mode which is dark or light. Windows OS - Settings &gt; Personalisation &gt; Colours will also effect eg: Task bar, button background colours and the thin strip colour which depicts what eg: Quick Filter optins are set. </p><p>So if computer has apps mode set to Light then the 'System Theme' setting in Thunderbird will also be Light.  </p><p>Please offer info about what you are finding difficult to 'read' and perhaps  post an image to help explain the problem. </p>",Toad-Hall,false,0,4
1748643,1493640,2025-07-13 02:24:59 -0700,2025-07-13 02:24:59 -0700,"<p>I came here for the first time because I could not remember how to set dark/light. Saw that there was already an answer. A snotty, condescending answer, but an answer. Think I'll keep my failing memories to myself if this is the typical help rendered. </p>",Kaaby357,false,0,0
1748899,1493640,2025-07-14 02:43:44 -0700,2025-07-14 02:43:44 -0700,"<em><p>Kaaby357 <a href=""#answer-1748643"" rel=""nofollow"">said</a></p></em> <blockquote>I came here for the first time because I could not remember how to set dark/light. Saw that there was already an answer. A snotty, condescending answer, but an answer. Think I'll keep my failing memories to myself if this is the typical help rendered. </blockquote> <p>There was nothing snotty or condescending about that comment. It was pure facts. This might be your first time on the support forum but it does not mean you can be rude to others who offer their time freely to help other users. As a heads up, your comment in someone elses question posts emails to that person and anyone following the question.  </p><p>The person who asked the question just wondered why the setting was not under Settings in appearance. That is a reasonable assumption to make, but the issue was all about themes and they are kept in a separate location. There is nothing wrong with stating that fact because that is just what it is. I offered to help further if the person needed it as there are many potential fixes when it comes to specific user readibility issues. As they did not respond any further, it would seem they were ok.  If the information helped you then that's ok too. </p>",Toad-Hall,false,0,1
1748911,1493640,2025-07-14 03:52:12 -0700,2025-07-14 03:52:12 -0700,"<p>Shoot, now you gone and hurt my feelings. </p>",Kaaby357,false,0,0
1712478,1493641,2025-02-16 03:23:21 -0800,2025-02-16 03:23:21 -0800,"<p>The only way that setting could be related to the problem would be if some <i>other</i> application is trying to use the default mail client for some reason when you log in. You may try setting Apple Mail as the default mail app, just to see if that causes Mail to open instead… </p>",DavidGG,false,0,0
1712481,1493641,2025-02-16 04:02:42 -0800,2025-02-16 04:02:42 -0800,"<em><p>DavidGG <a href=""#answer-1712478"" rel=""nofollow"">said</a></p></em> <blockquote>The only way that setting could be related to the problem would be if some <i>other</i> application is trying to use the default mail client for some reason when you log in. You may try setting Apple Mail as the default mail app, just to see if that causes Mail to open instead… </blockquote> <p>Thanks for getting back to me so quickly, David.  I'll give it a try.  Any other ideas about what's going on? </p>",nonpsvdl,false,0,0
1712489,1493641,2025-02-16 05:18:06 -0800,2025-02-16 05:18:06 -0800,"<p><em>re&nbsp;:Thunderbird always asks for my <strong>primary password</strong></em> </p><p>The wording 'Primary Password' is very specific and only relates to a specific password you set up to stop all other people who have access to your computer and who you allow access to your computer User Account from being able to get access to you saved passwords in Thunderbird. It has nothing to do with mail account passwords.  </p><p>It is something you set up but do you really need the 'Primary Password'&nbsp;? Do you allow other people full access to your computer and user account? If no then it's only you being prevented from auto access. </p><p>This is where it is set up: In Thunderbird </p> <ul><li> Settings &gt; Privacy &amp; Security </li><li> scroll down to 'Passwords section </li></ul> <p>If the 'Use a Primary Password' checkbox is selected then you set it up. </p> <ul><li> If you want to remove it then click on 'Change Primary Password' </li><li> Follow instructions. </li></ul> <p>More info here: </p> <ul><li> <a href=""https://support.mozilla.org/en-US/kb/protect-your-thunderbird-passwords-primary-password"" rel=""nofollow"">https://support.mozilla.org/en-US/kb/protect-your-thunderbird-passwords-primary-password</a> </li></ul> <p><br> <em><strong>re&nbsp;: I don't want Thunderbird opening automatically.</strong></em> </p><p>Thunderbird only starts up when you start computer and logon to your computer User Account IF Thunderbird has been set up to start up automatically when you logon.  This has nothing to do with the Primary PAssword and it's not a Thunderbird setting.  </p><p>This is simple fix, but this is very specific to a MAC.  Maybe you have only just acquired a MAC computer. I don't use a MAC but a goggle search located the following info. I suggest you deselect the 'Open at Login' option. <em>The simplest way to disable an app from launching on startup is from the Dock. Control-click on the app and hover over Options in the menu. Apps that are set to open automatically will have a checkmark next to Open at Login. Click that option to uncheck it and disable it from opening.</em> </p><p>Helpful Info link: <a href=""https://uk.pcmag.com/macos/134423/how-to-stop-mac-apps-from-launching-at-startup"" rel=""nofollow"">https://uk.pcmag.com/macos/134423/how-to-stop-mac-apps-from-launching-at-startup</a> </p>",Toad-Hall,false,0,0
1712523,1493641,2025-02-16 08:54:53 -0800,2025-02-16 08:54:53 -0800,"<p>No, setting Thunderbird as your default mail client should not cause Thunderbird to be launched when you start your computer. </p><p>You have ruled out my first two guesses: 1) You shut down with the option to re-open windows when logging back in and Thunderbird is still open; 2) Thunderbird is set to open on start-up in System Settings. </p><p>I have only one other guess, and it's just a guess. Check the file system for files that cause apps to open automatically. Do you see anything related to Thunderbird in the following locations? </p><p>~/Library/LaunchAgents /Library/LaunchAgents /Library/LaunchDaemons </p><p>The tilde (~) refers to your user account. The folders without a tilde are at the root of your file system. Please tell me if this is not enough information for you. </p>",mozilla98,false,0,0
1712477,1493642,2025-02-16 03:14:45 -0800,2025-02-16 03:15:06 -0800,"<p>You may have inadvertently hidden some toolbar, in particular maybe <b>View &gt; Toolbars &gt; Composition Toolbar</b> when composing a new message. Check this article to learn more about the view options available in Thunderbird: </p><p><a href=""https://support.mozilla.org/kb/getting-started-thunderbird-main-window-supernova"" rel=""nofollow"">https://support.mozilla.org/kb/getting-started-thunderbird-main-window-supernova</a> </p>",DavidGG,false,0,0
1712525,1493642,2025-02-16 09:03:42 -0800,2025-02-16 09:03:42 -0800,"<p>Many thanks, I am sure you are right, problem is I don't know how to delete my mistake ... I will try until I find&nbsp;! Thanks again </p>",genevieveguiot,false,0,0
1712620,1493642,2025-02-16 14:51:15 -0800,2025-02-16 14:51:15 -0800,"<em><p>genevieveguiot <a href=""#question-1493642"" rel=""nofollow"">said</a></p></em> <blockquote>help me to place again ""envoyer"" under the case ""fichier"" so I can send my messages easily </blockquote> <p>Your screen shot shows the tool bar for the Thunderbird main window which doesn't habe an item ""Envoyer"". I you open a compose (""new message"") window you will see another tool bar which contains ""Envoyer"" and/or ""Envoyer plus tard"" </p>",Mapenzi,false,0,0
1712483,1493645,2025-02-16 04:29:00 -0800,2025-02-16 04:29:00 -0800,<p>There is no Thunderbird version for iOS. But I'm certain iOS also has an email client you can use. </p>,christ1,false,0,0
1712640,1493645,2025-02-16 16:41:27 -0800,2025-02-16 16:41:27 -0800,"<p>Thunderbird is currently only for desktop Windows, macOS, Linux and as a mobile version for Android. </p>",James,false,0,0
1712484,1493654,2025-02-16 04:42:54 -0800,2025-02-16 04:42:54 -0800,"<p>I've used this method to move my Thunderbird profile to anothe PC. I don't see why it would not work for moving to another drive. Hope it helps you. </p><p>This process copies all the users profile. Be sure that thunderbird is NOT running on either PC. The “Thunderbird” file is the whole profile including folders and mail filters. Do not be confused by the “profile” folder inside the “Thunderbird” folder. You need to copy &amp; paste the whole “Thunderbird” folder. I used this easy method successfully when migrating from a Windows 10 pc to a Windows 11pro machine. When asked to enter %appdata% it does include the % signs. </p><pre>   1. ensure thunderbird is not running on old machine     2. enter %appdata% in search window on task bar and press Enter key     3. this should open windows file explorer in Appdata\roaming folder     4. highlight the Thunderbird folder and copy to mem stick     5. ensure thunderbird is installed on second computer and NOT running     6. Plug in your mem stick with the copied Thunderbird folder    7. enter %appdata% in search window on task bar and press Enter key     8. you should be in Appdata\roaming folder , copy&amp;paste the exported Thunderbird folder there. This may prompt to overwrite an existing folder of same name. allow it     9. start thunderbird and all should be there </pre>",showtown,false,2,0
1712488,1493654,2025-02-16 05:15:47 -0800,2025-02-16 05:15:47 -0800,"<p>See <a href=""https://kb.mozillazine.org/Moving_your_profile_folder_-_Thunderbird"" rel=""nofollow"">https://kb.mozillazine.org/Moving_your_profile_folder_-_Thunderbird</a> </p>",christ1,false,0,0
1712492,1493654,2025-02-16 06:03:58 -0800,2025-02-16 06:03:58 -0800,"<ol><li> In Thunderbird, choose <b>File &gt; Offline &gt; Work Offline</b> from the menu bar, so Thunderbird doesn't connect to the server while you're doing this. </li><li> Locate the profile folder you want to move to another drive. </li><li> Quit Thunderbird. </li><li> <b>Copy</b> (don't remove from the original location yet) the profile folder to the desired new location. </li><li> Launch Thunderbird, choose <b>Help &gt; Troubleshooting Information</b> from the menu bar and click on the <b>about:profiles</b> link there to open the <b>About Profiles</b> built-in Profile Manager. </li><li> <b>Create a New Profile</b>, read the introductory text if this is new to you, then click <b>Continue</b>. You may name the profile however you want, but I'd choose a name such as ""D-Drive"" that makes it clear this is a profile stored outside of the default location. </li><li> Click <b>Choose Folder</b> to choose the profile folder in the new location, then click <b>Done</b>. </li><li> Click <b>Launch Profile</b> under the new profile in the profile manager to start using the new profile. Don't go online yet, make sure first that everything is working as expected. In particular, you may check the <b>Server Settings &gt; Location Directory</b> of your mail accounts to see that your mail is now being stored where you expect. </li><li> Go back to the profile manager. The new profile may have already been set as the default. If not, use the <b>Set as default</b> button under it to make it so. </li><li> <b>Remove</b> the old profile. You'll be given the option to <b>Delete Files</b>, which is the very reason you're doing this. </li><li> Tell Thunderbird to go back online by unchecking <b>File &gt; Offline &gt; Work Offline</b>. </li></ol> <p>These instructions are similar to the article linked by <em>christ1</em>, but don't require using the external Profile Manager tool. That additional complication is unnecessary. Recent versions of Thunderbird have the built-in version of the Profile Manager that can be used instead. Both versions of the Profile Manager are documented in the following article: </p><p><a href=""https://support.mozilla.org/kb/profile-manager-create-and-remove-thunderbird-profiles"" rel=""nofollow"">https://support.mozilla.org/kb/profile-manager-create-and-remove-thunderbird-profiles</a> </p>",DavidGG,false,0,0
1712497,1493668,2025-02-16 07:13:30 -0800,2025-02-16 07:13:30 -0800,"<p><a href=""https://support.mozilla.org/kb/automatic-conversion-google-mail-accounts-oauth20"" rel=""nofollow"">https://support.mozilla.org/kb/automatic-conversion-google-mail-accounts-oauth20</a> </p>",DavidGG,false,0,0
1712943,1493675,2025-02-18 07:48:02 -0800,2025-02-18 07:48:02 -0800,"<p>I suppose the thinking is Tasks are usually a personal undertaking. You are talking about assigning a Task which is not inviting someone to attend an event or meeting etc. </p><p>I would do the following in your situation: Create the Task, so you have a log - you could set a Category which is relevant, save and close.  Note - whatever you type in 'Title' gets used as 'Subject' and whatever you type in 'Description' becomes the message content. So you could enter the name of person assigned task followed by the info on what you want done etc. </p><p>Then right click on Task in list and select 'convert to' &gt; 'Message' Edit the email as required eg: choose recipient in TO field and send. Now, you also have a log of sending the email as well. This means the recipient is made aware of the Task and you have the Task listed. They could be asked to update you on progress etc. </p><p>The recipient can then: Right click on received email and select 'Organise' &gt; 'Convert to' &gt; 'Task' Then both you and the person assigned the Task have a copy of the Task. </p>",Toad-Hall,false,0,0
1712547,1493684,2025-02-16 09:56:17 -0800,2025-02-16 09:56:17 -0800,"<p>First, check that your antivirus isn't scanning the TB profile folder (add the folder as an exception or exclusion in AV settings).  Next, if the account is IMAP, try rebuilding the Inbox, by deleting the mbox and .msf index file: </p><p><a href=""http://kb.mozillazine.org/Compacting_folders#Real_fix"" rel=""nofollow"">http://kb.mozillazine.org/Compacting_folders#Real_fix</a> </p><p>e.g. Help/Troubleshooting Info, Profile Folder, Open Folder, close TB, open the ImapMail/<a href=""http://imap.gmail.com"" rel=""nofollow"">imap.gmail.com</a> folder that has Inbox and Inbox.msf. </p><p>When TB is restarted, the Inbox will download from the mail server.  See if compacting now works. </p>",sfhowes,false,0,0
1712696,1493684,2025-02-17 02:33:30 -0800,2025-02-17 02:33:30 -0800,"<p>Thank you for the answer, but as I said above, rebuilding the indexes did not help. My account is POP and I had no benefit by deleting the ""global-messages-db.sqlite"" file and rebuilding it. </p>",riccardonarducci,false,0,0
1712751,1493684,2025-02-17 09:37:29 -0800,2025-02-17 09:37:29 -0800,"<p>By default, Microsoft Defender Antivirus runs in the background, scanning files and processes that you open or download looking for malware. </p><p>When you want to compact or download emails to eg: Inbox, that file gets opened.  If opened the Anti-Virus will then control the file which may prevent anything being written, so you need to make the Thunderbird folder (and all files and folders it contains) exempt from this auto scanning. </p><p>If you use a different Anti-Virus eg: Norton etc, then the same applies. </p><p>Have you Exited Thunderbird and then accessed your Anti-Virus and set up the Thunderbird profile as exempt from scanning? This is the folder I'm talking about: C://Users/username/Appdata/Roaming/<strong>Thunderbird</strong> </p><p>Then restart Thunderbird, wait for any download checks to occur and then right click on Inbox and select 'Compact folder'. Whilst compact is in progress, do not select to open or select anything and do not exit Thunderbird. Just wait. Did you get the same error message? </p><p>What size is the Inbox mbox file in the profile name/Mail/gmail account folder here: C://Users/username/Appdata/Roaming/Thunderbird/Profiles/profile name/Mail/gmail mail account folder </p>",Toad-Hall,false,0,0
1712754,1493684,2025-02-17 09:45:30 -0800,2025-02-17 09:45:30 -0800,"<em><p>riccardonarducci <a href=""#answer-1712696"" rel=""nofollow"">said</a></p></em> <blockquote>Thank you for the answer, but as I said above, rebuilding the indexes did not help. My account is POP and I had no benefit by deleting the ""global-messages-db.sqlite"" file and rebuilding it. </blockquote> <p>Rebuilding the index, which is the same as deleting the .msf file or doing Repair Folder, is not sufficient.  Deleting the mbox file will make TB automatically recreate it on restart with a new, uncorrupted Inbox.  Rebuilding the global sqlite file has no impact on repairing a corrupted Inbox. </p>",sfhowes,false,0,0
1712897,1493684,2025-02-18 02:09:05 -0800,2025-02-18 02:09:05 -0800,"<p>I thank all those who are participating to help me solve the problem. I was not able to solve the issue even by carrying out the following activities that were suggested by you. I inserted the exception of the TB folder in the Antivirus (integrated in windows10) of the path: ""C:\Users\Riccardo\AppData\Roaming\Thunderbird"" In addition to the antivirus integrated in Windows10 I also use the Watchdog (last release 4.3.102) anti-malware protection, but there is no possibility of excluding individual folders or files. I turned off completely and restarted the PC. I reloaded TB waiting for all the services to load, mail downloads and so on. My path is: C:\Users\Riccardo\AppData\Roaming\Thunderbird\Profiles\xx1qf56m.default\Mail Inbox size = 0 kb and Inbox.msf = 3 Kb </p><p>However, I also ask the following question: ""If for so many years the compaction that I perform daily, has worked well without excluding the TB folder from the antivirus, why should I exclude it now?"" Finally, I note that inside my TB folder there is no ""mbox"" file as Sfhowes reported to me in the last post, but only inbox and inbox.msf by deleting which I did not obtain any result. Thanks again to everyone. Riccardo </p>",riccardonarducci,false,0,0
1712953,1493684,2025-02-18 08:34:03 -0800,2025-02-18 08:34:03 -0800,"<p>I would like to add that now it no longer gives the error message: it simply does not compact the folder, leaving a few MB of unused memory. </p>",riccardonarducci,false,0,0
1712994,1493684,2025-02-18 12:29:41 -0800,2025-02-18 12:29:41 -0800,"<p>The file named Inbox (no extension) that's in the same place as Inbox.msf is the mbox file.  Since you deleted the old one and a new empty one was created, automatic compacting won't be performed until a sufficient number of messages have been deleted to trigger the process - it depends on the threshold set in Settings/General. </p><p>Compacting might have worked without excluding the folder from AV scanning, until the folder became corrupted over time and the process failed.  AV excluding simply removes the most likely cause of corruption. </p>",sfhowes,false,0,0
1713114,1493684,2025-02-19 00:36:57 -0800,2025-02-19 00:36:57 -0800,"<p>I understand thanks, however I checked that the compaction threshold in my settings is 3 MB and I have already accumulated 9.5. Patience I will keep it like this, after all it does not bother me that much. I just wanted to try to understand why it does not work anymore. I also add a personal consideration of mine: a software as complex and highly professional as TB could or perhaps should also provide for an automatic deep cleaning in the event of anomalies of this kind. Maybe in a future release? I hope so. Thanks again to everyone. </p>",riccardonarducci,false,0,0
1713172,1493684,2025-02-19 07:39:31 -0800,2025-02-19 07:39:31 -0800,"<p>EUREKA!!! I solved the problem! Actually, it was a matter of deleting the inbox and inbox.msf folders, as you suggested. I had done it, leaving out the correct account. As I told you, I have 2 accounts, one for me and one for my wife. I had deleted the inbox files from the wrong account. I had a doubt and I deleted all the mbox files from all the accounts. To be safe, I turned off the PC and restarted it, I reloaded TB. Now everything works fine. The error message disappeared and the contents of the inbox folder were reset. I tried to send myself an email and delete it, compacting the inbox folder, everything worked fine. I finally solved it, thanks to you. Thanks and greetings to everyone. Riccardo </p>",riccardonarducci,false,0,0
1712541,1493686,2025-02-16 09:48:13 -0800,2025-02-16 09:48:13 -0800,"<p>Sent mail is stored in Sent Mail for gmail, but <a href=""http://outlook.com"" rel=""nofollow"">outlook.com</a> stores it in Sent.  Both providers automatically copy sent messages, so uncheck 'Place a copy in' in Account Settings, Copies &amp; Folders.  You should see a single copy in Sent, but the changes you made might have upset things.  Perhaps try unsubscribing Sent, restarting TB, then subscribing Sent again. </p>",sfhowes,false,0,0
1712592,1493686,2025-02-16 12:20:22 -0800,2025-03-12 05:31:14 -0700,"<p>Corrected Update - and this does seem to be a Thunderbird problem, not an Outlook one. [n.b. in my earlier Update, I suggested that the difference was between Replying and Sending a New email; apologies to those who replied based on that post of mine.] </p><p>On our PC, under <strong>Account Settings</strong> the <strong>Default Identity</strong> is of the format <strong>AandB.Surname@outlook.com</strong>;  under <strong>Manage Identities</strong>, we have set up individual identities of the format <strong>ASurname@outlook.com</strong> and <strong>BC.Surname@outlook.com</strong> Replies to all these addresses arrive at our PC - now, as previously, so Outlook is working properly. When sending (or replying to) an email using the Default Identity, only one copy is sent; when using one of the individual identities, Thunderbird puts two copies in the Thunderbird Sent folder - and Outlook receives these two copies.  (I don't normally look in the Outlook ""Sent"" folder, just in ""Junk"" but today I did and noticed what has happened.) This change of behaviour by Thunderbird has occurred since recent Thunderbird updates. </p>",EmmBee,false,0,0
1712596,1493686,2025-02-16 12:30:53 -0800,2025-02-16 12:30:53 -0800,"<p>Apologies  sfhowes - I hadn't seen your reply when I wrote my update. Unfortunately, it doesn't seem to have solved the problem; I did as suggested [un-checked ""Place a Copy"" in Account Settings, Copies &amp; Folders, un-checked Sent in ""Subscribe""; closed &amp; reopened TB and re-checked Sent. I sent a test message and have two copies in Sent. </p>",EmmBee,false,0,0
1712598,1493686,2025-02-16 12:36:25 -0800,2025-02-16 12:36:25 -0800,"<p>I configure my Gmail accounts to save a copy of sent messages (in addition to the copy that Gmail saves automatically), but I tell Thunderbird to use a <b>Local Folders</b> 'Sent' for that, so the copy saved by Thunderbird and the one saved by Gmail are kept in separate folders. You may want to do the same with this account, at least temporarily, just to see who is doing what. </p>",DavidGG,false,0,1
1712635,1493686,2025-02-16 16:11:30 -0800,2025-02-16 16:11:30 -0800,<p>Just to confirm - I'm using <strong>Outlook</strong> - not Gmail. </p>,EmmBee,false,0,0
1712669,1493686,2025-02-16 22:29:50 -0800,2025-02-16 22:29:50 -0800,"<p>I know, I didn't mean otherwise, but both Outlook and Gmail appear to work similarly in this regard, i.e. both save copies of sent messages on their own, so I used what I do with <i>my</i> Gmail accounts as an example of what you may want to try with <i>your</i> Outlook account, just to see who (i.e. whether Thunderbird or Outlook) is doing what, and you don't try to fix in Thunderbird what Outlook is doing and you have no control over. </p>",DavidGG,false,1,0
1712643,1493694,2025-02-16 16:52:26 -0800,2025-02-16 16:52:26 -0800,<p>what happens if you delete a message in the local folders account?  Does it reappear? </p>,MattAuSupport,false,0,0
1712532,1493696,2025-02-16 09:36:27 -0800,2025-02-16 09:36:27 -0800,"<p>No wonder, there is no Thunderbird for iOS. </p>",christ1,false,0,0
1712639,1493696,2025-02-16 16:31:43 -0800,2025-02-16 16:31:43 -0800,"<p>Thunderbird is currently only for desktop Windows, macOS, Linux and as a mobile version for Android. </p>",James,false,0,0
