id,created,updated,locale,product,title,is_solved,solution,solved_by,is_spam,last_answer,answers,topic,tags,creator,content,involved,is_archived,is_locked,is_taken,metadata,num_answers,num_votes_past_week,num_votes,taken_until,taken_by,updated_by
1530587,2025-08-20 19:07:31 -0700,2025-08-23 18:39:20 -0700,en-US,thunderbird,"I keep getting an error message when trying to download emails on Windows 11 device. ""Connection to Server mail.besttelecom.net.au was reset"".",false,,,false,1759163,1759163;,connectivity,thunderbird;connectivity;,peefjay,"<p>For the past two weeks, since my IP provider renewed security certificates, I have not been able to send or receive emails in Thunderbird. I can access my emails fine using one of my android devises through Thunderbird, biut my Windows 11 devices refuse to co-operate. I deleted certificates in the hope that Thunderbird would download and attach new certificates, but this has not happened either. I have tried changing ports and security TLS. I can however, access my <a href=""http://mail.besttelecom.net.au"" rel=""nofollow"">mail.besttelecom.net.au</a> emails using outlook. I have been using Thunderbird since it's first appearance and prefer it to any other email manager.I have heaps of data stored in it which I access regularly, so I would prefer not going to another email manager. </p>",peefjay;MattAuSupport;,false,false,false,";useragent:Mozilla/5.0 (Windows NT 10.0; Win64; x64) AppleWebKit/537.36 (KHTML, like Gecko) Chrome/139.0.0.0 Safari/537.36;kb_visits_prior:[""/en-US/kb/automatic-account-configuration""]",1,0,2,,,
1530588,2025-08-20 19:10:20 -0700,2025-08-20 19:25:04 -0700,en-US,thunderbird,incoming mail,true,1758346,"{""username""=>""mozilla98"", ""display_name""=>""Rick"", ""avatar""=>""https://profile.accounts.firefox.com/v1/avatar/m""}",false,1758346,1758346;,customization,thunderbird;customization;,sf925m5zft,<p>I can't change incoming mail from ascending to descending </p>,sf925m5zft;mozilla98;,false,false,false,";solver_id:6966680;useragent:Mozilla/5.0 (Windows NT 10.0; Win64; x64) AppleWebKit/537.36 (KHTML, like Gecko) Chrome/139.0.0.0 Safari/537.36 Edg/139.0.0.0",1,0,0,,,
1530589,2025-08-20 19:30:59 -0700,2025-08-21 05:14:41 -0700,en-US,thunderbird,Help! Sob-story > I have just turned 80 yrs of age; bought a new computer (ACER) with W-11. Have a lot of computer histoy but have forgotten all of it.,false,,,false,1758434,1758434;,import-and-export-settings,thunderbird;import-and-export-settings;,oldencranky,<p>Need help installing Thunderbird mail settings. Step by step please! </p><p>C:\Users\Alan\AppData\Roaming\Thunderbird\Profiles\f5e139wv.default-esr\settingsgs.  </p><p>How far off are the settings as above? I am not able get success ... bummer! </p>,oldencranky;davidsk;,false,false,false,;useragent:Mozilla/5.0 (Windows NT 10.0; Win64; x64; rv:142.0) Gecko/20100101 Firefox/142.0,1,0,0,,,
1530595,2025-08-20 19:57:26 -0700,2025-08-21 05:07:46 -0700,en-US,thunderbird,lokal direktori berubah,false,,,false,1758430,1758430;,email-and-messaging,thunderbird;email-and-messaging;,pahlawansyah,<p>saya telah merubah lokal direktory email sehingga inbox email saya hilang tidak terbacs </p>,pahlawansyah;davidsk;,false,false,false,";useragent:Mozilla/5.0 (Windows NT 10.0; Win64; x64) AppleWebKit/537.36 (KHTML, like Gecko) Chrome/139.0.0.0 Safari/537.36",1,0,0,,,
1530596,2025-08-20 20:13:56 -0700,2025-08-21 05:38:52 -0700,en-US,thunderbird,"POP Password Failed  Still able to use, though",true,1758427,"{""username""=>""davidsk"", ""display_name""=>""david"", ""avatar""=>""https://firefoxusercontent.com/5eed5ecf74d9e1ec85435ea262bc016e""}",false,1758440,1758427;1758440;,connectivity,thunderbird;connectivity;,Steve72,"<p>I am receiving email, am able to read and reply to my email; but I continually get a warning box that the password to pop.(my address) failed.  I have an IMAP connection.  This warning box freezes what I am doing until I cancel it.  If I x-out the box, it closes the window I am in.  Annoying as hell...  Make it stop! </p>",Steve72;davidsk;,false,false,false,";solver_id:666082;useragent:Mozilla/5.0 (Windows NT 10.0; Win64; x64) AppleWebKit/537.36 (KHTML, like Gecko) Chrome/139.0.0.0 Safari/537.36",2,0,2,,,
1530597,2025-08-20 20:14:02 -0700,2025-08-24 09:21:00 -0700,en-US,thunderbird,Trying to set up an email account for my wifes gmail account,false,,,false,1759328,1758426;1759328;,email-and-messaging,thunderbird;email-and-messaging;,cwade483,<p>I am trying to set up a new email account for my wife's gmail account. She lost her Iphone and re-setting is becoming a nightmare </p>,cwade483;davidsk;wsmwk;,false,false,false,";useragent:Mozilla/5.0 (Windows NT 10.0; Win64; x64) AppleWebKit/537.36 (KHTML, like Gecko) Chrome/139.0.0.0 Safari/537.36",2,0,0,,,
1530600,2025-08-20 21:00:57 -0700,2025-08-26 20:03:48 -0700,en-US,thunderbird,Folder not compacting,true,1758370,"{""username""=>""siffemoz"", ""display_name""=>""Ed"", ""avatar""=>""https://profile.accounts.firefox.com/v1/avatar/s""}",false,1759916,1758370;1758376;1759836;1759916;,crashing-and-slow-performance,thunderbird;crashing-and-slow-performance;,dveitch,<p>Thunderbird keeps coming up with the message: The folder 'inbox on dveitch@202.215.17' could not be compacted because writing to folder failed. </p><p>There is plenty of disk space and compacting has been working fine until recently.  Has a Thunderbird update changed something? </p>,dveitch;siffemoz;chectus91;,false,false,false,";solver_id:5864329;useragent:Mozilla/5.0 (Windows NT 10.0; Win64; x64) AppleWebKit/537.36 (KHTML, like Gecko) Chrome/139.0.0.0 Safari/537.36",4,0,1,,,
1530602,2025-08-20 21:16:12 -0700,2025-08-21 03:57:59 -0700,en-US,thunderbird,Can't send emails,false,,,false,1758408,1758408;,send-and-receive-email,thunderbird;send-and-receive-email;,lynbaker1,<p>I have changed from Optus to Telstra and receive my emails through The Messaging Company. Today I cannot send an email andd they have informed me that I need to connect the Messaging Company to You or something like that.  I have no idea. Can you please help me? </p>,lynbaker1;bbonacci;,false,false,false,";useragent:Mozilla/5.0 (Windows NT 10.0; Win64; x64) AppleWebKit/537.36 (KHTML, like Gecko) Chrome/139.0.0.0 Safari/537.36",1,0,0,,,
1530606,2025-08-20 21:57:00 -0700,2025-08-21 05:10:37 -0700,en-US,thunderbird,アカウントエラー  『ユーザー名を送信できませんでした。メールサーバーpop.do7.enjoy.ne.jpからの応答  :invalid  command』,false,,,false,1758433,1758433;,send-and-receive-email,thunderbird;send-and-receive-email;,t.kashi0921,<p>アカウントエラーの表示でメールの受信が出来ずに困ってます </p>,t.kashi0921;davidsk;,false,false,false,";useragent:Mozilla/5.0 (Linux; Android 10; K) AppleWebKit/537.36 (KHTML, like Gecko) Chrome/139.0.0.0 Mobile Safari/537.36",1,0,0,,,
1530619,2025-08-20 22:34:31 -0700,2025-08-21 04:41:34 -0700,en-US,thunderbird,NEW MESSAGE tab not workinh since last update,false,,,false,1758420,1758420;,send-and-receive-email,firefox-14103;firefox-1410;windows-10;thunderbird;send-and-receive-email;,eau69,"<p>Since I first started using FIREFOX and THUNDERBIRD many years ago they have been virtually trouble free, but after the most recent update of THUNDERBIRD the NEW MESSAGE tab has stopped working. I have not, and never have, changed any SETTINGS and I checked my default email address as suggested, and it is exactly as it always has been. The various HELP options that have come up on internet searches have not worked, so I would appreciate some 'plain English' step by step instructions on how the problem can be fixed. </p><p>I really appreciate Mozilla enabling me to avoid Google etc as much as possible, and the AI assist on internet searches with has been really helpful.  At MOZILLA's suggestion, I am using Privacy Badger and Ad Nauseum, but don't really understand what they do.  Thank you, Alan Upritchard.  alan.upritchard@xtra.co.nz, an email address I have had for something like 40 years. </p>",eau69;davidsk;,false,false,false,;os:Windows 10;useragent:Mozilla/5.0 (Windows NT 10.0; Win64; x64; rv:141.0) Gecko/20100101 Firefox/141.0;ff_version:141.0.3,1,0,1,,,
1530620,2025-08-20 22:36:48 -0700,2025-08-23 19:24:53 -0700,en-US,thunderbird,"Inbox (top left corner) shows 560 messages, but the Inbox folder under the All folders column shows 39. My quick filter is not active.",true,1759160,"{""username""=>""MattAuSupport"", ""display_name""=>""Matt"", ""avatar""=>""https://firefoxusercontent.com/79e0e1373e33440d6ce85c47aefeda62""}",false,1759168,1759160;1759168;,send-and-receive-email,thunderbird;send-and-receive-email;,rstec,"<p>Inbox (top left corner) shows 560 messages, but the Inbox folder under the All folders column shows 39. My quick filter is not active. </p>",rstec;MattAuSupport;,false,false,false,";solver_id:3436008;useragent:Mozilla/5.0 (iPhone; CPU iPhone OS 18_6_1 like Mac OS X) AppleWebKit/605.1.15 (KHTML, like Gecko) EdgiOS/139.0.3405.101 Version/18.0 Mobile/15E148 Safari/604.1",2,0,0,,,
1530640,2025-08-21 01:26:55 -0700,2025-08-21 04:38:28 -0700,en-US,thunderbird,cardDAV,false,,,false,1758419,1758419;,contacts,thunderbird;contacts;,djn577,"<p>cardDAV new to my email, can I go back to old address book, difficulty adding new contact </p>",djn577;davidsk;,false,false,false,";useragent:Mozilla/5.0 (Windows NT 10.0; Win64; x64) AppleWebKit/537.36 (KHTML, like Gecko) Chrome/139.0.0.0 Safari/537.36",1,0,0,,,
1530641,2025-08-21 01:37:08 -0700,2025-08-22 08:53:54 -0700,nl,thunderbird,Overstappen van Windows naar Linux,false,,,false,1758808,1758386;1758808;,import-and-export-email,thunderbird;import-and-export-email;,d1vermeulen,<p>Ik heb nu Windows 10 en ik wil overstappen op Linux. Hoe verplaats ik de e-mails die ik in mijn lokale mappen op Windows heb staan naar Linux? </p><p>In Thunderbird heb ik mailberichten in lokale mappen. Die zouden zich bevinden in: C:\Users\Dik\AppData\Roaming\Thunderbird\Profiles\kdk220em.default\Mail\Local Folders In de map: C:\Users\Dik\AppData\Roaming\Thunderbird\Profiles\kdk220em.default zie ik de map Mail niet. </p><p>Dik. </p>,d1vermeulen;Mad_Maks;,false,true,false,";useragent:Mozilla/5.0 (Windows NT 10.0; Win64; x64; rv:141.0) Gecko/20100101 Firefox/141.0;kb_visits_prior:[""/nl/kb/thunderbird-installeren-linux""]",2,0,0,,,
1530642,2025-08-21 01:43:59 -0700,2025-08-21 07:19:06 -0700,it,thunderbird,import export file  .mbox,false,,,false,1758456,1758438;1758453;1758456;,extensions,thunderbird;extensions;,mmlsrg,"<p>Hello, With the new Thunderbird version 142.0, you can no longer read .mbox files with the ""import export tools NG"" extension. Why was it removed? Is there a similar extension? Thanks </p>",mmlsrg;@next;,false,false,false,";useragent:Mozilla/5.0 (Windows NT 10.0; Win64; x64) AppleWebKit/537.36 (KHTML, like Gecko) Chrome/139.0.0.0 Safari/537.36",3,0,0,,,
1530643,2025-08-21 01:54:39 -0700,2025-08-22 09:40:14 -0700,en-US,thunderbird,Moving emails to USB drive,true,1758548,"{""username""=>""sfhowes"", ""display_name""=>""sfhowes"", ""avatar""=>""https://firefoxusercontent.com/c92a42cdab68b73a39b7e6b5bde36e39""}",false,1758830,1758412;1758548;1758830;,import-and-export-email,thunderbird;import-and-export-email;,t.gawthrop161,"<p>I have many eails stored on Thunderbird servers and wish to reduce my footprint by first copying or moving some of them to USB drives, then deletinng the originals.  How do I do this? </p>",t.gawthrop161;davidsk;sfhowes;,false,false,false,;solver_id:5734751;useragent:Mozilla/5.0 (Windows NT 10.0; Win64; x64; rv:141.0) Gecko/20100101 Firefox/141.0,3,0,0,,,
1530644,2025-08-21 01:57:03 -0700,2025-08-21 02:08:55 -0700,cs,thunderbird,e-mail account,false,,,false,1758388,1758388;,email-and-messaging,thunderbird;email-and-messaging;,pheinige,<p>Jaké údaje poštovního serveru potřebuji k nastavení účtu&nbsp;? </p>,pheinige;Ansamb;,false,false,false,;useragent:Mozilla/5.0 (X11; Ubuntu; Linux x86_64; rv:141.0) Gecko/20100101 Firefox/141.0,1,0,0,,,
1530646,2025-08-21 02:13:09 -0700,2025-11-05 09:33:08 -0800,en-US,thunderbird,I can’t add my Outlook account to Thunderbird. (accounthub),true,1758416,"{""username""=>""davidsk"", ""display_name""=>""david"", ""avatar""=>""https://firefoxusercontent.com/5eed5ecf74d9e1ec85435ea262bc016e""}",false,1777192,1758405;1758407;1758409;1758413;1758416;1758445;1758446;1771008;1777192;,email-and-messaging,thunderbird;email-and-messaging;,aisu,"<p>I’m using the Windows 11 version of the Thunderbird app, but when I try to add my Outlook account and enter my password, it shows “Authentication failed. Please check your username and password,” and I can’t complete the Outlook setup. I’ve tried changing my Microsoft account password and entering an app password, but neither worked. </p>",aisu;bbonacci;davidsk;nic.rochette;Dubladon;,false,false,false,";useragent:Mozilla/5.0 (Windows NT 10.0; Win64; x64) AppleWebKit/537.36 (KHTML, like Gecko) Chrome/139.0.0.0 Safari/537.36;kb_visits_prior:[""/ja/kb/faq-changing-imap-pop""]",9,1,9,,,"{""username""=>""wsmwk"", ""display_name""=>""Wayne Mery"", ""avatar""=>""https://firefoxusercontent.com/3f0645137479a481e67f7fb3ff1d945b""}"
1530648,2025-08-21 02:48:56 -0700,2025-08-22 02:55:53 -0700,en-US,thunderbird,message d'erreur,false,,,false,1758706,1758415;1758705;1758706;,performance-and-connectivity,thunderbird;performance-and-connectivity;,dan.duprat,<p>je reçois ce message chaque fois que j'ouvre thunderbird sur ma messagerie de l'ordinateur&nbsp;: </p><p>voir message téléchargé . que faut_il que je fasse merci pour vos conseils daniel duprat </p>,dan.duprat;davidsk;,false,false,false,";useragent:Mozilla/5.0 (Windows NT 10.0; Win64; x64) AppleWebKit/537.36 (KHTML, like Gecko) Chrome/139.0.0.0 Safari/537.36",3,0,1,,,
1530650,2025-08-21 03:10:22 -0700,2025-08-22 08:52:58 -0700,nl,thunderbird,welke smtp server,false,,,false,1758807,1758807;,send-and-receive-email,thunderbird;send-and-receive-email;,louis14,"<p>Ik heb 3 accounts in thunderbird, dus 3 smtp server geconfigureerd bij installatie. Als ik nu naar accountinstellingen ga zie ik bij het overzicht van serverinstellingen bij elke account alleen de definitie van de imap server. Onderaan de accounts is er het item ""outgoing server (SMTP)""&nbsp;: hier zie ik 3 servers staan maar geen accounts, wel gebruiksnamen in de details. Er kan een ""standaard"" server geselecteerd worden. Ik heb gelezen dat de standaard server gebruikt wordt als er geen andere server ter beschikking is. Welke smtp server wordt er gebruikt als ik een mail verstuur vanaf een bepaald account adres? </p><p>PS. If needed I write the question in english </p>",louis14;Mad_Maks;,false,false,false,;useragent:Mozilla/5.0 (Windows NT 10.0; Win64; x64; rv:141.0) Gecko/20100101 Firefox/141.0,1,0,0,,,
1530651,2025-08-21 03:11:40 -0700,2025-08-21 05:09:09 -0700,en-US,thunderbird,cardDAV,true,1758418,"{""username""=>""davidsk"", ""display_name""=>""david"", ""avatar""=>""https://firefoxusercontent.com/5eed5ecf74d9e1ec85435ea262bc016e""}",false,1758432,1758418;1758432;,contacts,thunderbird;contacts;,djn577,"<p>cardDAV new to my email, can I go back to old address book, difficulty adding new contact </p>",djn577;davidsk;,false,false,false,";solver_id:4323791;useragent:Mozilla/5.0 (Windows NT 10.0; Win64; x64) AppleWebKit/537.36 (KHTML, like Gecko) Chrome/139.0.0.0 Safari/537.36",2,0,0,,,
1530657,2025-08-21 04:07:32 -0700,2025-08-25 21:13:34 -0700,en-US,thunderbird,"nowe konto pocztowe - problem z dodaniem, crash (accounthub)",false,,,false,1758414,1758414;,app-crash,thunderbird;app-crash;,lcs,"<p>Zainstalowałem thunderbirda. Dodałem 4 konta pocztowe, wszystko działa jak należy. </p><p>Problem pojawił się przy dodawaniu kolejnego konta email. Po wpisaniu nazwy i adresu e-mail, program się wiesza/ładuje (załączona grafika) na kroku ""wyszukiwanie konfiguracji"". </p><p>W opcjach/ustawieniach nie znalazłem nigdzie możliwości wyłączenia tego wyszukiwania i przejścia od razu do wpisywania serwerów imap/smtp. </p><p>Jak sobie z tym poradzić? </p><p>Dz! </p>",lcs;davidsk;,false,false,false,";useragent:Mozilla/5.0 (Windows NT 10.0; Win64; x64) AppleWebKit/537.36 (KHTML, like Gecko) Chrome/139.0.0.0 Safari/537.36",1,0,0,,,"{""username""=>""wsmwk"", ""display_name""=>""Wayne Mery"", ""avatar""=>""https://firefoxusercontent.com/3f0645137479a481e67f7fb3ff1d945b""}"
1530660,2025-08-21 04:14:38 -0700,2025-08-21 14:08:31 -0700,en-US,thunderbird,Outgoing Mail,false,,,false,1758545,1758417;1758545;,send-and-receive-email,thunderbird;send-and-receive-email;,jrobbertze,"<p>Good Day I am using <a href=""http://telkomsa.net"" rel=""nofollow"">telkomsa.net</a> I can receive mail but can not send out gives me a error  already spend ours with telkom but they say the fold is with thunderbird </p>",jrobbertze;davidsk;sfhowes;,false,false,false,";useragent:Mozilla/5.0 (Windows NT 10.0; Win64; x64) AppleWebKit/537.36 (KHTML, like Gecko) Chrome/139.0.0.0 Safari/537.36;kb_visits_prior:[""/en-US/kb/profile-manager-create-and-remove-thunderbird-profiles""]",2,0,0,,,
1530671,2025-08-21 05:20:41 -0700,2025-08-22 02:54:15 -0700,tr,thunderbird,KURULUM,false,,,false,1758704,1758704;,install,thunderbird;install;,amzkenan6565,<p>Merhaba bilgisayırım da kurulum da problem yaşıyorum dosyayı indirdim tıkladığım da hörsel açılıyor yalnızca </p>,amzkenan6565;maxcoder;,false,false,false,";useragent:Mozilla/5.0 (Macintosh; Intel Mac OS X 10_15_7) AppleWebKit/537.36 (KHTML, like Gecko) Chrome/139.0.0.0 Safari/537.36",1,0,0,,,
1530677,2025-08-21 06:06:51 -0700,2025-08-21 06:27:57 -0700,en-US,thunderbird,Emails missing from search results when clicking 'Show results as list',false,,,false,1758451,1758451;,search,thunderbird;search;,BillSparrow,"<p>I perform a search using the top search bar looking for a word i.e. 'Messages mentioning:' The search result shows it has found 30 emails. I click on 'Show results as list' and the new tab opens but the list only shows only 26 of the 30. When I compare the 30 with the list of 26, I see that the missing four are consecutive in the date sequence. Going back to the tab that displays the 30, and clicking on the individual messages, I find that the four troublesome messages result in 'No message found'.  Going directly to the folder where I know the messages are stored, I can open the four troublesome messages OK. </p><p>What should I try next to analyse the problem further? </p><p>140.1.1esr (64-bit) </p>",BillSparrow;shopov.bogomil;,false,false,false,";useragent:Mozilla/5.0 (Windows NT 10.0; Win64; x64) AppleWebKit/537.36 (KHTML, like Gecko) Chrome/139.0.0.0 Safari/537.36",1,0,0,,,
1530679,2025-08-21 06:15:24 -0700,2025-08-28 10:03:32 -0700,en-US,thunderbird,Problems with manually sorting of the folders using Thunderbird 140.2.0esr,false,,,false,1760291,1760220;1760291;,customization,thunderbird;customization;,cristian.vignali,"<p>I have a MacBook Pro with Sequoia 15.6.1 installed. I am reading and sending emails through Thunderbird Eclipse 140.2.0esr (recent update). For a few weeks now I have noticed that the folders in which I was saving my emails are no longer ordered alphabetically. If I change the order manually, for some unknown reason, these changes are not saved once I close Thunderbird. How can I manage this problem? Thanks Chris </p>",cristian.vignali;Mapenzi;,false,false,false,";useragent:Mozilla/5.0 (Macintosh; Intel Mac OS X 10_15_7) AppleWebKit/605.1.15 (KHTML, like Gecko) Version/18.6 Safari/605.1.15",2,1,1,,,
1530683,2025-08-21 06:33:44 -0700,2025-08-21 07:16:34 -0700,it,thunderbird,posta,false,,,false,1758455,1758455;,email-and-messaging,thunderbird;email-and-messaging;needsinfo;,paoloroma63,"<p>Dalla cartella posta in arrivo è scomparsa la quasi totaltà dei messaggi, stessa cosa nel cestino </p>",paoloroma63;@next;,false,false,false,;useragent:Mozilla/5.0 (Windows NT 10.0; Win64; x64; rv:141.0) Gecko/20100101 Firefox/141.0,1,0,0,,,
1530686,2025-08-21 07:09:19 -0700,2025-09-07 08:29:12 -0700,nl,thunderbird,Kan Thunderbird niet meer opstarten in Mac OS,true,1759228,"{""username""=>""Mad_Maks"", ""display_name""=>""Mad Maks"", ""avatar""=>""https://firefoxusercontent.com/7b3d52e8a04e121c8563c910de298096""}",false,1762626,1759228;1762626;,app-crash,thunderbird;app-crash;,Roel,"<p>Beste Mozilla-gebruikers, Ik kan Thunderbird niet meer opstarten op mijn iMac (MacOS Catalina - versie 10.15.7). Tot nu toe nooit problemen gehad maar nu plotseling wel. Het icoontje Thunderbird onderaan in mijn dock-balk blijft bij het willen opstarten permanent 'dansen' en doet verder niets. Er zit niets anders op dan maar af te sluiten met het commando 'forceer stop'. Ook de zogenaamde 'probleemoplossingsmodus' om add-ons uit te schakelen en te controleren op een eventueel corrupt profiel (opstarten met ingedrukte toets 'alt'), doet het niet. Herinstalleren van Thunderbird werkt al evenmin. Icoontje 'Thunderbird' blijft maar zijn macaber dansje uitvoeren&nbsp;:-( Wie weet raad waarvoor alvast veel dank? </p>",Roel;Mad_Maks;,false,false,false,";solver_id:1042;useragent:Mozilla/5.0 (Macintosh; Intel Mac OS X 10.15; rv:142.0) Gecko/20100101 Firefox/142.0;kb_visits_prior:[""/nl/kb/toegankelijkheidsfuncties-thunderbird""]",2,0,0,,,
1530689,2025-08-21 07:32:17 -0700,2025-08-22 23:55:01 -0700,it,thunderbird,"Blocco dei ""contenuti remoti""",true,1758936,"{""username""=>""giuseppe.miotti"", ""display_name""=>""Giuseppe Miotti"", ""avatar""=>""https://profile.accounts.firefox.com/v1/avatar/G""}",false,1758936,1758477;1758478;1758483;1758515;1758517;1758563;1758671;1758735;1758786;1758936;,encryption,thunderbird;encryption;,giuseppe.miotti,"<p>Ciao e grazie anticipatamente per il supporto, sto usando Thunderbid 142.0 su W11 e credo ci sia un comportamento inatteso. Uso Thunderbird su una casella GMAIL con PGP: ho creato le mie chiavi private e  pubbliche, che sono riconosciute da PROTON (servizio di mail crittografata che uso da web o client), infatti le mail verso PROTON sono correttamente decriptate. Ovviamente anche PROTON ha le chiavi PGP e scambia mail regolarmente con GMAIL, che Thunderbird decripta correttamente. Problema: se metto una foto nel messaggio email che mando da PROTON a GMAIL, Thunderbird quando la riceve mi dice che blocca i contenuti remoti e non mi permette di scaricarli (manca il bottone delle opzioni), ma me la ritrovo come allegato alla mail che posso aprire (vedi Thunderbird.png). Ho provato a mettere la eccezione dell'indirizzo email nelle impostazioni di Privacy e sicurezza dell'account GMAIL, ma segnala lo stesso il problema. Se mando da GMAIL a PROTON una mail con una immagine, in PROTON vedo un segnalibro di ""oggetto mancante"" (quindi non viene mandata) -- e non arriva NULLA, nemmeno come allegato (vedi PROTON.png). Come ultimo tentativi ho anche abilitato ""permetti contenuti remoti dentro i messaggi"" dalle impostazioni globali, ma Thunderbird continua a dirmi che ""ha bloccato i contenuti remoti"". </p><p>C'è qualche spiegazione? può essere che la crittografia PGP abbia problemi con le foto?  (nota: Thunderbird mi dice che è tutto OK -2 lucchetti con spunta verde- nel bottone ""OpenPGP""). </p><p>Grazie mille anticipatamente del supporto! </p><p>Beppe </p>",giuseppe.miotti;@next;,false,false,false,;solver_id:6967909;useragent:Mozilla/5.0 (Windows NT 10.0; Win64; x64; rv:142.0) Gecko/20100101 Thunderbird/142.0,10,0,0,,,
1530690,2025-08-21 07:35:35 -0700,2025-08-21 07:35:35 -0700,en-US,thunderbird,Calendar sync to/from BT email only works for full day events,false,,,false,,"",events,thunderbird;events;,frank.noton,<p>Since a problem with my BT email account (hacked) and its restoration I only seem able to sync between the two calendars when the diary entry is ticked as a whole day event. This appears to happen in both directions. In other words try to log an event with start and end times and it does not get synced to the other diary (and visa versa). I also suspect that the times of the two systems are not in sync but cannot find where to check them both. I assume that they both access W11 for the data. Any thoughts much appreciated. </p>,frank.noton;,false,false,false,";useragent:Mozilla/5.0 (Windows NT 10.0; Win64; x64) AppleWebKit/537.36 (KHTML, like Gecko) Chrome/139.0.0.0 Safari/537.36",0,0,0,,,
1530692,2025-08-21 07:41:02 -0700,2025-08-21 07:43:04 -0700,es,thunderbird,Digitally signing  Issue,false,,,false,,"",security,thunderbird;security;,apereira1970,"<p>Been using thunderbird for at least 20 years, and learn to live with the bugs and wait for the next release waiting and expecting the issues of the previous release were solved in the next one. </p><p>I've been using S/MIME certificates for many years without problem. I've recently installed a new certificate wich is correctly installed in my personal repository expiring in 2027. Since version 141 this certificates shows as selected, but is not used.  Updated to release 142 ... but the problem persists.  </p><p>I'm attaching a screen capture were shows the error message and the Developers Console showing the exitcode when trying to send a mail with digitally signed. </p><p>Please also note (i don´t know if this is related or not) that when y check the certificate in the account the hexadecimal ID of the certificate is not shown.  If I clear the certificate and select it again it is shown in this screen.    Attached to this you can find a capture of what mentioned before. </p><p>Please let me know if more information is needed. </p><p>Thanks / Regards  </p><p><br> Ariel Pereira </p>",apereira1970;,false,false,false,";useragent:Mozilla/5.0 (X11; Linux x86_64; rv:142.0) Gecko/20100101 Firefox/142.0;kb_visits_prior:[""/es/kb/firma-digital-y-cifrado-de-mensajes""]",0,0,0,,,"{""username""=>""apereira1970"", ""display_name""=>"""", ""avatar""=>""https://firefoxusercontent.com/39486494df2f32f74cf1a74638951678""}"
