id,created,updated,title,content,tags,product,topic,locale,answers,creator
1418480,2023-07-16 03:24:21 -0700,2023-07-16 03:24:21 -0700,Calendar and contacts integration with Gnome on Ubuntu,"<p>Hi everyone! </p><p>Coming from Evolution I'm used to having the calendar events and contacts synchronized from CalDAV and CardDAV to the Gnome calendar and contacts app. Especially the calendar integration is really helpful for keeping up with daily meetings. Now with Thunderbird the calendar inside Thunderbird works great, but it shows ""No events"" in the Gnome calendar. </p><p>Ubuntu 22.04 Gnome Calendar: 41.2 Thunderbird: 115.0 (Mozilla Thunderbird Snap for Ubuntu) </p><p>I'm using Snap on Ubuntu, but I'm open to moving to another installation if that would be helpful. I'd LOVE to see this fixed somehow, or suggestions to getting this to work with any external tool that either integrates with Thunderbird or runs in the background, so no Evolution&nbsp;:-) </p><p>Thanks all and have a great day! </p>",customize;,thunderbird,customize-controls-options-and-add-ons,en-US,"",thomaslobker
1418478,2023-07-16 02:38:26 -0700,2023-07-16 02:38:26 -0700,evidenziare nuovi messaggi thunderbird 115,"<p>Buongiorno, sono/ero utente Thunderbird 102.13.0 (64Bit) dove avevo creato userChrome.css per evidenziare email nuove in colore giallo. Dopo aggiornamento a Thunderbird 115 non riesco più ad avere questo effetto. Il file userChrome.css esiste nella cartella Chrome, Toolkit.legacyUserProfileCustomizations.stylesheets è a true, ma le email risultano sempre evidenziate in grassetto Bianche. grazie cordiali saluti </p>",other;,thunderbird,other,it,"",voyager956
1418477,2023-07-16 01:34:08 -0700,2023-07-16 01:34:08 -0700,Mittente nelle PEC,"<p>Da alcuni giorni, nella posta PEC tutti gli indirizzi dei mittenti sono stati modificati in un unico mittente con la dicitura: ""Per conto di:protocollo@comune.bosa.or.it"" eccetto i mittenti che avevano legalmail. Come si può ovviare? Grazie. </p>",other;,thunderbird,other,it,"",studio.ingsaba
1418463,2023-07-15 17:44:47 -0700,2023-07-16 01:50:12 -0700,Corrupted incoming emails,"<p>I am having problems with some, but not all, incoming messages on one of my computers. The messages appear correctly on other computers. </p><p>Some messages appear only in html format. </p><p>Other messages have the header but there is nothing in the content part of the message. </p><p>Other message have the correct heading but the content is from messages received LATER, this can be two or three emails in a row have the content from a later email. </p>",other;,thunderbird,other,en-US,1590856;,sprung
1418462,2023-07-15 17:33:42 -0700,2023-07-16 03:53:10 -0700,Download Thunderbird old version,"<p>Hi, How can I do to download the Thunderbird 78.14.0 version (for my mac OS 10.10.5)&nbsp;? Thanks, Thierry </p>",download-and-install_1;,thunderbird,download-install-and-migration,en-US,1590794;1590797;1590876;,pichont
