id,question_id,created,updated,content,creator,is_spam,num_helpful,num_unhelpful
1603063,1423706,2023-09-12 07:12:28 -0700,2023-09-12 07:12:28 -0700,"<p>Quando componi un messaggio, nella barra degli strumenti di formattazione, ci sono due quadrati colorati di solito uno bianco sullo sfondo ed uno nero in primo piano. Facendo click su questo quadrati puoi cambiare il colore dello sfondo e del testo. Questo per il singolo messaggio. </p><p>Se vuoi usare lo stesso schema in tutti i messaggi vai in Tasto menu &gt; Impostazioni &gt; Composizione Togli il segno di spunta da <em>Usa i colori predefiniti del lettore</em> Poi immediatamente sotto personalizza i colori in <em>Colore del testo</em> e <em>Colore di sfondo</em> </p><p>(le altre impostazioni che hai modificato riguardano la lettura dei messaggi ed è preferibile se le riporti ai valori predefiniti) </p>",@next,false,0,0
1603051,1423703,2023-09-12 06:12:20 -0700,2023-09-12 06:12:20 -0700,"<p>If they are stored as .eml files and your computer is set up to open .eml files using Thunderbird. Then you can read them using Thunderbird. </p><p>However, if you are thinking of changing provider and want to keep copies of emails, then create some folders in 'Local Folders' mail account and use 'right click on highlighted email and select 'Copy to' and choose relevant folder in 'Local Folders' mail account.  Check you really have a full copy; you can read emails stored in 'Local Folders'. </p><p>Basically, you do not have to save emails as .eml files to a folder outside of Thunderbird if you are going to stop using that particular email address. </p>",Toad-Hall,false,0,0
1603050,1423701,2023-09-12 06:04:59 -0700,2023-09-12 06:04:59 -0700,"<p>You can only modify a password via the webmail account accessed via a browser. </p><p>If you do not know password, then use the 'forgotten Pasword' link and follow instructions to get access to webmail account. Once you have reset/modified password, then you need to update the one stored in Thunderbird, assuming you do allow Thunderbird to store passwords. </p><p>In Thunderbird </p> <ul><li> Settings &gt; Privacy &amp; Security </li><li> scroll to 'Passwords' section </li><li> clickon 'Saved Passwords' </li><li> click on 'Show Passwords' </li><li> Select each relevant line there will one for incoming and one fior outgoing. </li><li> Right click on line and select 'Edit Password' </li><li> Completely clear contents and carefully type in the new password. </li><li> click on 'Close' </li></ul> <p>REstart Thunderbird. </p>",Toad-Hall,false,0,0
1603065,1423700,2023-09-12 07:20:51 -0700,2023-09-12 07:20:51 -0700,"<p><em>ciao, questa area di discussione è frequentata principalmente da semplici utenti, per cui dubito qualcuno possa aiutarti in una questione così tecnica. Se non ricevi altre risposte, puoi provare a riproporre la domanda nella sezione di lingua inglese (<a href=""https://support.mozilla.org/en-US/questions/new/thunderbird/form"" rel=""nofollow"">https://support.mozilla.org/en-US/questions/new/thunderbird/form</a>) o sul forum di Mozilla Italia (<a href=""https://forum.mozillaitalia.org/"" rel=""nofollow"">https://forum.mozillaitalia.org/</a>)</em> </p>",@next,false,0,0
1603032,1423691,2023-09-12 04:31:07 -0700,2023-09-12 04:31:07 -0700,<p>Please note neither Mozilla nor Thunderbird endorses the product mentioned above. Try it at your own risk. </p>,Toad-Hall,false,0,0
1603071,1423690,2023-09-12 08:00:49 -0700,2023-09-12 08:00:49 -0700,"<p>There is also the 'Density' option. This was introduced in the 102* versions. This alters the amount of space between items in lists.  Via 'Menu Bar' toolbar </p> <ul><li> 'View' &gt; 'Density' &gt; select an option note 'Compact' has the least space. </li></ul> <p>OR Via the menu app icon </p> <ul><li> 'Density' option has three icons. Compact, Default. Relaxed. Select the one you prefer. </li></ul> <p>In addition there is also the matter of choosing a suitable font size. Via 'Menu Bar' toolbar </p> <ul><li> 'View' &gt; 'Font Size' &gt; click on desired option to increase or decrease current font size by one size. Repeat action if you require a greater increase/decrease. </li></ul> <p>OR Via the menu app icon </p> <ul><li> 'Font Size' - click on the <strong>-</strong> or <strong>+</strong> icons to increase/decrease font size. </li></ul>",Toad-Hall,false,0,0
1603070,1423690,2023-09-12 08:00:08 -0700,2023-09-12 08:00:08 -0700,"<p>It would help if you could post an image explaining the problem. </p><p>I'm presuming you are talking about the 'Message List'.  What view are you using&nbsp;? To the right of the <em>Quick Filter' option is a new icon which allows you to select one of the following: </em> </p> <ul><li> Table view = standard list, one email per line with Column headers. </li><li> Cards view = a style where one email is displayed over a couple of lines and no column headers. </li></ul> <p>If you use 'Cards View' then it is better to use 'View' &gt; 'Layout' &gt; 'Vertical view' This layout may suit people with wide screens. In your case; small screen; it would be better to use 'Table view'. </p>",Toad-Hall,false,0,0
1603054,1423689,2023-09-12 06:23:17 -0700,2023-09-12 06:23:17 -0700,<p>The image on the right shows you are using a new supernova 115* version. There are two setting you can try. </p><p>Suggest you enable the Menu Bar as it will make life a lot easier. Menu app &gt; View &gt; Toolbars &gt; select Menu Bar </p><p>Then increase the space between items: View &gt; Density &gt; select 'Default' or 'Relaxed' </p><p>You can also choose to increase the size of the font: View &gt; Font Size &gt; select 'Increase Font size' You may need to select this more than once to get desired size. </p>,Toad-Hall,false,0,0
1603002,1423675,2023-09-11 22:40:24 -0700,2023-09-11 22:40:24 -0700,"<p>Are you trying to upload mail from Local Folders to a folder on the gmail server?  That's not as straightforward as it appears: </p><p><a href=""https://support.mozilla.org/en-US/questions/1331879"" rel=""nofollow"">https://support.mozilla.org/en-US/questions/1331879</a> </p><p>You might have better luck by setting the new account to collect mail from the other account, through the gmail website. </p><p>Also, an add-on isn't needed to import mbox files to TB Local Folders, although for TB 115 there is one. </p><p><a href=""https://support.mozilla.org/en-US/questions/1417914"" rel=""nofollow"">https://support.mozilla.org/en-US/questions/1417914</a> </p>",sfhowes,false,0,0
1602997,1423662,2023-09-11 20:48:36 -0700,2023-09-11 20:48:36 -0700,"<p>Downgrading is not recommended unless as a last resort.  See <a href=""https://support.mozilla.org/en-US/questions/1417914#answer-1602976"" rel=""nofollow"">this post</a> re IET NG. </p>",sfhowes,false,0,0
1602999,1423661,2023-09-11 20:53:17 -0700,2023-09-11 20:53:17 -0700,"<p>Try this: right-click the account in the Folder Pane, Properties, Repair Folder, to rebuild the message index. </p>",sfhowes,false,0,0
1602998,1423660,2023-09-11 20:51:53 -0700,2023-09-11 20:51:53 -0700,"<p>Do you have separate smtp servers for each account, differing only in the User Name, and is each account set to send on the correct smtp? </p><p><a href=""https://support.mozilla.org/en-US/questions/1350593"" rel=""nofollow"">https://support.mozilla.org/en-US/questions/1350593</a> </p><p><a href=""https://support.mozilla.org/en-US/questions/1417298#answer-1588949"" rel=""nofollow"">https://support.mozilla.org/en-US/questions/1417298#answer-1588949</a> </p>",sfhowes,false,0,0
