id,created,updated,title,content,tags,product,topic,locale,answers,creator
1428428,2023-10-21 07:41:18 -0700,2023-10-22 01:13:37 -0700,Thunderbird 115 Search is HORRIBLE.,"<p>Just updated to Thunderbird 115 a few days ago and today, searched for messages in a folder with the new version only to find that new search is USELESS.  </p><p>I don't remember my previous version number, maybe 112? but I could limit search to just name, just subject line, body, etc.  Now it's searching and it's showing me ""Messages mentioning Heard"" but ONLY showing me e-mail addresses, and names, not subject lines, not body of e-mail, nor do I see the ability to choose any of those options readily available, like before.  Also, the ability to toggle results relevance, or by date, seems to be lost as well, so finding the most recent response, with ""Heard"" in the subject line, in a specific folder - Does. Not. Work. even though it worked in the previous version quite easily.  </p><p>I will be looking to downgrade, if possible.  God, I hope it's possible.  </p><p>--- </p><p>Also, why is there another <a href=""http://connect.mozilla.org"" rel=""nofollow"">connect.mozilla.org</a> forum nearly identical to this, but not the same? </p><p><a href=""https://connect.mozilla.org/t5/discussions/bd-p/discussions"" rel=""nofollow"">https://connect.mozilla.org/t5/discussions/bd-p/discussions</a> </p>",other;,thunderbird,other,en-US,1612766;1612774;1612884;,VidPro
1428432,2023-10-21 07:59:08 -0700,2023-10-22 04:39:15 -0700,Can't sysnc with office365,"<p>Thunderbird 115.3.3 New update today since then unable to retrieve new emails. a windows pops up ""Microsoft - trying to sign you in"" this says up for a few seconds then closes, a few seconds it comes up again. </p><p>no error messages, no password requests. This is the same for all office365 accounts. </p><p>Gmail accounts seem to work fine </p>",other;,thunderbird,other,en-US,1612939;1612940;,greg212
1428433,2023-10-21 08:12:58 -0700,2023-11-12 04:33:31 -0800,BAD BAD BAD migration policy. (NO way back?),"<p>Thunderbird 115 forcefully migrated my older profile and did NOT leave a way to go back? </p><p>That is <strong>NOT</strong> the way to do this.  </p><p>You need create a NEW profile for the NEW version and LEAVE THE OLD PROFILE ALONE! </p><p>You must also have an alert, and explain the process, transparently giving the owner of decades of e-mail the opportunity to safely upgrade AND have the opportunity migrate back if they so desire.  </p><p>How DARE Mozilla treat users and their data so casually.  </p><p>This is <strong>NOT</strong> the way to do this.  </p><p>Currently FURIOUS that this trusted tool has left me NO way to downgrade back to 112 except to rebuild my profile (and all the various e-mail accounts) from fucking scratch. </p>",download-and-install_1;,thunderbird,installation-and-updates,en-US,1612765;1612881;1617393;1617444;1617503;1617602;,VidPro
1428436,2023-10-21 09:07:24 -0700,2023-10-21 09:31:51 -0700,"Unable to write the email to the mailbox. Make sure the file system allows you write privileges, and you have enough disk space to copy the mailbox.","<p>When will you fix (Unable to write the email to the mailbox. Make sure the file system allows you write privileges, and you have enough disk space to copy the mailbox.) </p><p>I am waiting for emails from Toronto Hospital and the emails not working. Please fix. </p>",other;,thunderbird,other,en-US,1612775;,Tvsatman
1428437,2023-10-21 09:24:54 -0700,2023-10-21 09:24:54 -0700,"Emails suddenly quit 'Send' last Wednesday, 10/18/23, after working that morning.","<p>Help me resolve this 'Send' problem.  My Thunderbird program has all my Master lists, email addresses, etc, so I need to keep using it.  I do use Spectrum email as an option, but prefer Thunderbird, which I've been on for over 22 years.  I'm not tech savvy enough to figure it out on my own or your 'help' statements.  Thanks. </p>",fix-problems;,thunderbird,troubleshooting,en-US,"",johnandjeanp
1428444,2023-10-21 10:57:36 -0700,2023-10-21 19:19:45 -0700,Hi all of sudden I have two icons for the thunderbird application. What should I do?,<p>Hi all of sudden I have two icons for the thunderbird application. What should I do? [removed email from public] </p>,other;,thunderbird,other,en-US,1612818;,meggo937
1428445,2023-10-21 10:59:59 -0700,2023-10-21 12:21:29 -0700,ALL MAIL folder,"<p>I have over 14000 messages in my ALL MAIL folder and don't know how to delete them, as they come back on when I try to delete them. </p>",other;,thunderbird,other,en-US,1612802;,christelreid41
1428446,2023-10-21 11:50:26 -0700,2023-10-21 12:26:00 -0700,"Getting TLS error - can't send or receive - gmail, outlook, yahoo - all bad","<p>I have switched to work remotely and have transferred all my Thunderbird settings from my PC to my laptop. </p><p>I got to my new remote work place and can't receive any emails using my accounts set up in Thunderbird. </p><p>It is the same whether I use Gmail, Outlook or Yahoo. </p><p>I have tried many things but basically have taken all defaults for setting up email accounts. I am using Windows 11 Home and I am not going through a VPN. My Thunderbird version is 115.3.3 (64-bit) </p><p>For example for Gmail I get: </p><p>Non-overridable TLS error occurred. Handshake error or probably the TLS version or certificate used by server <a href=""http://imap.gmail.com"" rel=""nofollow"">imap.gmail.com</a> is incompatible. </p><p>You can see a screen print here: <a href=""https://imgur.com/a/KDHtSP9"" rel=""nofollow"">https://imgur.com/a/KDHtSP9</a> </p><p>Am I doing something wrong? </p>",download-and-install_1;,thunderbird,installation-and-updates,en-US,1612803;,boliche.elresorte
1428453,2023-10-21 16:25:21 -0700,2023-10-21 19:17:06 -0700,October 20th connection to gmail stopped working,"<p>I have 2 gmail accounts. My main one stopped working, my play one is working OK. I looked at passwords and notived there was an entry oauth.... for my play account, but not for my main account. Checked Account settings and both were set to oauth2 </p><p>I deleted passwords for both accounts, set them both to not oauth2 and then set my main one to oauth2. of course now I have no passwords, but my connection to Googlemail which after asking me for a password ended with the screen attached </p>",download-and-install_1;,thunderbird,installation-and-updates,en-US,1612817;,audreyledbrook
