id,created,updated,title,content,tags,product,topic,locale,answers,creator
1428350,2023-10-20 17:58:31 -0700,2023-10-20 17:58:31 -0700,chaining messages,"<p>I don't like that messages are chained in messages from the same operator. Wanting to keep the messages separate. I can combine them myself and store them as separate messages&nbsp;! People are ungry with new TB 115 and we haven't seen any responce from TB-team going back to 102. I lost all my subfolders in the G-Mail Server when SuperNova stepped in. Because of syncronization, 1 Win 10 and 2 Linux Mint 21.2 + 2 SSD of Linux Mint 20.2. <strong>So, not a penny, untill you go back to 102. </strong> </p><p>Very, very angry Erkki&nbsp;! </p>",customize;,thunderbird,settings,fi,"",oisne
1428352,2023-10-20 18:29:03 -0700,2023-10-20 18:38:18 -0700,"Supernova: when dragging a message to the folder pane, sub-folders are expanded too quickly","<p>After upgrade to Supernova (115.3.1 64-bit from the Debian repo), when dragging a message to a collapsed folder in the folder pane, the delay before expanding is too short and accidental expansions common.  The delay is shorter than the previous version of Thunderbird. </p><p>This creates two difficulties.  Firstly, as I drag a message past folders on the way to the destination folder they can be expanded.  Presumably my pointer pauses briefly.  Secondly, the destination folder is often expanded and has to be collapsed later.  It's tedious because to speed the backup I avoid big .sbd files by having a subfolder for each of ~10 years </p><p>I've looked for solutions:   </p> <ul><li> <a href=""https://www.reddit.com/r/Thunderbird/comments/162lh4m/auto_expand_subfolder_while_dragndrop_over_it"" rel=""nofollow"">https://www.reddit.com/r/Thunderbird/comments/162lh4m/auto_expand_subfolder_while_dragndrop_over_it</a> describes the difficulty but had no solution. </li><li> I browsed the config editor's list but did not find a setting for the delay </li></ul> <p>In case it matters: </p> <ul><li> The layout is Classic, with the folder pane being full screen height  </li><li> The only extension is CardBook (for contacts) </li><li> The theme is ""System theme -- auto"" </li></ul> <p>Maybe the delay is OK for most people but my hands tremble a little.  Let's call it ""imperfect motor control"".  So it would be great to be able to increase the delay from the new default to the old default </p>",fix-problems;,thunderbird,troubleshooting,en-US,1612605;,mozilla_support1
1428355,2023-10-20 19:02:36 -0700,2023-10-22 13:58:22 -0700,"The program stops suddenly with the ""is not responding"" message","<p>After upgrading to the 115.3.3 all brand new version (by the way, congrats for such great design), the program stops suddenly with the ""is not responding"" message, no matter if you are or nor writing a message (in such case, you lost all the text in it, of course). Installed for a few users in a Windows Server 2022. Any hints (avoiding the unistall and reinstall, please)? </p>",fix-problems;,thunderbird,troubleshooting,es,1613000;,fernando.eguilaz
1428356,2023-10-20 19:32:48 -0700,2023-10-20 19:32:48 -0700,number of messages shows in inbox but not the message texts,"<p>The number of messages changes correctly. No texts show. </p><p>'Repair Folder' did not make any difference. I tried to follow other instructions. However, my lack of understanding of the technology meant that I could not follow the succinct instructions. </p>",other;,thunderbird,other,en-US,"",u.i.hill
1428357,2023-10-20 19:57:05 -0700,2023-10-20 19:57:05 -0700,Emails,<p>I was looking through my emails a few minutes ago and suddenly all of my 'Sent' emails disappeared.  Does anyone have any idea why this may have happened and can they be recovered? </p>,other;,thunderbird,other,en-US,"",delta.151
1428358,2023-10-20 20:09:36 -0700,2023-10-21 07:01:26 -0700,impossible de me connecter à thunderbird avec un compte outlook (2 OAuth),"<p>Bonjour, comme vous pouvez le voir dans le screenshot l'erreur apparaît j'ai tenté de suivre plusieurs de vos documentations  <a href=""https://support.mozilla.org/fr/kb/microsoft-oauth-authentication-and-thunderbird-202"" rel=""nofollow"">https://support.mozilla.org/fr/kb/microsoft-oauth-authentication-and-thunderbird-202</a> <a href=""https://support.mozilla.org/fr/kb/editeur-de-configuration"" rel=""nofollow"">https://support.mozilla.org/fr/kb/editeur-de-configuration</a> (j'ai bien ""supprimez les entrées contenant oauth2.issuer et auth2.scope."") avec un compote google j'ai réussi à me connecter. pour les serveurs j'ai tenté imap et pop3 mais sans succès. Apparemment c'est smtp qu<em>il faudrait enlever. </em> Merci pour votre aide </p>",other;,thunderbird,other,en-US,1612621;1612722;1612750;,netum
1428365,2023-10-20 22:35:43 -0700,2023-10-21 00:10:41 -0700,Email Hosting Server,"<p>Hey, Mozilla ThunderBird Provide any Email Hosting server???/ </p>",other;,thunderbird,other,en-US,1612656;,software1.nector
1428366,2023-10-20 22:41:46 -0700,2023-10-22 03:23:10 -0700,quick access banner notification for remote content preferences gone?,"<p>After one of the recent updates, I'm not getting that banner anymore (instead TB thinks everything is junk). Has this functionality been removed? i hope not because its fantastic. </p><p>Obviously its not allowed in the settings and previous exceptions have been cleared and the app restarted. </p>",privacy-and-security_1;,thunderbird,privacy-and-security,en-US,1612800;1612833;1612875;1612918;,Yinmin
1428367,2023-10-20 23:04:30 -0700,2023-10-20 23:04:30 -0700,Unable to download emails since 18 October,"<p>I have this message: </p><p>""Unable to write the email to the mailbox. Make sure the file system allows you write privileges, and you have enough disk space to copy the mailbox."" </p><p>I know from Gmail that there are 127 messages to download.  I have run Avast cleanup, deleted hundreds of emails a couple of weeks ago and have plenty of disc space. </p><p>I have downloaded the latest version of Thunderbird - no change, still getting message above. </p><p>And today, to add insult to injury, I am being asked for a donation!  Which I won't be acting on until this problem is sorted out.  I have no idea what ""make sure the file system allows you to write privileges "" means - but I haven't changed my settings and have been using Thunderbird and Firefox for years. </p>",download-and-install_1;,thunderbird,installation-and-updates,en-US,"",stravaigin1
1428368,2023-10-20 23:05:36 -0700,2023-10-21 12:13:49 -0700,"Unable to write the email to the mailbox. Make sure the file system allows you write privileges, and you have enough disk space to copy the mailbox.",<p>I don't think there is any help on the forum - I need to speak to one of your staff. </p>,download-and-install_1;,thunderbird,installation-and-updates,en-US,1612798;,stravaigin1
1428369,2023-10-20 23:06:01 -0700,2023-10-28 01:53:45 -0700,Long time to delete emails,"<p>When I delete 1 email, it happens quickly. When I delete 5 emails, it takes about 10 seconds. When I delete 40 emails, it takes 2+ minutes, when I delete 100+ emails, it takes 7+ minutes. What's going on? Seems to me emails, no matter how many I delete, should be deleted very quickly. What can I do to speed up the delete process? </p>",fix-problems;needsinfo;,thunderbird,troubleshooting,en-US,1612702;1612823;1612825;1614353;,MilusC1
1428371,2023-10-20 23:10:54 -0700,2023-11-02 08:55:31 -0700,Message selection after delete,"<p>I posted the following question 1 month ago. Can anyone help me with this, it's driving me crazy! Please respond. </p> <hr> <p>- Open TB - Open Inbox to see all emails - Open an email, read it, delete it - Scroll down, reading email Subjects until I find another email I want to open (this may be 30-40 lines or more) - Open another email, read it, delete it </p><p>The cursor/highlight then jumps back up to the previously highlighted email (next to the first email I deleted). Now I don't know where I am, I don't know what email Subjects I have already looked at, I don't know where the next unlooked-at email is. In order to get back to where I was before I deleted the second email, I have to scroll down through many emails I have already scrolled through. </p><p>How do I stop TB from doing this? I want the cursor/highlight to stay right where it was before I delete any email, I do not want it jumping to some previous location. </p>",download-and-install_1;,thunderbird,installation-and-updates,en-US,1612719;1612732;1612783;1613116;1613132;1613174;1613484;1613824;1613851;1614347;1614395;1614466;1614482;1615337;1615451;1615492;1615516;1615667;1615672;1615691;1615694;,MilusC1
1428374,2023-10-20 23:53:00 -0700,2023-11-15 09:47:33 -0800,Thunderbird 115 takes a long time to start up,"<p>Hi, I have been a happy and grateful user of Thunderbird for over a decade. TB has always been relative bug free for me, until it upgraded to 115. Since then I have many issues, and I will post one at a time here. Details: Name 	Thunderbird Version 	115.3.1 OS 	Linux 4.18.0-477.27.1.el8_8.x86_64 #1 OS Theme 	Mc-OS-CTLina-Gnome-Dark-1.3.2 / Mc-OS-CTLina-Gnome-1.3.2 Application Binary 	/usr/lib64/thunderbird/thunderbird </p><p>Issue: Since 115, Thunderbird takes about 30 seconds to start up - by that I mean from clicking the icon in my taskbar to start TB, to it fully displaying all panes, and having checked for new messages. Before 115, this took about 5 seconds. </p><p>Any help as to how to reduce start up time would be appreciated. </p>",fix-problems;,thunderbird,troubleshooting,en-US,1613917;1614059;1614062;1614070;1615978;1615998;1618187;,hiker11
1428375,2023-10-20 23:54:00 -0700,2023-10-22 03:22:33 -0700,Opening thunderbird from cli in a mailbox with space in name,"<p>With a running thunderbird (115.3.2), I can use the CLI command  </p><p>thunderbird -mail ""imap://...@.../testing"" </p><p>to have it switch to the IMAP folder ""testing"". </p><p>However, I cannot get it to work with folders containing a space, e.g. </p><p>thunderbird -mail ""imap://...@.../00 Current"" thunderbird -mail ""imap://...@.../00%20Current"" thunderbird -mail imap://...@.../00%20Current </p><p>all fail to switch to the existing IMAP folder ""00 Current""  (Thunderbird lists the address of this folder as imap://...@.../00%20Current under properties). </p><p>Is there any better way to escaping space (as well as other characters)? </p><p>Thank you very much in advance! </p>",other;,thunderbird,other,en-US,1612797;1612903;1612916;1612917;,csaemann
1428377,2023-10-21 00:04:06 -0700,2023-10-28 03:53:32 -0700,Inbox displays incorrect number of messages,"<p>Hi, I have been a happy and grateful user of Thunderbird for over a decade. TB has always been relatively bug free for me, until it upgraded to 115. Since then I have many issues, and I will post one at a time here. Details: Name 	Thunderbird Version 	115.3.1 OS 	Linux 4.18.0-477.27.1.el8_8.x86_64 #1 OS Theme 	Mc-OS-CTLina-Gnome-Dark-1.3.2 / Mc-OS-CTLina-Gnome-1.3.2 Application Binary 	/usr/lib64/thunderbird/thunderbird </p><p>Issue: Sometimes the message list pane for the Inbox displays the incorrect number of messages, eg 2 when it should be the actual number of messages, eg 30 as shown in uploaded image. </p><p>Any help appreciated. </p>",fix-problems;,thunderbird,troubleshooting,en-US,1614103;1614319;1614387;,hiker11
1428379,2023-10-21 00:32:17 -0700,2024-01-09 01:38:57 -0800,Outgoing emails blocked,"<p>Many outgoing emails are blocked and returned because ""sender is unauthenticated"". </p>",other;,thunderbird,other,en-US,1612697;1629277;,john@tanburn.org
1428381,2023-10-21 00:39:34 -0700,2023-11-15 23:42:28 -0800,Issues with forwarded messages,"<p>Name 	Thunderbird Version 	115.3.1 OS 	Linux 4.18.0-477.27.1.el8_8.x86_64 #1 OS Theme 	Mc-OS-CTLina-Gnome-Dark-1.3.2 / Mc-OS-CTLina-Gnome-1.3.2 Application Binary 	/usr/lib64/thunderbird/thunderbird </p><p>If I create a test message to myself containing eg: </p><p>Line 1 </p><p>Line 2 </p><p>Line 3  </p><p>(See uploaded image) </p><p>And then forward that message to myself, I have the following issues: </p><p>1) The forwarded message is displayed *twice* in my Inbox. (See uploaded image) </p><p>2) If I delete the initial message, and one of the forwarded messages, then the Inbox shows one message which has the errors of 1) The message Subject is blank 2) The message date is incorrect (See uploaded image) </p><p>3) If I restart TB, then this empty message in Issue 2 above is gone.  </p><p>4) If I have issue 1 above, and I restart TB, then the forwarded message is only displayed once - ie restarting TB fixes issue 1 </p><p>5) BUT if I now delete the original message and have only the forwarded message in my Inbox, the contents of the forwarded message is displayed as a summary and not in full. This is not always happening and so not alway reproducible and so I have not shown an image of this. </p>",fix-problems;,thunderbird,troubleshooting,en-US,1614249;1614323;1614525;1615976;1618189;1618294;,hiker11
1428382,2023-10-21 00:45:35 -0700,2023-10-21 02:01:21 -0700,Thread  e ricerca in Thunderbird,"<p>Buongiorno, è possibile disattivare il raggruppamento in ""thread"" per i risultati della ricerca messaggi? </p><p>Grazie! </p>",fix-problems;,thunderbird,troubleshooting,it,1612665;1612674;,al.vero
1428384,2023-10-21 01:00:32 -0700,2023-10-21 01:59:58 -0700,comandi uniuco per chiudere tutte le cartelle aperte,"<p>buongiorno, sapete se ci sia un comando per chiudere tutte le cartelle di posta che siano aperte? cioè ho molte cartelle di posta, lavorandoci ne apro molte; e dopo un po' la finestra delle cartelle si allunga a dismisura, e allora io mi metto a chiuderle una dopo l'altra. ho già provato a chiedere, senza successo, se ci sia modo di farle chiudere automaticamente dopo un tempo dato di inattività.  avere un comando unico che chiuda tutte le cartelle aperte sarebbe ugualmente utile grazie dell'aiuto! Maurizio </p>",customize;,thunderbird,settings,it,1612663;1612667;1612673;,maurizio.lana
1428386,2023-10-21 01:20:40 -0700,2023-10-22 23:56:13 -0700,corrupt task,"<p>one task of 20+ cannot be edited or deleted  Version 115.3.3 </p><p>edit window text Title: 	StaySharp[d] Calendar: 	USHolidays Start Date:	Sunday, March 20, 2022 08:00 Due Date:	Monday, March 21, 2022 07:00 Repeat: 	Occurs every weekday effective 3/20/2022 from 08:00 to 07:00. Reminder: 	5 minutes before the task starts </p>",other;,thunderbird,other,en-US,1612781;1612796;1612804;1612954;1613092;,tujays
1428388,2023-10-21 01:40:50 -0700,2023-10-21 02:05:42 -0700,Non riesco ad inviare la posta,<p><strong> </strong> I  miei account:  info@carserviceclass.it info@cscmaroso.it carserviceclass@pec.it  ricevo la posta ( nn appare il pulsante invio ) cioè non riesco ad inviare posta ) anche in risposta alle mail in arrivo ( come mai )? grazie </p>,other;,thunderbird,other,it,1612676;,levabolli
1428389,2023-10-21 01:44:39 -0700,2023-10-21 02:07:09 -0700,non scarica la posta,<p>appare il messaggio - impossibile collegarsi al server imap </p>,download-and-install_1;needsinfo;,thunderbird,installation-and-updates,it,1612677;,lorenzini.danila
1428390,2023-10-21 01:54:02 -0700,2023-10-24 02:08:41 -0700,spam emails,"<p>I've been using Thunderbird for years but lately I've been having all kinds of issues. For right now I'm trying to figure out how to move emails I've marked as ""Spam"" (the column with what looks little a double arrow thing) into a spam folder. I went through and clicked on that little double arrow thing and it turns red. However, I can't see anything that would allow me to have all of those go into the spam folder.  </p><p>Thank you for any help, Joe </p>",customize;,thunderbird,settings,en-US,1612780;1613158;1613338;,joseph-rowland
1428392,2023-10-21 02:34:45 -0700,2023-10-27 06:53:19 -0700,Impresión de correos,"<p>Luis Sanz En Thunderbird 115.3.2 (64-bit)  Supernova, cuando se imprime un correo o se genera un pdf, aparece impresa una enorme cantidad de información que acompaña al texto del correo y que lo ensucia completamente. En todas las anteriores versiones de Thunderbird no ocurría. Adjunto imagenes de lo que ocurre. ¿No se podría eliminar esta información? a la hora de imprimir.. Gracias por las repuestas. Luis Sanz luis@luissanz.es </p>",other;,thunderbird,other,es,1613574;1614046;1614119;1614139;1614145;,luis48
1428395,2023-10-21 02:47:25 -0700,2023-10-21 10:15:37 -0700,Connection to server imap.postoffice.net timed out,"<p>Using Thunderbird V 115.3.3 (32-bit) on W10 laptop...started getting following msg this a.m. .. ""Connection to server <a href=""http://imap.postoffice.net"" rel=""nofollow"">imap.postoffice.net</a> timed out.""  ..... first time I've seen this happen..worked fine yesterday... </p><p>Still able to access email ([edited] @usa.net) from web interface... </p><p>Any ideas&nbsp;?? ....I need some help... Thanx... </p>",fix-problems;,thunderbird,troubleshooting,en-US,1612696;,gregstanley
1428396,2023-10-21 02:53:50 -0700,2023-11-25 11:50:43 -0800,Can Thunderbird be made to autoscroll to new inbox messages?,"<p>If I set the inbox date order so that the most recent messages are at the top then that works fine, however I prefer to display the most recent messages at the bottom, yet when I download new messages I always need to scroll down to see the latest. </p><p>Is there a way around that so that TB autoscrolls to the latest? </p>",other;,thunderbird,other,en-US,1612857;1612888;1616009;1616064;1620282;,fortean1
1428399,2023-10-21 03:07:30 -0700,2023-10-21 04:32:44 -0700,Attachments in received mail need to be more obvious,"<p>I use Thunderbird in full screen mode on a high resolution monitor. I keep overlooking attachments because the tiny paperclip and the tiny link to the attachment at the bottom of the screen are too easy to miss.  A more obvious visual cue is needed. Perhaps display the paperclip in a contrasting color and move the attachment link to just below the message header instead of putting it at the very bottom of the screen so far from the message body?  Up to now this was just an inconvenience, but today it actually cost me $50 because of an attached notice I missed even though I had read the email several times. </p>",customize;,thunderbird,settings,en-US,1612711;,ff115
1428403,2023-10-21 03:33:08 -0700,2023-10-22 00:09:36 -0700,Tbird 115 has cluttered tab titles,<p>Want to be able to tell Tbird 115 to REFRAIN from cluttering tab titles with my e-mail address.  Want to see only a folder name in each tab title.  Could not find a way to avoid the clutter. </p>,customize;,thunderbird,settings,en-US,1612778;1612866;,OldNerd
1428404,2023-10-21 03:39:49 -0700,2023-10-21 09:57:06 -0700,message grouping,"<p>I've read some articles about this but I can't find what they're talking about.  What is the message header?  I'm not sure when this started but I don't like it, it's confusing about what message I'm reading or discussing.  I only want to see one message at a time and I can't seem to change the setting. </p>",customize;,thunderbird,settings,en-US,1612784;,timlturner
1428405,2023-10-21 03:51:38 -0700,2023-10-23 22:17:41 -0700,Bold text on read emails.,<p>vs 115.3.3 just downloaded. All read emails are showing in BOLD text. Manually changing from Read to Unread makes no difference. How do I fix this. </p>,customize;,thunderbird,settings,en-US,1612861;1612865;1612868;1612893;1612898;1612908;1613033;1613055;1613088;1613102;1613280;,csnyderdec
1428407,2023-10-21 04:24:40 -0700,2023-10-23 03:20:50 -0700,latest update wiped the messages from my inbox emails. Other folders are still intact.,"<p>How do I reinstate the content of my email messages?  </p><pre>I can search and find them, one by one, and resend them to myself. But where are they? Can I restore them all with one operation?  </pre> <p>Also, I hate the threads... not liking the latest update. Can I uninstall it? </p>",other;,thunderbird,other,en-US,1612743;1612945;1613073;1613146;,sharon711
1428415,2023-10-21 05:25:40 -0700,2023-10-22 03:05:24 -0700,Ctrl + B Moves Cursor to Beginning of Line,"<p>My wife and I both are using Tbird ver. 115.3.2 on our Windows 10 desktop computers. When typing a sentence in an email if one wants to bold a word prior to typing it, we press the Ctrl + B keys and then type the word, but on doing so the cursor jumps to the beginning of that line. It happens on both our computers. I checked and the Ctrl + B keys work normally in both Word and Excel. (That is, the cursor does not move.) Is there someway to stop the cursor from jumping under this scenario?  Thanks. </p>",other;,thunderbird,other,en-US,1612771;1612911;,neil.baron.1139
1428421,2023-10-21 06:02:32 -0700,2023-10-23 00:51:31 -0700,Import of Mail Messages from old profile fails,"<p>I had to reinstall Windows 10 on my laptop, which then required me to reinstall Thunderbird. My old profile was backed up, so I just tried to import from the old profile into the new one. The Account Settings imported successfully, but it failed while importing the old Mail Messages. When I looked after Thunderbird restarted, it looks like it failed part way through importing the Local Folders. Everything after a certain point was just missing. I retried the import (Mail Messages only) to the same profile and it appeared to succeed, but only the top-level Local Folders contained mail messages. Any folder that had sub-folders was empty (except for the folder that it was in the middle of when it failed the first time). I tried to create a new profile and imported the Account Settings and, after a restart of Thunderbird, imported Mail Messages. Again, top-level Local Folders with no sub-folders had the old e-mails, but any Local Folder with sub-folders was empty. How do I get my backed-up e-mails back in the current installation of Thunderbird? </p>",download-and-install_1;,thunderbird,installation-and-updates,en-US,1612751;1613107;,cjhughes426
1428425,2023-10-21 06:55:11 -0700,2023-10-21 09:18:19 -0700,External monitor pixelated,"<p>My Thunderbird emails are fine directly on my laptop, but when I attach an external monitor everything becomes to pixelated I cannot easily read my email If I restart Thunderbird in Troubleshoot Mode with no addons or themes, it gets much better, but I use the add ons! </p>",customize;,thunderbird,settings,en-US,1612769;,jillbod
1428426,2023-10-21 07:13:19 -0700,2023-12-26 12:34:57 -0800,Can not connect with AOL,"<p>This past week Thunderbird stopped download my emails and also stopped sending my emails. I have a Verizon email account which runs through AOL. When I tried to send an email I had written, A box opened up saying that the ""password"" I had entered was not correct. The last time this happened, I had to go into AOL and have it generate a ""one time password"" for third party programs, that I need to copy and then paste into Thunderbird when I logged in. </p><p>The only time I can get Thunderbird to request a password is when I send an email . So I did that and pasted the AOL password into the box when it requested a password. I then had a messages appear that said incorrect password and this continued each time I tired it. </p><p>I finally called AOL's tech support and was told that I needed to send myself an email by using my email account within <a href=""http://AOL.com"" rel=""nofollow"">AOL.com</a>. I needed to do this for 7 days. Send myself an email from AOL and then open that email within my email account on AOL. The reason I was given was that AOL no longer recognized my computer. None of this makes sense, but I've been doing this for 4 days. And each day I have also tried to get Thunderbird to start working again, but I keep getting the same results. </p><p>I also have a Comcast email account and I use Thunderbird to send and receive emails for that account and it works fine. Never had a problem. </p><p>Is there some kind of issue between AOL and Thunderbird that is causing this? I could use some help on this please. I'm a long time user of Thunderbird and would like to be able to continue using it.  </p><p>Thank you. Fred </p>",other;,thunderbird,other,en-US,1612752;1612782;1626663;,FredBerney
1428427,2023-10-21 07:37:27 -0700,2023-10-21 09:59:48 -0700,How to undo Gmail style of message display,"<p>One of the reasons I preferred reading my Gmail messages on Thunderbird is that it kept each message independent, while Gmail would link them together and hide the contents of the older messages.  I have hated using the Gmail interface because I had problems find emails that I clearly remembered reading.  Now, It appears that Thunderbird has adopted Gmail's horrible display method and now I can't find emails that I know that I received.  I hope that there is a setting somewhere that allows me to undo this.  I looked, but I could not find any. </p>",customize;,thunderbird,settings,en-US,1612768;1612785;,johnmoster
