id,created,updated,title,content,tags,product,topic,locale,answers,creator
1416556,2023-06-22 11:47:21 -0700,2023-06-22 12:51:21 -0700,Sent mail are saved but a copy is saved in the inbox as a new mail,"<p>I am using this settings <a href=""https://support.google.com/mail/answer/7104828?hl=en#zippy=%2Ci-want-to-download-emails-on-multiple-email-clients"" rel=""nofollow"">https://support.google.com/mail/answer/7104828?hl=en#zippy=%2Ci-want-to-download-emails-on-multiple-email-clients</a> and everything works fine, the only error is that the sent emails are copied in the inbox folder as a new mail, how can I fix this, thanks. </p>",fix-problems;,thunderbird,fix-slowness-crashing-error-messages-and-other-problems,en-US,1586780;,cortezangel
1416547,2023-06-22 10:09:58 -0700,2023-06-22 12:26:51 -0700,Feature Request: Allow double quotes (or other method) to do exact search in Global Search,"<p>The Global Search is great. I have many email accounts and folders and do not always remember where an email is located, so for me, Global Search is much faster than Classic Search. </p><p>I suppose faceted search may be useful if something is misspelled or you do not remember the tense. More often than not, I want an exact search, not one where multiple words are included. </p><p>Please add the functionality of double quotes or other method to do an exact match search in Global Search. </p><p>Thank you </p>",customize;,thunderbird,customize-controls-options-and-add-ons,en-US,1586771;,randall.sulkin
1416546,2023-06-22 09:56:38 -0700,2023-06-22 10:30:19 -0700,removing files from gmail server but not from thunderbird,"<p>I have thunderbird version 102.12.0 (64-bit). I cannot find a setting to remove downloaded messages from the server. my gmail account storage is nearly full, and I need to delete files off the server. </p><p>Do I need to delete each message from the server (will that delete them from thunderbird?) </p><p>Where do I find the setting to automatically delete files from the server when downloaded (and what is it called)? </p><p>Does clean up (expunge) inbox on exit remove emails from Thunderbird, server or both? </p>",other;,thunderbird,other,en-US,1586757;,david17361
1416544,2023-06-22 09:32:48 -0700,2023-06-22 12:42:52 -0700,Multiple accts / migration from Pocomail,<p>Two questions in one: </p><p>1. I'm wanting to migrate my accounts from Pocomail to Thunderbird. How can I do this? </p><p>2. How do I set up Thunderbird to show messages from multiple email accounts in the Inbox? </p><p>Thanks </p>,download-and-install_1;,thunderbird,download-install-and-migration,en-US,1586779;,drvon
1416543,2023-06-22 09:28:43 -0700,2023-06-22 12:21:41 -0700,GoDaddy email address no longer working in firefox,"<p>Dear Mozilla, </p><p>I have been a long term user/donator. Over the last few days my GoDaddy account which is linked to office 365 in some way has stopped working. I recieved this email not long before the address became inactive. </p><p><em>There are email accounts in your organization using Basic Authentication, which Microsoft will no longer support after 06/19/2023. You'll still be able to access your email through your browser, but not from an email app, such as Outlook or Apple Mail — don't worry, none of your emails will be lost. </em> </p><p>In order to continue using your email apps, you need to update your settings from POP/IMAP to Exchange for each device you use to check your email. This also applies to other users who are set up within your account using POP/IMAP settings.<em> </em> </p><p>It appears I need to change the settings to ""exchange""? Could you please advise me how to do this? </p><p>Thanks in advance, James </p>",privacy-and-security_1;,thunderbird,privacy-and-security-settings,en-US,1586770;,semajtres
1416541,2023-06-22 09:16:13 -0700,2023-06-22 09:16:13 -0700,Applying OpenPGP Alias to Account level,"<p>I have few accounts in Thunderbirds, and two of them have PGP enabled, one for my main email for communications and the other is for signing up things and storing newsletters which is relaied via Anonaddy. I would like to just apply the alias configuration to my alternate email, not my mail email. Is that possible? </p><p>Thanks. </p>",customize;,thunderbird,customize-controls-options-and-add-ons,en-US,"",hartmantam
1416536,2023-06-22 08:19:03 -0700,2023-06-22 12:33:01 -0700,Signatures,"<p>How to I create a second signature (and a third!). Somewhare under the Help it tells me that the option is under ""account settings"", but I can't find that option under Tools as it suggests. </p>",other;,thunderbird,other,en-US,1586775;,markhbfindlay
1416534,2023-06-22 07:34:29 -0700,2023-06-22 07:34:29 -0700,thunderbird,"<p>Using Thunderbird for email on win 11 HP Envy. Was working fine until this morning. On start up, can't download new mail. The ""back and forth"" indicator just runs and runs. Gmail times out. Yahoo not. Disabled VPN. Same result. Re-loaded latest version via internet, same result. There are new emails that were successfully viewed on my iPhone. </p>",fix-problems;,thunderbird,fix-slowness-crashing-error-messages-and-other-problems,en-US,"",ivan194872
1416527,2023-06-22 06:25:51 -0700,2023-06-22 06:25:51 -0700,secondary gmail account not working after migration to new pc,"<p>getting error </p><p>The STAT command did not succeed. Error getting message number and sizes. Mail server <a href=""http://pop.gmail.com"" rel=""nofollow"">pop.gmail.com</a> responded: [AUTH] Invalid credentials. </p><p>I can login to my google account and it works and my other gmail works in thunderbird but not my secondary autho is set in both </p>",download-and-install_1;,thunderbird,download-install-and-migration,en-US,"",john.nicoletti.jn
1416525,2023-06-22 05:40:54 -0700,2023-06-22 05:40:54 -0700,Teams Invitation - no ticket / you are not on the guest list,"<p>When ever I receive a Teams meeting invitation (might apply also to other mails with appointment information attached, I guess it is an ics-file) and try to accept, I get the message: ""No ticket? You are not on the guest list yet"". The exact wording might be a bit different, since I'm translating it from German. Then all mail addresses configured in Thunderbird are offered for the response to the invitation. In fact I'm on the list on invitees, otherwise I wouldn't have received the invitation. It's actually not a big deal, I can select the correct mail address and send the answer. But it is a bit annoying and not completely obvious why Thunderbird behaves this way. </p><p>Thanks. </p><p>Christian </p>",fix-problems;,thunderbird,fix-slowness-crashing-error-messages-and-other-problems,en-US,"",cortlieb
1416524,2023-06-22 05:38:46 -0700,2023-06-22 07:07:44 -0700,Missing sent messages,<p>I occasionally send out large group e-mails on industry news and for some reason I can never see these in my sent folder.  Sometimes I want to find one and resend it to someone but it's not there.  Where do they go?  Can I change something so I can see them? </p>,other;,thunderbird,other,en-US,1586722;,mary100661
1416521,2023-06-22 05:26:24 -0700,2023-06-22 05:26:24 -0700,"In CardBook, using the standard dialog to conect to a new contact database, iCloud hangs and never populates.","<p><strong>Platform</strong> TB: 102.12.0  Build ID:20230604001933 </p><p>Edition	Windows 11 Pro for Workstations Version	22H2 Installed on	‎9/‎21/‎2022 OS build	22621.1848 Serial number	USH117L52C Experience	Windows Feature Experience Pack 1000.22642.1000.0 Device name	WS-Z8-G4 Processor	Intel(R) Xeon(R) Gold 6240 CPU @ 2.60GHz   2.59 GHz  (2 processors) Installed RAM	384 GB (383 GB usable) Device ID	CE8E10D5-24B2-48E7-BAA7-92516161F230 Product ID	00391-50000-00000-AAOEM System type	64-bit operating system, x64-based processor Pen and touch	No pen or touch input is available for this display </p><p><strong>What happened</strong> I attempted to add an iCloud contact database to CardBook. It was one of the options. I had TBSync and Card/CalDav installed but saw that iCloud and Apple appeared support. </p><p>First mistake was I did not have an app specific password handy, and forgot I needed one, so I tried my Apple password twice. It failed to validate. Then I either read the instructions that I needed an app specific password and generated one from the iCloud website. Once I put that in, it validated fine and it looked like it was going to sync. It never finishes syncing or displaying any contacts. See attached screenshot. </p><p>That was yesterday afternoon, it is now twelve hours later.  </p><p>When I right click on the the iCloud contact list, I cannot delete it /  unsubscribe.  </p><p>I need help first in getting rid of it, and second knowing if there is a way to get it into CardBook.  </p><p>Any and all help is gratefully appreciated. </p><p>Dave </p>",fix-problems;,thunderbird,fix-slowness-crashing-error-messages-and-other-problems,en-US,"",dpalmer1
1416519,2023-06-22 05:19:52 -0700,2023-06-22 10:51:51 -0700,A particular tag stopped appearing for me since 2021,"<p>In our company, we are using Thunderbird tags to tag e-mails for particular employees to read/work on/answer. We are all using the same main work e-mail account (we are an internet store), just sign our replies with our respective names. </p><p>This worked for years, but then after September 2021 one of the tags (3rd) stopped working for me on all my computers (I work remotely from home), while it still shows for the rest of the employees on the computers at the office. </p><p>I still see all the e-mails from before Sept 2021 with this tag as correctly tagged. Everything from past that point the other employess successfully tag and see as tagged, while I see these messages as not having any tag at all. </p><p>In the hopes that it's some bug within my Thunderbird (currently 102.12.0) I installed the Beta 115.0b3 version as a separate entity and configured it from the scratch... The issue persists. </p><p>My config below. What am I doing wrong? All the other tags are configured in exactly the same way and they work properly. </p>",other;,thunderbird,other,en-US,1586761;,snowblindn3ss
1416508,2023-06-22 01:40:15 -0700,2023-06-22 08:57:35 -0700,POP Mail,<p>POP mail always asking my password. Password warning pops up 10-15 times a day </p>,other;,thunderbird,other,en-US,1586741;,baris.yurdakul
1416507,2023-06-22 00:48:31 -0700,2023-06-22 12:53:21 -0700,lösenord,<p>jag har glömt mitt lösenord </p>,other;,thunderbird,other,en-US,1586782;,pohagglund
1416506,2023-06-22 00:35:12 -0700,2023-06-22 08:55:10 -0700,two-factor verification,"<p>I can't set my aruba pec on thunderbird, after the two-factor verification required by the pec provider when I open thunderbird I am asked for the password every time I start the program </p>",other;,thunderbird,other,en-US,1586740;,ingcantale
1416503,2023-06-21 23:57:20 -0700,2023-06-22 03:49:53 -0700,page breaks when printing emails,"<p>I have upgraded to the new beta version, 115.0b3 (64-bit), and since upgrading I am having an issue with printing certain emails. </p><p>When I try to print an email, most of the time the resulting print will have the ""Subject"", ""From"", Date"" and ""To"" on one page and the body of the email on the next page. </p><p>This has never happened before with previous versions of thunderbird. </p><p>Some emails still print normally but the majority have this page break between the header and the body. </p><p>any help will be appreciated. </p>",other;tbbetasn;,thunderbird,other,en-US,1586687;,eyal6164
1416501,2023-06-21 23:33:49 -0700,2023-06-22 06:30:07 -0700,Problemi dopo Aggiornamento Thunderbird,"<p>Buongiorno, </p><p>chiedo se è possibile installare una versione precedente di Thunderbird, perchè dopo aver fatto l'aggiornamento ieri non mi funzionano le mail. Ho poi scoperto che dato che avevo una versione precedente alla 70 (la versione 32) avrei dovuto prima installare la versione 78 per poi procedere all'installazione della versione più recente. </p><p>Grazie in anticipo per l'aiuto. </p>",fix-problems;,thunderbird,fix-slowness-crashing-error-messages-and-other-problems,it,1586657;1586711;,justice.madufor
1416499,2023-06-21 23:26:17 -0700,2023-06-22 08:22:29 -0700,"Right click, multi-emails select","<p>Right then, </p><p>I've been using TB for about two years now.  I had been using Outlook for about 20+ years.  since around the beginning of this year, I began to notice a glitch in the programme.  It 'eats' emails.  I have three email accounts and all are in TB.  I'll be in the Inbox of one account and suddenly it scroll-deletes emails.  My hands are neither on the mouse nor the keyboard.  If I'm fast enough, I can close TB down.  If I open it again, it will happen again.  The only means to correct this, it seems is to reboot the PC.  Happened again yesterday and scroll deleted roughly 150 emails. </p><p>To bring the emails back to the Inbox from the Trash, is to click one email at a time, it would seem.  In Outlook, I was able to right click on one email and drag down or up to select multi emails and move them back.  It seems this does not exist in TB, unless I am missing something. </p><p>Questions:  1. Is there a means to fix this 'scroll deleting' of emails? </p><p>2. Is there a means to right click and drag select emails in order to move them to another folder, versus Clt+click on each?   </p><p>Thanks in advance. </p>",customize;,thunderbird,customize-controls-options-and-add-ons,en-US,1586735;,HondoMan
1416497,2023-06-21 20:24:20 -0700,2023-06-22 10:09:57 -0700,Thunderbird 102 will not send emails.,"<p>Thunderbird 102 has been working great since I installed it a few months ago. That is until last night, 20 June 2023, when Thunderbird suddenly stopped sending emails. It receives emails just fine, but suddenly stopped sending emails. My email service is through Spectrum, part of Charter Communications. </p><p>I spoke to technical support at Spectrum today, 21 June 2023. He checked my account and everything looked good.  He had me login to my email account via the Spectrum Webmail link. I logged and was able to send an email just fine.  Also, I have and iMac, iPhone, and iPad Pro. All of my Apple computer and both of my mobile devices send and receive emails just fine, no change there. </p><p>Spectrum tech support says it is not Spectrum and I should check with Thunderbird tech support. I him I had not upgraded Thunderbird since I installed version 102, so as far as Thunderbird goes, nothing has changed.  </p><p>That leaves me with the question, why did Thunderbird suddenly stop sending emails  and what changed? </p><p>Please help me out. I have to be able to send emails from my Windows 10 PC. </p><p>Thank you, </p><p>Randy Hayes [removed email from public] </p>",fix-problems;,thunderbird,fix-slowness-crashing-error-messages-and-other-problems,en-US,1586650;1586672;1586744;1586752;,chayes23
1416494,2023-06-21 19:16:35 -0700,2023-06-22 10:14:13 -0700,Auth-Status: Invalid login or password,<ul><li> passwords have been verified as valid </li><li> usernames have been verified as valid </li><li> webmail logins work perfectly </li><li> Thunderbird 64 bit stopped working after an update 3 days ago </li><li> NOT using a proxy or VPN - Windows 11 Home set to not use proxy </li><li> Thunderbird set to NOT use a proxy - auto-detect is off </li><li> Everything worked perfect prior to the update several days ago </li></ul> <p>I'm at a loss as to how to fix this issue - any suggestions would be very welcomed. </p><p>Webbi </p>,other;,thunderbird,other,en-US,1586754;,webbi
1416490,2023-06-21 17:00:11 -0700,2023-06-21 17:00:11 -0700,Just QUIT working today,<p>Today Thunderbird just quit working. It will show new messages in my accounts but will not display the message contents. Just a blank message pane. Also quit working with my Startmail account entirely. Also shows as busy in various accounts. What is really strange is that it was working perfectly at 1 this morning now just out of the blue I am dead in the water. </p><p>Any ideas&nbsp;?? </p>,other;,thunderbird,other,en-US,"",Scorpn1
