id,created,updated,title,content,tags,product,topic,locale,answers,creator
1428808,2023-10-25 07:58:02 -0700,2023-10-25 08:16:53 -0700,How to get Gmail configuration to work.,"<p>The standard SMTP server for Gmail accounts does not seem to work. For it to work, set it to STARTTLS in Connection Security instead of SSL/TLS. Why do I have to fix it manually? And why is it not stated anywhere on Mozilla support at Google Answers? </p>",fix-problems;,thunderbird,fix-slowness-crashing-error-messages-and-other-problems,en-US,1613532;,jdreioe
1428806,2023-10-25 07:45:00 -0700,2023-10-25 07:45:00 -0700,"Al utilizar ""Copiar a"" hace lo mismo que ""Mover a""","<p>Buenas tardes. </p><p>Tengo la versión 115.3.3 (64-bit) en W10. </p><p>Vengo detectado problemas al querer copiar un mensaje a carpetas que tengo creadas, ya que en vez de copiarlo me mueve el mensaje a dicha carpeta. </p><p>Para solucionarlo estoy teniendo que guardar el mensaje en el disco duro y luego moverlo a la carpeta que inicialmente quiero llevarlo. </p><p>¿Alguna solución para que funcione correctamente ""Copiar a""? </p><p>Gracias de antemano. </p>",fix-problems;,thunderbird,fix-slowness-crashing-error-messages-and-other-problems,es,"",jrvijuesca
1428805,2023-10-25 07:44:34 -0700,2023-10-25 07:44:34 -0700,"my incoming list of messages is on a black background with white print, how do I change it to white with black print",<p>I want to change the back ground on the incoming email to white with black print </p>,other;,thunderbird,other,en-US,"",wildfire3
1428804,2023-10-25 07:42:12 -0700,2023-10-25 08:22:19 -0700,Login,<p>I get this message when I try to get to the window to enter my password: 400. That’s an error. The server cannot process the request because it is malformed. It should not be retried. That’s all we know. </p>,other;,thunderbird,other,en-US,1613519;1613533;,benprestonmail
1428802,2023-10-25 07:19:37 -0700,2023-10-25 07:19:37 -0700,"New emails since 7pm last night, NOT coming thru, till NEXT day!","<p>I turned on pc, this morning. Opened Thunderbird. Checked for Updates; None. Thunderbird checks for new email from Gmail, then Compuserve (thru AOL). Taking about 3mins. Nothing past 7pm, last night. I go to Compuserve e-mail, on-line thru AOL. Messages waiting there from last night (past 7pm) and up to NOW. Had this happen before; within 2 months. If I wait until Tomorrow, the e-mails WILL come thru to my InBox. Of course then I have to go thru ALL that, PLUS today's stuff!! What is going on? I CAN read And reply thru on-line AND my connection thru my Cell phone. It can be good, on my Pc, with Thunderbird for a week or so, then Happens Again!! If I send myself a message from Gmail, it does NOT come to my Thunderbird Compuserve Inbox, but it Does show when I go On-line or to my Android Cell. I looked at my Thunderbird settings for anything that could be Filtering my e-mail, after 7pm (on Some days). Didn't see anything. I could just NOT Know Where that Particular Setting IS.... I CLOSE Thunderbird, then re-Open, and Do NOT get those NEW messages. Until a few months ago (after a 32 to 64bit update??), I don't think I had this problem (??). Even tried checking my Compuserve settings. NOTHING there, that I see that ""looks"" like it would cause this. When I click on Get Messages, even going to Specifically my Compuserve messages, on Thunderbird, a shaded line, on bottom right, keeps showing Something is going on, for a few minutes. </p><p>What Do I DO??? </p>",fix-problems;,thunderbird,fix-slowness-crashing-error-messages-and-other-problems,en-US,"",RandMF
1428801,2023-10-25 07:18:30 -0700,2023-10-25 07:18:30 -0700,New to Thunderbird. I do not have a Deleted folder. Where are my deleted emails?,<p>New to Thunderbird. I do not have a Deleted folder. Where are my deleted emails? </p>,other;,thunderbird,other,en-US,"",dirtguycentral
1428797,2023-10-25 07:08:34 -0700,2023-10-25 07:08:34 -0700,Thunderbird 115,"<p>When I reply to a message the cursor defaults to searching the contact list rather than simply sitting where my reply text will begin. Hiding the contact list solves it, obviously, but I prefer the contact list to be there for when I'm writing emails. This has only started since upgrading to 115. </p>",customize;,thunderbird,customize-controls-options-and-add-ons,en-US,"",colin_irvine
1428796,2023-10-25 07:06:36 -0700,2023-10-25 07:06:36 -0700,Multi folders in,"<p>I have two  ""daniel@desmedt.net""  in my Thunderbird main folder.  First one works as designed, second is always empty.  In addition I have a <em>Local Folders</em> always empty too.  How do I get rid of them, thanks. ___________________________________________ Daniel Desmedt Daniel@desmedt.net 845-527-5381 </p>",other;,thunderbird,other,en-US,"",daniel204
1428795,2023-10-25 06:48:02 -0700,2023-10-25 07:29:53 -0700,Disable Upgrade on MAC,"<p>Hello, how do I disable Thunderbird from updating? I was having issues sending and receiving emails with the new 115.3.3 update but as soon as I downgraded to 112 the problems went away. I would like to keep it this way. </p>",other;,thunderbird,other,en-US,1613495;1613497;1613504;1613511;,rick147
1428794,2023-10-25 06:41:52 -0700,2023-10-25 07:27:56 -0700,Sound alert when new email arrives,"<p>Since yesterday when Thunderbird updated, I either get an alert sound for new email all of the time (even when Thunderbird is closed and I don't want to be alerted) or none of the time, if I turn the sound off (meaning even when I have Thunderbird open, I get no sound alerting me of new email).  How do I set it so that when the program is open, the alert sound works, but when the program is closed, the alert sound does not interrupt my other activities (like work video calls)? Thanks for any help with this. </p>",customize;,thunderbird,customize-controls-options-and-add-ons,en-US,1613498;1613502;1613509;,bpc22
1428793,2023-10-25 06:17:49 -0700,2023-10-25 06:17:49 -0700,Can't reinstall archived mails,"<p>After umpteen bugs due to Supernova I have gone back to 102, I archived my work e mails before downgrading and these appear in Profiles but I can't get them back into the archives on Thunderbird to access them. I tried the solution of creating 'Restored' and Temp but they still are not appearing. Is there a simple solution to this? It has eaten several hours of my day and I need to access the mails for work.  </p><p>I have tried putting them into </p><pre>C:\Users\USER\AppData\Roaming\Thunderbird\Profiles\u6b1hjm3.default\Mail\Local Folders </pre> <p>Also C:\Users\USER\AppData\Roaming\Thunderbird\Profiles\u6b1hjm3.default\Mail\<a href=""http://pop.orange.fr"" rel=""nofollow"">pop.orange.fr</a> And C:\Users\USER\AppData\Roaming\Thunderbird\Profiles\u6b1hjm3.default\ImapMail\<a href=""http://imap.orange.fr"" rel=""nofollow"">imap.orange.fr</a> </p><p>Nothing happens. I'm terrified I will lose them all. </p>",download-and-install_1;,thunderbird,download-install-and-migration,en-US,"",Tootie
1428787,2023-10-25 05:41:15 -0700,2023-10-25 05:41:15 -0700,unable to open some Pdf Files,<p>Hi </p><pre>I have tried to see why but since the last update to Thunderbird I am not able to open some pdf files or images from some of the senders yet some are still working fine.  There is no error message it opens like all the others but only a blank page. If i same it to the PC and open it I get an error message ( we cant open this file something went wrong) I can not see any other reason why but it started as soon as the last update was completed.  </pre> <p>thanks Anthony </p>,desktop;fix-problems;windows-10;,thunderbird,tips-and-tricks,en-US,"",absolutepm
1428786,2023-10-25 05:32:02 -0700,2023-10-25 05:32:02 -0700,Google Calendar connection,"<p>Recently (roughly starting around September 2023), the connection to a google calendar has been had issues. I cannot dismiss and event, even though an event has passed - I am still notified. Updating events does not send our updated invites to attendees. </p>",calendar;,thunderbird,calendar,en-US,"",jjeffrie
1428778,2023-10-25 03:59:04 -0700,2023-10-25 08:04:48 -0700,115.3.3 THUNDERBIRD SUPERNOVA (Bug),"<p>Ciao, ho appena effettuato l'aggiornamento di Thunderbird, versione supernova 115.3.3. Ovviamente vi sto scrivendo a seguito di varie prove e riavvii non risolutivi. Prima quando aprivo Thunderbird, qualsiasi cartella aprissi, mi faceva comparire di default l'ultima email ricevuta. Con quest'ultimo aggiornamento no, fino a quando resto nel programma mantiene in memoria l'ultima visualizzazione ma se chiudo e riapro thunderbird ogni volta devo ricliccare sull'ultima email di ogni cartella...perchè non mi visualizza nulla altrimenti. </p><p>Inoltre non c'è modo di visualizzare in alto la barra con File Modifica... e mettere sotto quella con Scarica Messaggi...ecc. </p><p>Mi succede infine che con quest'ultimo aggiornamento, di entrare in cartelle, vedere gli oggetti delle email ma se clicco su una di queste mail non vedo nulla, schermata bianca senza alcun testo. </p><p>Vi ringrazio fin da ora per il supporto e i consigli che vorrete darmi, buon pomeriggio Andrea </p>",other;,thunderbird,other,it,1613464;1613525;,kuja79
1428777,2023-10-25 03:40:06 -0700,2023-10-25 06:29:06 -0700,non riesco a stampare le e-mail,"<p>non riesco a stampare le e-mail, la stampante risulta offline ma in realtà funziona regolarmente con tutti gli altri prigrammi </p>",other;,thunderbird,other,it,1613489;,cesare7
1428775,2023-10-25 03:15:43 -0700,2023-10-25 06:26:36 -0700,Account PEC non viene visualizzato nell'elenco a sinistra,"<p>Salve. Utilizzo il programma Thunderbird sia per la posta ordinaria che per la PEC. Mentre gli account della posta ordinaria li trovo regolarmente nella barra di sinistra con i sottomenu ""Posta in arrivo, Bozze, Posta inviata ecc."" per la PEC (malgrado l'account sia regolarmente configurato) non visualizzo nulla nella barra di sinistra, ma i messaggi arrivano nella posta in arrivo delle cartelle locali. Come devo fare per far visualizzare nella barra di sinistra anche l'account PEC, come per la posta ordinaria? </p>",customize;,thunderbird,customize-controls-options-and-add-ons,it,1613488;,brunosquillaci
1428773,2023-10-25 02:53:04 -0700,2023-10-25 02:53:04 -0700,My hotmail account will no longer send ( office365 auth failure),"<p>Hi My problem:         My hotmail account will no longer send emails.  The error message I get is </p><pre> From Microsoft: ""We can't sign you in Your browser is currently set to block cookies. You need to allow cookies to use this service.""    (NB my Firefox browser cookies is set to 'standard' and the settings had not been changed.  Plus I've tried playing with the settings, makes no difference)   From Thunderbird: ""Sending of the message failed. The message could not be sent because the connection to Outgoing server (SMTP) <a href=""http://smtp.office365.com"" rel=""nofollow"">smtp.office365.com</a> timed out. Try again."" </pre> <p>When?          Started on 6 or 7 Oct,  At this point, both receive and send failed. Last message was just before a Thunderbird update.  We were in France, using hotel internet, which Microsoft hates.  (so I didn't try to fix it until we got home).       </p><p>Other info:        However my hotmail address still worked well on my laptop's Outlook; internet login, Thunderbird on another  laptop (Win 11, and more recent installation of Tb) and on my phone (Android, FairEmail), ie has not been blocked.   My usual laptop is Win 10.  All other emails within my Thunderbird are working fine.   The outgoing SMTP for hotmail is: smtp://<a href=""http://smtp.office365.com"" rel=""nofollow"">smtp.office365.com</a> (smtp://<a href=""http://smtp.office365.com"" rel=""nofollow"">smtp.office365.com</a>)   See image attached.   </p><p>What since:      A forced update of Windows (as rec'd by local techy) restored the receive function and speed, which had become sluggish.   Hotmail still can't send.  I've logged in and out of my microsoft account online, and have changed my MS password (and therefore that of my hotmail account), plus restarted everything lots of times.  No difference. I have not got office365 except what came free with windows.   I avoid office/MS apps where possible.   </p><p>PLUS:  Discovered that my Tb profile is humungous, 45gb, of which a fair chunk is this last couple of weeks.  Most of it is not visible emails.  Any advice&nbsp;? - can I start a new profile and ditch the old?  </p><pre>                   Help please...................... </pre> <p>Thanks Eunice Lord </p>",fix-problems;,thunderbird,fix-slowness-crashing-error-messages-and-other-problems,en-US,"",eunice.lord
1428772,2023-10-25 02:38:41 -0700,2023-10-25 04:29:04 -0700,"Must scroll down messages to see the newest, very annoying. How to fix that. Version 115.3.3 (32 bit)",<p>Every time I opent Thunderbid I must scroll down to see the newest messages at the bottom. It is very annoying. Also it happens when I change the folders. How to fix it? </p><p>Thanks </p>,customize;,thunderbird,customize-controls-options-and-add-ons,en-US,1613465;,mifragama
1428771,2023-10-25 02:25:33 -0700,2023-10-25 08:07:02 -0700,edit themes,<p>i would like to change the dark theme that is installed by default </p>,customize;,thunderbird,customize-controls-options-and-add-ons,en-US,1613452;1613486;1613490;1613491;,bengallemoni
1428763,2023-10-25 01:45:06 -0700,2023-10-25 01:45:06 -0700,The minimum number of visible in the list of received emails,<p>Formerly I could decide the window size for the number of minimum visible received emails in the list down to 3. But for any reason the minimum now is 10. Which does that the space for text content is reduced a lot. How can I get back the former possibility? </p>,desktop;customize;windows-10;firefox-1180;firefox-11802;,thunderbird,tips-and-tricks,en-US,"",olanhol39
1428761,2023-10-25 01:37:51 -0700,2023-10-25 03:38:56 -0700,Thunderbird Downgrade From 115 To 102 Add-ons Still Think Version 115,"<p>Hi, My Thunderbird auto-upgraded to V115.3.3 yesterday and a number of add-ons that I use reported that they were not compatible with the new version. I didn't particularly like the appearance of the new version so I decided to downgrade back to V102. I downloaded the V102 installer, deleted compatability.ini and ran the installer. The install seems to have worked and I am back to V102.15.1 but my add-ons still think I have V115 installed so are marked as incompatible. If I look at the update history in settings the latest entry is the upgrade from V102 to V115, ie the downgrade is not showing. How do I convince my add-ons that I am back to V102 and that they are compatible? </p>",download-and-install_1;,thunderbird,download-install-and-migration,en-US,"",mjp21ff
1428760,2023-10-25 01:30:30 -0700,2023-10-25 01:30:30 -0700,Thunderbird detected a potential security threat and did not continue to localhost,"<p>Hi, </p><p>Since yesterday, thunderbolt open a popup to ask for access to my google account. But when I click on the button ""authorize"", I got the following error: </p><p><em>Warning: Potential Security Risk Ahead </em> </p><p>Thunderbird detected a potential security threat and did not continue to <strong>localhost</strong>. If you visit this site, attackers could try to steal information like your passwords, emails, or credit card details.<em> </em> </p><p>In the google account settings, thunderbird is already allowed. I use Thunderbolt 115.3.1 (64-bit) </p>",fix-problems;,thunderbird,fix-slowness-crashing-error-messages-and-other-problems,en-US,"",gregory10
1428757,2023-10-25 01:09:43 -0700,2023-10-25 01:18:22 -0700,lentezza thunderbird,"<p>Buongiorno, è da molto tempo che riscontro una notevole lentezza quando ricerco delle mail, oppure quando passo da posta inviata alla posta in arrivo... appare la rotellina di caricamento e la scritta non risponde. dopo una 40 sec circa si sblocca.. </p><p>Grazie per eventuali soluzioni.. </p>",fix-problems;,thunderbird,fix-slowness-crashing-error-messages-and-other-problems,it,1613439;,landcherrysrl
1428756,2023-10-25 00:37:02 -0700,2023-10-25 08:06:07 -0700,posta inviata,<p>da alcuni giorni i messaggi inviati non vengono più salvati nella cartella Posta Inviata e la stessa è priva dei messaggi inviati nei giorni precedenti (riporta solo i messaggi inviati a determinati destinatari) </p>,fix-problems;,thunderbird,fix-slowness-crashing-error-messages-and-other-problems,it,1613438;1613459;1613468;1613472;1613526;,roberta.rota
1428753,2023-10-25 00:16:18 -0700,2023-10-25 00:16:18 -0700,Thunderbird menu item: View>Sort by>Order received is disabled,"<p>Recently I noticed the ""sort by&gt;order received"" option has been disabled in Thunderbird (I am running version 115.3.3 64-bit). Other ""sort by"" options are still available for use but a few that appear on the list are greyed out and can't be selected. </p>",customize;,thunderbird,customize-controls-options-and-add-ons,en-US,"",stepmars
1428751,2023-10-24 23:39:48 -0700,2023-10-24 23:39:48 -0700,Mozilla Thunderbird,"<p>Mozilla Thunderbird gibt beim Starten diese Meldung aus: ""Ihr Profil ""Thunderbird"" kann nicht geladen werden. Es ist möglicherweise nicht vorhanden oder ein Zugriff ist nicht möglich"" wieso und wie kann ich das Problem beheben? Ich habe Thunderbird schon neu installiert, hat aber auch nicht geholfen! Die nächste Frage ist wo werden die Mails gespeichert, wie kann ich sie sichern? Vielen Dank im voraus. Wolfgang </p>",fix-problems;,thunderbird,fix-slowness-crashing-error-messages-and-other-problems,en-US,"",w.gloeckner
1428750,2023-10-24 23:12:01 -0700,2023-10-24 23:12:01 -0700,Thunderbird keeps forgetting Account setting,"<p>Hello, does anyone else experiencing in the last month Thunderbird forgetting set up email accounts? It comes every 3-4 days, then I can set up my accounts from scratch. It is annoying. If you  have the same problem, do you have any remedies? Thanks. </p>",customize;,thunderbird,customize-controls-options-and-add-ons,en-US,"",peter.kenesy
1428749,2023-10-24 22:42:46 -0700,2023-10-24 22:42:46 -0700,Automatic scroll in mailboxes,"<p>Hello, Recently, I am experimenting a problem with newer versions of Thunderbird: I open Mozilla Thunderbird, I see my Inbox, and when I click on another mailbox (Sent, Spam, or another folders that I have created), I think that it's happening an automatic scroll, because I see mails from 2021, 2022... not the lastest mails. I return to Inbox, and it's hapening the same. Is it a bug? </p><p>I could attach a video, and you could see that I am trying to explain. </p><p>Kind regards, iggy. </p>",customize;,thunderbird,customize-controls-options-and-add-ons,es,"",ialagon
1428748,2023-10-24 22:22:15 -0700,2023-10-25 01:10:29 -0700,portion of code in the message part,"<p>Good morning, with the switch to Thunderbird Supernova, with is mails that have images as background, do I display this error in the message body? Thanks for anyone who can help me, with previous versions never had any problems Best regards Andrea </p>",fix-problems;,thunderbird,fix-slowness-crashing-error-messages-and-other-problems,it,1613434;,andreapastori67
1428744,2023-10-24 20:10:23 -0700,2023-10-24 20:10:23 -0700,Prevent nagging update notifications in version 102,"<p>My wife and I are still on T'Bird 102 on our Macs.  After inadvertently replacing 102 with 115 on Windows, we will absolutely not downgrade to 115 for the foreseeable future.  But in 102, the only update settings I can find are either to automatically update, or automatically check for updates and nag us.  The nagging has been an issue for months now, since previous versions of 10x have broken the ability to read POP mail, to send mail, etc, so we have had to back-install previous versions.  But always that whining, nagging update notice. </p><p>Is there any way to stop that? </p>",download-and-install_1;,thunderbird,download-install-and-migration,en-US,"",greggbrickner
1428743,2023-10-24 20:05:02 -0700,2023-10-24 20:05:02 -0700,How to start the setting of Mozilla TB to direct my email traffic from a sleuth of email client accounts?,"<p>How to start the setting of Mozilla TB to direct my email traffic from a sleuth of email client accounts? I do have 10+ free Yahoo email accounts, Plus free Proton, Tutanota and Gmx accounts. I would like to follow a step by step process to integrate all those accounts under Mozilla Thunderbird to be able to see, open, read and eventually edit and modify my emails. Could you offer to Me all the links with tutorials that would teach me how to get the results I am looking for? </p><p>Also, in a second stage I would like to integrate Mozilla TB with SeaMonkey and also with MultCloud and other third party cloud free services. like Box, Mega, OneCrive, OneNote, etc </p><p>P would like if possible to get your response to my email linked to this account. </p><p>Awaiting your reply with my thanks </p><p>Charlie B </p>",other;,thunderbird,other,en-US,"",MSwhip
1428736,2023-10-24 18:43:38 -0700,2023-10-24 18:43:38 -0700,Update to Thunderbird 115.3.3 Corrupted Profile,"<p>I recently updated Thunderbird to 115.3.3.  When the update was complete it appears to have split my profile into two and created two of Inbox, Drafts, Sent, and Trash.  I use Earthlink which is the name of the POP3 account.  Now there are Inbox, Drafts, Sent, and Trash for ""Earthlink"", and a set for ""Local Folders"".  Junk and Archives are only associated with ""Local Folders"", and ""Outbox"" shows up under a ""Local Folders"" header along with all of the folders I used to organize received messages.  When new messages are downloaded they appear in ""Inbox / Local Folders"".  Nothing appears in any of the ""Earthlink / ..."" folders. </p><p>I don't recall exactly what it looked like before but there was only one set of the primary folders, and the local folders I created to organize my inbox.  I have attached screenshots of the the folder navigation pane, as well as the odd organization of the ""Account Settings"" tab.  I am admittedly not an expert.  Any help is appreciated. </p>",download-and-install_1;,thunderbird,download-install-and-migration,en-US,"",pete48
1428735,2023-10-24 18:39:00 -0700,2023-10-24 18:39:00 -0700,Constant crashes with new version of Thunderbird.,"<p>Didnt use Thunderbird for 2 weeks. On return from trip  last week, tried to open what seems to be a new version of TBird. Tried many times--each time crashed. Tried troubleshooting mode--also crashed each time. Has never opened in the new format. </p><pre> Some recent crash reports:  bp-623fc874-02c1-428b-a374-9bc100231023  </pre> <p>bp-1e1ab409-5839-4f7f-a333-bdc0b0231023  bp-470996a8-385d-4f53-b30b-af2570231023 </p><pre>bp-683b1b67-0a33-4304-8658-f36c50231022  </pre> <p>bp-4ab8d633-366e-49ff-a12d-2d2ca0231022.  Thanks. </p>",fix-problems;,thunderbird,fix-slowness-crashing-error-messages-and-other-problems,en-US,"",prerau
1428729,2023-10-24 17:43:07 -0700,2023-10-24 17:43:07 -0700,Edit Address Book entry,<p>I can't seem to be able to edit Address Book entries in TB 115.3.3. </p><p>I highlight the email to change and can't do anything with it </p><p>In fact the address book is no longer found under Tools. </p>,other;,thunderbird,other,en-US,"",natebacon1
1428727,2023-10-24 17:22:57 -0700,2023-10-24 17:33:52 -0700,CANNOT ACCESS MY ATT SBCGLOBAL EMAILS ON THUNDERBIRD,"<p>THUNDERBIRD IS WORKING FOR MY G-MAILS BUT NOT MY ATT SBCGLOBAL EMAILS. PASSWORDS ON ATT SITE WAS PUT IN WHEN ASKED FOR EACH EMAIL IN THUNDERBIRD.  BUT INDICATES Login to server <a href=""http://inbound.att.net"" rel=""nofollow"">inbound.att.net</a> with username rudbusiness@sbcglobal.net failed. </p>",download-and-install_1;,thunderbird,download-install-and-migration,en-US,1613415;,astrorudy1rud
