id,created,updated,title,content,tags,product,topic,locale,answers,creator
1417496,2023-07-04 13:32:45 -0700,2023-07-04 13:32:45 -0700,Newgroups,<p>How can I delete a Newgroup? </p>,customize;,thunderbird,customize-controls-options-and-add-ons,en-US,"",luke378
1417494,2023-07-04 13:10:03 -0700,2023-07-04 13:10:03 -0700,Cannot Send Emails,"<p>Hello, Thank you for helping me out today. For some reason I cannot send emails anymore. I have been tinkering around with the outgoing server settings for a few hours and cannot seem to be able to figure this one out.  I am getting the following error message. <em>Sending of the message failed. </em> The message could not be sent because the connection to Outgoing server (SMTP) <a href=""http://smtp.charter.net"" rel=""nofollow"">smtp.charter.net</a> timed out. Try again.<em> </em> </p><p>This is the way my outgoing server is set up. <em><strong>smtp server</strong></em> DESCRIPTION; SPECTRUM SERVER NAME; <a href=""http://SMTP.CHARTER.NET"" rel=""nofollow"">SMTP.CHARTER.NET</a> PORT; 587 SECURITY AND AUTHENTICATION CONNECTION SECURITY; SSL/TLS AUNTHENTICATION METHOD; NO AUTHENTICATION USER NAME;  IS MYEMAIL ADDRESS </p><p>If you have any suggestions that you can share with me I would greatly appreciate it. </p><p>Thanks and have a great day..&nbsp;:) </p>",other;,thunderbird,other,en-US,"",AristotleNewton
1417493,2023-07-04 13:02:36 -0700,2023-07-04 13:29:47 -0700,Image attachments issue,"<p>I am new to TB. Using 102.12.0 (64-bit), Windows 11, and I am migrating from AOL Mail Browser (Firefox) using IMAP.   </p><p>So far, only one site has issues with their inline PNG image attachments, which display in AOL and IONOS Webmail without issue.  </p><p>My TB current settings: </p><p>In SETTINGS &gt; GENERAL &gt; CONFIG EDITOR &gt; are the following settings:  mail.inline_attachments = true mail.inline_attachments.text = true </p><p>In SETTINGS &gt; PRIVACY * SECURITY &gt; WEB CONTENT &gt; ACCEPT COOKIES FROM SITES &gt; EXCEPTIONS &gt; ADDRESS OF WEBSITE &gt; <a href=""http://cigna.com"" rel=""nofollow"">http://cigna.com</a> &gt; ALLOW </p><p>In EMAIL &gt; MENU (the hamburger in the upper right) &gt;  VIEW &gt; DISPLAY ATTACHMENTS INLINE is selected </p><p>Attached is a COMBINED screen capture from TB and AOL Mail Browser and IONOS Webmail; latter combined since they display the desired end result. </p><p>What steps do I need to get TB to display like AOL Mail Browser and IONOS Webmail? </p><p>Thanks in advance for your assistance. </p>",fix-problems;,thunderbird,fix-slowness-crashing-error-messages-and-other-problems,en-US,1588602;,hutch10
1417491,2023-07-04 12:34:36 -0700,2023-07-04 12:34:36 -0700,Thunderbird,<p>I am running Catalina 10.15.7 on my Mac. I tried deleting many emails at once (200+?) and the program froze. All I get now is the spinning wait cursor every time and I have to force close the program. </p>,crash;,thunderbird,emails-thunderbird,en-US,"",ragtr
1417489,2023-07-04 12:24:01 -0700,2023-07-04 12:24:01 -0700,No email content,"<p>I cannot view the contents of my emails on my Thunderbird account on my computer. I can view them on my phone. I upgraded Thuderbird, wish I knew the date! The updated version has never worked. I have been using the older version. Now the older version will show me my list of emails but no longer shows me the content of my emails. How do I correct this? Is there a way I can get rid of the newer version and reload the older version. Right now, I cannot use it at all on my computer. I am not technological at all! Please help. </p>",other;,thunderbird,other,en-US,"",tragan
1417484,2023-07-04 12:11:23 -0700,2023-07-04 13:27:41 -0700,Sync Outlook Contacts with TB,"<p>I'm brand new to TB, and a novice at this, so thank you for your patience. I'm running the latest version of TB on a Windows PC. I have an Outlook email account that holds all of my Contacts. I know I can import those Contacts into TB - export from my iPhone, save file, then Import into TB. But how do I sync my Contacts between TB and my Outlook account? Thank you for your responses. </p>",download-and-install_1;,thunderbird,download-install-and-migration,en-US,1588565;1588598;,OnTheRoadAgain
1417483,2023-07-04 12:09:48 -0700,2023-07-04 12:09:48 -0700,attachments appearing in email,<p>Hi </p><p>When I receive some attachments they don't show up as attachments but rather are incorporated in the email. in order to access them I have to go to gmail. See attached screen shot of a Word doc sent as an attachment </p>,other;,thunderbird,other,en-US,"",smithx57
1417480,2023-07-04 11:03:07 -0700,2023-07-04 11:57:38 -0700,Settings for reinstalling Thunderbird after Windows reinstall,<p><strong>are you able to help me set up Thunderbird after a catastrophic crash and windows reinstall please?</strong> </p>,download-and-install_1;,thunderbird,download-install-and-migration,en-US,1588554;,stone5
1417471,2023-07-04 09:28:31 -0700,2023-07-04 10:19:36 -0700,Forward CC filter,"<p>Is there any way to make a filter that forwards to an e-mail address and CC to another? There's no option in the filter menu, and if make two rules on the same filter to redirect to two different emails, they won't know that each received the e-mail, hence the CC requirement. </p><p>thank you in advance </p>",customize;,thunderbird,customize-controls-options-and-add-ons,en-US,1588551;,yellowmatter
1417469,2023-07-04 08:52:40 -0700,2023-07-04 08:52:40 -0700,Perfil / perfiles borrado accidental,"<p>Hola. Manejo Thunderbird Mail desde 2006 y en MACOS desde 2009, como conservo mucho el correo tengo dividido en perfiles. Hace unos días decidí eliminar uno de los perfiles y ocurrió que se borraron todos los perfiles todo el contenido de la carpeta desapareció, con una APP de recuperación pude ver que los archivos XXXXX.default seguían en su sitio, por razones de trabajo deje esta recuperación para mas tarde, pasados unos días los archivos ya no aparecen. 1… Están en el sistema y debo de buscar alguna aplicación de recuperación para salvarlos. 2…Ya se han eliminado directamente. 3…Están en otra carpeta diferente /User/Library/Thunderbird Sería bueno ver de que manera no pueda volver a ocurrir. Saludos Desde Barcelona / Catalunya / Europa </p>",other;,thunderbird,other,es,"",Jordi_Cleias
1417467,2023-07-04 08:41:41 -0700,2023-07-04 09:01:08 -0700,"T/B, when trying to send an email from T/B there is no SEND button on thr page",<p>I alway had a send button on this page how can Iget this page back please </p>,customize;,thunderbird,customize-controls-options-and-add-ons,en-US,1588538;,mickmar.7416
1417466,2023-07-04 08:24:46 -0700,2023-07-04 08:33:44 -0700,"nstmp files in Thunderbird - what do they do, and how can I delete them?","<p>Hello I have nstmp files in my Thunderbird account that are holding huge amount of emails. I think this is slowing down my computers overall operating speed. What function do these files serve, and how can I delete these files? Thank you </p>",other;,thunderbird,other,en-US,1588532;,vuts
1417452,2023-07-04 06:20:00 -0700,2023-07-04 10:18:34 -0700,Mailbox,"<p>I have a domain name registered with 123-reg with an e-mail.  Email options are forwarding (selected) or mailbox options (annual charge) </p><p>Am I able to use thunderbird as my mail box with just mail forwarding? I suspect the answer is only if I have the 123-reg mailbox, but I have to ask the Question! </p>",other;,thunderbird,other,en-US,1588550;,aesmorris79
1417450,2023-07-04 06:08:02 -0700,2023-07-04 06:08:02 -0700,"Filtering fails on specific filter, error dialog box is of no help, space seems to be the problem, random folder.","<p>I am running Windows 11 Home, TB version 102.12.0 64-bit. </p><p>Recurring problem on getting emails (POP3 only). </p><p>Randomly, at least once a week, I get an error pop-up stating the folder name and it can not be moved to it. Reason seemed to be space. I've got the specific Profile and folders on a 512GB SSD with over 100GB's free, so I know it isn't a space issue. </p><p>I discovered that if I Right Mouse Button on the folder, select Properties, and then select Run Repair (which is still gray, not highlighted) and close the Properties. I then run the specific filter that failed and I can see the mail moved from the Inbox, and no longer get the error? </p><p>Suspect a timing issue or something that might cause an interruption? </p><p>I've run SFC and DISM with no errors. </p><p>I've also uninstalled TB and reinstalled, but I did not change or delete the Profile or contents. </p><p>Once I thought maybe I had too many emails in a specific failing filter the error pointed to. I went to the folder and it had less that 100 mail in it, so I deleted some. Ran the filter and it still failed? </p><p>Suggestions? </p>",other;,thunderbird,other,en-US,"",irvspa
1417446,2023-07-04 05:18:19 -0700,2023-07-04 05:18:19 -0700,Google calendar events,"<p>I'm subscribed to a google calendar.  I can view the calendar using Thunderbird or using a web browser. When I add an event from Thunderbird, it appears on the web, but when I add an event on the web, it doesn't appear on Thunderbird, even after I manually ""sync"" the calendars.  I've found a clunky workaround; if I unsubscribe from the google calendar, and then subscribe again, the added events are displayed in Thunderbird.  Is there a simpler way to sync the calendars? </p>",calendar;,thunderbird,calendar,en-US,"",asb0656
1417445,2023-07-04 04:59:06 -0700,2023-07-04 04:59:06 -0700,Android,<p>olá.. existe alguma versão do Thunderbird para Android? </p>,other;,thunderbird,other,pt-BR,"",stredas
1417441,2023-07-04 04:24:36 -0700,2023-07-04 10:24:07 -0700,Dawn Earle,<p>I downloaded Thunderbird on the recommendation of a friend.  I already had a firefox account but the name was automatically put in Thunderbird with a name and email I haven't used in years and I can't figure out how to change the inserted name and bogus email which no longer exists to my firefox name. </p><p>I'm an old lady with not much understanding of tech so an explanation will need a step by step instruction to fix it.  Help? </p>,other;,thunderbird,other,en-US,1588552;,dawnearle
1417440,2023-07-04 03:10:44 -0700,2023-07-04 08:49:37 -0700,MANCATO ACCESSO SERVER,"<p>SALVE, NON RIESCO AD ENTRARE NELLA MIA MAIL IN QUANTOI MI VIENE CHIESTO DI INSERIRE LA PASSWORD E POI MI APPARE UNA SCRITTA CON RIPROVA/ANNULLA/INSERISCI UNA NUOVA PASSWORD. HO PROVATO AD INSERIRE UNA NUOVA PASSWORD MA NON RIESCO A LEGGERE LE MAIL . APPARE IL SEGUENTE AVVISO&nbsp;: ACCESSO AL SERVER <a href=""http://IMAP.STUDIOFARNESE.IT"" rel=""nofollow"">IMAP.STUDIOFARNESE.IT</a> UTENTE INFO@STUDIOFARNESE.IT NON RIUSCITO. RIPROVA/INSERIRE NUOVA PASSWORD/ANNULLA. </p>",other;,thunderbird,other,it,1588536;,farnese.silvia
1417439,2023-07-04 02:51:30 -0700,2023-07-04 02:51:30 -0700,An email account I delete comes back again,"<p>Hi. I have an old email account in Thunderbird that I no longer use. It is not my default account. I go to Tools / Account Settings, select the old account on the left hand side and use Account Actions to remove it. It then disappears from the left hand panel and all looks good. </p><p>BUT next time I start Thunderbird, it comes back again&nbsp;! </p><p>Does anyone have any tips for getting rid of it permenantly? </p><p>Many thanks, Alvin </p>",other;,thunderbird,other,en-US,"",alvin.roussel
1417435,2023-07-04 02:06:39 -0700,2023-07-04 08:45:50 -0700,l'app non funziona,"<p>Buongiorno, da questa mattina Mozilla Thunderbird non ci permette di ricevere e-mail, continua ad apparire l'avviso: ""Accesso al server <a href=""http://imaps.aruba.it"" rel=""nofollow"">imaps.aruba.it</a> con nome utente info@dilisiotrasporti.it non riuscito. Riprova / Inserire nuova password /Annulla"". Nonostante aver provato sia cliccando su ""Annulla"", sia su ""Riprova"" che su ""Imposta Nuova Password"" l'app continua a non funzionare, nonostante aver anche riavviato e spento il computer.  Abbiamo urgente bisogno di risolvere la problematica. </p>",fix-problems;,thunderbird,fix-slowness-crashing-error-messages-and-other-problems,it,1588511;1588535;,info9467
1417433,2023-07-04 01:06:52 -0700,2023-07-04 09:04:12 -0700,accesso thunderbird negato,"<p>All'apertura di Thunderbird l'accesso mi viene negato perchè l'accesso al server <a href=""http://imaps.aruba.it"" rel=""nofollow"">imaps.aruba.it</a> con il mio nome utente non riesce. L'errore è apparso improvvisamente senza cambiare nessun settaggio o password </p>",other;,thunderbird,other,it,1588539;,aurora.castagna
1417428,2023-07-03 22:42:02 -0700,2023-07-03 23:34:50 -0700,Trying to add Google CardDAV directory of contact fails validation,"<p>I tried to add as remote address book in Thunderbird a google account using CardDAV and providing the CardDAV URL, the Google username and the password and fails validation. From Log Viewer: </p><p>"" 2023.07.03 14:22:01:991&nbsp;: Validation module&nbsp;: Validating without discovery request on <a href=""https://www.googleapis.com/carddav/v1/principals/directory@swiss-property.ch/lists/default/"" rel=""nofollow"">https://www.googleapis.com/carddav/v1/principals/directory@swiss-property.ch/lists/default/</a> … 2023.07.03 14:22:02:070&nbsp;: Validation module&nbsp;: Impossible to parse the server response because of this line&nbsp;: { ^ 2023.07.03 14:22:03:015&nbsp;: Validation module&nbsp;: debug mode&nbsp;: cardbookServerDiscoveryRequest&nbsp;: 1 2023.07.03 14:22:03:017&nbsp;: Validation module&nbsp;: debug mode&nbsp;: cardbookServerDiscoveryResponse&nbsp;: 1 2023.07.03 14:22:03:018&nbsp;: Validation module&nbsp;: debug mode&nbsp;: cardbookServerDiscoveryError&nbsp;: 1 2023.07.03 14:22:03:019&nbsp;: Validation module&nbsp;: debug mode&nbsp;: cardbookServerValidation&nbsp;: [object Object] 2023.07.03 14:22:03:026&nbsp;: Validation module&nbsp;: Discovering phase 1 request on <a href=""https://www.googleapis.com/carddav/v1/principals/directory@swiss-property.ch/lists/default/"" rel=""nofollow"">https://www.googleapis.com/carddav/v1/principals/directory@swiss-property.ch/lists/default/</a> … 2023.07.03 14:22:03:078&nbsp;: Validation module&nbsp;: Impossible to parse the server response because of this line&nbsp;: { ^ 2023.07.03 14:22:04:048&nbsp;: Validation module&nbsp;: debug mode&nbsp;: cardbookServerDiscoveryRequest&nbsp;: 1 2023.07.03 14:22:04:051&nbsp;: Validation module&nbsp;: debug mode&nbsp;: cardbookServerDiscoveryResponse&nbsp;: 1 2023.07.03 14:22:04:055&nbsp;: Validation module&nbsp;: debug mode&nbsp;: cardbookServerDiscoveryError&nbsp;: 1 2023.07.03 14:22:04:056&nbsp;: Validation module&nbsp;: debug mode&nbsp;: cardbookServerValidation&nbsp;: [object Object] 2023.07.03 14:22:04:066&nbsp;: Validation module&nbsp;: Discovering phase 1 request on <a href=""https://www.googleapis.com/carddav/v1/principals/directory@swiss-property.ch/lists/default/.well-known/carddav"" rel=""nofollow"">https://www.googleapis.com/carddav/v1/principals/directory@swiss-property.ch/lists/default/.well-known/carddav</a> … 2023.07.03 14:22:04:099&nbsp;: Validation module&nbsp;: Impossible to parse the server response because of this line&nbsp;:  -----------^ 2023.07.03 14:22:05:077 : Validation module : debug mode : cardbookServerDiscoveryRequest : 1 2023.07.03 14:22:05:079 : Validation module : debug mode : cardbookServerDiscoveryResponse : 1 2023.07.03 14:22:05:080 : Validation module : debug mode : cardbookServerDiscoveryError : 1 2023.07.03 14:22:05:081 : Validation module : debug mode : cardbookServerValidation : [object Object] ""  I am using Thunderbird 102.12.0 (64-bit) on Ubuntu 22.04 LTS. Please note that I could do without problems exactly the same operation (exactly the same CardDAV URL, Google username and the password) about 2 months ago using a slightly older version of Thunderbird. Also just logging in in Google in Firefox with the username and the password of the remote address book works fine and I can see all the contacts.  So this problem looks like a bug introduced very recently in Thunderbird that was not happening 2 months ago or so. This makes Thunderbird unusable for me, so until this is fixed I will switch back to Evolution.  Please let me know when fixed or if you have another solution. Thanks.  </p>",other;,thunderbird,other,en-US,1588500;,valentin.brasov
1417425,2023-07-03 21:19:46 -0700,2023-07-03 22:19:37 -0700,reset password,"<p>I cannot reset my Thunderbird password  T/ bird froze last week. ...........My desk top is  windows 10 , lap top is windows 11 and samsung mob. The phone now has email access. I cannot get emails using Thunderbird on my computers at all.  I have always used T/bird . I am now on.version 102.12.00. My phone is back but not the computer nor laptop. I have tried clearing the cache. The new password will not hold  I can add the new password and get mail in and that is it. I cannot send any mail . I am temporarily using Bigpond mail.  Help please I am a senior lady going quietly batty trying to solve this issue.  Judy B </p>",other;,thunderbird,other,en-US,1588490;,scraps6
1417421,2023-07-03 19:03:41 -0700,2023-07-03 19:03:41 -0700,Default Settings for New Accounts?,<p>Is there a way to specify default settings for newly created accounts? </p><p>Or is it necessary to change the settings for each newly created account if I don't want the Thunderbird defaults? </p>,download-and-install_1;,thunderbird,download-install-and-migration,en-US,"",Toolworker
1417419,2023-07-03 17:48:34 -0700,2023-07-04 04:37:10 -0700,Empty Thunderbird Window,"<p>I started Thunderbird (version 102.12.0 64-bit) on my PC tonight (Windows 11 Pro 22H2). What I see is an empty window. Well, not entirely empty; it shows the menu bar, some of the toolbar buttons, and lines for the different panes of the Thunderbird window. But, there's nothing inside any of them.  </p><p>Also, many of the menu functions are disabled or grayed out. Two that aren't, are Tools &gt; Settings and Tools &gt; Account Settings, but clicking either of those does nothing. The three-line menu near the top-right also does nothing if I click on it.  </p><p>See attached screenshot of what this is all about.  </p><p>I've seen a few different solutions online. One is to delete the xulstore.json file in my Thunderbird profile directory. I did that (to be more precise, I renamed that file to xulstore.json.save). Didn't help.  </p><p>I also saw mention of somehow moving a profile between two different computers, which I don't think has anything to do with this situation. I have no idea what to do with that suggestion.  </p><p>I saw something about ""about:profiles"" which I have no idea how to pull up (I tried entering it into the bars at the top of the Thunderbird window and hitting Enter; nothing happened).  </p><p>About the only thing that even attempts to work at all, is Help &gt; Troubleshoot Mode, which I tried. And guess what; although it did restart Thunderbird in troubleshooting mode, that didn't help, either. Still the big empty window with 99% of functionality gone.  </p><p>I don't see an item in Help menu called ""Troubleshooting Information,"" but I do see ""More Troubleshooting Information."" Clicking on that also (guess what?) does nothing.  </p><p>Thunderbird's entry in Control Panel &gt; Programs and Features doesn't offer any ""repair"" option, so that's yet another dead end.  </p><p>Any ideas appreciated. But offhand it sure looks as though I'm SOL with Thunderbird. Guess I'll have to find a new email client, one that will actually, like, work. </p>",other;,thunderbird,other,en-US,1588492;1588517;,djhalnon
