id,question_id,created,updated,content,creator,is_spam,num_helpful,num_unhelpful
1820566,1583381,2026-05-23 17:07:27 -0700,2026-05-23 17:07:27 -0700,"<em><p>claude.blanchard50 <a href=""#question-1583381"" rel=""nofollow"">said</a></p></em> <blockquote>Hello, I have a Thunderbird shortcut on my desktop.  When I try to move the icon to the taskbar, it doesn't appear.  I'm running Windows 11 on a new PC (ASUS GALAXY 5 PRO). Thanks in advance. </blockquote>",claude.blanchard50,false,0,0
1820586,1583381,2026-05-23 18:17:36 -0700,2026-05-23 18:17:36 -0700,"<p>Try this:  - start thunderbird  - while running, right click and click 'pin to taskbar'  - let me know if that suffices.  thanks </p>",davidsk,false,0,0
1820588,1583381,2026-05-23 18:28:49 -0700,2026-05-23 18:28:49 -0700,"<p>Hello, Perfect thank you very much! </p>",claude.blanchard50,false,0,0
1820602,1583381,2026-05-23 20:23:02 -0700,2026-05-23 20:23:02 -0700,<p>Kewl! :) Always glad to assist. :) </p>,davidsk,false,0,0
1820703,1583381,2026-05-24 11:47:20 -0700,2026-05-24 11:47:20 -0700,<p>Thanks again </p>,claude.blanchard50,false,0,0
1820629,1583393,2026-05-24 01:37:33 -0700,2026-05-24 01:37:33 -0700,"<p>Can you find the messages with Global Search (Ctrl-K)? </p><p>Could have accidentally dragged the folder into another? </p><p>Is this an IMAP account, and if so, is it a remote folder or a Local Folder? </p><p>What is your anti-virus, if any, and have you checked to see if it quarantined the folder(s)? </p>",rednoise,false,0,0
1820714,1583395,2026-05-24 12:19:29 -0700,2026-05-24 12:19:29 -0700,"<p>There are no .sbd <strong>files</strong> in the Thunderbird profile but only .sbd <strong>file folders</strong> which contain message files (""mailbox"" or ""mbox"" files) A folder containing subfolders in Thunderbird is represented in the profile by an *.sbd folder and a mailbox (mbox) file without extension, having the same name as the .sbd file folder (I neglect the .msf file with the same name since it is an index file). So if you recovered the .sbd folder from your backup you probably should also have recovered the mailbox file having the same name. It is impossible to solve your issue without having a look on this folder hierarchy in the profile folder: please take a screen shot of the contents of the directory where this .sbd folder is located in the profile </p>",Mapenzi,false,0,0
1820717,1583395,2026-05-24 12:53:02 -0700,2026-05-24 12:53:02 -0700,"<p>Thanks for your reply. I must confess that I messed up and deleted the mbox files (without extension) by mistake.  Doing so removed all the folders that I created.   However, I searched around and was able to recreate the folder hierarchy in Local Folders so all is good with my folders now. So, my only issue now (and my original problem) are emails that I stored in these folders/subfolders that now I can't see.  I get ""No Message Found""  The interesting thing is that I can view messages stored this month (May) only but nothing else.  Messages stored from Jan - Apr of this year are not there. I've searched all around for date restrictions, filters etc and can't come up with anything. Did I mess up again? </p>",aszwarz,false,0,0
1820721,1583395,2026-05-24 13:20:18 -0700,2026-05-24 13:20:18 -0700,"<em><p>aszwarz <a href=""#answer-1820717"" rel=""nofollow"">said</a></p></em> <blockquote> I must confess that I messed up and deleted the mbox files (without extension) by mistake.  Doing so removed all the folders that I created.  </blockquote>  <p>No, removing an mbox file which is linked with the corresponding .sbd folder doesn't remove the folders you had created. The mbox files of those folders are still present in the .mbox folder! And you only need to create a new empty text file with a simple text editor and give it the same name...  and your folders will reappear. </p> <em><p>aszwarz <a href=""#answer-1820717"" rel=""nofollow"">said</a></p></em> <blockquote> So, my only issue now (and my original problem) are emails that I stored in these folders/subfolders that now I can't see.  I get ""No Message Found""   </blockquote> <p>Did you try a R-click on the faulty folder &gt; Properties &gt; Repair Folder ? </p> <em><p>aszwarz <a href=""#answer-1820717"" rel=""nofollow"">said</a></p></em> <blockquote> I've searched all around for date restrictions, filters etc and can't come up with anything. Did I mess up again? </blockquote> <p>As I said in my first answer: ""lost message"" problems can hardly be solved in classic help forums. One needs to have a look on the screen to be able to search in the Thunderbird profile; sometimes many screen shots can be helpful.` There is an add-on which allows to recover deleted messages:  ""Undelete"" (Recover accidentally deleted messages) <a href=""https://www.ggbs.de/extensions/Undelete.html"" rel=""nofollow"">https://www.ggbs.de/extensions/Undelete.html</a> but I doubt whether it would be useful in your case </p>",Mapenzi,false,0,0
1820738,1583395,2026-05-24 14:10:35 -0700,2026-05-24 14:10:35 -0700,"<p>Thanks for your response on the folder issue.  I wasn't clear.  I copied the sbd files from my external backup back into the proper directory on the C:  drive and all my folders/subfolders were restored. As for the emails, I may have found the issue. Under my email address/settings/Local Folders/Disk Space the option under Delete Messages Older than 30 days was highlighted (not be me).  So that's probably why I can only view current emails. I will change the setting but it looks like I'm toast for previous emails. </p><p>Thanks again for your help. </p>",aszwarz,false,0,0
1820752,1583395,2026-05-24 15:12:15 -0700,2026-05-24 15:14:25 -0700,"<p>If you haven't already compacted this folder you may try to recover the deleted (&gt; 30 days) messages with the add-on ""Undelete"" <a href=""https://www.ggbs.de/extensions/Undelete.html"" rel=""nofollow"">https://www.ggbs.de/extensions/Undelete.html</a> I just did the following test and took several screen shots: • in Account settings &gt; Disk Space of my POP account I activated the radio button  ◉ Delete messages more than 30 days • restarted TB to verify that messages &gt; 30d had been deleted (which was the case) • R-clicked on Inbox &gt; Undelete (image) • got a pop-up saying that 54 messages had been recovered to ""LocalFolders/Inbox_undeleted"" (image) • verified in Local Folders and found the folder containing 54 recovered messages (images) </p>",Mapenzi,false,0,0
1820767,1583395,2026-05-24 16:02:03 -0700,2026-05-24 16:02:03 -0700,"<p>I apologize. I think I've hit a brick wall. I can't find the ""undelete"" add on when searching Add on and Themes in Thunderbird. When I click the link that you've provided and try to open the xpi file it prompts me for an app to use.   I picked NotePad but that's when I hit the wall.  What do I do next?  How do I get it to work with Thunderbird? </p><p>Mapenzi...you don't need to respond because I don't want to waste all your time.  You've been very responsive to my issues and I appreciate all the help that you've provided. </p><p>Thank you. </p><p>Andre </p>",aszwarz,false,0,0
1820780,1583395,2026-05-24 16:23:55 -0700,2026-05-24 18:40:03 -0700,"<p>Andre, I have plenty of time and you won't waste it!  To download the add-on ""Undelete"" from <a href=""https://www.ggbs.de/extensions/Undelete.html"" rel=""nofollow"">https://www.ggbs.de/extensions/Undelete.html</a> R-click on ""Download latest version"" and choose ""Save target as..."" in the context menu. You'll get a file ""Undelete-current.xpi"" which you must import in the Add-ons Manager of your Thunderbird: open the Add-ons Manager, click on the cogwheel symbol, select ""Install Add-on From File"" and navigate to the add-on .xpi file you'd just downloaded.... </p>",Mapenzi,false,0,0
1820816,1583395,2026-05-24 20:26:19 -0700,2026-05-24 20:26:19 -0700,<p>Mapenzi </p><p>Everything worked out just fine.   I went through all my folders and recovered tons of emails.   Thank you so much for all your help and thanks for putting up with me. </p><p>Have a great day. </p><p>Andre </p>,aszwarz,false,0,0
1820819,1583395,2026-05-24 20:39:49 -0700,2026-05-24 20:39:49 -0700,<p>Thanks for your feedback! I'm glad I could help you. </p>,Mapenzi,false,1,0
1820603,1583396,2026-05-23 20:24:58 -0700,2026-05-23 20:24:58 -0700,"<p>Create a new address book and add the 20 contacts (by drag and drop), then make a filter with the rule From + is in my address book + &lt;name of new book&gt;.  Add new contacts to the book by clicking the star in the message header, twice, to select the target book. </p>",sfhowes,false,0,0
1820611,1583421,2026-05-23 22:10:12 -0700,2026-05-23 22:10:36 -0700,<p>P.S.: My TB just updated to 140.11.0esr (16 bit). </p>,Bartholo,false,0,0
1820851,1583421,2026-05-25 03:28:23 -0700,2026-05-25 03:28:23 -0700,"<p>It would have been helpful if you had just posted this as a reply on that topic. <a href=""https://support.mozilla.org/en-US/questions/1580858"" rel=""nofollow"">https://support.mozilla.org/en-US/questions/1580858</a> </p><p>From my perspective is do not need to be reading on two web pages at once to catch up and don't start typing in the weirdest places and make responses that are out of place in the wrong topic.  I am crazy enough,  without extra complications. </p><p>What we are seeing here is clearly a refusal by the comcast server to accept a commection from you.  Despite the dribble the Specrum support tech voiced.  It is a shame they do not employ humans with brains instead of AI that hallucinates and will regurgitate the corporate line regardless of evidence. </p><p>The server <a href=""http://mail.twc.com"" rel=""nofollow"">mail.twc.com</a> belongs to spectrum,  it is refusing your connection attempts.  Why is is doing that.  Only Spectrum know that answer as of now.  We can only speculate, guess and sometimes get information from connection logs. </p><p>It is logging that I am going to propose now. </p><p>Open the <a href=""/en-US/kb/config-editor"" rel=""nofollow"">Config Editor</a> and type in mailnews.pop3.loglevel or as much as you need to see it appear below. change the value of this hidden preference to ALL Now try the thing again and check the error console for the log.  Hopefully we will get specifics on that network error or refusal. </p><p>PS. TWC used to be very picky about connecting to their mail server,  you had to be using their connection to the internet.  I do not know about Spectrum.  Go on holiday and everything fails, or you can only read but not send mail.  This does translate forward to anyone using a VPN frequently having such issues as they do not appear to be connected to the internet from their ISP. </p><p>SO do you use one of those and it works occasionally when you have it off?  Or are you using wifi and sometimes your device connects to Spectrum on your service  and sometimes to the neighbors ISP.  Wifi is more than capable of just changing sources and if the Wifi connection is not secured you know nothing of it. </p>",MattAuSupport,false,0,0
1820986,1583421,2026-05-25 17:24:47 -0700,2026-05-25 17:24:47 -0700,"<p>Matt, thanks for your reply.  </p><p>At the moment, TB seems to be working OK (as I mentioned, my problem is very sporadic). After reading the stern warnings on the Config Editor page, I'll hold off on that for now, at least till my issue gets bad again. </p><p>One thing about Spectrum is that sometimes the reps can be helpful and at other times they're no help at all. Given that the problem here is that Spectrum's server (sporadically) refuses the TB connection, I may try my luck with Spectrum next time this acts up. Maybe I'll get lucky. </p><p>Andrew </p>",Bartholo,false,0,0
1820619,1583424,2026-05-23 23:33:54 -0700,2026-05-23 23:33:54 -0700,"<p>When you reset your Windows PC, you delete your files. </p><p>So, even when you reinstall Thunderbird - the emails where on the PC/ OS you have reseted, when you was using POP3. </p><p>So maybe <strong>you</strong> or your <strong>email provider</strong> has a <strong>backup</strong> - that's the only way.  </p><p>Or when you didn't used POP3, than your email are still on the server of your provider. Look on his Help-Page for a contact form or email-address. He'll need to know your email-address and maybe some further information, like customer number or else. </p><p>The alternative would be to complicate to explain here in simple words. </p><p>Hope I was helpful (and I'm sorry about your old emails) </p>",derNorden,false,0,0
1820686,1583424,2026-05-24 10:36:25 -0700,2026-05-24 10:36:25 -0700,"<em><p>Jan <a href=""#question-1583424"" rel=""nofollow"">said</a></p></em> <blockquote>I had to reset my Windows 10 computer and lost all apps and files.   </blockquote> <p>Do you have a folder ""Windows-old""? <a href=""https://support.microsoft.com/en-us/windows/retrieve-files-from-the-windows-old-folder-after-a-windows-upgrade-f668ada4-701b-204a-73c3-952bc5ceb1c8"" rel=""nofollow"">https://support.microsoft.com/en-us/windows/retrieve-files-from-the-windows-old-folder-after-a-windows-upgrade-f668ada4-701b-204a-73c3-952bc5ceb1c8</a> </p>",Mapenzi,false,0,0
1820726,1583438,2026-05-24 13:25:41 -0700,2026-05-24 13:25:41 -0700,"<p>Is this a POP account? If so, click 'account settings' and then click the 'server settings' pane for the account </p>",davidsk,false,0,0
1820732,1583438,2026-05-24 13:43:35 -0700,2026-05-24 13:55:58 -0700,"<p>Hello there col. </p><p><br> It seems you are unable to find the setting to prevent messages from being left on the server. Could I ask why you uninstalled the previous version of Thunderbird from that PC? </p><p>Can you provide more information? Do you use IMAP or POP accounts? </p><p><br> </p><p><br> <em><strong>Pop</strong></em> Right click on the email account in the left panel&gt;settings. And  now search for the server setting &gt; in there can you search for the settings &gt;leave message on the server&gt;uncheck that option. </p><p>The option is there to remember that you also can configure x days to select specific day limit.  </p><p><br> </p><pre><em><strong>Imap</strong></em> </pre> <p>Imap accounts constantly synchronise with the server, which means that copies are continuously stored on the server.  This feature cannot simply be turned on or off. Right-click on your email address and select 'Settings'. Then, under your account, click on 'Server Settings'. Under 'When I delete a message', choose either 'Move it to this folder: Trash' or 'Mark it as deleted'. </p><p><br> </p><p><br> </p><p><br> <em><strong>Note</strong></em>: <em><strong>Delete permanently</strong></em>  To permanently delete messages from the server, go to Server Settings &gt; Message Storage and check 'Empty Trash on Exit'. </p>",Googlethunderbird.,false,0,0
1820840,1583438,2026-05-25 00:40:15 -0700,2026-05-25 00:40:15 -0700,"<p>Many thanks for that reply...that was the problem, it is an IMAP account so that was the setting that I needed to change...it was frustrating as I couldn't find the ""remove from server"" setting that everyone had suggested... cheers col </p>",col.brokey,false,0,0
1821004,1583438,2026-05-25 19:53:00 -0700,2026-05-25 20:41:14 -0700,"<p>Hello there </p><p>Good , okay Can you ring that green bell for solved? </p><p>Thanks. </p>",Googlethunderbird.,false,0,0
1820725,1583449,2026-05-24 13:22:17 -0700,2026-05-24 13:22:17 -0700,"<p>Thunderbird is not rejecting your password, your email provider is. That may happen if the account is not set up properly. For example, people sometimes fail to put their full email address into the server settings pane, and that prevents the email provider from being able to confirm the account. You might check with <a href=""http://hctx.net"" rel=""nofollow"">hctx.net</a> to verify that your settings are correct, including port numbers and authentication requirements. Or, you could post screenshots of exactly what is in your server settings pane and SMTP server settings pane to see if anyone on this forum has suggestions. thank you. I included a screenshot that shows where to find that information. </p>",davidsk,false,0,0
1820740,1583449,2026-05-24 14:12:53 -0700,2026-05-24 14:12:53 -0700,"<p>David, thanks so much for the suggestions.  I have been in touch with <a href=""http://hctc.net"" rel=""nofollow"">hctc.net</a> and everything is OK there.  I've downloaded a new version of Thunderbird and that solved some of the problems, but I still have some issues.  I've run malware scans and rebooted the computer, but the new version is different and I'm still trying to figure out some other issues.  At least it recognizes the new password.  John </p>",holmes2jp,false,0,0
1820743,1583449,2026-05-24 14:23:19 -0700,2026-05-24 14:23:19 -0700,<p>I'm pleased that you're making progress. :) </p>,davidsk,false,0,0
1820653,1583456,2026-05-24 08:05:43 -0700,2026-05-24 08:05:43 -0700,<p>TB menu &gt; Account Settings &gt; account &gt; Copies &amp; Folders &gt; 'Place a copy in:' &gt; change from Sent folder to other and point it to Inbox. </p>,siffemoz,false,0,0
1820678,1583463,2026-05-24 10:10:37 -0700,2026-05-24 10:10:37 -0700,"<blockquote> Does clearing up disk space from this option(see image) delete the emails from server as well? </blockquote> <p>It depends on your account type - POP or IMAP? </p> <blockquote> I couldn't find the manual triggering of ""Compact Folders"". </blockquote> <p>Again, it depends on what you're trying to achieve. You can set a threshold in Settings, when compacting shall be triggered automatically. To compact a single folder, right-click the folder in the folder pane - Compact Folder. To compact all folders of an account, right-click the account in the folder pane - Compact All Folders </p>",christ1,false,0,0
1820654,1583477,2026-05-24 08:10:05 -0700,2026-05-24 08:10:31 -0700,"<p>Hi PD, this error is not related to the number of recipients in your email itself. Even when sending to a single recipient, the message “Policy-SCO1 You've reached your sending Limit” comes from your mail server, not from Mozilla Thunderbird. It usually means that your account has hit a temporary sending limit imposed by the email provider, for example due to too many messages sent in a short period, background or stuck messages being sent from the outbox, or security/rate-limiting protections triggered by the server. Sometimes hidden CC/BCC fields, mailing lists, or synced devices can also cause extra outgoing messages without it being obvious. To troubleshoot, check your Outbox and Sent folders for stuck or repeated emails, make sure no automatic CC/BCC rules or templates are adding recipients, and if possible try sending the same email via webmail to see if the issue also occurs there. If it does, the limitation is definitely server-side and not caused by Thunderbird. In that case, the best solution is usually to wait for the temporary limit to reset and contact your email provider to ask specifically about the “Policy-SCO1 sending limit” on your account. </p>",yulyabrylk,false,0,0
1820658,1583486,2026-05-24 08:54:15 -0700,2026-05-24 08:54:15 -0700,<p>我已经回退至 ESR 版本了 </p>,akarinliu,false,0,0
1820720,1583497,2026-05-24 13:17:16 -0700,2026-05-24 13:17:16 -0700,"<p>If the account was closed three years ago, any of his messages would likely be on the PC that he used. You might contact telkomsa to see if they retain archives from prior years. </p>",davidsk,false,0,0
1820746,1583528,2026-05-24 14:35:46 -0700,2026-05-24 14:43:31 -0700,"<p>Hello there Berman. </p><p><br> </p><p><br> Do you like to turn off threads to communicate better with your clients?okay. </p><p><em><strong>Thread fix</strong></em> Open Settings and select the General tab. Scroll down to the bottom and click Config Editor. Type mailnews.default_view_flags into the search bar. Double-click the preference and change its number value from \(1\) to \(0\). Click the checkmark or press Enter to save. </p><p><em><strong>Tip</strong></em> <a href=""https://support.mozilla.org/en-US/kb/message-threading-thunderbird"" rel=""nofollow"">https://support.mozilla.org/en-US/kb/message-threading-thunderbird</a> </p>",Googlethunderbird.,false,0,0
1820749,1583528,2026-05-24 14:48:53 -0700,2026-05-24 14:48:53 -0700,"<p>Sorry but it didn't work. I did restart Thunderbird and checked that there was now a 0 in that setting. But when I opened a message, five other messages opened with it. Thanks for trying. </p>",bermanart,false,0,0
1820775,1583528,2026-05-24 16:11:53 -0700,2026-05-24 16:11:53 -0700,<p>Hello there </p><p>it is possible that this one single map fix can work on this issue too. You might need to try this fix after the global fix didn't work well. </p><p><br> </p><p>For a single folder: Click on the folder (like your Inbox). Click View in the top menu bar (or the application menu button). Select Sort by and choose Threaded or Unthreaded. </p>,Googlethunderbird.,false,0,0
1820960,1583530,2026-05-25 15:47:18 -0700,2026-05-25 15:47:18 -0700,"<p>Which is your ""older"" Thunderbird version? How many messages does your IMAP inbox contain? Open ""Activity Manager"" whilst Thunderbird is downloading messages. Also go to Tools &gt; Developer Tools &gt; Error Console and explore possible errors </p>",Mapenzi,false,0,0
1820847,1583531,2026-05-25 01:44:31 -0700,2026-05-25 01:44:31 -0700,"<p>Ok so lets have a look at your settings at Google for what they do with mail that is to be deleted </p><p>Have a look in your settings here. <a href=""https://mail.google.com/mail/u/0/#settings/fwdandpop"" rel=""nofollow"">https://mail.google.com/mail/u/0/#settings/fwdandpop</a> </p><p>A move is an implied deletion from gmail, a copy it not.  So what happens with gmail impacts what you see in your Thunderbird IMAP syncronised Thunderbird account.  If the mail is still visible in the new mail at google for some reason when the filter executes 10 minutes later I would expect deduplications to occur. </p><p>It may also help to move the execution to after spam classification.  The default is before,  but I find the after works more reliably with IMAP as sometimes the filter kicks off before the antivirus has done it's messing around and the short delay remove that race condition.  It also allows slightly longer for other things that delay full download completing of the message body (required for spam classification but not filters) </p><p>BTW the stop filter execution command is mostly a nonevent.  I am sure it has value somewhere, but I don't see where. </p>",MattAuSupport,false,0,0
1820952,1583531,2026-05-25 15:08:02 -0700,2026-05-25 15:08:02 -0700,<p>Thanks for the quick reply - I checked my gmail settings. Here's what's there currently: </p><p>When I mark a message in IMAP as deleted: 	Auto-Expunge on - Immediately update the server. (default) X	Auto-Expunge off - Wait for the client to update the server. </p><p>When a message is marked as deleted and expunged from the last visible IMAP folder: X	Archive the message (default) 	Move the message to the Trash 	Immediately delete the message forever </p><p>It's not clear to me what they should be. Maybe change the Auto-Expunge to On? </p>,arw2104,false,0,0
1820763,1583538,2026-05-24 15:53:14 -0700,2026-05-24 15:53:14 -0700,"<p>R-click on your Trash folder &gt; Properties &gt; Retention policy .... and verify whether the radio-button ""Delete messages more then 30 days"" is activated (see image). If it is the Trash folder in an IMAP account the 30 days delay might be fixed by your email provider.  In this case log in to your webmail page and verify the retention policy. </p>",Mapenzi,false,0,0
1820783,1583538,2026-05-24 16:39:07 -0700,2026-05-24 16:39:07 -0700,"<p>My trash folder's ""Properties"" is not like yours; in mine there is no ""Retention Policies"", only ""General Information"", ""Synchronisation"", ""Sharing"" and ""Quota"". So I can't choose ""Retention Policies"".   My e-mail server is an ""IMAP-mail server"". But I can't find anything like Reention Policies there. </p>",B.O.,false,0,0
1820803,1583538,2026-05-24 18:50:05 -0700,2026-05-24 18:50:05 -0700,<p>My screen shot has been made in the Trash folder properties window in an IMAP account (see my new screen shot) </p>,Mapenzi,false,0,0
1820804,1583538,2026-05-24 19:01:24 -0700,2026-05-24 19:01:24 -0700,"<p>Here is a screen shot of my Trash folder properties window in my IMAP account (note that it is in DANISH LANGUAGE!).  I wonder why ""Retention Policies"" is missing. </p>",B.O.,false,0,0
1820811,1583538,2026-05-24 19:59:06 -0700,2026-05-24 19:59:06 -0700,"<p>This is rather odd.  Which OS and which Thunderbird version are you running? Is it a Thunderbird version you got from Microsoft? This is what I get for ""Properties"" of an IMAP Trash folder when I install the Dansk language pack (image) </p>",Mapenzi,false,0,0
1820812,1583538,2026-05-24 20:10:37 -0700,2026-05-24 20:25:06 -0700,"<p>I use Windows 11 and Thunderbird version 151.O (64 bit) which I downloaded from Mozilla Support (<a href=""https://support.mozilla.org/da/kb/installer-thunderbird-i-windows"" rel=""nofollow"">https://support.mozilla.org/da/kb/installer-thunderbird-i-windows</a>).  My trash folder didn't always delete emails after 30 days. Until a few months ago the folder kept all of my deleted emails. </p>",B.O.,false,0,0
