id,question_id,created,updated,content,creator,is_spam,num_helpful,num_unhelpful
1801904,1567428,2026-02-24 17:23:15 -0800,2026-02-24 17:23:15 -0800,"<p>Please provide more information on your situation. All email accounts need passwords, so I am unclear on what you want. thank you </p>",davidsk,false,0,0
1801902,1567429,2026-02-24 17:17:37 -0800,2026-02-24 17:17:37 -0800,"<p>I don't know what link you're referring to, but these steps work, assuming Windows:  </p><p><strong>BACKUP</strong> </p> <ol><li> ensure thunderbird is not running </li><li> enter %appdata% in search window on task bar and press Enter key </li><li> this should open windows file explorer in Appdata\roaming folder </li><li> highlight the Thunderbird folder and copy to external media  </li></ol> <p><strong>RESTORE</strong> </p> <ol><li> ensure thunderbird is installed and NOT running </li><li> enter %appdata% in search window on task bar and press Enter key </li><li> you should be in Appdata\roaming folder , copy&amp;paste the exported Thunderbird folder there. This will prompt to overwrite an existing folder of same name. allow it </li><li> start thunderbird and all should be there </li></ol>",davidsk,false,0,0
1801907,1567429,2026-02-24 17:32:56 -0800,2026-02-24 17:32:56 -0800,"<p>Thanks for your reply. Below is the attached screen I am referring to, which does not seem to work? </p>",nalag@46,false,0,0
1801909,1567429,2026-02-24 17:42:27 -0800,2026-02-24 17:42:27 -0800,"<p>That does not look like a product officially supported by Thunderbird. Do you recall where you got it? All I can state is that using a backup tool other than from Thunderbird has no guarantees, and persons on the support forum will not be able to assist. From my experience, the only  backup that works every time is one done using the OS's file management software. </p>",davidsk,false,0,0
1801918,1567429,2026-02-24 18:25:51 -0800,2026-02-24 18:25:51 -0800,"<p>I downloaded this from a website some years ago, assuming it was a recommended Mozilla backup product. I backed up my account then, but never had any reason to use it, and now that I have a new computer, it does not seem to work anymore, so I am glad I asked about it and will use the recommended OS.s file management software mentioned. Thanks for the advice. </p>",nalag@46,false,0,0
1801920,1567429,2026-02-24 18:53:30 -0800,2026-02-24 18:53:30 -0800,"<p>You're welcome. Also, should you have problems in a restore, it's easier to get help because the issue is simpler to address. :) </p>",davidsk,false,0,0
1801921,1567429,2026-02-24 18:55:30 -0800,2026-02-24 18:55:30 -0800,<p>One more thing: Thunderbird DOES have a backup and restore feature. It's at the tools&gt;export menu. But it has proved unreliable and problem-prone and difficult to recover from it. </p>,davidsk,false,0,0
1802065,1567443,2026-02-25 14:07:36 -0800,2026-02-25 14:07:36 -0800,<p>Just suggestions here that may (or may not) work:  </p> <ol><li> check to see name of Drafts folder that is in the subscribed listing for the account.  </li><li> check the 'copies&amp;folders' pane to verify that the Drafts folder is the same as in the subscribed listing  </li><li> rightclick on the draft folder to verify that it has the same name in properties as in subscribed listing </li><li> create a test message in draft to verify that the setting works.  </li></ol> <p>Comment: all drafts will appear in Allmail. </p>,davidsk,false,0,0
1801961,1567461,2026-02-25 00:35:21 -0800,2026-02-25 00:35:21 -0800,"<p>Are you entering the account password or an app password?  The latter is required for calendar sync. </p><p><a href=""https://support.apple.com/en-ca/102654"" rel=""nofollow"">https://support.apple.com/en-ca/102654</a> </p>",sfhowes,false,0,0
1801928,1567466,2026-02-24 19:51:43 -0800,2026-02-24 19:51:43 -0800,"<p>This post is a duplicate. Let's continue the discussion here: <a href=""https://support.mozilla.org/en-US/questions/1558777"" rel=""nofollow"">https://support.mozilla.org/en-US/questions/1558777</a> </p>",mozilla98,false,0,0
1801940,1567472,2026-02-24 21:06:24 -0800,2026-02-24 21:06:24 -0800,<p>Please clarify the issue. You mention Samson Mobile and Outlook. What is Thunderbird's responsibility here? </p>,davidsk,false,0,0
1801949,1567472,2026-02-24 22:02:43 -0800,2026-02-24 22:02:43 -0800,<p>Thunderbird is somehow connected to Outlook as is my Samsung phone. Apparently what I do in one affects the other. </p>,theoasis_1,false,0,0
1802052,1567488,2026-02-25 13:07:49 -0800,2026-02-25 13:07:49 -0800,"<p>Ça pourrait être un problème de réglage de l'espace disque dans les Paramètres de comptes &gt; Nom du compte &gt; Synchronisation et espace disque &gt; Espace disque (image) Mais ce réglage se fait séparément pour chaque compte et non pour l'ensemble des comptes dans Thunderbird. Cela pourrait aussi être un réglage du coté de l'hébergeur des comptes email Sinon, est-ce que tu as installé ces mêmes comptes sur un smartphone ou un iPad ? </p>",Mapenzi,false,0,0
1802053,1567488,2026-02-25 13:09:20 -0800,2026-02-25 13:09:20 -0800,<p>Check the 'synchronization&amp;storage' pane for each account to see if you have set it to delete messages older than 30 days. That's the only possibility I can think of. </p>,davidsk,false,0,0
1801960,1567491,2026-02-25 00:30:30 -0800,2026-02-25 00:30:30 -0800,"<p>See <a href=""https://support.mozilla.org/en-US/questions/1426872"" rel=""nofollow"">https://support.mozilla.org/en-US/questions/1426872</a> </p>",sfhowes,false,0,0
1801987,1567517,2026-02-25 08:15:25 -0800,2026-02-25 08:15:25 -0800,"<p>This is how I've always done it (Windows). It preserves your whole existing setup. </p><p>Copy TB files from the old PC  </p><p>- launch TB on the old PC </p><p>- go to TB menu &gt; Help &gt; Troubleshooting Information </p><p>- click the Application Basics &gt; Profile Folder 'Open Folder' button </p><p>- the profile folder will open </p><p>- navigate three levels up to the AppData\Roaming folder </p><p>- close TB </p><p>- copy the AppData\Roaming\Thunderbird folder to a flash drive </p><p>--- </p><p>Skip to 'Paste the copied TB files to the new PC', as you already installed TB and created a profile. </p><p>Install and launch TB on the new PC, then start setting up the new profile.  </p><p>- on the 'Set Up Your Existing Email Address' screen, enter name and email address only </p><p>- click the 'Configure manually' link </p><p>- scroll down and click 'Cancel' </p><p>- exit setup </p><p>- close TB </p><p>--- </p><p>Paste the copied TB files to the new PC </p><p>- open the AppData\Roaming folder like you did above </p><p>- delete the Thunderbird folder, or copy it somewhere if you want to save it </p><p>- replace it with the Thunderbird folder from the flash drive </p><p>- launch TB </p>",siffemoz,false,0,0
1801986,1567535,2026-02-25 08:12:24 -0800,2026-02-25 08:12:24 -0800,"<p>Try R. click Inbox &gt; Properties &gt; click 'Repair folder' button, then R. click Inbox &gt; Compact. </p>",siffemoz,false,0,0
1801985,1567556,2026-02-25 08:10:52 -0800,2026-02-25 08:10:52 -0800,<p>Should be doable - did you try TB menu &gt; Help &gt; About Thunderbird? </p>,siffemoz,false,0,0
1802063,1567563,2026-02-25 13:46:18 -0800,2026-02-25 13:46:18 -0800,"<p>First, you have provided no details that allow someone to investigate this. I suggest posting a screenshot of the SMTP server settings pane, plus screenshot of any error message. Please also provide detail on what you mean by the messages being in Sent folder, yet going nowhere. Thank you. I do not mean to imply that I have the solution; I only mean that nobody can assist without more information. thank you </p>",davidsk,false,0,0
1802061,1567577,2026-02-25 13:40:26 -0800,2026-02-25 13:40:26 -0800,"<p>I think this should work:  </p> <ol><li> install the 'importexporttools NG addon </li><li> highlight a desired folder, rightclick, and select importexport option to export as EML files  </li><li> repeat for all desired folders  </li><li> in Outlook, create a new folder and the drag the EML files to it </li></ol>",davidsk,false,0,0
1801984,1567586,2026-02-25 08:09:13 -0800,2026-02-25 08:09:13 -0800,<p>I'm not sure how you were seeing that in Options; it doesn't exist in v128 or 140 either. Use the toolbar icon. </p>,siffemoz,false,0,0
1801983,1567594,2026-02-25 08:05:11 -0800,2026-02-25 08:05:11 -0800,"<p>I answered your question at <a href=""https://support.mozilla.org/en-US/questions/1567344"" rel=""nofollow"">https://support.mozilla.org/en-US/questions/1567344</a>. Please continue there. </p>",siffemoz,false,0,0
1801997,1567601,2026-02-25 09:20:40 -0800,2026-02-25 09:20:40 -0800,"<p>Hai lo stesso problema in Modalità risoluzione dei problemi? -&gt; <a href=""https://support.mozilla.org/it/kb/modalita-risoluzione-problemi-thunderbird"" rel=""nofollow"">https://support.mozilla.org/it/kb/modalita-risoluzione-problemi-thunderbird</a> </p><p>Approssimativamente quanto è grande il tuo archivio di posta? </p><p>Più in generale, Per poter inquadrare il problema prova a fornire queste informazioni: </p> <ol><li> Versione di Thunderbird </li><li> Versione del sistema operativo </li><li> Provider delle caselle email (Gmail, Libero, Hotmail, etc.) </li><li> Tipologia di account (POP3, IMAP) </li><li> Estensioni installate </li><li> Messaggi di errore che vengono visualizzati durante l'utilizzo di Thunderbird </li><li> Software di sicurezza eventualmente presenti (Antivirus e simili) </li><li> Screenshot del problema (se utile a chiarire il contesto) </li></ol>",@next,false,0,0
1802049,1567604,2026-02-25 13:02:53 -0800,2026-02-25 13:02:53 -0800,"<p>Assuming Windows:  </p><p><strong>BACKUP</strong> </p> <ol><li> ensure thunderbird is not running </li><li> enter %appdata% in search window on task bar and press Enter key </li><li> this should open windows file explorer in Appdata\roaming folder </li><li> highlight the Thunderbird folder and copy to external media  </li></ol> <p><strong>RESTORE</strong> </p> <ol><li> ensure thunderbird is installed and NOT running </li><li> enter %appdata% in search window on task bar and press Enter key </li><li> you should be in Appdata\roaming folder , copy&amp;paste the exported Thunderbird folder there. This will prompt to overwrite an existing folder of same name. allow it </li><li> start thunderbird and all should be there </li></ol>",davidsk,false,0,0
1802035,1567610,2026-02-25 11:59:40 -0800,2026-02-25 11:59:40 -0800,"<p>If you open the Inbox file in Notepad and if you can still see the messages which Thunderbird no longer displays in the thread pane, that means that those messages are marked as deleted with a  X-Mozilla-Status: 0009 And as long as you don't compact the Inbox folder those messages cas still be recovered by changing the X-Mozilla-Status: to 0000 or 0001. Actually the easiest way to restore deleted messages is with the add-on ""Undelete""  <a href=""https://www.ggbs.de/extensions/Undelete.html"" rel=""nofollow"">https://www.ggbs.de/extensions/Undelete.html</a> </p><p>The other question is why those messages disappeared from your Inbox folder. For me this issue looks like an erroneous retention policy.  Do you use the same email account on another device or did you change your retention policy (Account Settings &gt; Synchronisation &amp; Storage &gt; Disk Space)? Or R-click on Inbox &gt; Properties &gt; Retention policy ...  </p><p>Also see this discussion <a href=""https://support.mozilla.org/en-US/questions/1566083"" rel=""nofollow"">https://support.mozilla.org/en-US/questions/1566083</a> </p>",Mapenzi,false,0,0
1802046,1567613,2026-02-25 12:54:29 -0800,2026-02-25 12:54:29 -0800,"<p><em>The email provider IONOS gives me the following error message: Sign-in on the server <a href=""http://imap.ionos.de"" rel=""nofollow"">imap.ionos.de</a> with the username ""<a href=""mailto:info@palion.de"" rel=""nofollow"">info@palion.de</a>"" failed. I can try again, set a new password, or cancel. I have spoken with IONOS, they promised help, but it will take some time. In the meantime, I am not receiving any emails on <a href=""mailto:info@palion.de"" rel=""nofollow"">info@palion.de</a> and wanted to forward the emails to <a href=""mailto:info@latea.de"" rel=""nofollow"">info@latea.de</a>. Is that possible? Send the replies to <a href=""mailto:info@latea.de"" rel=""nofollow"">info@latea.de</a>.</em> </p><p>Someone here who is familiar with the settings for IONOS may be able to assist you if you post screenshots of your 'server settings' pane and your SMTP server settings pane. </p>",davidsk,false,0,0
1802043,1567622,2026-02-25 12:42:28 -0800,2026-02-25 12:42:28 -0800,"<p><strong>FOR EXISTING FOLDERS</strong>	 These steps may help:  To set many *existing* folders, follow these steps: This must be done on an account by account basis. </p> <ol><li> select table view  - the icon just to right of 'quick filter' button above message list pane </li><li>  select a message folder and apply all desired attributes - View&gt;sort by from menu bar (if not shown, click alt key) </li><li>  click the icon at right side of column display in message list pane </li><li>  select the entry near bottom 'Apply current view to...' </li><li>  highlight 'folder and children' </li><li> move mouse left to see account name and move left again to display all account folders. Now CLICK. a small menu will appear to confirm setting all folders within that account. </li></ol> <p>I did a simple (okay, crude) video at <a href=""https://davidkirk.org/SettingDefaultFolderView.mp4"" rel=""nofollow"">https://davidkirk.org/SettingDefaultFolderView.mp4</a> </p>",davidsk,false,0,0
1802048,1567622,2026-02-25 13:01:46 -0800,2026-02-25 13:03:04 -0800,"<em><p>david <a href=""#answer-1802043"" rel=""nofollow"">said</a></p></em> <blockquote><strong>FOR EXISTING FOLDERS</strong>	 These steps may help:  To set many *existing* folders, follow these steps: This must be done on an account by account basis. <ol><li> select table view  - the icon just to right of 'quick filter' button above message list pane </li><li>  select a message folder and apply all desired attributes - View&gt;sort by from menu bar (if not shown, click alt key) </li><li>  click the icon at right side of column display in message list pane </li><li>  select the entry near bottom 'Apply current view to...' </li><li>  highlight 'folder and children' </li><li> move mouse left to see account name and move left again to display all account folders. Now CLICK. a small menu will appear to confirm setting all folders within that account. </li></ol>  I did a simple (okay, crude) video at <a href=""https://davidkirk.org/SettingDefaultFolderView.mp4"" rel=""nofollow"">https://davidkirk.org/SettingDefaultFolderView.mp4</a> </blockquote> <p>Thanks David,  I already do what you show in the video. Unfortunately, it doesn't solve the problem. <strong>NB: </strong>If it helps, the email accounts configured on my Thunderbird are Google Workspace accounts. </p>",l.amodei,true,0,0
1802051,1567622,2026-02-25 13:05:23 -0800,2026-02-25 13:05:23 -0800,"<em><p>david <a href=""#answer-1802043"" rel=""nofollow"">said</a></p></em> <blockquote><strong>FOR EXISTING FOLDERS</strong>	 These steps may help:  To set many *existing* folders, follow these steps: This must be done on an account by account basis. <ol><li> select table view  - the icon just to right of 'quick filter' button above message list pane </li><li>  select a message folder and apply all desired attributes - View&gt;sort by from menu bar (if not shown, click alt key) </li><li>  click the icon at right side of column display in message list pane </li><li>  select the entry near bottom 'Apply current view to...' </li><li>  highlight 'folder and children' </li><li> move mouse left to see account name and move left again to display all account folders. Now CLICK. a small menu will appear to confirm setting all folders within that account. </li></ol>  I did a simple (okay, crude) video at <a href=""https://davidkirk.org/SettingDefaultFolderView.mp4"" rel=""nofollow"">https://davidkirk.org/SettingDefaultFolderView.mp4</a> </blockquote> <p>Thanks David, I already do what you show in the video. Unfortunately, it only works immediately. Then the column display changes. <strong>NB:</strong> If it helps, the email accounts configured on my Thunderbird are Google Workspace accounts. </p>",l.amodei,false,0,0
1802055,1567622,2026-02-25 13:12:54 -0800,2026-02-25 13:12:54 -0800,"<p>What do you mean by ' it only works immediately. then the column display changes'? Are you stating that it works, but on a restart it reverts to prior setting? I am not an expert on this at all, but the more detail you provide, the better that someone else may see the thread. </p>",davidsk,false,0,0
1802057,1567622,2026-02-25 13:17:07 -0800,2026-02-25 13:17:07 -0800,"<em><p>david <a href=""#answer-1802055"" rel=""nofollow"">said</a></p></em> <blockquote>What do you mean by ' it only works immediately. then the column display changes'? Are you stating that it works, but on a restart it reverts to prior setting? I am not an expert on this at all, but the more detail you provide, the better that someone else may see the thread. </blockquote> <p>I already wrote in my first post: <em>However, the next day or a few days later, when I reopen the program, the column display changes. </em> Sometimes in the main folder (inbox), sometimes in the subfolders.<em></em> </p>",l.amodei,false,0,0
1802027,1567623,2026-02-25 10:50:54 -0800,2026-02-25 10:50:54 -0800,"<p>Hallo Floris, </p><p>normaliter zou dat niets uit moeten maken. In <a href=""/nl/kb/kan-geen-berichten-verzenden"" rel=""nofollow"">Kan geen berichten verzenden</a> staan mogelijke oorzaken en oplossingen, probeer eens of daar een passende oplossing bij staat? We horen het graag! </p>",markh2,false,0,0
1802041,1567624,2026-02-25 12:36:14 -0800,2026-02-25 12:36:14 -0800,"<p>I presume you use Windows. I am not familiar with OpenGPG keys, but this may be what you're seeking. Open windows file explorer, click the View&gt;show&gt;hidden items on menu bar </p>",davidsk,false,0,1
1802044,1567624,2026-02-25 12:45:21 -0800,2026-02-25 12:45:21 -0800,"<p>Thank you, David. </p><p>1. I do not use ""Losedows"". I have Thunderbird on a GNU computer. 2. I can find hidden files from Thunar (file explorer) or CLI. 3. The problem for me is that when Thunderbird opens the file explorer there is no view option. </p><p>If I can cp or link the key files to a Thunderbird location, it is a solution. Do you know? </p>",wxie2016,false,0,0
1802047,1567624,2026-02-25 12:57:32 -0800,2026-02-25 12:57:32 -0800,"<p>Sorry, I'm a Windows person. </p>",davidsk,false,0,0
1802042,1567632,2026-02-25 12:40:07 -0800,2026-02-25 12:40:07 -0800,<p>What happens when you R-click on the parent folder &gt; Reset Folder Order ? </p>,Mapenzi,false,0,0
1802045,1567642,2026-02-25 12:45:44 -0800,2026-02-25 12:45:44 -0800,"<p>First, I may not be able to assist, since you have provided no specifics. SO, I offer this comment: some email providers (such as Gmail and Gmx) require that you first authorize use of POP from within the online account. That may be your problem. </p>",davidsk,false,0,0
1802067,1567645,2026-02-25 14:16:18 -0800,2026-02-25 14:16:18 -0800,"<p>After using normail uninstall tool from operating system, the profile folder is still there.  </p> <ol><li> from windows desktop, enter %appdata% in search box and press enter </li><li> that should take you to the appdata\roaming folder. Delete the Thunderbird folder.   There may also be a Thunderbird folder at appdata\Local. Delete that one as well.  </li></ol> <p>The above steps assume user installed from <a href=""http://thunderbird.net"" rel=""nofollow"">thunderbird.net</a> </p>",davidsk,false,0,0
