id,created,updated,locale,product,title,is_solved,solution,solved_by,is_spam,last_answer,answers,topic,tags,creator,content,involved,is_archived,is_locked,is_taken,metadata,num_answers,num_votes_past_week,num_votes,taken_until,taken_by,updated_by
1583731,2026-05-25 17:07:14 -0700,2026-05-25 17:52:37 -0700,it,thunderbird,Un allegato PDF non viene visualizzato,false,,,false,1820988,1820988;,attachments,thunderbird-1510;windows-11;thunderbird;attachments;,dibarileonardo1,"<p>Una mail in particolare proveniente da ""<a href=""mailto:noreply.passaportonline@poliziadistato.it"" rel=""nofollow"">noreply.passaportonline@poliziadistato.it</a>"" non mostra la presenza di un allegato PDF. L'allegato sembra presente nel corpo della mail e questo di seguito é il suo header: </p><p>Content-Type: application/pdf; name=""Dichiarazione.pdf"" Content-Transfer-Encoding: base64 Content-Disposition: attachment; filename=""Dichiarazione.pdf"" Content-Description: Dichiarazione.pdf </p><p>E' un vecchio problema che sembrava risolto già  dalle versioni 9 e 11 ma pare si ripresenti nell'ultima versione 151.0 </p>",dibarileonardo1;@next;,false,false,false,";useragent:Mozilla/5.0 (Windows NT 10.0; Win64; x64) AppleWebKit/537.36 (KHTML, like Gecko) Chrome/148.0.0.0 Safari/537.36;tb_version:151.0 (64 bit);os:Windows 11",1,0,0,,,
1583732,2026-05-25 17:09:55 -0700,2026-05-25 17:21:28 -0700,en-US,thunderbird,how can i easily block certain spam messages,false,,,false,1820985,1820985;,junk-mail-and-spam,windows-11;thunderbird;junk-mail-and-spam;,bartfincke,"<p>i get nasty emails in my spam ,,a lot of them !  i have marked them as spam many times but i cant get them to stop.. please help </p>",bartfincke;davidsk;,false,false,false,";useragent:Mozilla/5.0 (Windows NT 10.0; Win64; x64) AppleWebKit/537.36 (KHTML, like Gecko) Chrome/138.0.0.0 Safari/537.36;os:Windows 11",1,0,0,,,
1583736,2026-05-25 17:31:15 -0700,2026-05-25 17:31:15 -0700,it,thunderbird,non riesco ad accedere alle mie email,false,,,true,,"",email-and-messaging,thunderbird-1510;windows-11;thunderbird;email-and-messaging;,rizzosg,<p><strong>testo in grassetto</strong> </p>,rizzosg;,false,false,false,";useragent:Mozilla/5.0 (Windows NT 10.0; Win64; x64) AppleWebKit/537.36 (KHTML, like Gecko) Chrome/148.0.0.0 Safari/537.36 Edg/148.0.0.0;tb_version:151.0;os:Windows 11",0,0,0,,,
1583738,2026-05-25 17:45:01 -0700,2026-05-25 17:57:39 -0700,en-US,thunderbird,controlling writing text size and sent textsize,false,,,false,1820989,1820989;,email-and-messaging,windows-11;thunderbird;email-and-messaging;,erniec1,"<p>the default font for writing texts is too small for me to easily read. Yet when I send the message the text size too large, How do I control these font sizes independently </p>",erniec1;davidsk;,false,false,false,;useragent:Mozilla/5.0 (Windows NT 10.0; Win64; x64; rv:151.0) Gecko/20100101 Firefox/151.0;tb_version:Version 128.7.1esr;os:Windows 11,1,0,0,,,
1583739,2026-05-25 17:47:47 -0700,2026-05-25 19:26:35 -0700,en-US,thunderbird,"Every email I have ever opened, but not unread emails have disappeared",false,,,false,1821000,1821000;,email-and-messaging,firefox-15101;firefox-1510;windows-10;thunderbird;email-and-messaging;,kholds,<p>Please give advice on how I may restore lost emails or at least stop them disappearing </p>,kholds;christ1;,false,false,false,;useragent:Mozilla/5.0 (Windows NT 10.0; Win64; x64; rv:151.0) Gecko/20100101 Firefox/151.0;ff_version:151.0.1;os:Windows 10,1,0,0,,,
1583741,2026-05-25 18:05:16 -0700,2026-05-25 18:05:16 -0700,en-US,thunderbird,"After changing some settings, all emails printed as plain text only, even past emails.",false,,,false,,"",customization,windows-11;thunderbird;customization;,cj23,"<p>I started setting up Thunderbird on May 8, after I got my new windows 11 computer. I added 6 of my most important email accounts (different providers). Today, I went through settings to make things better (I thought). Immediately after, all my email accounts (both current &amp; previous messages started printing in plain text only. I tried to fix by going to view, message body as...simple text, restart, then back to original HTML. Then, restart again. All this to no avail. I am sure it is a setting because until today, all were in HTML. </p>",cj23;,false,false,false,";useragent:Mozilla/5.0 (Windows NT 10.0; Win64; x64) AppleWebKit/537.36 (KHTML, like Gecko) Chrome/148.0.0.0 Safari/537.36;tb_version:May 7 or after. ??;os:Windows 11",0,0,0,,,
1583744,2026-05-25 18:23:08 -0700,2026-05-25 18:23:08 -0700,en-US,thunderbird,Cloutier728@gmail.com i cant get messages to my email cloutier728@email.com,false,,,false,,"",send-and-receive-email,android;thunderbird;send-and-receive-email;,ca.ca,"<p><a href=""mailto:Cloutier728@gmail.com"" rel=""nofollow"">Cloutier728@gmail.com</a> i need to add to my email <a href=""mailto:cloutier728@email.com"" rel=""nofollow"">cloutier728@email.com</a> </p>",ca.ca;,false,false,false,";useragent:Mozilla/5.0 (Linux; Android 10; Pixel 3 XL) AppleWebKit/537.36 (KHTML, like Gecko) Chrome/110.0.5481.65 Mobile Safari/537.36;os:Android",0,0,0,,,
1583747,2026-05-25 18:49:40 -0700,2026-05-25 18:59:10 -0700,en-US,thunderbird,I have lost access to my icloud email on Thunderbird.,true,1820997,rednoise,false,1820997,1820997;,passwords-and-sign-in,thunderbird-1510;thunderbird;passwords-and-sign-in;,jayoung3,"<p>When I try to access my email on Thunderbird, I keep getting the same message: Login to account ""<a href=""mailto:jayoung3@icloud.com"" rel=""nofollow"">jayoung3@icloud.com</a>"" failed Login to server <a href=""http://imap.mail.me.com"" rel=""nofollow"">imap.mail.me.com</a> with username jayoung3 failed. </p><p>I changed my password but I still can't access my email. And I have an account recovery code (which I don't know how to use). </p>",jayoung3;rednoise;,false,false,false,;useragent:Mozilla/5.0 (Macintosh; Intel Mac OS X 10.15; rv:151.0) Gecko/20100101 Firefox/151.0;tb_version:151.0;os:OS 14.8.7;solver_id:6857818,1,0,0,,,
1583755,2026-05-25 19:58:22 -0700,2026-05-26 00:30:00 -0700,en-US,thunderbird,"When trying to sign in to my Thunderbird email, I get the message to use my password, but I don't know of one so how do I fix this?",false,,,false,1821035,1821035;,passwords-and-sign-in,thunderbird-1500;beta;windows-11;thunderbird;passwords-and-sign-in;,jvdfedie,"<p>If I have a password to sign into my Thunderbird emails, where do I find it.  I haven't gotten this requirement in the past so where might I find it now and/or stop those messages? </p>",jvdfedie;rednoise;,false,false,false,;useragent:Mozilla/5.0 (Windows NT 10.0; Win64; x64; rv:151.0) Gecko/20100101 Firefox/151.0;tb_version:150.0b1;os:Windows 11,1,0,0,,,
1583756,2026-05-25 20:05:07 -0700,2026-05-25 21:26:13 -0700,en-US,thunderbird,Thunderbird desktop switched to ESR release erroneously. Why?,true,1821007,davidsk,false,1821020,1821007;1821010;1821018;1821019;1821020;,update,thunderbird-115101;thunderbird-11510;windows-11;thunderbird;update;,moz.defender447,"<p>My reddit post is here: <a href=""https://www.reddit.com/r/Thunderbird/s/lM11YcRIIT"" rel=""nofollow"">https://www.reddit.com/r/Thunderbird/s/lM11YcRIIT</a>  </p><p>Hello, </p><p>I'm confused and slightly concerned.  </p><p>Through no deliberate action by me, Thunderbird DOWNGRADED itself from the May 2026 standard release version to an AUGUST 2025 ESR(Extended Support Release) version.  </p><p>UPDATE: the next application restart brought the ESR version up to date, but why was I forced onto the ESR version?!  </p><p>What could have pissibly triggered this? I don't want or need ESR, and without knowing the cause, I have e no guarantee it won't happen again. Worst if all, everywhere I look, there is zero explanation for this. It appears to be fairly unprecedented.  </p><p>My original installer for 102.15.1 was downloaded from the official Thunderbird site in 2025.  </p><p>The sequence of events:  </p> <ul><li> I've had Thunderbird version 102.15.1 installed for awhile, but wasn't using it.  </li><li> Ysterday I opened it and connected an account.  </li><li> Today I noticed it hadn't auto-updated, so I went into the settings and clicked on the 'check for updates'.  </li><li> this brought it up to v115.10.1.  </li><li> Its success was demonstrated by me being sent to this URL after it opened: <a href=""https://www.thunderbird.net/en-US/thunderbird/115.0/whatsnew/?locale=en-US&amp;version=115.10.1&amp;channel=release&amp;oldversion=102.15.1"" rel=""nofollow"">https://www.thunderbird.net/en-US/thu.../?locale=en-US&amp;version=115.10.1&amp;channel=release&amp;oldversion=102.15.1</a>(<a href=""https://www.thunderbird.net/en-US/thunderbird/115.0/whatsnew/?locale=en-US&amp;version=115.10.1&amp;channel=release&amp;oldversion=102.15.1"" rel=""nofollow"">https://www.thunderbird.net/en-US/thunderbird/115.0/whatsnew/?locale=en-US&amp;version=115.10.1&amp;channel=release&amp;oldversion=102.15.1</a>) </li><li>  An hour later, I closed Thunderbird completely hoping it would fix a sync that appeared 'stuck'. </li><li> When I re-opened Thunderbird, I saw the small ""updating"" window. It was pretty surprising since I had *just* updated.  </li><li> After Thunderbird opens, after this additional ""update"", the URL that I'm sent to is this: <a href=""https://www.thunderbird.net/en-US/thunderbird/128.0/whatsnew/?locale=en-US&amp;version=128.14.0&amp;channel=esr&amp;oldversion=115.18.0"" rel=""nofollow"">https://www.thunderbird.net/en-US/thu.../?locale=en-US&amp;version=128.14.0&amp;channel=esr&amp;oldversion=115.18.0</a>(<a href=""https://www.thunderbird.net/en-US/thunderbird/128.0/whatsnew/?locale=en-US&amp;version=128.14.0&amp;channel=esr&amp;oldversion=115.18.0"" rel=""nofollow"">https://www.thunderbird.net/en-US/thunderbird/128.0/whatsnew/?locale=en-US&amp;version=128.14.0&amp;channel=esr&amp;oldversion=115.18.0</a>) </li><li> Thunderbird changed to a year old ESR version! </li></ul>",moz.defender447;davidsk;James;,false,false,false,";useragent:Mozilla/5.0 (Linux; Android 10; K) AppleWebKit/537.36 (KHTML, like Gecko) Chrome/148.0.0.0 Mobile Safari/537.36;tb_version:115.10.1;os:Windows 11;solver_id:7671979",5,0,0,,,
1583757,2026-05-25 20:08:21 -0700,2026-05-25 20:08:21 -0700,en-US,thunderbird,Help..  I accidentally trashed files under my email and I would like to get them back? recover them.,false,,,false,,"",send-and-receive-email,thunderbird-115180;thunderbird-11518;windows-7;thunderbird;send-and-receive-email;,dcran5,"<p>I was looking around my emails and when I thought I was trashing my junk emails in the trash bin it was my emails (that I keep)..  I hit trash and they were gone, tried the undo and is there any way to get them back, would like to find out.  I am a newbie to this kind of thing, so please be gentle when telling me what to do, also closed thunderbird and opened it up again, just wondering if someone out there can help me.  Thank you for your time in reading this. </p>",dcran5;,false,false,false,";useragent:Mozilla/5.0 (Windows NT 10.0; Win64; x64) AppleWebKit/537.36 (KHTML, like Gecko) Chrome/109.0.0.0 Safari/537.36;tb_version:115.18.0 (32 bit);os:Windows 7",0,0,0,,,
1583772,2026-05-25 21:05:29 -0700,2026-05-25 21:05:29 -0700,en-US,thunderbird,cant send emails following software update yesterday,false,,,false,,"",send-and-receive-email,windows-1011;thunderbird;send-and-receive-email;,david957,"<p>Emails taking for ever to send, seems to be looking for a folder, but outcome is that fails to send or show message as a draft, just gets lost </p>",david957;,false,false,false,;useragent:Mozilla/5.0 (Windows NT 10.0; Win64; x64; rv:140.0) Gecko/20100101 Thunderbird/140.11.0;tb_version:ersion 140.11.0esr;os:Windows 10/11,0,0,0,,,
1583774,2026-05-25 21:11:52 -0700,2026-05-25 21:11:52 -0700,it,thunderbird,Thunderbird no longer sends an account's mail,false,,,false,,"",send-and-receive-email,thunderbird-15002;thunderbird-1500;windows-10;thunderbird;send-and-receive-email;,ashuat,"<p>Hello, I use Thunderbird for some days. I have some accounts. My predefinite account is a gmail account. It worked wel still today, but today it fails to send mail.,Receives it, but does not send it. I'm worried because I don't know what to do. Yet it seems to me that it is configured well. On the web I receive mail but not with Thunderbird. I attach a photo that tells me he can't find the address. I also uninstalled Thunderbird and installed it again, but I have the same problem. Thanks for some info. </p>",ashuat;,false,false,false,;useragent:Mozilla/5.0 (Windows NT 10.0; Win64; x64; rv:151.0) Gecko/20100101 Firefox/151.0;tb_version:150.0.2 (64 bit);os:Windows 10,0,0,0,,,
1583779,2026-05-25 21:25:11 -0700,2026-05-26 00:15:21 -0700,en-US,thunderbird,12/31/1969 5:00 pm.  shows up at the bottom of my saved emails.,true,1821034,rednoise,false,1821034,1821034;,email-and-messaging,thunderbird-1510;windows-11;thunderbird;email-and-messaging;,geminiguy53,"<p>Hello.  Something strange happens in my emails.  I read and/or delete an email and then at the bottom of any saved emails, the following shows up: no ""from"", no ""subject"" and no ""recipient.  It only shows 12/31/1969 5:00 pm.  It is almost impossible to delete it.  If I am lucky, it might finally disappear after closing Thunderbird and starting it again, several times.  Becoming very much a nuisance.  Thank you. </p>",geminiguy53;rednoise;,false,false,false,";useragent:Mozilla/5.0 (Windows NT 10.0; Win64; x64) AppleWebKit/537.36 (KHTML, like Gecko) Chrome/148.0.0.0 Safari/537.36;tb_version:151.0;os:Windows 11;solver_id:1946859",1,0,0,,,
1583799,2026-05-26 01:11:44 -0700,2026-05-26 01:11:44 -0700,en-US,thunderbird,Authentication error when migrating Yahoo mail to Thunderbird,false,,,false,,"",passwords-and-sign-in,thunderbird-1510;windows-11;thunderbird;passwords-and-sign-in;,nmP264h,"<p>Hello, Previously, I had my email with Xfinity, but they stopped this service and set us to Yahoo Mail. I’ve had no luck in setting it up in Outlook, so I tried Thunderbird and encountered the same problem. I have Windows 11. I’m using the IMAP settings recommended by Yahoo. During the setup process, everything checks, but when it asks for an address, which is from Xfinity, and a password, which I’m not sure they’re asking for so I tried the Xfinity, Yahoo, and Mozilla passwords. I get the authentication error on each attempt. Help! Thanks, Parris </p>",nmP264h;,false,false,false,";useragent:Mozilla/5.0 (Windows NT 10.0; Win64; x64) AppleWebKit/537.36 (KHTML, like Gecko) Chrome/148.0.0.0 Safari/537.36;tb_version:151.0;os:Windows 11",0,0,0,,,
1583801,2026-05-26 01:39:10 -0700,2026-05-26 07:44:47 -0700,en-US,thunderbird,"There's a frightening ambiguity in the ""add new account"" page please help",false,,,false,1821062,1821040;1821043;1821057;1821062;,accounts,windows-10;thunderbird;accounts;,45rpm,"<p>Hello.  I am trying to add a new provider, which means adding a new account.  When I click ""Add new account"" it takes me to a page that asks me to enter my existing account.  Does this mean the currently running account or the new account? </p>",45rpm;wxie2016;,false,false,false,;useragent:Mozilla/5.0 (Windows NT 10.0; Win64; x64; rv:144.0) Gecko/20100101 Firefox/144.0;tb_version:144.0.2;os:Windows 10,4,0,0,,,
1583802,2026-05-26 01:41:23 -0700,2026-05-26 03:29:29 -0700,en-US,thunderbird,"thunderbird is doubling my outgoing (sent) email, why?",false,,,false,1821038,1821038;,send-and-receive-email,thunderbird-1510;windows-10;thunderbird;send-and-receive-email;,bigben232323,"<p>Every time I send a message, it duplicates itself.  Any help in removing this problem in the settings will be appreciated.  Please keep in mind I'm not that savvy with settings so if you can keep this simple like me, that would be great.  I'm using version 151.0 64-bit on Windows 10.  Hopefully someone be able to help me resolve this problem. </p><p>Thank you, Joe </p>",bigben232323;wxie2016;,false,false,false,";useragent:Mozilla/5.0 (Windows NT 10.0; Win64; x64) AppleWebKit/537.36 (KHTML, like Gecko) Chrome/148.0.0.0 Safari/537.36 Edg/148.0.0.0;tb_version:151.0;os:Windows 10",1,1,1,,,
1583804,2026-05-26 01:46:20 -0700,2026-05-26 01:46:20 -0700,en-US,thunderbird,"shall I get rid of you? stop with the we think this is junk crap begging for more money, lmk, i've given more than a years worth, more than my other email subscriptions, lmk, stop the we think this is junk crap",false,,,false,,"",junk-mail-and-spam,thunderbird-140102;thunderbird-14010;linux;thunderbird;junk-mail-and-spam;,anthony.williams763,"<p>I get your begging for money, you are obviously young, I have donated more money to you already than all my other email providers combined, period, you will allow me to move , remove as much as I want or I can delete you and you lose any future donations, but ticking me off with this we think this is junk crap trying to get more money from me only makes me want to DELETE YOU YOUNG PEOPLE, you act just like your buddy Google, lmk Anthony, or stop the bs </p>",anthony.williams763;,false,false,false,";useragent:Mozilla/5.0 (X11; Linux x86_64) AppleWebKit/537.36 (KHTML, like Gecko) Chrome/148.0.0.0 Safari/537.36;tb_version:140.10.2esr;os:Linux",0,0,0,,,
1583807,2026-05-26 02:20:20 -0700,2026-05-26 02:20:20 -0700,en-US,thunderbird,"so I guess you are Google people trying to blackmail me for money, I'll stick with real ESPs, byeeeeee",false,,,true,,"",email-and-messaging,thunderbird-140102;thunderbird-14010;linux;thunderbird;email-and-messaging;,anthony.williams763,"<p>I won't be harrassed young people, nor blackmailed for more money, nice try but your false advertising and statements bought you a class action, I've been screen recording this, you do not limit my usage, period, I'm to old for this crap, byeeeeeeee </p>",anthony.williams763;,false,false,false,";useragent:Mozilla/5.0 (X11; Linux x86_64) AppleWebKit/537.36 (KHTML, like Gecko) Chrome/148.0.0.0 Safari/537.36;tb_version:140.10.2esr;os:Linux",0,0,0,,,
1583810,2026-05-26 02:36:06 -0700,2026-05-26 03:20:52 -0700,en-US,thunderbird,please direct me to your user guide. I've looked all over and don't see anything close.,false,,,false,1821037,1821037;,email-and-messaging,thunderbird-140102;thunderbird-14010;linux;thunderbird;email-and-messaging;,saroj3,"<p>None of your ""topics"" addresses my issue at all. Where is your user manual? I'm trying to figure out how your ""retention"" works. Also how to get a message filter to run on a specific folder daily. </p><p>Thanks, Saroj Gilbert </p>",saroj3;wxie2016;,false,false,false,;useragent:Mozilla/5.0 (X11; Linux x86_64; rv:150.0) Gecko/20100101 Firefox/150.0;tb_version:140.10.2esr (64-bi;os:Linux,1,0,0,,,
1583814,2026-05-26 03:18:09 -0700,2026-05-26 03:18:09 -0700,en-US,thunderbird,update to email on 5/19/26 and I am unable to pull new emails past that date. I also get doubles of emails from 5/18 and 5/19,false,,,false,,"",send-and-receive-email,windows-11;thunderbird;send-and-receive-email;,cathy.shiner,<p>update to email on 5/19/26 and I am unable to pull new emails past that date. I also get doubles of emails from 5/18 and 5/19 </p>,cathy.shiner;,false,false,false,";useragent:Mozilla/5.0 (Windows NT 10.0; Win64; x64) AppleWebKit/537.36 (KHTML, like Gecko) Chrome/148.0.0.0 Safari/537.36;tb_version:140.11.oesr;os:Windows 11",0,0,0,,,
1583817,2026-05-26 03:30:07 -0700,2026-05-26 03:30:07 -0700,en-US,thunderbird,Calendar Unavailable After Import Attempt,false,,,false,,"",calendar,thunderbird-1510;windows-11;thunderbird;calendar;,maxsros,<p>Exported ical file from Google Calendar and then went to import into Thunderbird. This previously worked in the same installation. The import failed and the error console displayed the attached message. Restarted Thunderbird. Calendar showed ready and is not read only. Same problem. </p>,maxsros;,false,false,false,";useragent:Mozilla/5.0 (Windows NT 10.0; Win64; x64) AppleWebKit/537.36 (KHTML, like Gecko) Chrome/148.0.0.0 Safari/537.36;tb_version:151.0 (64 bit);os:Windows 11",0,0,0,,,
1583821,2026-05-26 03:53:20 -0700,2026-05-26 03:53:20 -0700,en-US,thunderbird,cc attached to an email sent to my mechanic that I did not include,false,,,false,,"",send-and-receive-email,thunderbird-15002;thunderbird-1500;windows-11;thunderbird;send-and-receive-email;,ntra9236,"<p>I sent an email to my mechanic today and another site attached  a CC to their Website. It is weird I didn't send an email to them <a href=""mailto:support@bloominto.co"" rel=""nofollow"">support@bloominto.co</a>, yet I received a reply and there was a CC to my mechanic in it. </p><p>How is it possible? </p>",ntra9236;,false,false,false,";useragent:Mozilla/5.0 (Windows NT 10.0; Win64; x64) AppleWebKit/537.36 (KHTML, like Gecko) Chrome/148.0.0.0 Safari/537.36;tb_version:150.0.2(64bit);os:Windows 11",0,0,0,,,
1583826,2026-05-26 04:16:42 -0700,2026-05-26 04:16:42 -0700,en-US,thunderbird,how to send spam straight to the spam folder,false,,,false,,"",junk-mail-and-spam,thunderbird-1510;windows-11;thunderbird;junk-mail-and-spam;,brisbane59,"<p>Hi Team, I right click on a message header and select ""mark as spam"" which then deletes it but it will let another message from the same place in at a later date, is there a way to have the messages I mark as spam go straight to the spam folder? </p><p>Thanks, regards Steve </p>",brisbane59;,false,false,false,";useragent:Mozilla/5.0 (Windows NT 10.0; Win64; x64) AppleWebKit/537.36 (KHTML, like Gecko) Chrome/148.0.0.0 Safari/537.36 Edg/148.0.0.0;tb_version:151.0;os:Windows 11",0,0,0,,,
1583830,2026-05-26 05:03:13 -0700,2026-05-26 05:03:13 -0700,en-US,thunderbird,"Ich komme nicht mehr in mein Thunderbird, da ich die App gelöscht hatte und das Passwort angeblich nicht stimmt.",false,,,false,,"",reset-passwords,windows-11;thunderbird;reset-passwords;,mbitzl,"<p>Ich kam nicht mehr in mein Thunderbird. Es hieß immer, dass ich das Passwort brauche. Dieses wurde aber nicht akzeptiert. Bin Laie in den technischen Dingen. Habe die App deinstalliert, da ich mir sicher war, dass das Passwort das richtige ist. Nun wollte ich die App neu intallieren, aber dazu soll ich das Passwort eingeben. Wahrscheinlich hatte ich es doch mal geändert, kann mich aber nicht erinnern, da ich es ja nie mehr brauchte. Jetzt komme ich auf gar nichts mehr, da man das PAsswort eingeben muss und ich erst gar nicht in Thunderbird komme. Wäre aber sehr wichtig, da hier all meine Mails gespeichert sind. </p>",mbitzl;,false,false,false,;useragent:Mozilla/5.0 (Windows NT 10.0; Win64; x64; rv:150.0) Gecko/20100101 Firefox/150.0;tb_version:keine Ahnung;os:Windows 11,0,0,0,,,
1583831,2026-05-26 05:25:36 -0700,2026-05-26 05:53:20 -0700,it,thunderbird,Provo a configurare Thunderbird ma il quadro e' oltre lo screen senza possibilita' di rimpicciolire.  Cosa fare??,false,,,false,1821046,1821046;,performance-and-connectivity,thunderbird-1510;windows-11;thunderbird;performance-and-connectivity;needsinfo;,francoitalia51,<p>Non riesco a configurare Thunderbird dopo la finestra dove mi chiede di inserire un nome e l'email.  Al comando 'continua' la pagina si ingrandisce senza possibilita' di portarla alla misura dello schermo.  La pagina 'distorta' mi sta chiedendo presumo l'inizio della configurazione vera e propria in quanto riesco a capire che mi sta chiedendo le credenziali per l'accesso a Yahoo mail. </p>,francoitalia51;@next;,false,false,false,;useragent:Mozilla/5.0 (Windows NT 10.0; Win64; x64; rv:151.0) Gecko/20100101 Firefox/151.0;tb_version:151.0;os:Windows 11,1,0,0,,,
1583833,2026-05-26 05:54:58 -0700,2026-05-26 05:54:58 -0700,it,thunderbird,tunderbirds dopo aver compattato le cartelle e cancellato della posta è diventato molto lento sia nella lettura della posta e nello scorrere,false,,,false,,"",crashing-and-slow-performance,thunderbird-140110;thunderbird-14011;windows-11;thunderbird;crashing-and-slow-performance;,enricocanel,"<p>tunderbirds è diventato lentissimo in tutte le sue funzioni : nel caricare la posta , nella lettura e nel scrolling. Funziona quasi a salti come se ci fosse qualcosa che lo ferma. </p>",enricocanel;,false,false,false,;useragent:Mozilla/5.0 (Windows NT 10.0; Win64; x64; rv:151.0) Gecko/20100101 Firefox/151.0;tb_version:140.11.0 esr 64bit;os:Windows 11,0,0,0,,,
1583840,2026-05-26 06:53:02 -0700,2026-05-26 08:03:31 -0700,en-US,thunderbird,How to delete ...,false,,,false,1821069,1821069;,junk-mail-and-spam,thunderbird-1510;windows-11;thunderbird;junk-mail-and-spam;,rowandow66,<p>How to delete double Junk box from Thunderbird 151.0 ? </p>,rowandow66;siffemoz;,false,false,true,";useragent:Mozilla/5.0 (Windows NT 10.0; Win64; x64; rv:151.0) Gecko/20100101 Firefox/151.0;tb_version:151.0;os:Windows 11;kb_visits_prior:[""/en-US/kb/thunderbird-and-junk-spam-messages""]",1,0,0,2026-05-26T01:12:56.295375-07:00,"{""username""=>""siffemoz"", ""display_name""=>""Ed"", ""avatar""=>""https://profile.accounts.firefox.com/v1/avatar/s""}",
1583845,2026-05-26 07:56:38 -0700,2026-05-26 07:56:38 -0700,en-US,thunderbird,Lost Correspondence in Sub folders,false,,,false,,"",email-and-messaging,thunderbird-140110;thunderbird-14011;windows-11;thunderbird;email-and-messaging;,hubert.fratczak,"<p>Good morning,  </p><p>this morning, after logging into my Thunderbird account, all my subfolders from my main account were in the ""Trash"" folder, and there was no correspondence in them. Folders named ""V 2"" also appeared in the Trash folder. Could you please advise if it's possible to restore these correspondence and folders to their previous state? I also tried using the ""repair folder"" function, but it didn't work. </p><p><br> Best regards and have a nice day. </p>",hubert.fratczak;,false,false,false,";useragent:Mozilla/5.0 (Windows NT 10.0; Win64; x64) AppleWebKit/537.36 (KHTML, like Gecko) Chrome/148.0.0.0 Safari/537.36;tb_version:140.11.0esr;os:Windows 11;kb_visits_prior:[""/pl/kb/porzadkowanie-folderow-potencjalne-komplikacje""]",0,0,0,,,
