id,question_id,created,updated,content,creator,is_spam,num_helpful,num_unhelpful
1820929,1583538,2026-05-25 14:18:48 -0700,2026-05-25 14:18:48 -0700,"<p>In Thunderbird there are only a few ways to set up emptying of Trash. </p> <ul><li> Right click on folder and select 'Properties' </li><li> On 'Retention policy'  tab </li><li> select 'Use my account settings'  - (where you can set up preferences) </li><li> or override on this particular folder </li><li> uncheck 'Use my account settings' </li><li> select eg: 'Delete messages more than eg: 30 days old' </li><li> click on 'OK' </li></ul> <p>I'm not sure why you do not see this option. It's not new - it's been around for decades. Maybe this is particular to the Danish version. I'll have to see if this has been reported as a bug. </p><p>In Thunderbird </p> <ul><li> Account Settings &gt; Server Settings </li><li> under 'Message Storage </li><li> Select checkbox 'Empty Deleted folder on Exit'  - if desired, uncheck if not desired. </li></ul> <ul><li> Account Settings &gt; Synchronisation &amp; Storage for the account </li><li> Select 'Don't delete any messages' - if desired. </li><li> OR Select 'Delete messages more than eg:30 days - if desired. </li></ul> <p>However, I would like to draw your attention to the following: Many servers now auto remove/delete any emails that are selected as unwanted and put in Trash after a specific number of days.  The number of days varies between servers. Gmail does it after 30 days - I believe yahoo empty every 10 days, spectrum auto empty every 3 days. </p><p>Yousee may also auto empty the trash. As you use Imap, the folders synchronise so an imap folder can only display whatever is on the server. </p>",Toad-Hall,false,0,0
1820937,1583538,2026-05-25 14:33:54 -0700,2026-05-25 14:33:54 -0700,"<p>Thunderbird official website to get download/installation <a href=""https://www.thunderbird.net/en-US/thunderbird/all/"" rel=""nofollow"">https://www.thunderbird.net/en-US/thunderbird/all/</a> </p><p>For Danish you would need to select:  Locale: Dansk </p><p>It might be worth uninstalling Thunderbird and getting a fresh download from the above link to see if the 'Retention Policy' tab then appears in the 'Properties' of selected folder. </p>",Toad-Hall,false,0,0
1820946,1583538,2026-05-25 14:50:43 -0700,2026-05-25 15:00:41 -0700,"<p>Thank you for your suggestions, Toad-Hall, </p><p>I made a fresh download from the link you gave me, but there is still no 'Retention policy' tab in the 'Properties' of the trash folder. As you suggested, in ""Server Settings"" under ""Message Storage"" I have changed the selection ""Don't delete any messages"" to ""Delete messages more than"" and I have put in:  ""10000"" days (!!), which I hope will work. </p>",B.O.,false,0,0
1820953,1583538,2026-05-25 15:10:17 -0700,2026-05-25 15:10:17 -0700,"<em><p>Bo <a href=""#question-1583538"" rel=""nofollow"">said</a></p></em> <blockquote>My trash folder deletes my emails after just 30 days.  </blockquote> <p>Did you install the same email address on a smartphone or an iPad? If this is the case the Trash messages might be deleted by the server of your smartphone mail client.  I already have asked you to verify retention policy on your webmail. </p>",Mapenzi,false,0,0
1820955,1583538,2026-05-25 15:22:29 -0700,2026-05-25 15:22:29 -0700,"<em><p>Bo <a href=""#answer-1820946"" rel=""nofollow"">said</a></p></em> <blockquote>Thank you for your suggestions, Toad-Hall,  I made a fresh download from the link you gave me, but there is still no 'Retention policy' tab in the 'Properties' of the trash folder. </blockquote> <p>Thanks for trying. I'll see if I can find out more on that. </p> <blockquote> As you suggested, in ""Server Settings"" under ""Message Storage"" I have changed the selection ""Don't delete any messages"" to ""Delete messages more than"" and I have put in:  ""10000"" days (!!), which I hope will work. </blockquote> <p>The 'Don't delete any messages' would work, but you are talking about the Trash folder and an imap account, so that means emptying of the TRash can be done via anything that connects to server eg: another computer or phone OR and most likely by the server itself.  That will override any setting in AccountSettings because it's done on the server external to your Thunderbird imap account.  You would need to find out if you have a phone connecting to server that's set up to clear TRash. You also need to find out if the 'yousee' server auto deletes emails after a certain period. Is there a setting in the  webmail account that controls when it empties the Trash and the Spam? </p><p>Please remember,  you should not be storing wanted emails in the Trash, it's designed as a place to put mail that's no longer wanted. </p>",Toad-Hall,false,0,0
1820963,1583538,2026-05-25 15:51:52 -0700,2026-05-25 16:30:15 -0700,"<p>I use the same email <strong>address</strong> on my smart phone, but with another email program, which is the email app pre-installed by Samsung. The email program on my smart phone does not delete emails from its trash folder: it retains emails there that are more than two years old. </p><p>I can't find any settings in my computer's webmail account (YouSee) that control when the trash folder deletes emails. </p>",B.O.,false,0,0
1820974,1583538,2026-05-25 16:39:32 -0700,2026-05-25 16:39:32 -0700,"<em><p>Bo <a href=""#answer-1820963"" rel=""nofollow"">said</a></p></em> <blockquote>I use the same email <strong>address</strong> on my smart phone, but with another email program, which is the email app pre-installed by Samsung. The email program on my smart phone does not delete emails from its trash folder: it retains emails there that are more than two years old. </blockquote> <p>If the imap account has no emails in TRash, then I assume there are no emails in the webmail Trash folder because they synchronise with each other.   But if smart phone has emails in Trash over 2 years old then it's not an imap account. It's a pop account.  Does the pop account have settings to download and pop off server or is POP set up to 'Leave messages on server'? </p> <blockquote> I can't find any settings in my computer's webmail account (YouSee) that control when the trash folder deletes emails. </blockquote> <p>There may not be any settings in webmail because if server auto empties Trash then it's a server policy and not something you have control over. </p>",Toad-Hall,false,0,0
1820982,1583538,2026-05-25 17:07:04 -0700,2026-05-25 19:29:01 -0700,"<p>My Thunderbird account <strong>has</strong> got emails in Trash folder, the same as in the webmail Trash folder, but only emails younger than 30 days. I want to keep them much longer in Trash folder. </p><p>The pop account on my smart phone can retain up to 10000 emails, and I can change the number that I want to keep. </p>",B.O.,false,0,0
1821098,1583538,2026-05-26 11:21:09 -0700,2026-05-26 11:21:09 -0700,"<em><p>Bo <a href=""#answer-1820982"" rel=""nofollow"">said</a></p></em> <blockquote>My Thunderbird account <strong>has</strong> got emails in Trash folder, the same as in the webmail Trash folder, but only emails younger than 30 days. I want to keep them much longer in Trash folder. </blockquote> <p>That proves the Trash folder in imap is fully synchronised with the server Trash, so that's good. If you want to keep emails then do not put then in the Trash. Trash is strictly for emails you do not want. It is not a place to archive emails. </p><p>If the server has a policy for deleting emails that have been in Trash for more than 30 days, there is nothing you can do about it.  This could be something they have recently introduced. But it is something most servers are adopting because they need to maintain space on servers for wanted emails, so they clear what people do not want.   </p><p>Thunderbird (no email client) has no control over the server regarding it's policies. So if you do not have any specific settings in Thunderbird to delete emails after 30 days then it's not Thunderbird, it's the server. </p><p>If you want to store emails for a longer period of time then clearly the emails are not unwanted so they should not be in Trash. Trash means rubbish that needs to go. The 30 days is a cooling off period just in case you deleted in error and need to keep, so you can get it out of TRash and put into a more suitable folder. </p><p>Some servers also have a recovery period of about 30 days, but anything you recover and want to keep must not be stored in Trash. I did locate this, so check it out: <a href=""https://yousee.dk/hjaelp/artikler/gendan-slettede-mails-i-yousee-webmail"" rel=""nofollow"">https://yousee.dk/hjaelp/artikler/gendan-slettede-mails-i-yousee-webmail</a> </p><p>You would need to ask the Yousee <a href=""http://mail.dk"" rel=""nofollow"">mail.dk</a> help service to see if they have a policy of removing emails from trash after 30 days. </p> <blockquote> The pop account on my smart phone can retain up to 10000 emails, and I can change the number that I want to keep. </blockquote> <p>Pop accounts can only access the server Inbox and download emails that are in the server Inbox. There is no synchonisation.  Everything is stored on the computer or phone in the POP account. You cannot compare with an Imap account.  Imap accounts store everything on the server and the imap account shows a mirror image of what is on server. Anything downloaded to an Imap account cannot be considered as a true independent copy because it can only display whatever is on server. The copy in imap can be used to create an independent backup. </p>",Toad-Hall,false,1,0
1821100,1583538,2026-05-26 11:34:00 -0700,2026-05-26 11:34:00 -0700,"<p>Toad-Hall, thank you very much for your detailed information. It was helpful for my understanding. </p>",B.O.,false,0,0
1820808,1583541,2026-05-24 19:49:45 -0700,2026-05-25 03:12:27 -0700,"<p>A Google search provides this answer... </p><p>(<a href=""https://www.google.com/search?q=change+where+thunderbird+saves+sent+messages&amp;rlz=1C2VDKB_enGB1120GB1120&amp;num=10&amp;newwindow=1&amp;sca_esv=f1fb8f2ab13df819&amp;sxsrf=ANbL-n4dDWRVyIk875ujzquXiuBkP5UCaA%3A1779651138271&amp;source=hp&amp;ei=QlITaraNDZuvhbIP1e3FmAc&amp;iflsig=AFdpzrgAAAAAahNgUkVxCkfIyq9ze8R0gKH5MAo1vSlQ&amp;ved=0ahUKEwi2tquP1dKUAxWbV0EAHdV2EXMQ4dUDCCU&amp;uact=5&amp;oq=change+where+thunderbird+saves+sent+messages&amp;gs_lp=Egdnd3Mtd2l6IixjaGFuZ2Ugd2hlcmUgdGh1bmRlcmJpcmQgc2F2ZXMgc2VudCBtZXNzYWdlczIFECEYoAEyBRAhGKABMgUQIRifBTIFECEYnwUyBRAhGJ8FMgUQIRifBTIFECEYnwUyBRAhGJ8FMgUQIRifBTIFECEYnwVI239Qig1Y9XtwAXgAkAEAmAF3oAGFHKoBBDQwLjS4AQPIAQD4AQGYAi2gAugdqAIKwgIHECMY6gIYJ8ICDRAjGJ4GGPAFGOoCGCfCAg0QLhjHARivARjqAhgnwgIQEC4YgAQYigUYxwEYrwEYJ8ICBBAjGCfCAhAQIxjJAhjwBRiABBiKBRgnwgILEAAYgAQYigUYkQLCAg0QABiABBiKBRhDGLEDwgIKEAAYgAQYigUYQ8ICExAuGIAEGIoFGEMYsQMYxwEY0QPCAgsQLhiDARixAxiABMICChAjGIAEGIoFGCfCAggQLhiABBixA8ICCxAAGIAEGIoFGLEDwgIOEAAYgAQYigUYsQMYgwHCAggQABiABBixA8ICDhAuGIAEGLEDGMcBGNEDwgILEAAYgAQYsQMYgwHCAgUQABiABMICChAAGIAEGBQYhwLCAg4QLhivARjHARjJAxiABMICBhAAGBYYHsICCxAAGIAEGIoFGIYDwgIFEAAY7wXCAggQABiABBiiBMICCBAAGIkFGKIEwgIHECEYChigAZgDD_EFQgPzLKv99aGSBwQ0MS40oAe5qwKyBwQ0MC40uAfZHcIHCTEuMjMuMTguM8gHmwGACAE&amp;sclient=gws-wiz"" rel=""nofollow"">https://www.google.com/search?q=change+where+thunderbird+saves+sent+messages&amp;rlz=1C2VDKB_enGB1120GB1120&amp;num=10&amp;newwindow=1&amp;sca_esv=f1fb8f2ab13df819&amp;sxsrf=ANbL-n4dDWRVyIk875ujzquXiuBkP5UCaA%3A1779651138271&amp;source=hp&amp;ei=QlITaraNDZuvhbIP1e3FmAc&amp;iflsig=AFdpzrgAAAAAahNgUkVxCkfIyq9ze8R0gKH5MAo1vSlQ&amp;ved=0ahUKEwi2tquP1dKUAxWbV0EAHdV2EXMQ4dUDCCU&amp;uact=5&amp;oq=change+where+thunderbird+saves+sent+messages&amp;gs_lp=Egdnd3Mtd2l6IixjaGFuZ2Ugd2hlcmUgdGh1bmRlcmJpcmQgc2F2ZXMgc2VudCBtZXNzYWdlczIFECEYoAEyBRAhGKABMgUQIRifBTIFECEYnwUyBRAhGJ8FMgUQIRifBTIFECEYnwUyBRAhGJ8FMgUQIRifBTIFECEYnwVI239Qig1Y9XtwAXgAkAEAmAF3oAGFHKoBBDQwLjS4AQPIAQD4AQGYAi2gAugdqAIKwgIHECMY6gIYJ8ICDRAjGJ4GGPAFGOoCGCfCAg0QLhjHARivARjqAhgnwgIQEC4YgAQYigUYxwEYrwEYJ8ICBBAjGCfCAhAQIxjJAhjwBRiABBiKBRgnwgILEAAYgAQYigUYkQLCAg0QABiABBiKBRhDGLEDwgIKEAAYgAQYigUYQ8ICExAuGIAEGIoFGEMYsQMYxwEY0QPCAgsQLhiDARixAxiABMICChAjGIAEGIoFGCfCAggQLhiABBixA8ICCxAAGIAEGIoFGLEDwgIOEAAYgAQYigUYsQMYgwHCAggQABiABBixA8ICDhAuGIAEGLEDGMcBGNEDwgILEAAYgAQYsQMYgwHCAgUQABiABMICChAAGIAEGBQYhwLCAg4QLhivARjHARjJAxiABMICBhAAGBYYHsICCxAAGIAEGIoFGIYDwgIFEAAY7wXCAggQABiABBiiBMICCBAAGIkFGKIEwgIHECEYChigAZgDD_EFQgPzLKv99aGSBwQ0MS40oAe5qwKyBwQ0MC40uAfZHcIHCTEuMjMuMTguM8gHmwGACAE&amp;sclient=gws-wiz</a>) </p><p>Follow these quick steps: </p><p>Click the menu icon (three horizontal lines) in the top-right corner of Thunderbird and select Account Settings.  </p><p>In the left-hand panel, click on Copies &amp; Folders directly under the specific email account you want to change.  </p><p>On the right side, find the When sending messages, automatically: section.  </p><p>Locate Place a copy in and choose your preferred destination: </p><p>Your settings should look like this (mine)... See attached pic 😉 </p><p>Hope that helps. 😊 </p>",Highlander009,false,0,0
1821055,1583541,2026-05-26 06:37:12 -0700,2026-05-26 06:37:12 -0700,"<p>Did this fix your problem, Mike? </p>",Highlander009,false,0,0
1821194,1583541,2026-05-26 19:01:20 -0700,2026-05-26 19:01:20 -0700,<p>I admit that my eyes played some tricks on me - the check box for copies and folders was set to other instead of sent not sure how that happened but... </p>,mikealte135,false,0,0
1821198,1583541,2026-05-26 19:34:59 -0700,2026-05-26 19:34:59 -0700,"<p>Unfortunately, i just sent a msg and it was placed in my 'inbox'. I have tried to search thru about:config but didn't see anything that looks like it would help. </p><p>Any suggestions etc would be appreciated. Mike </p>",mikealte135,false,0,0
