id,created,updated,locale,product,title,is_solved,solution,solved_by,is_spam,last_answer,answers,topic,tags,creator,content,involved,is_archived,is_locked,is_taken,metadata,num_answers,num_votes_past_week,num_votes,taken_until,taken_by,updated_by
1584332,2026-05-28 17:10:24 -0700,2026-05-29 09:03:43 -0700,en-US,thunderbird,Проблема авторизации,false,,,false,1821845,1821712;1821845;,import-and-export-email,thunderbird-15002;thunderbird-1500;thunderbird;import-and-export-email;,ryzhihekatt9008,"<p>Здравствуйте! </p><p>Пытаюсь подключить Яндекс.Почту к Thunderbird, чтобы скачать письма с Яндекса на компьютер. </p><p>Проблема такая: при добавлении аккаунта Яндекс.Почты в Thunderbird меня почему-то перебрасывает на авторизацию Google. Возможно, это связано с тем, что ранее почта была мигрирована на Google-аккаунт с таким же адресом и доменом, либо ящик Яндекса сейчас неактивен (он не оплачен, там просто старые письма лежат) — точно не понимаю. </p><p>Подскажите, пожалуйста: </p><p>Почему при подключении Яндекс.Почты Thunderbird может открывать Google-авторизацию? Можно ли принудительно подключить Яндекс.Почту вручную? Если ящик Яндекса был ранее связан/мигрирован с Google, есть ли способ всё равно скачать письма именно с Яндекса? </p><p>Моя цель — получить локальный архив писем с Яндекс.Почты на компьютере. Буду благодарна за пошаговую инструкцию, что проверить и как правильно настроить подключение. </p>",ryzhihekatt9008;Googlethunderbird.;,false,false,false,";useragent:Mozilla/5.0 (Macintosh; Intel Mac OS X 10_15_7) AppleWebKit/537.36 (KHTML, like Gecko) Chrome/148.0.0.0 Safari/537.36;tb_version:150.0.2 (aarch64);os:Mac OS x 10_15_7",2,0,0,,,
1584336,2026-05-28 17:36:24 -0700,2026-05-28 19:42:03 -0700,en-US,thunderbird,Thunderbird is loaded on my Dell laptop (Win 11) twice. How do I delete one and save my messages?,false,,,false,1821713,1821688;1821689;1821713;,install,windows-11;thunderbird;install;,ngreene02,<p>There are two copies of Thunderbird on my laptop. Win 11. A newer copy appeared but does not have my old emails that I have saved. How do I safely get rid of it and keep all emails? Thank you. </p>,ngreene02;rednoise;davidsk;,false,false,false,";useragent:Mozilla/5.0 (Windows NT 10.0; Win64; x64) AppleWebKit/537.36 (KHTML, like Gecko) Chrome/148.0.0.0 Safari/537.36;tb_version:150.02;os:Windows 11",3,0,0,,,
1584338,2026-05-28 17:42:03 -0700,2026-05-28 19:00:13 -0700,en-US,thunderbird,Emails from customers through a third party applications come over with the same same correspondent name.,false,,,false,1821702,1821690;1821702;,send-and-receive-email,thunderbird-140111;thunderbird-14011;windows-11;thunderbird;send-and-receive-email;,kendallconstructioninc,<p>When we first started using a third party application to track our customers information &amp; jobs; we received emails showing the customers name on the correspondent/from column. Now all of the emails show the third party applications name and I do not know which customers are trying to contact us. </p>,kendallconstructioninc;davidsk;rednoise;,false,false,false,";useragent:Mozilla/5.0 (Windows NT 10.0; Win64; x64) AppleWebKit/537.36 (KHTML, like Gecko) Chrome/148.0.0.0 Safari/537.36;tb_version:140.11.1esr;os:Windows 11",2,0,0,,,
1584343,2026-05-28 18:42:29 -0700,2026-05-28 20:26:54 -0700,en-US,thunderbird,compacting only certain folders,false,,,false,1821725,1821698;1821707;1821725;,email-and-messaging,thunderbird-15101;thunderbird-1510;windows-11;thunderbird;email-and-messaging;,dcal53,"<p>Hi, Local folders seem destined to be compacted (Trimmed).  Can I make a folder or email  undeletable?  I'd love to keep some. Thanks </p>",dcal53;davidsk;,false,false,false,";useragent:Mozilla/5.0 (Windows NT 10.0; Win64; x64) AppleWebKit/537.36 (KHTML, like Gecko) Chrome/148.0.0.0 Safari/537.36 Edg/148.0.0.0;tb_version:151.0.1;os:Windows 11",3,0,0,,,
1584345,2026-05-28 18:51:35 -0700,2026-05-28 23:08:46 -0700,en-US,thunderbird,Had to reload Thunderbird. Where is the address book stored?,false,,,false,1821762,1821701;1821715;1821716;1821717;1821723;1821741;1821748;1821762;,contacts,thunderbird-15101;thunderbird-1510;windows-10;thunderbird;contacts;,timbernie,<p>Had to reload Thunderbird. Where is the address book stored? Old method not working. </p>,timbernie;davidsk;,false,false,false,";useragent:Mozilla/5.0 (Windows NT 10.0; Win64; x64) AppleWebKit/537.36 (KHTML, like Gecko) Chrome/148.0.0.0 Safari/537.36;tb_version:151.0.1 (64-bit);os:Windows 10",8,0,0,,,
1584350,2026-05-28 19:24:32 -0700,2026-05-28 19:24:32 -0700,es,thunderbird,Mozilla Thunderbird does not sort folders alphabetically according to the order in which I create them.,false,,,false,,"",customization,thunderbird-140111;thunderbird-14011;windows-11;thunderbird;customization;,elevenreturns,<p><strong>Mozilla Thunderbird does not sort folders alphabetically according to the order in which I create them.</strong> </p>,elevenreturns;,false,false,false,;useragent:Mozilla/5.0 (Windows NT 10.0; Win64; x64; rv:151.0) Gecko/20100101 Firefox/151.0;tb_version:140.11.1esr;os:Windows 11,0,0,0,,,
1584356,2026-05-28 19:53:34 -0700,2026-05-28 20:36:18 -0700,en-US,thunderbird,Problem of version ?,false,,,false,1821728,1821728;,customization,thunderbird-15101;thunderbird-1510;windows-10;thunderbird;customization;,bernard.vulliez,"<p>283 With Thunderbird version 140.11.1, when I click on an email, the content appears below. </p><p>With version 151.0.1, the content opens in a new window. This is less convenient. Is it possible to revert to the previous version's behavior? Thank you for your reply. </p>",bernard.vulliez;davidsk;,false,false,false,";useragent:Mozilla/5.0 (Windows NT 10.0; Win64; x64) AppleWebKit/537.36 (KHTML, like Gecko) Chrome/148.0.0.0 Safari/537.36 Edg/148.0.0.0;tb_version:151.0.1;os:Windows 10;kb_visits_prior:[""/fr/kb/basculer-du-protocole-imap-vers-le-protocole-pop""]",1,0,0,,,
1584365,2026-05-28 20:55:50 -0700,2026-05-28 20:55:50 -0700,en-US,thunderbird,"While composing,  unable to see what I am type on the right when over the current window",false,,,false,,"",customization,thunderbird-15101;thunderbird-1510;windows-11;thunderbird;customization;,175k.wong,"<p>When I compose a next message, anything I type exist the current window size (on the right) were disappear, until I press CTRL- to zoom out the scene. But when the same issue happened when I kept on typing. I.E. the content I was typing did not move to the next line. So that I could see what I was typing. </p><p>(example: the top line of this message, if my window is too big, I can only see upto 'the cur"", then ""rent window..."" is out of the picture. I should move ""current window.."" to the next line). This is very frustrating when typing a long email. The only option I am using is the manually pressing 'Enter' for the new line. </p>",175k.wong;,false,false,false,";useragent:Mozilla/5.0 (Windows NT 10.0; Win64; x64) AppleWebKit/537.36 (KHTML, like Gecko) Chrome/148.0.0.0 Safari/537.36;tb_version:151.0.1 (64-bit);os:Windows 11",0,0,0,,,
1584372,2026-05-28 21:56:12 -0700,2026-05-28 22:57:05 -0700,en-US,thunderbird,My daughter's email somehow ended up in my junk folder and I have not been able to keep it out.,false,,,false,1821759,1821759;,junk-mail-and-spam,thunderbird-11533;thunderbird-1153;windows-10;thunderbird;junk-mail-and-spam;,chris.a.miller,"<p>I have marked it as Not Junk multiple times, reset my settings to NOT use adaptive Junk, added my address books to the exception list, removed junk history, and none of it has worked.  Help! </p>",chris.a.miller;mozilla98;,false,false,false,;useragent:Mozilla/5.0 (Windows NT 10.0; Win64; x64; rv:150.0) Gecko/20100101 Firefox/150.0;tb_version:115.3.3;os:Windows 10,1,0,0,,,
1584374,2026-05-28 22:09:13 -0700,2026-05-28 22:10:48 -0700,en-US,thunderbird,accidentally sorted all mail - 9000 emails. hung the program and I can't get it to stop.,false,,,false,1821755,1821755;,app-crash,windows-10;thunderbird;app-crash;,eronne531,"<p>Thunderbird is hung up sorting 9000 emails. I downloaded and upgraded program, turned off my computer. I can't get it to stop sorting. Its been hours. </p>",eronne531;,false,false,false,";useragent:Mozilla/5.0 (Windows NT 10.0; Win64; x64) AppleWebKit/537.36 (KHTML, like Gecko) Chrome/148.0.0.0 Safari/537.36;tb_version:I can't get past;os:Windows 10",1,0,0,,,
1584376,2026-05-28 22:12:51 -0700,2026-05-29 10:22:38 -0700,en-US,thunderbird,I had to log in to Thunderbird and when i did all my folders and previous emails have vanished.,false,,,false,1821860,1821860;,profiles,thunderbird-140111;thunderbird-14011;windows-10;thunderbird;profiles;,clayton.young,"<p>I had to log in this morning, the first time as its automatic, and when i did all my folders and emails have gone. Where are they as there is important information in there which i need. The page layout is different too as i can't delete anything. HELP </p>",clayton.young;Mapenzi;,false,false,false,";useragent:Mozilla/5.0 (Windows NT 10.0; Win64; x64) AppleWebKit/537.36 (KHTML, like Gecko) Chrome/147.0.0.0 Safari/537.36 Norton/147.0.0.0;tb_version:140.11.1esr;os:Windows 10;kb_visits_prior:[""/en-US/kb/thunderbird-accessibility-features""]",1,0,0,,,
1584378,2026-05-28 22:21:52 -0700,2026-05-29 10:36:27 -0700,en-US,thunderbird,Raw code is quoted with Reply of Forward,false,,,false,1821864,1821864;,customization,thunderbird-1510;windows-10;thunderbird;customization;,hooeygoo,"<p>[I was sure I submitted this but I can't find it. Sorry if it's a dupe.} Thunderbird v. 151.0 (64-bit) Windows 10 </p><p>When I reply to or forward a message, I get raw code like: </p><p>&gt; ad that says: Mary gets us &lt;<a href=""https://click.ngpvan.com/"" rel=""nofollow"">https://click.ngpvan.com/</a> </p><p>&gt; k/132163625/623609951/778722144?refcode=LOC_EM_FR_2026.05.27_peltola- </p><p>&gt; split_B1_F1_S1_C1_60DO90DC120DD_N- </p><p>&gt; T0&amp;nvep=ew0KICAiVGVuYW50VXJpIjogIm5ncHZhbjovL3Zhbi9OR1AvTkdQMTkvMS83MjcyMiIsDQogICJEaXN0cmlidXRpb25VbmlxdWVJZCI6ICJlYTIyODEwZS1kYzU5LWYxMTEtOGZjYi0wMDBkM2ExODkwNWMiLA0KICAiRW1haWxBZGRyZXNzIjogImhvb2V5Z29vQGdtYWlsLmNvbSINCn0%3D&amp;hmac=FH6VuhfY9AcHmAdMj2RHECp0IpRhxQHb41JBnp34fM0=&gt; </p><p>&gt; </p><p>How can I get just the normal readable text quoted (Gmail-style)? </p><p>TIA </p>",hooeygoo;davidsk;,false,false,false,";useragent:Mozilla/5.0 (Windows NT 10.0; Win64; x64) AppleWebKit/537.36 (KHTML, like Gecko) Chrome/148.0.0.0 Safari/537.36 Edg/148.0.0.0;tb_version:151.0 (64-bit);os:Windows 10",1,0,0,,,
1584394,2026-05-28 23:17:17 -0700,2026-05-28 23:17:17 -0700,en-US,thunderbird,Yahoo error: The current operation on 'Inbox' did not succeed. The mail server for account (myaccount)@yahoo.com responded: p.,false,,,false,,"",send-and-receive-email,thunderbird-140110;thunderbird-14011;windows-1011;thunderbird;send-and-receive-email;,quantumnanotechextinction,"<p>I can see and check mail fine, I can send mail fine, and I've tried repairing the inbox folder. I'm using OAuth. What is the meaning of this error? I get it every time I start  Thunderbird. </p>",quantumnanotechextinction;,false,false,false,;useragent:Mozilla/5.0 (Windows NT 10.0; Win64; x64; rv:151.0) Gecko/20100101 Firefox/151.0;tb_version:140.11.0esr;os:Windows 10/11,0,0,0,,,
1584400,2026-05-29 00:33:59 -0700,2026-05-29 00:33:59 -0700,en-US,thunderbird,Emails in inbox will not drag into sub folders,false,,,false,,"",email-and-messaging,thunderbird-15101;thunderbird-1510;windows-11;thunderbird;email-and-messaging;,wfollett43,<p>Emails in inbox will not drag to sub folders </p>,wfollett43;,false,false,false,";useragent:Mozilla/5.0 (Linux; Android 10; K) AppleWebKit/537.36 (KHTML, like Gecko) Chrome/148.0.0.0 Mobile Safari/537.36;tb_version:151.0.1 (64-bit);os:Windows 11",0,0,0,,,
1584402,2026-05-29 00:46:03 -0700,2026-05-29 01:14:17 -0700,en-US,thunderbird,"Where Do Sent, Draft, Deleted, etcetera Go?",false,,,false,1821785,1821785;,email-and-messaging,thunderbird-14901;thunderbird-1490;windows-11;thunderbird;email-and-messaging;,redacted,"<p>PRELUDE: I have several email accounts. All accounts display properly, except one. Yes, this is similar to my question about bottom of the far left [<a href=""https://support.mozilla.org/en-US/questions/1566274|list"" rel=""nofollow"">of emails</a>] list of emails - but this is different. </p><p>On the far left of Thunderbird is a list of all my email accounts with ""Inbox"" etcetera. Each email account shows it's Inbox/Sent/Deleted/ except for 1 account. The problem email account only shows it's Title and Inbox northing else.  Yes, I tested it and sent emails to it, and used the problem email account to send, create a draft, and they don't show.. </p><p>The image explains it. </p><p>Thanks for reading this ~r </p>",redacted;MattAuSupport;,false,false,false,";useragent:Mozilla/5.0 (Windows NT 10.0; Win64; x64) AppleWebKit/537.36 (KHTML, like Gecko) Chrome/148.0.0.0 Safari/537.36;tb_version:149.0.1 (64-bit);os:Windows 11",1,0,0,,,
1584405,2026-05-29 01:06:04 -0700,2026-05-29 07:59:36 -0700,en-US,thunderbird,Can't delete duplicate Spam folder,false,,,false,1821824,1821824;,junk-mail-and-spam,thunderbird-15101;thunderbird-1510;windows-11;thunderbird;junk-mail-and-spam;,judylinklater,"<p>I am new to Thunderbird, and attempting to use it as my email client. So far I have imported my main Gmail account, a second Gmail account, as well as three different Microsoft accounts. There is a duplicate Spam folder on one of the Exchange accounts, which I assume came with the import. There is, however, no way to delete the Spam folder from the original MS account. None of the other accounts has this issue, although when I had duplicate Trash folders on Gmail accounts earlier, I was able to delete them from the original account, which allowed them to disappear from TB. The Spam messages in TB actually only populate into one of the Spam folders. Any ideas what else I can do to get rid of this superfluous Spam folder, please? Many thx for any help! </p>",judylinklater;siffemoz;,false,false,false,";useragent:Mozilla/5.0 (Windows NT 10.0; Win64; x64) AppleWebKit/537.36 (KHTML, like Gecko) Chrome/148.0.0.0 Safari/537.36;tb_version:151.0.1 (64-bit);os:Windows 11",1,0,0,,,
1584422,2026-05-29 02:46:58 -0700,2026-05-29 10:41:22 -0700,en-US,thunderbird,Not always receiving email from 1 email address,false,,,false,1821866,1821866;,send-and-receive-email,thunderbird-140111;thunderbird-14011;thunderbird;send-and-receive-email;,glenron610,<p>Emails from one sender are not always received. It is being blocked by their server. </p>,glenron610;davidsk;,false,false,false,";useragent:Mozilla/5.0 (Linux; Android 10; K) AppleWebKit/537.36 (KHTML, like Gecko) SamsungBrowser/30.0 Chrome/143.0.0.0 Mobile Safari/537.36;tb_version:140.11.1esr(32-bit;kb_visits_prior:[""/en-US/kb/cannot-receive-messages""]",1,0,0,,,
1584425,2026-05-29 03:25:17 -0700,2026-05-29 03:25:17 -0700,en-US,thunderbird,how can I export the ASCII-armored public key?,false,,,false,,"",encryption,thunderbird-15101;thunderbird-1510;mac-os-x-1015;thunderbird;encryption;,7w447w4gmg,"<p>I've been trying to set up a GPG key, but Thunderbird doesn't recognize my pub.asc file. So I created a PGP key thru Thunderbird and I would like to export it as ASCII-armored public key. </p>",7w447w4gmg;,false,false,false,";useragent:Mozilla/5.0 (Macintosh; Intel Mac OS X 10.15; rv:151.0) Gecko/20100101 Thunderbird/151.0.1;tb_version:151.0.1;os:Mac OS x 10.15;kb_visits_prior:[""/en-US/kb/introduction-to-e2e-encryption"", ""/en-US/kb/thunderbird-help-setup-account-e2ee""]",0,0,0,,,
1584426,2026-05-29 03:53:54 -0700,2026-05-29 03:53:54 -0700,cs,thunderbird,otevírání správ na minulé versi,false,,,true,,"",accessibility,windows-11;thunderbird;accessibility;,zmrzlysimeon,"<p>Dobrý den, po oznámení pádu Thunderbird, program přijímal zprávy, ale nešly otevřít. stejně bylo nefunkční ovládání aplikace. Dají se zprávy zachránit? Po nové ínstalaci  thunderbirdu na novém počítači nelze nastavit ""druhý účet : <a href=""mailto:zmrzlys@iol.cz"" rel=""nofollow"">zmrzlys@iol.cz</a> Již dříve byly problémy, na štěstí neovlivňujíci funkci. viz přiložený text, který zůstal bez reakce. </p><p>""Mám problém s účtem. Pří zřízení účtu mi bylo přiděleno jméno „541225629“ a heslo „0600806936“ tento účet je funkční a mohu v něm otevřít Webmail schránku. Dobrý den, Při instalaci poštovní aplikace „Mozila thunderbird“ vznikl účet <a href=""mailto:zmrzlys@iol.cz"" rel=""nofollow"">zmrzlys@iol.cz</a> se zadaným heslem „up5Date“ pro toto heslo neotevřu Webmail schránku. Tento účet jsem roky používal bez problémů. V poslední době( zřejmě po nějakém updatu) však při startu thunderbirdu je požadováno heslo pro „zmrzly pop3. <a href=""http://Iol.cz"" rel=""nofollow"">Iol.cz</a>“. Ani jedno z hesel uložených pro „iol“ není akceptováno POP3 odpovídá [AUTH] Authentication failed. Po ignoraci tohoto požadavku (X) pošta funguje. Připokusech na webu najít platné heslo, jsem obdržel   odpovědi:  „Chyba účtu  zmrzly – odeslání hesla pro uživatele „zmrzly“ nebylo úspěšné. POP3 <a href=""http://iol.cz"" rel=""nofollow"">iol.cz</a> odpovídá [AUTH] Authentication failed. Při snaze přihlásit se, nebo vytvořit účet u „centrum“ – <a href=""mailto:zmrzlys@iol.cz"" rel=""nofollow"">zmrzlys@iol.cz</a> označuje jako nesprávnou e-mail adresu. Při vytvoření nového účtu „zmrzly“ je adresa obsazena. Prosím o pomoc s řešením S díky Ing. Simon Zmrzl ýCSc."" </p><p>Přispěl jsem na vaši dobrou práci a při  úspěšném řešení mého problému v tom hodlám pokračovat. Prosím o odpověď Vašich systémových pracovníků, nebo z fóra. s pozdravem Ing. Simeon Zmrzlý, <a href=""mailto:zmrzlysimeon@gmail.com"" rel=""nofollow"">zmrzlysimeon@gmail.com</a> tel:606937575 </p>",zmrzlysimeon;,false,false,false,";useragent:Mozilla/5.0 (Windows NT 10.0; Win64; x64) AppleWebKit/537.36 (KHTML, like Gecko) Chrome/148.0.0.0 Safari/537.36 Edg/148.0.0.0;tb_version:asi140.8.0esr?;os:Windows 11",0,0,0,,,
1584475,2026-05-29 09:43:57 -0700,2026-05-29 09:43:57 -0700,en-US,thunderbird,How to Convert Thunderbird Emails to Outlook?,false,,,true,,"",email-and-messaging,windows-7;thunderbird;email-and-messaging;,shiv2expert,"<p>The Recoveryfix MBOX to PST Converter is a dedicated migration tool designed to quickly convert Mozilla Thunderbird mailbox data into Outlook-compatible PST files. It preserves your exact folder structure, email formatting, and attachments while moving data without risk of corruption. The software features an auto-detection option that automatically locates your Thunderbird data folders on your computer to save setup time. It handles bulk conversions by processing multiple profiles simultaneously and includes a built-in preview pane to inspect emails before finalizing the export. This utility streamlines the entire email transition process, making it simple to access your old messages inside Microsoft Outlook. </p>",shiv2expert;,false,false,false,;useragent:Mozilla/5.0 (Windows NT 6.1; Win64; x64; rv:109.0) Gecko/20100101 Firefox/115.0;tb_version:help;os:Windows 7,0,0,0,,,
