id,created,updated,locale,product,title,is_solved,solution,solved_by,is_spam,last_answer,answers,topic,tags,creator,content,involved,is_archived,is_locked,is_taken,metadata,num_answers,num_votes_past_week,num_votes,taken_until,taken_by,updated_by
1576563,2026-04-15 17:13:04 -0700,2026-04-15 23:36:38 -0700,en-US,thunderbird,View Layout Classic  (and others) are grayed out and I cannot cope with the new view and all the issues with opening and closing tabs and windows.,false,,,false,1811976,1811976;,customization,thunderbird;customization;,dvandusen,"<p>How can I get back classic so that I don't have to deal with 40 tabs - or any excess tabs?    140.9.1esr (aarch64) </p><p>The View Layout Classic  (and others) are grayed out , </p>",dvandusen;Googlethunderbird.;,false,false,false,";useragent:Mozilla/5.0 (Macintosh; Intel Mac OS X 10_15_7) AppleWebKit/537.36 (KHTML, like Gecko) Chrome/146.0.0.0 Safari/537.36;tb_version:140.9.1;os:Mac OS x 10_15_7;kb_visits_prior:[""/en-US/kb/getting-started-thunderbird-main-window-supernova""]",1,0,0,,,
1576564,2026-04-15 17:19:17 -0700,2026-04-15 17:19:17 -0700,en-US,thunderbird,"Je n'arrive plus à me connecter, voici le message d'erreur ""Échec de la connexion depuis le serveur imap.sfr.fr avec le nom d’utilisateur beaudonnat.jean-luc@neuf.fr.",false,,,false,,"",connectivity,windows-10;thunderbird;connectivity;,beaudonnat.jean-luc,"<p>Je n'arrive plus à me connecter, voici le message d'erreur ""Échec de la connexion depuis le serveur <a href=""http://imap.sfr.fr"" rel=""nofollow"">imap.sfr.fr</a> avec le nom d’utilisateur <a href=""mailto:beaudonnat.jean-luc@neuf.fr"" rel=""nofollow"">beaudonnat.jean-luc@neuf.fr</a>. Pouvez-vous me dire ce qu'il faut faire pour me connecter. A savoir j'ai changé mon mot de passe mais celui-ci ne me permet toujours pas d'accéder à mes mails. </p>",beaudonnat.jean-luc;,false,false,false,";useragent:Mozilla/5.0 (Windows NT 10.0; Win64; x64) AppleWebKit/537.36 (KHTML, like Gecko) Chrome/147.0.0.0 Safari/537.36 Edg/147.0.0.0;tb_version:140.9 1esr (32bits;os:Windows 10",0,0,0,,,
1576565,2026-04-15 17:23:12 -0700,2026-04-15 23:03:04 -0700,en-US,thunderbird,"""Thunderbird thinks this message is spam.""",false,,,false,1811991,1811960;1811991;,junk-mail-and-spam,windows-11;thunderbird;junk-mail-and-spam;,warlocc,"<p>How the <em>[edited]</em> do I turn automatic spam filtering off? I've literally unchecked EVERYTHING related to junk or spam, but it's still marking every <em>[edited]</em> email that I get as spam. Even addresses in my address book! </p>",warlocc;davidsk;denyshon;,false,false,false,";useragent:Mozilla/5.0 (Windows NT 10.0; Win64; x64) AppleWebKit/537.36 (KHTML, like Gecko) Chrome/147.0.0.0 Safari/537.36 Edg/147.0.0.0;tb_version:149.0.2 (64-bit);os:Windows 11",2,0,0,,,denyshon
1576566,2026-04-15 17:25:00 -0700,2026-04-16 13:56:36 -0700,en-US,thunderbird,Prevoius Colors Add-On  Disappeared,false,,,false,1812106,1811959;1812106;,extensions,windows-11;thunderbird;extensions;,BillTreloar,"<p>Previous Colors add-on is apparently not  him compatible with the most recent version of Thunderbird which installed itself in the last few days. </p><p>Does anyone know if it updates to that plug-in is anticipated? </p><p>If not, are there any similar add-ons available? </p><p>Thanks! Bill </p>",BillTreloar;davidsk;,false,false,false,;useragent:Mozilla/5.0 (Windows NT 10.0; Win64; x64; rv:149.0) Gecko/20100101 Firefox/149.0;tb_version:149.0.2;os:Windows 11,2,0,0,,,
1576580,2026-04-15 19:12:07 -0700,2026-04-16 22:44:39 -0700,en-US,thunderbird,Why has T-bird suddenly begun compacting my Inbox when I delete a message?,true,1812100,davidsk,false,1812175,1811969;1812100;1812117;1812123;1812175;,crashing-and-slow-performance,windows-11;thunderbird;crashing-and-slow-performance;,john.beech,"<p>Once I delete a message, T-bird (147.0.4 on W11 Pro) begins compacting, and then I'm stuck until it's done. This is new behavior.  Previously the system compacted occasionally, but now it's every single time I delete something from the inbox (which happens frequently during the day, of course, sigh). </p><p>Anyway, many thanks in advance for help/guidance and if it matters, I'm one of those who contributes monetarily for use versus freeloading. Also, no, we don't believe updating to the latest version is productive for our situation so I hope this is not the solutuion. -- Regards, </p>",john.beech;davidsk;,false,false,false,;solver_id:3691265;useragent:Mozilla/5.0 (Windows NT 10.0; Win64; x64; rv:147.0) Gecko/20100101 Firefox/147.0;tb_version:147.0.4;os:Windows 11,5,0,0,,,
1576583,2026-04-15 20:08:50 -0700,2026-04-16 20:27:57 -0700,it,thunderbird,Configurazione secondo account Outlook365,false,,,false,1812157,1812024;1812128;1812129;1812157;,passwords-and-sign-in,thunderbird;passwords-and-sign-in;,daniele.riccucci,"<p>Ho correttamente configurato un account Outlook365 aziendale tramite IMAP e Oauth2. Configurando il secondo account ricevo un errore di autenticazione, sono convinto che questo sia dovuto al fatto che Thunderbird prova ad accedere con le credenziali del primo account. Come posso approfondire o risolvere il problema? Grazie. </p>",daniele.riccucci;@next;,false,false,false,";useragent:Mozilla/5.0 (Macintosh; Intel Mac OS X 10_15_7) AppleWebKit/537.36 (KHTML, like Gecko) Chrome/146.0.0.0 Safari/537.36;tb_version:140.9.1esr;os:Mac OS Taohe 26.2",4,0,0,,,
1576593,2026-04-15 20:51:33 -0700,2026-04-15 20:51:33 -0700,en-US,thunderbird,Dragon70Red,false,,,true,,"",passwords-and-sign-in,thunderbird;passwords-and-sign-in;,llew1,<p>By giving me an email account </p>,llew1;,false,false,false,";useragent:Mozilla/5.0 (iPhone; CPU iPhone OS 18_7 like Mac OS X) AppleWebKit/605.1.15 (KHTML, like Gecko) Version/18.7.5 Mobile/15E148 Safari/604.1;tb_version:https://www.micros;os:Ios",0,0,0,,,
1576595,2026-04-15 21:15:10 -0700,2026-04-16 11:38:48 -0700,en-US,thunderbird,"104.9.0esr 64-bit: - Profile? What profile? (Lots of email, but the Thunderbird profile is MIA...and the app itself is hiding from me!))",false,,,false,1812072,1812072;,profiles,windows-11;thunderbird;profiles;,desk8,"<p>Have been using the 104.9.0esr 64-bit release on Windows 11 for some time now (mostly for email, involving a number of email accounts) and have been generally satisfied... </p><p>...but discovered when I started looking into switching over to the 145 default release that I have a capital-P Problem. The first thing recommended on making that change is - sensibly - to back up one's Thunderbird profile. Only as far as I can tell, I don't *have* any such file anywhere on my system. [To answer the obvious question - yes, I've got ""View"" set in File Explorer such that it should be showing me hidden files.] </p><p>I have drilled downward through all the USERS subdirectories on my C: drive. ""Default"" and ""Public"" have nothing at all (as one might expect). My personal subdirectory has a Mozilla directory under ""Roaming"", and both a Firefox and a Thunderbird directory therein, but the only things in the Thunderbird directory are an empty folder labeled ""Crash Reports"" and a tiny ""desktop.ini"" file.  </p><p>There is a ""Mozilla Firefox"" directory under Program Files, but nothing in that hierarchy looks applicable. There is a ""Mozilla Maintenance Service"" directory under ""Program Files (x86)"", but nothing there appears relevant. There is a ""Mozilla [alpahnumeric hash]"" subdirectory under ""Program Data"", but nothing there appears relevant.  </p><p>And in fact, I begin to think I have a bigger issue than I thought I did...because the more I poke at my C: drive, the less I'm seeing...to the extent that I'm not at all sure where the Thunderbird program itself (not to mention a quite large accumulation of associated email) is being kept. </p><p>Which would be nice to know if one were attempting to back up one's mail before changing program versions.... </p>",desk8;davidsk;,false,false,false,";useragent:Mozilla/5.0 (Windows NT 10.0; Win64; x64; rv:149.0) Gecko/20100101 Firefox/149.0;tb_version:140.9.0esr 64-bit;os:Windows 11;kb_visits_prior:[""/en-US/kb/thunderbird-add-ons-frequently-asked-questions""]",1,0,0,,,
1576596,2026-04-15 21:34:32 -0700,2026-04-15 21:34:32 -0700,en-US,thunderbird,"why did the email folders I added such as auto, bank, legal, medical now I have lost those emails",false,,,false,,"",email-and-messaging,windows-10;thunderbird;email-and-messaging;,woodworth1,"<p>why did the email folders I added such as auto, bank, legal, medical now I have lost those emails </p>",woodworth1;,false,false,false,;useragent:Mozilla/5.0 (Windows NT 10.0; Win64; x64; rv:149.0) Gecko/20100101 Firefox/149.0;tb_version:149.0.2 (64-bit);os:Windows 10,0,0,0,,,
1576600,2026-04-15 22:03:23 -0700,2026-04-15 22:03:23 -0700,en-US,thunderbird,A link selection displayed in Thunderbird is not opening a web in Safari and other browsers... what's going on?,false,,,false,,"",connectivity,thunderbird;connectivity;,dicknick46,"<p>Over the last week or so, selecting a link embedded within an incoming email on Thunderbird does not now ensure that the desired webpage will be opened in Safari and other browsers. Shutting down Thunderbird, intermittently enables the proper functional activity of opening the desired webpage. I've discussed this with Apple (iMac; Sequoia 15.7.5) and was unable to identify this as an Apple problem. </p>",dicknick46;,false,false,false,;useragent:Mozilla/5.0 (Macintosh; Intel Mac OS X 10.15; rv:149.0) Gecko/20100101 Firefox/149.0;tb_version:140.9.1esr; 64-bit;os:Mac OS Sequoia 15.7.5,0,0,0,,,
1576604,2026-04-15 22:27:03 -0700,2026-04-15 22:27:03 -0700,en-US,thunderbird,"""Open message in conversation"" is no longer based on the correspondent",false,,,false,,"",customization,thunderbird;customization;,cmackenzie1,"<p>I have relied heavily on the ""Open message in conversation"" function, because it gave me a tree of messages across all folders (Inbox, Sent, etc.) that was based on the person I was corresponding with. </p><p>Now, the function is giving me a tree based on the Subject of the message.  This behavior makes it useless to me.  I've looked, and I can't find any configuration setting that would control this option. </p><p>How can I once again get a message tree based on the correspondent's name, then sorted next by date? </p><p>Thanks! </p>",cmackenzie1;,false,false,false,";useragent:Mozilla/5.0 (Windows NT 10.0; Win64; x64; rv:149.0) Gecko/20100101 Firefox/149.0;tb_version:149.0.2 (64-bit);os:Windows 11 Pro, build 26200.8246",0,0,0,,,
1576607,2026-04-15 22:31:23 -0700,2026-04-16 07:47:38 -0700,en-US,thunderbird,"In version 149.0.2, why do I no longer get the warning bar when I type the word ""attachment""?",false,,,false,1812035,1812035;,attachments,windows-11;thunderbird;attachments;,dhyoung1040,"<p>When I type the word ""attachment"" in version 149.0.2 I no longer get the warning bar across the bottom of the screen.  I do have the ""check for missing attachments"" box checked in Settings. </p>",dhyoung1040;siffemoz;,false,false,false,;useragent:Mozilla/5.0 (Windows NT 10.0; Win64; x64; rv:149.0) Gecko/20100101 Firefox/149.0;tb_version:149.0.2;os:Windows 11,1,0,0,,,
1576636,2026-04-16 02:57:07 -0700,2026-04-16 05:07:47 -0700,en-US,thunderbird,Tech Support for Thunderbird???,false,,,false,1812021,1812021;,undefined,windows-11;thunderbird;undefined;,cat5,"<p>How in the heck do you reach tech support for Thunderbird? I have NEVER in my life seen a company so elusive to contacting them. I appreciate the help in here, but there are times when a forum can't help and you need the actual company to be accessible to get that help.  </p><p>I am about to that point of uninstalling it and throwing it out the office window. </p>",cat5;wxie2016;,false,false,false,";useragent:Mozilla/5.0 (Windows NT 10.0; Win64; x64) AppleWebKit/537.36 (KHTML, like Gecko) Chrome/145.0.0.0 Safari/537.36;tb_version:149.0.2;os:Windows 11",1,0,0,,,
1576642,2026-04-16 04:35:35 -0700,2026-04-16 18:49:57 -0700,en-US,thunderbird,The RETR command did not succeed.,false,,,false,1812152,1812096;1812137;1812140;1812144;1812150;1812152;,send-and-receive-email,windows-11;thunderbird;send-and-receive-email;,singjai,<p>I'm trying to download my email and my progress has been halted by a single email that could not be processed. Right now I'm stuck. </p>,singjai;davidsk;,false,false,false,;useragent:Mozilla/5.0 (Windows NT 10.0; Win64; x64; rv:149.0) Gecko/20100101 Firefox/149.0;tb_version:149.0.2;os:Windows 11,6,0,0,,,
1576650,2026-04-16 05:17:14 -0700,2026-04-16 07:12:18 -0700,nl,thunderbird,spam blocking possible for me,false,,,false,1812030,1812030;,junk-mail-and-spam,windows-1011;thunderbird;firefox-14902;firefox-1490;junk-mail-and-spam;,f.verwimp,"<p>Hello Nice that I can ask a question here I am a private person. however I get quite a lot of emails  When I get about ten e-mails a day, half of them(at least5 out of ten) are spam, Some go in Spamfolder immediatly, some don't. Nowadays I get spammails from one company that  I removed that come back in my Thunderbird emaillist, They return in my unread mail later, How can I BLOCK emailadresses ? I would also like 'stupid' mailadresses(like: <a href=""mailto:1234@zyx.com"" rel=""nofollow"">1234@zyx.com</a>) to get blocked straightaway </p><p>Frank from the Netherlands </p>",f.verwimp;Mozilla-assistent;,false,false,false,";useragent:Mozilla/5.0 (Windows NT 10.0; Win64; x64; rv:149.0) Gecko/20100101 Thunderbird/149.0.2;ff_version:149.0.2;os:Windows 10/11;troubleshooting:Firefox with Thunderbird, 2 emailaccounts",1,0,0,,,
1576657,2026-04-16 05:37:06 -0700,2026-04-16 06:17:29 -0700,it,thunderbird,importare indirizzi email da gmail,false,,,false,1812026,1812026;,contacts,windows-11;thunderbird;contacts;,mauri.boa,"<p>buongiorno a tutti, ho acquistato un nuovo PC con sistema operativo windows 11 (prima avevo windows 10) dopo le varie configurazioni, ho installato thunderbird ma, una volta installato non ho più gli indirizzi mail memorizzati. gentilmente vi chiedo quale è la procedura di recupero di questi indirizzi. ringrazio in anticipo chi mi saprà dare indicazioni. cordiali saluti </p>",mauri.boa;@next;,false,false,false,;useragent:Mozilla/5.0 (Windows NT 10.0; Win64; x64; rv:149.0) Gecko/20100101 Firefox/149.0;tb_version:Version 149.0.2 |;os:Windows 11,1,0,0,,,
1576680,2026-04-16 10:08:40 -0700,2026-04-16 12:26:33 -0700,it,thunderbird,"Buongiorno chiedo cortesemente perche nell'invio di posta con dominio office 365 mi da errore invio ho cambiato piu volte smpt e porta e autenticazione in arrivo ricevo nuova posta senza problemi,",false,,,false,1812084,1812084;,send-and-receive-email,windows-10;thunderbird;send-and-receive-email;needsinfo;,mircoloretoni,"<p>vorrei capire se è un problema di office365 come dominio oppure va nno modificate le impostazioni accaunt di tumberg nel server di uscita ,ho effettuato delle ricerche in internet cambiando smpt porta e altro ma continua  ha darmi errore quando invio,inserisco qui sotto l'errore: </p><p><br> Invio del messaggio non riuscito. Non è stato possibile inviare il messaggio perché la connessione al server in uscita (SMTP) <a href=""http://smtp.office365.com"" rel=""nofollow"">smtp.office365.com</a> non è riuscita. Il server potrebbe non essere disponibile o rifiutare le connessioni in uscita (SMTP). Verificare che le impostazioni del server in uscita (SMTP) siano corrette e riprovare. </p>",mircoloretoni;@next;,false,false,false,";useragent:Mozilla/5.0 (Windows NT 10.0; Win64; x64) AppleWebKit/537.36 (KHTML, like Gecko) Chrome/147.0.0.0 Safari/537.36;tb_version:ultima alla data6;os:Windows 10",1,0,0,,,
1576682,2026-04-16 10:19:07 -0700,2026-04-16 12:03:41 -0700,en-US,thunderbird,Не отправляются письма с вложениями,false,,,false,1812080,1812080;,attachments,windows-11;thunderbird;attachments;,ksekacheva2004,"<p>Не отправляются письма с вложениями с Thrunderbird  с данных почт <a href=""mailto:mng326@anepmetall.ru"" rel=""nofollow"">mng326@anepmetall.ru</a> <a href=""mailto:mng323@anepmetall.ru"" rel=""nofollow"">mng323@anepmetall.ru</a> <a href=""mailto:209@anepmetall.ru"" rel=""nofollow"">209@anepmetall.ru</a> <a href=""mailto:204@anepmetall.ru"" rel=""nofollow"">204@anepmetall.ru</a> <a href=""mailto:201@anepmetall.ru"" rel=""nofollow"">201@anepmetall.ru</a> <a href=""mailto:205@anepmetall.ru"" rel=""nofollow"">205@anepmetall.ru</a> <a href=""mailto:220@anepmetall.ru"" rel=""nofollow"">220@anepmetall.ru</a> <a href=""mailto:218@anepmetall.ru"" rel=""nofollow"">218@anepmetall.ru</a> <a href=""mailto:206@anepmetall.ru"" rel=""nofollow"">206@anepmetall.ru</a> <a href=""mailto:208@anepmetall.ru"" rel=""nofollow"">208@anepmetall.ru</a> <a href=""mailto:217@anepmetall.ru"" rel=""nofollow"">217@anepmetall.ru</a> <a href=""mailto:215@anepmetall.ru"" rel=""nofollow"">215@anepmetall.ru</a> <a href=""mailto:mng314@anepmetall.ru"" rel=""nofollow"">mng314@anepmetall.ru</a> <a href=""mailto:211@anepmetall.ru"" rel=""nofollow"">211@anepmetall.ru</a> <a href=""mailto:202@anepmetall.ru"" rel=""nofollow"">202@anepmetall.ru</a> <a href=""mailto:210@anepmetall.ru"" rel=""nofollow"">210@anepmetall.ru</a> <a href=""mailto:214@anepmetall.ru"" rel=""nofollow"">214@anepmetall.ru</a> <a href=""mailto:buh-krsk@anepmetall.ru"" rel=""nofollow"">buh-krsk@anepmetall.ru</a> <a href=""mailto:212@anepmetall.ru"" rel=""nofollow"">212@anepmetall.ru</a> <a href=""mailto:207@anepmetall.ru"" rel=""nofollow"">207@anepmetall.ru</a>  проблема массовая. С других сервисов письма отправляются нормально. Подскажите в чем проблема? </p>",ksekacheva2004;davidsk;,false,false,false,";useragent:Mozilla/5.0 (Windows NT 10.0; Win64; x64) AppleWebKit/537.36 (KHTML, like Gecko) Chrome/144.0.0.0 YaBrowser/26.3.0.0 Safari/537.36;tb_version:149.0;os:Windows 11",1,0,0,,,
1576684,2026-04-16 10:26:55 -0700,2026-04-16 11:31:42 -0700,en-US,thunderbird,When transfering Thunderbird Profile between PCs passwords are not transferred,false,,,false,1812070,1812070;,save-passwords,windows-11;thunderbird;save-passwords;,phil_plisgyn,<p>When transferring Thunderbird Profile between PCs passwords are not transferred.  Transferring Profiles between two Windows 11 PCs (  both are the same version )  the email details are transferred but no passwords are.  I followed the instructions found on the forums to transfer profile between PCs </p>,phil_plisgyn;davidsk;,false,false,false,;useragent:Mozilla/5.0 (X11; Linux x86_64; rv:149.0) Gecko/20100101 Firefox/149.0;tb_version:149.0esr;os:Windows 11,1,0,0,,,
1576694,2026-04-16 11:37:38 -0700,2026-04-16 16:31:24 -0700,en-US,thunderbird,Email provider is ending service on June 30 and need to move folders and files to new email account,false,,,false,1812122,1812079;1812122;,import-and-export-email,windows-11;thunderbird;import-and-export-email;,cspurgin,"<p>I was just notified that my email provider is ending service after 30 years.  I need to move all my folders and messages from my old Provalue account to a new Gmail account.  Is there an easy way to do this?  Can I just change the account name and password as well as the server settings?  They are both Pop3 accounts.  I also need to point 131 message filters to the new Gmail account.  Is there a way to do this without having to rewrite all of the filters? Do I need to copy all of the folders and messages to the new account manually?  I have 30 years of emails that I still refer back to occasionally.  I need help, what do I do?  Thanks in advance for any help I can get. </p>",cspurgin;davidsk;,false,false,false,";useragent:Mozilla/5.0 (Windows NT 10.0; Win64; x64; rv:149.0) Gecko/20100101 Firefox/149.0;tb_version:140.9.1esr (64bit);os:Windows 11;kb_visits_prior:[""/en-US/kb/using-multiple-profiles""]",2,0,0,,,
1576695,2026-04-16 11:37:54 -0700,2026-04-16 22:45:52 -0700,it,thunderbird,Linee verticali,false,,,false,1812176,1812086;1812176;,customization,windows-10;thunderbird;customization;,radaellim,"<p>Buongiorno, vorrei togliere le linee verticali (vedere allegato), che per me sono molto fastidiose, che appaiono quando si risponde utilizzando lo stesso messaggio. Grazie </p>",radaellim;@next;,false,false,false,;useragent:Mozilla/5.0 (Windows NT 10.0; Win64; x64; rv:149.0) Gecko/20100101 Firefox/149.0;tb_version:140.9.1esr;os:Windows 10,2,0,0,,,
1576696,2026-04-16 11:50:41 -0700,2026-04-16 12:07:08 -0700,en-US,thunderbird,Thunderbird zeigt meine gesendeten emails doppelt an; beim Empfänger kommen sie korrekt nur 1x an,false,,,false,1812082,1812082;,customization,windows-11;thunderbird;customization;,berndcwolff,"<p>eigentlich = Alles im Betreff gesagt - nach Absenden steht die Anzeige im ""gesendet-Ordner"" doppelt. Empfänger berichteten mir, daß sie mein email nur ein Mal erhielten ...was auch korrekt ist  -   aber die Anzeige aller gesandeten emails in meinem Thunderbird-System erscheint doppelt. Wie - wo kann ich das abstellen? gern Ihre Hilfe    mein Laptop hat Win.11 </p>",berndcwolff;davidsk;,false,false,false,";useragent:Mozilla/5.0 (Windows NT 10.0; Win64; x64; rv:149.0) Gecko/20100101 Firefox/149.0;tb_version:149.0.2;os:Windows 11;kb_visits_prior:[""/de/kb/einen-absender-blockieren""]",1,0,0,,,
1576702,2026-04-16 12:48:22 -0700,2026-04-16 14:10:43 -0700,nl,thunderbird,ik kan wel emails ontvangen maar ineens niet meer versturen,false,,,false,1812107,1812107;,send-and-receive-email,windows-10;thunderbird;send-and-receive-email;,f.vdnoord,<p>Krijg melding dat er geen verbinding is met de server (pop3) uitgaande post. Ik ontvang wel inkomende post. Ik  ben druk bezig met het versturen van mails ivm met verhuizing documenten doorsturen naar notarissen e.d het komt mij dus zeer ongelukkig uit dat ik de mails niet kan versturen. </p>,f.vdnoord;Mozilla-assistent;,false,false,false,";useragent:Mozilla/5.0 (Windows NT 10.0; Win64; x64) AppleWebKit/537.36 (KHTML, like Gecko) Chrome/147.0.0.0 Safari/537.36;tb_version:??;os:Windows 10;kb_visits_prior:[""/nl/kb/thunderbird-android-importeren""]",1,0,0,,,
1576711,2026-04-16 13:39:41 -0700,2026-04-16 13:39:41 -0700,en-US,thunderbird,Google Calendar Notifications Always go to Spam,false,,,false,,"",junk-mail-and-spam,windows-11;thunderbird;junk-mail-and-spam;,Bob,<p>I accidentally moved a Google calendar notification to the spam folder 1 time and now I can't get TB to stop putting them in there. I reset the training data and created a message filter to catch them but they still automatically go into my spam folder. How do I get these messages to go to my inbox instead of spam? </p>,Bob;,false,false,false,";useragent:Mozilla/5.0 (Windows NT 10.0; Win64; x64) AppleWebKit/537.36 (KHTML, like Gecko) Chrome/147.0.0.0 Safari/537.36;tb_version:149.0.2 (64-bit);os:Windows 11",0,0,0,,,
1576723,2026-04-16 14:37:39 -0700,2026-04-16 14:37:39 -0700,en-US,thunderbird,Lost older emails,false,,,false,,"",email-and-messaging,firefox-14902;firefox-1490;windows-11;thunderbird;email-and-messaging;,belcher.thomas2,<p>In the morning start up ALL my previous emails received are missing gone? Need to retrieve them all. Very important old emails. </p>,belcher.thomas2;,false,false,false,;useragent:Mozilla/5.0 (Windows NT 10.0; Win64; x64; rv:149.0) Gecko/20100101 Firefox/149.0;ff_version:149.0.2;os:Windows 11,0,0,0,,,
1576725,2026-04-16 14:52:56 -0700,2026-04-16 14:52:56 -0700,en-US,thunderbird,Slow Email,false,,,false,,"",crashing-and-slow-performance,windows-11;thunderbird;crashing-and-slow-performance;,stpatrick,"<p>My email is very slow since I moved it to my new Dell laptop, sending, reading new messages, deleting and  moving, NOT old messages.  It was also slow on my old tower PC, but not this slow.  I might leave Thunderbird if this continues.  Not worth my time.   Thank you! </p>",stpatrick;,false,false,false,;useragent:Mozilla/5.0 (Windows NT 10.0; Win64; x64; rv:149.0) Gecko/20100101 Firefox/149.0;tb_version:149.0.2 (64-bit);os:Windows 11,0,0,0,,,
1576727,2026-04-16 15:03:16 -0700,2026-04-16 16:25:24 -0700,it,thunderbird,come faccio a vedere la posta in arrivo?,false,,,false,1812121,1812121;,send-and-receive-email,firefox-14902;firefox-1490;windows-11;thunderbird;send-and-receive-email;,emilio.jazzetti,<p>come faccio a vedere la posta in arrivo? </p>,emilio.jazzetti;@next;,false,false,false,;useragent:Mozilla/5.0 (Windows NT 10.0; Win64; x64; rv:149.0) Gecko/20100101 Firefox/149.0;ff_version:149.0.2;os:Windows 11,1,0,0,,,
1576730,2026-04-16 15:25:15 -0700,2026-04-16 21:31:50 -0700,en-US,thunderbird,Does the signature URL need to be a certain format for it to pull a jpg from web hosting?,false,,,false,1812164,1812119;1812156;1812158;1812164;,customization,linux;thunderbird;customization;,JJTX,"<p>"" attach the signature from a file instead "" </p><p>I put the URL in there and it does not retain it and use it as signature image.  It is a jpg.  It browses in a URL on my browser and loads fine but T/B refuses to allow it. </p><p>Suggestions ? </p>",JJTX;davidsk;,false,false,false,";useragent:Mozilla/5.0 (X11; Linux x86_64) AppleWebKit/537.36 (KHTML, like Gecko) Chrome/147.0.0.0 Safari/537.36;tb_version:140.9.1esr (64-bit;os:Linux;kb_visits_prior:[""/en-US/kb/signatures""]",4,0,0,,,
