id,created,updated,locale,product,title,is_solved,solution,solved_by,is_spam,last_answer,answers,topic,tags,creator,content,involved,is_archived,is_locked,is_taken,metadata,num_answers,num_votes_past_week,num_votes,taken_until,taken_by,updated_by
1563861,2026-02-03 16:18:42 -0800,2026-02-03 18:18:25 -0800,en-US,thunderbird,Reset Folder Order option,false,,,false,1798066,1798066;,customization,thunderbird;customization;,nospam17,<p>I am on 140.7.1esr (64-bit). My sub-folders under Inbox is not sorted alphabetically. I do not see any option to re-sort at the pop-up menu after I right-click at the account name. Does this mean the version I am on does not have this feature? </p>,nospam17;sfhowes;,false,false,false,";useragent:Mozilla/5.0 (Windows NT 10.0; Win64; x64) AppleWebKit/537.36 (KHTML, like Gecko) Chrome/144.0.0.0 Safari/537.36;os:Win 11 Pro",1,0,0,,,
1563863,2026-02-03 16:39:35 -0800,2026-02-03 16:58:22 -0800,en-US,thunderbird,Attachments to e-mails,true,1798061,rednoise,false,1798061,1798061;,attachments,windows-10;thunderbird;attachments;,eight2,<p>I don't find te way to attach any file to my e-mails. </p><p>Thanks for your help </p>,eight2;rednoise;,false,false,false,";useragent:Mozilla/5.0 (Windows NT 10.0; Win64; x64) AppleWebKit/537.36 (KHTML, like Gecko) Chrome/144.0.0.0 Safari/537.36 Edg/144.0.0.0;os:Windows 10;solver_id:7244666",1,0,0,,,
1563870,2026-02-03 18:11:01 -0800,2026-02-03 18:11:01 -0800,en-US,thunderbird,Transfer thunderbird passwords from phone to tablet,false,,,false,,"",passwords-and-sign-in,android;thunderbird;passwords-and-sign-in;,fygooog2,"<p>Hey all, here's my conundrum:I have tbird on my phone, 12 different email addys all told. Imagine if you can my dismay at finding no passwords transferred using that quick transfer thing. Please tell me there is a way to fix this without having to manually re-enter every dang pass... Thanks </p>",fygooog2;,false,false,false,;useragent:Mozilla/5.0 (Windows NT 10.0; Win64; x64; rv:140.0) Gecko/20100101 Firefox/140.0;os:Android,0,0,0,,,
1563871,2026-02-03 18:15:33 -0800,2026-02-03 18:15:33 -0800,en-US,thunderbird,Thunderbird on Android,false,,,false,,"",connectivity,thunderbird;connectivity;,dawhit50,"<p>Recently started using Thunderbird on Pixel 9a, Android v16. Just installed newest update to OS. Emails do not sync properly. New messages that are in my Gmail do not show up in Thunderbird until I do a manual update. This is true for all folders, but especially trash and spam. For example, messages that appeared in my Gmail trash folder this morning did not show up in Thunderbird trash at 7 pm MST this evening. When I did a manual sync, 10 messages from this morning suddenly showed up in Thunderbird. In Thunderbird settings, Background sync is set for Always. What do I need to do? </p>",dawhit50;,false,false,false,";useragent:Mozilla/5.0 (Linux; Android 10; K) AppleWebKit/537.36 (KHTML, like Gecko) Chrome/144.0.0.0 Mobile Safari/537.36;os:Android 16",0,0,0,,,
1563877,2026-02-03 19:01:22 -0800,2026-02-03 19:01:22 -0800,en-US,thunderbird,Can't download emails from ISP Server,false,,,false,,"",send-and-receive-email,windows-11;thunderbird;send-and-receive-email;,kingsnjan,"<p>Given Thunderbird version 140.7.1 esr  (32 Bit) </p><p>Since 27.01.26, no emails have been downloaded from my ISP Server and I don't know how to fix. </p><p>Note in the version above, it says (32 Bit) but Windows 11 is exclusively 64 bit&nbsp;???? </p>",kingsnjan;,false,false,false,;useragent:Mozilla/5.0 (Windows NT 10.0; Win64; x64; rv:147.0) Gecko/20100101 Firefox/147.0;os:Windows 11,0,0,0,,,
1563882,2026-02-03 19:48:22 -0800,2026-02-03 19:48:22 -0800,en-US,thunderbird,Moving 90 folders,false,,,false,,"",email-and-messaging,windows-11;thunderbird;email-and-messaging;,tcluster,"<p>I have a local folder which has 90 folders within it.  These are folders brought over from Eudora (the mail system I used before Thunderbird).  It would help me if I could easily move all 90 from their current ""Eudora"" folder to the big ""main"" folder that Thunderbird has.  To make it clear what I'm asking, here's an example, using two folders, Danbury and Fritz. </p><p>D (folders whose names begin with D) Eudora folder, which has two folders - Danbury and Fritz F (folders whose names begin with F) </p><p>Is there any way to move the 2 folders that are currently within the ""Eudora"" folder so that they're ""first level"" folders.  In other words, Danbury would be among the ""D"" folders and Fritz would be among the ""F"" folders. </p><p>The only way I know to achieve this is by manually creating the new folders, moving the items from the old folder to the new folder, and then deleting the old folder.  This is cumbersome. </p>",tcluster;,false,false,false,;useragent:Mozilla/5.0 (Windows NT 10.0; Win64; x64; rv:147.0) Gecko/20100101 Firefox/147.0;os:Windows 11,0,0,0,,,
1563889,2026-02-03 20:13:39 -0800,2026-02-03 20:13:39 -0800,en-US,thunderbird,CAN'T RESURRECT EMAILS AFTER ALL ATTEMPTS,false,,,false,,"",account-management,thunderbird;account-management;,whenangelscry,"<p>As a last resort to restore my emails after trying everything else, if I delete my account and register it again as a new account will I lose all current emails and folders? </p>",whenangelscry;,false,false,false,;useragent:Mozilla/5.0 (Windows NT 10.0; Win64; x64; rv:147.0) Gecko/20100101 Firefox/147.0;os:Win11,0,0,0,,,
1563890,2026-02-03 20:25:04 -0800,2026-02-03 20:25:04 -0800,en-US,thunderbird,OMEMO Support in Chat,false,,,false,,"",encryption,linux;thunderbird;encryption;,52303for,"<p>Could we see XMPP-Omemo support in TB Chat? It'd be such a usable feature, especially given it's usage in popular apps like Conversations... </p>",52303for;,false,false,false,";useragent:Mozilla/5.0 (X11; Linux x86_64; rv:140.0) Gecko/20100101 Firefox/140.0;os:Linux;kb_visits_prior:[""/en-US/kb/thunderbird-matrix-chat-faq""]",0,0,0,,,
