id,question_id,created,updated,content,creator,is_spam,num_helpful,num_unhelpful
1812432,1577052,2026-04-18 18:53:12 -0700,2026-04-18 18:53:12 -0700,"<p>Please quote the exact error message you see, in full. When did this start? Have you received the ""invitation"" from Comcast to migrate your email to Yahoo? </p><p>Your account settings should not change without your intervention, but it's good to confirm them anyway. Here are my working Comcast IMAP and SMTP settings. How do they compare with yours? Pay particular attention to the Authentication Method which should NOT be OAUTH2: </p><p>Incoming Server Type: IMAP Mail Server Incoming Server Name: <a href=""http://imap.comcast.net"" rel=""nofollow"">imap.comcast.net</a> Port: 993 User Name: &lt;my email address&gt; Connection Security: SSL/TLS Authentication method: Normal Password </p><p>SMTP Server Name: <a href=""http://smtp.comcast.net"" rel=""nofollow"">smtp.comcast.net</a> Port: 465 Connection Security: SSL/TLS Authentication method: Normal password User Name: &lt;my email address&gt; </p><p>Here are the POP3 server settings, in the rare case you use POP3 rather than IMAP: POP3 (Incoming): Incoming Server Type: POP Mail Server Incoming Server Name: <a href=""http://pop3.comcast.net"" rel=""nofollow"">pop3.comcast.net</a> Port: 995 User Name: &lt;my email address&gt; Connection Security: SSL/TLS Authentication method: Normal Password </p><p>Depending on what you find we can take additional steps. </p>",rednoise,false,0,0
1812462,1577052,2026-04-19 00:13:49 -0700,2026-04-19 08:57:09 -0700,"<p>Hi Lin my email has been working fine until today to answer your questions here it is NO I didn't make any changes or received the ""invitation"" from Comcast to migrate your email to Yahoo my imap has port 993 set and smtp port 465 and I am using normal password . here is the error that I am getting over and over again  ""Login to server <a href=""http://imap.comcast.net"" rel=""nofollow"">imap.comcast.net</a> with user id [edited]@comcast.net failed"" with options of  Retry, Enter New Password, Cancel  I have tried all three neither works  Please help  </p><p>thank you </p>",pspringer11,false,0,0
1812544,1577052,2026-04-19 20:38:07 -0700,2026-04-19 20:38:07 -0700,"<p>I'm afraid I don't have any more suggestions for you right now, but I was wondering if Comcast were themselves having technical difficulties, and indeed, someone else here was complaining about symptoms similar to yours, that they were getting unexplained password errors. In their case, the problem resolved itself today, which supports my idea that it was a Comcast problem. </p><p>How is it working for you today? </p>",rednoise,false,0,0
1812435,1577059,2026-04-18 19:07:44 -0700,2026-04-18 19:07:44 -0700,"<p>Try this: </p><p>- Delete your saved Comcast/Xfinity password from Thunderbird's Saved Passwords. They can be found in &lt;Settings | Privacy &amp; Security | Passwords | Saved Passwords button&gt;. You will find at least two entries, one for the IMAP server, one for SMTP. </p><p>- Check for saved cookies. They can be seen in &lt;Settings | Privacy &amp; Security | Web Content | Show Cookies button&gt;. There may not be any there, but if there are, delete them. </p><p>Now restart Thunderbird. When it checks for mail and when you send mail, you will be prompted for your password. </p><p>This usually works, but not always. Please report back with your results. </p>",rednoise,false,0,0
1812447,1577059,2026-04-18 20:50:13 -0700,2026-04-18 20:50:13 -0700,"<p>Thanks, Lin. I just followed your directions (above) exactly. Unfortunately, I still have the same error. Of course, I entered the same password, which is still correct for online login, correctly. </p><p>Any other suggestions? Thank you. </p>",Ferrell516,false,0,0
1812517,1577059,2026-04-19 12:09:10 -0700,2026-04-19 12:09:10 -0700,"<p>Earlier this Sunday morning, Thunderbird began receiving Comcast emails again as usual. Practically, I did nothing to resolve the problem. Thus, whatever happened fixed itself. Ain't modern software wonderfully aggravating? </p>",Ferrell516,false,1,0
1812528,1577059,2026-04-19 16:34:06 -0700,2026-04-19 16:34:06 -0700,"<p>I'm thinking Comcast was having technical difficulties, not that they would be likely to admit it. You weren't the only one having unexplainable logon difficulties - I saw at least two others yesterday. I'm glad your problem resolved itself - I was out of ideas. Hope theirs did, too. </p>",rednoise,false,0,0
1812531,1577059,2026-04-19 16:48:45 -0700,2026-04-19 16:48:45 -0700,"<p>Thanks, Lin. I too suspected a problem on Comcast's end. </p>",Ferrell516,false,0,0
1812433,1577060,2026-04-18 18:55:41 -0700,2026-04-18 18:55:41 -0700,"<p>When you update Cardbook, the tab disappears. Once you  choose it again from the Tools menu, the tab should stick again from session to session... until the next time you update Cardbook. </p>",rednoise,false,0,0
1812438,1577062,2026-04-18 19:26:32 -0700,2026-04-18 19:26:32 -0700,"<p>Can you provide a screen shot showing the grayed-out settings, please? </p>",rednoise,false,1,0
1812478,1577072,2026-04-19 02:38:53 -0700,2026-04-19 02:38:53 -0700,"<em><p>DD46 <a href=""#question-1577072"" rel=""nofollow"">said</a></p></em> <blockquote>I deleted an old email address for a friend, but every time I email her, the auto-complete feature includes both the current email address and the one for her old job. I've deleted that one, and it doesn't seem to show up in the Address Book anywhere, so why does it keep coming up in the auto-complete?   It's annoying to me and to the place of employment to have the emails go to the wrong address when I'm not watching very carefully.  How can I make sure this doesn't happen again? </blockquote> <p>I suggest you search all address books for the wrong email address.  It is probably hiding in plain sight in the collected address book but a search of the all address books is probably the most sure way to locate where it is. </p>",MattAuSupport,false,1,0
1812676,1577072,2026-04-20 21:19:13 -0700,2026-04-20 21:19:13 -0700,"<p>Hi Matt,  I did search ""all address books"" and the email address didn't come up. Then I clicked on the Contact and saw to the right that she had 2 email addresses listed. The wrong one was the secondary email listed. Not sure why the search didn't pull that up, but at least once I saw it I could delete it. That solved the problem! So your suggestion led me to the solution - thanks! DD </p>",DD46,false,0,0
1812484,1577096,2026-04-19 03:12:38 -0700,2026-04-19 03:12:38 -0700,<p>What happen if you hold shift while you open the composition widow? </p>,MattAuSupport,false,0,0
1812485,1577096,2026-04-19 03:17:33 -0700,2026-04-19 03:17:33 -0700,<p>nothing different doing that </p>,collydale2370,false,0,0
1812487,1577096,2026-04-19 03:24:31 -0700,2026-04-19 03:24:31 -0700,<p>Elsewhere a contributor suggested press alt. This brought some menu back but then disappeared again. Playing around with the alt function several times and then view enabled me to tick format menu and then restore default. </p>,collydale2370,false,0,0
1812476,1577102,2026-04-19 02:36:04 -0700,2026-04-19 02:36:04 -0700,"<p>Perhaps this will help. <a href=""https://support.mozilla.org/en-US/kb/cannot-send-messages"" rel=""nofollow"">https://support.mozilla.org/en-US/kb/cannot-send-messages</a> </p>",MattAuSupport,false,0,0
1812483,1577106,2026-04-19 03:11:45 -0700,2026-04-19 03:11:45 -0700,"<p>Right click the folder, select properties and then the repair button. </p>",MattAuSupport,false,0,0
1812492,1577106,2026-04-19 06:32:04 -0700,2026-04-19 06:32:04 -0700,"<p>Thank you, but I had found it in a previous version, and it didn't change anything. Same for the latest version. Still No Message found. </p>",extech,false,0,0
1812496,1577106,2026-04-19 07:52:45 -0700,2026-04-19 07:52:45 -0700,"<p>Try R. click Inbox &gt; Compact, then repair again. </p>",siffemoz,false,0,0
1812498,1577122,2026-04-19 07:55:55 -0700,2026-04-19 07:55:55 -0700,"<p>Se hai ripristinato il profilo, le password le puoi visualizzare direttamente in Thunderbird Menu &gt;  Impostazioni &gt; Privacy e sicurezza &gt; [Password salvate] infine click su [Mostra password] </p>",@next,false,0,0
1812499,1577122,2026-04-19 07:57:39 -0700,2026-04-19 07:57:39 -0700,"<p>Non le ha salvate. importando i profili ,tutte le password non sono state importate. </p>",rskowalsky,false,0,0
1812518,1577129,2026-04-19 13:17:05 -0700,2026-04-19 13:17:05 -0700,"<p>Per poter inquadrare il problema prova a fornire queste informazioni: </p> <ol><li> Versione di Thunderbird </li><li> Versione del sistema operativo </li><li> Provider delle caselle email (Gmail, Libero, Hotmail, etc.) </li><li> Tipologia di account (POP3, IMAP) </li><li> Estensioni installate </li><li> Messaggi di errore che vengono visualizzati durante l'utilizzo di Thunderbird </li><li> Software di sicurezza eventualmente presenti (Antivirus e simili) </li><li> Screenshot del problema (se utile a chiarire il contesto) </li></ol>",@next,false,0,0
1812516,1577134,2026-04-19 12:00:24 -0700,2026-04-19 12:00:24 -0700,<p>I don't know how we can assist you. Email accounts have have passwords. What are we missing? </p>,davidsk,false,0,0
1812568,1577151,2026-04-20 06:34:15 -0700,2026-04-20 06:34:15 -0700,"<p>Dat kan zeker, mits u gebruik maakt van IMAP. </p>",markh2,false,1,0
1812576,1577151,2026-04-20 07:15:32 -0700,2026-04-20 07:15:32 -0700,"<p>Dag Mark,  Dank voor jouw reactie. Ik heb er niet zo veel verstand van maar als ik in Thunderbird bij mijn accountinstellingen kijk, zie ik bij servertype ""IMAP-mailserver"" staan dus dat lijkt wel OK. </p><p>Nog een vraagje: ik sleep gelezen emails in Thunderbird vaak naar een lokale map om het te rubriceren. Worden die lokale mappen ook weergegeven in Thunderbird op de laptop? </p><p>M vr gr Francis </p>",f.c.mennega,false,0,0
1812606,1577151,2026-04-20 10:15:40 -0700,2026-04-20 10:15:40 -0700,"<p>Nee, de lokale mappen staan echt lokaal. Als u dergelijke mappen op twee plaatsen wilt zien, moet u submappen onder Postvak IN gebruiken, zodat ze ook op de server aanwezig zijn. IMAP zorgt namelijk voor synchronisatie met de mailserver. </p>",markh2,false,0,0
1812605,1577170,2026-04-20 10:13:27 -0700,2026-04-20 10:13:27 -0700,"<p>Hallo Jules, is dit zonder aanleiding gebeurd, of is er een update geweest of een wijziging aan de instellingen? </p>",markh2,false,0,0
1812679,1577174,2026-04-20 22:02:13 -0700,2026-04-20 23:04:16 -0700,"<p>Hello there Ash721 </p><p>Yes, Welcome ,it s possible to bring your own creations to thunderbird too. I should look for these two languages if they do </p><p>Yes, Thunderbird supports the Marathi language and the Devanagari script. </p>",Googlethunderbird.,false,0,0
1812682,1577174,2026-04-20 22:51:02 -0700,2026-04-20 23:38:00 -0700,"<p>Hello there Ash721 </p><p><br> In Thunderbird, the user interface language (UI) and the spell checker are two completely separate systems that can be configured independently </p>",Googlethunderbird.,false,0,0
1812689,1577174,2026-04-20 23:39:42 -0700,2026-04-20 23:47:11 -0700,"<p>Hello there </p><p><br> </p><p>Interface: Go to Settings &gt; General &gt; Language. Click Search for more languages to add Marathi. Restart Thunderbird to apply. Spell Check: Go to the Thunderbird Dictionary Page, download the Marathi dictionary, and install it via Add-ons and Themes. Usage: Right-click in a new email compose window to switch the spell-check language to Marathi. </p>",Googlethunderbird.,false,0,0
1812690,1577174,2026-04-20 23:39:43 -0700,2026-04-20 23:55:11 -0700,"<p>Hello there Ash721 </p><p>Did you had more questions? </p><p>Yes, Devanagari (the script used for Hindi, Marathi, Nepali, and Sanskrit) is supported in Mozilla Thunderbird. While it is a ""complex script"" (utilizing diacritics and ligatures), modern versions of Thunderbird support it similarly to other languages using Unicode (UTF-8). </p>",Googlethunderbird.,false,0,0
