id,question_id,created,updated,content,creator,is_spam,num_helpful,num_unhelpful
1811976,1576563,2026-04-15 20:52:13 -0700,2026-04-15 23:36:38 -0700,"<p>Hello there Dvd </p><p><br> </p><p><br> </p><p><br> <em><strong>Cause</strong></em> Greyed-out areas, folders, or menu options in Thunderbird are often caused by UI glitches, add-on conflicts, or synchronization issues. Areas are mostly frozen, greyed-out, or unusable. The symptoms can vary from minor to severe </p><p>Are you using chrome as browser? </p><p>Restarting in troubleshooting mode can help detect broken extensions or outdated add-ons that are cluttering our software. </p><p>First, repair the view layout. Once that is complete, you can switch to classic view. </p><p><em><strong>Restarting in troubleshoot mode</strong></em> <a href=""https://support.mozilla.org/en-US/kb/troubleshoot-mode-thunderbird"" rel=""nofollow"">https://support.mozilla.org/en-US/kb/troubleshoot-mode-thunderbird</a>. </p><p><em><strong>To use </strong></em> Restoring classic view. <em><strong>Open settings</strong></em> : click the hamburger menu&gt;on the top-right tittle bar and select settings. <em><strong>Appearance tab</strong></em> :click on the appearance tab in the left side pane. <em>Message list classic</em> : in the right-side pane.find the message list section. <em><strong>Change view style</strong></em> : change the <em>view style</em>  to table view. <em><strong>Enable classic view layout</strong></em> : click the hamburger menu again. Select&gt;view&gt;layout&gt;classic view . </p><p><em><strong>Tip</strong></em> Use a the latest version from us , thunderbird. <a href=""https://support.mozilla.org/en-US/kb/troubleshoot-mode-thunderbird"" rel=""nofollow"">https://support.mozilla.org/en-US/kb/troubleshoot-mode-thunderbird</a> </p>",Googlethunderbird.,false,0,0
1811960,1576565,2026-04-15 18:17:48 -0700,2026-04-15 18:17:48 -0700,"<p>When you signed in, you agreed to Mozilla guidelines. Do you see others posting four-letter-words here? That's right, it's just you. Clean up your act to get support. I find your post offensive. </p>",davidsk,false,0,1
1811991,1576565,2026-04-15 23:03:04 -0700,2026-04-15 23:03:04 -0700,"<p>Hi Paul, </p><p>I've edited your question, but please make sure to follow our <a href=""/en-US/kb/mozilla-support-rules-guidelines"" rel=""nofollow"">rules and guidelines</a> in the future. As David mentioned above, obscene language is not allowed here. </p>",denyshon,false,0,1
1811959,1576566,2026-04-15 18:06:49 -0700,2026-04-15 18:06:49 -0700,<p>You'll get the best answer by writing to the author. Addons are not developed or maintained by the Thunderbird team. </p>,davidsk,false,1,0
1812106,1576566,2026-04-16 13:56:36 -0700,2026-04-16 13:56:36 -0700,"<p>Thanks, David. </p>",BillTreloar,false,0,0
1811969,1576580,2026-04-15 20:02:32 -0700,2026-04-15 20:02:32 -0700,"<p>Oops, it's T-bird 102.15.1 instead, my bad! </p>",john.beech,false,0,0
1812100,1576580,2026-04-16 13:16:28 -0700,2026-04-16 13:16:28 -0700,"<p>Look at settings&gt;general and scroll down to the Disk Space area and adjust the compact setting to less frequentlly, and also consider checking the box to be asked each time. </p>",davidsk,false,0,0
1812024,1576583,2026-04-16 06:13:25 -0700,2026-04-16 06:13:25 -0700,<p>Quale errore ricevi esattamente? </p>,@next,false,0,0
1812072,1576595,2026-04-16 11:38:48 -0700,2026-04-16 11:38:48 -0700,"<p>I will assume you use Windows If you installed from <a href=""http://Thunderbird.net"" rel=""nofollow"">Thunderbird.net</a>, the profile is normally at  </p><pre>c:\users\&lt;yourid&gt;\appdata\roaming\thunderbird  </pre> <p>A simple way to locate it is to follow these steps;  </p> <ol><li> click help&gt;troubleshootinginformation </li><li> scroll down left side to 'profile folder' and click 'open folder'  </li><li> that will normally show the profile in the place described earlier.  </li></ol> <p>If that is true, here are sample steps to backup and restore profile: </p><p><strong>  BACKUP  </strong> </p> <ol><li> ensure thunderbird is not running </li><li> enter %appdata% in search window on task bar and press Enter key </li><li> this should open windows file explorer in Appdata\roaming folder </li><li> highlight the Thunderbird folder and copy to external media  </li></ol> <p>To locate Thunderbird, if there is a desktop icon, rightclick and select 'properties. </p><p><strong> RESTORE </strong> </p> <ol><li> ensure thunderbird is installed and NOT running </li><li> enter %appdata% in search window on task bar and press Enter key </li><li> delete the thunderbird folder </li><li> you should be in Appdata\roaming folder , copy&amp;paste the exported Thunderbird folder there.  </li><li> start thunderbird and all should be there </li></ol>",davidsk,false,0,0
1812035,1576607,2026-04-16 07:47:38 -0700,2026-04-16 07:47:38 -0700,"<p>Go to TB menu &gt; Settings &gt; General  </p><p>- scroll all the way down and click the 'Config editor' button on the right </p><p>- click 'Accept the risk and continue' if that appears </p><p>- search for mail.compose.attachment_reminder </p><p>Is it set to true? </p><p>Two entries below, is the mail.compose.attachment_reminder_keywords field populated? It should be this: </p><p>.doc,.pdf,.xls,.ppt,.rtf,.pps,attachment,attach,attached,attaching,enclosed,CV,cover letter </p><p>If both look right: does that also happen in <a href=""/en-US/kb/troubleshoot-mode-thunderbird"" rel=""nofollow"">Troubleshoot mode</a>? </p>",siffemoz,false,0,0
1812021,1576636,2026-04-16 05:07:47 -0700,2026-04-16 05:07:47 -0700,"<p>Sorry for that. Thunderbird is community driven. Please consider: </p><p>Become a Supporter Help us make Thunderbird better. </p><p>MZLA Technologies Corporation is the for-profit organization sustaining the free software mission of Thunderbird. Our work is to provide open source apps that are secure, private and available for users around the world. Your support helps us: </p><pre>   Develop new apps, integrations and features    Improve the interface, speed, and stability    Promote Thunderbird and software freedom    Serve millions of free app downloads each year </pre> <p><a href=""https://www.thunderbird.net/en-US/donate/"" rel=""nofollow"">https://www.thunderbird.net/en-US/donate/</a> </p>",wxie2016,false,0,0
1812096,1576642,2026-04-16 13:03:46 -0700,2026-04-16 13:03:46 -0700,<p>I suggest going online to free the email. </p>,davidsk,false,0,0
1812030,1576650,2026-04-16 07:12:18 -0700,2026-04-16 07:12:18 -0700,"<p>Meer informatie over het gebruik van het spamfilter wordt hier gegeven: <a href=""https://support.mozilla.org/nl/kb/thunderbird-en-ongewenste-spamberichten"" rel=""nofollow"">https://support.mozilla.org/nl/kb/thunderbird-en-ongewenste-spamberichten</a>. Binnen Thunderbird kunt u geen e-mailadressen blokkeren, wellicht wel bij uw e-mailprovider via webmail. Wat u wel kunt doen is berichten filteren, zie <a href=""https://support.mozilla.org/nl/kb/uw-berichten-ordenen-filters-gebruiken"" rel=""nofollow"">https://support.mozilla.org/nl/kb/uw-berichten-ordenen-filters-gebruiken</a>. </p>",Mozilla-assistent,false,0,0
1812026,1576657,2026-04-16 06:17:29 -0700,2026-04-16 06:17:29 -0700,"<p>Thunderbird è un programma per PC, la sua rubrica viene memorizzata sul computer. Se hai ancora accesso al vecchio computer o se hai un backup del profilo, la puoi importare nel nuovo. Qui trovi altri dettagli: <a href=""https://forum.mozillaitalia.org/index.php?topic=12289.0#post_backup_rubrica"" rel=""nofollow"">https://forum.mozillaitalia.org/index.php?topic=12289.0#post_backup_rubrica</a> </p>",@next,false,0,0
1812084,1576680,2026-04-16 12:26:33 -0700,2026-04-16 12:26:33 -0700,"<p>Hai già seguito queste istruzioni? -&gt; <a href=""https://support.mozilla.org/it/kb/autenticazione-oauth-microsoft-thunderbird-2023"" rel=""nofollow"">https://support.mozilla.org/it/kb/autenticazione-oauth-microsoft-thunderbird-2023</a> </p>",@next,false,0,0
1812080,1576682,2026-04-16 12:03:40 -0700,2026-04-16 12:03:40 -0700,"<p>Please translate the error message to English, and someone here may be able to assist. Thank you. </p>",davidsk,false,0,0
1812070,1576684,2026-04-16 11:31:42 -0700,2026-04-16 11:31:42 -0700,"<p>If you used the tools&gt;export menu, passwords are not transferred for security reasons. If you use your OS file transfer facility, then passwords will be transferred, except where an email provider requires new password on new PC. Here are sample steps to transfer a profile:  </p> <ol><li>    ensure thunderbird is NOT running on old machine </li><li>   enter %appdata% in search window on task bar and press Enter key </li><li>    this should open windows file explorer in Appdata\roaming folder </li><li>    highlight the Thunderbird folder and copy to external media </li><li>    ensure thunderbird is installed on second computer, started once and NOT running </li><li>    enter %appdata% in search window on task bar and press Enter key </li><li>    you should be in Appdata\roaming folder. DELETE the thunderbird folder there </li><li>    now , paste your copied thunderbird folder there. </li></ol> <pre>#   start thunderbird and all should be there </pre>",davidsk,false,0,0
1812079,1576694,2026-04-16 12:00:52 -0700,2026-04-16 12:00:52 -0700,"<ol><li> As the account name will change, create a new account - but keep the old one </li><li> Since this is a POP account, you will not lose any messages when the old account dies, as all messages are on PC </li><li> the filers are in a file called msgfilterrules.dat. it is a simple text file, so you can edit it with notepad. whether they work or not will depend on careful editing to adjust text from old account name to new name. Often, a simple find/replace works. Anyway, with a minimum of work, this is doable. After tweaking it, COPY to the new account.  To do that, click help&gt;troubleshootinginformation, scroll to 'profile folder', click 'open folder', click the Mail folder and then the folder for old POP account, copy the msgfilterrules.dat file and then select the folder for the new POP account, locate its default msgfilterrules.dat file and overlay it.  </li><li> to 'clean up, I suggest copying the message folders from old account to Local Folders so that you don't lose them. A simple way for that is to click help&gt;troubleshootinginformation, scroll again to 'profile folder' and click 'open folder' and, again, click the Mail folder and then the old POP folder. This time, look for message files, which will be in twos: e.g., inbox, inbox.msf, sent, sent.msf.. Ignore the msf files, but COPY the sister files and paste into the Mail\Local Folders file (rename if needed to prevent overlaying any existing files).  </li><li> once done, check that you salvaged all the messages and you can then delete the old account.  </li></ol> <p>When done, be sure to backup everything. Here is a sample of backup and restore steps, if ever needed.  <strong>  BACKUP  </strong> </p> <ol><li> ensure thunderbird is not running </li><li> enter %appdata% in search window on task bar and press Enter key </li><li> this should open windows file explorer in Appdata\roaming folder </li><li> highlight the Thunderbird folder and copy to external media  </li></ol> <p><strong> RESTORE </strong> </p> <ol><li> ensure thunderbird is installed and NOT running </li><li> enter %appdata% in search window on task bar and press Enter key </li><li> delete the thunderbird folder </li><li> you should be in Appdata\roaming folder , copy&amp;paste the exported Thunderbird folder there.  </li><li> start thunderbird and all should be there </li></ol>",davidsk,false,0,0
1812086,1576695,2026-04-16 12:27:46 -0700,2026-04-16 12:27:46 -0700,<p>Sono il segno convenzionale del testo citato. Che io sappia non si possono eliminare dalle impostazioni. </p>,@next,false,0,0
1812082,1576696,2026-04-16 12:07:08 -0700,2026-04-16 12:07:08 -0700,"<p>It may be your email provider. For example, I have a Gmail account and an Outlook account and I do NOT check the option to save a message in Sent folder, as Gmail and Outlook do that anyway. If I tick that box, two copies are sent. So, I am guessing that is your issue. If you provide the domain name of email provider, somone may be able to confirm that. And, if you use Gmail or Outlook, you now have an answer. :) Let me know. </p>",davidsk,false,0,0
1812107,1576702,2026-04-16 14:10:42 -0700,2026-04-16 14:10:42 -0700,"<p>Lees dit artikel even door voor mogelijke oplossingen: <a href=""https://support.mozilla.org/nl/kb/kan-geen-berichten-verzenden"" rel=""nofollow"">https://support.mozilla.org/nl/kb/kan-geen-berichten-verzenden</a>. </p>",Mozilla-assistent,false,0,0
