id,question_id,created,updated,content,creator,is_spam,num_helpful,num_unhelpful
1790524,1557909,2026-01-01 00:01:20 -0800,2026-01-01 00:01:20 -0800,<p>Try creating the account this way: </p><p>- go to TB menu &gt; Settings &gt; General &gt; Account hub &gt; uncheck 'Create accounts in the new Account Hub' </p><p>- go to TB menu &gt; New Account &gt; Email </p>,siffemoz,false,0,0
1790526,1557909,2026-01-01 00:24:23 -0800,2026-01-01 00:24:23 -0800,"<p>I found another solution bei using ""manuell einrichten"" (sorry, I use the German version) </p><p>But thanks for answering this quick. </p>",Anna_matthaei,false,0,0
1790527,1557909,2026-01-01 00:46:39 -0800,2026-01-01 00:46:39 -0800,"<em><p>Anna_matthaei <a href=""#answer-1790526"" rel=""nofollow"">said</a></p></em> <blockquote>I found another solution bei using ""manuell einrichten"" (sorry, I use the German version)  But thanks for answering this quick. </blockquote> <p>Excellent - you're welcome&nbsp;:-) </p>",siffemoz,false,0,0
1790532,1557910,2026-01-01 01:23:51 -0800,2026-01-01 01:23:51 -0800,"<p><img src=""https://assets-prod.sumo.prod.webservices.mozgcp.net/media/uploads/images/2026-01-01-00-42-27-d7333a.png""> Click the three dots in the image and then select the items you want shown from the menu. </p>",MattAuSupport,false,0,0
1790533,1557910,2026-01-01 01:35:43 -0800,2026-01-01 01:35:43 -0800,"<p>Thanks, except I  lost the three dots and don't know to get them back.&nbsp;:( </p>",mkirlow,false,0,0
