id,created,updated,locale,product,title,is_solved,solution,solved_by,is_spam,last_answer,answers,topic,tags,creator,content,involved,is_archived,is_locked,is_taken,metadata,num_answers,num_votes_past_week,num_votes,taken_until,taken_by,updated_by
1565114,2026-02-10 16:09:04 -0800,2026-02-11 03:11:02 -0800,en-US,thunderbird,"Inbox area/list empty, but says I have messages",false,,,false,1799440,1799440;,performance-and-connectivity,windows-11;thunderbird;performance-and-connectivity;,djmozilla123,"<p>My emails were all working (accounts were setup fine). Then, recently, when I opened Thunderbird, the main area (where my messages are displayed) is empty. If I choose another folder, still empty. BUT, the folders all say that there are messages in them (see the attached screenshot) </p><p>I have tried the following... 1. Opening Thunderbird in Troublshooting mode: This works, and the messages appear. But I don't want to have to open troubleshooting mode every time. 2. I have ZERO extensions installed, so asking to disable them obviously wont do anything. 3. I have tried to repair the folders (I have tried to repair the default inbox folder, and then tried to repair them all ... nothing worked). 4. I have backed up my thunderbird files, and tried reinstalling Thunderbird. Still didn't work.  5. I tried these three steps ... <a href=""https://www.mboxtooutlook.org/blog/thunderbird-inbox-missing-emails.html"" rel=""nofollow"">https://www.mboxtooutlook.org/blog/thunderbird-inbox-missing-emails.html</a> Didn't work either. </p><p>Any other suggestions? </p>",djmozilla123;Mapenzi;,false,false,false,";useragent:Mozilla/5.0 (Windows NT 10.0; Win64; x64) AppleWebKit/537.36 (KHTML, like Gecko) Chrome/144.0.0.0 Safari/537.36;os:Windows 11",1,0,0,,,
1565119,2026-02-10 16:35:20 -0800,2026-02-11 00:24:21 -0800,en-US,thunderbird,How do I get my emails of the black list,false,,,false,1799423,1799423;,send-and-receive-email,windows-11;thunderbird;send-and-receive-email;,sandysansoni,<p>I have been told my emails have been black listed how do I fix it please </p>,sandysansoni;siffemoz;,false,true,false,";useragent:Mozilla/5.0 (Windows NT 10.0; Win64; x64) AppleWebKit/537.36 (KHTML, like Gecko) Chrome/143.0.0.0 Safari/537.36 AVG/143.0.0.0;os:Windows 11",1,0,0,,,
1565121,2026-02-10 16:36:29 -0800,2026-02-11 00:23:38 -0800,en-US,thunderbird,I have been told my emails have been black listed how do I fix it please,false,,,false,1799422,1799422;,send-and-receive-email,windows-11;thunderbird;send-and-receive-email;,sandysansoni,<p>I have been told my emails have been black listed how do I fix it please </p>,sandysansoni;siffemoz;,false,false,false,";useragent:Mozilla/5.0 (Windows NT 10.0; Win64; x64) AppleWebKit/537.36 (KHTML, like Gecko) Chrome/143.0.0.0 Safari/537.36 AVG/143.0.0.0;os:Windows 11",1,0,0,,,
1565122,2026-02-10 16:38:28 -0800,2026-02-10 16:38:28 -0800,en-US,thunderbird,download all (or partial) emails from gmail as quota too large,false,,,false,,"",import-and-export-email,windows-11;thunderbird;import-and-export-email;,dcal53,"<p>Hi, I have used ""takeout"" years before but not one of these. </p><p><a href=""https://www.google.com/search?q=download+Gmail+MBOX+viewer+tool&amp;oq=download+Gmail+MBOX+viewer+tool&amp;gs_lcrp=EgRlZGdlKgYIABBFGDkyBggAEEUYOdIBCTE5NzE5ajBqMagCALACAA&amp;sourceid=chrome&amp;ie=UTF-8"" rel=""nofollow"">https://www.google.com/search?q=download+Gmail+MBOX+viewer+tool&amp;oq=download+Gmail+MBOX+viewer+tool&amp;gs_lcrp=EgRlZGdlKgYIABBFGDkyBggAEEUYOdIBCTE5NzE5ajBqMagCALACAA&amp;sourceid=chrome&amp;ie=UTF-8</a> </p><p>Can I keep folder integrity using one of these?  And how if not obvious. </p><p>Quota is high. </p><p>Thanks </p>",dcal53;,false,false,false,";useragent:Mozilla/5.0 (Windows NT 10.0; Win64; x64) AppleWebKit/537.36 (KHTML, like Gecko) Chrome/144.0.0.0 Safari/537.36 Edg/144.0.0.0;os:Windows 11",0,0,0,,,
1565123,2026-02-10 16:42:33 -0800,2026-02-11 04:26:18 -0800,en-US,thunderbird,outgoing email not working,false,,,false,1799448,1799448;,send-and-receive-email,windows-11;thunderbird;send-and-receive-email;,rvwakefield,<p>Unable to authenticate to Outgoing server (SMTP) . Please check the password and verify the 'Authentication method' in 'Account Settings | Outgoing server (SMTP)'. </p>,rvwakefield;davidsk;,false,false,true,";useragent:Mozilla/5.0 (Windows NT 10.0; Win64; x64) AppleWebKit/537.36 (KHTML, like Gecko) Chrome/144.0.0.0 Safari/537.36 Edg/144.0.0.0;os:Windows 11",1,1,1,2026-02-11T04:36:14.321953,"{""username""=>""davidsk"", ""display_name""=>""david"", ""avatar""=>""https://firefoxusercontent.com/5eed5ecf74d9e1ec85435ea262bc016e""}",
1565124,2026-02-10 16:45:25 -0800,2026-02-10 16:45:25 -0800,en-US,thunderbird,"Windows cannot access the specified device, path or file.  You may not have the appropriate permissions to access the item.",false,,,false,,"",profiles,windows-7;thunderbird;profiles;,MiTasol,<p>My computer suddenly started the above error message for multiple programs.  The local computer shop was able to sort out what appeared to be the root cause and that recovered some things but I still needed to reinstall a number of programs. </p><p>The program I am terrified of reinstalling is Thunderbird.  All my emails on five email accounts since 2011 are stored in TB and I naturally do not want to lose any of them. </p><p>The major problems are the computer is running Win7 Enterprise and I am 82 years old so I am prone to needing things spelt out in greater detail than many others. </p><p>Can anyone provide a way to reset the program permissions (preferable) or identify the best way to reinstall and still access all my historic emails? </p><p>Thank you </p>,MiTasol;,false,false,false,;useragent:Mozilla/5.0 (Windows NT 6.1; Win64; x64; rv:109.0) Gecko/20100101 Firefox/115.0;os:Windows 7,0,0,0,,,
1565135,2026-02-10 19:12:40 -0800,2026-02-11 04:20:25 -0800,en-US,thunderbird,Can't stop one email sender from going into Junk mail,false,,,false,1799447,1799447;,junk-mail-and-spam,windows-11;thunderbird;junk-mail-and-spam;,duhnel,"<p>In the past week emails from one of my friends started going into junk mail.  The person in in my contacts.  I selected 'enable adaptive emailjunk mail..."" and selected the correct address book.  The mail still went to the junk folder.  I changed the 'move new junk mail to: my inbox, still went into the junk folder.  I had him send me 10  emails that I marked as 'not junk' still no success.  My emails come from <a href=""http://yahoo.com"" rel=""nofollow"">yahoo.com</a> - went there and there was nothing in the spam or junk folder in my yahoo email account.  This is happening to only one email address.  There's nothing strange in the title of the email or the content.  I've run out of ideas. </p>",duhnel;davidsk;,false,false,false,";useragent:Mozilla/5.0 (Windows NT 10.0; Win64; x64) AppleWebKit/537.36 (KHTML, like Gecko) Chrome/140.0.0.0 Safari/537.36;os:Windows 11;kb_visits_prior:[""/en-US/kb/thunderbird-and-junk-spam-messages""]",1,0,0,,,
1565160,2026-02-10 23:44:25 -0800,2026-02-10 23:44:25 -0800,en-US,thunderbird,File / Empty Trash,false,,,false,,"",junk-mail-and-spam,linux;thunderbird;junk-mail-and-spam;,theking2,<p>What is the function of File / Empty Trash? Will it empty trash in all mail accounts or only the selected? If I select Blogs &amp; News feeds will File / Empty Trash empty read posts there as well? Empty Trash is a bit unclear. </p>,theking2;,false,false,false,;useragent:Mozilla/5.0 (X11; Linux x86_64; rv:147.0) Gecko/20100101 Firefox/147.0;os:Linux,0,0,0,,,
1565163,2026-02-11 00:11:45 -0800,2026-02-11 00:11:45 -0800,en-US,thunderbird,how can i supress duplicate adress in thunderbird?,false,,,false,,"",contacts,linux;thunderbird;contacts;,marc.nerot,<p><strong>i have duplicate adress. i want to supress them</strong> </p>,marc.nerot;,false,false,false,;useragent:Mozilla/5.0 (X11; Linux x86_64; rv:147.0) Gecko/20100101 Firefox/147.0;os:Linux,0,0,0,,,
1565165,2026-02-11 00:24:15 -0800,2026-02-11 00:24:15 -0800,en-US,thunderbird,PROBLEM SMTP SERVER,false,,,true,,"",settings,thunderbird;settings;,huetclaudy,"<p>Subject: Persistent SMTP block on specific Outlook account (IMAP functional) ​Problem Description: Systematic failure of outgoing emails via SMTP on Mozilla Thunderbird for the address josettethirion@outlook.be. Crucial Note: Incoming mail (IMAP) works perfectly with the same credentials, proving that the authentication and the password used are correct. ​Technical Data &amp; Actions Taken: ​SMTP Configuration: Server <a href=""http://smtp.office365.com"" rel=""nofollow"">smtp.office365.com</a>, Port 587, STARTTLS (or port 465 SSL/TLS). ​Authentication: Using a 16-character App Password generated after enabling Two-Step Verification. ​Symptom: Systematic rejection of the SMTP connection (Command Error 12 or timeout). Other Outlook accounts configured on the same Thunderbird client and the same internet connection (Belgium) are working without any issues. ​Tests Performed: Complete purge of Thunderbird's password manager, alias verification, and full restart of network equipment. ​Conclusion: Since the reception service is operational and full access is functional via Webmail/Outlook App, the block is specific to the SMTP protocol for this particular account on the Microsoft server side. ​Request: Please lift any security restrictions or reset security flags for the SMTP service on this specific account. My mail for respons&nbsp;: huetclaudy@gmail.com </p>",huetclaudy;,false,false,false,";useragent:Mozilla/5.0 (Linux; Android 10; K) AppleWebKit/537.36 (KHTML, like Gecko) Chrome/144.0.0.0 Mobile Safari/537.36;os:W11",0,0,0,,,
1565166,2026-02-11 00:42:25 -0800,2026-02-11 04:31:26 -0800,en-US,thunderbird,Перестала отправляться почта с ящика Gmail,false,,,false,1799449,1799445;1799446;1799449;,send-and-receive-email,thunderbird;send-and-receive-email;,7063252,"<p>В один день перестала отправляться почта с ящика Google. В настройках исходящие почты проверку не проходит, входящие письма приходят хорошо. </p>",7063252;davidsk;,false,false,true,";useragent:Mozilla/5.0 (Macintosh; Intel Mac OS X 10_15_7) AppleWebKit/605.1.15 (KHTML, like Gecko) Version/26.2 Safari/605.1.15;os:Mac OS x 10_15_7;kb_visits_prior:[""/ru/kb/ne-otpravlyayutsya-soobsheniya""]",3,0,0,2026-02-11T04:41:10.874407,"{""username""=>""davidsk"", ""display_name""=>""david"", ""avatar""=>""https://firefoxusercontent.com/5eed5ecf74d9e1ec85435ea262bc016e""}",
1565168,2026-02-11 01:53:42 -0800,2026-02-11 01:53:42 -0800,en-US,thunderbird,No emails,false,,,false,,"",send-and-receive-email,windows-11;thunderbird;send-and-receive-email;,widgetwilk3,"<p>Anyone know why I cannot get emails this morning, Plusnet is my internet server, </p>",widgetwilk3;,false,false,false,;useragent:Mozilla/5.0 (Windows NT 10.0; Win64; x64; rv:147.0) Gecko/20100101 Firefox/147.0;os:Windows 11,0,0,0,,,
1565169,2026-02-11 01:53:57 -0800,2026-02-11 01:53:57 -0800,nl,thunderbird,hoe exporteer je het adressenbestand,false,,,false,,"",contacts,windows-11;thunderbird;contacts;,f.bosschers,<p>Hoe exporteer je het adressenbestand naar een map op mijn computer </p>,f.bosschers;,false,false,false,";useragent:Mozilla/5.0 (Windows NT 10.0; Win64; x64) AppleWebKit/537.36 (KHTML, like Gecko) Chrome/144.0.0.0 Safari/537.36 Edg/144.0.0.0;os:Windows 11;kb_visits_prior:[""/nl/kb/instellingen-gegevens-importeren-thunderbird""]",0,0,0,,,
1565170,2026-02-11 02:03:15 -0800,2026-02-11 02:03:15 -0800,it,thunderbird,"i messaggi eliminati non vanno nel cestino, ma vengono eliminati completamente",false,,,false,,"",email-and-messaging,windows-8;thunderbird;email-and-messaging;,mauro.dalpiaz1954,<p>i messaggi eliminati non vanno nel cestino ma vengono eliminati completamente </p>,mauro.dalpiaz1954;,false,false,false,";useragent:Mozilla/5.0 (Windows NT 10.0; Win64; x64) AppleWebKit/537.36 (KHTML, like Gecko) Chrome/144.0.0.0 Safari/537.36;os:Windows 8",0,0,0,,,
1565171,2026-02-11 02:18:52 -0800,2026-02-11 02:18:52 -0800,en-US,thunderbird,Creat directory,false,,,false,,"",accounts,windows-1011;thunderbird;accounts;,george501,<p>I can't create a directory for an account. I can't move a directory from one account to another. </p><p>Best Regards </p><p>Jerzy </p>,george501;,false,false,false,;useragent:Mozilla/5.0 (Windows NT 10.0; Win64; x64; rv:147.0) Gecko/20100101 Firefox/147.0;tb_version:147.0.1;os:Windows 10/11,0,0,0,,,
1565172,2026-02-11 02:28:11 -0800,2026-02-11 03:11:58 -0800,en-US,thunderbird,UNABLE TO SEND AND RECEIVE EMAILS FROM FREE-ONLINE (PLUSNET SERVER),false,,,false,,"",send-and-receive-email,thunderbird;send-and-receive-email;,gfinley,"<p>1. Was able to receive emails sent to my address xxxxxx@xxxxxxx.free<a href=""http://-online.co.uk"" rel=""nofollow"">-online.co.uk</a>, but unable to SEND my replies. Was getting this notification: 'Send message error. Sending of message failed. An error occurred while sending mail. The mail server responded: Unknown sender. Please verify that your email address is correct in your account settings and try again, OK' (see attached). 2. Checked all settings, all correct as used to be before the problem started. 3. At some stage, I tried changing the password in Settings &gt; Privacy &amp; Security &gt; Passwords &gt; Saved passwords &gt; Saved logins to see if that helped. It didn't. 4. This time I also failed to receive emails in my INBOX (except for the Mozilla new sign-in email) and got this other notification: ' Login to account ""xxxxxx@xxxxxxx.free<a href=""http://-online.co.uk"" rel=""nofollow"">-online.co.uk</a>"" failed. Login to server <a href=""http://mail.free-online.net"" rel=""nofollow"">mail.free-online.net</a> with Username xxxxxxx failed. Enter new password/Cancel/Retry'. 5. I tried Cancel and Retry (several times) but was still getting the same notif. (see attached). 6. I removed the free-online Server from the Saved logins (Provider: smtp://<a href=""http://relay.free-online.net"" rel=""nofollow"">relay.free-online.net</a>, User: xxxxxxx) with the intention of restoring it with a new password - but found I couldn't restore the free-online server. So I decided the best thing to do was to restore the password as it was before and to ask for help here. I will have to check on the webmail until the problem is resolved. </p><p>NB1. Free-online is a sub section of Plusnet. NB2. Last year I received an email from Greenby saying something about maybe taking over from Plusnet and that I would be notified if and when I had to do anything. I have not received any such instructions so left things as they were. Many thanks for your help from a not-very-techy so stressed old lady. </p>",gfinley;,false,false,false,;useragent:Mozilla/5.0 (Macintosh; Intel Mac OS X 10.15; rv:147.0) Gecko/20100101 Firefox/147.0;tb_version:140.5.0esr (aarch64);os:Mac Sequoia 15.7.3 (macbook air M2),0,0,0,,,gfinley
1565185,2026-02-11 04:06:39 -0800,2026-02-11 04:06:39 -0800,nl,thunderbird,"The connection with my email adresses suddenly stops one day from another, using Thunderbird.",false,,,false,,"",send-and-receive-email,windows-11;thunderbird;send-and-receive-email;,info4277,"<p>Van de een op de andere dag lijkt de server de berichten niet meer op te halen in mijn Thunderbird app. Het gaat om de mail adressen info@egoat.nl en support@egoat.nl. Ik heb de IMAP en SMTP instellingen nu meerdere keren ingevoerd, maar het lukt niet. Is hier een update geweest aan jullie kant? </p><p>Instellingen voor inkomende e-mail (IMAP)  • Server: imap.transip.email  • Poort: 993  • SSL: ingeschakeld  • Gebruikersnaam: je e-mailadres  • Wachtwoord: het wachtwoord dat je voor dit e-mailadres hebt ingesteld  </p><p>Instellingen voor uitgaande e-mail (SMTP)  • Server: smtp.transip.email  • Poort: 465  • SSL: ingeschakeld  • Gebruikersnaam: je e-mailadres  • Wachtwoord: het wachtwoord dat je voor dit e-mailadres hebt ingesteld </p>",info4277;,false,false,false,";useragent:Mozilla/5.0 (Windows NT 10.0; Win64; x64) AppleWebKit/537.36 (KHTML, like Gecko) Chrome/144.0.0.0 Safari/537.36 Edg/144.0.0.0;tb_version:Onbekend;os:Windows 11",0,0,0,,,
