id,question_id,created,updated,content,creator,is_spam,num_helpful,num_unhelpful
1793649,1560091,2026-01-13 22:23:46 -0800,2026-01-13 22:23:46 -0800,"<p>Enable the Menu Bar on the Calendar tab, then Events &amp; Tasks/Find Events. </p>",sfhowes,false,0,0
1793643,1560103,2026-01-13 21:31:56 -0800,2026-01-13 21:31:56 -0800,"<p><a href=""https://www.thunderbird.net/en-US/"" rel=""nofollow"">https://www.thunderbird.net/en-US/</a> </p>",rednoise,false,0,0
1793740,1560103,2026-01-14 07:04:00 -0800,2026-01-14 07:04:00 -0800,"<p>Eric, what makes you believe that Thunderbird is corrrupted? Re-installing Thunderbird does not usually fix problems. If you describe your problems, people here may be able to help more. </p>",mozilla98,false,0,0
1793664,1560106,2026-01-14 00:35:02 -0800,2026-01-14 00:35:02 -0800,"<p>The email provider's server is doing that. It's not unusual for that to happen when sending messages to many  people at once or multiple messages at the same time, but for that to happen with only three seems too harsh. Make a complaint with their customer support. </p>",siffemoz,false,0,0
1793743,1560107,2026-01-14 07:12:58 -0800,2026-01-14 07:12:58 -0800,"<p>Hi Joe, </p><p>What does the error message say? </p><p>When you set up the account, were your user name and password accepted? </p><p>Where and how did you block Thunderbird from accessing your contacts? Contacts where? In iCloud? </p><p>Please report your incoming and outgoing server settings. Incoming server settings are in account settings &gt; server settings. Outgoing server settings are in account settings &gt; click on account name &gt; edit SMTP server. </p><p>We will need this information for each server: </p><p>server name port connection security method authentication method username: just report if whether or not you are using your full e-mail address </p>",mozilla98,false,0,0
1793668,1560122,2026-01-14 00:38:42 -0800,2026-01-14 00:38:42 -0800,"<p><em>In this section of the forum we speak Italian. For english support -&gt; <a href=""https://support.mozilla.org/en-US/questions/new/thunderbird/form"" rel=""nofollow"">https://support.mozilla.org/en-US/questions/new/thunderbird/form</a> </em> </p>",@next,false,0,0
1793698,1560124,2026-01-14 03:28:12 -0800,2026-01-14 03:28:12 -0800,"<p>Install the very useful add-on ""Compact Headers"". <a href=""https://services.addons.thunderbird.net/az/thunderbird/addon/compact-headers/"" rel=""nofollow"">https://services.addons.thunderbird.net/az/thunderbird/addon/compact-headers/</a> Instead of ""Wide"" view I'm using Classic"" view (image) </p>",Mapenzi,false,0,0
1793739,1560124,2026-01-14 07:00:14 -0800,2026-01-14 07:00:14 -0800,<p>View &gt; Layout &gt; Vertical view may work well for you too. </p>,mozilla98,false,0,0
1793749,1560130,2026-01-14 07:47:56 -0800,2026-01-14 07:47:56 -0800,"<p>I presume an IMAP account, as POP only retrieves from inbox. If there are messages in a folder other than the inbox, highlight the folder, rightclick, select properties, and tick to check this folder when retrieving messages. If I misunderstood your issue, please clarify. thank you </p>",davidsk,false,0,0
1793748,1560135,2026-01-14 07:43:32 -0800,2026-01-14 07:43:32 -0800,"<p>the profile is at appdata\roaming, not appdata\local  Try again </p>",davidsk,false,0,0
1793755,1560135,2026-01-14 08:24:11 -0800,2026-01-14 09:13:53 -0800,"<p>Thanks: right, there are profiles in both locations, it seems the Roaming one is the correct one. Deleting this successfully removes the orginal POP3 account; I have since discovered that deleting Google cookies forces a a new password reentry, so that takes care of that, but it's still not authenticating. For the record I can still access the Gmail account via Outlook and web. I have checked the incoming and outgoing server settings in Account hub and they seem correct, also OAuth2 is selected </p>",davidhealer4,false,0,0
1793737,1560140,2026-01-14 06:57:29 -0800,2026-01-14 06:57:29 -0800,"<p>Hi Jesper, </p><p>The error was trying to re-use the previous account and just changing some settings. One has to add the new account, transfer messages from the old account either to local folders or the new account, and then disable or delete the old account. </p><p>The new account seems to be an IMAP account. Is it? IMAP synchronizes folders with the server. When you had your inbox and other folders access the new account, those folders were synchronized with the new account. </p><p>But I do not understand why you can find messages from the old account by searching for them or why the names of all the folders are preserved in the folderTree.json file. So my diagnosis could be wrong. </p><p>I believe that you have two options: </p> <ol><li> Re-connect to the old account if you still can, and start this process over. </li><li> Restore from a back-up. </li></ol> <p>Maybe a third option: if your old account was a POP account, I understand that those messages are still on your local drive. Was it a POP account? </p>",mozilla98,false,0,0
1793745,1560143,2026-01-14 07:14:40 -0800,2026-01-14 07:14:40 -0800,"<p>Poškozený index složky (NEJČASTĚJŠÍ PŘÍČINA). Thunderbird má zprávy fyzicky stažené, ale index složky je rozbitý. </p><p>Postup (bezpečný – o maily nepřijdete): Pravým tlačítkem klikněte na složku Doručená pošta (Inbox) u účtu Atlas Zvolte Vlastnosti Klikněte na Opravit složku Potvrďte a vyčkejte (může trvat i několik minut) Restartujte Thunderbird </p><p>Ve většině případů se zprávy okamžitě objeví. </p>",Ansamb,false,0,0
1793753,1560143,2026-01-14 08:11:50 -0800,2026-01-14 08:11:50 -0800,"<p>Bohužel, nepomohlo. Při uvedeném postupu se ukazuje počet zpráv 0, a nic se neopraví. Atlas účet vůbec nefunguje. Když z něj odešlu zprávu na jiný email, jako odeslaná se neukáže, avšak doručena je. To jsem tedy blázen... </p>",krizova.gabriela,false,0,0
1793757,1560143,2026-01-14 08:47:55 -0800,2026-01-14 08:47:55 -0800,"<p>Je zapnutý filtr / skryté zprávy. Někdy je aktivní filtr, který způsobí, že se zdá, že žádné zprávy nejsou. </p><p>Zkontrolujte: Nahoře nad seznamem zpráv: zda není aktivní Rychlý filtr (ikona trychtýře) klikněte na „Zobrazit vše“ Menu Zobrazit → Zprávy nastavte Vše </p>",Ansamb,false,0,0
1793759,1560143,2026-01-14 09:01:35 -0800,2026-01-14 09:01:35 -0800,"<p>Je taky možné, že antivirus blokuje poštovní databázi. </p>",Ansamb,false,0,0
1793763,1560143,2026-01-14 09:10:33 -0800,2026-01-14 09:10:33 -0800,"<p>Je mi moc líto, ale ""zobrazit vše"" - píše žádné zprávy, antivirus Eset jsem vypnula a taky to nepomohlo. Blbé je, že v archivovaných zprávách mám některé licence.... </p><p>Přitom notifikace došlých zpráv ukazuje, že přišel nový mail, ale zobrazit se nedá </p>",krizova.gabriela,false,0,0
1793746,1560147,2026-01-14 07:17:20 -0800,2026-01-14 07:17:20 -0800,<p>Asi je poškozená složka Odeslané </p><p>Pravým tlačítkem na Odeslané Vlastnosti Opravit složku Restart Thunderbirdu </p>,Ansamb,false,0,0
1793747,1560150,2026-01-14 07:41:47 -0800,2026-01-14 07:41:47 -0800,"<p>The IP address brings up a webpage with information explicitly for your problem. Often there is a 'more' link on the page for specific guidance from your email provider They are abdicating their responsibility here. Thunderbird is only the messenger, presenting that message to you. However, if you post back the complete URL, including the IP numbers, someone here may be able to read the page and see what it says. Thank you. </p>",davidsk,false,0,0
1793744,1560164,2026-01-14 07:13:19 -0800,2026-01-14 07:13:19 -0800,"<p>Kedves Gábor! </p><p>Konkrétan ugyanazt a funkcionalitást nem tudja az androidos alkalmazás, de a beérkezett üzeneteket tudod egyesített módon kezelni. </p><p>A <em>Beállítások -&gt; Általános beállítások -&gt; Megjelenés</em> oldalon, a <em>Fióklista</em> szakaszban kapcsold be az <em>Egységes beérkezett üzenetek megjelenítése</em> lehetőséget. Ezután ez is megjelenik a fióklistában. Lásd a mellékelt képeket. </p><p>Üdv, Balázs </p>",meskobalazs,false,0,0
