id,created,updated,locale,product,title,is_solved,solution,solved_by,is_spam,last_answer,answers,topic,tags,creator,content,involved,is_archived,is_locked,is_taken,metadata,num_answers,num_votes_past_week,num_votes,taken_until,taken_by,updated_by
1443004,2024-03-22 11:46:03 -0700,2024-03-23 07:59:37 -0700,en-US,thunderbird,"Printing emails when on print screen, email shows as garblely gook.",false,,,false,1643699,1643643;1643699;,troubleshooting,fix-problems;,kerbelcpa,"<p>What do I need to do when I go to print and print screen comes up, a display shows my email in garblely gook.  Also prints that way.  I just started having this problem with email I received. </p>",kerbelcpa;MattAuSupport;,true,false,false,";category:fix-problems;useragent:Mozilla/5.0 (Windows NT 10.0; Win64; x64) AppleWebKit/537.36 (KHTML, like Gecko) Chrome/123.0.0.0 Safari/537.36;product:thunderbird",2,0,3,,,
1443005,2024-03-22 11:49:58 -0700,2024-03-23 04:01:39 -0700,en-US,thunderbird,LOG-IN PROBLEM,false,,,false,1643669,1643669;,other,other;,sinai,"<p>ON MAC VENTURA I AM REQUIRED TO LOG-IN TWICE. 1. THE FIRST PASSWORD ENTRY OPENS THE PAGE BUT DOES NOT CONNECT TO THE SERVER 2, THE SECOND PASSWORD ENTRY CONNECTS ME TO THE SERVER. </p>",sinai;christ1;,true,false,false,;category:other;useragent:Mozilla/5.0 (Macintosh; Intel Mac OS X 10.15; rv:124.0) Gecko/20100101 Firefox/124.0;product:thunderbird,1,0,0,,,
1443006,2024-03-22 11:51:08 -0700,2024-03-22 14:41:37 -0700,es,thunderbird,PROBLEMAS PARA ENVIAR  MAIL,false,,,false,1643603,1643603;,troubleshooting,fix-problems;,danielcastro7,"<p>Desde hace meses no puedo enviar mails . El programa que uso es&nbsp;: Thunderbird 115.9.0 ( 64 bit) y el proveedor de internet es Fibertel de Argentina . Luego de estar un tiempo tratando de logearse aparece el siguiente mensaje de error&nbsp;: Cannot connect to SMTP server 24.232.0.227 (24.232.0.227:587), connect error 10060. Espero que se encuentre la solución . Gracias </p>",danielcastro7;pcp04;,true,false,false,";category:fix-problems;useragent:Mozilla/5.0 (Windows NT 10.0; Win64; x64) AppleWebKit/537.36 (KHTML, like Gecko) Chrome/122.0.0.0 Safari/537.36;product:thunderbird",1,0,0,,,
1443008,2024-03-22 12:02:49 -0700,2024-03-26 11:21:45 -0700,it,thunderbird,Sincronizzare email e cartelle di Thunderbird con server email remoto,true,1643859,@next,false,1644300,1643634;1643663;1643698;1643764;1643838;1643855;1643859;1643871;1644263;1644266;1644300;,other,other;,dmtogaunmdtpbb,"<p>Buonsera  mi sono iscritat per chiedere un supporto/aiuto su Thunderbird 115.9.0 64 bit per windows Provero´ad essere quanto piu´chiara possibile Con un plugin (di terze parti) caricato in Thunderbird 115.9.0  ho importato un file mbox visto he la procedura e´nuova per adesso ho solo copiato nella cartella del nuovo account (in pratica l´operazione che sto facendo e´una migrazione di email da un account vecchio che chiudero´ad uno nuovo). Adesso nel mio pc ho Thunderbird 115.9.0 ,con la nuova email (gmail) e appunto una email che ho importato da mailbox e attualmente sta nella cartella di posta in arrivo,ma tutto questo sta nel mio Thunderbird 115.9.0 e sul mio pc. Come faccio a mandare il tutto (e una volta che ci sono riuscita passero´le altre email) dal mio account che sta nel mio pc /Thunderbird 115.9.0  al server il remoto? Penso che dovrei sincronizzare lßaccount ""locale"" cosi´che possa aggiornarsi con il server remoto  Come e cosa devo fare? Spero sia stata chiara qualora non mi fossi spiegata chiedete e vedro´di spiegarmi meglio Grazie  Sabrina </p>",dmtogaunmdtpbb;@next;,true,false,false,";category:other;useragent:Mozilla/5.0 (Windows NT 10.0; Win64; x64) AppleWebKit/537.36 (KHTML, like Gecko) Chrome/122.0.0.0 Safari/537.36;product:thunderbird;solver_id:5851508",11,0,0,,,
1443009,2024-03-22 12:07:55 -0700,2024-04-01 11:57:24 -0700,en-US,thunderbird,"Chrome size versus ""View/Font Size""",false,,,false,1645247,1643642;1645247;,calendar,calendar;,mondalealex,"<p>If I go into Config Editor and set PixelsPerPx and set it to 1.0, the ""Chrome"" (Icon size out of the calendar area) becomes tiny in my current resolution of 3840x2860, which I know seems ""oddball"" with screen magnfication at the recommended 300%.  </p><p>""new meeting"" is small enough to be unreadable. Seems to not honor the ""View|Font Size"" increases that the rest (""non-chrome"") of the layout does.  </p><p>Also, sometimes the needed controls are not visible (OK/Cancel/Save/etc.) when I do increase PixelsPerPx to say 1.2. Tbird ver 115.9 supernova; Windows 11 </p>",mondalealex;MattAuSupport;,true,false,false,";category:calendar;useragent:Mozilla/5.0 (Windows NT 10.0; Win64; x64) AppleWebKit/537.36 (KHTML, like Gecko) Chrome/123.0.0.0 Safari/537.36;product:thunderbird",2,0,0,,,
1443021,2024-03-22 14:20:34 -0700,2024-03-23 01:49:00 -0700,en-US,thunderbird,Latest version of Thunderbird won't work after months of attempting to fix it.,false,,,false,1643641,1643641;,troubleshooting,fix-problems;,pwelbourne,"<p>Why can't the latest version of Thunderbird be fixed to send mail, keep local folders, and receive latest email from connect xfinity??? This has gone on for months and months. </p>",pwelbourne;MattAuSupport;,true,false,false,;category:fix-problems;useragent:Mozilla/5.0 (Windows NT 5.1; Win64; x64; rv:91.0) Gecko/20100101 Thunderbird/91.13.1;product:thunderbird,1,0,0,,,
1443022,2024-03-22 14:28:33 -0700,2024-03-29 10:12:33 -0700,en-US,thunderbird,WTH? You hijacked my TBird!! Put it back!,true,1643818,MattAuSupport,false,1644855,1643639;1643800;1643818;1644330;1644670;1644855;,installation-and-updates,download-and-install_1;,atsdon1,"<p>I have been avoiding the update from last year like the plague. It had so many bugs and crap I went back to the previous version 102 and stayed happy. </p><p>No more! I opened it today and viola' you didn't ask, you didn't warn, you simply updated to your so called ""supernova"" before I had a chance to even review it before deciding to use it. </p><p>What kind of crass corporate control is this? Instead of accepting that we can intelligently testing and deciding what we want, you give up on user discretion and, you force it down our throats. </p><p>Tell me how to stuff it and get back to something I know that works, THEN AND ONLY THEN, tell me how to upgrade if I decide to do so. </p><p>If you can't tell, this is NOT tongue in cheek, I'm PISSED! </p>",atsdon1;MattAuSupport;,true,false,false,;category:download-and-install;useragent:Mozilla/5.0 (Windows NT 10.0; Win64; x64; rv:124.0) Gecko/20100101 Firefox/124.0;product:thunderbird;solver_id:2087937,6,0,0,,,
1443023,2024-03-22 14:37:08 -0700,2024-03-24 11:21:06 -0700,en-US,thunderbird,Thunderbird 102.6.1 inbox message background/forground color impossible to read.,true,1643940,smfabac,false,1643940,1643664;1643940;,other,other;,smfabac,"<p>I've been plagued with incoming messages that use a foreground/background color combination too dark to read without forwarding the message and then applying white to the swept text. The uploaded image shows the progression of reading the message, sweeping the text in the message (still uncomfortably dark with low contrast), forwarding the message (still unreadable), then select the text and apply white as the text color.  I've googled this problem to no avail as most hits are for color contrast in the inbox format for color. </p><p>One solution is to switch themes from ""dark"" or ""system theme - auto""  to ""light"" then Thunderbird switches to black text on a white background and the incoming message is readable.  </p><p>Is there a setting I'm missing to automatically solve this without having to swap theme's to read a message then swap back to preferred dark mode? </p>",smfabac;davidsk;,true,false,false,;category:other;useragent:Mozilla/5.0 (Windows NT 10.0; Win64; x64; rv:124.0) Gecko/20100101 Firefox/124.0;product:thunderbird;solver_id:2403274,2,0,2,,,smfabac
