id,question_id,created,updated,content,creator,is_spam,num_helpful,num_unhelpful
1663895,1454250,2024-07-24 10:56:47 -0700,2024-07-24 10:56:47 -0700,"<p>Did you remove the old password from Saved Passwords in Settings, restart TB, and enter the new one at the prompt? </p>",sfhowes,false,0,0
1663949,1454264,2024-07-24 16:01:16 -0700,2024-07-24 16:01:16 -0700,"<p>Please continue in <a href=""https://support.mozilla.org/en-US/questions/1454255"" rel=""nofollow"">https://support.mozilla.org/en-US/questions/1454255</a> </p>",wsmwk,false,0,0
1663894,1454267,2024-07-24 10:54:51 -0700,2024-07-24 10:54:51 -0700,"<p>Do you have <a href=""https://my.norton.com/extspa/passwordmanager"" rel=""nofollow"">Norton Password Manager</a> affecting TB passwords?  Normally, a password can be changed by removing it from Saved Passwords, restarting TB, entering the new password in the prompt and checking the box to have it stored in Saved Passwords.  This is for accounts with 'normal password' authentication, and is a bit different with other types of authentication.  If there are no entries in Saved Passwords, it often points to an external app that is managing passwords. </p>",sfhowes,false,0,0
1663906,1454267,2024-07-24 12:04:20 -0700,2024-07-24 12:04:57 -0700,"<p>Thanks, sfhowes.  I do not have Norton Password Manager installed, and have (temporarily) removed Norton 360. I do use Bitwarden as a password manager, but it is set up more as a reference rather than to autofill or manage passwords. There are no passwords in ""Saved Passwords"", and when I get the password entry prompt at login, there is no box to choose to save the password. I wonder if this is a result of an older preference setting?  I used Seamonkey for years and moved to Thunderbird a few years ago. </p>",linda.snider,false,0,0
1663948,1454267,2024-07-24 15:48:48 -0700,2024-07-24 15:48:48 -0700,"<p>If you've used the same profile over several versions of TB, there might be some obsolete file that is affecting the passwords.  I recall there was <a href=""https://support.mozilla.org/en-US/questions/1410289"" rel=""nofollow"">an issue with secmod.db</a>. </p><p>If you can't find the source of the problem, try adding an IMAP account to a new profile and see if it works correctly.  Help/Troubleshooting Info, about:profiles, to create and manage profiles.  The current profile is unaffected, and if the new one works, data can be transferred from the old to the new. </p>",sfhowes,false,0,0
1663810,1454278,2024-07-23 23:53:58 -0700,2024-07-23 23:53:58 -0700,"<p>Si, se ne è parlato diverse volte negli ultimi giorni ad esempio: </p> <ul><li> <a href=""https://support.mozilla.org/it/questions/1453783"" rel=""nofollow"">https://support.mozilla.org/it/questions/1453783</a> </li><li> <a href=""https://support.mozilla.org/it/questions/1453330"" rel=""nofollow"">https://support.mozilla.org/it/questions/1453330</a> </li><li> <a href=""https://forum.mozillaitalia.org/index.php?topic=79045.msg545884#msg545884"" rel=""nofollow"">https://forum.mozillaitalia.org/index.php?topic=79045.msg545884#msg545884</a>  </li></ul> <p>Per la PEC di Aruba leggi invece qui </p> <ul><li> <a href=""https://support.mozilla.org/it/questions/1451357"" rel=""nofollow"">https://support.mozilla.org/it/questions/1451357</a> </li><li> <a href=""https://support.mozilla.org/it/questions/1410316"" rel=""nofollow"">https://support.mozilla.org/it/questions/1410316</a> </li></ul> <p>Purtroppo in questo periodo sono due provider problematici da usare in Thunderbird. </p>",@next,false,0,0
1663902,1454281,2024-07-24 11:27:44 -0700,2024-07-24 11:27:44 -0700,"<p>A recent MS notice encouraged its users to switch incoming server to <a href=""http://outlook.office365.com"" rel=""nofollow"">outlook.office365.com</a>  and Oauth2 authentication. </p>",davidsk,false,0,0
1663814,1454285,2024-07-24 01:23:18 -0700,2024-07-24 01:23:18 -0700,<ul><li> Posso chiederti qual è la configurazione che stai usando? </li><li> Hai attivo qualche meccanismo di autenticazione a 2 fattori? </li><li> Puoi riportare l'esatto messaggio di errore che ricevi? </li><li> L'account è di tipo POP3 o IMAP? </li><li> La ricezione dei messaggi funziona correttamente? </li></ul>,@next,false,0,0
1663816,1454285,2024-07-24 01:32:21 -0700,2024-07-24 01:32:21 -0700,<p>allego configurazione thunderbird e messaggio di errore </p>,mediterranea.amministrazione,false,0,0
1663818,1454285,2024-07-24 02:14:06 -0700,2024-07-24 02:14:06 -0700,"<p>Mi spiace ma c'è poco che si possa fare da Thunderbird. <strong>È il server che rifiuta la connessione</strong>. Se i parametri sono quelli che ti suggerisce il tuo provider (io non li ho trovati online e non li posso verificare), allora il problema va risolto a livello del server. </p>",@next,false,0,0
1663819,1454291,2024-07-24 02:20:58 -0700,2024-07-24 02:22:49 -0700,<p>Probabilmente hai un problema con i permessi utente sulle cartelle in cui hai salvato il profilo di Thunderbird. L'utente che esegue Thunderbird ha pieni diritti di lettura e scrittura su tutti i file del profilo utente? </p>,@next,false,0,1
1663852,1454291,2024-07-24 06:10:46 -0700,2024-07-24 06:10:46 -0700,"<p>&lt;/blockquote&gt; </p><p>Ringrazio Next per la risposta, l'utente che poi sono io, ha il pieno controllo sia sulle cartelle che l'intero sistema essendo anche l'unico che utilizza il PC in cui è installato Thunderbird. Posso aggiungere che l'applicazione è installata su Windows 11 e meglio: </p><p>Edizione	Windows 11 Pro Versione	23H2 Data installazione:	‎30.‎01.‎2024 Build sistema operativo	22631.3880 Esperienza	Windows Feature Experience Pack 1000.22700.1020.0 </p><p>Ho anche pensato ad un aggiornamento Windows, ho disinstallato l'ultimo fatto, ma il problema in Thunderbird si è di nuovo presentato anche dopo l'aggiornamento alla versione 128.0.1esr Di seguito allego le informazioni sulle ultime versioni installate e che hanno creato questi problemi!! Allego anche lo Screenshot delle cartelle locali dove si vede che sono sparite le cartelle con relative icone di posta INVIATA e MODELLI, e le cartelle recuperate con i dati!!! Grazie e chi può darmi ev. soluzioni o cosigli su come risolvere questi spiacevoli incovenienti. Olivio </p> <em><p>olivio.beloedil <a href=""#question-1454291"" rel=""nofollow"">ha detto</a></p></em> <blockquote>Da qualche mese e dopo gli ultimi aggiornamenti effettuati. Ultima versione installata 128.0.1esr Ma anche con le versioni 115.0 e seguenti aggiornamenti riscontro dei seri problemi con le mie cartelle, spariscono o entrano in conflitto!! Dopo l'ultimo aggiornamento (128.0.1esr) la cosa sembra migliorata, però la cartella invata e modelli hanno sempre problemi (conflitto e spariscono!!) Inoltre quando invio nuovi messaggi non salva subito il messaggio inviato, ma si riceve il seguente (vedi immagine allegata). Poi di seguito lascia salvare il messaggio in una nuova cartella locale/inviata!!!  Sent(conflict PCxxxxx 23-07-2024 10-04-06)  Templates(conflict PCxxxxx 22-07-2024 10-00-36)  Premetto che uso il prodotto da molto tempo e con molta soddisfazione, ma ora il tutto è molto fastidioso e irritante, pur avendo il backup di tutto, ricostruire la situazione prima di questi problemi, sta diventando frequente e con molto tempo perso a capire cosa é successo.  Grazie per ev. risposte o soluzioni! Olivio </blockquote>",olivio.beloedil,false,0,0
1663860,1454291,2024-07-24 06:34:28 -0700,2024-07-24 06:34:28 -0700,"<p>I problemi che stai segnalando dipendono quasi sempre da problemi con il file system. Oltre alla questione dei diritti (a proposito su che percorso è il profilo di Thunderbird? perché dalle immagini non è visibile) può essere causato da carenza di spazio sul disco e da archivi che hanno raggiunto una dimensione eccessiva (ad esempio superiore ai 4 GB). Altra possibile causa è un software di sicurezza ""troppo zelante"" che tiene bloccato uno o più file di Thunderbird impedendo al programma di accedervi in scrittura. In ultima ipotesi potrebbe esserci anche un problema di integrità del disco/drive che potresti verificare con un programma di diagnostica SMART. </p><p>In generale comunque è difficile venirne a capo, per specie se stai usando IMAP forse si fa prima a ripartire da un profilo pulito -&gt; <a href=""https://support.mozilla.org/it/kb/utilizzare-piu-profili"" rel=""nofollow"">https://support.mozilla.org/it/kb/utilizzare-piu-profili</a> </p><p>Se vuoi sentire altre opinioni prova a scrivere anche sul forum di Mozilla Italia -&gt; <a href=""https://forum.mozillaitalia.org/index.php"" rel=""nofollow"">https://forum.mozillaitalia.org/index.php</a> </p>",@next,false,0,0
1663892,1454293,2024-07-24 10:46:08 -0700,2024-07-24 10:46:08 -0700,"<p>Just a suggestion, and not a solution:  check the mail from your online account, as some email providers mark mail as spam before thunderbird sees it. </p>",davidsk,false,0,0
1663822,1454294,2024-07-24 03:10:22 -0700,2024-07-24 03:10:22 -0700,"<p>OK I have worked it out. There's a tick box under advanced, advanced appears to be related to something else though. Poor design really. It's so sad that a program which is so richly featured is so difficult to use. Anyway, I'm sorted. </p>",addyjustforregistering,false,0,0
1663855,1454301,2024-07-24 06:15:04 -0700,2024-07-24 06:15:04 -0700,"<p>Check settings of them both. They should both be IMAP setup. If one is POP, it will retrieve the message and it won't then be available on the other. </p>",davidsk,false,0,0
1663835,1454302,2024-07-24 04:43:09 -0700,2024-07-24 04:52:12 -0700,"<p>Najľahší spôsob spočíva v nastavení automatickej odpovede priamo na strane poštového servera. </p><p>V prípade že máte dostatok času a nervy zo železa, tak tu je postup pre Thunderbird: <a href=""https://jasnapakablog.mozilla.cz/719167-jak-v-thunderbirdu-nastavit-automatickou-odpoved.html"" rel=""nofollow"">Jak v Thunderbirdu nastavit automatickou odpověď</a> </p>",Ansamb,false,0,0
1663859,1454302,2024-07-24 06:30:51 -0700,2024-07-24 06:30:51 -0700,<p>V případě odpovědi z Thunderbirdu je ovšem nutné mít celou dovolenou zapnutý svůj počítač. </p>,poljos-moz,false,1,0
1663844,1454307,2024-07-24 05:46:30 -0700,2024-07-24 05:46:30 -0700,<p>Probabilmente è il server a cui ti colleghi che è più lento del solito </p>,@next,false,0,1
1663876,1454307,2024-07-24 08:46:30 -0700,2024-07-24 08:46:30 -0700,"<p>Purtroppo non è questo il problema. Oltre a non visualizzare le mail è rallentato anche quando scrivo una mail, nel senso che che scrivo una parola ma non la visualizza in tempo reale, c'è troppa latenza da quando scrivo a quando scrive </p>",articoliperanimali,false,0,0
1663854,1454321,2024-07-24 06:13:07 -0700,2024-07-24 06:13:07 -0700,"<p>Not yet.  See <a href=""https://blog.thunderbird.net/2023/12/when-will-thunderbird-for-android-be-released/"" rel=""nofollow"">https://blog.thunderbird.net/2023/12/when-will-thunderbird-for-android-be-released/</a> </p>",davidsk,false,0,0
1663864,1454325,2024-07-24 06:50:28 -0700,2024-07-24 06:50:28 -0700,"<p>I forgot to add: please, oh please return a decent .deb installer that does not do such unpredictable things with file paths and permissions. </p>",nocom,false,0,0
1663891,1454327,2024-07-24 10:44:16 -0700,2024-07-24 10:44:16 -0700,"<p>The instructions <a href=""https://www.zoho.com/mail/help/thunderbird-imap-access.html"" rel=""nofollow"">here</a> have a few points to consider: enable IMAP access in Zoho settings, and if you set two-factor authentication on the account, generate an app-specific password and use that in TB instead of the account password. </p>",sfhowes,false,0,0
1663885,1454355,2024-07-24 10:33:30 -0700,2024-07-24 10:33:30 -0700,"<p>I don't think Thunderbird is your problem, it's your inventory of old messages that require storage space. IMAP accounts never 'let go' of the messages. To save your disc space, you might consider setting up a cloud storage account or buy external media and save there. </p>",davidsk,false,0,0
1663878,1454358,2024-07-24 09:11:09 -0700,2024-07-24 09:16:15 -0700,<p>oups sorry error I didint want to answer myself&nbsp;!!&nbsp;:-) </p>,lubecki75,false,0,0
1663889,1454358,2024-07-24 10:42:58 -0700,2024-07-24 10:42:58 -0700,"<p>Well, my first thought is that ""thunderbird is alway right"" and has stronger HTML enforcement -- but maybe there is a real bug. Would you be able to redirect (not forward) to me at davidthunderbird at gmx dot com? I may not discover anything, but it's a possibility. </p>",davidsk,false,0,0
1663907,1454358,2024-07-24 12:05:15 -0700,2024-07-24 12:05:15 -0700,"<em><p>david <a href=""#answer-1663889"" rel=""nofollow"">a écrit</a></p></em> <blockquote>Well, my first thought is that ""thunderbird is alway right"" and has stronger HTML enforcement -- but maybe there is a real bug. Would you be able to redirect (not forward) to me at davidthunderbird at gmx dot com? I may not discover anything, but it's a possibility. </blockquote> <p>I sent it to you from my other email hotmail I hope I did what you asked. Merci&nbsp;:-) </p>",lubecki75,false,0,0
1663910,1454358,2024-07-24 12:28:12 -0700,2024-07-24 12:28:12 -0700,"<p>It looks fine in Daily, which is release 130. That does not mean it doesn't work in 128, but it works fine from where I see it. </p>",davidsk,false,0,0
1663911,1454358,2024-07-24 12:32:41 -0700,2024-07-24 12:32:41 -0700,<p>here is partial screencopy </p>,davidsk,false,0,0
1663913,1454358,2024-07-24 12:34:37 -0700,2024-07-24 12:34:37 -0700,<p>I was glad to assist. I have no idea why it didn't format properly for you. </p>,davidsk,false,0,0
1663915,1454358,2024-07-24 12:52:21 -0700,2024-07-24 12:52:21 -0700,"<em><p>david <a href=""#answer-1663913"" rel=""nofollow"">said</a></p></em> <blockquote>I was glad to assist. I have no idea why it didn't format properly for you. </blockquote> <p>thanks anyway, it's a mystery no other mail has this behavior... </p>",lubecki75,false,0,0
1663916,1454358,2024-07-24 12:54:41 -0700,2024-07-24 12:54:41 -0700,"<em><p>david <a href=""#answer-1663913"" rel=""nofollow"">said</a></p></em> <blockquote>I was glad to assist. I have no idea why it didn't format properly for you. </blockquote> <p>oh and guess what&nbsp;: I sent it ""back"" to myself and.... </p>",lubecki75,false,0,0
1663918,1454358,2024-07-24 13:07:18 -0700,2024-07-24 13:07:18 -0700,"<p>Ah, sweet mystery of life... (remember ""Naughty Marietta'?) Thank you for sharing that. Best smile of the day.  I'll be humming that song the rest of the day.&nbsp;:) </p>",davidsk,false,0,0
1663884,1454360,2024-07-24 10:23:25 -0700,2024-07-24 10:23:25 -0700,"<p>please post screenshot of your smtp server pane. are you using smtp,<a href=""http://office365.com?"" rel=""nofollow"">office365.com?</a> </p>",davidsk,false,0,0
1663881,1454365,2024-07-24 10:11:52 -0700,2024-07-24 10:11:52 -0700,"<p>I don't know how it happened, but my message display is ""normal"" </p><p>bob </p>",rvvolpe38,false,0,0
1663924,1454372,2024-07-24 13:56:35 -0700,2024-07-24 13:56:35 -0700,"<p>An app password is one that your email provider gives you for use when using an email client. That is, the password you use online for the account will not work on Thunderbird or any other email client. Each email provider may have unique process in doing this. </p>",davidsk,false,0,0
1663903,1454383,2024-07-24 11:48:14 -0700,2024-07-24 11:48:14 -0700,"<p>That setting you referred to only affects folders you create AFTER making the change. This article specifies exactly how to do it. As written, it focuses on using table view, but the steps work. <a href=""https://support.mozilla.org/en-US/kb/message-threading-thunderbird"" rel=""nofollow"">https://support.mozilla.org/en-US/kb/message-threading-thunderbird</a> </p>",davidsk,false,0,0
1663914,1454384,2024-07-24 12:38:36 -0700,2024-07-24 12:38:36 -0700,<p>Thunderbird has filters for unread messagesl and for predefined spam or other uses. I suggest first using fiters to move selected messages to a tempirary folder to ensure you don't delete important messages </p>,davidsk,false,0,0
1663944,1454384,2024-07-24 14:50:00 -0700,2024-07-24 14:50:00 -0700,"<p>Thank you David.  But how do I use filters to move selected messages? I would value your guidance. Thanks, John </p>",John.romm,false,0,0
1663960,1454392,2024-07-24 16:38:56 -0700,2024-07-24 16:38:56 -0700,<p>Has starting working again without any further intervention from me. I can only assume the issue was something at the server end and it's been reset or otherwise unfankled. </p>,sjf8,false,0,0
1663928,1454395,2024-07-24 14:07:43 -0700,2024-07-24 14:07:43 -0700,"<p>These instructions work:  <a href=""https://support.mozilla.org/en-US/kb/message-threading-thunderbird"" rel=""nofollow"">https://support.mozilla.org/en-US/kb/message-threading-thunderbird</a>   follow them and all info on setting default and changing for existing folders is there. The URL assumes table view, so if  you're in card view, you should switch to follow the steps. </p>",davidsk,false,0,0
1663931,1454395,2024-07-24 14:14:38 -0700,2024-07-24 14:14:38 -0700,<p>Thank you. That was it. I was in Card View. </p>,jprobins74,false,0,0
1663967,1454402,2024-07-24 16:54:19 -0700,2024-07-24 16:54:19 -0700,"<p>Have you checked DNS resolutions are correct through the VPN&nbsp;?  Found an issue with DNS resolutions failing on latest Thunderbird &amp; VPN over the weekend Try enabling DNS over HTTPS, step by step instructions in the topic below if you need them. </p><p><a href=""https://support.mozilla.org/en-US/questions/1454425"" rel=""nofollow"">https://support.mozilla.org/en-US/questions/1454425</a> </p>",jennydeione,false,0,0
1663962,1454411,2024-07-24 16:44:36 -0700,2024-07-24 16:44:36 -0700,"<p>Hi there, Have a look at this answer I had just posted  <a href=""https://support.mozilla.org/en-US/questions/1454425"" rel=""nofollow"">https://support.mozilla.org/en-US/questions/1454425</a> this was the answer for the system I was helping friends/family with, which had similar behavior. </p>",jennydeione,false,0,0
