id,created,updated,title,content,tags,product,topic,locale,answers,creator
1442009,2024-03-10 18:43:52 -0700,2024-03-10 23:35:45 -0700,"Even it's the original HTML, It doesn't show the Format.","<p>Even it's the original HTML, It doesn't show the Format from the Excel. and receiving email also I cannot see any format. </p>",other;,thunderbird,other,en-US,1641556;,sunyin93
1442010,2024-03-10 20:14:41 -0700,2024-03-10 23:37:30 -0700,Import of folder within Mail to Thunderbox.,"<p>I wish to import a folder from within my old Mail into my current Thunderbox.  Is this possible, and how might it be done? </p>",download-and-install_1;,thunderbird,download-install-and-migration,en-US,1641557;,whillans
1442018,2024-03-11 00:34:03 -0700,2024-03-11 00:34:03 -0700,recovering deleted message from mbox file,"<p>Hi, </p><p>I deleted some messages from my imap mail (using the web interface, not TB) and want to recover them from the locally stored mbox files. On several places, I read that messages are not deleted but merely marked deleted via an X-Mozilla-Status: 0009 flag. I checked the mbox-file and the deleted messages are there, but the X-Mozilla-Status is 0001. But they don't show up in TB. Has there been a recent change to this? </p>",other;,thunderbird,other,en-US,"",bob.ansay
1442020,2024-03-11 00:53:55 -0700,2024-03-11 07:05:06 -0700,Errore ricezione posta dopo cambio password,"<p>Dopo il cambio password dell'account di @libero.it thunderbird non riceve più la posta. Ho impostato la nuova password ma esce sempre l'errore ""Non riuscito l’invio della password per l’utente geom.bicchi@libero.it. Il server di posta <a href=""http://popmail.libero.it"" rel=""nofollow"">popmail.libero.it</a> ha risposto:  [AUTH] IOL RBL"" </p>",other;,thunderbird,other,it,1641570;1641590;1641618;,silvano.bicchi
1442023,2024-03-11 02:30:25 -0700,2024-03-11 07:03:24 -0700,Rubriche Thunderbird,"<p>Buongiorno e grazie per il supporto. Vorrei semplicemente sapere come si fa a spostare dei nominativi dalla rubrica (A) alla rubrica (B), oppure ad aprire una nuova rubrica e quindi spostare lì una serie di nominativi. La versione che ho di Thunderbird è la 115.4.1 </p><p>Inoltre:- E' stato trovato un rimedio per evitare la creazione delle cartelle popstate.dat sotto ogni account che se si cancellano si ricreano? Ringrazio sentitamente. A. </p>",other;,thunderbird,other,it,1641582;1641587;1641617;,anflav1
1442026,2024-03-11 03:16:25 -0700,2024-03-11 04:36:19 -0700,unthreading,"<p>Since latest update i can not remove email threading, i have tried the VIEW route no option there, i have gone into settings and changed it that way yet still emails are threading, how can i remove this? </p>",customize;,thunderbird,customize-controls-options-and-add-ons,en-US,1641601;,sales404
1442027,2024-03-11 03:27:24 -0700,2024-03-11 04:47:30 -0700,why am i getting duplicate emails in 2 of my aol email accounts?,"<p><strong>bold text</strong>I have 3 Aol accounts setup in Thunderbird and recently I have noticed that when I receive an email in one main account, its repeated in another Aol account </p>",fix-problems;,thunderbird,fix-slowness-crashing-error-messages-and-other-problems,en-US,1641603;,Korevette
1442028,2024-03-11 03:33:37 -0700,2024-03-11 03:33:37 -0700,adatok betöltése nagyon régi verzióból,"<p>Thunderbird 2.0.0.23 verzióban lévő adatokat (levelek, címek, minden) szeretném átemelni a legfrissebb verzióba. Mi ennek a módja, van rá esetleg segédprogram? Az például működhet, hogy a MozBackup-al csinálok egy mentést és az új verzióra ráengedem? (bár valószínűleg ez így nem működik, túl egyszerű lenne...) </p>",download-and-install_1;,thunderbird,download-install-and-migration,hu,"",hajasiroda
1442030,2024-03-11 03:35:40 -0700,2024-03-11 03:35:40 -0700,Thunderbird freezing after about 20 minutes,<p>After installing Thunderbird on a new windows 11 computer and transferring in the profiles and accounts from the previous computer I the application freezes after about 20 minutes. I have tried all the suggested courses of action. There are no extensions added and the antivirus has an exception for Thunderbird. </p><p>The only way to close the error is using task manager to end the program. It does however always say (2) next to Thunderbird in task manager so I am guessing it is trying to do a scheduled action at the point of crashing. </p><p>Do you have any suggestions as to what I can try to fix this issue. </p><p>Thanks </p>,fix-problems;,thunderbird,fix-slowness-crashing-error-messages-and-other-problems,en-US,"",dianne16
1442031,2024-03-11 03:48:55 -0700,2024-03-11 04:45:38 -0700,"Global Inbox. No Advanced button under ""Message storage"".","<p>Hi, In a new Windows 11 PC Thunderbird 115.81.1 (64-bit) was installed. Then I did /Server Settings/Message storage/Local Directory/F:Mail  </p><p>The F:\Mail is an external USB-drive. The left pane then showed two main folders: </p><p>x@y.no Local Folders </p><p>In both of these there is an Inbox sub-folder.  The one under ""Local Folders"" shall be set as the ""Global Inbox"". In many pages on the web, e.g. a MozillaZine page, it is explained how to do this. The key point here is to navigate to the ""Server Settings"" and clock on the ""Advanced button"".  </p><p>My problem is that there is none; see the uploaded image. </p><p>Could anyone, please, tell me where I did my error? </p><p>Best regards;  ChG </p>",download-and-install_1;,thunderbird,download-install-and-migration,en-US,1641602;,Gustaf17A
1442032,2024-03-11 03:58:07 -0700,2024-03-11 07:09:41 -0700,SMTP issue with Thunderbird 115.8.1,"<p>Salve, da diverse settimane ho problemi nell'invio di email dal client Thunderbird, quando sono connesso tramite una linea fissa. Ho sottoposto il problema ad un amico esperto.  Premesso che l'account di posta e' gestito dal provider REGISTER, che con il client gestisco anche account di altri provider (libero, gmail etc.) che funzionano regolarmente, il test che vi sottopongo e che mi sembra il piu' significativo per comprendere dove sia il problema e' questo: utilizzando telnet e pingando l'smtp, si riscontra un rifiuto da parte del server del provider.  La cosa anomala e' che utilizzando dallo stesso MAC outlook le email partono (oath2) mentre da thunderbird no. Potete aiutarmi? Grazie elio </p>",privacy-and-security_1;needsinfo;,thunderbird,privacy-and-security-settings,it,1641595;1641621;,8q9szxqqw2
1442035,2024-03-11 05:10:01 -0700,2024-03-11 07:32:48 -0700,richiesta,"<p>Salve, sto usando windows 11 ho installato thunderbird 115.8.1 (64 bit), ho provato a fare invia a da tasto destro mouse ma non funziona, sembra che funzioni solo con il loro outlook. Ho provato allora ad aggiungere il comando  nella apposita cartella send to  di windows e non procede a creare la mail per l'invio. Praticamente se faccio la procedura thunderbird si avvia nella schermata principale ma non prepara per l'invio il documento allegato. Ovviamente ho già messo come predefinito thunderbird come client di posta preferenziale. La stessa cosa mi accade con windows server 2022. Potete aiutarmi per favore. Grazie </p>",other;,thunderbird,other,it,1641626;1641628;1641629;,ik5edw
1442039,2024-03-11 05:53:31 -0700,2024-03-11 05:53:31 -0700,"In Wayland, Thunderbird not switching to Browser after passing URLS.","<p>OS: Fedora 39/Gnome45/Wayland Firefox 123.0.1 Thunderbird 115.8.1 </p><p>Under X11, clicking a link in an email switches to the web browser and opens the link.  If I change the session to Wayland, the link is passed to the browser, but the browser is not brought to the front. </p><p>I checked everything is this document: <a href=""https://support.mozilla.org/en-US/kb/hyperlinks-in-messages-not-working"" rel=""nofollow"">https://support.mozilla.org/en-US/kb/hyperlinks-in-messages-not-working</a> but the problem persists. </p><p>Thoughts? </p>",other;,thunderbird,other,en-US,"",mcoyle1960
1442041,2024-03-11 06:00:13 -0700,2024-03-11 07:59:04 -0700,Calendar died; how can I restore it?,"<p>Last week (and for years before) I could view my Google calendar, edit appointments and respond to invitations. in Thunderbird, Now the Thunderbird calendar is completely empty (all 5 calendars that I have subscribed in my Google Suite account). The Google mail account still appears to work normally in Thunderbird, and the Google calendar is visible in other clients (e.g. Samsung Calendar under Android or Outlook (MS 365) under Windows 10). I am using Thunderbird 15.8.1 running under Ubuntu Studio 22.04 LTS. Any ideas what happened or how to restore calendar functionality? Was there a recent update to Thunderbird or to the Calendar module? </p>",calendar;,thunderbird,calendar,en-US,1641632;,rsbrux
1442042,2024-03-11 06:29:49 -0700,2024-03-11 08:21:13 -0700,Spam Through My Thunderbird Email Account,"<p>Hello, I would like to know how I can block/filter spam emails that I get through my thunderbird email account&nbsp;?? I get some that go straight to my spam folder and I get some that go through my inbox folder. </p><p>Thank You&nbsp;!! </p>",other;,thunderbird,other,en-US,1641638;,redmanmaa
1442052,2024-03-11 08:02:59 -0700,2024-03-11 08:02:59 -0700,How to turn off all browser behaviour in TB?,"<p>Just moved to TB after 20 years on Mac Mail. Loving it so far, for the most part.  </p><p>One thing I REALLY do not like is the 'browser behaviour' of Thunderbird. I do not want a second browser on my machine to worry about securing and preventing privacy leaks etc. I have a browser, it's carefully set up, and it's the only i want on my system.  </p><p>So is there a way to stop TB behaving like a browser? I see questions about 3rd party cookies, they were turned on, and I'm glad I spotted that (could easily have missed it). Can I just turn off all firefox like behaviour? what about ""Chat""? I have no use for that.  </p><p>Thanks </p><p>PS - If anyone knows of a way to export my Mac Calendar data to TB, I might try the Calendar function out&nbsp;:) </p>",privacy-and-security_1;,thunderbird,privacy-and-security-settings,en-US,"",mozilla516
1442053,2024-03-11 08:04:56 -0700,2024-03-11 08:22:29 -0700,"I cannot find the install for thunderbird, because Gmail is screwing with my previous email addresses","<p>Can someone send me a link to install the app? I can sign in on the help app, but cannot find a way to actually see or sign into the thunderbird app itself </p>",download-and-install_1;,thunderbird,download-install-and-migration,en-US,1641633;1641640;,Mallardbite
1442055,2024-03-11 08:14:26 -0700,2024-03-11 08:14:26 -0700,Works more,<p>Thanks </p>,privacy-and-security_1;,thunderbird,privacy-and-security-settings,en-US,"",ravindersingh.thakur02
