id,created,updated,title,content,tags,product,topic,locale,answers,creator
1453100,2024-07-16 17:16:42 -0700,2024-07-16 17:28:20 -0700,"Cannot access toolbars or send from the ""Write"" screen","<p>My ""Write"" screen has suddenly become useless. It will not show any toolbars, including the Composition bar. So no Send button, no sending. Even the formatting bar below the subject line is grayed out and inert. Looks like this is a longtime failing. I tried solutions offered in earlier threads and none helped. Pressing  Alt on the keyboard does not produce a temporary Menu Bar. Help! </p>",troubleshooting;,thunderbird,troubleshooting,en-US,1662336;,erics1
1453104,2024-07-16 18:29:46 -0700,2024-07-16 18:29:46 -0700,I cannot reply to my emails it indicates error. this is the third time and no solution yet PLEASE HELP,<p>I cannot reply to my emails it indicates error. this is the third time and no solution yet PLEASE HELP </p>,troubleshooting;,thunderbird,troubleshooting,en-US,"",cmcnall9197
1453109,2024-07-16 19:53:10 -0700,2024-07-16 19:53:10 -0700,How to find Personal Thunderbird calendar I'm trying to set up on my macBook Pro,<p>Tell me how to find a partially set up Personal Thunderbird Calendar on my MacBook pro </p>,calendar;,thunderbird,calendar,en-US,"",noelgodson9
1453113,2024-07-16 20:31:49 -0700,2024-07-16 20:31:49 -0700,Microsoft 365 email not connecting properly,"<p>I'm having trouble setting up my Microsoft 365 email from GoDaddy. </p><p>After setting everything up I get an error message saying that it is ""authenticated but not connected"". </p><p>I've tried troubleshooting with GoDaddy to no help.  I've followed what many said helped them with the same problem and set ""network.dns.disableIPv6"" to ""true"".  Still not working. </p><p>Anybody have any other tips? </p><p>Thanks in advance! </p>",troubleshooting;,thunderbird,troubleshooting,en-US,"",chuck83
1453116,2024-07-16 20:43:27 -0700,2024-07-16 20:43:27 -0700,"HELP, PLEASE. Email (receiving and sending) stopped working on the 12th","<p>We have 3 email accounts, each for out business. 1 of them stopped working several years ago with no resolve but we didn't use it that much to make it matter.  Now our main email is not working. It stopped working on the 12th of July. We are not getting emails and our business RELIES on this. We are at a total loss. I've tried everything. I can send email from the main which is no longer working to the other one that still works but cannot send anywhere outside that.  I'm not real knowledgeable with this stuff but I did empty the trash. We had 4 years of trash emails that needed dumped so I did that. Still notihing. The server is a POP3 and the port is correct. 110 is the default on all 3.  The outgoing server (SMTP) what ever that is, is the default server for the email that is not working.  WE ARE DESPERATE HERE. PLEASE SOMEONE HELP US. </p>",troubleshooting;,thunderbird,troubleshooting,en-US,"",sdallas611
1453119,2024-07-16 21:17:59 -0700,2024-07-16 21:17:59 -0700,Mozilla Thunderbird,"<p>export - import um den Rechner zu wechseln von Win7 auf Win10, liefert nur die Adressbücher, aber nicht die bisherigen Mails. Beide haben die gleiche Version. </p><p>// I want to update my PC to an newer Version with another Hardware.. On both is the same version (aktuell version) istalled. By exporting settings from the old PC to an *.Zip - file an then on the new Hardware importing that file i only get the adressbooks and settings but not the Emails in the different folders. Instead i get a set of new but empty ""Local Folders""... The *.zip is only 72MB great but contains 307 empty ""folderCache-nnn.json"" files.. What is my problem??? best regards  Thomas Schipper </p>",other;,thunderbird,other,en-US,"",Post484
1453122,2024-07-16 21:30:05 -0700,2024-07-16 21:30:05 -0700,telstra says i need to fix unauthenticated email address,<p>i had email from telstra saying i need to fix my email address from unauthenicated emails . i went to settings smtp edit to password normal and it still will not send </p>,troubleshooting;,thunderbird,troubleshooting,en-US,"",splittys2
1453125,2024-07-16 22:33:56 -0700,2024-07-16 22:33:56 -0700,access,"<p>morning i seem unable to sign into my email accounts althou it says details found when it veryfies the password it says account unavalable due to configuration wrong, please help as i am expecting an important email from the huspital. thank you in advance. </p>",troubleshooting;,thunderbird,troubleshooting,en-US,"",dennis.wright3
1453129,2024-07-16 22:52:30 -0700,2024-07-16 22:52:30 -0700,how to remove unwanted screen,"<p>Just updated from version 60.9.1 to latest (don't ask why). Just spent hours putting things back the way they were, but cannot find a way to get rid of the screen containing things like ""Choose What to Set Up"", ""Import from Another Program"", ""About Mozilla Thunderbird"" etc that shows when no folder is selected from any account (see attached screenshot). I would prefer to see a blank screen in this area when no account folder is selected as previously. </p><p>Any way to remove this? if not, how about taking this as a request. Thanks. </p>",customize-settings-and-preferences;,thunderbird,customize-settings-and-preferences,en-US,"",dogdogonholiday
