id,question_id,created,updated,content,creator,is_spam,num_helpful,num_unhelpful
1637060,1439848,2024-02-16 04:58:53 -0800,2024-02-16 04:58:53 -0800,"<p>That is an indication that it is the wrong password. If that password works when logging in online in browser, that is an indication that your email provider requires a separate password for email clients. </p>",davidsk,false,0,0
1637072,1439850,2024-02-16 06:49:46 -0800,2024-02-16 06:49:46 -0800,"<p>Open your <strong>profile folder</strong>, <strong>Quit </strong>Thunderbird then delete the <em><strong>session.json</strong></em> file from the profile folder. This file is where information about opened tabs is stored, so that they can reopen when Thunderbird starts, so delete it so that Thunderbird ""forgets"" about those many tabs you accidentally opened. For more information about your Thunderbird profile, see <a href=""/en-US/kb/profiles-where-thunderbird-stores-user-data"" rel=""nofollow"">Profiles - Where Thunderbird stores your messages and other user data</a> </p>",stancestans,false,0,0
1637053,1439853,2024-02-16 01:33:26 -0800,2024-02-16 01:33:26 -0800,"<p>Bug reports should be directed to Mozilla's Bugzilla instance so the developers can track the issue. <a href=""https://bugzilla.mozilla.org"" rel=""nofollow"">https://bugzilla.mozilla.org</a> </p>",bbonacci,false,0,0
1637048,1439856,2024-02-16 01:01:17 -0800,2024-02-16 01:01:17 -0800,"<p>Hi, If you have server side filters for some reason, the messages could be moved to different folders than your Inbox <strong>before</strong> arriving to your Thunderbird client. this checkbox ensures that the folder specified will be always checked for new content. </p><p>I hope that helps! </p>",shopov.bogomil,false,0,0
1637045,1439860,2024-02-16 00:06:46 -0800,2024-02-16 00:06:46 -0800,"<p>Bugbear, not bedbug! Old age strikes again </p>",Tombarkas,false,0,0
1637051,1439860,2024-02-16 01:18:13 -0800,2024-02-16 01:18:13 -0800,"<p>I would recommend using Thunderbird's built-in Import and Export tool to transfer your Thunderbird profile.  <a href=""https://support.mozilla.org/en-US/kb/thunderbird-import"" rel=""nofollow"">https://support.mozilla.org/en-US/kb/thunderbird-import</a> <a href=""https://support.mozilla.org/en-US/kb/thunderbird-export"" rel=""nofollow"">https://support.mozilla.org/en-US/kb/thunderbird-export</a> These support articles should assist you with instructions. </p>",bbonacci,false,0,0
1637057,1439860,2024-02-16 03:48:11 -0800,2024-02-16 03:48:11 -0800,"<p>Thanks, Ben </p>",Tombarkas,false,0,0
1637062,1439867,2024-02-16 05:03:13 -0800,2024-02-16 05:03:13 -0800,"<p>You need to post information on the incoming and outgoing server settings for the account, and maybe some suggestions will be forthcoming. Thank you. </p>",davidsk,false,0,0
1637059,1439869,2024-02-16 04:54:53 -0800,2024-02-16 04:54:53 -0800,"<p>If this is IMAP, my first suggestion is to highlight account on main window, rightclick and select 'subscribe' to see if the folders appear. </p>",davidsk,false,1,0
1637069,1439875,2024-02-16 06:32:15 -0800,2024-02-16 06:32:15 -0800,<p>E lo hai verificato il metodo di autenticazione impostato in Thunderbird? </p>,@next,false,0,0
1637061,1439878,2024-02-16 05:02:01 -0800,2024-02-16 05:02:01 -0800,"<p>Do you have the email still in your sent folder? Can you post a screenshot of the headers hat show the To, CC, and BCC entries? </p>",davidsk,false,0,0
1637074,1439891,2024-02-16 07:57:16 -0800,2024-02-16 07:57:16 -0800,<p>You would first need to tell your current email client. </p>,davidsk,false,0,0
1637079,1439907,2024-02-16 10:08:00 -0800,2024-02-16 10:08:00 -0800,"<p>Your post is still there at <a href=""https://support.mozilla.org/en-US/questions/1439878"" rel=""nofollow"">https://support.mozilla.org/en-US/questions/1439878</a>  and i had responded to it. Please keep replies so you can stay with the thread. I am waiting to see screenshot of the outgoing header info that shows to, cc and bc. thank you. </p>",davidsk,false,0,0
