id,question_id,created,updated,content,creator,is_spam,num_helpful,num_unhelpful
1651900,1446826,2024-05-08 03:54:57 -0700,2024-05-08 03:54:57 -0700,"<p>Images will repeat to fill the message. Review this URL for guideline on fixing your HTML. this not a Thunderbird issue:    <a href=""https://www.w3schools.com/htmL/html_images_background.asp"" rel=""nofollow"">https://www.w3schools.com/htmL/html_images_background.asp</a> </p>",davidsk,false,0,0
1652006,1446826,2024-05-08 17:19:57 -0700,2024-05-08 17:19:57 -0700,<p>Very sorry.  Know NOTHING about HTML and the article you suggested is only so much Greek. </p>,dalewebb1,false,0,0
1652034,1446831,2024-05-08 23:13:15 -0700,2024-05-08 23:13:15 -0700,"<blockquote> would like to know if there is a preferred way to optimize them. </blockquote> <p>I ... would like to know if there is a preferred way to optimize them. </p><p>I don't think one way would be better than then other. It's entirely up to you how to do it. It may also depend on how many filters (or filter actions) you're planning to use. </p> <blockquote> Also, I seem to recall seeing in the filter help pages that it is preferable to have local storage for filters as opposed to having the mail server sort them out.  Why is that?  </blockquote> <p>The filtering happens locally in Thunderbird, not on the server. Thus e.g. filtering on the message body would only work when the entire message has been downloaded, not just the headers. I don't think Thunderbird can do server side filtering. </p>",christ1,false,0,0
1651916,1446842,2024-05-08 06:00:47 -0700,2024-05-08 06:00:47 -0700,<p>Check to see if you possibly had a calendar with the old email id. </p>,davidsk,false,0,0
1651903,1446848,2024-05-08 04:11:21 -0700,2024-05-08 04:11:21 -0700,"<p>Your screenshot indicates you also imported an account with 350 messages, yet you state that you see no messages. Please clarify. Thank you. </p>",davidsk,false,0,0
1651904,1446848,2024-05-08 04:13:37 -0700,2024-05-08 04:13:37 -0700,<p>these 350 messages come from the previous integration of the account with the mail server </p>,kuba.frankowski.gt,false,0,0
1651905,1446848,2024-05-08 04:17:54 -0700,2024-05-08 04:17:54 -0700,"<p>Then I presume you do NOT wish to import the profile, only some specific message folders. Please confirm or explain and I will try to assist. </p>",davidsk,false,0,0
1651912,1446848,2024-05-08 05:02:35 -0700,2024-05-08 05:02:35 -0700,<p>I need to transfer only messages from the old computer to the new one. Konto email na obydwu komputerach jest takie samo if kodzi o konfigurację w Thunderbird. </p>,kuba.frankowski.gt,false,0,0
1651915,1446848,2024-05-08 05:35:06 -0700,2024-05-08 05:35:06 -0700,"<p>On old computer, do this:  - start thunderbird and click help&gt;troubleshootinginformation - scroll down to 'profile folder' and click 'open folder'  - exit thunderbird. you are now in the profile. messages from IMAP account will be in the imapmail folder  </p><pre>  and messages for POP or Local Folders will be in the Mail folder. you will see entries such as inbox, inbox.msf, sent, sent.msf, etc.   </pre> <p>- copy the desired folder to external media </p><p>On new computer, do this:  - install the importexport addon of not already done - create new folders in Local Folders for each folder to be imported  - highlight the first new local folder, rightclick, and select the importexport option to import mbox - select one of the folders in the Mail folder on external media and import to the new folder. DO NOT do this for the .msf files, as those are just indexes that will be automatically rebuilt. - repeat the above for each folder.  - </p>",davidsk,false,0,0
1651917,1446848,2024-05-08 06:21:21 -0700,2024-05-08 06:21:21 -0700,"<p>There is one small problem - my old computer broke down, I'm waiting for information from the service center to see if it can be repaired. So at the moment I only have the .zip file from the old computer export. </p>",kuba.frankowski.gt,false,0,0
1651918,1446848,2024-05-08 06:23:14 -0700,2024-05-08 06:23:14 -0700,"<p>Ok, unzip it and post a screenshot of the Mail folder and the Mail\Local Folder folder and we'll go from there. </p>",davidsk,false,0,0
1651980,1446848,2024-05-08 13:31:58 -0700,2024-05-08 13:31:58 -0700,"<p>Ok, if I good understand, screenschot in attachment. </p>",kuba.frankowski.gt,false,0,0
1651986,1446848,2024-05-08 14:04:38 -0700,2024-05-08 14:04:38 -0700,"<p>Thanks. It shows no local folders messages, but the POP account does have messages. Use my suggested steps above to import the inbox, after having created a new folder in Local Folders. That's all there is. </p>",davidsk,false,0,0
1651987,1446848,2024-05-08 14:19:45 -0700,2024-05-08 14:19:45 -0700,"<p>As I correct understand, I did this operation , but only in new computer. </p>",kuba.frankowski.gt,false,0,0
1651909,1446849,2024-05-08 04:58:26 -0700,2024-05-08 04:58:26 -0700,"<p>Please  </p> <ul><li> Start Windows in safe mode with networking enabled - <a href=""https://support.microsoft.com/en-us/help/12376/windows-10-start-your-pc-in-safe-mode"" rel=""nofollow"">https://support.microsoft.com/en-us/help/12376/windows-10-start-your-pc-in-safe-mode</a> </li><li> Still In Windows safe mode, start Thunderbird in Troubleshoot Mode - <a href=""https://support.mozilla.org/en-US/kb/troubleshoot-mode-thunderbird"" rel=""nofollow"">https://support.mozilla.org/en-US/kb/troubleshoot-mode-thunderbird</a> </li></ul> <p>Does problem change? </p>",wsmwk,false,0,0
1652033,1446852,2024-05-08 23:05:44 -0700,2024-05-08 23:05:44 -0700,"<blockquote> I have read the instructions offered in the FAQ's </blockquote> <p>What FAQs? Please post a link. </p> <blockquote> when I type in my filter name and then select ""+"" after the email addy I get error about filter name already exists... </blockquote> <p>You'll have to use a unique filter name. <a href=""https://support.mozilla.org/kb/organize-your-messages-using-filters"" rel=""nofollow"">https://support.mozilla.org/kb/organize-your-messages-using-filters</a> </p>",christ1,false,0,0
1652081,1446852,2024-05-09 07:35:03 -0700,2024-05-09 07:35:03 -0700,"<p>Thanks for the reply but that doesn't apply here I don't think. I named my filter ""block list"" I have about 5 junk mails daily which I r-click on the email address and ""create filter from"" and on the pop up I select ""any of the following"" and drop down to delete message and then get the error above.  I want to use that filter name for all junk messages... </p>",genedean198,false,0,0
1652084,1446852,2024-05-09 07:43:57 -0700,2024-05-09 07:43:57 -0700,"<p>You can only add a filter ""block list"" once. It has to be a unique name. But you can then add multiple filter rules underneath that filter. </p><p>Having said that, the attempt to fight spam with static filter rules is futile. Use the built-in junk mail controls instead. <a href=""https://support.mozilla.org/kb/thunderbird-and-junk-spam-messages"" rel=""nofollow"">https://support.mozilla.org/kb/thunderbird-and-junk-spam-messages</a> </p>",christ1,false,0,0
1651939,1446853,2024-05-08 09:04:21 -0700,2024-05-08 09:04:21 -0700,<p>I presume you are receiving error messages? Reading those may prove helpful. </p>,davidsk,false,0,0
1651928,1446854,2024-05-08 08:00:37 -0700,2024-05-08 08:00:37 -0700,"<p>This may not be the issue, but check your setting for View&gt;Threads to see you ticked 'expand all threads.' For the sound, untick that at settings&gt;general. The sound comes because it is an incoming message. </p>",davidsk,false,0,0
1651937,1446854,2024-05-08 08:30:43 -0700,2024-05-08 08:30:43 -0700,"<p>Nope, same issue happens without threading (duplicates messages in my collective inbox) </p><p><br> </p><p>Regarding the sound - I DO want a sound notification for my ""legit"" single-occurrence emails when they first come in. </p>",yogev.w,false,0,0
1651919,1446855,2024-05-08 06:51:20 -0700,2024-05-08 06:51:20 -0700,"<p>I also had a look at these posts: <a href=""https://support.mozilla.org/en-US/questions/1192643"" rel=""nofollow"">https://support.mozilla.org/en-US/questions/1192643</a> </p><p>Unfortunately, Lightning doesn't show up in the list of extensions, nor does it show up when I search for it. Not sure though if this is still valid, as the post is 6 years old. </p><p>Hmmm, I now created a calendar via ""new"" --&gt; Calendar to test, and somehow I managed to create a calendar, and then it gave me back the once grayed out ""calendar"" in view. ""tasks"" where still grayed out though. But stil, I couldn't view the calendar. But then i clicked on the top left corner symbol and I could activate the calendar tab somehow.  </p><p>Not sure what is going on there, but this was annoying as hell and somehow I got lucky and got it back. Not intuitive at all. Can't remember how it worked before though. Well, seems like solved. Hopefully it works now. </p>",Holch,false,0,0
1651930,1446856,2024-05-08 08:03:18 -0700,2024-05-08 08:03:18 -0700,<p>My suggestion when this happens is to log onto your online account to see what is there and then compare that to what Thunderbird is retrieving. That should at least let you see the missing messages and may help you confirm its location. </p>,davidsk,false,0,0
1651922,1446857,2024-05-08 07:43:24 -0700,2024-05-08 07:43:24 -0700,"<p>If you are setting up a gmail account, there is a google prompt to validate your gmail password. once that is done once, google sets the account password for you. </p>",davidsk,false,0,0
1651929,1446861,2024-05-08 08:01:27 -0700,2024-05-08 08:01:27 -0700,<p>You need to first post the exact error message and also a screenshot of your SMTP server settings. Thank you. </p>,davidsk,false,0,0
1651941,1446861,2024-05-08 09:25:21 -0700,2024-05-08 09:25:21 -0700,"<p>I took a screen shot but don't know how to send it to you David.  Also, I don't know where to find the SMTP server.  Please help. </p><p>I may not be able to reply for awhile as I have to leave for an appointment now. Thank you. </p>",ringjane48,false,0,0
1651945,1446861,2024-05-08 10:10:16 -0700,2024-05-08 10:10:16 -0700,"<p>Info on SMTP server is here: - click account settings from menu - scroll down left side until you see 'Outgoing Servers (SMTP) and click there.  - to include a screenshot, look slightly below the reply area and there is a place to add images. Screenshots should be JPG or PNG. </p>",davidsk,false,0,0
1652015,1446868,2024-05-08 18:57:24 -0700,2024-05-08 18:57:24 -0700,"<p>Repetida, ver consulta: <a href=""https://support.mozilla.org/es/questions/1446869"" rel=""nofollow"">https://support.mozilla.org/es/questions/1446869</a> </p><p>Por favor marcar este respuesta como solución ya que no corresponde a un tema de configuracion de Thunderbird. Gracias </p>",pcp04,false,0,0
1652014,1446869,2024-05-08 18:55:16 -0700,2024-05-08 18:55:49 -0700,"<p>Hola,  Disculpa pero te equivocaste de soporte eso que estas solicitando se configura en el servidor DNS de tu dominio, contacta con tu proveedor del dominio <a href=""http://elquijotedeoro.es"" rel=""nofollow"">elquijotedeoro.es</a>. </p><p>Agradecería marcar esta respuesta como solución para cerrarla ya que no es una consulta sobre Thunderbird. Gracias </p>",pcp04,false,0,0
1651943,1446874,2024-05-08 09:48:49 -0700,2024-05-08 09:48:49 -0700,<p>ps. The problem is not about 'Local Folders' but about the sub folders beneath the folder Archives. </p>,j.verhoeckx,false,0,0
1651967,1446877,2024-05-08 12:09:09 -0700,2024-05-08 12:09:09 -0700,"<p>So, post a screenshot of your server settings and someone may have suggestions. Thanks. </p>",davidsk,false,0,0
1651977,1446878,2024-05-08 13:14:43 -0700,2024-05-08 13:14:43 -0700,<p>Hello there  We have read the question We try to help </p><p>You are using the Thunderbird software program okay. which version do you have on your device? </p><p>You mean a mobile version on your iPhone is okay.Oke that not the subject? </p><p>Greetings Firefox volunteer </p>,Googlethunderbird,false,0,0
1651979,1446878,2024-05-08 13:30:50 -0700,2024-05-09 00:00:01 -0700,"<p>Hello there  </p><p>The device you are working on cannot receive emails as you write. Sending is going well, okay, can I ask? </p><p>When it comes to hereI can I ask you whether the sending and receiving settings have been completed correctly and you do not have any disturbing software on your computer? </p><p>try checking in trouble shoot mode for Thunderbird to see if your connections are okay to use with the add-ons disabled? Restart Thunderbird. If you do not receive a response or progress in the problem, check whether your safe mode for Win or the similar OS is hiding a bad software installation in your PC. </p><p>Back to not being able to receive and being excluded from what was described above. Can you send us the port numbers and all of  the outgoing messages and incoming settings?(they can be found in the incoming email settings en outgoing server settings) per screenshot? These may have been entered incorrectly or may have changed after an update. Your AV software should be checked to see if it is set too high in security mode or if active scans are preventing your process from sending emails, they should be stopped for a while. </p><p><a href=""https://support.mozilla.org/en-US/kb/how-to-make-screenshots"" rel=""nofollow"">https://support.mozilla.org/en-US/kb/how-to-make-screenshots</a> </p><p>Greetings Firefox volunteer </p>",Googlethunderbird,false,0,0
1652031,1446878,2024-05-08 22:52:09 -0700,2024-05-08 22:52:09 -0700,"<p><a href=""https://support.mozilla.org/en-US/kb/cannot-receive-messages"" rel=""nofollow"">https://support.mozilla.org/en-US/kb/cannot-receive-messages</a> </p>",christ1,false,0,0
1652039,1446878,2024-05-09 00:42:48 -0700,2024-05-09 00:42:48 -0700,<p>Hello there  </p><p><br> It is also important that your internet traffic is not blocked so that all topics can behave properly. </p><p><br> Greetings Firefox volunteer </p>,Googlethunderbird,false,0,0
1651963,1446879,2024-05-08 11:49:06 -0700,2024-05-08 11:49:06 -0700,"<p>Here is what I do:  - install addon - either thunderHTMLedit (my favorite), or HTML source editor - right-click the prior message and click 'edit as new' - that's simpler than creating a new message and using copy/paste and accomplishes the same thing.  - using the addon, click to show the actual HTML and there delete the original URL and paste in the new one.  - works every time and I like seeing the actual HTML so I know it's right. </p>",davidsk,false,0,0
1651968,1446881,2024-05-08 12:19:24 -0700,2024-05-08 12:19:24 -0700,"<p>That content is in what is called the profile. if the old computer is windows, and if you didn't customize locations of folders, do this - start old PC and do NOT start thunderbird  - copy c:\users\&lt;yourid&gt;\appdata\roaming\thunderbird to external media - on new computer, exit thunderbird if running - copy the thunderbird folder from external media to c:\users\&lt;yourid&gt;\appdata\roaming to overwrite the default profile.  - start thunderbird and your old profile, including accounts and folders, should appear.   </p><p>For future reference, the user is responsible to saving the profile, as thunderbird does not have an online cloud server to do that for users. </p>",davidsk,false,0,0
1652037,1446893,2024-05-08 23:45:06 -0700,2024-05-08 23:45:06 -0700,"<p>Hi, There could be multiple reasons for this error. Could you explore this here and see if it helps: <a href=""https://support.mozilla.org/en-US/questions/1071835"" rel=""nofollow"">https://support.mozilla.org/en-US/questions/1071835</a> </p>",shopov.bogomil,false,0,0
1652048,1446894,2024-05-09 03:56:44 -0700,2024-05-09 03:56:44 -0700,"<p>At the top right of the Thunderbird window, click the menu button ≡ &gt; Account Settings &gt; Composition &amp; Addressing &gt; Composition </p><p>Make sure the box ""Include signature for replies"" is checked. </p><p>Beyond that you may want to look for an add-on that does what you want. <a href=""https://addons.thunderbird.net"" rel=""nofollow"">https://addons.thunderbird.net</a> </p>",christ1,false,0,0
1652056,1446894,2024-05-09 05:30:16 -0700,2024-05-09 05:30:16 -0700,"<p>That is checked, and what I've realized is that in most cases its placing my signature below everything ('below the quote') despite my having 'above the quote' selected.  In 1 account its doing it correctly.  In the others its not. </p>",eric.gombrich,false,0,0
1652030,1446896,2024-05-08 22:51:03 -0700,2024-05-08 22:51:03 -0700,<blockquote> I can't remember it and can't find how to change it. </blockquote> <p>You'll have to talk to your email provider about password reset options. </p>,christ1,false,0,0
1651993,1446898,2024-05-08 15:28:46 -0700,2024-05-08 15:28:46 -0700,"<p>Set the authentication method to OAuth2 and the User Name to the email address.  Restart TB, enter the account password in the OAuth browser window prompt to allow TB access. </p><p><a href=""https://support.mozilla.org/en-US/questions/1417298#answer-1588949"" rel=""nofollow"">https://support.mozilla.org/en-US/questions/1417298#answer-1588949</a> </p>",sfhowes,false,0,0
1652036,1446899,2024-05-08 23:40:36 -0700,2024-05-08 23:40:36 -0700,"<p>Hi, Drag and drop would work! </p>",shopov.bogomil,false,0,0
