id,created,updated,locale,product,title,is_solved,solution,solved_by,is_spam,last_answer,answers,topic,tags,creator,content,involved,is_archived,is_locked,is_taken,metadata,num_answers,num_votes_past_week,num_votes,taken_until,taken_by,updated_by
1451294,2024-07-01 17:39:12 -0700,2024-07-01 18:41:45 -0700,en-US,thunderbird,moving TB from C:\ to D:\,false,,,false,1660008,1660007;1660008;,other,other;,mswilder,"<p>I have done a custom install of TB on D:\ drive, moved Profiles folder to D:\, verified that account settings/server settings have local directory pointing to D:\ drive.  </p><p>Can I delete all TB files on C:\?  TB still *seems* to be using those files.  I really need to free up space on C:\ - tiny drive filled with Windows OS,  huge D:\ with nothing on it.   </p><p>Thank you for your time and attention! </p>",mswilder;davidsk;oblibm8391;,true,false,false,;category:other;useragent:Mozilla/5.0 (Windows NT 10.0; Win64; x64; rv:127.0) Gecko/20100101 Firefox/127.0;product:thunderbird,2,0,1,,,
1451297,2024-07-01 18:19:08 -0700,2024-07-02 03:43:23 -0700,en-US,thunderbird,showing 115.11.1 and 115.12.2 as both installed,false,,,false,1660047,1660004;1660021;1660046;1660047;,other,other;,newmachine5600,<p>Can 115.11.1 be uninstalled? </p>,newmachine5600;davidsk;,true,false,false,";category:other;useragent:Mozilla/5.0 (Windows NT 10.0; Win64; x64) AppleWebKit/537.36 (KHTML, like Gecko) Chrome/124.0.0.0 Safari/537.36 Edg/124.0.0.0;product:thunderbird",4,0,0,,,
1451298,2024-07-01 18:30:06 -0700,2024-07-01 18:32:39 -0700,en-US,thunderbird,Where are my questions?,true,1660003,oblibm8391,false,1660003,1660003;,other,other;,oblibm8391,<p>I've written several questions - where are they? </p>,oblibm8391;,true,false,false,;category:other;useragent:Mozilla/5.0 (Windows NT 10.0; Win64; x64; rv:127.0) Gecko/20100101 Firefox/127.0;product:thunderbird;solver_id:5581285,1,0,0,,,
1451299,2024-07-01 18:52:42 -0700,2024-07-01 18:52:42 -0700,en-US,thunderbird,Thunderbird wont connect to verizon/aol mail server,false,,,false,,"",troubleshooting,fix-problems;,k.machv,"<p>All morning I had been receiving and sending emails without issue. Then at approx 12:41 PM EST Thunderbird stopped working. I can send and receive emails through AOL to AOL but they do not show up in Thunderbird. I did not have any other computer issues and did not change any settings. Verizon told me it was an AOL issue, but I was able to successfully send and receive messages with AOL. AOL tried to fix it but ultimately said it was a Thunderbird issue. In the last 6 or 7 weeks I have had issues with Thunderbird. What is going on? Very Very Frustrating!!! </p>",k.machv;,true,false,false,";category:fix-problems;useragent:Mozilla/5.0 (Windows NT 10.0; Win64; x64) AppleWebKit/537.36 (KHTML, like Gecko) Chrome/126.0.0.0 Safari/537.36;product:thunderbird",0,0,0,,,
1451301,2024-07-01 19:56:11 -0700,2024-07-01 19:56:11 -0700,en-US,thunderbird,Can't find address lists under Personal Address Book on one of two systems,false,,,false,,"",other,other;,ronks1,"<p>Using TBird 15.10.1 64-bit on my Windows 10 desktop system, I find under Tools | Address Book a down arrow to the left of Personal Address Book; clicking on it displays all my created address lists, which are available when I compose a message to send.  </p><p>Using 15.10.1 64-bit on my Windows 11 laptop, the down arrow does not appear and I have no access to those lists.  </p><p>Am using IMAP on both systems. Tried importing lists as a CSV file; no effect. How can I get access to my address lists on both PCs? </p>",ronks1;,true,false,false,;category:other;useragent:Mozilla/5.0 (Windows NT 10.0; Win64; x64; rv:127.0) Gecko/20100101 Firefox/127.0;product:thunderbird,0,0,0,,,
1451303,2024-07-01 20:46:38 -0700,2024-07-01 21:56:29 -0700,en-US,thunderbird,Microsoft Modern Authentication,false,,,false,1660026,1660026;,privacy-and-security,privacy-and-security_1;,roballan,"<p>I have TB ver 115.12.2 64 bit. It reports as being up to date. During attempting to make the changes necessary to accommodate Microsoft's Modern Authentication I reach a point where the option to select OAuth2 does not appear in the Outgoing Server SMPT settings drop down menu, see the image. How do I deal with this? Thanks for your help. </p>",roballan;sfhowes;,true,false,false,;category:privacy-and-security;useragent:Mozilla/5.0 (Windows NT 10.0; Win64; x64; rv:127.0) Gecko/20100101 Firefox/127.0;product:thunderbird,1,0,0,,,
1451305,2024-07-01 20:56:22 -0700,2024-07-02 07:06:32 -0700,en-US,thunderbird,How to automatically add a bcc: recipient when using a specific smtp server?,true,1660025,sfhowes,false,1660072,1660025;1660072;,other,other;,Alain_Damlamian,"<p>Hello, When sending a message from my gmail account within TB, I would like to automatically attach one of my other adresses as bcc: . How can I do that&nbsp;? </p><p>As an alternative, is there a way to automatically copy the message in my sent folder in my gmail account to my local sent folder&nbsp;? Using a filter perhaps , but I have been unable to create a filter that operates on the Sent folder. </p><p>Thank you, Alain Damlamian </p>",Alain_Damlamian;sfhowes;,true,false,false,";category:other;useragent:Mozilla/5.0 (Macintosh; Intel Mac OS X 10_15_7) AppleWebKit/537.36 (KHTML, like Gecko) Chrome/124.0.0.0 Safari/537.36 OPR/110.0.0.0;product:thunderbird;solver_id:1144816",2,0,1,,,
1451307,2024-07-01 22:02:50 -0700,2024-07-07 22:46:30 -0700,en-US,thunderbird,can't get in,false,,,false,1660848,1660089;1660848;,other,other;,kraiff,<p>have been using Thunderbird mail for about 3 years. It’s template selected the incoming and outgoing servers and ports etc..successfully. I've been connecting to Prodigy mail/ATT    I had to change the battery and it doesn't work anymore. Can you help&nbsp;???it checks the password until it shows an error message that the servers password or etc are wrong. I know the password is right since I can log in directly. Messages&nbsp;: </p><p>1- Configuration found in ISP Database </p><p>2- Checking Password (for a few minutes </p><p>3- Unable to log in at server..probably wrong configuration username or password </p><p>4 then nothing </p><p>Worked great before battery change </p>,kraiff;sfhowes;,true,false,false,;category:other;useragent:Mozilla/5.0 (Windows NT 10.0; Win64; x64; rv:127.0) Gecko/20100101 Firefox/127.0;product:thunderbird,2,0,0,,,
1451309,2024-07-01 23:05:21 -0700,2024-07-01 23:05:21 -0700,en-US,thunderbird,Email,false,,,false,,"",troubleshooting,fix-problems;,ncrendell,"<p>Updated Thunderbird to 117.12.2 on the 25 June 2024. Since then I am not receiving emails on my computer. I have actually sent some emails but they don't save into the sent folder and I have had a ""Add security exception"" warning occured when sending. </p><p>So problem is not getting new emails since the latest update was loaded. Thanks Neil </p>",ncrendell;,true,false,false,;category:fix-problems;useragent:Mozilla/5.0 (Windows NT 10.0; Win64; x64; rv:127.0) Gecko/20100101 Firefox/127.0;product:thunderbird,0,0,0,,,
1451312,2024-07-02 00:17:12 -0700,2024-07-07 18:57:37 -0700,en-US,thunderbird,Attachment handling in Thunderbird,true,1660832,ianchristie,false,1660832,1660831;1660832;,other,other;,ianchristie,"<p>Whenever I select an email in my Inbox which has attached files (of any type) i get this pop-up, one for each attachment. <a href=""https://assets-prod.sumo.prod.webservices.mozgcp.net/media/uploads/images/2024-07-02-00-10-20-f3ab8a.png"" rel=""nofollow"">https://assets-prod.sumo.prod.webservices.mozgcp.net/media/uploads/images/2024-07-02-00-10-20-f3ab8a.png</a> This has only been occurring since I updated to Ubuntu 24.04 and Thunderbird 115.12.0-2 If I click on the ""Find more in Software"" button I get a message 'Failed to execute child process ""Gnome Software"" (No such file/directory)'. I have searched for a solution but can only find a reference which suggests that the problem has something to do with Evolution, (the file handler, not Darwin's theory). Any suggestions? Cheers Ian </p>",ianchristie;,true,false,false,;category:other;useragent:Mozilla/5.0 (X11; Ubuntu; Linux x86_64; rv:127.0) Gecko/20100101 Firefox/127.0;product:thunderbird;solver_id:2376656,2,0,0,,,
1451315,2024-07-02 01:34:24 -0700,2024-07-02 01:34:24 -0700,en-US,thunderbird,I can't access my calendar,false,,,false,,"",calendar,calendar;,freiroma,<p>I have used Thunderbird for many years. I had a problem viewing a jpg file that I couldn't resolve and decided to uninstall Thunderbid to install it again. Mail is working smoothly but I can't access my multi-year Calendar. I've tried several alternatives with no solution and I really need help please. I'm in Portugal and I'm Portuguese. My English is Google Translate's English. Thank you. </p>,freiroma;,true,false,false,";category:calendar;useragent:Mozilla/5.0 (Windows NT 10.0; Win64; x64) AppleWebKit/537.36 (KHTML, like Gecko) Chrome/126.0.0.0 Safari/537.36;product:thunderbird",0,0,0,,,
1451319,2024-07-02 02:55:31 -0700,2024-07-02 23:15:07 -0700,it,thunderbird,Rimozione account e rimozione dati messaggi,false,,,false,1660167,1660048;1660078;1660079;1660167;,other,other;,gabrib7,"<p>Buongiorno, purtroppo nella fretta ho eliminato un account e messo la spunta su ""Rimuovi dati messaggi"". I dati vengono rimossi definitivamente (riscrivendo anche i blocchi del disco) oppure c'è modo di recuperarli scollegando il disco e utilizzando un software come Recuva o chiedendo il supporto a dei servizi specializzati? </p><p>Grazie </p>",gabrib7;@next;,true,false,false,";category:other;useragent:Mozilla/5.0 (Windows NT 10.0; Win64; x64) AppleWebKit/537.36 (KHTML, like Gecko) Chrome/126.0.0.0 Safari/537.36;product:thunderbird",4,0,0,,,
1451323,2024-07-02 04:27:16 -0700,2024-07-02 10:54:03 -0700,en-US,thunderbird,how to continue to use hotmail and live emails in Tunderbird without office360?,false,,,false,1660088,1660088;,other,other;,eskarina,<p>I received a notification from @hotmail and @live that I won't be able to receive or send mail after Sept 17th without taking action - what steps should I take when I don't have Microsoft Office 360? </p>,eskarina;sfhowes;,true,false,false,";category:other;useragent:Mozilla/5.0 (Windows NT 10.0; Win64; x64) AppleWebKit/537.36 (KHTML, like Gecko) Chrome/126.0.0.0 Safari/537.36 Edg/126.0.0.0;product:thunderbird",1,0,0,,,
1451325,2024-07-02 04:50:02 -0700,2024-07-09 04:03:07 -0700,en-US,thunderbird,Microsoft Oauth2 authentification - option not available for outgoing server,true,1660087,sfhowes,false,1660985,1660087;1660094;1660098;1660183;1660200;1660330;1660365;1660402;1660403;1660456;1660712;1660754;1660977;1660985;,privacy-and-security,privacy-and-security_1;,david_mccloy,"<p>I have received an email from Microsoft informing me of changes to its authentification procedure. As from Sept, to continue using Thunderbird to access my outlook/hotmail accounts, I have to change the authentification method to Oauth2. The reasons and changes required are detailed here: <a href=""https://support.mozilla.org/en-US/kb/microsoft-oauth-authentication-and-thunderbird-202"" rel=""nofollow"">https://support.mozilla.org/en-US/kb/microsoft-oauth-authentication-and-thunderbird-202</a> I have 2 problems.  1. <a href=""http://imap-mail.outlook.com"" rel=""nofollow"">imap-mail.outlook.com</a> - I can change my authentification method to Oauth2. However, when I then try to access my mail via TB, I get an error stating that the server <a href=""http://imap-mail.outlook.com"" rel=""nofollow"">imap-mail.outlook.com</a> does not support the authentification method! (see image) 2. Outgoing Server SMTP There is no Oauth2 option available to choose! </p><p>Can anyone help? I am using the most up to date version of Thunderbird 115.12.2 (64-bit). </p>",david_mccloy;sfhowes;,true,false,false,;category:privacy-and-security;useragent:Mozilla/5.0 (Windows NT 10.0; Win64; x64; rv:127.0) Gecko/20100101 Firefox/127.0;product:thunderbird;solver_id:6030250,14,0,2,,,
1451327,2024-07-02 05:51:24 -0700,2024-07-02 05:51:24 -0700,en-US,thunderbird,Blank message tabs and email contents,false,,,false,,"",other,other;,lisa.kleitz,"<p>Hi, I just reopened Thunderbird after my computer was shut down automatically after a Dell firmware update. I had 15 email tabs open before this -- things I wanted to go back to or that reminded me to do something. They are now empty! I have gone into Troubleshoot mode a couple of times and restarted Thunderbird. I've also checked the ""remove addons (or something like that)"" check box. No luck. Can someone out there help? I'm going to try restarting my computer now. Thanks! </p>",lisa.kleitz;,true,false,false,;category:other;useragent:Mozilla/5.0 (Windows NT 10.0; Win64; x64; rv:127.0) Gecko/20100101 Firefox/127.0;product:thunderbird,0,0,0,,,
1451328,2024-07-02 05:52:16 -0700,2024-07-02 05:52:16 -0700,pt-BR,thunderbird,AppData/Thunderbird folder still big after moving e-mail storage to external folder,false,,,false,,"",troubleshooting,fix-problems;,neovalk,"<p>It's been about 3 years since I started using Thunderbird as my e-mail client, and pretty soon I started using a separate HD device to store the e-mail data (image 1, where I highlight ""Local Dir"" in D:\). </p><p>In image 2, you can see the e-mails are actually stored in the destination directory. The date shows also that they are updated. </p><p>However, AppData/Thunderbird folder is still very big (almost the same size as the e-mails). </p><p>I checked the folder contents and found out that probably the e-mails are still stored inside the Thunderbird folder. The dates show that they are very old, probably from the time I actually moved the e-mails to the D:\ drive (image 3). </p><p>I suspect that I could remove all these folders inside ImapMail, but I'm not sure if I'll break anything, maybe even cause removal from the server (you never know) </p><p>Sorry for the images being in Portuguese, but I tried to make them as clear as possible. </p>",neovalk;,true,false,false,;category:fix-problems;useragent:Mozilla/5.0 (Windows NT 10.0; Win64; x64; rv:127.0) Gecko/20100101 Firefox/127.0;product:thunderbird,0,0,0,,,
1451334,2024-07-02 08:53:33 -0700,2024-07-02 08:53:33 -0700,en-US,thunderbird,Pop Up when opening Thunderbird slowing down progress!,false,,,false,,"",troubleshooting,fix-problems;,citycarrier24,<p>Is there a way to stop initial pop ups when opening FireFox? They slow productivity! I don't need to be reminded that I have new emails when I am already in Thunderbird. </p>,citycarrier24;,true,false,false,";category:fix-problems;useragent:Mozilla/5.0 (Windows NT 10.0; Win64; x64) AppleWebKit/537.36 (KHTML, like Gecko) Chrome/126.0.0.0 Safari/537.36;product:thunderbird",0,0,0,,,
1451339,2024-07-02 09:53:14 -0700,2024-07-02 09:53:14 -0700,en-US,thunderbird,Gmail account password not working,false,,,false,,"",privacy-and-security,privacy-and-security_1;,brownralphm,"<p>Changed <a href=""http://Gmail.com"" rel=""nofollow"">Gmail.com</a> password and now Thunderbird will not login even with the new verified password. I have tried all recommendations on the internet and nothing works. </p>",brownralphm;,true,false,false,;category:privacy-and-security;useragent:Mozilla/5.0 (Windows NT 10.0; Win64; x64; rv:127.0) Gecko/20100101 Firefox/127.0;product:thunderbird,0,0,0,,,
1451340,2024-07-02 09:58:16 -0700,2024-07-02 09:58:16 -0700,en-US,thunderbird,Thunderbird won't send emails,false,,,false,,"",other,other;,drbeckma,"<p>Why won't Thunderbird send emails when connected to NordVPN? I have spoken to Spectrum and NordVPN and both of them have suggested that Thunderbird is the issue. I have confirmed that my SMTP settings are correct. I can send and receive from the Web client's site. I have turned off NordVPN and the sending process works as expected. However when I turn NordVPN back on, my outgoing emails are blocked. </p>",drbeckma;,true,false,false,";category:other;useragent:Mozilla/5.0 (Windows NT 10.0; Win64; x64) AppleWebKit/537.36 (KHTML, like Gecko) Chrome/126.0.0.0 Safari/537.36;product:thunderbird",0,0,0,,,
1451342,2024-07-02 11:34:49 -0700,2024-07-02 11:34:49 -0700,en-US,thunderbird,Temporary hiding of emails when I delete one,false,,,false,,"",other,other;,ddhpub,"<p>Not always, but frequently when I delete an email from an inbox, the other emails are hidden for awhile.  This occurs whether I am pressing Del while the email is visible, or pressing Del with the email selected in the Inbox.   If, however, I immediately open another folder and then re-open the inbox, all emails are instantly visible.  Am I doing something wrong, or is this a ""feature""?   &nbsp;;-) Regards, Dave </p>",ddhpub;,true,false,false,";category:other;useragent:Mozilla/5.0 (Windows NT 10.0; Win64; x64) AppleWebKit/537.36 (KHTML, like Gecko) Chrome/126.0.0.0 Safari/537.36;product:thunderbird",0,0,0,,,
1451343,2024-07-02 11:40:17 -0700,2024-07-02 11:40:17 -0700,en-US,thunderbird,"Thunderbird, cannot send emails out.",false,,,false,,"",troubleshooting,fix-problems;,robertlhunter1,"<p>Error message: </p><p>""Sending of the message failed. An error occurred while sending mail. The mail server responded: &lt;<a href=""http://ec2-54-219-72-248.us-west-1.compute.amazonaws.com"" rel=""nofollow"">ec2-54-219-72-248.us-west-1.compute.amazonaws.com</a>[54.219.72.248]&gt;: Client host rejected: NO THANKS. Please check the message recipient ""patrick.gilroy@harmonydesigninc.com"" and try again"" </p><p>Occurs regardless of recipient, whether replying to an incoming email, or composing a new email. </p>",robertlhunter1;,true,false,false,";category:fix-problems;useragent:Mozilla/5.0 (Windows NT 10.0; Win64; x64) AppleWebKit/537.36 (KHTML, like Gecko) Chrome/126.0.0.0 Safari/537.36;product:thunderbird",0,0,0,,,
1451344,2024-07-02 11:58:06 -0700,2024-10-14 19:48:24 -0700,en-US,thunderbird,Thunderbird keeps crashing on startup @ OOM | large | NS_ABORT_OOM | nsTSubstring<T>::AllocFailed | nsTSubstring<T>::Append | MimeInlineTextHTMLParsed_parse_line,false,,,false,1681629,1660099;1660327;1660538;1660642;1681629;,troubleshooting,fix-problems;,a.epstein,"<p>A new problem since July 1, 2024 Thunderbird keeps crashing on start-up when checking for new mail. HELP!! Crash ID: bp-e8be7291-7fe9-41c0-bd21-45d860240702 </p><p>alfieepstein@gmail.com </p>",a.epstein;sfhowes;MattAuSupport;wsmwk;,true,false,false,;category:fix-problems;useragent:Mozilla/5.0 (Windows NT 10.0; Win64; x64; rv:127.0) Gecko/20100101 Firefox/127.0;product:thunderbird,5,0,0,,,wsmwk
1451346,2024-07-02 12:15:26 -0700,2024-07-03 10:55:51 -0700,en-US,thunderbird,Microsoft is changing the authentication method,false,,,false,1660209,1660182;1660209;,privacy-and-security,privacy-and-security_1;,Loyall,"<p>Microsoft is changing the authentication method for outlook mail to OAuth2. I follow the guide provided to update Thunderbird, but my version of the program does not have OAuth2 as an option. My outgoing server is <a href=""http://smtp-mail.outlook.com"" rel=""nofollow"">smtp-mail.outlook.com</a>, but OAuth2 is not an option in the dropdown for authentication method. </p>",Loyall;davidsk;,true,false,false,";category:privacy-and-security;useragent:Mozilla/5.0 (Windows NT 10.0; Win64; x64) AppleWebKit/537.36 (KHTML, like Gecko) Chrome/126.0.0.0 Safari/537.36 Edg/126.0.0.0;product:thunderbird",2,0,5,,,
1451353,2024-07-02 12:59:55 -0700,2024-07-02 12:59:55 -0700,en-US,thunderbird,attach file inline?,false,,,false,,"",settings,customize;,linusr,"<p>Hello: t-bird 115.12.2 esr dev build. W11p laptop. Drag &amp; drop (also paste) for putting a file inline for a msg do not function ""any more,"" this has functionned in earlier versions. I can only attach the file. I have changed config ed settings mail.inline_attachments &amp; mail.inline_attachments.text to true &amp; restarted t-bird, to no effect (no inline). This is for a simple .rtf of 340 bytes (yes, very small). Please advise. Thank you. </p>",linusr;,true,false,false,;category:customize;useragent:Mozilla/5.0 (Windows NT 10.0; Win64; x64; rv:128.0) Gecko/20100101 Firefox/128.0;product:thunderbird,0,0,0,,,
1451357,2024-07-02 13:17:36 -0700,2024-07-26 11:05:33 -0700,it,thunderbird,Collegamento ad Aruba,true,1664376,gianpieronegri,false,1664404,1660164;1663815;1663851;1663858;1663861;1663862;1664376;1664404;,other,other;,gianpieronegri,"<p>Non riesco a collegare Thunderbird alla mail di aruba. Quando apro Thunderbird, compare una finestra che chiede la password, ma non la accetta. Sembra che non sia possibile stabilire la verifica in due passi, ma solo la password normale. Il Tecnico di Aruba dice che è un problema di settaggio di Thunderbird. Qualcuno mi può aiutare? </p>",gianpieronegri;@next;ing.carreri;,true,false,false,";category:other;useragent:Mozilla/5.0 (Windows NT 10.0; Win64; x64) AppleWebKit/537.36 (KHTML, like Gecko) Chrome/126.0.0.0 Safari/537.36;product:thunderbird;solver_id:6031107",8,0,0,,,
1451358,2024-07-02 13:20:32 -0700,2024-07-02 18:39:40 -0700,en-US,thunderbird,Import doesn't include email,false,,,false,1660140,1660123;1660133;1660134;1660140;,installation-and-updates,download-and-install_1;,dsalmon2,"<p>I converted my Outlook .pst file to an mbox file using SysTools PST converter   When I try to import it into Thunderbird, it permits me to import only a .zip file from a previous backup, or a calendar file, or an address file.  I need it to import the whole thing, especially the emails.  How? </p>",dsalmon2;sfhowes;,true,false,false,";category:download-and-install;useragent:Mozilla/5.0 (Windows NT 10.0; Win64; x64) AppleWebKit/537.36 (KHTML, like Gecko) Chrome/126.0.0.0 Safari/537.36;product:thunderbird",4,0,0,,,
1451359,2024-07-02 13:30:35 -0700,2024-07-03 13:33:42 -0700,en-US,thunderbird,Delete suggested email address when using search,false,,,false,1660230,1660125;1660230;,other,other;,ebcrosby,"<p>When I start a email message search, I am bombarded with bad suggestions for email addresses. These include addresses from everyone I've received email from even though I have deleted these entries in collected email addresses and my personal address book.  </p><p>The addresses could be from old purchases or ebay responses or anyone I've ever received an email from. I have deleted most of the emails entirely, yet I still get all these bad addresses when I search.  </p><p>Is there a way to clear the history in search or remove the email addresses where I have deleted the email? </p><p>I've attached a Home Depot search as an example. </p>",ebcrosby;sfhowes;,true,false,false,;category:other;useragent:Mozilla/5.0 (Windows NT 10.0; Win64; x64; rv:127.0) Gecko/20100101 Firefox/127.0;product:thunderbird,2,0,0,,,
1451361,2024-07-02 13:49:12 -0700,2024-07-04 14:22:55 -0700,en-US,thunderbird,"Update your sign-in technology before September 16th, 2024 to maintain email access.  You will no longer be able to access your Outlook.com, Hotmail or Live.com email address on September 16th.",false,,,false,1660370,1660180;1660350;1660351;1660354;1660355;1660357;1660362;1660364;1660370;,privacy-and-security,privacy-and-security_1;needsinfo;,Denis.Clarke,"<p>Tell me how I can continue to use thunderbird with the above account and also <a href=""http://Denis.Clarke.hotmail.com"" rel=""nofollow"">Denis.Clarke.hotmail.com</a> after September 18. I have 4 individual historic E mail accounts and thunderbird joins them together. What do you need to do? To deal with threat below.  </p> <hr> <p>If you are receiving this email, you are currently using an email or calendar app that uses a less secure authentication method to connect to your <a href=""http://Outlook.com"" rel=""nofollow"">Outlook.com</a> email account. You will need to upgrade your third-party mail and calendar app to a version which supports modern authentication methods. </p>",Denis.Clarke;davidsk;Martymoz;,true,false,false,;category:privacy-and-security;useragent:Mozilla/5.0 (Windows NT 6.1; Win64; x64; rv:109.0) Gecko/20100101 Firefox/115.0;product:thunderbird,9,0,0,,,
1451362,2024-07-02 13:50:13 -0700,2024-07-02 13:50:13 -0700,en-US,thunderbird,adding my email to thunderbird,false,,,false,,"",installation-and-updates,download-and-install_1;,tammy16,"<p>I need to add my email address to Thunderbird,. This is the error message Authentication faild </p>",tammy16;,true,false,false,";category:download-and-install;useragent:Mozilla/5.0 (Windows NT 10.0; Win64; x64) AppleWebKit/537.36 (KHTML, like Gecko) Chrome/126.0.0.0 Safari/537.36 Edg/126.0.0.0;product:thunderbird",0,0,1,,,
1451363,2024-07-02 13:56:01 -0700,2024-07-02 13:56:01 -0700,en-US,thunderbird,Problem with outlook and gmail accounts this last week,false,,,false,,"",other,other;,leibly,<p>Outlook email accounts are duplicating and asking for passwords which are in the password manager. T/B does not accept the entered password. Gmail accounts are also duplicating and adding weird passwords. Just started last week. Probably has something to do with the new Microsoft Authorizarion rules. It is a mess. I have been a lifetimme used if Mozilla and Thunderbird. </p>,leibly;,true,false,false,;category:other;useragent:Mozilla/5.0 (Windows NT 10.0; Win64; x64; rv:127.0) Gecko/20100101 Firefox/127.0;product:thunderbird,0,0,0,,,
