id,question_id,created,updated,content,creator,is_spam,num_helpful,num_unhelpful
1641792,1442107,2024-03-12 05:16:17 -0700,2024-03-12 05:16:17 -0700,"<p>In account settings, in 'composition&amp;addressing', set compose to HTML. Either that or press shift key when clicking 'new message' button. </p>",davidsk,false,0,0
1641757,1442111,2024-03-11 21:39:11 -0700,2024-03-11 21:39:11 -0700,"<p>Have you enabled 3rd-party access for all accounts? </p><p><a href=""https://www.xfinity.com/support/articles/third-party-email-access"" rel=""nofollow"">https://www.xfinity.com/support/articles/third-party-email-access</a> </p>",sfhowes,false,0,0
1641762,1442111,2024-03-11 23:41:19 -0700,2024-03-11 23:41:19 -0700,"<p>Have you enabled 3rd-party access for all accounts? Thanks for reply. Comcast likes to use last login. Finally got to the Ladies account on Firefox, bit was not set  to allow 3rd, so I changed it. Her email page shows Mans name?? on Firefox Xfinity. Struggled but managed to login on Mans account, (first and working in Thunderbird) it WAS set to allow. </p><p>Still get ""Unable to Connect"" popout screen when attempting to add second, Lady's account. </p><p>Do we need to contact Comcast for such a problem? </p>",bobstanl,false,0,0
1641787,1442120,2024-03-12 05:08:32 -0700,2024-03-12 05:08:32 -0700,"<p>You are probably using an addon that does that, such as Unicodify. </p>",davidsk,false,0,0
1641798,1442124,2024-03-12 05:33:28 -0700,2024-03-12 05:33:28 -0700,"<p>So, it was working, but now it is not. Please share complete SMTP settings and maybe some suggestions will surface to assist. Thank you. </p>",davidsk,false,0,0
1641786,1442125,2024-03-12 05:06:22 -0700,2024-03-12 05:06:22 -0700,"<p>All email accounts require a password to access the data. If you allow Thunderbird to save them, the requests to enter them should stop. </p>",davidsk,false,0,0
1641794,1442129,2024-03-12 05:24:08 -0700,2024-03-12 05:24:08 -0700,"<p>What do you see when you access the account online? If it is a server-side issue, you should see the message in the junk folder. </p>",davidsk,false,0,0
1641796,1442129,2024-03-12 05:29:23 -0700,2024-03-12 05:29:23 -0700,"<p>Yes, i can see the message in the junk folder when using any email client. Every folder in my mailbox is synchronized between Thunderbird, Outlook Desktop, Outlook for android and Outlook Online. </p>",vdrag,false,0,0
1641797,1442129,2024-03-12 05:32:26 -0700,2024-03-12 05:32:26 -0700,"<p>Okay, the info is confusing, as your post implies that the message appears in Junk only when using Thunderbird. I am not sure what support you are seeking. </p>",davidsk,false,0,0
1641799,1442129,2024-03-12 05:37:09 -0700,2024-03-12 05:37:09 -0700,"<p>Ok let me try to clarify then: The ""only when using thunderbird"" part corresponds to the message i am sending. The message that goes to junk is the system-generated non-delivery report. </p>",vdrag,false,0,0
1641800,1442129,2024-03-12 05:40:08 -0700,2024-03-12 05:40:08 -0700,"<p>So, the message is NOT junk on the server, but is junk in Thunderbird? Have you tried using the Junk filter to mark it not junk? The junk filter needs training on good and bad messages to improve its use. </p>",davidsk,false,0,0
1641801,1442129,2024-03-12 05:44:43 -0700,2024-03-12 05:44:43 -0700,<p>I believe i have to give some more clarification with examples: </p><p>Example 1:  </p><pre> - I start Thunderbird.  - I send a new email to some nonexistentaddress@mydomain.com  - A non-delivery reply comes back and goes to junk folder </pre> <p>Example 2:  </p><pre> - I start Microsoft outlook.  - I send a new email to some nonexistentaddress@mydomain.com  - A non-delivery reply comes back and gets delivered in my Inbox. </pre>,vdrag,false,0,0
1641802,1442129,2024-03-12 05:48:53 -0700,2024-03-12 05:48:53 -0700,"<p>I understand. The Thunderbird junk filter apparently doing this and needs training to stop doing it. There is more info on this at  <a href=""https://support.mozilla.org/en-US/kb/thunderbird-and-junk-spam-messages"" rel=""nofollow"">https://support.mozilla.org/en-US/kb/thunderbird-and-junk-spam-messages</a> </p>",davidsk,false,0,0
