id,created,updated,title,content,tags,product,topic,locale,answers,creator
1446746,2024-05-06 17:51:47 -0700,2024-05-06 17:51:47 -0700,Thunderbird latest release does not work when typing a message,"<p>Support needs to take their head out of the sand! With the latest release of Thunderbird for iOS it does not work when trying to type a message. The default is ""preformat"" and trying to change it to paragraph or other does not work. Older version works on my MacBook Pro (2011). My MacBook Air, Thunderbird writing message does not work. Glad I did not contribute money! Oh well must be a way to get folks to purchase Office 365, Outlook? </p>",fix-problems;,thunderbird,fix-slowness-crashing-error-messages-and-other-problems,en-US,"",dave.mcinnes
1446748,2024-05-06 18:23:45 -0700,2024-05-06 18:23:45 -0700,Having trouble sending and receiving email,<p><strong>bold text</strong> </p>,other;,thunderbird,other,en-US,"",lamppostbk
1446750,2024-05-06 20:40:29 -0700,2024-05-06 20:40:29 -0700,Inconsistent problem deleting emails,"<p>Periodically I am unable to delete emails.  I usually just highlight the email, then click the delete button.  When that stops working, sometimes I can use the Edit menu and delete the email that way.  Other times I cannot delete.  If I come back later, I can usually delete again.  How can this be fixed?  Thank you. </p>",other;,thunderbird,other,en-US,"",mkdeupree
1446756,2024-05-06 23:59:13 -0700,2024-05-06 23:59:13 -0700,la ricerca con il filtro veloce è estremamente rallentata dopo ultimo aggiornamento (scorsa settimana),"<p><strong>dopo l'aggiornaamento di settimana scorsa è impossibile effettuare una ricerca per mittente od oggetto in modo fluido: ad ogni SINGOLA digitazione il programma si blocca (non risponde)  e non fornisce alcuna possibilità di azione per diverse decine di secondi, ripeto ad ogni singola digitazione</strong> </p>",fix-problems;,thunderbird,fix-slowness-crashing-error-messages-and-other-problems,it,"",gaetano.mazzotto
1446757,2024-05-07 00:15:47 -0700,2024-05-07 00:25:44 -0700,Thunderbird po zapnutí neustále stahuje celou databázi - po aktulizaci Windows,"<p>Dobrý den, po včerejší aktualizaci Windows mám problém s Thunderbirdem. Po zapnutí stahuje celou databázi emailu (ikdyž se připojuje přes IMAP), nikdy se takto nechoval. Včera jsem ho nechal vše stáhnout, ale dnes po zapnutí dělá vše znovu. Zároveň se znovu provedou všechna pravidla u starých zpráv..Thunderbird behěm toho nejde používat, je kompletně vytížený..Jak to prosím toto vyřešit? Děkuji! </p>",fix-problems;,thunderbird,fix-slowness-crashing-error-messages-and-other-problems,cs,1651718;,tomas37
