id,question_id,created,updated,content,creator,is_spam,num_helpful,num_unhelpful
1689793,1475664,2024-11-23 19:40:53 -0800,2024-11-23 19:40:53 -0800,"<p>Turn on table view <a href=""https://support.mozilla.org/en-US/kb/thunderbird-115-supernova-faq#w_step-2-turn-on-cards-view"" rel=""nofollow"">https://support.mozilla.org/en-US/kb/thunderbird-115-supernova-faq#w_step-2-turn-on-cards-view</a> </p>",wsmwk,false,1,0
1689795,1475664,2024-11-23 19:55:04 -0800,2024-11-23 19:55:04 -0800,<p>Thank you <em>so</em> much. </p><p>That was bothering me all out of proportion. </p>,grebnellow,false,0,0
1689847,1475671,2024-11-24 06:59:38 -0800,2024-11-24 06:59:38 -0800,"<p>To get suggestions, please post screenshots of incoming server settings pane, SMTP server settings pane, and complete error messages. Thanks. </p>",davidsk,false,0,0
1689844,1475673,2024-11-24 06:53:52 -0800,2024-11-24 06:53:52 -0800,"<p>- install the addon, importexporttools NG - highlight Local Folders - rightclick and select importexport option to import mbox - locate and select the message file (NOT the msf file) from your old profile and click OK  - done </p>",davidsk,false,0,0
1689831,1475683,2024-11-24 06:13:41 -0800,2024-11-24 06:13:41 -0800,"<p>Jeśli nie znasz języka angielskiego, skorzystaj z forum polskiej społeczności <a href=""http://mozillapl.org/forum/viewforum.php?f=31"" rel=""nofollow"">http://mozillapl.org/forum/viewforum.php?f=31</a> </p>",wsmwk,false,0,0
1689892,1475684,2024-11-24 11:22:54 -0800,2024-11-24 11:22:54 -0800,"<p>Open the .sbd folder.  Is there a file with no extension and an .msf file, such as File and File.msf?  Copy File to Mail/Local Folders, with TB closed, then restart TB.  Does the File folder appear under Local Folders in the Folder Pane? </p>",sfhowes,false,0,0
1689840,1475685,2024-11-24 06:46:57 -0800,2024-11-24 06:46:57 -0800,"<p>Donations are needed to keep Thunderbird available for everyone, so a donation will be appreciated. In fact, many users donate regularly or periodically, as one-time donations will not sustain any ongoing initiative. However, on your question:   click settings&gt;general and untick to option to show start page. </p>",davidsk,false,0,0
1689866,1475689,2024-11-24 08:26:37 -0800,2024-11-24 08:26:37 -0800,"<p>Na tom obrázku není vidět verze 115, jen verze 102. Jinak je možné, žes aktualizoval systém a ta aktualizace ti něco změnila v registrech. Pokud máš skript, kterým jsi vyřadil aktuliazace, zkus ho spustit znovu. </p>",poljos-moz,false,0,0
1689867,1475689,2024-11-24 08:40:03 -0800,2024-11-24 08:40:03 -0800,"<p>Aktualizace není v malém okně zapsaná (další záhada&nbsp;:-) ), ale ve velkém je vidět 115.16.2 a ""Aktualizace jsou zakázány správcem. Dávám nový obrázek. </p>",luka7,false,0,0
1689868,1475689,2024-11-24 08:53:23 -0800,2024-11-24 08:53:23 -0800,"<p>Já používám portable verze Thunderbirdu i Firefoxu.  Tam je nějaká ""nechtěná"" aktualizace vyloučena. </p>",poljos-moz,false,0,0
1689832,1475692,2024-11-24 06:14:18 -0800,2024-11-24 06:14:18 -0800,"<p>Si vous n'avez pas bien communiquer en anglais, s'il vous plaît utiliser geckozone - <a href=""http://forums.mozfr.org/viewforum.php?f=4"" rel=""nofollow"">http://forums.mozfr.org/viewforum.php?f=4</a> </p>",wsmwk,false,0,0
1689825,1475697,2024-11-24 05:58:56 -0800,2024-11-24 05:58:56 -0800,"<p>Are you using your full email address as user name? Maybe, if you post screenshots of your incoming server settings pane, and your SMTP settings server pane, and complete error message, we may have suggestions. Thanks. </p>",davidsk,false,0,0
1689886,1475699,2024-11-24 10:18:51 -0800,2024-11-24 10:18:51 -0800,"<p>It may be some corruption. My suggestion to try would be - first, copy the profile to a safe place to protect of any problems. that would be at c:\users\&lt;yourid&gt;\appdata\roaming\thunderbird  - second, download from <a href=""http://thunderbird.net"" rel=""nofollow"">thunderbird.net</a> and install over the top of the installation - thunderbird should now start with you existing profile. if it starts, but ignores the profile, click help&gt;troubleshootinginformation, scroll down to 'profile folders', click 'about:profiles, and your old profile should appear available.   </p><p>I like your desktop graphic. Are you a remote-control modeler? Nice plane.&nbsp;:) </p>",davidsk,false,1,0
1689833,1475700,2024-11-24 06:15:20 -0800,2024-11-24 06:15:20 -0800,"<p>Si vous n'avez pas bien communiquer en anglais, s'il vous plaît utiliser geckozone - <a href=""http://forums.mozfr.org/viewforum.php?f=4"" rel=""nofollow"">http://forums.mozfr.org/viewforum.php?f=4</a> </p>",wsmwk,false,0,0
1689842,1475704,2024-11-24 06:51:39 -0800,2024-11-24 06:51:39 -0800,"<p>This sometimes happens when Thunderbird is updated. Other software (antivirus? VPN?) interrupts the process, causing thunderbird's update of the prefs.js file to fail. When this happens, the updates appear in prefs-1.js. On a restart, Thunderbird starts fresh, causing you to reenter email info. exiting thunderbird, locating the prefs-1.js and renaming to prefs.js generally restores everything. </p>",davidsk,false,1,0
1689860,1475704,2024-11-24 08:08:10 -0800,2024-11-24 08:08:10 -0800,"<p>Hello David, </p><p>Thank you for your response.  I have been able to use your information to apparently solve my problem.  But in my case, I actually had seven prefs.js files, the original plus numbers 1 through 6.  So instead of renaming prefs-1.js, I renamed prefs-6.js because it seemed like the newest file from the bunch.   </p><p>I think that this has solved the problem.  We'll see in the days and weeks ahead. </p><p>Thank you for your intervention and advice! </p>",justme2021,false,0,0
1689865,1475704,2024-11-24 08:25:39 -0800,2024-11-24 08:25:39 -0800,<p>You're welcome.&nbsp;:) </p>,davidsk,false,0,0
1689839,1475706,2024-11-24 06:40:13 -0800,2024-11-24 06:40:13 -0800,"<p>To receive any suggestions, you will need to post screenshots of incoming server settings pane, SMTP server settings pane, and complete error messages. Thank you. </p>",davidsk,false,0,0
1689879,1475715,2024-11-24 09:38:18 -0800,2024-11-24 09:38:18 -0800,"<p>I suggest repeating the download and install, as this appears to be corrupted. Be sure to download from <a href=""http://thunderbird.net"" rel=""nofollow"">thunderbird.net</a>. </p>",davidsk,false,0,0
1689882,1475733,2024-11-24 09:41:51 -0800,2024-11-24 09:41:51 -0800,"<p>I have replied to two of your posts, but you never responded. </p>",davidsk,false,0,0
1689902,1475736,2024-11-24 13:17:48 -0800,2024-11-24 13:17:48 -0800,"<p>There may be one if using an addon, but there is no 'signature switch' in thunderbird as installed. </p>",davidsk,false,0,0
1689889,1475737,2024-11-24 11:12:41 -0800,2024-11-24 11:12:41 -0800,"<p>See <a href=""https://support.mozilla.org/en-US/questions/1404881"" rel=""nofollow"">https://support.mozilla.org/en-US/questions/1404881</a> </p>",sfhowes,false,0,0
1689888,1475740,2024-11-24 11:11:42 -0800,2024-11-24 11:11:42 -0800,<p>Tools/Message Filters and create a filter like the one in the attached picture. </p>,sfhowes,false,1,0
1689891,1475740,2024-11-24 11:19:49 -0800,2024-11-24 11:19:49 -0800,"<p>Thank you very much for instant support&nbsp;:) I should have found it myself, but it's a long time I didn't need filters (long ago with Outlook Express - very ancient times&nbsp;;)) </p>",janowski,false,0,0
1689901,1475751,2024-11-24 13:15:50 -0800,2024-11-24 13:15:50 -0800,"<p>To save the files from the outgoing account, assuming IMAP, do this:  - check account settings&gt;synchronization&amp;storage to be sure all are available for download - click file&gt;offline&gt;download to ensure you capture all headers and message content - install the addon, importexporttools NG, if not already done - highlight each of the account folders in turn, right click and select the importexport option to export mbox and the save to a local folder on PC - next, reverse the process, by highlighting Local Folders, rightclick, select importexport option to import mbox and locate and select each of the exported files in turn to import to a local folder.  - once you have successfully collected the message folders to local folders, you can upload to the Outlook account, if desired, by creating a manual filter for each folder. I suggest that because IMAP was not designed for uploads so you need to monitor the process. Once complete, check that the messages uploaded successfully before deleting the local folder. </p>",davidsk,false,0,0
