id,question_id,created,updated,content,creator,is_spam,num_helpful,num_unhelpful
1630582,1436731,2024-01-14 17:57:31 -0800,2024-01-14 17:57:31 -0800,<p>Crap!  This is another catch-22.  rabbithutch@mygrande.net is one of the addresses I can't set up; so I can't see email notices of responses. </p>,rabbithutch1,false,0,0
1630601,1436740,2024-01-14 21:54:24 -0800,2024-01-14 21:54:24 -0800,"<p>Perhaps you need to scroll down to make it visible,  because I can certainly see one on my Thunderbird V115 </p><p>If that is not it,  how are you adding the contact? </p>",MattAuSupport,false,0,0
1630931,1436741,2024-01-16 06:43:15 -0800,2024-01-16 06:43:15 -0800,<p>Is this account you added a POP account? </p>,MattAuSupport,false,0,0
1630629,1436743,2024-01-15 02:27:05 -0800,2024-01-15 02:27:05 -0800,<p>Did Google's OAuth window open before the error message appeared? </p>,bbonacci,false,0,0
1630817,1436743,2024-01-15 17:55:13 -0800,2024-01-15 17:55:51 -0800,"<em><p>Ben Bonacci <a href=""#answer-1630629"" rel=""nofollow"">said</a></p></em> <blockquote>Did Google's OAuth window open before the error message appeared? </blockquote> <p>I did not see the OAuth window appear. </p>",ronald.a126,false,0,0
1630920,1436743,2024-01-16 06:05:19 -0800,2024-01-16 06:05:19 -0800,"<p>You might want to check your distribution has not disabled cookies in Thunderbird.  It is something distributions sometimes do for ideological reasons,  but it does have downsides.  Like basically disabling oauth. </p><p>This article contains a lot of good information on Google oauth issues. <a href=""https://support.mozilla.org/en-US/kb/automatic-conversion-google-mail-accounts-oauth20"" rel=""nofollow"">https://support.mozilla.org/en-US/kb/automatic-conversion-google-mail-accounts-oauth20</a> </p><p>There is also this generic Thunderbird and gmail article  which has links to known bugs at the bottom. <a href=""https://support.mozilla.org/en-US/kb/thunderbird-and-gmail"" rel=""nofollow"">https://support.mozilla.org/en-US/kb/thunderbird-and-gmail</a> </p>",MattAuSupport,false,0,0
1630608,1436744,2024-01-15 00:09:20 -0800,2024-01-15 00:09:20 -0800,"<p>Bazı e-postalar ulaşmıyorsa Thunderbird'de değil de e-posta sunucunuzda sorun var demektir. Bu durumda muhtemelen MEB'e danışmanız gerekir. Ancak e-postaların size ulaştıktan sonra siliniyor olma ihtimali de var. </p><p>Cihazlardan biri indirilen e-postaları sunucudan silmeye ayarlanmış olabilir. <strong>Menü &gt; Hesap ayarları &gt; Eşitleme ve depolama</strong> sayfasına girip ""Hiçbir iletiyi silme"" seçeneğinin seçili olduğunu kontrol edin. Bu kontrolü tüm cihazlarda yapmalısınız. </p><p>Ayrıca, e-postaları almak için IMAP kullanıyorsanız (<strong>Menü &gt; Hesap ayarları &gt; Sunucu ayarları</strong> sayfasında ""Sunucu türü: IMAP posta sunucusu"" yazar.) bir kişi bir e-postayı kendi bilgisayarından sildiği zaman o e-posta tüm bilgisayarlardan silinir. </p>",maxcoder,false,0,0
1630667,1436748,2024-01-15 05:34:37 -0800,2024-01-15 05:34:37 -0800,"<em><p>allan_raewyn <a href=""#question-1436748"" rel=""nofollow"">said</a></p></em> <blockquote>There was a change of format a few weeks ago &amp; the programme has not worked well since. It is painfully slow to load, &amp; i have to log into my address book before I can open my messages.</blockquote> <p>Do you mean click on an address book?  What does that do for you? </p> <em><p>allan_raewyn <a href=""#question-1436748"" rel=""nofollow"">said</a></p></em> <blockquote>Just to make things worse, for the last 2 days Thunderbird has been randomly &amp; frequently freezing. What's going on? </blockquote> <p>freezing when doing what? </p><p>What antivirus software do you use? </p>",wsmwk,false,0,0
1630619,1436751,2024-01-15 00:54:04 -0800,2024-01-15 00:54:04 -0800,"<p>Also, when viewing the certificate in Thunderbird its uses seem to support what I want to use it for, so I dont see that the certificate itself is the problem here. Right? </p>",Dain_547647,false,0,0
1630821,1436751,2024-01-15 18:50:18 -0800,2024-01-15 18:50:18 -0800,<p>Try restating the certificate in the settings.  Over the years I have had occasions when similar error have occurred and when I restate the certificate in account settings the line with the certificate to use comes back with what looks like a serial number after the certificate name and everything works again. </p>,MattAuSupport,false,0,0
1631046,1436751,2024-01-17 00:24:09 -0800,2024-01-17 00:38:26 -0800,"<p>I restated the cert and then I get the serial after the name, as you said. </p><p>Unfortunately it did not help. The error msg when sending signed e-mails is still the same. </p><p>I also installed the .deb variant of Thunderbird in Pop OS, instead of the flatpak variant, and tried that one, but same error. So doesnt have to do with the variant of the application. </p>",Dain_547647,false,0,0
1630930,1436752,2024-01-16 06:40:58 -0800,2024-01-16 06:40:58 -0800,"<p>what SMTP server are you trying to connect to?  If it is your own,  then your server is, I think, using server to server checking that is usually reserved for mail submitted on port 25 to mail you are trying to send.  The issue is in the SMTP server configuration as it is what is rejecting the email. </p><p>It is many years since I ran an SMTP server of my own, so I really can't advise on specifics.  But I would assume the server needs to be configured to accept new submissions on a different port to mail for delivery so they can be treated differently. </p>",MattAuSupport,false,0,0
1630663,1436755,2024-01-15 05:28:57 -0800,2024-01-15 05:28:57 -0800,"<p>I should have put my os, Windows 10 Home 64-bit OS x64-based processor.  Intel cpu i3-2100 @ 3.10GHz. Thunderbird is 115.6.1 and 32 bit . Is that right 32 bit, I have auto updates so not something I have altered. Other observations are: Putting unread mail in the trash and then empty trash, it stays visible until you go to inbox then back to trash. Trash is then clear but the toolbar visible thunderbird icon still has 2 unread (in red) mails way after they have been deleted. Clicking get new msgs clears them. </p>",mikedall,false,0,0
1630665,1436755,2024-01-15 05:30:33 -0800,2024-01-15 05:30:33 -0800,<p>What crash report IDs are listed at Help &gt; Troubleshooting? </p>,wsmwk,false,0,0
1630681,1436755,2024-01-15 06:37:17 -0800,2024-01-15 07:47:04 -0800,"<p>None listed for the past 3 days, under all crash reports just one from 11 march 23 so not relevant I guess. </p><p>What I see when it crashes is either a black screen or it just freezes, when I click the close button I get this programe is not responding and sending a report to microsoft, then it shuts down. </p>",mikedall,false,0,0
1630652,1436758,2024-01-15 04:30:51 -0800,2024-01-15 04:30:51 -0800,<p>The  prompt may be due to still having the gmail calendar. </p>,davidsk,false,0,0
1630946,1436758,2024-01-16 07:30:22 -0800,2024-01-16 07:30:22 -0800,"<p>I found the Calendar still in Thunderbird - removed it and still get Google wanting to nag me. First T/Bird says there is a server connection failure to <a href=""http://imap.gmail.com"" rel=""nofollow"">imap.gmail.com</a>. Then up pops the gmail nag screen. Though I admit only one now whereas before there has been 2. </p>",androidsgii,false,0,0
1630653,1436769,2024-01-15 04:34:45 -0800,2024-01-15 04:34:45 -0800,"<p>One way to find out:  - click help&gt;troubleshootinginformation - scroll down to 'profile folder' and click 'open folder'  - you will now be in the profile. If the account was POP, then look in the Mail folder, otherwise, look in the Imapmail folder </p>",davidsk,false,1,0
1630662,1436769,2024-01-15 05:26:40 -0800,2024-01-15 05:26:40 -0800,"<p>Thanks David, away from my system for the rest of the day (13:25 here on 15th&nbsp;!) but I will try this later &amp; report back. </p>",jvwhyte,false,0,0
1630673,1436769,2024-01-15 05:59:38 -0800,2024-01-15 05:59:38 -0800,"<em><p>jvwhyte <a href=""#question-1436769"" rel=""nofollow"">said</a></p></em> <blockquote>I came across this message from March 2022 -   ""I read at AskLeo that I could use Thunderbird with Gmail as a way to backup my Gmail emails to my computer. I then want to backup the Thunderbird folder using a backup program to save the emails to an external drive.   </blockquote> <p>Why will folk not just use the Google takeout service? Relatively quick,  very comprehensive and you end up with a fairly standard MBOX file that google compress for you that you can store as a backup. </p><p>Thunderbird can natively read mbox files, but so can many other mail clients, if you ever need to access the backup.  So why involve Thunderbird in a Gmail backup at all?  I just fail to understand that when Gmail offers good, simple, robust and fit for purpose tools. </p>",MattAuSupport,false,0,0
1630689,1436769,2024-01-15 07:21:28 -0800,2024-01-15 07:21:28 -0800,"<p>Thanks for your comments Matt. </p><p>I have used Google Takeout to an extent in the past but have been put off by the sheer size of the files created - for example, a mail folder of 120 emails, when downloaded gave me an mbox file of 165Mb (127 when compressed), nor did I find it a particularly speedy process. </p><p>I don't really understand the sizing &amp; structures.  My All Mail folder in gmail has &gt; 26,000 mails going back several years, but organised by topic  (folder/label) rather than by date.  The Google One storage page indicates that gmail is taking just 1.68Gb of my Drive. </p><p>I probably retain far too many emails but I do like being able to access all my records and search mails without having to ""access"" a backup. </p><p>I am also coming to the view that I should perhaps pay for private and secure email and move away from free services like Gmail that monetize my personal data.   Google is not an organisation I feel very good about. </p><p><a href=""https://www.theverge.com/2019/11/26/20977968/google-graveyard-products-shut-down-dead-not-supported-discontinues-spring-cleaning"" rel=""nofollow"">https://www.theverge.com/2019/11/26/20977968/google-graveyard-products-shut-down-dead-not-supported-discontinues-spring-cleaning</a> </p><p>A combination of, for example, Proton Mail or Fastmail with a desktop client like Thunderbird, would allow me a bit more freedom to take a considered approach so I'm testing a few options to see where it takes me. </p>",jvwhyte,false,0,0
1630712,1436769,2024-01-15 09:53:51 -0800,2024-01-15 09:53:51 -0800,"<em><p>david <a href=""#answer-1630653"" rel=""nofollow"">said</a></p></em> <blockquote>One way to find out:  - click help&gt;troubleshootinginformation - scroll down to 'profile folder' and click 'open folder'  - you will now be in the profile. If the account was POP, then look in the Mail folder, otherwise, look in the Imapmail folder </blockquote> <p>Hi David at 'profile folder' I have 'profile directory' but the 'open directory' button does nothing&nbsp;! </p><p>When I navigate from 'Home' to '.thunderbird', click on 'xxx..xxx.default-release', there is a folder 'Imapmail' containing just an '.msf' file.  There is also  'Mail' folder but it's empty&nbsp;? </p><p>??, Jack </p>",jvwhyte,false,0,0
1630790,1436769,2024-01-15 16:24:07 -0800,2024-01-15 16:24:07 -0800,"<em><p>jvwhyte <a href=""#answer-1630689"" rel=""nofollow"">said</a></p></em> <blockquote>Thanks for your comments Matt.  I have used Google Takeout to an extent in the past but have been put off by the sheer size of the files created - for example, a mail folder of 120 emails, when downloaded gave me an mbox file of 165Mb (127 when compressed), nor did I find it a particularly speedy process. </blockquote> <p>When you are tediously trying to work out which mails you ""missed"" in your imap backup you will decide the Google process is positively rocket powered. </p><p>The storage file system in Thunderbird is exactly the same as the google one for mail takeout.  So if you thought their files were large,  they will be exactly the same size as your Thunderbird ones. </p> <blockquote> I don't really understand the sizing &amp; structures.  My All Mail folder in gmail has &gt; 26,000 mails going back several years, but organised by topic  (folder/label) rather than by date.  The Google One storage page indicates that gmail is taking just 1.68Gb of my Drive. </blockquote> <p>Just how does google store an email?  I do not know.  I do know Microsoft outlook has always pulled it to bits,  converted attachments back to files and lumped them all in a database format in the PST file.  It is quite probable Google do something different. One of the realities of mail attachments is they are around thirty percent larger that their file equivalents.  It is a side effect of the MIME encoding of the binary data. </p> <blockquote>  I am also coming to the view that I should perhaps pay for private and secure email and move away from free services like Gmail that monetize my personal data.   Google is not an organisation I feel very good about.  <a href=""https://www.theverge.com/2019/11/26/20977968/google-graveyard-products-shut-down-dead-not-supported-discontinues-spring-cleaning"" rel=""nofollow"">https://www.theverge.com/2019/11/26/20977968/google-graveyard-products-shut-down-dead-not-supported-discontinues-spring-cleaning</a>  A combination of, for example, Proton Mail or Fastmail with a desktop client like Thunderbird, would allow me a bit more freedom to take a considered approach so I'm testing a few options to see where it takes me. </blockquote> <p>I would suggest you rethink your proton ideas. they get a lot of press,  but you can not get mail onto your desktop without their ""bridge"" running on your device.  The bridge is basically a local mail server as far as mail clients are concerned,  plenty of those with issues on this forum  for you to research.  Or you could check out the issues their git hub site for development of the bridge. <a href=""https://github.com/ProtonMail/proton-bridge/issues"" rel=""nofollow"">https://github.com/ProtonMail/proton-bridge/issues</a> </p><p>Add to that they offer to send encrypted mail even to those that do not have encryption certificates,  and you find they email a link to a web page on their server because the thing about symmetric encryption is both parties need to have and use their own certificates. So anyone claiming to do it without is mostly not doing what they lead you to think they are doing. </p><p>You might be better served by mailfence, I personally did a trial of their service and it appeared Ok, I failed to sign up for the paid account,  but it was closer to a paid reality I felt and you get your own domain with the paid tiers. <a href=""https://mailfence.com/#pricing"" rel=""nofollow"">https://mailfence.com/#pricing</a>  If you sign up for it via Thunderbird the project gets a few cents as well, but that is not why I suggest them. </p> <blockquote> <em><p>jvwhyte <a href=""#answer-1630712"" rel=""nofollow"">said</a></p></em> <p>When I navigate from 'Home' to '.thunderbird', click on 'xxx..xxx.default-release', there is a folder 'Imapmail' containing just an '.msf' file.   </p> </blockquote> <p>Check that the account is set to actually store messages remotely.  Account settings &gt; synchronization and storage ensure the keep messages in all folders for this account on this computer is checked.  Then check the advanced button to make sure the global setting is being applied on a per folder basis. </p><p>Ensure Synchronize all message regardless of age is checked under the disk space heading. </p>",MattAuSupport,false,0,0
1630966,1436769,2024-01-16 09:26:13 -0800,2024-01-16 09:26:13 -0800,"<p>Thanks again Matt for a seriously comprehensive answer. </p><p>I was looking for the IMAP folder in the wrong place - found it, eventually, at  </p><p>~/.var/app/org.mozilla.Thunderbird/.thunderbird/0q38jrr5.default-release/ImapMail/<a href=""http://imap.gmail.com"" rel=""nofollow"">imap.gmail.com</a> </p><p>and through Tools-Export backed up to a zipped file Thunderbird_profile-backup of 4.5Gb very quickly indeed&nbsp;!  Archive Manager refused to open this file but I may investigate a little further. </p><p>In the help notes, there is a mechanism for saving profiles over 2GB.   Using copy + paste, I copied the folder xx.default-release to an external USB disc; seemed to work although I had to skip over a ""symbolic link"" which could not be copied.  The copy was very fast indeed - just over 4.5Gb.   </p><p>I won't try a restore just yet until I understand what the symbolic link was and how to ensure it gets onto the backup.   </p><p>I will ""tediously (perhaps tomorrow)"" check that all the gmail folders are represented in the copied files. </p><p>Thanks for the comments about Proton - I have been using a free account for a couple of months, and I am not comfortable with it.   Mailfence looks rather complex and maybe a bit too technical for me.  I have read a lot of the user guide type info on Fastmail, and given they operate a free 30 days before ""cashing in"", I may well give that a try when I have worked with Thunderbird for a week or so.   </p><p>I have been retired for 18 years now and do struggle a bit with many technical terms.  I've been using Linux off + on for a while but have to confess that I have not made much progress.        Day to day, I use a MacBook Air M1 along with my iPhone &amp; iPad but to keep the brain cells ticking over I have an antique iMAC (2009 model) running Linux Mint which has loads of disc space and is helping to wean me off too much reliance on online storage from the dreaded Google and some others.   The end point is to have a steady backup regime of all my data, independently. </p>",jvwhyte,false,0,0
1630670,1436770,2024-01-15 05:42:09 -0800,2024-01-15 05:42:09 -0800,"<p>Hi Shubham, Just to be sure. You are not using Proton mail, you are using your existing email with the proton VPN? If yes, is it just the sending that doesn't work? If this is the case, could you try to use the alternative ports 465 or 587 as an outgoing SMTP port within Thunderbird settings in combination with SSL/TLS. </p>",shopov.bogomil,false,0,0
1630829,1436770,2024-01-15 19:22:34 -0800,2024-01-15 19:22:34 -0800,"<p>I just want to inform you. I'm a ProtonMail Enterprise user, and I'd like to use Proton VPN to send emails through Thunderbird. If that's possible, please assist me. </p>",itdesk.hopp,false,0,0
1630853,1436770,2024-01-15 23:19:27 -0800,2024-01-15 23:19:27 -0800,<p>Could you answer my questions? </p>,shopov.bogomil,false,0,0
1630879,1436770,2024-01-16 03:05:38 -0800,2024-01-16 03:05:38 -0800,"<em><p>Bogomil Shopov - Бого <a href=""#answer-1630853"" rel=""nofollow"">said</a></p></em> <blockquote>Could you answer my questions? </blockquote> <p>I just want to inform you. I'm a ProtonMail Enterprise user, and I'd like to use Proton VPN to send emails through Thunderbird. If that's possible, please assist me. </p>",itdesk.hopp,false,0,1
1630883,1436770,2024-01-16 03:34:32 -0800,2024-01-16 03:35:03 -0800,"<em><p>Bogomil Shopov - Бого <a href=""#answer-1630670"" rel=""nofollow"">said</a></p></em> <blockquote>Hi Shubham, Just to be sure. You are not using Proton mail, you are using your existing email with the proton VPN? If yes, is it just the sending that doesn't work? If this is the case, could you try to use the alternative ports 465 or 587 as an outgoing SMTP port within Thunderbird settings in combination with SSL/TLS. </blockquote> <p>I was talking about those questions ^^ </p><p><br> <strong>If you are using a proton email, </strong> you would need to install the Proton Bridge for Thunderbird: <a href=""https://proton.me/support/protonmail-bridge-clients-windows-thunderbird"" rel=""nofollow"">https://proton.me/support/protonmail-bridge-clients-windows-thunderbird</a> </p>",shopov.bogomil,false,0,0
1631048,1436770,2024-01-17 00:34:31 -0800,2024-01-17 00:34:31 -0800,"<em><p>Bogomil Shopov - Бого <a href=""#answer-1630883"" rel=""nofollow"">said</a></p></em> <blockquote><em><p>Bogomil Shopov - Бого <a href=""#answer-1630670"" rel=""nofollow"">said</a></p></em> <blockquote>Hi Shubham, Just to be sure. You are not using Proton mail, you are using your existing email with the proton VPN? If yes, is it just the sending that doesn't work? If this is the case, could you try to use the alternative ports 465 or 587 as an outgoing SMTP port within Thunderbird settings in combination with SSL/TLS. </blockquote> <p>I was talking about those questions ^^ </p><p><br> <strong>If you are using a proton email, </strong> you would need to install the Proton Bridge for Thunderbird: <a href=""https://proton.me/support/protonmail-bridge-clients-windows-thunderbird"" rel=""nofollow"">https://proton.me/support/protonmail-bridge-clients-windows-thunderbird</a> </p> </blockquote> <p>I am already using the proton bridge and proton VPN as well. there after we are facing the same issue, as we are mention in my first query..  could pls help? </p>",itdesk.hopp,false,0,0
1631057,1436770,2024-01-17 01:24:48 -0800,2024-01-17 01:24:48 -0800,<p>There is nothing more I can do. I advice you to contact Proton VPN support for help. </p>,shopov.bogomil,false,0,0
1630658,1436772,2024-01-15 05:10:41 -0800,2024-01-15 05:10:41 -0800,<p>Maybe if you create a screenshot of the HTML and post that. </p>,davidsk,false,0,0
1630659,1436772,2024-01-15 05:14:53 -0800,2024-01-15 05:14:53 -0800,"<em><p>david <a href=""#answer-1630658"" rel=""nofollow"">said</a></p></em> <blockquote>Maybe if you create a screenshot of the HTML and post that. </blockquote> <p>I did post it above, but forgot it would run it and display that! </p><p>Attached now.... </p>",breakwater-coaching,false,0,0
1630672,1436772,2024-01-15 05:57:06 -0800,2024-01-15 05:57:32 -0800,"<p>I tried it, exactly as you posted, and it works fine. Is there an addon or special theme you are using? </p>",davidsk,false,0,0
1630679,1436772,2024-01-15 06:22:46 -0800,2024-01-15 06:22:46 -0800,"<p>That's weird. </p><p>I've some, but I've tried turning them off, and the issue remains. </p>",breakwater-coaching,false,0,0
1630680,1436772,2024-01-15 06:35:00 -0800,2024-01-15 06:35:00 -0800,"<p>I suggest you look at all the HTML, as you may be creating more than that.  Send an email to me at davidthunderbird at gmx dot com and I'll look at it. </p>",davidsk,false,0,0
1630694,1436772,2024-01-15 07:50:22 -0800,2024-01-15 07:50:22 -0800,"<p>Makes sense to think that. But if the one line alone isn't working, is not due to other lines of text added. </p>",breakwater-coaching,false,0,0
1630890,1436772,2024-01-16 04:53:12 -0800,2024-01-16 04:53:12 -0800,<p>Any other takers? </p>,breakwater-coaching,false,0,0
1630894,1436772,2024-01-16 04:57:27 -0800,2024-01-16 04:57:27 -0800,<p>I offered to check it if you send a sample. </p>,davidsk,false,0,0
1630897,1436772,2024-01-16 05:08:31 -0800,2024-01-16 05:09:36 -0800,"<p><a href=""https://pastebin.mozilla.org/dS1ixSM8"" rel=""nofollow"">https://pastebin.mozilla.org/dS1ixSM8</a> I did an edit to extract the HTML and included it in Mozilla's pastebin for a few weeks <a href=""https://pastebin.mozilla.org/dS1ixSM8"" rel=""nofollow"">https://pastebin.mozilla.org/dS1ixSM8</a> </p><p>However I inserted the HTML into the signature block of an account,   <img src=""https://assets-prod.sumo.prod.webservices.mozgcp.net/media/uploads/images/2024-01-15-19-15-13-68829a.png""> I opened a new message for that account and this is what I see. <img src=""https://assets-prod.sumo.prod.webservices.mozgcp.net/media/uploads/images/2024-01-15-19-15-49-a6e644.png""> </p><p>I would therefore think that the issue is not so much as Thunderbird,  but perhaps some other add-on you may have installed. </p><p>Have you tried restarting Thunderbird in Troubleshooting mode from the help menu and continuing when prompted.  That should remove any add-ons and if I am right in guessing an add-on then you should see your signature. </p><p>Just as an aside,  I have included another image showing what normal sized text look like beside yours. <img src=""https://assets-prod.sumo.prod.webservices.mozgcp.net/media/uploads/images/2024-01-15-19-20-58-892e71.png"">  You choice of 19Px is about 14 points,  which may suit your eyes,  but will look unusually large, perhaps even clownishly so, for most folk who use 10 or 12 point when writing a letter.  I know there is this idea that setting a font size is a good idea,  but it is not.  You have no idea what the person reading your email will read it on.  For this reason Thunderbird sticks to ""generic"" sizes.  With normal being ""about"" 14 points. See <a href=""https://developer.mozilla.org/en-US/docs/Web/CSS/font-size"" rel=""nofollow"">https://developer.mozilla.org/en-US/docs/Web/CSS/font-size</a> </p><p>But beyond my aversion to specifying sizes outside the ""Thunderbird generic"" small, medium, large, x-large et al which allows to reading device to scale things based on the environment in use.  Generally a 30 inch desktop screen has differences to a 5 inch phone screen.  There are other reason to avoid using pixels when scaling fonts.  See <a href=""https://joshcollinsworth.com/blog/never-use-px-for-font-size"" rel=""nofollow"">https://joshcollinsworth.com/blog/never-use-px-for-font-size</a> which I personally found rather interesting. </p>",MattAuSupport,false,0,0
1630922,1436772,2024-01-16 06:12:08 -0800,2024-01-16 06:12:08 -0800,"<em><p>david <a href=""#answer-1630894"" rel=""nofollow"">said</a></p></em> <blockquote>I offered to check it if you send a sample. </blockquote> <p>And much appreciate. But for now, I'm sticking with: If the one line of html fails, then is not the rest of the uninclcuded signature that's the issue. </p>",breakwater-coaching,false,0,0
