id,created,updated,title,content,tags,product,topic,locale,answers,creator
1461716,2024-09-02 17:39:24 -0700,2024-09-03 08:18:40 -0700,Does Firefox/Thunderbird have an email reader for emails saved locally?,<p>Is it possible to use Thunderbird as an email reader without opening the app with all of the email accounts? I want to read emails saved on my hard drive. </p>,other;,thunderbird,other,en-US,1672550;,hartfilms1
1461722,2024-09-02 17:53:59 -0700,2024-09-03 08:04:00 -0700,Deleted emails,<p>Is there a way to restore an email that was deleted from the trash folder? </p>,other;,thunderbird,other,en-US,1672548;,ptownsend28
1461725,2024-09-02 18:27:56 -0700,2024-09-05 05:51:30 -0700,Outgoing smtp details being teset,"<p>snowski Sep 1, 2024, 18:50 CST </p><p>Emails were blocked from being sent out of Thunderbird. The solution was to change the smtp Outgoing settings, which works but only once: Telstra (email provider) recently upgraded it's security and the Outgoing Server details needed changing to ""<a href=""http://smtp.telstra.com"" rel=""nofollow"">smtp.telstra.com</a>"" with Port 465, SSL/TLS, Normal Password, user name. The old default Outgoing Server was <a href=""http://smtp.bigpond.com"" rel=""nofollow"">smtp.bigpond.com</a> etc. </p><p>I deleted all the old Outgoing Server details and changed the old ""<a href=""http://smtp.bigpond.com"" rel=""nofollow"">smtp.bigpond.com</a>"" to ""<a href=""http://smtp.telstra.com"" rel=""nofollow"">smtp.telstra.com</a>"" etc as the default. All was fine, emails could now be sent. The problem is that when Thunderbird is closed and reopened all the old smtp settings are being restored and the new SMTP settings removed/deleted. Emails now can't be sent again until the smtp settings are changed back to <a href=""http://smtp.telstra.com"" rel=""nofollow"">smtp.telstra.com</a> etc. I've tried the advanced option and removed old smtp settings but that didn't work. Each time Thunderbird is closed the new Outgoing SMTP settings are overwritten by the old values. Is there somewhere on the C drive that I can access to delete the old settings manually or some other solution? </p>",customize-settings-and-preferences;,thunderbird,settings,en-US,1672523;1672847;1672850;,snowski
1461726,2024-09-02 18:55:41 -0700,2024-09-02 18:55:41 -0700,Thunderbird Calendar,"<p>I am using TB Beta 130.0b3 64 bit on Windows10 </p><p>An entry has appeared in my Calendar and I have No idea where it came from  It is however dated Friday 13th September&nbsp;?! ""France &amp; Spain Trip 2024 Deposit"" </p><p>Can anybody explain this&nbsp;?!  </p><p>Regards Eric </p>",protect-your-privacy;,thunderbird,privacy-and-security,en-US,"",firefox2902
1461731,2024-09-02 20:30:13 -0700,2024-11-09 06:46:18 -0800,Thunderbird 128.2.0 Crashing on Start up (bug 1907691),"<p>Hello,  </p><p>Thunderbird keeps crashing. That is about all that I can tell you.  It started this morning (/when I got to work I fist noticed it). I have not used any add ons.  I have been submitting crash reports.  Crash data avaiable on request.  I uninstalled and re installed, same result; crashes immediately on start up.  </p><p>Please assist.  </p><p>Thank you  </p><p>Toll </p>",other;bug1907691;tb128crash;,thunderbird,other,en-US,1672600;1672611;1672612;1672613;1672618;1672640;1674068;1674069;1674757;1674758;1674759;1674786;1674794;1674830;1674835;1674996;1674998;1674999;1675006;1686881;,tolle
1461734,2024-09-02 20:52:14 -0700,2024-09-03 08:01:56 -0700,Thunderbird requesting email password,<p>Please advise not accepting password. </p>,calendar;,thunderbird,calendar,en-US,1672546;,rmdawson
1461736,2024-09-02 21:10:53 -0700,2024-09-03 08:01:04 -0700,Thunderbird constantly requesting password.,<p>I have checked email server settings and all in order.  The attached message pops up constantly after password has been entered correctly. </p>,other;,thunderbird,other,en-US,1672545;,rmdawson
1461750,2024-09-02 23:59:55 -0700,2024-10-25 09:29:16 -0700,Corruption of emails when transferring them from Inbox to another folder,"<p>Last night, after transferring several emails from my Inbox to another folder listed in the left sidebar, I later discovered that they were corrupted and looked like this: </p><p>Received: by 2002:a05:6830:c8b:b0:70f:5b16:394e with SMTP id bn11csp798892otb; </p><pre>       Thu, 29 Aug 2024 11:10:24 -0700 (PDT) </pre> <p>X-Google-Smtp-Source: AGHT+IH2nbVZyZiCOmfmlo//5s738npdwGHURCCYVNOi/7sQnA0yXsht4BSfL7lfN+f3jqO7thY/ X-Received: by 2002:a05:620a:448a:b0:79f:1352:8318 with SMTP id af79cd13be357-7a8084a6ee2mr565344185a.4.1724955024593; </p><pre>       Thu, 29 Aug 2024 11:10:24 -0700 (PDT) </pre> <p>ARC-Seal: i=1; a=rsa-sha256; t=1724955024; cv=none; </p><pre>       d=<a href=""http://google.com"" rel=""nofollow"">google.com</a>; s=arc-20160816;        b=ozvQYozIzSqSgd80kdPRZZAqiil5/r0UUIRHhVhxl1aNA/yURiQVbHcQL14i/XE4ml         u9qo6fmx1mHONqenQ2PQWeFnjswDVjdpBcohjplhSP3GM17LSYZc01F3a13UkF27OyVb </pre> <p>Now, that is not happening.  What did happen, and how can I get them back in their proper form? </p>",troubleshooting;tb128corrupt;,thunderbird,troubleshooting,en-US,1672547;1672738;1672742;1672765;1672767;1672885;1672909;1681237;1683500;1684086;,jinkem
1461753,2024-09-03 00:17:04 -0700,2024-11-01 04:33:40 -0700,Setting local network server mail folder as Local Directory,"<p>I have used Thunderbird as my preferred mail client for many years. Recent upgrade to Kubuntu 24.04 from 22.04.4 seems to have changed storage options. Thunderbird 128.1.0esr(64bit) </p><p>I store my mail on my local server so that I can access it from a number of different computers on the same network.  If I set the Local Directory to that network folder it is changed to /run/user/1000/doc/5f5f8977/<a href=""http://mail.xxxxxx.com"" rel=""nofollow"">mail.xxxxxx.com</a> and the mail is imported to my local disk in that folder.  </p><p>However, when I restart the computer I have to set up the network folder again each time. </p><p>I have never had this problem before. How do I set the Local Directory permanently to the network server address? Thanks Bob </p>",customize-settings-and-preferences;,thunderbird,settings,en-US,1673457;1673702;1673850;1685298;,r.i.p1987
1461759,2024-09-03 01:12:01 -0700,2024-09-03 01:12:01 -0700,Thunderbird,"<p>How to clear the error (in Polish)&nbsp;: ""Logowanie na koncie ""l.twardy@jastar.de"" się nie powiodło Logowanie na serwerze <a href=""http://mail.jastar.de"" rel=""nofollow"">mail.jastar.de</a> za pomocą nazwy użytkownika ""l.twardy@jastar.de"" się nie powiodło"" </p>",other;,thunderbird,other,en-US,"",sekretariat24
1461762,2024-09-03 01:54:15 -0700,2024-09-03 01:54:15 -0700,Missing emails,"<p>I keep all my important emails in folders for future referance. Example, purchase receipts, internet purchases etc. I have just noticed that all my emails that are older than 2 or 3 months that I have stored in these folders have disappeared. Am I able to get these back and if so how do I do it please. I use IMAP if that helps. Thank you. </p>",troubleshooting;,thunderbird,troubleshooting,en-US,"",gstman007
1461767,2024-09-03 02:58:36 -0700,2024-09-03 02:58:36 -0700,messages,<p>i cant find any message in my inbox and sent </p>,other;,thunderbird,other,en-US,"",surelogs172
1461768,2024-09-03 03:07:54 -0700,2024-09-03 07:58:39 -0700,Corrupted email content.,"<p>Good day, </p><p>In random emails, I have a problem like in the picture. It means that the email content is corrupted, the subject and the rest of the data match. For other colleagues in the same mailbox, the email content displays correctly. </p><p>Do you have any ideas for this problem? </p>",troubleshooting;,thunderbird,troubleshooting,en-US,1672544;,szymon5
1461773,2024-09-03 03:40:14 -0700,2024-09-03 05:23:50 -0700,samsung phone,<p>can i down load thunderbird to my  android mobile i have K-9app but not working well but i have thunderbird on my windows laptop </p>,other;,thunderbird,other,en-US,1672521;,judithmilne633
1461776,2024-09-03 03:55:15 -0700,2024-09-03 03:55:15 -0700,Thunderbird,<p>Move a profile between two various  versions of thunderbird Techniques used previously no longer works from ubuntu 24.04 to 23.04 </p>,install-and-update;,thunderbird,installation-and-updates,en-US,"",rrundstrom
1461777,2024-09-03 04:09:25 -0700,2024-09-03 04:40:11 -0700,contenuti delle mail scomparsi - urgente,"<p>Buongiorno oggi non riusciamo più a vedere i contenuti delle mail in arrivo ma solo l'elenco. Abbiamo provveduto a selezionare la funzione ""ripara cartella"" da ""proprietà cartella"" della posta in arrivo. A quel punto sono scomparse tutte le mail del 2022-2023-2024 . Nell'elenco compaiono solo le mail dal 2021 in giù. Siamo disperati perchè di trattava di mail di lavoro anche certificate di due indirizzi mail. Per cortesia aiutateci a risolvere il problema. Grazie Maurizio Callegari </p>",troubleshooting;,thunderbird,troubleshooting,it,1672516;,archimaury
1461778,2024-09-03 04:27:57 -0700,2024-09-04 04:50:16 -0700,Selection of Inbox to receive emails from online email account,"<p>I have two Inboxes in which to receive emails from my online account using POP email forwarding. The emails are going into the online account's Inbox in Thunderbird, but I want them to go into the Inbox in my Local Folders. It's not a big issue, but a matter of preference. Otherwise I have no problems in Thunderbird. </p>",customize-settings-and-preferences;,thunderbird,settings,en-US,1672543;1672595;1672693;,rogersquier
1461779,2024-09-03 04:34:01 -0700,2024-09-03 04:34:01 -0700,Thunderbird login problem - 0x80004005 error message,"<p>Hello. One e-mail account (<a href=""http://online.de"" rel=""nofollow"">online.de</a>) in my Windows Mail, which has been operating continuously for three years, indicated a login password problem overnight last week. Since my mailbox was flawless on the web interface, I downloaded Thunderbirds. (I really like it so far). I logged into my two mailboxes (gmail, freemail) without any problems - but <a href=""http://online.de"" rel=""nofollow"">online.de</a> also said after every setting: ""Component returned failure code: 0x80004005 (NS_ERROR_FAILURE)"" I tried to ask for help from the service provider for days, before they finally solved it their hands: they have no idea. In summary: <a href=""http://online.de"" rel=""nofollow"">online.de</a>'s web interface is flawless, Thunderbird's IMAP settings are fine, Thunderbird's other mailboxes are flawless. Can you help me what's going on??? </p>",troubleshooting;,thunderbird,troubleshooting,hu,"",durkoandras
1461783,2024-09-03 05:05:49 -0700,2024-09-03 05:05:49 -0700,Problemas ao colar imagem do whatsapp no corpo do email - Thunderbird,"<p>Bom dia. </p><p>Recentemente nem eu nem nenhum dos usuários da empresa está conseguindo colar imagens copiadas do Whatsapp Web no corpo do email utilizando o Thunderbird, versão 128.1.1esr. Até semana passada isto era possível e utilizado amplamente dentro da empresa. </p><p>Sempre que uma imagem copiada do Whatsapp web é colada no corpo do email, é exibido um ícone como se o arquivo estivesse corrompido, em anexo um exemplo. O problema ocorre utilizando as 3 opções de colagem, ""Colar"", ""Colar sem formatação"" e ""Colar como citação"". Adicionalmente, imagens copiadas de outras fontes na internet, como por exemplo imagens do google ou imagens copiadas de quaisquer outros sites funcionam normalmente, bem como capturas de telas tiradas do computador, sendo inseridas no corpo do email ao utilizar a opção Colar (ctrl-v). </p><p>Apesar de parece pequeno, esse problema atrapalha muito o fluxo produtivo de todos da empresa, gostaria de ajuda para entender e solucionar esse incidente. </p><p>Desde já, agradeço a todos que colaborarem. </p>",troubleshooting;,thunderbird,troubleshooting,pt-BR,"",user111053045295106468366157942782696683620
1461793,2024-09-03 06:17:38 -0700,2024-09-09 04:28:26 -0700,Laptop crashed and lost Thunderbird user profile and all emails. Need help to recover,<p>Laptop crashed and lost Thunderbird user profile and all emails. Need help to recover all emails in Thunderbird </p>,troubleshooting;,thunderbird,troubleshooting,en-US,1672542;1672659;1672695;1672860;1672863;1672884;1673485;1673503;,nkkjanice
1461796,2024-09-03 06:45:52 -0700,2024-09-06 11:09:00 -0700,Mail lock down with contribute screen.,<p>I contributed to Mozilla but Thunderbird remains locked. What can I do&nbsp;? Please respond to inbox@windchim.com Thank-you. </p>,troubleshooting;,thunderbird,troubleshooting,en-US,1672541;1673057;1673072;,manager51
1461797,2024-09-03 06:47:12 -0700,2024-09-03 07:46:35 -0700,thnderbird will not launch,"<p>I have always used mail washer pro, now all of a sudden it will not lauch thunderbird, I get an cannot launch notice. </p>",other;,thunderbird,other,en-US,1672540;,bmeister1
1461798,2024-09-03 07:08:45 -0700,2024-09-03 12:34:26 -0700,Vulnerability detection,<p>NordVPN flags Thunderbird as a high security level risk and relatively straightforward for attackers to gain access to my data. Please look into this matter and correct. Thanks </p>,protect-your-privacy;,thunderbird,privacy-and-security,en-US,1672582;,trent22
1461803,2024-09-03 07:19:56 -0700,2024-10-10 14:10:19 -0700,After update to Thunderbird version 128:  Quick filter freezes the GUI while doing the filtering,"<p>Dear community, I have recently updated my Thinkpad from kubuntu 22.04 to 24.04, which included an update of thunderbird to version 128.1.0esr (and a switch to a snap package). </p><p>However, when I type into the quick filter bar, (i) the whole thunderbird GUI freezes until the filter was applied to my several thousand emails, (ii) which also seems to take much longer than before.   Before the update, the filter took maybe ~0.5 seconds or less, it now takes ~4  seconds.  A lot for just a few thousand emails. Btw, the same happens if I empty the quick filter field.  Just that it seems to take now even longer until it shows all of my emails. </p><p>I don't know if anyone can help.  I feel more this could be something for a bug report? </p><p>Thanks a lot in advance, Matthias </p>",troubleshooting;,thunderbird,troubleshooting,en-US,1672536;1672603;1672897;1673167;1673168;1673173;1673310;1673314;1673368;1673442;1673904;1678560;1680750;,matthias.merkel
1461805,2024-09-03 07:42:25 -0700,2024-09-03 07:42:25 -0700,"Using ""Send to:"" to email photo will not use Thunderbird","<p>A friend just got a new Win 11 PC and I am helping him set up Thunderbird.  When emailing photos, he uses the context menu ""Send to:"" selection, which resizes the photo and adds it to a new email.  The problem is that it always tries to use Outlook, which isn't installed.  We have set Thunderbird as the default app for all the options offered, but it still doesn't work with Send to. </p>",troubleshooting;,thunderbird,troubleshooting,en-US,"",enzer
1461808,2024-09-03 07:52:38 -0700,2024-09-03 17:04:49 -0700,Cannot Get Messages,"<p>When I click on Get Messages, nothing happens. The Get Messages icon blinks momentarily but nothing else. When I go to File-&gt;Get New Messages for either all accounts or for jmcarron@starstream.net, the dialog box disappears but  nothing else. </p>",troubleshooting;,thunderbird,troubleshooting,en-US,1672615;,jmcarron
1461811,2024-09-03 08:15:47 -0700,2024-09-03 19:59:26 -0700,Thunderbird v128.1.1esr Password manager fails,<p>Under Thunderbird v128.1.1esr the passwords of accounts couldn't be saved via password manager. The list of saved passwords is empty. But if I run Thunderbird in debug mode the list is shown correctly. What can I do to not been prompted everytime for passwords&nbsp;? </p>,troubleshooting;,thunderbird,troubleshooting,en-US,1672629;,otto.imgrund
1461819,2024-09-03 09:10:56 -0700,2024-09-06 00:54:43 -0700,Non visualizzo il testo delle emails scaricate da settimane e mesi con TB!!!,"<p>Buon pomeriggio, ho provato a cercare nel Forum ma trovo solo domande analoghe e non riesco a capire le risposte quali siano, quindi spero che possiate rispondere anche a me. Da agosto noto che le emails scaricate non sono più leggibili nel loro testo, si vede solo l'oggetto, si vede se ci sono allegati (la spilla) ma non si legge nulla e non sembrano neanche esistere se ci clikko sopra col mouse. Questo anche per le emails inviate o cancellate. Sembra ci sia solo la loro traccia ma non la sostanza e per chi come me usa TB per lavoro è assolutamente un grave problema. Inoltre ho notato che questo problema vale a posteriori avendo coinvolto emails precedenti che prima leggevo! sono disperato!!!! Utilizzo TB da oltre 10 anni e lo aggiorno sempre (ora uso 128.1.1esr (32 bit) ). cosa succede? avete una soluzione? da una decina di giorni o meno le nuove emails scaricate si leggono normalmente ma quelle vecchie di 2.3 settimane ed oltre sembrano scomparse. grazie Giovanni </p>",other;,thunderbird,other,it,1672571;1672999;1673009;,giovanni.ben
1461820,2024-09-03 09:12:01 -0700,2024-09-04 04:46:57 -0700,Failure to send email,"<p>I am getting a number of messages ""Sending of the message failed. SSL received a record with an incorrect Message Authentication Code. The configuration related to <a href=""http://mail.tobymanning.co.uk"" rel=""nofollow"">mail.tobymanning.co.uk</a> must be corrected"" when I send an email </p>",other;,thunderbird,other,en-US,1672692;,Toby-Go
1461823,2024-09-03 10:02:43 -0700,2024-09-03 10:02:43 -0700,"Calendar Reminders unreadable, too dark","<p>Hi, </p><p>The uploaded image shows the problem.  When I first open Tbird and the Reminder popup opens, all reminders look normal - black text on a white background.  As soon as I do anything, in Tbird or another application, the top reminder gets a very dark blue background, making it unreadable. </p><p>This has been going on since the release before 128 (124?).  I waited until the next release in case it was just 124.  Clearly, it isn't.  I have opened Tbird in Troubleshoot mode but the issue remains. </p><p>The only possibility I can think of is that I have too many emails.  That's a very long, unrealistic guess so any others would be greatly appreciated! </p><p>Thanks, sivarik </p>",calendar;,thunderbird,calendar,en-US,"",sivarik
1461828,2024-09-03 10:44:57 -0700,2024-09-03 18:38:15 -0700,export contacts from olf thunderbird to new on new computer,"<p>I have a very old computer with windows 7 and Thunderbird 11.5.14. 0 32 bit  I have finally got a new computer with windows 11 and have installed Thunderbird 128.1 ESR 64 bit  I tried to export from the old version but it will not install on the new version. How do I move my contacts from the old one to the new one - contacts are all I care about , I can get the email by logging in. There doesn't seem to be an export for just contacts. </p><p>Im willing to put them in something like xcel as a csv if needed. thanks for any help. </p><p>Dianne </p>",other;,thunderbird,other,en-US,1672591;1672616;1672622;,foxymax
1461833,2024-09-03 11:21:19 -0700,2024-09-09 05:16:26 -0700,I can receive emails but can't send emails on my tommorelli@hotmail.com email address in Thunderbird program on Asus laptop,"<p>To whom it may concern, Not able to send emails using Windows 10 with Windows Defender as my virus and threat protection service. Attached is SMTP Server screenshot. Already tried two other recommended numbers as Port numbers and still was not able to send emails. Thanks in advance for any/all assistance. Tom </p>",troubleshooting;,thunderbird,troubleshooting,en-US,1672590;1673086;1673108;1673511;,tomfidelismorelli
1461836,2024-09-03 11:31:55 -0700,2024-09-03 15:42:52 -0700,Unified Folders Slow on MacOS 128.1.1,"<p>Hello, </p><p>I've recently begun using Thunderbird to manage all of my disparate email accounts. Going into each account separately was a bit slower than ideal so I found out about Unified folders. However, I run into an issue with the main Inbox where clicking on it will freeze Thunderbird for up to several minutes. I know there are other posts about this, however, nothing has been able to fix the issues I have so far (also a lot of them are on windows). </p><p>Issue: Clicking on ""Inbox"" in the ""Unified Folders"" section results in a freezing of the software for period of time (it does eventually unfreeze). The freeze is preceded by a noticeable albeit reasonably short pause as Thunderbird switches to the inbox. After this is when the freeze happens and it shows as not responding in Activity Monitor.  </p><p>Things that don't cause the issue: - Clicking on any of the account specific inbox folders within the ""Unified Folders"" menu. - Clicking on an account's inbox. </p><p>Current setup: Accounts: - My proton mail account ( - My google mail account (only downloads the last year of mail for offline access) (total mail in the 10s of thousands range) </p><p>Things I have tried: - Launching in trouble shooting mode - Launching in trouble shooting mode while disabling plugins and such - Delete global sqlite db - Delete imap msr files - Fully re install and re-setup accounts </p>",troubleshooting;,thunderbird,troubleshooting,en-US,1672602;1672608;,elijah.sauder
1461837,2024-09-03 11:49:02 -0700,2024-09-03 14:26:14 -0700,email,"<p>We have been working with our server, Blue Mountain, for weeks now trying to correct ever shifting email issues: can't send or receive emails on laptop, can receive on phones but not send, then can't receive but can send. Then can't do either. Currently I haven't gotten an email on my phone since August 2, the last item there is a box that says ""Correct credentials needed. Enter credentials for arimor@gorge.net."" My husband's last email is a Newsbreak -- from a week or so ago. So we can't send or receive from laptop or phones, but in our last contact with Blue Mountain they said it must be a Thunderbird problem. I fervently hope it is because then our problems might be solved. Can you help? </p>",other;,thunderbird,other,en-US,1672592;,arimor
1461839,2024-09-03 11:52:28 -0700,2024-09-03 11:52:28 -0700,"connection to carddav addressbook provider fails (address, username, passwort correct)","<p>Hi, after searching the help topics and consulting the german speaking forum (<a href=""https://www.thunderbird-mail.de/forum/user-thread-list/94649-kakeck/"" rel=""nofollow"">https://www.thunderbird-mail.de/forum/user-thread-list/94649-kakeck/</a>), re-installing the update to v 128.1.1 for windows 10 (which in the help tab &gt; About Thunderbird permanently seems to try and update again), I don't have a clou how to go on to solve the following problem: The connection with my E-mail provider's addressbook server address always fails, there is no connection to the server address: <a href=""https://carddav.a1.net"" rel=""nofollow"">https://carddav.a1.net</a>. Username and password are correct. If I use <a href=""https://carddav.a1.net/.well-known/carddav"" rel=""nofollow"">https://carddav.a1.net/.well-known/carddav</a> in Firefox, there is an error, too. I have also deinstalled the antivirus software and tried again. I am attaching some sreenshots for illustration. </p><p>Can somebody give advise&nbsp;? Thanks a lot, Karin </p>",troubleshooting;,thunderbird,troubleshooting,en-US,"",karin.keckeis
1461840,2024-09-03 11:52:57 -0700,2024-09-06 17:15:34 -0700,No puedo aseder a mi cuenta Google y feis,<p>No puedo aseder a mi cuenta gogle </p>,troubleshooting;,thunderbird,troubleshooting,es,1673124;,mariodelangel06201917
1461841,2024-09-03 11:56:36 -0700,2024-11-23 04:38:04 -0800,Disabled account keeps popping up asking for password,"<p>I quit working for a company and my email account with them was closed. However, I like to keep the emails around just to have some <a href=""http://history.So"" rel=""nofollow"">history.So</a> I am trying to disable the account without wiping it out of my thunderbird.  Following advice from another question, I turned off checkboxes in my server settings (shown in image).However, regardless of this, whenever I open thunderbird and various other times besides, it pops up this demand for my password for that account (second image, note the banner at the top). How can I REALLY TRULY deactivate the account so that thunderbird will never again try to read anything from it? </p>",troubleshooting;,thunderbird,troubleshooting,en-US,1672589;1681723;1681726;1681920;1681928;1682210;1682216;1682218;1685375;1685417;1689592;1689653;,ken225
1461844,2024-09-03 12:17:56 -0700,2024-09-03 12:17:56 -0700,INBOX ISSUE,<p>I have a scrolling across the top of my page that makes me scroll back to get to inbox. It has multiple copies of a particular email land I have to back scroll forever to get to my in box. This has been going on for months </p>,troubleshooting;,thunderbird,troubleshooting,en-US,"",FIMOCREATIONSINC
1461846,2024-09-03 12:51:58 -0700,2024-09-04 13:13:11 -0700,name + contact better dictation.com,"<p>Hello </p><p>I see I'm registered as davidhands100. </p><p>I want to contact <a href=""http://betterdictation.com"" rel=""nofollow"">betterdictation.com</a> as david hands </p><p>How do I do that? </p><p>David Hands </p>",other;,thunderbird,other,en-US,1672588;1672757;,davidhands100
1461849,2024-09-03 12:58:58 -0700,2024-09-13 19:16:34 -0700,Thunderbird local directory changes after restart,"<p>Hi, </p><p>since I installed Ubuntu 24.04 Thunderbird (V. 128.1.0 as snap app) changes the path of the local directory each time I restart Thunderbird. My original path to the local directory points to a mounted drive e.g. /media/username/disk... Thunderbird changes it to /run/usr/1000/doc/.... How can I avoid this? The same thing happens also to the path of the signature file. </p><p>Thank you for your help! Ubuntu </p>",troubleshooting;,thunderbird,troubleshooting,en-US,1672644;1673165;1673404;1673456;1673487;1673683;1673877;1673998;1674001;1674002;1674003;1674046;1674168;1674180;1674458;,rapo60
