id,created,updated,title,content,tags,product,topic,locale,answers,creator
1443812,2024-04-01 18:16:12 -0700,2024-04-02 04:23:36 -0700,POP to IMAP saving old messages,"<p>I recently converted from POP to IMAP.  It appears old messages from POP were automatically migrated to the IMAP Local Folder, but how can I confirm that before I remove the old POP account?  The conversion instructions said I needed to manually move the old messages, but they are already in the Local Folder. </p>",download-and-install_1;,thunderbird,download-install-and-migration,en-US,1645313;,cfnord
1443814,2024-04-01 18:59:21 -0700,2024-04-01 18:59:21 -0700,Thunderbird 115.9.0-1 Snap will not open hyperlinks in messages,"<p>Hello! </p><p>My Thunderbird snap was updated a few days ago to 115.9.0-1.  Since then, I cannot open any hyperlinks in any messages.  I am running Ubuntu 20.04 LTS.  Opening hyperlinks in emails was working fine prior to the upgrade.   </p><p>As far as I can tell from the TB settings, TB is set up to ""Use System Handler (default)"" for ""HTML document"".  I can set the system browser to Chrome or FireFox, but the problem still persists.  Hyperlinks open from other documents, like LibreOffice documents. </p><p>The console logs the following error whenever a hyperlink is clicked: NS_ERROR_FAILURE: Component returned failure code: 0x80004005 (NS_ERROR_FAILURE) [nsIHandlerInfo.launchWithURI] ContentDispatchChooser.sys.mjs:76 </p><p>Any ideas? </p><p>My TB Snap info is: jhuber@t5610:~$ snap info thunderbird name:      thunderbird summary:   Mozilla Thunderbird email application publisher: Canonical✓ store-url: <a href=""https://snapcraft.io/thunderbird"" rel=""nofollow"">https://snapcraft.io/thunderbird</a> contact:   <a href=""https://launchpad.net/distros/ubuntu/+source/thunderbird"" rel=""nofollow"">https://launchpad.net/distros/ubuntu/+source/thunderbird</a> license:   unset description: | </p><pre> Thunderbird is a free and open source email, newsfeed, chat, and calendaring client, that’s easy  to set up and customize. One of the core principles of Thunderbird is the use and promotion of  open standards - this focus is a rejection of our world of closed platforms and services that  can’t communicate with each other. We want our users to have freedom and choice in how they  communicate. </pre> <p>commands: </p><pre> - thunderbird </pre> <p>snap-id:      k1Ml1O9GzSO2QftV0ZlWSbUfQ78nN460 tracking:     latest/stable refresh-date: 5 days ago, at 09:41 CDT channels: </p><pre> latest/stable:    115.9.0-1 2024-03-20 (460) 145MB -  latest/candidate: 124.0-1   2024-03-13 (459) 150MB -  latest/beta:      124.0b5-1 2024-03-12 (456) 150MB -  latest/edge:      ↑                                 </pre> <p>installed:          115.9.0-1            (460) 145MB - </p>",fix-problems;,thunderbird,fix-slowness-crashing-error-messages-and-other-problems,en-US,"",jhuber1965
1443816,2024-04-01 20:35:42 -0700,2024-04-01 21:41:13 -0700,Donation,<p>Thought I made a donation about 10 minutes ago - the donation page will not go away did I make the donation&nbsp;?? Mike Duncombe </p>,other;,thunderbird,other,en-US,1645283;,kathymiked
1443819,2024-04-01 23:09:04 -0700,2024-04-01 23:09:04 -0700,Color texto en mensajes,"<p>Buenos días, cuando redacto un nuevo mensaje de correo electrónico y quiero colorear el texto en una frase, solo se colorea la primera palabra pero si selecciono un párrafo con más de una línea, pasa lo mismo solo se colorea una palabra por línea pero distintas palabras en una misma línea no se colorea. </p><p>La versión de mi ThunderBird es 115.9.0 (64 bit) sobre un Windows 10 Pro. </p><p>No sé si faltaría algún dato para poder ayudarme. </p><p>Gracias de antemano. </p><p>Saludos, </p><p>Carlos. </p>",other;,thunderbird,other,es,"",carlosruizprieto
1443820,2024-04-01 23:17:42 -0700,2024-04-01 23:17:42 -0700,Thunderbird no longer loading messages prefixed as ***SPAM***,"<p>Up until a few weeks ago around 70% of my messages were prefixed ***SPAM*** even though most were not. This was not a problem, as I looked at the subject and sender and decided for myself. I now get no messages prefixed ***SPAM***,  I can however, get these with webmail. I did not change any settings, this just happened. I have tried playing with the security spam settings but this does not fix the problem. My computer runs Linux Fedora, always the latest version. Any help/suggestions greatly appreciated. Cheers Steve </p>",other;,thunderbird,other,en-US,"",steve611
1443822,2024-04-02 00:19:33 -0700,2024-04-02 00:19:33 -0700,Emails sent by moodle or webmails are not shown in sent folder,"<p>Hello everyone, </p><p>At work we have a moodle installation that uses an email account to send messages, notifications, etc to students. In the past we used gmail and we saw how every email Moodle sent was in the ""Sent"" folder. Now we switched to a custom email account from our hosting and since we did that we cannot see the emails Moodle sent. I decided to try Thunderbird to see if I could see it there but I still can't. I checked the option ""Copy in Other"" so it saves the email in the Sent folder. It works when I send an email directly from Thunderbird but not if I send an email from webmail or Moodle. </p><p>Any idea of why this is happening? </p><p>Thanks in advance! </p>",other;,thunderbird,other,es,"",daniel.garcia
1443823,2024-04-02 00:28:02 -0700,2024-04-02 02:38:23 -0700,Thunderbird / gmail only few messages showing,"<p>Dear all </p><p>starting from today my thunderbird 115.9.0 only show few messages from gmail account in my inbox folder. </p><p>Don't know what happened, I left my laptop on wednesday with all the email showing in INBOX... In the gmail web all the mail are present. In thunderbird I have only few. All the new email are downloaded. </p><p>What I can check? I have already done both compact folder and repair folder but no success. </p><p>Please help. </p>",other;,thunderbird,other,it,1645299;,tuxberg77
1443825,2024-04-02 00:39:55 -0700,2024-04-02 00:39:55 -0700,Cannot login to outlook account (empty oauth window),"<p>Hello, our company changed login to our outlook accounts to always use two factor auth. Since that change I cannot login nor create new account in Thunderbird, because the window where I should login to my account is just blank, see attached image. </p>",download-and-install_1;,thunderbird,download-install-and-migration,en-US,"",tkocan
1443826,2024-04-02 01:28:31 -0700,2024-04-02 01:28:31 -0700,I can't log in,<p>Hello. I use thunderbird e-mail. But today I can't access it anymore. Can you help me? e-mail in thunderbird is ---&gt; info@oiltrustservice.com </p><p><br> answer please here oiltrustservice@gmail.com </p>,other;,thunderbird,other,en-US,"",oiltrustservice
1443828,2024-04-02 01:43:30 -0700,2024-04-02 01:43:30 -0700,Need your support to login my account,"<p>I can't able to, open my thunderbird account.  Srihari.mohan@safexpress.com is my mail ID.  Please do the needful </p>",other;,thunderbird,other,en-US,"",srihari.mohan
1443830,2024-04-02 02:13:15 -0700,2024-04-02 02:17:37 -0700,Help with TBSync,"<p>I have been using TBSync for a while now to synchronise contacts with my Google account and, at the weekend, have rebuilt my PC and updated to Windows 11. </p><p>Before the upgrade I copied the whole Thunderbird folder and then reinstated it on the new build. This has worked fine and I have all my accounts, address books, etc. as before. </p><p>However, I don't think that the contacts are being synchronised any more and wondered if people know what steps I need to do to get this going again? </p><p>Thanks </p>",customize;,thunderbird,customize-controls-options-and-add-ons,en-US,1645298;,MysteryMan
1443831,2024-04-02 03:21:02 -0700,2024-04-02 03:21:02 -0700,Thunderbird email- not loading inbox emails? cant fetch from IUD?,"<p>Thunbderbird, will not load inbox emails. sent mails showing and folders. test email sent not showing. </p><p><br> pop up box displayed"" cant fetch uid?"" </p><p>thanks. </p>",other;,thunderbird,other,en-US,"",henrywillis
1443832,2024-04-02 04:02:25 -0700,2024-04-02 04:19:57 -0700,Why is it so hard to find a contact book deduper??,"<p>I've wanted to migrate over to Thunderbird, but as I have a frightening amount of contacts, and I don't have the time to go through each one manually, I'm really surprised that no one has developed a good deduper for the contact book.  Is it that difficult, or did Thunderbird go through some massive change that made the old dedupers obsolete? </p>",customize;,thunderbird,customize-controls-options-and-add-ons,en-US,1645312;,racarrera
1443834,2024-04-02 04:11:10 -0700,2024-04-02 04:11:10 -0700,Borrado de mensajes,"<p>Hola! Se han borrado de repente, todos los mensajes de la bandeja de entrada, que no tenia archivados. No están en la papelera. ¿Cómo puedo recuperarlos? Estoy muy preocupada, ya que es el correo del trabajo. Gracias. </p>",other;,thunderbird,other,es,"",rosi6
1443837,2024-04-02 04:42:01 -0700,2024-04-02 04:42:01 -0700,Error envío email de cuentas HOTMAIL,"<p>Buenas tardes. </p><p>Llevo años con este gestor de cuentas de email, y todo perfecto. </p><p>Pero desde hace una semana no me deja enviar emails, solo recibo emails para cuentas ""hotmail"". </p><p>El resto de cuentas de email corporativas van perfectas. </p><p>Me da este error al intentar enviar emails desde 2 cuentas de HOTMAIL: </p><p>Falló el envío del mensaje. El mensaje no se ha podido enviar porque ha caducado la conexión al servidor de salida (SMTP) <a href=""http://smtp.office365.com"" rel=""nofollow"">smtp.office365.com</a>. Vuelva a intentarlo. </p><p>Muchas gracias anticipadas por los comentarios. </p>",other;,thunderbird,other,es,"",toriasas1
1443842,2024-04-02 05:29:46 -0700,2024-04-02 05:29:46 -0700,Lista de Mensagem com 3 linhas,"<p>Olá, </p><pre>  Eu uso visualização verticar, como eu adiciono uma linha na lista de mensagens (Card)&nbsp;?   Esta funcionalidade é muito importante para trazer ao menos a primeira linha do corpo do email no card da lista de mensagens. </pre> <p><br> Obrigado Talis </p>",customize;,thunderbird,customize-controls-options-and-add-ons,pt-BR,"",talisjonatas
1443845,2024-04-02 05:54:23 -0700,2024-04-02 05:54:23 -0700,Thunderbird Contacts Import,<p>hi Thunderbird Contacts Import， It's too slow。  </p><p>我模拟了一些数据，测试导入数据越大速度越慢。我是用CSV文件格式导入，可以优化一下吗？ </p>,fix-problems;,thunderbird,fix-slowness-crashing-error-messages-and-other-problems,en-US,"",atgf0127
1443847,2024-04-02 06:31:56 -0700,2024-04-02 06:31:56 -0700,VPN omrežje,"<p>POzdravljeni  </p><p>Pred nekaj dnevi smo si uredili ExpressVPN, naš poštni odjemalec je Thunderbird na katerem imam nastavljenih več email računov in sicer gmail, domenske poštne predale, problem pa je pri poštnem predalu <a href=""http://siol.net"" rel=""nofollow"">siol.net</a>, če imam vklopljen VPN , mi niti ne sprejema , niti pošilja pošte s tega poštnega predala, če VPN izklopim, pošta poteka normalno. Zanima me ali bi bilo potrebno za siol poštni predal, kako drugače nastaviti strežnike , oz. kje bi bil problem. </p>",customize;,thunderbird,customize-controls-options-and-add-ons,sl,"",bralcom
