id,question_id,created,updated,content,creator,is_spam,num_helpful,num_unhelpful
1686119,1472841,2024-11-05 10:53:43 -0800,2024-11-05 10:53:43 -0800,"<p>Anything that's labelled Spam is due to the mail provider's filters, which you might or might not be able to adjust.  TB always uses the label 'Junk'. </p><p>Access the account in webmail and whitelist or unblock legitimate senders, and add them to webmail contacts. </p>",sfhowes,false,0,0
1686034,1472846,2024-11-05 00:34:44 -0800,2024-11-05 00:34:44 -0800,<p>Probabilmente stai caricando una firma in formato binario il cui file originario è danneggiato. </p>,@next,false,0,0
1686038,1472849,2024-11-05 00:52:51 -0800,2024-11-05 00:52:51 -0800,<p>In che modo dovremmo aiutarti se non spieghi bene la situazione? </p>,@next,false,0,0
1686047,1472851,2024-11-05 01:15:18 -0800,2024-11-05 01:15:18 -0800,"<p>Per i file PDF, ImportExportTools NG segue le impostazioni di stampa, genera cioè l'anteprima di stampa di ogni messaggio e poi lo converte in PDF. </p>",@next,false,0,0
1686118,1472855,2024-11-05 10:49:43 -0800,2024-11-05 10:49:43 -0800,"<p>My settings in Settings/General/Lang. &amp; Appearance, Colours, are shown in the first picture.  I can make the message body background yellow by changing to the second picture.  While it's possible to use css to change the colours, I suggest first trying to do this with the Colours options. </p>",sfhowes,false,0,0
1686196,1472855,2024-11-06 00:07:05 -0800,2024-11-06 00:07:05 -0800,"<p>Thank a lot! By clicking Colors button there, selecting new colors and restarting Thunderbird the problem was solved! </p>",morlop,false,0,0
1686056,1472861,2024-11-05 03:37:35 -0800,2024-11-05 03:37:35 -0800,"<p>Se non si comunica bene in inglese, si prega di utilizzare MozillaItalia - <a href=""http://forum.mozillaitalia.org/index.php?board=32.0"" rel=""nofollow"">http://forum.mozillaitalia.org/index.php?board=32.0</a> </p>",wsmwk,false,0,0
1686089,1472868,2024-11-05 07:18:13 -0800,2024-11-05 07:18:13 -0800,"<p>Hallo Frans, </p><p>gaat uw vraag over Firefox of Thunderbird? Beide kunnen een hoofdwachtwoord gebruiken namelijk, maar ik weet niet of u met ‘mailbox’ Thunderbird of uw webmail bedoelt. </p><p>Voor Firefox zijn de volgende artikelen wellicht relevant: </p> <ul><li><a href=""/nl/kb/een-hoofdwachtwoord-gebruiken-synchronisatie"" rel=""nofollow"">Een hoofdwachtwoord gebruiken met Synchronisatie</a> </li><li><a href=""/nl/kb/firefox-blijft-me-om-het-hoofdwachtwoord-vragen"" rel=""nofollow"">Firefox blijft me om het hoofdwachtwoord vragen</a> </li></ul> <p>Voor Thunderbird: </p> <ul><li><a href=""/nl/kb/thunderbird-wachtwoorden-beschermen-hoofdwachtwoord"" rel=""nofollow"">Uw Thunderbird-wachtwoorden beschermen met een hoofdwachtwoord</a> </li></ul> <p>Ook is er eerder een vergelijkbare vraag gesteld, maar ik weet niet of die veel nuttige informatie oplevert in dezen: <a href=""https://support.mozilla.org/nl/questions/1471238"" rel=""nofollow"">https://support.mozilla.org/nl/questions/1471238</a> </p>",markh2,false,0,0
1686104,1472868,2024-11-05 08:54:13 -0800,2024-11-05 08:54:13 -0800,"<p>Dag Mark, Bedankt voor je spoedig antwoord. Nog een mooie avond. Frans </p>",franita,false,0,0
1686115,1472871,2024-11-05 10:37:17 -0800,2024-11-05 10:37:17 -0800,"<em><p>Michael Große <a href=""#question-1472871"" rel=""nofollow"">said</a></p></em> <blockquote>Hello, I have just transferred a one-off donation. The transfer probably worked via credit card. I was surprised that although I activated 2-factor authentication at my bank, my banking security app didn't ask for confirmation. This always worked for other transfers on various websites. Does Thunderbird Mozilla not support 2-factor identification? That would be a pity. And I have no feeling about it. Yours sincerely, Michael Mintel </blockquote> <p>See <a href=""https://www.thunderbird.net/de/donate/help/"" rel=""nofollow"">https://www.thunderbird.net/de/donate/help/</a> </p>",sfhowes,false,0,0
1686085,1472891,2024-11-05 07:05:32 -0800,2024-11-05 07:05:32 -0800,"<p>Informazioni utili da fornire nelle richieste di supporto: </p> <ol><li> Versione di Thunderbird </li><li> Versione del sistema operativo </li><li> Provider delle caselle email (Gmail, Libero, Hotmail, etc.) </li><li> Tipologia di account (POP3, IMAP) </li><li> Estensioni installate </li><li> Messaggi di errore che vengono visualizzati durante l'utilizzo di Thunderbird </li><li> Software di sicurezza eventualmente presenti (Antivirus e simili) </li></ol>",@next,false,0,0
1686090,1472892,2024-11-05 07:21:33 -0800,2024-11-06 03:55:28 -0800,"<p>Ik neem aan dat u dat via de Snelfilterwerkbalk hebt gedaan. U leest in <a href=""https://support.mozilla.org/nl/kb/snelfilterwerkbalk"" rel=""nofollow"">dit artikel</a> meer over deze functie. </p>",markh2,false,0,0
1686109,1472892,2024-11-05 10:07:40 -0800,2024-11-05 10:07:40 -0800,"<p>Beste Mark, dank je voor je snelle reactie. Ik weet niet precies of het via de snelfilterwerkbalk was of via een andere weg. Dat artikel heb ik ook gelezen, maar het zegt niets over ongedaanmaken van de filter. </p>",anierman,false,0,0
1686201,1472892,2024-11-06 00:44:52 -0800,2024-11-06 00:44:52 -0800,<p>klik op het regelpictogram naast het invoerveld¨berichten filteren¨ en haal het vinkje weg bij ¨ongelezen¨ </p>,Mad_Maks,false,0,0
1686209,1472892,2024-11-06 02:19:04 -0800,2024-11-06 02:19:04 -0800,"<p>Als je bedoelt het invoerveld dat tevoorschijn komt met klik op Snelfilter: daar staan bij alle 5 categorieen (ongelezen, met ster enz.) de vinkjes uit. Om te testen heb ik er even op geklikt en dan zie ik een blauw streepje, dat bij weer klikken weg is. Bij aanzetten verandert er niks aan mijn e-mail scherm. </p>",anierman,false,0,0
1686210,1472892,2024-11-06 02:21:31 -0800,2024-11-06 02:21:31 -0800,<p>En ik wil nog even toevoegen: ik heb de pc ook al opnieuw opgestart. Dat hielp niet. </p>,anierman,false,0,0
1686214,1472892,2024-11-06 03:25:38 -0800,2024-11-06 03:25:38 -0800,"<p>dit is een vreemd probleem, kunt u een schermafbeelding maken en hier posten, <a href=""https://support.mozilla.org/nl/kb/hoe-maak-ik-schermafbeelding-mijn-probleem"" rel=""nofollow"">https://support.mozilla.org/nl/kb/hoe-maak-ik-schermafbeelding-mijn-probleem</a> </p><p>Als u naar uw webmail omgeving gaat ziet u dan nog wel alle mailtjes? </p>",Mad_Maks,false,0,0
1686237,1472892,2024-11-06 05:26:18 -0800,2024-11-06 05:26:18 -0800,"<p>Je vraag: ""Als u naar uw webmail omgeving gaat ziet u dan nog wel alle mailtjes"": op mijn iPad zie ik alle mails. Ik hoef dus niet naar de webmailomgeving.  Ik voeg een screenshot van mijn iMac scherm toe. Daarop zie je dat jouw mail van 12:25 niet te zien is, omdat ik die op mijn iPad gelezen heb. Vreemd is dat 2 emails, ondanks dat ik ze gelezen heb, op mijn iMac wèl nog zichtbaar zijn (niet vet, want reeds gelezen).  Ik ben morgen een paar dagen weg, dus als je een paar dagen geen antwoord krijgt van mij, weet dan dat dat geen gebrek aan interesse is dit op te lossen!! </p>",anierman,false,0,0
1686084,1472896,2024-11-05 07:04:28 -0800,2024-11-05 07:04:28 -0800,"<p>Informazioni utili da fornire nelle richieste di supporto: </p> <ol><li> Versione di Thunderbird </li><li> Versione del sistema operativo </li><li> Provider delle caselle email (Gmail, Libero, Hotmail, etc.) </li><li> Tipologia di account (POP3, IMAP) </li><li> Estensioni installate </li><li> <strong>Messaggi di errore che vengono visualizzati durante l'utilizzo di Thunderbird</strong> </li><li> Software di sicurezza eventualmente presenti (Antivirus e simili) </li></ol>",@next,false,0,0
1686170,1472901,2024-11-05 18:16:28 -0800,2024-11-05 18:16:28 -0800,"<ul><li> Start Windows in safe mode with networking enabled - <a href=""https://support.microsoft.com/en-us/help/12376/windows-10-start-your-pc-in-safe-mode"" rel=""nofollow"">https://support.microsoft.com/en-us/help/12376/windows-10-start-your-pc-in-safe-mode</a> </li><li> Still In Windows safe mode, start Thunderbird in Troubleshoot Mode - <a href=""https://support.mozilla.org/en-US/kb/troubleshoot-mode-thunderbird"" rel=""nofollow"">https://support.mozilla.org/en-US/kb/troubleshoot-mode-thunderbird</a> </li></ul> <p>Better?  Worse? </p><p>If not better, try setting hidden preference accessibility.force_disabled to value of 1 at Settings &gt; General &gt; Config editor. </p>",wsmwk,false,0,0
1686114,1472913,2024-11-05 10:30:56 -0800,2024-11-05 10:30:56 -0800,"<p>Create a secure mail key and use that in TB in place of the account password: </p><p><a href=""https://www.att.com/support/article/dsl-high-speed/KM1010523/"" rel=""nofollow"">https://www.att.com/support/article/dsl-high-speed/KM1010523/</a> </p>",sfhowes,false,0,0
1686144,1472916,2024-11-05 13:40:07 -0800,2024-11-05 13:40:07 -0800,"<p>You're right, it's not a simple step or two, but once done, you'll never need to repeat it.   </p><p>This is the official (to my knowledge) documentation. Well worth the read <a href=""https://support.mozilla.org/en-US/kb/message-threading-thunderbird"" rel=""nofollow"">https://support.mozilla.org/en-US/kb/message-threading-thunderbird</a>   </p><p>Here is my own documentation on threading, duplicating the above, but it may help: You need to highlight each folder and click View&gt;sort by&gt;unthreaded. If this applies to just a few folders, just repeat the process as necessary. If you have many folders or plan to add many new folders, you may wish a different approach, below:  </p> <pre>More info:  To change default for *new* folders, In config editor, you can change default that applies to NEW folders you set up: mailnews.default_view_flags      0 =unthreaded    Config editor is available at Tools&gt;settings&gt;general and scroll to bottom right.    ------------ 	 These steps may help:  To set many *existing* folders, follow these steps: This must be done on an account by account basis. # select table view  - the icon just to right of 'quick filter' button above message list pane #  select a message folder and apply all desired attributes - View&gt;sort by from menu bar (if not shown, click alt key) #  click the icon at right side of column display in message list pane #  select the entry near bottom 'Apply current view to...' #  highlight 'folder and children' # move mouse left to see account name and move left again to display all account folders. Now CLICK. a small menu will appear to confirm setting all folders within that account.  I did a simple (okay, crude) video at <a href=""https://davidkirk.org/SettingDefaultFolderView.mp4"" rel=""nofollow"">https://davidkirk.org/SettingDefaultFolderView.mp4</a>   ALSO, for future installations of Thunderbird,  - create a simple text file with name of user.js with these lines:       // Set default threading to UNthreaded  ###   &lt;== this line is optional, just for documentation      user_pref(""mailnews.default_view_flags"", 0); - install Thunderbird and exit prior to setting up accounts	  - copy the user.js file into the profile - now, when you start Thunderbird, unthreading will be the default. Problem solved.   </pre>",davidsk,false,0,0
1686098,1472922,2024-11-05 08:26:38 -0800,2024-11-05 08:26:38 -0800,"<p>No, non ci sono strumenti simili in Thunderbird al momento. Se vuoi puoi proporre la tua idea qui -&gt; <a href=""https://connect.mozilla.org/t5/ideas/idb-p/ideas"" rel=""nofollow"">https://connect.mozilla.org/t5/ideas/idb-p/ideas</a> </p>",@next,false,0,0
1686113,1472924,2024-11-05 10:29:09 -0800,2024-11-05 10:29:09 -0800,"<p>Post a crash ID.  They are strings beginning with bp-... </p><p><a href=""https://support.mozilla.org/en-US/kb/mozilla-crash-reporter-tb#w_viewing-crash-reports"" rel=""nofollow"">https://support.mozilla.org/en-US/kb/mozilla-crash-reporter-tb#w_viewing-crash-reports</a> </p><p>In the meantime, run Windows in safe mode and test TB performance.  Still crashing in W10 safe mode, try TB safe mode (hold Shift when launching TB). </p>",sfhowes,false,0,0
1686139,1472924,2024-11-05 12:53:34 -0800,2024-11-05 12:53:34 -0800,<p>None of this changes anything still same issues. </p>,mckinnk,false,0,0
1686225,1472924,2024-11-06 04:19:31 -0800,2024-11-06 04:19:31 -0800,"<em><p>Kevin M <a href=""#answer-1686139"" rel=""nofollow"">said</a></p></em> <blockquote>None of this changes anything still same issues. </blockquote> <p>Thanks, but you haven't posted your <strong>crash ID</strong> here. </p><p>Please: </p> <ul><li> Start Windows in safe mode with networking enabled - <a href=""https://support.microsoft.com/en-us/help/12376/windows-10-start-your-pc-in-safe-mode"" rel=""nofollow"">https://support.microsoft.com/en-us/help/12376/windows-10-start-your-pc-in-safe-mode</a> </li><li> Still In Windows safe mode, start Thunderbird in Troubleshoot Mode - <a href=""https://support.mozilla.org/en-US/kb/troubleshoot-mode-thunderbird"" rel=""nofollow"">https://support.mozilla.org/en-US/kb/troubleshoot-mode-thunderbird</a> </li></ul> <p>Does problem change? </p>",wsmwk,false,0,0
1686112,1472928,2024-11-05 10:24:55 -0800,2024-11-05 10:24:55 -0800,"<p>See <a href=""https://support.mozilla.org/en-US/questions/1471643#answer-1684666"" rel=""nofollow"">https://support.mozilla.org/en-US/questions/1471643#answer-1684666</a> </p>",sfhowes,false,0,0
1686211,1472928,2024-11-06 02:25:37 -0800,2024-11-06 02:25:37 -0800,<p>Well unless I've not put that in the right userChrome file it does not work! </p><p>Stuart </p>,stuart39,false,0,0
1686241,1472928,2024-11-06 06:53:03 -0800,2024-11-06 06:53:31 -0800,"<p>Well actually I had placed it in the wrong userChrome file, now it's in the correct one it works. Don't understand why colour choice has to be done via this method though should be easier. </p><p>Stuart </p>",stuart39,false,0,0
1686106,1472938,2024-11-05 09:25:37 -0800,2024-11-05 09:25:37 -0800,"<p>I just noticed that Thunderbird in my   Program Files has been updated to version 128.4.1 (x64). The problem, however, is the same. </p>",tedk,false,0,0
1686227,1472938,2024-11-06 04:20:54 -0800,2024-11-06 04:20:54 -0800,"<p>Please: </p> <ul><li> Start Windows in safe mode with networking enabled - <a href=""https://support.microsoft.com/en-us/help/12376/windows-10-start-your-pc-in-safe-mode"" rel=""nofollow"">https://support.microsoft.com/en-us/help/12376/windows-10-start-your-pc-in-safe-mode</a> </li><li> Still In Windows safe mode, start Thunderbird in Troubleshoot Mode - <a href=""https://support.mozilla.org/en-US/kb/troubleshoot-mode-thunderbird"" rel=""nofollow"">https://support.mozilla.org/en-US/kb/troubleshoot-mode-thunderbird</a> </li></ul> <p>Does problem go away? </p><p>Also, please post your crash IDs here. You will find them under Help &gt; Troubleshooting Information </p>",wsmwk,false,0,0
1686247,1472938,2024-11-06 07:51:36 -0800,2024-11-06 07:51:36 -0800,"<p>Thank you, Wayne. Here are all the submitted crash report numbers from the current incident: </p><p>bp-7abc5ddb-3b09-42a9-acdd-7556a0241105 bp-60be4df4-5f58-455d-b707-584d00241105 bp-94762472-3803-4c63-a053-7a8150241104 bp-a727d735-7c4d-492f-80d2-980f40241104 bp-abd00e7c-a931-4442-a414-a51320241031 bp-c4e6b16e-d139-47e6-838b-ec1a70241031 bp-c7b96418-9bb5-4e1e-aef8-9d61a0241104 bp-f03e38dc-6d7e-4469-8d12-f64b60241031 </p><p>Now, I wish to add more background information that might help. </p><p>I started using Thuderbird after Eudora was no longer supported. When I installed Thunderbird, I pointed it to my Eudora folder on the C: drive, imported everything, and used the same mailboxes that used to be for Eudora also for Thunderbird. Sometimes (maybe until 10/2024). Maybe there was an update in Thunderbird that moved the profile and mailbox storage location also to the Users/user name/AppData/Thunderbird location. I did not notice that change, and just continued to use Thunderbird. While trying to figure out this crash issue, I also noticed that Version 115.10.1.0 is installed in Program Files (x86), while the newer versions (currently 128.4.1 is in the Programs folder. </p><p>I can see in my Eudora folder two sub folders: ""Local Folders"" and ""Local Folders.sbd"". The ""Local Folders"" contains possibly all the mailboxes with their data (at least I hope so). </p><p>Also, on 11/1/2024, I backed up my Thunderbird profile to a local server, as Thunderbird_profile_backup.zip. I that folder I found the profile ""d79vy9vv.default"", and in it are various folders that were in the profile. Among them was a ""Mail"" folder, in which is a ""Local Folders"".  That folder contains only 58 mail boxes that have the same names, as their counterparts in the Eudora Folder, and their contents are only part of what is in the Eudora folder. </p><p>So, after the crashes from the update to 128.3.3, I could not open Thunderbird. There was another update to 128.4.1, but it did not solve the problem. Yesterday, I copied the Thunderbird backup profile from 11/1/2024 (see above), and replaced the profile in the  Users/user name/AppData/Thunderbird location. This enabled Thunderbird to open, and it asked me to update my profile, and connect to our mail server. Now, everything looks normal, except that it only has the 58 mailboxes with the limited information. </p><p>I am thinking to copy all the mailboxes from the Eudora folder into the Users/user name/AppData/Thunderbird location to replace the 58 mailboxes there. Do you think that this might solve the problem? </p><p>Thank you again for your guidance and assistance. </p><p>Ted </p>",tedk,false,0,0
1686270,1472938,2024-11-06 09:10:37 -0800,2024-11-06 09:10:37 -0800,"<p>I tried replacing The ""Local Folders"" from the Eudora folder into the Users/user name/AppData/Thunderbird location. I opened Thunderbird, it shows everything normally,  and everything seems to work.  </p><p>Thank you again. </p>",tedk,false,0,0
1686110,1472942,2024-11-05 10:16:24 -0800,2024-11-05 10:16:24 -0800,"<p>Please post a screenshot of the error. <a href=""https://support.mozilla.org/kb/how-do-i-create-screenshot-my-problem"" rel=""nofollow"">https://support.mozilla.org/kb/how-do-i-create-screenshot-my-problem</a> </p>",christ1,false,0,0
1686143,1472952,2024-11-05 13:18:57 -0800,2024-11-05 13:18:57 -0800,"<p>If you placed the messages in Local Folders, they will stay. If they are in message folders for an IMAP account, they will be lost. Please provide more detail to 'imported several years of emails to TB' to ensure I'm giving correct information for your situation, </p>",davidsk,false,0,0
1686226,1472953,2024-11-06 04:20:01 -0800,2024-11-06 04:20:01 -0800,"<p>Please </p> <ul><li> Start Windows in safe mode with networking enabled - <a href=""https://support.microsoft.com/en-us/help/12376/windows-10-start-your-pc-in-safe-mode"" rel=""nofollow"">https://support.microsoft.com/en-us/help/12376/windows-10-start-your-pc-in-safe-mode</a> </li><li> Still In Windows safe mode, start Thunderbird in Troubleshoot Mode - <a href=""https://support.mozilla.org/en-US/kb/troubleshoot-mode-thunderbird"" rel=""nofollow"">https://support.mozilla.org/en-US/kb/troubleshoot-mode-thunderbird</a> </li></ul> <p>Does problem change? </p>",wsmwk,false,0,0
1686117,1472955,2024-11-05 10:44:27 -0800,2024-11-05 10:44:27 -0800,<p>Czym się objawia to niedziałanie? </p>,TyDraniu,false,0,0
1686141,1472969,2024-11-05 13:14:55 -0800,2024-11-05 13:14:55 -0800,"<p>What is the English translation of the error message? That may be of help. is the server set to port 587, STARTTLS, OAuth2? </p>",davidsk,false,0,0
1686205,1472969,2024-11-06 01:39:26 -0800,2024-11-06 01:39:26 -0800,"<p>Hello, I have 3 email accounts managed on Thunderbird. On one of the three (jeanmarie.doree@outlook.fr), I receive messages but I am unable to send them... while on the other two email accounts everything works normally. I deleted this account and reinstalled it but the problem is still there (see attachment). Thank you in advance for your help! Sincerely, JM Dorée </p>",jeanmarie.doree,false,0,0
1686230,1472969,2024-11-06 05:07:07 -0800,2024-11-06 05:07:07 -0800,"<p>I do not know the error message. Would you please translate that to English.?  Also, please post a screenshot of the SMTP server settings, as that may be a possible explanation. Finally, I am requesting this information on the possibility that such information will explain the error, but it may not. </p>",davidsk,false,0,0
1686306,1472969,2024-11-06 12:54:37 -0800,2024-11-06 12:54:37 -0800,"<p>Hello David, As I wrote to you, I have 3 email accounts managed with Thunderbird: jmd.ufc@gmail.com, family.doree@orange.fr and jeanmarie.doree@outlook.fr The first two work perfectly, but with the third (jeanmarie.doree@outlook.fr) if I receive emails, <strong>I can't send them...</strong> (see attached file: screenshot 1). I have also attached screenshot 2 and 3 of the account settings. Many thanks for your help&nbsp;! Kind regards, JM Dorée </p>",jeanmarie.doree,false,0,0
1686311,1472969,2024-11-06 13:16:44 -0800,2024-11-06 13:16:44 -0800,<p>Change authentication to Oauth2 and let me know. That is required. </p>,davidsk,false,0,0
1686312,1472969,2024-11-06 13:29:26 -0800,2024-11-06 13:29:26 -0800,"<p>Bonsoir, Voir les 3 copies d'écran, suite à votre dernier message. </p>",jeanmarie.doree,false,0,0
1686313,1472969,2024-11-06 13:38:20 -0800,2024-11-06 13:38:20 -0800,"<p>Bonsoir, Je viens de faire un nouvel essai et tout semble fonctionner à nouveau&nbsp;!!! Un grand MERCI&nbsp;! JM Dorée </p>",jeanmarie.doree,false,0,0
1686319,1472969,2024-11-06 13:52:16 -0800,2024-11-06 13:52:16 -0800,"<p>You are very welcome! &nbsp;:)  I sometimes wonder why it is that the French people are so polite - but I LIKE IT!  I appreciate your courtesy and kindness in your posts and responses. You may assume this is normal, but it is not, and it is always welcome. </p>",davidsk,false,0,0
1686320,1472969,2024-11-06 13:57:02 -0800,2024-11-06 13:57:02 -0800,"<p>Yes dear David, the French are sometimes grumblers... but (in principle) polite. Especially when a nice computer scientist helps them... THANK YOU again! </p>",jeanmarie.doree,false,0,0
1686322,1472969,2024-11-06 13:58:21 -0800,2024-11-06 13:58:21 -0800,<p>Thank you for the smile. You're welcome here anytime. &nbsp;:) </p>,davidsk,false,1,0
1686224,1472970,2024-11-06 04:15:05 -0800,2024-11-06 04:15:05 -0800,"<p>We don't have good insight to what is happening.  So let's start with... </p> <ul><li> Start Windows in safe mode with networking enabled - <a href=""https://support.microsoft.com/en-us/help/12376/windows-10-start-your-pc-in-safe-mode"" rel=""nofollow"">https://support.microsoft.com/en-us/help/12376/windows-10-start-your-pc-in-safe-mode</a> </li><li> Still In Windows safe mode, start Thunderbird in Troubleshoot Mode - <a href=""https://support.mozilla.org/en-US/kb/troubleshoot-mode-thunderbird"" rel=""nofollow"">https://support.mozilla.org/en-US/kb/troubleshoot-mode-thunderbird</a> </li></ul> <p>Does problem change? </p>",wsmwk,false,0,0
1686301,1472970,2024-11-06 12:23:19 -0800,2024-11-06 12:23:19 -0800,"<p>Hi Wanye, Thanks for your reply! I just tried that, but it had the same result. Thunderbird opend a blank window, which I could not interact with, and shut down by itself after a few seconds. The only difference was that I did not get the report crash interface afterwards. I am clueless about what is happening, if you have any ideas how I can provide useful information, it would be very appreciated. </p>",Felix,false,0,0
1686303,1472975,2024-11-06 12:39:06 -0800,2024-11-06 12:39:06 -0800,<p>We need more details. </p>,frederic12,false,0,0
1686183,1472984,2024-11-05 22:18:31 -0800,2024-11-05 22:59:30 -0800,"<p>For GMail it's <a href=""http://smtp.gmail.com"" rel=""nofollow"">smtp.gmail.com</a> and Port 465. </p><p>For Outlook it's <a href=""http://smtp.office365.com"" rel=""nofollow"">smtp.office365.com</a> and Port 587. </p>",ThePillenwerfer,false,0,0
1686233,1472984,2024-11-06 05:12:26 -0800,2024-11-06 05:12:26 -0800,<p>Both Gmail and Outlook have stopped support SMTP so these do not work anymore. </p>,arbogast.rush,false,0,0
