id,created,updated,locale,product,title,is_solved,solution,solved_by,is_spam,last_answer,answers,topic,tags,creator,content,involved,is_archived,is_locked,is_taken,metadata,num_answers,num_votes_past_week,num_votes,taken_until,taken_by,updated_by
1442936,2024-03-21 18:10:25 -0700,2024-03-22 13:54:38 -0700,hu,thunderbird,UrL link prewiev in Thunderbird,false,,,false,1643596,1643553;1643596;,settings,customize;,katalin.gellert,"<p>Add link preview when pasting URLs - option doesn't work. I see only the link, when sending emails. </p>",katalin.gellert;meskobalazs;,true,false,false,";category:customize;useragent:Mozilla/5.0 (Windows NT 10.0; Win64; x64) AppleWebKit/537.36 (KHTML, like Gecko) Chrome/123.0.0.0 Safari/537.36;product:thunderbird",2,0,0,,,
1442938,2024-03-21 18:38:53 -0700,2024-03-25 08:20:54 -0700,en-US,thunderbird,Glitch resulted in 98 .eml files converted to attachments on a single email,true,1643557,Toad-Hall,false,1644080,1643557;1643626;1644080;,other,other;,Victoria-nola,"<p>I've got TB 115.5.0 on Windows 11, been using TB for some 10-15 years, but not a programmer of any sort.  Something weird happened, where the order of the emails in a folder was all wrong, and I pressed the Date header to get it to sort back under Date.  No proper response. Rebooted computer. On re-opening, the emails in the same folder are in order except this weird file at the top with a 2015 date, which now contains all of my important .eml files converted to attachments to this email, but without any ability to detach attachments. Those .eml files no longer exist in the folder as emails, they only exist as attachments to this weird email.   When I try to delete the file, I get a warning that 98 emails will be deleted, but in fact those emails now only exist as attachments.  I right clicked and got an option to ""Forward as Attachments"", so I sent myself an email that has all those .eml files as attachments (29 MB). Right now I have not collected that email into TB, it's just sitting on the gmail site. </p><p>So, if possible, I need to know how to convert those .eml attachments back into active emails in my folder.  Does my request and problem make any sense?  Is there any way to get my correspondence back?   All my other folders appear to be normal.   </p><p>I have all my files backed up in the cloud.  Is it possible to get back a single folder from my TB backup there? And actually, I haven't collected email in a couple of days, so I could just get my entire TB backup if I had to, then collect the most recent email.   Need help and advice, please.  </p><p>Thank you, --Victoria </p>",Victoria-nola;Toad-Hall;,true,false,false,;category:other;useragent:Mozilla/5.0 (Windows NT 10.0; Win64; x64; rv:123.0) Gecko/20100101 Firefox/123.0;product:thunderbird;solver_id:1098507,3,0,0,,,
1442939,2024-03-21 18:54:43 -0700,2024-03-22 07:56:27 -0700,en-US,thunderbird,"Unable to write the email to the mailbox. Make sure the file system allows you write privileges, and you have enough disk space to copy the mailbox.",false,,,false,1643551,1643551;,other,other;,snipiam,"<p>MANY folks have had this problem. This happened to me today, and I see you archived all the helpful info, thought nothing is working on my end.  Please don't remove these posts, as it is difficult to find them and get the much needed answers.  I right clicked on the inbox for properties and clicked repair folder, more than once as it appeared to do nothing.  I cleared my recycle bin. I am using GMAIL with thunderbird, my gmail is not overloaded. I still cannot download email into my thunderbird.  PLEASE HELP.  I need this to function. Thank you. </p>",snipiam;Toad-Hall;,true,false,false,";category:other;useragent:Mozilla/5.0 (Windows NT 10.0; Win64; x64) AppleWebKit/537.36 (KHTML, like Gecko) Chrome/122.0.0.0 Safari/537.36 Edg/122.0.0.0;product:thunderbird",1,0,0,,,
1442941,2024-03-21 19:42:04 -0700,2024-05-16 22:44:21 -0700,en-US,thunderbird,How can i stop the New split screen format? Return to the old?,false,,,false,1653281,1643507;1653281;,settings,customize;,ycgfpr8cpm,<p>I have vision problems so i use enlarged text and color modifiers. The new mozilla thunderbird format SQUEEZES the text and shrinks it into HALF a screen. This is VERY difficult for me to even see… and navigat9ng thunderbirds menus has always been very difficult and not user friendly.  Add to this the confusing reordering of emails received so that newer emails now stack UNDER older emails…. And its completely frustrating to find anything. I have to scroll down hunting for possible new emails burried down below dozens of others on a tiny scrunched window. PLEASE how do i change it back…. This is too difficult to function in……… </p>,ycgfpr8cpm;davidsk;wsmwk;,true,false,false,";category:customize;useragent:Mozilla/5.0 (Macintosh; Intel Mac OS X 10_15_7) AppleWebKit/605.1.15 (KHTML, like Gecko) Version/16.5 Safari/605.1.15 Ddg/16.7;product:thunderbird",2,0,1,,,wsmwk
1442944,2024-03-21 21:09:32 -0700,2024-03-21 21:39:08 -0700,en-US,thunderbird,show email form multiple accounts at the same time,false,,,false,1643471,1643471;,settings,customize;,citydwelleer,"<p>Hello fine people, forgive me im a noob, first day kn thunderbird... I would like all of my email to show together from both of my Gmail accounts. In Gmail it available as ""all mailboxes""  </p><p>I see that when I search it searches all accounts, that's super cant do that on Gmail but I just cant figure out how to combine my inboxes so scanning the days mail is more easy the way I like it </p><p>thunderbird virsion 115.9.0 (64-bit) Edition	Windows 10 Home Version	22H2 Installed on	‎9/‎9/‎2023 OS build	19045.4170 Experience	Windows Feature Experience Pack 1000.19054.1000.0 </p><p><br> </p><p>Thanks Toodles 🦄 </p>",citydwelleer;sfhowes;,true,false,false,";category:customize;useragent:Mozilla/5.0 (Windows NT 10.0; Win64; x64) AppleWebKit/537.36 (KHTML, like Gecko) Chrome/122.0.0.0 Safari/537.36;product:thunderbird",1,0,0,,,
1442945,2024-03-21 21:32:40 -0700,2024-03-24 17:34:07 -0700,en-US,thunderbird,Trying to use multiple 365 mail accounts on Thunderbird,true,1643834,MattAuSupport,false,1643985,1643834;1643985;,other,other;,dnjplus4,"<p>I installed Thunderbird to consolidate the many emails I have, of which there are 3 Microsoft 365 accounts.  I have been able to load all 3 but can only get the <a href=""http://outlook.com"" rel=""nofollow"">outlook.com</a> account to receive and send.  The other 2 which are @companyname.com accounts will not send emails.  I have tried the solutions in the help database with regards to having the multiple of the same SMTP servers and the ""Normal Password"" vs OAUTH2 but to no avail.  Any suggestions will be greatly appreciated.  My Gmail, multiple Yahoo acounts and Digital Pacific accounts all work fine. </p>",dnjplus4;MattAuSupport;,true,false,false,";category:other;useragent:Mozilla/5.0 (Windows NT 10.0; Win64; x64) AppleWebKit/537.36 (KHTML, like Gecko) Chrome/122.0.0.0 Safari/537.36;product:thunderbird;solver_id:5850239",2,0,0,,,
1442949,2024-03-21 23:48:36 -0700,2024-03-21 23:51:41 -0700,it,thunderbird,"non funziona più, da ieri pomeriggio, Thunderbird",false,,,false,1643481,1643481;,other,other;,Aldomarola,"<p>1) autenticazione non riuscita durante la connessione al server <a href=""http://imap.gmail.com"" rel=""nofollow"">imap.gmail.com</a> </p><p>2) invio del messaggio non riuscito. non è stato possibile inviare il messaggio perchè la connessione al server di posta in uscita (SMTP) <a href=""http://smtp.gmail.com"" rel=""nofollow"">smtp.gmail.com</a>  è scaduta </p><p>Risolvere individualmente è come entrar in un labirinto. </p>",Aldomarola;@next;,true,true,false,;category:other;useragent:Mozilla/5.0 (Windows NT 6.1; Win64; x64; rv:109.0) Gecko/20100101 Firefox/115.0;product:thunderbird,1,0,0,,,
1442954,2024-03-22 01:34:54 -0700,2024-04-13 10:13:34 -0700,en-US,thunderbird,How to send email from WordPress site via Gmail using Thunderbird App authorization,false,,,false,1647208,1643504;1644380;1644392;1645719;1645761;1645927;1646287;1646762;1646763;1647207;1647208;,other,other;,warp.imagick,"<p>What WordPress email setting we should use to to send WordPress transactional emails via Gmail account which has Thunderbird-Gmail App enabled. For example, using FluentSMPT WordPress Plugin? </p><p>Or, how to send WordPress transactional emails using Thunderbird mail client, on Linux OS server? </p>",warp.imagick;davidsk;dragan.djuritj;wsmwk;,true,false,false,";category:other;useragent:Mozilla/5.0 (X11; Linux x86_64) AppleWebKit/537.36 (KHTML, like Gecko) Chrome/123.0.0.0 Safari/537.36;product:thunderbird",11,0,0,,,
1442956,2024-03-22 01:43:30 -0700,2024-03-22 09:53:50 -0700,en-US,thunderbird,Thunderbird asking for credentials - blank screen,false,,,false,1643569,1643569;,troubleshooting,fix-problems;,info11059,"<p>My Thunderbird was just updated. Now when I try to check emails, it gives me a blank screen and on the top it says: ""Enter Credentials for &lt;my email address&gt; on <a href=""http://outlook.office365.com"" rel=""nofollow"">outlook.office365.com</a>"". There are no options and the screen is blank. Please help! </p>",info11059;wsmwk;,true,false,false,;category:fix-problems;useragent:Mozilla/5.0 (Windows NT 10.0; Win64; x64; rv:123.0) Gecko/20100101 Firefox/123.0;product:thunderbird,1,0,0,,,
1442959,2024-03-22 03:07:12 -0700,2024-04-03 10:09:42 -0700,it,thunderbird,1 G-mail su 2 pc con pop3,false,,,false,1645473,1643547;1643558;1643559;1643560;1643575;1645445;1645449;1645473;,other,other;,Cris,"<p>Buongiorno, vorrei capire se sbaglio qualcosa nella procedura d'installazione o se semplicemente Gmail non permette questa funzione. Ho un piccolo ufficio e su 2 stanze diverse ho 2 pc, che hanno bisogno di mandare (ed ovviamente), ricevere email da un unico account Gmail, ho bisogno di metterlo in pop3 perché così evito il problema di errori, magari cancellare inavvertitamente un email dal server, per questo non faccio la configurazione imap. Io ho fatto la configurazione e se la metto nel pc1(o pc2 ho fatto anche il contrario non cambia), il problema non si pone, ma appena la configuro nell'altro pc, l'email non arrivano in entrambi i pc, se vi può interessare se mando un email dal pc2 e rispondono all'email, arriva solo al pc2, se un fornitore manda un email senza rispondere alla stessa(ma creando un email nuova), non viene ricevuta da entrambi i pc.... Credo di essermi spiegato abbastanza bene, scusate se cosi non è stato. </p>",Cris;@next;,true,false,false,";category:other;useragent:Mozilla/5.0 (Windows NT 10.0; Win64; x64) AppleWebKit/537.36 (KHTML, like Gecko) Chrome/122.0.0.0 Safari/537.36;product:thunderbird",8,0,0,,,
1442962,2024-03-22 03:43:22 -0700,2024-03-22 03:55:56 -0700,en-US,thunderbird,connection is refusing after importing thunderbird  from windows to tails,false,,,false,1643515,1643515;,troubleshooting,fix-problems;,sarathdc,"<p>after importing backup /existing thunderbird profile folder , everything imported but connection is refusing.I am unable to read nee feeds and emails I have configured in windows. </p>",sarathdc;davidsk;,true,false,false,;category:fix-problems;useragent:Mozilla/5.0 (X11; Linux x86_64; rv:109.0) Gecko/20100101 Firefox/115.0;product:thunderbird,1,0,0,,,
1442965,2024-03-22 04:16:05 -0700,2024-03-22 05:25:12 -0700,en-US,thunderbird,Cómo borrar una libreta de direcciones?,false,,,false,1643526,1643525;1643526;,other,other;,penolibe,"<p><strong>Hola, ¿Cómo borrar una libreta de direcciones completa, cargada por error? Gracias.</strong> </p>",penolibe;davidsk;Toad-Hall;,true,false,false,;category:other;useragent:Mozilla/5.0 (Windows NT 10.0; Win64; x64; rv:66.0) Gecko/20100101 Firefox/66.0;product:thunderbird,2,0,0,,,
1442966,2024-03-22 04:16:44 -0700,2024-03-23 02:41:14 -0700,en-US,thunderbird,"Thunderbird, S/MIME, X509 certificates and Smartcards",false,,,false,1643648,1643648;,privacy-and-security,privacy-and-security_1;,PB64,"<p>Sorry in advance for the long reading. </p><p>For my personal needs I'm currently using the general purpose desktop platform UBUNTU 22.04.04 LTS and GNOME/WAYLAND. Thunderbird is my personal e-mail and productivity client application, now in it's stable version 115.8.1 (64 bits). </p><p>For many years I used to sign my personal emails using S/MIME and a high assurance (Qualified) X.509 digital certificate, protected by my personal ID card (i.e. a smartcard), which is provided by my government (Belgium). It used to work flawlessly under Xubuntu, my favorite OS flavor until about a year ago, with earlier versions of Thunderbird. </p><p>Since I migrated to UBUNTU's standard flavour (using WAYLAND), it doesn't work any longer. </p><p>I experienced the same behaviour with Firefox when Canonical started distributing only the SNAP version of the app for Ubuntu. This problem is well known and documented. I applied the recommended solution, which was - and still is - to install the Mozilla binary version along the snap version. I can since happily continue authenticating and connecting securely to any belgian e-government web site using the Mozilla firefox binary version with my certificates/Id card, while using the snap version for other purposes. </p><p>So I tried the same recipe with Thunderbird, ... to no avail. Both versions (Ubuntu-snap and Mozilla-binary version 115.8.1) display the same, consistent behaviour. I must precise here that I can load the BELPIC PKCS#11 subsytem and configure Thunderbird like I always did. After asking for my smartcard's PIN, TB can access the smartcard and lets me associate my certificate with my email account. Everything seems to work as usual until there, except that signing a message does not work. TB systematically displays the same error message ""... the application does not find the certificate or the certificate has expired"". Of course my certificate is not expired.  It looks like the message composer (not Thunderbird itself) cannot access the smartcard. Disabling apparmor leads to the same result with both the snap and Mozilla versions of TB.  </p><p>Still, TB - both versions - works as expected when using low-assurance digital certificates, e.g. issued by <a href=""http://CAcert.org"" rel=""nofollow"">CAcert.org</a>. I also use those for receiving encrypted personal messages when needed. But those are stored locally together with their private keys. </p><p>There is no interest in signing messages with a digital certificate without any legal value, especially on a system that is meant to be more secure. I migrated to the standard ubuntu desktop for the added security provided by snap, apparmor, Wayland, ... </p><p>Before I file in a bug record, would someone be in a position to provide any useful hint? </p><p>Many thanks in advance. </p>",PB64;MattAuSupport;,true,false,false,;category:privacy-and-security;useragent:Mozilla/5.0 (X11; Ubuntu; Linux x86_64; rv:124.0) Gecko/20100101 Firefox/124.0;product:thunderbird,1,0,0,,,
1442967,2024-03-22 04:50:37 -0700,2024-03-22 09:29:21 -0700,en-US,thunderbird,How to merge two inboxes together?,true,1643524,davidsk,false,1643564,1643524;1643530;1643561;1643563;1643564;,other,other;,22134150,"<p>I've got two inboxes: x@domain1.com and y@domain2.com.  </p><p>y@domain2.com receives emails from multiple domains in it's inbox, and I use inbox folders + Message Filters to easily view the inbox for each domain in a folder each. </p><p>x@domain1.com is an older account with just one email address attached to it. I want to delete this inbox after migrating all of it's inbox to y@domain2.com. I thought it'd be possible just by cutting and pasting the MBOX file of x@domain1.com into y@domain2.com's MBOX, but those emails didn't show in the y@domain2.com's inbox.  </p><p>How can I accomplish this? </p>",22134150;davidsk;Toad-Hall;,true,false,false,;category:other;useragent:Mozilla/5.0 (X11; Linux x86_64; rv:124.0) Gecko/20100101 Firefox/124.0;product:thunderbird;solver_id:3835095,5,0,0,,,
1442969,2024-03-22 05:13:15 -0700,2024-03-22 10:33:48 -0700,it,thunderbird,thunderbird cancellati files,false,,,false,1643582,1643548;1643577;1643578;1643581;1643582;,other,other;,leonardomailit,"<p>su thunderbird, mi sono stati cancellati tutti i messaggi archiviati, migliaia. eppure non ho cancellato nulla, ho cliccato per aprire, e dopo pochi istanti non c'era più niente...zero messaggi. Vorrei sapere se si posson recuperare </p>",leonardomailit;@next;,true,false,false,;category:other;useragent:Mozilla/5.0 (Windows NT 6.1; Win64; x64; rv:109.0) Gecko/20100101 Firefox/115.0;product:thunderbird,5,0,0,,,
1442970,2024-03-22 05:24:05 -0700,2024-03-22 19:36:29 -0700,en-US,thunderbird,Thunderbird 115.9.0 - all emails from all folders missing,false,,,false,1643627,1643570;1643580;1643585;1643627;,other,other;,kbgoodtogo313,"<p>After overnight automatic update to Thunderbird 115.9.0, all my emails are missing... inbox &amp; local folders are visible, but all are empty... I'm running Windows 10... with POP server... since the update, I received a couple of new emails in my inbox... I moved one of them to a local folder, where it also disappeared... Help please! </p>",kbgoodtogo313;wsmwk;,true,false,false,;category:other;useragent:Mozilla/5.0 (Windows NT 10.0; Win64; x64; rv:124.0) Gecko/20100101 Firefox/124.0;product:thunderbird,4,0,0,,,
1442973,2024-03-22 06:06:47 -0700,2024-03-23 02:38:19 -0700,en-US,thunderbird,Impossible to respond to an invitation,false,,,false,1643646,1643646;,settings,customize;,remy_leridon,"<p>Hi An association creates an event in ProtonCalendar and designs me as a participant. So I received an invitation, nice. Reading the message I have a button ""Accept"" in which there is a ""Send a response to the author"". When I click on that button, the event is correctly added to my personal calendar and it is said that a response has been sent. But, the response is not in my ""Sent"" directory and the association never receive the response. What am I missing&nbsp;? Is there a way to get that working? </p><p>Thanks in advance </p><p>Best regards Rémy Léridon </p>",remy_leridon;MattAuSupport;,true,false,false,;category:customize;useragent:Mozilla/5.0 (X11; Linux x86_64; rv:109.0) Gecko/20100101 Firefox/115.0;product:thunderbird,1,0,0,,,
1442974,2024-03-22 06:07:11 -0700,2024-03-22 06:07:11 -0700,pt-BR,thunderbird,SPF INCORRETO,false,,,false,,"",troubleshooting,fix-problems;,contato148,"<p>Não estou conseguindo enviar emails, quando eu tento enviar recebo um email do Titan dizendo assim ""Email sending failed due to Incorrect SPF Records"" pedi suporte e eles me responderam, mas não consigo executar o que eles me pedem. Vou anexar o que eles me disseram, uso o ThunderBird, o email da empresa é contato@frommer.com.br. Preciso de um passo a passo de como resolver esse problema. Aguardo retorno, muito obrigada! </p>",contato148;,true,false,false,";category:fix-problems;useragent:Mozilla/5.0 (Windows NT 10.0; Win64; x64) AppleWebKit/537.36 (KHTML, like Gecko) Chrome/109.0.0.0 Safari/537.36;product:thunderbird",0,0,0,,,
1442977,2024-03-22 06:40:50 -0700,2024-03-22 09:56:03 -0700,en-US,thunderbird,Disappearing messages after 115.9.0 Update,false,,,false,1643571,1643571;,other,other;,randalf43,"<p>Windows 10 PC. After update to Thunderbird 115.9.0 new messages disappear from Inbox after closing and reopning app BUT they can still be found in Search results. Also, many old messages have moved from Local Folders back into Account's Inbox. </p>",randalf43;wsmwk;,true,false,false,";category:other;useragent:Mozilla/5.0 (Windows NT 10.0; Win64; x64) AppleWebKit/537.36 (KHTML, like Gecko) Chrome/122.0.0.0 Safari/537.36;product:thunderbird",1,0,0,,,
1442978,2024-03-22 06:45:50 -0700,2024-03-22 21:54:12 -0700,en-US,thunderbird,Suggestions for improvement in Thunderbird Setup 115.9.0,false,,,false,1643631,1643538;1643587;1643631;,troubleshooting,fix-problems;,Halloween_guy,"<p>Just saying.....Consider comments below for future updates </p><pre>Using Thunderbird Setup 115.9.0   </pre> <p>After install and configuration of account. all seems good Except..... </p><p>Assume you were migrating from outlook to Thunderbird.....You use the ""import"" tool  --&gt; from Outlook </p><p>1) Current configuration  of Thunderbird ""ASSUMES""  </p><pre>  outlook pst files are under C:\user\username\documents\Outlook Files...     what if outlook no longer on said machine,    What if user had then else where, --&gt; result it fails to import  No option to select where said PST files are located...     </pre> <p>2) What if there are numerous PST files and you only want to import 1.. Again no option to ""picK"" </p><pre>  User has to Move all non required PST file to import to somewhere else, then start import </pre> <p>3) Say it manages to start importing PST file.   Status of importing is SUPER slow.... </p><pre>   % importing indicator movement almost NADA then after say 30 minutes.... Complete 100%.  What!!!!   Granted , pain full to import, but it should not take that long.... That needs to get fixed  In case you ask--&gt;  WIn 1022H2, 4GHZ 8 core cpu with 32GB ram... under task manager Thunderbird shows under 400MB ram usage @ CPU 3% at best of times. Nothing else being done while import in process... </pre> <p>Example: I'm importing only messages from PST file (approx 250 messages. It's been 10 minutes, % import still stating 0% imported... ) </p>",Halloween_guy;davidsk;wsmwk;,true,false,false,;category:fix-problems;useragent:Mozilla/5.0 (Windows NT 10.0; Win64; x64; rv:123.0) Gecko/20100101 Firefox/123.0;product:thunderbird,3,0,0,,,
1442979,2024-03-22 06:46:37 -0700,2024-03-22 10:11:45 -0700,en-US,thunderbird,Feature Request: Whitelisting domains,false,,,false,1643579,1643537;1643579;,privacy-and-security,privacy-and-security_1;,Firebird_Charlie,<p>I'd really like the ability to whitelist a domain rather than add an email address to the address book. I work with booking websites that create unique email addresses for each booking and they keep ending up in spam. I'd like to be able to whitelist the domain they're coming from instead of trying to train the spam cannon that they are not an issue. </p>,Firebird_Charlie;davidsk;sfhowes;,true,false,false,;category:privacy-and-security;useragent:Mozilla/5.0 (Macintosh; Intel Mac OS X 10.15; rv:124.0) Gecko/20100101 Firefox/124.0;product:thunderbird,2,0,1,,,
1442981,2024-03-22 07:25:50 -0700,2024-03-22 07:40:11 -0700,en-US,thunderbird,Synchronise the most recent (number of days) not working,true,1643542,Toad-Hall,false,1643542,1643542;,troubleshooting,fix-problems;,iv.an,"<p>""Synchronise the most recent"" setting (Settings -&gt; Account settings -&gt; Synchronisation and storage -&gt; Synchronise the most recent) </p><p>I am having trouble with the synchronization setting. I have an email address with a large number of emails coming through the IMAP <a href=""http://server.To"" rel=""nofollow"">server.To</a> avoid overloading the computer, I want to download only the emails from the last month to the computer. I found the 'Synchronize the most recent' setting under Settings -&gt; Account settings -&gt; Synchronization and storage. Thunderbird downloads all email from the server regardless of the number of days specified. Can anyone assist me with this issue? </p>",iv.an;Toad-Hall;,true,false,false,;category:fix-problems;useragent:Mozilla/5.0 (Windows NT 10.0; Win64; x64; rv:123.0) Gecko/20100101 Firefox/123.0;product:thunderbird;solver_id:5851030,1,0,0,,,
1442982,2024-03-22 07:49:35 -0700,2024-03-23 03:59:12 -0700,en-US,thunderbird,Can't reply to a PGP pdf,true,1643668,bxcfilm,false,1643668,1643645;1643668;,other,other;,bxcfilm,"<p>I received a secure email from my bank. The file name is PGPMessage.pdf, which probably tells you all you need to know about it. I can open it with no problem, but when I click the button to ""Reply Securely"" nothing happens. When I hover over the Reply Securely button, I see a long URL, but preceded by the word ""Disabled"".  </p><p>Just to be clear about this - I don't use the PGP/encryption facilities of TB for my own emails, this is just a one-off email I received. And yes, I'm satisfied it's legitimate. </p><p>What can I do about this? Is this being caused by FF itself, or an extension? I have attached a picture of my extensions. </p><p>I would appreciate any suggestions. </p>",bxcfilm;MattAuSupport;,true,false,false,;category:other;useragent:Mozilla/5.0 (Windows NT 10.0; Win64; x64; rv:123.0) Gecko/20100101 Firefox/123.0;product:thunderbird;solver_id:1130311,2,0,0,,,
1442993,2024-03-22 10:27:36 -0700,2024-03-27 11:00:55 -0700,it,thunderbird,L'APP NON FUNZIONA,true,1643700,@next,false,1644469,1643583;1643675;1643700;1643880;1644407;1644437;1644455;1644464;1644469;,troubleshooting,fix-problems;,ambrogio.balducci,"<p>Buonasera, vi allego il popup che appare appena apro Thunderbird, e sinceramente non so come fare per eliminare tale disservizio continuo. Attendo il vostro aiuto. Grazie e cordiali saluti Ambrogio </p>",ambrogio.balducci;@next;,true,false,false,";category:fix-problems;useragent:Mozilla/5.0 (Windows NT 10.0; Win64; x64) AppleWebKit/537.36 (KHTML, like Gecko) Chrome/122.0.0.0 Safari/537.36 Edg/122.0.0.0;product:thunderbird;solver_id:5851363",9,0,3,,,
1442998,2024-03-22 11:19:29 -0700,2024-03-23 02:32:07 -0700,en-US,thunderbird,why can’t I get my email.,false,,,false,1643644,1643644;,installation-and-updates,download-and-install_1;,noraisens,"<p>where do I find, where I can put my password for my email </p>",noraisens;MattAuSupport;,true,false,false,";category:download-and-install;useragent:Mozilla/5.0 (Macintosh; Intel Mac OS X 10_15_7) AppleWebKit/605.1.15 (KHTML, like Gecko) Version/17.4 Safari/605.1.1517.4 Ddg/17.4;product:thunderbird",1,0,0,,,
