id,question_id,created,updated,content,creator,is_spam,num_helpful,num_unhelpful
1678736,1466897,2024-10-02 19:57:49 -0700,2024-10-02 19:57:49 -0700,"<p>See <a href=""https://wiki.mozilla.org/Thunderbird:Exchange"" rel=""nofollow"">https://wiki.mozilla.org/Thunderbird:Exchange</a> </p>",sfhowes,false,0,0
1678735,1466903,2024-10-02 19:54:58 -0700,2024-10-02 19:54:58 -0700,"<p>Settings/General/Reading &amp; Display, Message List, 'Preferred...'. </p>",sfhowes,false,0,0
1678734,1466912,2024-10-02 19:51:45 -0700,2024-10-02 19:51:45 -0700,"<p>Put the 25 contacts in a new address book, then create a filter with the rule From + is in my address book + &lt;select the new address book&gt;.  New contacts can be added to this address book by clicking the icon in the message header, then clicking it again to specify the new address book. </p>",sfhowes,false,0,0
1678756,1466924,2024-10-02 21:16:53 -0700,2024-10-02 21:16:53 -0700,"<p>Open Classic Search (Ctrl+Shift+F) as in the attached picture, then select all the results (Ctrl+A), then Move To and choose the archive folder. </p>",sfhowes,false,0,0
1678752,1466926,2024-10-02 21:08:37 -0700,2024-10-02 21:08:37 -0700,"<p>Do you have multiple accounts with <a href=""http://twc.com"" rel=""nofollow"">twc.com</a>, or accounts with other providers?  Are there smtp servers for each account? </p>",sfhowes,false,0,0
