id,created,updated,locale,product,title,is_solved,solution,solved_by,is_spam,last_answer,answers,topic,tags,creator,content,involved,is_archived,is_locked,is_taken,metadata,num_answers,num_votes_past_week,num_votes,taken_until,taken_by,updated_by
1448840,2024-06-01 17:11:40 -0700,2024-06-02 05:31:03 -0700,en-US,thunderbird,Unified tab,false,,,false,1655455,1655455;,settings,customize;,l.m.mit,<p>If I click on the tab at top of LH corner I get a list starting with Restore and ending with Close. How do I get to Customise? </p>,l.m.mit;davidsk;,true,false,false,;category:customize;useragent:Mozilla/5.0 (Windows NT 10.0; Win64; x64; rv:126.0) Gecko/20100101 Firefox/126.0;product:thunderbird,1,0,0,,,
1448842,2024-06-01 17:55:28 -0700,2024-06-02 05:31:36 -0700,en-US,thunderbird,unified tab,false,,,false,1655456,1655456;,other,other;,l.m.mit,<p>How to start unified tab and get Customise. I only get a list of actions beginning with restore on right clicking. </p>,l.m.mit;davidsk;,true,true,false,;category:other;useragent:Mozilla/5.0 (Windows NT 10.0; Win64; x64; rv:126.0) Gecko/20100101 Firefox/126.0;product:thunderbird,1,0,0,,,
1448843,2024-06-01 17:59:31 -0700,2024-06-02 04:36:24 -0700,en-US,thunderbird,"i mistakingly deleted my primary password. i cant remember it and even though i entered a new one, i cant recieve or send any messages. HELP",false,,,false,1655442,1655442;,other,other;,mwebsurfer,"<p>help me set up tbird properly. I use <a href=""http://Verizon.net"" rel=""nofollow"">Verizon.net</a>. </p>",mwebsurfer;davidsk;,true,false,false,;category:other;useragent:Mozilla/5.0 (Windows NT 10.0; Win64; x64; rv:126.0) Gecko/20100101 Firefox/126.0;product:thunderbird,1,0,0,,,
1448845,2024-06-01 18:22:48 -0700,2024-06-02 05:25:51 -0700,en-US,thunderbird,"Hello!  Suddenly, when I hit ""write"" a new message form pops up but I can't see folders on left.",false,,,false,1655454,1655454;,other,other;,Santacruz77,"<p>Suddenly when I hit ""write"" a new message form pops up but I can't see any of the folders on the left, or address book.  How to see again?  Thanks! </p><p>Matt </p>",Santacruz77;davidsk;,true,false,false,;category:other;useragent:Mozilla/5.0 (Windows NT 10.0; Win64; x64; rv:126.0) Gecko/20100101 Firefox/126.0;product:thunderbird,1,0,0,,,
1448847,2024-06-01 19:01:54 -0700,2024-06-01 19:01:54 -0700,en-US,thunderbird,Full screen app interruption.,false,,,false,,"",other,other;,callakskt,"<p>Is there any way to prevent Thunderbird notices from interrupting full screen programs?  Every time one pops up, it minimizes my program. </p>",callakskt;,true,false,false,";category:other;useragent:Mozilla/5.0 (Windows NT 10.0; Win64; x64) AppleWebKit/537.36 (KHTML, like Gecko) Chrome/123.0.0.0 Safari/537.36 OPR/109.0.0.0 (Edition std-1);product:thunderbird",0,0,0,,,
1448848,2024-06-01 19:23:43 -0700,2024-06-03 03:49:14 -0700,en-US,thunderbird,Difficulties changing email server name,true,1655485,davidsk,false,1655585,1655451;1655480;1655485;1655517;1655585;,other,other;,david827,"<p>I recently changed webhosts, which requires me to change the incoming and outgoing server names. When I change the name and reboot, the server name always reverts to the previous server name. How do I correct this? </p>",david827;davidsk;,true,false,false,";category:other;useragent:Mozilla/5.0 (Windows NT 10.0; Win64; x64) AppleWebKit/537.36 (KHTML, like Gecko) Chrome/125.0.0.0 Safari/537.36;product:thunderbird;solver_id:5975004",5,0,0,,,
1448849,2024-06-01 20:06:01 -0700,2024-06-02 04:43:35 -0700,en-US,thunderbird,Address Book Importing,false,,,false,1655444,1655444;,installation-and-updates,download-and-install_1;,tjmarciniak,"<p>Hi, I'm a MTB newbie Version 115.11.1 and am just trying to import my <a href=""http://comcast.net"" rel=""nofollow"">comcast.net</a> address book from CSV. MTB seems to be totally confused about the columns. I'd be happy to adjust the column assignments, as I think I'm supposed to, but it won't let me. The automatically selected column name is the only option allowed in the drop-down. See attached. </p><p>Is this by design? Do I need to reorder the columns within the exported file. Seems a bit much really, but ultimately doable, I guess.  </p><p>Any other options? Or what am I doing wrong </p><p>TIA Tim </p>",tjmarciniak;davidsk;,true,false,false,";category:download-and-install;useragent:Mozilla/5.0 (Windows NT 10.0; Win64; x64) AppleWebKit/537.36 (KHTML, like Gecko) Chrome/125.0.0.0 Safari/537.36 Edg/125.0.0.0;product:thunderbird",1,0,0,,,
1448850,2024-06-01 21:16:38 -0700,2024-06-01 21:16:38 -0700,en-US,thunderbird,Thunderbird shows Hijri (Saudi Arabia Regional Date Format) no matter what Preference I choose in settings,false,,,false,,"",settings,customize;,fahadysf,<p>Thunderbird shows Hijri (Saudi Arabia Regional Date Format) no matter what Preference I choose in settings. </p><p>I've chosen the English (United States) Application Locale and restarted Thunderbird multiple times but in the header the date still shows in Hijri Format (1445-xx-xx). See attached images. </p><p>Am I missing something here? Couldn't find any clues in the config editor either. The version I have installed is the correct one (English US). </p>,fahadysf;,true,false,false,";category:customize;useragent:Mozilla/5.0 (Macintosh; Intel Mac OS X 10_15_7) AppleWebKit/537.36 (KHTML, like Gecko) Chrome/125.0.0.0 Safari/537.36 Edg/125.0.0.0;product:thunderbird",0,0,0,,,
1448851,2024-06-01 21:46:04 -0700,2024-06-02 14:46:53 -0700,en-US,thunderbird,5T disk space - startupCache corrupt,false,,,false,1655527,1655463;1655527;,troubleshooting,fix-problems;,steven.e.hansen,"<p>I'm on Thunderbird 115.11.1 on Windows 11. I got an error that there wasn't space to download emails today.  My Thunderbird profile shows this: </p><pre>            121 File(s)    100,867,461 bytes              24 Dir(s)  455,503,380,480 bytes free </pre> <p>In the startupCache folder File Explorer says that there are 2500 directories, 660 files, and 4.94 TB of content. The last few lines of a dir command show this. Note the weird dates on the directories and garbage names.  </p><p>06/02/2024  12:15 AM           164,221 startupCache.8.little 08/16/2057  01:32 AM    &lt;DIR&gt;          }+ 3an^.1q 08/08/1997  03:53 AM    &lt;DIR&gt;          √µÇ┌╪,Pù. 05/04/1990  02:21 PM       467,310,242 4φ)τ~o╗D.cÖê 04/24/2063  05:53 AM    &lt;DIR&gt;          ╤fεª╫s₧&amp;.╘rα 02/08/2083  12:31 AM     2,596,407,552 «-╞┐I┤U.`xs 10/22/2020  06:59 PM    &lt;DIR&gt;          *¼²Ñ▐'╣.░╦ 03/06/2078  11:59 AM     3,915,121,951 n│ê/ë∞3Γ.f└ï The parameter is incorrect. </p><pre>     &lt;DIR&gt;          πºaîí├ </pre> <p>▌.»δ The parameter is incorrect. </p><pre>        333,948,754 Åô␦╖w6ùƒ.x▐ </pre> <p>The parameter is incorrect. j]j.╥QwDIR&gt;          Φπ═ The parameter is incorrect. </p><pre>     &lt;DIR&gt;          ╒0q≡ó,.@{¥             660 File(s) 2,708,943,115,907 bytes             664 Dir(s)  455,496,040,448 bytes free </pre> <p>What is the best way to clean this up? </p>",steven.e.hansen;davidsk;wsmwk;,true,false,false,;category:fix-problems;useragent:Mozilla/5.0 (Windows NT 10.0; Win64; x64; rv:126.0) Gecko/20100101 Firefox/126.0;product:thunderbird,2,0,0,,,wsmwk
1448855,2024-06-02 00:31:12 -0700,2024-06-02 05:09:18 -0700,en-US,thunderbird,thunderbird Backup with Zip.file,false,,,false,1655452,1655452;,installation-and-updates,download-and-install_1;,mbea1,"<p>Hi  I did a backup with Zip.file, and then tried to reinstall. Now somme accounts do not have sent/spam/trash Bin folders. When i try to send a mail, i am told that there is not enouch space on the disk to save the message, and that the message will be save in a local folder&nbsp;? How can I get back to my ""old"" and working setup Kind regards Michael </p>",mbea1;davidsk;,true,false,false,;category:download-and-install;useragent:Mozilla/5.0 (Macintosh; Intel Mac OS X 10.15; rv:126.0) Gecko/20100101 Firefox/126.0;product:thunderbird,1,0,0,,,
1448856,2024-06-02 02:18:03 -0700,2024-06-02 04:54:56 -0700,en-US,thunderbird,configure Outlook anywhere in thunderbird,false,,,false,1655447,1655447;,privacy-and-security,privacy-and-security_1;,doumindikissyou,"<p>Dear Team, Please guide me to configure Outlook anywhere in thunderbird. </p><p>Regards, </p>",doumindikissyou;davidsk;,true,false,false,";category:privacy-and-security;useragent:Mozilla/5.0 (Windows NT 10.0; Win64; x64) AppleWebKit/537.36 (KHTML, like Gecko) Chrome/125.0.0.0 Safari/537.36;product:thunderbird",1,0,0,,,
1448858,2024-06-02 03:23:14 -0700,2024-06-02 04:37:56 -0700,en-US,thunderbird,Moving email management from 20i to you.,false,,,false,1655443,1655439;1655443;,installation-and-updates,download-and-install_1;,Andrew177,"<p>Tell me how to move, first, andrew@8on8.com, then andrew@luvli<a href=""http://-homes.com"" rel=""nofollow"">-homes.com</a> to you. The latter is with 20i. I do not know where andrew@8on8 is. Please tell me what to do to move these DNs to you. </p>",Andrew177;davidsk;,true,false,false,;category:download-and-install;useragent:Mozilla/5.0 (Windows NT 10.0; Win64; x64; rv:126.0) Gecko/20100101 Firefox/126.0;product:thunderbird,2,0,0,,,
1448863,2024-06-02 05:25:22 -0700,2024-06-09 02:45:50 -0700,en-US,thunderbird,Cardbook,false,,,false,1656472,1655490;1655492;1655495;1655496;1655497;1655499;1655501;1656061;1656063;1656096;1656099;1656134;1656181;1656272;1656472;,other,other;,stevecrowther,<p>How do I configure Thunderbird to sync contacts using CardBook? </p>,stevecrowther;Googlethunderbird.;MattAuSupport;,true,false,false,";category:other;useragent:Mozilla/5.0 (Macintosh; Intel Mac OS X 10_15_7) AppleWebKit/605.1.15 (KHTML, like Gecko) Version/17.5 Safari/605.1.15;product:thunderbird",15,0,0,,,
1448872,2024-06-02 07:39:30 -0700,2024-06-02 12:28:43 -0700,en-US,thunderbird,Thunderbird will not switch profiles,false,,,false,1655489,1655489;,troubleshooting,fix-problems;,par6,"<p>When I try to switch profiles, I get the following error: An unexpected error has prevented your changes from being saved. I have been messing around with this on and off for a couple of months. I uninstalled Thunderbird and re-installed with no luck. This error is not allowing me to switch to a profile that I have had for over 20 years and I have lost all my Local Folders, quite disturbing. I found a similar thread here, but no solution. Thanks, Paul </p>",par6;davidsk;,true,false,false,";category:fix-problems;useragent:Mozilla/5.0 (Windows NT 10.0; Win64; x64) AppleWebKit/537.36 (KHTML, like Gecko) Chrome/125.0.0.0 Safari/537.36;product:thunderbird",1,0,0,,,
1448876,2024-06-02 08:55:13 -0700,2024-06-09 23:42:18 -0700,en-US,thunderbird,"want old email box back, new inbox sucks.",false,,,false,1656634,1655488;1656629;1656634;,other,other;,b9btpzrmsn,"<p>The new inbox format is similar to Apple inbox. I used Thunderbird because, in my opinion,  the inbox layout was much better than Apple mail inbox which is one of the primary reason I use Thunder bird. Is there a way to go back to the previous inbox version? </p>",b9btpzrmsn;davidsk;MattAuSupport;,true,false,false,";category:other;useragent:Mozilla/5.0 (Macintosh; Intel Mac OS X 10_15_7) AppleWebKit/537.36 (KHTML, like Gecko) Chrome/125.0.0.0 Safari/537.36;product:thunderbird",3,0,0,,,
1448877,2024-06-02 09:06:47 -0700,2024-06-02 09:06:47 -0700,en-US,thunderbird,Ubuntu 22.04.4 LTS interaction with Thunderbird,false,,,false,,"",other,other;,Tony_O,"<p>Since moving from Ubuntu 20.04.6 LTS (Focal Fossa) to 22.04.04 LTS (Jammy Jellyfish) 2 days ago the appearance of my Email (from the Inbox) has changed. Not in a nice way. On the web I found ways to re-install Thunderbird (using the Thunderbird ""Help"" option) but that does not work anymore. Thanks, Teun. </p>",Tony_O;,true,false,false,;category:other;useragent:Mozilla/5.0 (X11; Ubuntu; Linux x86_64; rv:126.0) Gecko/20100101 Firefox/126.0;product:thunderbird,0,0,0,,,
1448880,2024-06-02 10:07:30 -0700,2024-06-02 10:07:30 -0700,en-US,thunderbird,some emails are not readable,false,,,false,,"",other,other;,andrest_71,"<p>Hello There, I'm using thunderbird with two email accounts, <a href=""http://Hotmail.com"" rel=""nofollow"">Hotmail.com</a> and <a href=""http://Outlook.it"" rel=""nofollow"">Outlook.it</a> but since some time now, some e-mails are no longer readable.... If I open the same e-mails on the Outlook website I can see it correctly... </p><p>Attached some examples </p><p>Thanks in advance  </p><p>Andrea </p>",andrest_71;,true,false,false,;category:other;useragent:Mozilla/5.0 (Windows NT 10.0; Win64; x64; rv:126.0) Gecko/20100101 Firefox/126.0;product:thunderbird,0,0,0,,,
1448885,2024-06-02 11:17:29 -0700,2024-06-02 11:52:38 -0700,en-US,thunderbird,storage location in local file system,false,,,false,1655486,1655486;,other,other;,grfullen,<p>Where are email files and associated attachments stored.  My OS is Ubuntu 20.04 &amp; 22.04. </p>,grfullen;davidsk;,true,false,false,;category:other;useragent:Mozilla/5.0 (X11; Ubuntu; Linux x86_64; rv:126.0) Gecko/20100101 Firefox/126.0;product:thunderbird,1,0,0,,,
1448889,2024-06-02 12:26:34 -0700,2024-06-02 12:26:34 -0700,en-US,thunderbird,Empty messages in the inbox,false,,,false,,"",troubleshooting,fix-problems;,biuro346,"<p>Hello, After updating Thunderbird to version 115.11.1, messages are empty and contain no content. Messages that arrive after the update have content.  How can I solve this problem because all messages in the folder received from before the update are empty. </p>",biuro346;,true,false,false,;category:fix-problems;useragent:Mozilla/5.0 (Windows NT 10.0; Win64; x64; rv:126.0) Gecko/20100101 Firefox/126.0;product:thunderbird,0,0,1,,,
1448891,2024-06-02 13:31:09 -0700,2024-09-03 09:50:10 -0700,en-US,thunderbird,I am not receiving some emails,false,,,false,1672564,1655616;1655670;1655767;1672419;1672431;1672564;,other,other;,rmeyer174,<p>I have been receiving emails and newsletters from a number of companies for many years. Suddenly last December many stopped coming. I have been in touch with one in particular and I am still on their mailing list. I am unable to find anywhere I can check. And before anyone says check your Junk folder. I do that every day. It has gotten to the point where I will have to stop using Thunderbird. Where can I look to find out what is wrong. </p>,rmeyer174;Toad-Hall;twilightgold;,true,false,false,";category:other;useragent:Mozilla/5.0 (Windows NT 10.0; Win64; x64) AppleWebKit/537.36 (KHTML, like Gecko) Chrome/125.0.0.0 Safari/537.36;product:thunderbird",6,0,1,,,
1448893,2024-06-02 14:14:01 -0700,2024-06-02 14:14:01 -0700,en-US,thunderbird,Thunderbird latest email first displayed,false,,,false,,"",settings,customize;,macbellett,<p>I have to always scroll back to find the latest email to arrive. Can that be the default setting as is the case with Mac Mail Thank you </p>,macbellett;,true,false,false,";category:customize;useragent:Mozilla/5.0 (Windows NT 10.0; Win64; x64) AppleWebKit/537.36 (KHTML, like Gecko) Chrome/125.0.0.0 Safari/537.36 Edg/125.0.0.0;product:thunderbird",0,0,0,,,
1448894,2024-06-02 14:33:35 -0700,2024-06-02 14:33:35 -0700,en-US,thunderbird,"Moved many MB of emails from Outlook to Thunderbird, now Tbird login to Outlook fails",false,,,false,,"",other,other;,whldorsey,"<p><strong>1</strong> Yesterday I moved many MB of emails from Outlook to Thunderbird, now Tbird login to Outlook fails; password that works in browsers seems not to be accepted. </p><p>I suspect the drastically shrunk-in-size folders need compacting (which I was going to do today) but can not get to Tbird establishing a relationship to Hotmail (now owned by Outlook). I kept expecting Tbird to tell me it was compacting the whole Outlook Inbox, but it never did.  </p><p>I tried clearing the cache as suggested. Ran troubleshooting but it merely displayed settings but no explanation. </p><p>Hotmail was my first email account (1995 or so), but Microsoft having bought it and it therefore now being subject to whatever inconsistencies they have introduced in the past year or so, I did what I did last night was the first step to moving emails off of their Outlook server onto my hard drive in advance of closing that account. Thunderbird seemed like the mos efficient way to keep emails while emptying their folders in Outlook. </p><p><strong>2</strong> If/When I get it back, I would appreciate advice on how to avoid this happening again. </p><p>Thank you. </p>",whldorsey;,true,false,false,";category:other;useragent:Mozilla/5.0 (Macintosh; Intel Mac OS X 10_14_6) AppleWebKit/605.1.15 (KHTML, like Gecko) Version/14.1.2 Safari/605.1.15;product:thunderbird",0,0,0,,,
1448896,2024-06-02 15:09:47 -0700,2024-09-12 08:28:42 -0700,en-US,thunderbird,Suddenly unable to connect to outgoing mail server (Outlook),false,,,false,1656980,1655642;1655657;1655663;1655666;1655672;1655682;1655775;1655784;1655987;1656287;1656312;1656345;1656364;1656624;1656726;1656939;1656980;,troubleshooting,fix-problems;,dk_salerno,"<p>I've just started getting error messages that I need to enter my password to send emails. I've tried that but it still keeps saying unable to connect to the server. This has been happening for about two days now. I've tried updating Thunderbird, restarting Thunderbird and restarting my PC. None of this has worked. I made no changes to my system, software or home network. Any help would be appreciated. Thanks, Dave </p>",dk_salerno;davidsk;Toad-Hall;MattAuSupport;,true,false,false,;category:fix-problems;useragent:Mozilla/5.0 (Windows NT 10.0; Win64; x64; rv:126.0) Gecko/20100101 Firefox/126.0;product:thunderbird,17,0,2,,,wsmwk
1448897,2024-06-02 15:42:51 -0700,2024-06-02 15:42:51 -0700,en-US,thunderbird,"""move"" filter copies but does not remove from inbox",false,,,false,,"",other,other;,wmmmoz,"<p>i am using TB 115.10.1 (64-bit) on Ubuntu 22.04.4 LTS expected behavior: </p><pre> the msg should be moved to the junk folder on Local Folders, marked as junk and NOT placed  in the Inbox </pre> <p>actual behavior: </p><pre> the msg is usually  (but not always) copied to the folder ""junk"" on ""Local Folders"" and a copy is left in the Inbox </pre> <p>i have many other filters like this, most always work, some occasionally do not.  this particular filter has approx 30 such rules each with different matching content, some with domain names, some with portions of IP address.  furthermore, other filter rules of similar nature mostly work but occasionally do not. </p><p>i am using a customized header, ""Received:"" </p><p>the filter (named ""received by #10""&nbsp;: </p><pre> apply filter when: Filter Before Junk Classification </pre> <pre> match any of the following  Received contains      [128.245.         # should match all 128.245.x.x hosts </pre> <pre> perform these actions:    Move Message to   junk on Local Folders    Set Junk Status to   junk    Stop Filter Execution </pre> <p>one of the ""Received:"" headers contains: </p><pre> Received: from <a href=""http://mta.s.alivebusinessplan.com"" rel=""nofollow"">mta.s.alivebusinessplan.com</a> ([128.245.246.45]) by <a href=""http://mx.mail.com"" rel=""nofollow"">mx.mail.com</a>... </pre> <p>filter log content: </p><pre> <strong>[6/2/24, 17:04:06 GMT-4] Applied filter ""received by #10"" to message from </strong>  ""Mark White (ABP)"" &lt;send@s.alivebusinessplan.com&gt; - 66,000% upside on tiny   biotech at 6/2/24, 17:04:04 GMT-4 junk score </pre> <pre> [6/2/24, 17:04:06 GMT-4] Applied filter ""received by #10"" to message from  ""Mark White (ABP)"" &lt;send@s.alivebusinessplan.com&gt; - 66,000% upside on tiny  biotech at 6/2/24, 17:04:04 GMT-4 moved message id  = 4910df06-d805-41a4-96af-5e814f6cfc97@iad4s13mta861.xt.local to  mailbox://nobody@Local%20Folders/Junk </pre> <pre> [6/2/24, 17:04:06 GMT-4] Applied filter ""received by #10"" to message from </pre> <p>""  Mark White (ABP)"" &lt;send@s.alivebusinessplan.com&gt; - 66,000% upside on tiny </p><pre> biotech at 6/2/24, 17:04:04 GMT-4 execution stopped </pre> <p>questions: 1. why this behavior?  what'd i do wrong? 2. is there a limit on the number of filters? 3. is there a limit on the number of rules per filter? </p>",wmmmoz;,true,false,false,";category:other;useragent:Mozilla/5.0 (X11; Linux x86_64) AppleWebKit/537.36 (KHTML, like Gecko) Chrome/124.0.0.0 Safari/537.36;product:thunderbird",0,0,0,,,
1448901,2024-06-02 16:22:34 -0700,2024-06-02 16:22:34 -0700,en-US,thunderbird,Filters not working,false,,,false,,"",troubleshooting,fix-problems;,annmeng,"<p>I have had the same filters and folders for years. Now pretty much everything is not filtered when messages arrive, and when I do a manual ""Run Filters on Folder"" I get this message about many, maybe all, of my filters ""The folder 'Newsletters' could not be found, so filter(s) associated with this folder will be disabled. Verify that the folder exists, and that filters point to a valid destination folder."" </p><p>""Applying filter From is: dailybusinessreview@alm.com failed. Would you like to continue applying filters?"" </p><p>When I try redoing the filter, filter dialog says it can't find the folder. I tried repairing the folder, no good.  </p><p>Junk filters after years of learning, aren't working either. </p><p>Now what? TIA. </p>",annmeng;,true,false,false,;category:fix-problems;useragent:Mozilla/5.0 (Windows NT 10.0; Win64; x64; rv:126.0) Gecko/20100101 Firefox/126.0;product:thunderbird,0,0,0,,,
1448902,2024-06-02 16:39:11 -0700,2024-06-05 12:33:54 -0700,en-US,thunderbird,Deleting/Moving Problem,false,,,false,1655971,1655971;,other,other;,simberg.rand,"<p>I can't do batch delete or move from the Inbox. It will only do one file at a time, despite the fact that several are highlighted. </p><p>It is also repeatedly trying to download a few thousand files to the Inbox. It gets to the number of files, then hangs, then starts to do it again (except each time it's fewer files to download). I don't know if the two problems are related. </p>",simberg.rand;,true,false,false,";category:other;useragent:Mozilla/5.0 (X11; Linux x86_64) AppleWebKit/537.36 (KHTML, like Gecko) Chrome/125.0.0.0 Safari/537.36;product:thunderbird",1,0,1,,,
1448903,2024-06-02 16:50:16 -0700,2024-06-04 11:54:12 -0700,en-US,thunderbird,Refresh Local Folders After Turning on Remote Drive?,false,,,false,1655818,1655818;,other,other;,RIMSHOT3,"<p>Hi, All. I store older emails in subfolders by year within Local Folders, and I've specified that Thunderbird store Local Folders on a toggleable remote drive. The idea is that I will just toggle that remote drive on when I need to access Local Folders messages. </p><p>Thankfully, when I start Thunderbird with the remote drive off, Local Folders appears without any references to inbox or sent folders (since it can't find the drive), and also thankfully it doesn't throw any ""Can't find drive x"" error messages. When Thunderbird is open, and I turn the drive on, however, it does not display the remote Local Folders content. </p><p>Other than completely closing and reopening Thunderbird, is there a way to have it more easily load the Local Folders content when the drive is turned on - either automatically or manually? </p><p>Thank you </p>",RIMSHOT3;davidsk;,true,false,false,";category:other;useragent:Mozilla/5.0 (Windows NT 10.0; Win64; x64) AppleWebKit/537.36 (KHTML, like Gecko) Chrome/125.0.0.0 Safari/537.36;product:thunderbird",1,0,0,,,
